arrival_time,start_time,finish_time,wait_time,queue_length
30-03-2023 5.34,25-04-2024 12.49,2024-04-25 12:59:41,13.25,40.0
2023/12/19 04:10:31,25-08-2023 14.12,2023-08-25 14:22:12,27.59,51.0
17-07-2023 14.55,17-07-2023 15.29,2023-07-17 15:38:03,33.91,32.0
11-07-2023 13.36,11-07-2023 13.59,2023-07-11 14:08:47,23.22,17.0
05-06-2024 10.33,05-06-2024 10.59,2024-06-05 11:08:29,26.68,37.0
09-08-2024 11.28,09-08-2024 11.49,2024-08-09 11:56:54,21.64,32.0
01-05-2023 10.16,01-05-2023 10.25,2023-05-01 10:33:34,9.44,32.0
14-09-2023 09.49,14-09-2023 10.08,2023-09-14 10:14:40,19.96,18.0
07-10-2024 15.25,07-10-2024 15.44,2024-10-07 15:45:00,18.67,38.0
24-11-2023 14.13,24-11-2023 14.29,2023-11-24 14:35:50,16.99,45.0
18-07-2023 14.47,18-07-2023 15.10,2023-07-18 15:22:46,23.7,23.0
06-01-2024 13.00,06-01-2024 13.01,2024-01-06 13:02:00,1.0,40.0
20-06-2023 10.03,20-06-2023 10.21,2023-06-20 10:31:03,18.44,32.0
08-11-2023 09.42,08-11-2023 09.56,2023-11-08 10:10:55,14.91,16.0
28-11-2023 15.07,28-11-2023 15.29,2023-11-28 15:39:39,22.04,33.0
31-10-2023 14.08,31-10-2023 14.15,2023-10-31 14:24:05,7.62,17.0
09-08-2024 12.17,09-08-2024 12.45,2024-08-09 12:57:40,28.63,23.0
2023/08/28 11:59:00,28-08-2023 12.10,2023-08-28 12:20:20,11.58,29.0
2023/11/06 10:57:00,06-11-2023 11.18,2023-11-06 11:27:23,21.98,40.0
21-10-2023 09.25,21-10-2023 09.46,2023-10-21 09:55:52,21.37,26.0
09-12-2023 13.00,09-12-2023 13.01,2023-12-09 13:02:00,1.0,17.0
12-11-2024 10.10,12-11-2024 10.40,2024-11-12 10:53:02,29.3,40.0
06-06-2024 12.20,06-06-2024 12.24,2024-06-06 12:31:05,4.79,40.0
2024/09/16 15:45:00,16-09-2024 15.46,2024-09-16 15:47:00,1.0,43.0
05-08-2023 13.00,05-08-2023 13.01,2023-08-05 13:02:00,1.0,75.0
18-08-2023 15.45,18-08-2023 15.46,2023-08-18 15:47:00,1.0,25.0
15-07-2024 10.09,15-07-2024 10.18,2024-07-15 10:26:02,9.93,24.0
2023/02/14 12:31:00,14-02-2023 12.37,2023-02-14 12:46:59,6.77,40.0
10-05-2023 09.16,10-05-2023 09.33,2023-05-10 09:45:03,17.25,26.0
24-01-2023 10.24,24-01-2023 10.55,2023-01-24 11:11:38,31.02,36.0
27-03-2024 13.01,27-03-2024 13.22,2024-03-27 13:33:22,21.27,19.0
27-06-2023 10.47,27-06-2023 11.19,2023-06-27 11:33:28,32.39,32.0
23-06-2023 12.50,23-06-2023 13.07,2023-06-23 13:14:43,17.26,43.0
16-03-2024 9.27,16-03-2024 09.44,2024-03-16 09:56:21,16.53,37.0
05-11-2024 12.20,05-11-2024 12.29,2024-11-05 12:32:54,9.62,19.0
2023/03/23 15:27:00,23-03-2023 15.43,2023-03-23 15:45:00,16.81,28.0
2024/01/04 12:06:00,04-01-2024 12.30,2024-01-04 12:41:09,24.12,30.0
29-02-2024 12.36,29-02-2024 13.05,2024-02-29 13:15:21,29.24,0.0
01-11-2024 10.39,01-11-2024 10.56,2024-11-01 11:01:47,17.5,27.0
16-09-2023 12.26,16-09-2023 12.55,2023-09-16 13:00:00,29.55,39.0
02-03-2023 10.07,02-03-2023 10.26,2023-03-02 10:36:36,19.59,19.0
26-08-2024 13.55,26-08-2024 14.32,2024-08-26 14:41:46,37.16,75.0
2023/02/01 14:06:00,01-02-2023 14.16,2023-02-01 14:28:54,10.11,25.0
2023/02/04 13:00:00,04-02-2023 13.01,2023-02-04 13:02:00,1.0,17.0
12-10-2024 12.31,12-10-2024 12.55,2024-10-12 13:00:00,24.38,33.0
09-05-2024 14.22,09-05-2024 14.40,2024-05-09 14:52:54,18.25,41.0
27-07-2023 10.40,27-07-2023 10.41,2023-07-27 10:43:24,1.0,32.0
07-01-2023 13.00,07-01-2023 13.01,2023-01-07 13:02:00,1.0,17.0
24-10-2023 12.41,24-10-2023 13.01,2023-10-24 13:18:01,20.2,202.0
06-05-2023 10.36,06-05-2023 10.55,2023-05-06 11:02:33,19.72,9.0
01-05-2024 14.09,01-05-2024 14.25,2024-05-01 14:41:12,16.14,25.0
18-06-2024 09.09,18-06-2024 09.37,2024-06-18 09:41:24,28.38,
24-06-2023 10.47,24-06-2023 11.03,2023-06-24 11:15:01,16.68,24.0
15-07-2024 10.44,15-07-2024 11.02,2024-07-15 11:11:04,18.6,27.0
08-11-2023 09.24,08-11-2023 09.47,2023-11-08 10:05:41,23.95,38.0
2023/05/26 09:57:00,26-05-2023 10.21,2023-05-26 10:40:44,23.96,10.0
2023/03/01 10:46:00,01-03-2023 11.10,2023-03-01 11:22:40,24.09,35.0
13-09-2023 10.05,13-09-2023 10.31,2023-09-13 10:48:20,26.56,24.0
2023/08/09 09:40:00,09-08-2023 10.07,2023-08-09 10:19:45,27.92,
2024/06/14 11:33:00,14-06-2024 12.04,2024-06-14 12:14:38,31.68,55.0
26-08-2023 11.31,26-08-2023 11.57,2023-08-26 12:11:33,26.04,32.0
30-04-2024 10.28,30-04-2024 11.04,2024-04-30 11:15:48,36.19,33.0
07-11-2023 09.54,07-11-2023 10.14,2023-11-07 10:31:35,20.15,39.0
18-10-2023 14.12,18-10-2023 14.21,2023-10-18 14:35:35,9.14,0.0
30-10-2024 10.44,30-10-2024 11.10,2024-10-30 11:26:41,26.48,
14-06-2024 09.49,14-06-2024 10.05,2024-06-14 10:14:35,16.77,26.0
27-12-2023 11.36,27-12-2023 11.45,2023-12-27 12:03:58,9.72,19.0
21-02-2023 09.48,21-02-2023 10.05,2023-02-21 10:17:37,17.06,23.0
27-06-2024 13.26,27-06-2024 13.50,2024-06-27 13:53:57,24.89,33.0
2024/05/20 13:47:00,20-05-2024 14.09,2024-05-20 14:21:54,22.56,7.0
01-11-2023 11.40,01-11-2023 12.02,2023-11-01 12:17:09,22.67,23.0
16-01-2024 14.41,16-01-2024 15.10,2024-01-16 15:24:19,29.23,31.0
02-08-2024 09.34,02-08-2024 09.40,2024-08-02 09:48:05,6.92,169.0
20-04-2024 10.21,20-04-2024 10.31,2024-04-20 10:41:57,10.91,32.0
31-10-2024 13.43,31-10-2024 14.12,2024-10-31 14:14:57,29.72,47.0
07-02-2024 14.39,07-02-2024 15.00,2024-02-07 15:14:38,21.9,43.0
12-06-2024 13.43,12-06-2024 14.12,2024-06-12 14:19:37,29.9,38.0
11-09-2024 12.59,11-09-2024 13.17,2024-09-11 13:27:22,,34.0
2023/02/21 13:23:00,21-02-2023 13.39,2023-02-21 13:45:59,16.88,162.0
15-02-2023 14.42,15-02-2023 15.01,2023-02-15 15:09:40,19.8,28.0
14-12-2023 14.57,14-12-2023 15.17,2023-12-14 15:26:18,20.8,27.0
25-09-2024 10.04,25-09-2024 10.27,2024-09-25 10:36:28,23.76,34.0
09-09-2024 12.11,09-09-2024 12.27,2024-09-09 12:38:59,16.96,24.0
09-01-2024 15.28,09-01-2024 15.44,2024-01-09 15:45:00,,43.0
07-11-2023 10.35,07-11-2023 10.57,2023-11-07 11:05:04,22.6,34.0
15-09-2023 09.47,15-09-2023 10.07,2023-09-15 10:17:31,20.5,34.0
15-01-2024 13.45,15-01-2024 14.03,2024-01-15 14:13:56,18.51,7.0
,25-11-2023 10.39,2023-11-25 10:52:17,12.94,32.0
2024/05/21 12:01:00,21-05-2024 12.19,2024-05-21 12:24:18,18.82,23.0
28-03-2024 10.30,28-03-2024 10.59,2024-03-28 11:05:42,29.62,45.0
16-11-2024 13.00,16-11-2024 13.01,2024-11-16 13:02:00,1.0,7.0
2023/01/18 10:24:00,18-01-2023 10.44,2023-01-18 10:53:52,20.57,34.0
01-05-2024 09.59,01-05-2024 10.14,2024-05-01 10:31:28,14.42,0.0
2023/04/01 10:27:00,01-04-2023 10.33,2023-04-01 10:35:14,6.95,11.0
23-04-2024 09.19,23-04-2024 09.53,2024-04-23 10:00:53,34.19,
2023/01/27 10:31:00,27-01-2023 10.39,2023-01-27 10:52:17,8.23,32.0
22-10-2024 10.48,22-10-2024 11.13,2024-10-22 11:25:52,25.97,32.0
16-10-2023 12.10,16-10-2023 12.40,2023-10-16 12:51:26,30.11,32.0
07-03-2023 14.07,07-03-2023 14.27,2023-03-07 14:36:07,20.52,32.0
25-06-2024 10.58,25-06-2024 11.20,2024-06-25 11:23:19,21.86,29.0
23-11-2023 14.30,23-11-2023 15.44,2023-11-23 15:45:00,74.0,48.0
2023/12/19 12:43:00,19-12-2023 12.57,2023-12-19 13:12:24,14.95,40.0
14-10-2024 10.12,14-10-2024 10.31,2024-10-14 10:44:29,19.5,23.0
14-03-2023 09.53,14-03-2023 10.30,2023-03-14 10:45:16,37.56,34.0
25-09-2023 15.29,25-09-2023 15.43,2023-09-25 15:45:00,14.96,24.0
20-11-2024 09.23,20-11-2024 09.58,2024-11-20 10:03:29,35.41,53.0
28-05-2024 09.49,28-05-2024 09.53,2024-05-28 10:05:56,4.15,10.0
2023/09/23 11:29:00,23-09-2023 11.48,2023-09-23 11:51:45,19.3,19.0
29-03-2024 09.43,29-03-2024 09.44,2024-03-29 09:48:42,1.0,10.0
17-04-2024 09.15,17-04-2024 09.35,2024-04-17 09:49:04,19.5,40.0
17-03-2023 12.11,17-03-2023 12.33,2023-03-17 12:44:19,22.26,33.0
16-02-2024 09.55,16-02-2024 10.13,2024-02-16 10:22:02,18.62,32.0
22-08-2023 10.48,22-08-2023 11.10,2023-08-22 11:17:49,22.48,22.0
20-05-2024 10.11,20-05-2024 10.32,2024-05-20 10:45:18,21.51,29.0
10-10-2023 12.56,10-10-2023 13.15,2023-10-10 13:20:33,19.14,20.0
2024/07/16 14:24:00,16-07-2024 14.44,2024-07-16 14:46:15,20.52,26.0
04-05-2024 09.57,04-05-2024 10.07,2024-05-04 10:21:15,10.35,17.0
08-09-2023 10.47,08-09-2023 11.18,2023-09-08 11:24:45,31.45,205.0
14-03-2024 14.21,14-03-2024 14.25,2024-03-14 14:32:53,4.93,17.0
2023/12/20 10:33:00,20-12-2023 10.55,2023-12-20 11:00:08,22.25,29.0
12-10-2024 13.00,12-10-2024 13.01,2024-10-12 13:02:00,1.0,32.0
2024/07/04 10:38:00,04-07-2024 11.00,2024-07-04 11:10:10,22.39,29.0
28-07-2023 15.26,28-07-2023 15.44,2023-07-28 15:45:00,18.0,57.0
2023/01/12 09:29:00,12-01-2023 09.44,2023-01-12 09:57:07,15.37,40.0
07-04-2023 12.43,07-04-2023 12.52,2023-04-07 13:00:38,9.32,40.0
29-05-2023 12.47,29-05-2023 13.20,2023-05-29 13:29:57,33.78,39.0
02-05-2024 14.43,02-05-2024 15.16,2024-05-02 15:28:20,33.4,31.0
22-11-2023 11.46,22-11-2023 12.05,2023-11-22 12:08:14,19.92,38.0
05-01-2023 15.17,05-01-2023 15.44,2023-01-05 15:45:00,27.0,39.0
2023/02/13 09:19:00,13-02-2023 09.38,2023-02-13 09:49:21,19.04,23.0
2024/06/20 12:38:00,20-06-2024 12.53,2024-06-20 13:02:55,15.54,31.0
24-03-2023 14.30,24-03-2023 14.50,2023-03-24 15:01:23,20.9,600.0
22-09-2023 14.35,22-09-2023 14.53,2023-09-22 15:00:09,18.18,45.0
24-07-2024 14.07,24-07-2024 14.21,2024-07-24 14:38:10,14.44,25.0
19-10-2023 13.40,19-10-2023 13.49,2023-10-19 13:58:25,9.8,146.0
07-10-2023 13.00,07-10-2023 13.01,2023-10-07 13:02:00,1.0,17.0
10-08-2024 12.16,10-08-2024 12.35,2024-08-10 12:46:21,19.91,33.0
22-10-2024 13.24,22-10-2024 14.00,2024-10-22 14:08:54,36.62,46.0
23-11-2024 13.00,23-11-2024 13.01,2024-11-23 13:02:00,1.0,17.0
2023/05/06 10:36:00,06-05-2023 10.49,2023-05-06 11:02:09,13.9,24.0
23-11-2024 13.00,23-11-2024 13.01,2024-11-23 13:02:00,1.0,25.0
2023/07/15 13:00:00,15-07-2023 13.01,2023-07-15 13:02:00,1.0,44.0
10-09-2024 12.40,10-09-2024 13.08,2024-09-10 13:17:30,28.51,23.0
08-05-2023 14.48,08-05-2023 14.56,2023-05-08 15:03:11,8.16,
25-04-2023 11.25,25-04-2023 11.59,2023-04-25 12:23:29,34.45,32.0
21-11-2024 14.20,21-11-2024 14.50,2024-11-21 15:04:07,30.11,48.0
2023/04/22 13:00:00,22-04-2023 13.01,2023-04-22 13:02:00,1.0,
2024/10/25 10:40:00,25-10-2024 10.49,2024-10-25 10:52:55,9.3,12.0
2023/08/11 13:25:00,11-08-2023 14.34,2023-08-11 14:45:47,68.53,20.0
25-12-2023 10.46,25-12-2023 11.06,2023-12-25 11:16:35,20.67,32.0
04-09-2023 12.21,04-09-2023 12.31,2023-09-04 12:43:58,10.49,40.0
21-03-2023 12.30,21-03-2023 12.34,2023-03-21 12:35:54,4.91,19.0
03-05-2023 11.52,03-05-2023 12.19,2023-05-03 12:33:51,27.46,32.0
17-03-2023 09.44,17-03-2023 10.09,2023-03-17 10:11:38,25.78,53.0
09-07-2024 12.13,09-07-2024 12.33,2024-07-09 12:45:16,20.8,38.0
21-08-2023 13.50,21-08-2023 14.25,2023-08-21 14:35:12,35.57,53.0
2024/03/29 11:35:00,29-03-2024 11.55,2024-03-29 12:06:13,20.71,31.0
15-05-2024 10.22,15-05-2024 10.30,2024-05-15 10:34:34,8.25,32.0
2023/05/10 13:36:00,10-05-2023 13.46,2023-05-10 13:59:14,10.82,17.0
27-10-2023 12.52,27-10-2023 14.46,2023-10-27 14:58:34,114.9,46.0
13-05-2024 09.00,13-05-2024 09.18,2024-05-13 09:35:05,18.98,24.0
10-05-2024 10.22,10-05-2024 10.32,2024-05-10 10:44:37,10.52,32.0
2024/04/08 13:50:00,08-04-2024 14.06,2024-04-08 14:20:28,16.25,25.0
01-11-2023 10.33,01-11-2023 11.07,2023-11-01 11:18:16,34.34,49.0
31-01-2023 10.23,31-01-2023 10.37,2023-01-31 10:49:22,14.08,13.0
18-03-2023 10.50,18-03-2023 11.23,2023-03-18 11:31:15,33.38,166.0
08-07-2024 14.12,08-07-2024 14.34,2024-07-08 14:40:07,22.93,32.0
16-03-2023 12.45,16-03-2023 13.15,2023-03-16 13:28:19,30.2,26.0
2024/06/28 10:08:00,28-06-2024 10.38,2024-06-28 10:45:15,30.09,51.0
01-03-2024 09.02,01-03-2024 09.24,2024-03-01 09:36:28,22.88,31.0
02-05-2023 14.17,02-05-2023 14.54,2023-05-02 15:03:01,37.79,55.0
2023/11/07 10:33:00,07-11-2023 10.52,2023-11-07 11:08:54,19.39,32.0
06-02-2023 12.18,06-02-2023 12.29,2023-02-06 12:41:54,11.98,
2024/09/11 15:24:00,11-09-2024 15.39,2024-09-11 15:42:32,15.94,8.0
09-01-2023 12.11,09-01-2023 12.32,2023-01-09 12:44:23,21.87,30.0
19-11-2024 15.30,19-11-2024 15.44,2024-11-19 15:45:00,14.0,57.0
14-10-2023 11.14,14-10-2023 11.40,2023-10-14 11:51:45,26.67,55.0
06-06-2023 10.19,06-06-2023 10.42,2023-06-06 10:46:00,23.38,22.0
2023/04/12 10:24:00,12-04-2023 10.33,2023-04-12 10:45:39,9.61,32.0
25-05-2024 12.30,25-05-2024 12.59,2024-05-25 13:00:00,29.0,57.0
02-11-2023 10.28,02-11-2023 10.38,2023-11-02 10:43:28,10.71,12.0
25-04-2024 09.20,25-04-2024 09.39,2024-04-25 10:03:21,19.62,30.0
19-08-2023 10.27,19-08-2023 10.38,2023-08-19 10:46:59,11.39,32.0
2023/05/26 11:31:00,26-05-2023 11.51,2023-05-26 12:10:35,20.79,47.0
2024/08/08 11:28:00,08-08-2024 11.46,2024-08-08 11:57:25,18.51,24.0
02-09-2023 10.10,02-09-2023 10.31,2023-09-02 10:48:57,21.19,39.0
16-03-2023 15.30,16-03-2023 15.44,2023-03-16 15:45:00,14.0,
28-08-2023 12.05,28-08-2023 12.32,2023-08-28 12:43:55,27.31,22.0
29-02-2024 12.15,29-02-2024 12.41,2024-02-29 12:51:42,26.76,47.0
2023/03/09 14:18:00,09-03-2023 14.27,2023-03-09 14:38:24,9.92,17.0
17-05-2024 12.20,17-05-2024 12.25,2024-05-17 12:33:44,5.56,40.0
12-03-2024 11.22,12-03-2024 11.57,2024-03-12 12:00:36,35.65,57.0
05-03-2024 10.18,05-03-2024 10.29,2024-03-05 10:41:00,10.98,5.0
2023/09/19 11:10:00,19-09-2023 11.32,2023-09-19 11:44:26,22.49,50.0
09-08-2023 10.17,09-08-2023 10.35,2023-08-09 10:51:04,18.76,28.0
19-01-2023 14.00,19-01-2023 14.13,2023-01-19 14:26:35,13.14,41.0
11-09-2024 11.09,11-09-2024 11.29,2024-09-11 11:41:40,20.22,39.0
14-08-2024 12.11,14-08-2024 12.31,2024-08-14 12:41:04,20.42,15.0
03-05-2024 12.18,03-05-2024 12.28,2024-05-03 12:39:57,10.58,40.0
04-04-2023 09.14,04-04-2023 09.48,2023-04-04 10:02:57,34.19,56.0
21-03-2024 11.54,21-03-2024 12.29,2024-03-21 12:44:41,35.35,1000.0
10-04-2024 09.00,10-04-2024 09.14,2024-04-10 09:34:10,14.68,27.0
27-08-2024 14.24,27-08-2024 14.43,2024-08-27 14:53:57,19.44,45.0
09-01-2024 12.18,09-01-2024 12.36,2024-01-09 12:39:41,18.6,23.0
2023/11/18 09:12:00,18-11-2023 09.28,2023-11-18 09:42:02,15.95,25.0
06-10-2023 14.12,06-10-2023 14.25,2023-10-06 14:36:47,13.97,38.0
12-11-2024 12.05,12-11-2024 12.20,2024-11-12 12:31:59,15.87,33.0
10-04-2024 14.51,10-04-2024 15.09,2024-04-10 15:18:52,18.28,28.0
2024/02/06 12:55:00,06-02-2024 13.17,2024-02-06 13:28:21,22.46,37.0
19-05-2023 11.20,19-05-2023 12.55,2023-05-19 13:08:06,95.26,30.0
24-05-2024 09.00,24-05-2024 09.11,2024-05-24 09:31:45,11.9,27.0
2024/01/15 12:32:00,15-01-2024 12.53,2024-01-15 13:03:23,21.86,39.0
21-02-2024 09.44,21-02-2024 10.08,2024-02-21 10:19:56,24.67,39.0
19-10-2023 12.40,19-10-2023 13.09,2023-10-19 13:19:23,,31.0
06-03-2023 13.25,06-03-2023 13.47,2023-03-06 14:02:41,22.14,27.0
19-02-2024 10.49,19-02-2024 11.23,2024-02-19 11:32:08,34.0,39.0
22-03-2024 12.31,22-03-2024 12.53,2024-03-22 13:00:59,22.21,43.0
14-11-2023 14.05,14-11-2023 14.12,2023-11-14 14:19:18,7.69,17.0
03-08-2023 10.42,03-08-2023 10.53,2023-08-03 10:57:12,11.35,32.0
20-07-2024 09.53,20-07-2024 10.09,2024-07-20 10:13:06,16.9,18.0
2023/04/05 13:16:00,05-04-2023 13.47,2023-04-05 13:51:02,31.92,33.0
01-03-2024 15.22,01-03-2024 15.39,2024-03-01 15:45:00,17.02,18.0
21-01-2023 10.00,21-01-2023 10.23,2023-01-21 10:34:14,23.6,28.0
18-07-2024 15.45,18-07-2024 15.46,2024-07-18 15:47:00,1.0,37.0
06-07-2023 14.49,06-07-2023 15.06,2023-07-06 15:18:15,17.95,23.0
11-01-2024 12.12,11-01-2024 12.42,2024-01-11 12:52:35,30.91,57.0
03-04-2023 09.11,03-04-2023 09.32,2023-04-03 09:44:14,21.6,34.0
2023/09/14 14:46:00,14-09-2023 15.06,2023-09-14 15:16:08,20.48,32.0
18-06-2024 15.27,18-06-2024 15.38,2024-06-18 15:45:00,11.88,22.0
2024/06/29 13:00:00,29-06-2024 13.01,2024-06-29 13:02:00,1.0,47.0
2024/01/23 14:53:00,23-01-2024 15.17,2024-01-23 15:28:20,24.98,157.0
23-01-2024 13.58,23-01-2024 14.15,2024-01-23 14:25:40,17.35,7.0
08-03-2024 11.10,08-03-2024 11.23,2024-03-08 11:45:30,13.51,19.0
10-01-2023 13.10,10-01-2023 14.16,2023-01-10 14:24:33,65.52,20.0
19-07-2023 12.40,19-07-2023 13.05,2023-07-19 13:16:07,25.98,36.0
04-10-2023 14.39,04-10-2023 14.55,2023-10-04 14:58:06,16.17,20.0
2024/02/12 15:45:00,12-02-2024 15.46,2024-02-12 15:47:00,1.0,25.0
29-07-2024 09.00,29-07-2024 09.21,2024-07-29 09:28:45,21.2,38.0
26-01-2024 09.11,26-01-2024 09.31,2024-01-26 09:42:32,20.43,28.0
21-05-2024 11.19,21-05-2024 11.46,2024-05-21 12:00:01,27.11,36.0
2023/12/16 11:05:00,16-12-2023 11.22,2023-12-16 11:35:03,17.86,3.0
09-10-2024 13.33,09-10-2024 13.54,2024-10-09 13:59:58,21.23,48.0
17-05-2023 12.48,17-05-2023 12.52,2023-05-17 12:57:44,4.07,40.0
07-05-2024 12.12,07-05-2024 12.31,2024-05-07 12:40:38,19.37,28.0
18-02-2023 11.34,18-02-2023 11.57,2023-02-18 12:07:32,23.49,28.0
01-07-2023 10.33,01-07-2023 10.45,2023-07-01 10:56:07,12.15,32.0
28-08-2024 11.42,28-08-2024 12.06,2024-08-28 12:22:10,24.3,36.0
22-08-2024 15.38,22-08-2024 15.44,2024-08-22 15:45:00,6.0,39.0
19-08-2024 11.05,19-08-2024 11.20,2024-08-19 11:31:51,15.74,38.0
20-10-2023 11.28,20-10-2023 11.49,2023-10-20 11:59:22,21.22,47.0
16-11-2023 12.16,16-11-2023 12.38,2023-11-16 12:51:14,21.89,38.0
10-08-2024 11.48,10-08-2024 12.08,2024-08-10 12:20:03,,35.0
01-10-2024 15.45,01-10-2024 15.46,2024-10-01 15:47:00,1.0,50.0
02-12-2024 10.13,02-12-2024 10.22,2024-12-02 10:33:44,9.47,21.0
08-02-2023 11.50,08-02-2023 12.14,2023-02-08 12:23:38,24.98,24.0
29-11-2024 10.22,29-11-2024 10.48,2024-11-29 10:59:57,26.77,30.0
23-10-2024 12.10,23-10-2024 12.30,2024-10-23 12:40:34,20.91,33.0
03-01-2024 10.36,03-01-2024 11.08,2024-01-03 11:19:42,32.92,36.0
16-02-2024 10.45,16-02-2024 11.04,2024-02-16 11:16:03,19.84,24.0
2024/09/14 13:00:00,14-09-2024 13.01,2024-09-14 13:02:00,1.0,33.0
20-06-2023 11.36,20-06-2023 12.00,2023-06-20 12:08:10,24.65,30.0
09-02-2024 13.39,09-02-2024 14.00,2024-02-09 14:12:43,21.29,28.0
01-03-2024 13.39,01-03-2024 13.57,2024-03-01 14:10:50,18.1,27.0
10-05-2024 12.51,10-05-2024 13.09,2024-05-10 13:17:40,18.69,36.0
27-11-2024 11.28,27-11-2024 11.40,2024-11-27 11:57:27,12.76,22.0
22-05-2023 9.32,22-05-2023 09.50,2023-05-22 10:03:18,18.38,40.0
2024/07/08 12:08:00,08-07-2024 12.22,2024-07-08 12:39:33,14.49,6.0
20-05-2024 10.36,20-05-2024 10.54,2024-05-20 11:03:48,18.84,24.0
01-08-2024 15.45,01-08-2024 15.46,2024-08-01 15:47:00,1.0,15.0
05-07-2023 13.17,05-07-2023 13.28,2023-07-05 13:40:24,11.93,18.0
21-11-2024 10.40,21-11-2024 10.54,2024-11-21 11:10:06,14.81,32.0
,10-10-2023 13.54,2023-10-10 14:05:08,15.19,17.0
01-02-2023 10.29,01-02-2023 10.37,2023-02-01 10:46:04,8.25,32.0
24-07-2024 13.58,24-07-2024 14.29,2024-07-24 14:37:08,31.07,51.0
06-04-2023 12.29,06-04-2023 12.52,2023-04-06 12:55:10,22.99,15.0
2024/03/23 11:05:00,23-03-2024 11.36,2024-03-23 11:45:43,31.74,39.0
16-05-2024 14.10,16-05-2024 14.19,2024-05-16 14:31:14,9.74,25.0
27-08-2024 12.25,27-08-2024 12.51,2024-08-27 13:04:48,26.52,33.0
19-04-2024 10.03,19-04-2024 10.23,2024-04-19 10:34:42,19.38,24.0
05-03-2024 12.54,05-03-2024 13.32,2024-03-05 13:44:18,38.15,54.0
20-04-2023 12.28,20-04-2023 12.55,2023-04-20 13:07:00,27.58,41.0
23-02-2024 10.07,23-02-2024 10.33,2024-02-23 10:43:21,26.42,26.0
2023/01/14 12:24:00,14-01-2023 12.43,2023-01-14 13:00:00,19.65,40.0
29-07-2023 10.28,29-07-2023 10.42,2023-07-29 10:52:14,14.94,32.0
28-02-2024 14.13,28-02-2024 14.28,2024-02-28 14:46:16,15.03,
01-06-2023 10.20,01-06-2023 10.39,2023-06-01 10:50:36,18.86,30.0
14-02-2023 14.10,14-02-2023 14.25,2023-02-14 14:32:52,15.3,37.0
21-02-2023 14.00,21-02-2023 14.17,2023-02-21 14:24:22,17.44,8.0
15-03-2024 15.32,15-03-2024 15.44,2024-03-15 15:45:00,12.0,16.0
24-02-2024 12.31,24-02-2024 12.43,2024-02-24 12:47:16,12.58,40.0
08-11-2024 10.38,08-11-2024 11.10,2024-11-08 11:15:36,32.31,35.0
2023/11/16 13:06:00,16-11-2023 13.37,2023-11-16 13:39:56,31.75,44.0
04-11-2023 11.07,04-11-2023 11.32,2023-11-04 11:46:09,25.75,17.0
2023/09/04 11:15:00,04-09-2023 11.34,2023-09-04 11:49:12,19.12,26.0
16-11-2024 09.12,16-11-2024 09.42,2024-11-16 09:56:48,30.36,49.0
21-10-2023 10.28,21-10-2023 10.38,2023-10-21 10:48:35,10.64,32.0
22-06-2024 11.42,22-06-2024 12.04,2024-06-22 12:17:10,22.06,32.0
2023/05/31 09:49:00,31-05-2023 10.14,2023-05-31 10:27:44,,30.0
11-04-2024 11.45,11-04-2024 11.57,2024-04-11 12:09:43,12.03,13.0
2024/07/17 09:09:00,17-07-2024 09.43,2024-07-17 09:54:26,34.84,49.0
08-02-2023 13.35,08-02-2023 14.04,2023-02-08 14:20:27,29.93,52.0
13-03-2024 12.43,13-03-2024 12.59,2024-03-13 13:12:38,,29.0
2023/12/08 11:32:00,08-12-2023 12.00,2023-12-08 12:13:00,28.62,34.0
09-08-2023 10.11,09-08-2023 10.42,2023-08-09 10:55:58,31.07,38.0
2024/10/03 10:35:00,03-10-2024 10.37,2024-10-03 10:39:11,2.61,32.0
17-04-2024 10.30,17-04-2024 10.58,2024-04-17 11:08:07,28.1,32.0
23-06-2023 11.39,23-06-2023 12.02,2023-06-23 12:11:46,23.02,40.0
13-11-2023 10.49,13-11-2023 11.06,2023-11-13 11:19:34,17.29,16.0
02-11-2023 12.50,02-11-2023 13.13,2023-11-02 13:30:47,23.72,30.0
19-01-2024 15.14,19-01-2024 15.38,2024-01-19 15:43:56,24.21,23.0
28-12-2023 09.52,28-12-2023 10.15,2023-12-28 10:24:52,23.1,47.0
10-08-2023 10.42,10-08-2023 11.20,2023-08-10 11:31:35,38.46,33.0
12-08-2023 09.33,12-08-2023 10.18,2023-08-12 10:26:43,45.39,44.0
25-01-2024 14.05,25-01-2024 14.14,2024-01-25 14:28:19,9.76,25.0
04-10-2024 12.33,04-10-2024 12.43,2024-10-04 12:46:30,10.27,5.0
08-07-2023 13.00,08-07-2023 13.01,2023-07-08 13:02:00,1.0,200.0
20-07-2024 10.20,20-07-2024 10.36,2024-07-20 10:55:21,16.29,0.0
20-09-2024 10.56,20-09-2024 11.25,2024-09-20 11:29:01,29.04,64.0
22-01-2024 14.45,22-01-2024 14.55,2024-01-22 15:01:11,10.55,29.0
21-08-2023 10.30,21-08-2023 10.49,2023-08-21 10:56:58,19.54,20.0
2023/08/04 11:08:00,04-08-2023 11.27,2023-08-04 11:38:03,19.72,215.0
21-06-2024 09.58,21-06-2024 10.05,2024-06-21 10:13:00,7.93,32.0
01-07-2023 13.00,01-07-2023 13.01,2023-07-01 13:02:00,1.0,25.0
21-01-2023 10.33,21-01-2023 10.47,2023-01-21 11:06:01,15.0,32.0
29-03-2024 15.45,29-03-2024 15.46,2024-03-29 15:47:00,1.0,25.0
02-09-2023 10.56,02-09-2023 11.22,2023-09-02 11:33:31,26.4,32.0
03-02-2024 11.02,03-02-2024 11.21,2024-02-03 11:32:28,18.48,49.0
2023/01/23 14:18:00,23-01-2023 14.35,2023-01-23 14:55:05,17.97,17.0
07-03-2023 09.15,07-03-2023 09.41,2023-03-07 09:53:38,26.22,39.0
22-01-2024 14.49,22-01-2024 15.10,2024-01-22 15:22:45,21.7,37.0
2023/10/21 09:28:00,21-10-2023 09.47,2023-10-21 10:04:25,19.27,45.0
10-05-2024 11.00,10-05-2024 11.21,2024-05-10 11:36:21,21.76,25.0
17-03-2023 10.03,17-03-2023 10.35,2023-03-17 10:48:31,32.15,36.0
2023/01/17 09:40:00,17-01-2023 10.12,2023-01-17 10:21:20,32.04,53.0
2023/01/31 14:09:00,31-01-2023 14.29,2023-01-31 14:38:54,20.58,14.0
23-02-2023 10.41,23-02-2023 10.59,2023-02-23 11:11:32,18.21,16.0
25-11-2023 11.08,25-11-2023 11.31,2023-11-25 11:42:29,23.59,42.0
14-06-2023 12.28,14-06-2023 12.31,2023-06-14 12:42:33,3.2,40.0
07-11-2023 09.48,07-11-2023 09.55,2023-11-07 10:01:35,7.09,24.0
01-02-2024 10.24,01-02-2024 10.29,2024-02-01 10:34:36,5.36,32.0
22-08-2024 12.20,22-08-2024 12.57,2024-08-22 13:11:36,37.63,45.0
06-03-2023 11.21,06-03-2023 11.58,2023-03-06 12:05:54,37.45,57.0
2023/10/10 12:47:00,10-10-2023 13.05,2023-10-10 13:16:13,18.41,36.0
31-08-2024 13.00,31-08-2024 13.01,2024-08-31 13:02:00,1.0,36.0
10-06-2023 10.51,10-06-2023 11.16,2023-06-10 11:30:27,25.68,
25-11-2024 09.38,25-11-2024 09.50,2024-11-25 10:01:30,12.56,10.0
2023/09/13 09:00:00,13-09-2023 09.23,2023-09-13 09:27:47,23.24,32.0
07-02-2023 12.21,07-02-2023 12.27,2023-02-07 12:35:12,6.05,40.0
16-11-2024 13.00,16-11-2024 13.01,2024-11-16 13:02:00,1.0,49.0
28-11-2023 10.24,28-11-2023 10.34,2023-11-28 10:38:37,10.3,21.0
09-04-2024 11.04,09-04-2024 11.14,2024-04-09 11:31:07,10.85,0.0
10-10-2024 10.32,10-10-2024 10.59,2024-10-10 11:12:07,27.24,32.0
11-12-2023 9.40,11-12-2023 10.13,2023-12-11 10:15:29,33.25,47.0
18-12-2023 13.30,18-12-2023 13.49,2023-12-18 14:02:44,19.2,32.0
16-09-2024 9.13,16-09-2024 09.30,2024-09-16 09:39:36,17.82,26.0
2024/09/04 10:36:00,04-09-2024 10.52,2024-09-04 11:06:52,16.83,32.0
01-11-2023 09.19,01-11-2023 09.40,2023-11-01 09:54:19,21.07,20.0
19-04-2024 10.09,19-04-2024 10.31,2024-04-19 10:39:59,22.94,21.0
29-10-2024 09.11,29-10-2024 09.31,2024-10-29 09:41:37,20.32,26.0
25-09-2024 13.56,25-09-2024 15.28,2024-09-25 15:38:29,92.48,47.0
23-05-2023 10.40,23-05-2023 10.49,2023-05-23 11:00:58,9.63,32.0
27-07-2024 12.30,27-07-2024 12.42,2024-07-27 12:45:55,12.75,5.0
31-07-2023 14.17,31-07-2023 14.24,2023-07-31 14:33:16,7.17,17.0
2024/07/01 09:08:00,01-07-2024 09.18,2024-07-01 09:26:36,10.57,6.0
21-06-2024 14.25,21-06-2024 14.28,2024-06-21 14:37:19,3.78,17.0
01-01-2024 11.53,01-01-2024 12.19,2024-01-01 12:24:22,26.89,24.0
02-11-2023 14.19,02-11-2023 14.45,2023-11-02 14:57:07,26.75,54.0
,11-09-2024 12.49,2024-09-11 13:02:14,28.13,33.0
2024/02/24 09:13:00,24-02-2024 09.42,2024-02-24 09:52:16,29.73,36.0
24-04-2024 14.48,24-04-2024 15.11,2024-04-24 15:22:43,23.19,36.0
29-02-2024 11.53,29-02-2024 12.10,2024-02-29 12:16:54,17.98,27.0
2024/04/16 14:07:00,16-04-2024 14.23,2024-04-16 14:35:16,16.44,0.0
2023/02/16 10:29:00,16-02-2023 10.48,2023-02-16 11:03:43,19.23,25.0
13-06-2024 09.05,13-06-2024 09.13,2024-06-13 09:32:03,8.09,27.0
03-04-2024 14.56,03-04-2024 15.24,2024-04-03 15:35:20,28.88,39.0
20-07-2024 12.03,20-07-2024 12.24,2024-07-20 12:33:57,21.51,30.0
2023/08/01 12:59:00,01-08-2023 13.09,2023-08-01 13:11:32,10.6,12.0
30-03-2024 11.43,30-03-2024 12.11,2024-03-30 12:13:58,28.85,24.0
19-07-2024 12.07,19-07-2024 12.43,2024-07-19 12:45:31,36.46,44.0
30-03-2024 13.00,30-03-2024 13.01,2024-03-30 13:02:00,1.0,12.0
27-11-2024 15.01,27-11-2024 15.06,2024-11-27 15:17:48,5.68,32.0
08-08-2023 9.41,08-08-2023 09.53,2023-08-08 10:09:45,12.75,10.0
06-04-2023 10.45,06-04-2023 11.12,2023-04-06 11:22:34,27.25,31.0
17-10-2023 15.07,17-10-2023 15.14,2023-10-17 15:30:41,7.52,21.0
2024/11/02 12:58:00,02-11-2024 12.59,2024-11-02 13:00:00,1.0,12.0
2023/11/21 12:11:00,21-11-2023 12.30,2023-11-21 12:42:04,19.42,
19-04-2023 11.28,19-04-2023 11.46,2023-04-19 12:01:44,18.38,21.0
16-09-2023 13.00,16-09-2023 13.01,2023-09-16 13:02:00,1.0,7.0
16-08-2024 10.30,16-08-2024 10.53,2024-08-16 11:10:55,23.13,32.0
16-02-2024 13.29,16-02-2024 15.09,2024-02-16 15:19:54,100.66,22.0
07-06-2024 11.03,07-06-2024 11.34,2024-06-07 11:46:16,31.84,34.0
2023/03/04 13:00:00,04-03-2023 13.01,2023-03-04 13:02:00,1.0,26.0
22-03-2023 14.55,22-03-2023 15.21,2023-03-22 15:29:06,26.6,22.0
10-06-2023 10.41,10-06-2023 11.11,2023-06-10 11:21:51,30.91,49.0
2023/09/13 11:56:00,13-09-2023 12.08,2023-09-13 12:16:23,12.64,29.0
14-11-2023 10.21,14-11-2023 10.50,2023-11-14 11:05:25,29.58,36.0
09-08-2024 09.36,09-08-2024 09.59,2024-08-09 10:08:49,22.45,37.0
14-10-2024 15.45,14-10-2024 15.46,2024-10-14 15:47:00,1.0,25.0
02-02-2024 12.49,02-02-2024 13.01,2024-02-02 13:11:42,12.35,32.0
13-09-2023 10.33,13-09-2023 10.47,2023-09-13 10:59:40,14.04,14.0
25-03-2024 14.22,25-03-2024 14.34,2024-03-25 14:50:24,12.92,17.0
2024/08/31 12:18:00,31-08-2024 12.44,2024-08-31 12:56:19,26.41,37.0
28-09-2023 09.52,28-09-2023 11.58,2023-09-28 12:09:20,126.72,28.0
22-11-2024 13.00,22-11-2024 13.18,2024-11-22 13:29:45,18.82,36.0
01-05-2023 11.37,01-05-2023 12.04,2023-05-01 12:19:36,27.62,45.0
28-06-2023 13.01,28-06-2023 13.15,2023-06-28 13:17:27,14.7,12.0
20-09-2023 14.34,20-09-2023 14.58,2023-09-20 15:10:18,24.88,18.0
12-01-2024 12.07,12-01-2024 12.24,2024-01-12 12:40:50,16.78,10.0
26-10-2024 13.00,26-10-2024 13.01,2024-10-26 13:02:00,1.0,200.0
26-07-2023 10.30,26-07-2023 10.58,2023-07-26 11:06:24,28.8,45.0
2023/01/09 11:44:00,09-01-2023 12.12,2023-01-09 12:20:03,28.45,60.0
01-05-2023 11.18,01-05-2023 11.25,2023-05-01 11:31:59,7.44,2.0
31-07-2024 11.48,31-07-2024 12.07,2024-07-31 12:15:06,19.96,27.0
07-02-2024 14.01,07-02-2024 14.32,2024-02-07 14:52:38,,30.0
,25-10-2023 10.33,2023-10-25 10:44:05,25.64,40.0
2023/08/17 13:16:00,17-08-2023 13.44,2023-08-17 13:55:45,28.79,35.0
26-03-2024 09.43,26-03-2024 10.05,2024-03-26 10:16:49,22.89,34.0
25-04-2023 13.33,25-04-2023 13.56,2023-04-25 14:07:50,23.07,43.0
07-06-2023 15.36,07-06-2023 15.44,2023-06-07 15:45:00,8.0,39.0
30-09-2023 12.38,30-09-2023 12.41,2023-09-30 12:49:06,3.22,40.0
22-06-2023 09.06,22-06-2023 09.20,2023-06-22 09:28:43,14.8,32.0
27-10-2023 09.10,27-10-2023 09.39,2023-10-27 09:50:12,29.77,49.0
28-09-2023 09.38,28-09-2023 10.02,2023-09-28 10:03:49,24.62,53.0
13-07-2024 10.52,13-07-2024 11.08,2024-07-13 11:23:20,16.48,25.0
2024/03/02 10:27:00,02-03-2024 10.48,2024-03-02 10:51:52,21.87,22.0
09-08-2024 09.15,09-08-2024 09.45,2024-08-09 09:54:19,30.01,37.0
18-09-2023 13.39,18-09-2023 14.07,2023-09-18 14:18:58,28.81,36.0
26-11-2024 12.43,26-11-2024 13.04,2024-11-26 13:09:22,21.75,20.0
17-11-2023 12.33,17-11-2023 12.49,2023-11-17 13:05:05,16.34,
29-09-2023 13.31,29-09-2023 15.09,2023-09-29 15:21:43,98.03,22.0
25-09-2023 14.50,25-09-2023 15.13,2023-09-25 15:26:25,23.94,71.0
2024/08/29 12:59:00,29-08-2024 13.24,2024-08-29 13:36:22,25.07,41.0
2024/06/13 13:44:00,13-06-2024 14.00,2024-06-13 14:11:54,16.72,32.0
2024/03/09 10:29:00,09-03-2024 10.45,2024-03-09 10:51:50,16.09,9.0
2023/12/16 09:52:00,16-12-2023 10.01,2023-12-16 10:10:22,9.68,10.0
2023/08/14 12:37:00,14-08-2023 12.57,2023-08-14 13:18:20,20.73,40.0
05-08-2024 12.58,05-08-2024 13.14,2024-08-05 13:24:13,16.74,32.0
19-06-2024 13.07,19-06-2024 13.23,2024-06-19 13:28:07,16.71,20.0
04-06-2024 12.01,04-06-2024 12.16,2024-06-04 12:27:00,15.65,15.0
25-02-2023 10.07,25-02-2023 10.22,2023-02-25 10:33:23,15.02,5.0
15-05-2024 10.28,15-05-2024 10.51,2024-05-15 11:09:22,23.55,32.0
2023/12/16 13:00:00,16-12-2023 13.01,2023-12-16 13:02:00,1.0,48.0
04-03-2024 11.12,04-03-2024 12.44,2024-03-04 12:59:42,92.62,30.0
,02-09-2023 10.02,2023-09-02 10:12:51,19.05,20.0
26-11-2024 09.18,26-11-2024 09.43,2024-11-26 09:46:29,25.28,25.0
22-03-2023 14.17,22-03-2023 14.38,2023-03-22 14:46:20,21.82,22.0
14-09-2023 09.44,14-09-2023 10.09,2023-09-14 10:18:39,25.66,33.0
27-05-2023 13.00,27-05-2023 13.01,2023-05-27 13:02:00,1.0,25.0
2023/07/25 12:18:00,25-07-2023 12.45,2023-07-25 12:54:03,27.49,29.0
06-09-2024 14.58,06-09-2024 15.13,2024-09-06 15:19:09,15.35,12.0
16-06-2023 10.39,16-06-2023 11.09,2023-06-16 11:21:00,30.05,19.0
06-07-2024 13.00,06-07-2024 13.01,2024-07-06 13:02:00,1.0,28.0
26-09-2024 10.12,26-09-2024 10.35,2024-09-26 10:47:54,23.62,30.0
29-02-2024 13.27,29-02-2024 13.49,2024-02-29 13:58:38,22.01,36.0
07-08-2023 12.24,07-08-2023 12.46,2023-08-07 12:56:07,22.47,31.0
29-08-2023 9.15,29-08-2023 09.40,2023-08-29 09:52:16,25.67,63.0
23-01-2024 10.24,23-01-2024 11.51,2024-01-23 12:01:19,87.65,33.0
2023/11/23 11:43:00,23-11-2023 11.57,2023-11-23 12:08:46,14.11,13.0
15-06-2024 12.18,15-06-2024 12.28,2024-06-15 12:38:57,10.37,40.0
2024/05/20 11:13:00,20-05-2024 11.34,2024-05-20 11:47:44,21.89,37.0
17-05-2024 09.33,17-05-2024 09.56,2024-05-17 10:06:03,23.36,26.0
22-03-2023 14.02,22-03-2023 14.14,2023-03-22 14:28:13,12.62,17.0
2024/08/02 10:51:00,02-08-2024 11.14,2024-08-02 11:23:48,23.89,29.0
07-08-2024 12.20,07-08-2024 12.28,2024-08-07 12:39:40,8.86,40.0
24-08-2024 13.00,24-08-2024 13.01,2024-08-24 13:02:00,1.0,43.0
07-05-2024 14.21,07-05-2024 14.42,2024-05-07 14:52:02,21.5,33.0
27-01-2024 10.47,27-01-2024 11.11,2024-01-27 11:24:09,24.11,24.0
02-08-2023 14.39,02-08-2023 15.03,2023-08-02 15:08:52,24.38,52.0
2023/08/14 13:14:00,14-08-2023 13.53,2023-08-14 14:01:41,39.64,36.0
2023/06/09 15:00:00,09-06-2023 15.13,2023-06-09 15:31:33,13.31,0.0
01-09-2023 14.21,01-09-2023 14.43,2023-09-01 14:52:56,22.57,27.0
24-06-2023 12.17,24-06-2023 12.37,2023-06-24 12:50:58,20.83,400.0
25-10-2024 11.04,25-10-2024 11.27,2024-10-25 11:35:23,23.07,42.0
03-04-2024 13.00,03-04-2024 13.26,2024-04-03 13:34:49,26.21,32.0
16-11-2024 13.00,16-11-2024 13.01,2024-11-16 13:02:00,1.0,34.0
2023/01/11 15:27:00,11-01-2023 15.44,2023-01-11 15:45:00,16.67,
2024/01/02 12:41:00,02-01-2024 12.48,2024-01-02 12:54:04,7.37,40.0
29-09-2023 13.57,29-09-2023 14.33,2023-09-29 14:42:05,36.67,75.0
12-10-2023 09.54,12-10-2023 10.21,2023-10-12 10:28:24,27.01,52.0
10-01-2023 12.06,10-01-2023 12.31,2023-01-10 12:40:55,25.63,30.0
30-03-2023 12.34,30-03-2023 12.53,2023-03-30 13:03:40,400.0,46.0
25-03-2023 13.00,25-03-2023 13.01,2023-03-25 13:02:00,1.0,57.0
18-10-2024 12.03,18-10-2024 12.20,2024-10-18 12:33:16,17.32,34.0
02-03-2024 11.56,02-03-2024 12.23,2024-03-02 12:32:12,27.38,30.0
03-06-2024 14.22,03-06-2024 14.36,2024-06-03 14:52:23,14.55,18.0
2023/10/18 14:05:00,18-10-2023 14.25,2023-10-18 14:36:46,20.04,20.0
31-05-2023 12.46,31-05-2023 12.49,2023-05-31 12:55:07,3.13,40.0
2023/09/30 11:41:00,30-09-2023 11.57,2023-09-30 12:05:15,16.66,60.0
05-01-2023 15.24,05-01-2023 15.44,2023-01-05 15:45:00,20.0,43.0
02-10-2024 10.40,02-10-2024 10.51,2024-10-02 11:00:42,11.05,14.0
04-07-2023 13.50,04-07-2023 13.53,2023-07-04 13:57:51,3.55,25.0
22-02-2024 11.24,22-02-2024 11.45,2024-02-22 11:53:51,21.23,38.0
28-08-2023 14.29,28-08-2023 14.48,2023-08-28 14:52:50,19.83,32.0
25-01-2024 09.33,25-01-2024 09.53,2024-01-25 10:12:17,20.15,26.0
2023/07/28 09:05:00,28-07-2023 09.21,2023-07-28 09:31:04,16.43,26.0
24-09-2024 14.42,24-09-2024 15.07,2024-09-24 15:10:09,25.44,47.0
26-06-2024 10.31,26-06-2024 10.43,2024-06-26 10:56:00,12.78,13.0
24-03-2023 15.29,24-03-2023 15.44,2023-03-24 15:45:00,15.0,50.0
26-01-2024 10.02,26-01-2024 10.08,2024-01-26 10:12:19,6.69,32.0
16-05-2024 09.14,16-05-2024 09.44,2024-05-16 09:54:51,30.41,
03-03-2023 15.11,03-03-2023 15.30,2023-03-03 15:39:32,19.5,34.0
2023/04/03 10:29:00,03-04-2023 10.43,2023-04-03 10:44:22,14.37,21.0
2023/02/02 11:56:00,02-02-2023 12.21,2023-02-02 12:31:02,25.93,41.0
29-01-2024 12.12,29-01-2024 12.35,2024-01-29 12:46:52,23.2,41.0
16-06-2023 09.00,16-06-2023 09.25,2023-06-16 09:39:36,25.15,33.0
05-03-2024 14.04,05-03-2024 14.12,2024-03-05 14:18:34,8.89,25.0
2023/04/18 14:55:00,18-04-2023 15.20,2023-04-18 15:34:06,25.05,53.0
05-12-2023 12.43,05-12-2023 12.53,2023-12-05 13:05:53,10.71,14.0
31-07-2023 10.16,31-07-2023 10.36,2023-07-31 10:39:57,20.9,34.0
10-01-2023 12.35,10-01-2023 12.50,2023-01-10 13:01:36,15.81,26.0
06-06-2023 10.10,06-06-2023 10.21,2023-06-06 10:31:47,11.04,38.0
09-01-2024 14.34,09-01-2024 15.05,2024-01-09 15:21:29,31.2,53.0
20-01-2023 11.51,20-01-2023 12.14,2023-01-20 12:23:38,23.57,36.0
26-02-2024 14.06,26-02-2024 14.17,2024-02-26 14:31:14,11.53,
05-01-2024 09.59,05-01-2024 10.26,2024-01-05 10:37:25,27.73,34.0
2023/04/17 09:28:00,17-04-2023 10.01,2023-04-17 10:15:55,,40.0
14-02-2024 11.07,14-02-2024 11.19,2024-02-14 11:31:42,12.62,38.0
31-05-2024 10.55,31-05-2024 11.23,2024-05-31 11:38:28,27.27,34.0
,01-01-2024 12.03,2024-01-01 12:21:02,27.9,36.0
20-11-2024 11.30,20-11-2024 11.53,2024-11-20 12:13:38,23.97,45.0
2024/06/08 09:41:00,08-06-2024 09.53,2024-06-08 10:04:07,12.36,45.0
14-06-2023 09.00,14-06-2023 09.16,2023-06-14 09:29:51,16.97,44.0
11-04-2023 11.53,11-04-2023 12.18,2023-04-11 12:36:13,25.24,22.0
15-03-2023 15.45,15-03-2023 15.46,2023-03-15 15:47:00,1.0,16.0
07-03-2024 12.49,07-03-2024 13.06,2024-03-07 13:18:09,17.42,36.0
25-08-2023 13.22,25-08-2023 13.41,2023-08-25 13:49:46,19.25,
26-04-2024 12.46,26-04-2024 12.59,2024-04-26 13:18:12,13.68,40.0
27-09-2023 09.51,27-09-2023 10.12,2023-09-27 10:22:10,21.04,40.0
2023/01/06 11:13:00,06-01-2023 11.31,2023-01-06 11:39:12,18.62,39.0
22-07-2024 10.24,22-07-2024 10.28,2024-07-22 10:33:38,4.68,32.0
22-07-2024 11.57,22-07-2024 12.14,2024-07-22 12:23:59,17.5,23.0
21-02-2023 11.21,21-02-2023 11.38,2023-02-21 11:53:57,17.9,20.0
17-06-2024 10.57,17-06-2024 11.09,2024-06-17 11:20:06,12.82,24.0
18-03-2023 09.12,18-03-2023 09.48,2023-03-18 09:57:45,36.42,45.0
21-11-2023 11.22,21-11-2023 11.44,2023-11-21 11:57:04,22.31,28.0
2023/09/25 13:58:00,25-09-2023 14.19,2023-09-25 14:28:59,21.22,31.0
30-10-2024 14.51,30-10-2024 15.15,2024-10-30 15:26:20,24.98,33.0
29-05-2024 15.18,29-05-2024 15.26,2024-05-29 15:44:32,8.51,21.0
10-04-2023 09.43,10-04-2023 09.55,2023-04-10 10:07:52,12.94,15.0
2023/07/18 10:21:00,18-07-2023 10.55,2023-07-18 11:04:01,34.38,36.0
20-06-2024 10.19,20-06-2024 10.28,2024-06-20 10:44:17,9.2,32.0
25-05-2024 12.59,25-05-2024 12.59,2024-05-25 13:00:00,0.0,36.0
2024/05/10 10:27:00,10-05-2024 10.57,2024-05-10 11:09:53,30.67,20.0
24-02-2023 13.05,24-02-2023 13.44,2023-02-24 13:49:14,39.07,36.0
2024/03/30 13:00:00,30-03-2024 13.01,2024-03-30 13:02:00,1.0,221.0
29-10-2024 10.03,29-10-2024 10.25,2024-10-29 10:29:59,21.78,45.0
07-01-2023 13.00,07-01-2023 13.01,2023-01-07 13:02:00,1.0,25.0
27-02-2023 15.11,27-02-2023 15.38,2023-02-27 15:45:00,27.12,48.0
2023/05/13 13:00:00,13-05-2023 13.01,2023-05-13 13:02:00,1.0,38.0
07-02-2023 14.02,07-02-2023 14.10,2023-02-07 14:23:57,8.82,25.0
24-06-2023 13.00,24-06-2023 13.01,2023-06-24 13:02:00,1.0,17.0
30-06-2023 09.16,30-06-2023 09.32,2023-06-30 09:46:20,16.3,12.0
18-01-2024 10.31,18-01-2024 10.39,2024-01-18 10:45:53,8.2,0.0
10-04-2024 12.52,10-04-2024 13.12,2024-04-10 13:19:44,20.73,43.0
30-10-2024 11.05,30-10-2024 11.29,2024-10-30 11:44:51,24.02,34.0
2023/09/20 14:34:00,20-09-2023 14.49,2023-09-20 15:07:20,15.09,25.0
01-04-2024 14.49,01-04-2024 15.12,2024-04-01 15:16:27,23.41,32.0
01-04-2024 15.45,01-04-2024 15.46,2024-04-01 15:47:00,1.0,25.0
30-01-2024 11.31,30-01-2024 11.48,2024-01-30 12:07:04,17.82,47.0
06-02-2023 14.24,06-02-2023 14.49,2023-02-06 15:00:29,25.12,18.0
11-07-2023 09.14,11-07-2023 09.44,2023-07-11 10:01:33,30.15,40.0
12-10-2024 09.51,12-10-2024 10.23,2024-10-12 10:27:23,32.96,63.0
06-10-2023 15.24,06-10-2023 15.44,2023-10-06 15:45:00,20.0,57.0
14-07-2023 14.10,14-07-2023 14.38,2023-07-14 15:00:05,28.32,30.0
07-03-2023 15.43,07-03-2023 15.44,2023-03-07 15:45:00,1.0,35.0
13-07-2023 09.46,13-07-2023 10.02,2023-07-13 10:14:10,16.25,34.0
20-03-2023 10.48,20-03-2023 11.05,2023-03-20 11:22:40,17.31,33.0
07-09-2024 13.00,07-09-2024 13.01,2024-09-07 13:02:00,1.0,62.0
12-06-2024 12.14,12-06-2024 12.21,2024-06-12 12:34:23,7.12,29.0
02-08-2024 9.20,02-08-2024 09.49,2024-08-02 10:00:27,29.7,63.0
2023/08/17 10:01:00,17-08-2023 10.27,2023-08-17 10:37:08,26.87,26.0
11-11-2024 12.40,11-11-2024 12.47,2024-11-11 12:48:53,7.88,19.0
08-04-2023 13.00,08-04-2023 13.01,2023-04-08 13:02:00,1.0,42.0
31-05-2024 09.31,31-05-2024 09.50,2024-05-31 10:03:25,19.99,47.0
04-02-2023 09.44,04-02-2023 10.03,2023-02-04 10:08:49,19.2,34.0
05-07-2023 10.40,05-07-2023 10.49,2023-07-05 11:01:00,9.58,32.0
03-01-2024 09.14,03-01-2024 09.32,2024-01-03 09:42:18,18.96,18.0
21-08-2024 12.38,21-08-2024 12.53,2024-08-21 12:57:18,15.16,32.0
2023/09/27 12:05:00,27-09-2023 12.33,2023-09-27 12:47:42,28.58,22.0
06-04-2023 09.12,06-04-2023 09.32,2023-04-06 09:44:04,19.91,39.0
12-04-2024 09.51,12-04-2024 10.12,2024-04-12 10:21:09,21.52,31.0
18-07-2023 11.04,18-07-2023 11.31,2023-07-18 11:43:44,27.83,42.0
2024/05/10 10:29:00,10-05-2024 10.37,2024-05-10 10:46:25,8.28,32.0
03-02-2023 10.27,03-02-2023 10.48,2023-02-03 10:56:18,,47.0
07-06-2024 09.14,07-06-2024 09.41,2024-06-07 09:52:46,27.73,37.0
16-03-2023 10.08,16-03-2023 10.28,2023-03-16 10:41:45,20.93,37.0
22-06-2024 10.12,22-06-2024 10.36,2024-06-22 10:45:40,24.87,23.0
2024/01/16 11:50:00,16-01-2024 12.14,2024-01-16 12:30:32,24.5,23.0
28-04-2023 09.23,28-04-2023 09.41,2023-04-28 09:53:40,,43.0
07-08-2023 15.41,07-08-2023 15.44,2023-08-07 15:45:00,3.0,25.0
07-08-2023 09.58,07-08-2023 10.09,2023-08-07 10:16:28,11.76,15.0
12-01-2023 09.57,12-01-2023 10.06,2023-01-12 10:20:20,9.33,17.0
2023/08/24 14:45:00,24-08-2023 15.06,2023-08-24 15:19:06,21.0,18.0
15-06-2023 11.05,15-06-2023 11.21,2023-06-15 11:30:11,16.06,39.0
07-06-2023 14.16,07-06-2023 14.33,2023-06-07 14:44:56,17.16,14.0
2024/01/18 13:03:00,18-01-2024 13.27,2024-01-18 13:44:33,24.29,27.0
2023/07/22 11:05:00,22-07-2023 11.26,2023-07-22 11:35:37,21.63,27.0
13-05-2024 14.53,13-05-2024 15.15,2024-05-13 15:26:28,22.16,31.0
01-05-2023 10.03,01-05-2023 10.30,2023-05-01 10:49:47,26.29,10.0
28-11-2024 10.44,28-11-2024 11.04,2024-11-28 11:16:45,21.0,22.0
18-03-2024 14.02,18-03-2024 14.26,2024-03-18 14:38:45,24.43,43.0
25-12-2023 10.51,25-12-2023 11.10,2023-12-25 11:36:42,19.25,40.0
25-02-2023 12.59,25-02-2023 12.59,2023-02-25 13:00:00,0.0,12.0
2023/10/10 11:42:00,10-10-2023 12.20,2023-10-10 12:24:44,38.3,57.0
2024/06/05 11:13:00,05-06-2024 11.39,2024-06-05 11:48:32,26.03,34.0
2023/04/08 13:00:00,08-04-2023 13.01,2023-04-08 13:02:00,1.0,46.0
2023/03/06 15:14:00,06-03-2023 15.28,2023-03-06 15:38:23,14.52,18.0
27-03-2024 13.53,27-03-2024 14.22,2024-03-27 14:36:12,29.34,54.0
14-12-2023 14.13,14-12-2023 14.23,2023-12-14 14:35:19,10.97,221.0
05-06-2023 14.16,05-06-2023 14.39,2023-06-05 14:51:39,23.2,32.0
19-12-2023 13.23,19-12-2023 13.56,2023-12-19 14:08:06,33.68,46.0
08-02-2023 12.43,08-02-2023 12.56,2023-02-08 13:13:40,13.43,40.0
15-08-2023 14.32,15-08-2023 15.08,2023-08-15 15:16:41,35.61,
01-09-2023 13.35,01-09-2023 14.02,2023-09-01 14:13:15,27.26,50.0
26-06-2023 14.43,26-06-2023 15.23,2023-06-26 15:34:40,40.15,55.0
19-08-2024 11.59,19-08-2024 12.26,2024-08-19 12:31:08,,29.0
19-09-2023 14.44,19-09-2023 15.44,2023-09-19 15:45:00,60.0,48.0
05-09-2023 12.46,05-09-2023 12.54,2023-09-05 13:00:12,8.04,40.0
17-01-2024 10.06,17-01-2024 10.26,2024-01-17 10:41:38,20.0,28.0
2023/04/22 13:00:00,22-04-2023 13.01,2023-04-22 13:02:00,1.0,42.0
2023/04/13 13:40:00,13-04-2023 14.10,2023-04-13 14:20:33,30.54,53.0
14-02-2023 13.45,14-02-2023 13.53,2023-02-14 14:03:22,8.22,25.0
29-02-2024 15.43,29-02-2024 15.44,2024-02-29 15:45:00,1.0,25.0
06-05-2024 12.37,06-05-2024 13.01,2024-05-06 13:10:02,24.87,30.0
01-02-2023 10.16,01-02-2023 10.40,2023-02-01 10:50:46,24.82,58.0
2023/08/18 09:07:00,18-08-2023 09.39,2023-08-18 09:47:18,32.25,46.0
22-02-2023 11.21,22-02-2023 11.32,2023-02-22 11:42:42,11.57,
10-07-2024 11.21,10-07-2024 11.29,2024-07-10 11:40:59,8.48,13.0
12-09-2024 09.16,12-09-2024 09.38,2024-09-12 09:52:49,22.98,12.0
21-06-2024 13.14,21-06-2024 13.43,2024-06-21 13:58:40,29.41,36.0
2024/06/25 14:19:00,25-06-2024 14.40,2024-06-25 14:53:32,21.24,43.0
22-12-2023 09.23,22-12-2023 10.00,2023-12-22 10:03:39,37.33,53.0
10-05-2023 12.22,10-05-2023 12.25,2023-05-10 12:32:52,3.58,40.0
03-02-2023 11.04,03-02-2023 11.31,2023-02-03 11:43:48,27.53,32.0
24-05-2024 14.17,24-05-2024 14.35,2024-05-24 14:46:55,,41.0
2023/04/06 11:00:00,06-04-2023 11.18,2023-04-06 11:32:54,18.89,25.0
2023/07/18 12:18:00,18-07-2023 12.46,2023-07-18 12:56:38,28.3,33.0
29-05-2024 15.00,29-05-2024 15.16,2024-05-29 15:23:03,16.81,17.0
01-02-2023 14.16,01-02-2023 14.44,2023-02-01 15:02:41,28.28,32.0
05-09-2024 10.54,05-09-2024 11.21,2024-09-05 11:37:58,27.42,29.0
04-05-2024 12.44,04-05-2024 12.59,2024-05-04 13:00:00,15.0,41.0
2023/07/04 13:51:00,04-07-2023 13.58,2023-07-04 14:03:33,7.21,25.0
14-06-2023 13.36,14-06-2023 13.59,2023-06-14 14:08:38,23.64,38.0
05-03-2024 14.03,05-03-2024 14.23,2024-03-05 14:34:42,19.77,
2024/08/14 10:26:00,14-08-2024 10.50,2024-08-14 10:59:29,24.44,32.0
20-01-2023 09.03,20-01-2023 09.21,2023-01-20 09:33:47,18.1,20.0
27-09-2023 13.54,27-09-2023 14.15,2023-09-27 14:24:45,21.29,44.0
06-03-2023 11.14,06-03-2023 11.29,2023-03-06 11:45:22,15.06,40.0
03-10-2024 14.05,03-10-2024 14.23,2024-10-03 14:35:45,18.51,41.0
01-04-2023 13.00,01-04-2023 13.01,2023-04-01 13:02:00,1.0,31.0
18-02-2023 09.26,18-02-2023 09.33,2023-02-18 09:39:27,7.7,5.0
2023/06/05 12:51:00,05-06-2023 13.10,2023-06-05 13:27:25,19.15,17.0
2024/05/07 15:34:00,07-05-2024 15.44,2024-05-07 15:45:00,10.0,25.0
09-03-2023 13.57,09-03-2023 14.08,2023-03-09 14:23:12,11.41,25.0
18-03-2024 14.41,18-03-2024 15.01,2024-03-18 15:17:04,20.98,32.0
25-05-2024 13.00,25-05-2024 13.01,2024-05-25 13:02:00,1.0,17.0
2024/11/23 10:11:00,23-11-2024 10.43,2024-11-23 10:59:24,32.24,37.0
26-08-2023 13.00,26-08-2023 13.01,2023-08-26 13:02:00,1.0,25.0
25-07-2023 11.29,25-07-2023 11.45,2023-07-25 11:56:39,,25.0
11-01-2023 14.12,11-01-2023 14.28,2023-01-11 14:42:13,16.61,41.0
11-09-2023 12.32,11-09-2023 12.36,2023-09-11 12:39:38,4.66,40.0
03-06-2023 11.46,03-06-2023 12.02,2023-06-03 12:14:46,16.09,26.0
19-01-2024 12.45,19-01-2024 13.12,2024-01-19 13:23:16,27.13,23.0
07-09-2024 9.00,07-09-2024 09.06,2024-09-07 09:12:09,6.79,13.0
2024/05/16 10:09:00,16-05-2024 10.37,2024-05-16 10:46:31,28.04,38.0
2024/02/24 12:58:00,24-02-2024 12.59,2024-02-24 13:00:00,1.0,36.0
06-06-2024 14.09,06-06-2024 14.22,2024-06-06 14:36:17,13.22,29.0
04-10-2024 10.30,04-10-2024 10.40,2024-10-04 10:47:56,10.87,32.0
08-08-2024 14.50,08-08-2024 15.15,2024-08-08 15:25:34,25.18,48.0
2024/06/06 11:23:00,06-06-2024 11.45,2024-06-06 12:05:31,22.02,34.0
30-11-2024 11.25,30-11-2024 11.37,2024-11-30 11:48:56,12.94,11.0
2023/12/02 12:07:00,02-12-2023 12.23,2023-12-02 12:33:58,16.78,28.0
20-09-2023 12.36,20-09-2023 12.55,2023-09-20 13:02:16,19.86,31.0
2024/06/13 12:24:00,13-06-2024 12.42,2024-06-13 12:53:44,17.54,38.0
07-02-2023 13.01,07-02-2023 13.13,2023-02-07 13:16:04,12.38,12.0
17-10-2023 12.22,17-10-2023 12.38,2023-10-17 12:40:41,16.27,32.0
09-10-2023 13.23,09-10-2023 13.53,2023-10-09 14:02:21,30.59,54.0
31-01-2023 12.10,31-01-2023 12.33,2023-01-31 12:46:31,23.1,
03-09-2024 11.44,03-09-2024 12.09,2024-09-03 12:23:40,25.14,32.0
28-11-2023 12.23,28-11-2023 12.45,2023-11-28 12:56:37,22.75,35.0
06-06-2023 13.46,06-06-2023 13.54,2023-06-06 14:05:22,8.23,25.0
20-08-2024 14.39,20-08-2024 14.53,2024-08-20 15:14:47,14.4,15.0
11-01-2024 15.34,11-01-2024 15.39,2024-01-11 15:45:00,5.88,25.0
25-11-2023 11.36,25-11-2023 11.55,2023-11-25 12:14:02,19.85,21.0
2024/02/13 15:45:00,13-02-2024 15.46,2024-02-13 15:47:00,1.0,25.0
10-02-2023 10.16,10-02-2023 10.31,2023-02-10 10:48:45,15.72,32.0
10-02-2023 12.32,10-02-2023 12.33,2023-02-10 12:47:03,1.0,3.0
2024/06/25 12:11:00,25-06-2024 12.29,2024-06-25 12:37:43,18.14,15.0
2023/04/10 09:28:00,10-04-2023 09.53,2023-04-10 10:00:09,25.66,29.0
23-10-2024 11.19,23-10-2024 11.47,2024-10-23 11:58:33,27.93,70.0
2023/06/01 09:44:00,01-06-2023 10.03,2023-06-01 10:09:46,19.95,34.0
25-07-2024 12.04,25-07-2024 12.26,2024-07-25 12:36:35,22.72,24.0
12-08-2023 11.32,12-08-2023 11.56,2023-08-12 12:09:16,24.83,34.0
22-07-2024 15.16,22-07-2024 15.40,2024-07-22 15:45:00,24.02,47.0
28-03-2024 10.55,28-03-2024 11.03,2024-03-28 11:16:13,8.85,32.0
08-09-2023 11.12,08-09-2023 11.38,2023-09-08 11:46:30,26.52,33.0
,03-04-2023 15.44,2023-04-03 15:45:00,9.0,25.0
10-06-2023 13.00,10-06-2023 13.01,2023-06-10 13:02:00,1.0,36.0
15-08-2024 10.34,15-08-2024 10.54,2024-08-15 11:13:19,20.46,0.0
22-05-2023 12.16,22-05-2023 12.39,2023-05-22 12:48:47,23.27,48.0
30-06-2023 10.46,30-06-2023 11.09,2023-06-30 11:16:58,23.72,48.0
18-04-2024 10.45,18-04-2024 10.48,2024-04-18 10:55:46,3.8,32.0
02-02-2024 10.20,02-02-2024 10.44,2024-02-02 10:46:02,24.22,62.0
17-04-2024 9.24,17-04-2024 09.37,2024-04-17 09:52:28,13.33,12.0
09-07-2024 09.19,09-07-2024 09.59,2024-07-09 10:06:45,40.51,44.0
10-05-2024 09.40,10-05-2024 09.57,2024-05-10 10:05:05,17.69,31.0
20-03-2024 10.57,20-03-2024 11.21,2024-03-20 11:30:29,23.73,22.0
07-10-2024 10.02,07-10-2024 10.21,2024-10-07 10:37:18,19.43,26.0
2024/03/04 12:03:00,04-03-2024 12.20,2024-03-04 12:26:10,17.52,32.0
07-10-2024 15.21,07-10-2024 15.44,2024-10-07 15:45:00,23.0,50.0
2024/07/03 15:04:00,03-07-2024 15.20,2024-07-03 15:33:28,16.57,26.0
23-12-2023 13.00,23-12-2023 13.01,2023-12-23 13:02:00,1.0,25.0
29-11-2023 09.00,29-11-2023 09.24,2023-11-29 09:34:50,24.15,44.0
25-08-2023 10.15,25-08-2023 10.30,2023-08-25 10:38:06,15.05,23.0
26-08-2024 10.39,26-08-2024 11.07,2024-08-26 11:23:02,28.5,50.0
2024/06/27 12:55:00,27-06-2024 13.21,2024-06-27 13:30:03,26.83,22.0
2023/05/25 13:22:00,25-05-2023 13.33,2023-05-25 13:41:07,11.51,18.0
2024/11/12 15:43:00,12-11-2024 15.44,2024-11-12 15:45:00,1.0,47.0
06-06-2023 12.05,06-06-2023 12.28,2023-06-06 12:37:59,23.39,45.0
31-05-2024 10.54,31-05-2024 11.23,2024-05-31 11:35:53,29.66,42.0
01-11-2023 14.57,01-11-2023 15.16,2023-11-01 15:26:37,19.53,44.0
31-10-2023 12.00,31-10-2023 12.27,2023-10-31 12:32:22,,29.0
08-10-2024 14.19,08-10-2024 14.53,2024-10-08 14:58:46,34.15,47.0
23-06-2023 14.36,23-06-2023 15.08,2023-06-23 15:20:52,32.05,31.0
09-08-2023 12.44,09-08-2023 13.06,2023-08-09 13:17:05,22.13,34.0
2024/09/18 10:50:00,18-09-2024 11.08,2024-09-18 11:37:27,18.88,40.0
01-10-2024 11.38,01-10-2024 12.02,2024-10-01 12:16:43,25.0,31.0
21-03-2023 15.25,21-03-2023 15.44,2023-03-21 15:45:00,19.0,40.0
06-04-2023 10.48,06-04-2023 11.01,2023-04-06 11:16:44,13.75,33.0
13-01-2024 11.33,13-01-2024 11.55,2024-01-13 12:07:51,22.22,56.0
21-02-2024 13.29,21-02-2024 13.53,2024-02-21 14:02:49,24.27,43.0
31-10-2024 13.38,31-10-2024 13.55,2024-10-31 14:15:55,17.49,28.0
07-08-2023 13.26,07-08-2023 13.41,2023-08-07 13:50:38,15.22,37.0
03-07-2023 12.10,03-07-2023 12.35,2023-07-03 12:46:21,25.68,37.0
2024/11/19 14:56:00,19-11-2024 15.15,2024-11-19 15:27:09,19.41,41.0
13-04-2023 10.21,13-04-2023 10.31,2023-04-13 10:36:41,10.05,32.0
21-11-2023 11.48,21-11-2023 12.11,2023-11-21 12:16:14,23.57,41.0
28-09-2023 09.14,28-09-2023 09.40,2023-09-28 09:54:00,26.64,56.0
01-02-2024 11.19,01-02-2024 11.46,2024-02-01 11:57:18,27.03,30.0
18-10-2023 11.39,18-10-2023 12.04,2023-10-18 12:12:43,25.85,60.0
25-06-2024 09.32,25-06-2024 09.50,2024-06-25 10:08:05,18.1,45.0
10-11-2023 12.02,10-11-2023 12.20,2023-11-10 12:31:13,18.66,29.0
11-11-2023 12.06,11-11-2023 12.38,2023-11-11 12:57:37,32.9,54.0
02-12-2023 09.29,02-12-2023 09.58,2023-12-02 10:10:36,29.88,36.0
02-10-2023 10.17,02-10-2023 10.37,2023-10-02 10:52:19,20.23,33.0
2024/10/14 15:33:00,14-10-2024 15.44,2024-10-14 15:45:00,11.0,50.0
11-01-2024 09.52,11-01-2024 10.11,2024-01-11 10:33:23,19.93,26.0
16-08-2024 14.25,16-08-2024 14.40,2024-08-16 14:55:17,15.79,17.0
2024/01/04 12:39:00,04-01-2024 12.58,2024-01-04 13:10:50,19.36,35.0
27-04-2024 09.42,27-04-2024 10.04,2024-04-27 10:13:21,22.77,36.0
13-05-2024 09.25,13-05-2024 09.48,2024-05-13 09:58:04,23.23,31.0
2024/09/03 14:24:00,03-09-2024 14.48,2024-09-03 14:56:27,24.93,48.0
15-11-2023 09.39,15-11-2023 10.05,2023-11-15 10:17:53,26.83,46.0
11-09-2024 09.30,11-09-2024 09.44,2024-09-11 09:58:59,14.28,27.0
,05-02-2024 10.44,2024-02-05 10:52:40,21.93,45.0
16-03-2023 13.34,16-03-2023 13.51,2023-03-16 13:59:02,17.54,28.0
21-06-2023 09.34,21-06-2023 09.55,2023-06-21 10:06:28,21.63,40.0
22-12-2023 10.04,22-12-2023 10.17,2023-12-22 10:23:25,13.09,11.0
13-07-2023 12.39,13-07-2023 12.54,2023-07-13 13:03:39,15.04,40.0
31-07-2023 12.05,31-07-2023 12.27,2023-07-31 12:34:28,22.29,31.0
11-02-2023 12.17,11-02-2023 12.33,2023-02-11 12:37:11,16.69,23.0
29-11-2023 13.18,29-11-2023 13.40,2023-11-29 13:51:28,22.86,35.0
08-03-2023 11.21,08-03-2023 11.40,2023-03-08 11:57:28,19.02,47.0
29-08-2023 10.25,29-08-2023 10.49,2023-08-29 11:02:39,24.71,34.0
2024/08/26 13:23:00,26-08-2024 13.42,2024-08-26 13:55:12,19.84,32.0
19-08-2023 13.00,19-08-2023 13.01,2023-08-19 13:02:00,1.0,24.0
06-11-2023 09.00,06-11-2023 09.33,2023-11-06 09:36:34,33.9,56.0
13-06-2024 15.42,13-06-2024 15.44,2024-06-13 15:45:00,2.0,27.0
06-03-2023 11.23,06-03-2023 11.49,2023-03-06 11:56:37,26.63,33.0
04-06-2024 12.58,04-06-2024 13.33,2024-06-04 13:44:43,35.05,49.0
22-06-2024 10.02,22-06-2024 10.24,2024-06-22 10:37:07,22.13,34.0
09-05-2023 09.19,09-05-2023 09.43,2023-05-09 09:55:02,24.6,21.0
2023/12/07 14:36:00,07-12-2023 14.58,2023-12-07 15:14:30,22.98,25.0
2023/01/10 10:34:00,10-01-2023 10.48,2023-01-10 11:01:01,14.69,14.0
06-01-2024 09.09,06-01-2024 09.24,2024-01-06 09:42:18,15.84,27.0
14-09-2024 11.56,14-09-2024 12.21,2024-09-14 12:22:29,25.49,31.0
31-10-2023 14.19,31-10-2023 14.48,2023-10-31 14:56:17,29.56,62.0
07-02-2023 12.41,07-02-2023 12.50,2023-02-07 12:59:53,9.48,40.0
11-11-2024 14.18,11-11-2024 14.40,2024-11-11 14:57:04,22.03,27.0
2023/06/13 10:17:00,13-06-2023 10.24,2023-06-13 10:32:01,7.92,32.0
25-05-2024 12.41,25-05-2024 12.59,2024-05-25 13:00:00,18.0,20.0
2024/05/06 14:38:00,06-05-2024 14.56,2024-05-06 15:12:56,18.45,15.0
03-02-2023 11.43,03-02-2023 12.19,2023-02-03 12:27:17,36.63,35.0
2023/08/07 10:36:00,07-08-2023 10.57,2023-08-07 11:00:46,21.56,37.0
09-04-2024 11.59,09-04-2024 12.24,2024-04-09 12:36:06,25.14,29.0
16-05-2024 12.12,16-05-2024 12.45,2024-05-16 12:47:40,33.93,44.0
27-04-2024 13.00,27-04-2024 13.01,2024-04-27 13:02:00,1.0,21.0
2024/11/27 12:12:00,27-11-2024 12.36,2024-11-27 12:47:06,24.39,35.0
01-09-2023 11.21,01-09-2023 11.48,2023-09-01 11:55:25,27.19,64.0
2023/08/01 11:00:00,01-08-2023 11.17,2023-08-01 11:29:12,17.53,125.0
17-08-2023 10.27,17-08-2023 10.54,2023-08-17 11:07:10,27.69,40.0
2023/02/28 11:08:00,28-02-2023 11.31,2023-02-28 11:44:41,22.59,34.0
15-04-2023 10.19,15-04-2023 10.27,2023-04-15 10:36:58,,32.0
07-10-2023 10.13,07-10-2023 10.48,2023-10-07 11:01:14,35.65,38.0
2024/05/28 15:22:00,28-05-2024 15.44,2024-05-28 15:45:00,22.39,47.0
08-10-2024 12.18,08-10-2024 12.29,2024-10-08 12:43:45,11.53,40.0
02-05-2024 12.34,02-05-2024 12.48,2024-05-02 13:07:54,14.99,40.0
20-01-2023 12.34,20-01-2023 12.53,2023-01-20 13:01:29,19.8,31.0
08-07-2024 10.14,08-07-2024 10.30,2024-07-08 10:38:22,16.7,24.0
05-07-2024 12.19,05-07-2024 12.39,2024-07-05 12:43:16,19.98,43.0
15-06-2023 11.56,15-06-2023 12.12,2023-06-15 12:24:28,16.0,25.0
12-07-2024 14.18,12-07-2024 14.38,2024-07-12 14:50:46,20.07,32.0
2024/01/08 14:06:00,08-01-2024 14.26,2024-01-08 14:36:19,20.53,44.0
,18-06-2024 09.54,2024-06-18 09:57:31,37.73,52.0
08-10-2024 15.18,08-10-2024 15.41,2024-10-08 15:45:00,23.68,47.0
24-04-2024 12.32,24-04-2024 13.06,2024-04-24 13:17:07,34.76,44.0
19-06-2023 10.27,19-06-2023 11.03,2023-06-19 11:13:44,36.68,33.0
01-11-2023 10.22,01-11-2023 10.32,2023-11-01 10:45:04,10.87,21.0
06-11-2023 12.38,06-11-2023 13.05,2023-11-06 13:18:27,27.73,41.0
2024/07/19 12:01:00,19-07-2024 12.26,2024-07-19 12:39:34,25.0,43.0
2023/06/06 09:33:00,06-06-2023 10.04,2023-06-06 10:05:27,31.47,55.0
06-12-2023 11.34,06-12-2023 12.07,2023-12-06 12:20:40,33.81,39.0
11-02-2023 10.14,11-02-2023 10.41,2023-02-11 10:51:21,27.2,45.0
23-08-2024 15.17,23-08-2024 15.44,2024-08-23 15:45:00,27.0,48.0
28-06-2024 12.05,28-06-2024 12.21,2024-06-28 12:32:13,16.23,23.0
20-05-2023 09.26,20-05-2023 09.58,2023-05-20 10:07:54,32.24,46.0
29-03-2023 10.08,29-03-2023 10.17,2023-03-29 10:29:56,9.06,32.0
04-09-2023 12.46,04-09-2023 12.52,2023-09-04 13:04:21,6.3,13.0
07-01-2023 13.00,07-01-2023 13.01,2023-01-07 13:02:00,1.0,53.0
15-04-2023 12.32,15-04-2023 12.59,2023-04-15 13:00:00,27.0,33.0
12-08-2024 14.38,12-08-2024 15.11,2024-08-12 15:26:05,33.62,42.0
25-10-2024 11.56,25-10-2024 12.13,2024-10-25 12:19:55,17.41,21.0
07-03-2024 13.19,07-03-2024 13.36,2024-03-07 13:45:07,17.86,37.0
28-05-2024 9.33,28-05-2024 10.11,2024-05-28 10:20:37,38.02,44.0
12-05-2023 10.31,12-05-2023 10.44,2023-05-12 10:57:41,13.32,32.0
24-07-2023 15.33,24-07-2023 15.44,2023-07-24 15:45:00,11.0,39.0
01-12-2023 13.57,01-12-2023 14.19,2023-12-01 14:29:45,22.09,27.0
20-01-2023 10.23,20-01-2023 10.32,2023-01-20 10:42:18,9.13,0.0
05-10-2023 13.25,05-10-2023 13.48,2023-10-05 13:57:54,23.87,
2023/09/27 10:05:00,27-09-2023 10.28,2023-09-27 10:46:11,23.41,24.0
2024/01/12 11:39:00,12-01-2024 12.00,2024-01-12 12:09:47,21.72,24.0
02-06-2023 11.31,02-06-2023 12.02,2023-06-02 12:11:59,31.07,35.0
28-03-2023 14.22,28-03-2023 14.50,2023-03-28 15:01:20,28.48,26.0
08-09-2023 10.29,08-09-2023 11.04,2023-09-08 11:18:17,35.39,38.0
2024/05/17 09:09:00,17-05-2024 09.32,2024-05-17 09:46:07,23.82,35.0
16-04-2024 11.09,16-04-2024 11.28,2024-04-16 11:32:54,19.49,40.0
2023/12/08 09:25:00,08-12-2023 09.58,2023-12-08 10:07:23,33.71,46.0
17-07-2023 10.19,17-07-2023 10.56,2023-07-17 11:09:48,37.26,34.0
23-03-2024 13.00,23-03-2024 13.01,2024-03-23 13:02:00,1.0,35.0
18-05-2024 13.00,18-05-2024 13.01,2024-05-18 13:02:00,1.0,25.0
17-05-2024 10.24,17-05-2024 10.55,2024-05-17 11:10:22,31.68,31.0
30-08-2024 10.00,30-08-2024 10.17,2024-08-30 10:25:21,17.68,40.0
12-03-2024 10.31,12-03-2024 10.32,2024-03-12 10:35:56,1.63,32.0
24-10-2023 11.42,24-10-2023 11.49,2023-10-24 11:52:23,7.06,2.0
2024/02/09 12:17:00,09-02-2024 12.39,2024-02-09 12:49:41,22.19,59.0
11-12-2023 14.00,11-12-2023 14.23,2023-12-11 14:27:18,23.02,36.0
01-05-2024 15.23,01-05-2024 15.44,2024-05-01 15:45:00,20.37,41.0
24-02-2024 11.46,24-02-2024 12.02,2024-02-24 12:10:07,16.51,28.0
27-07-2023 12.43,27-07-2023 13.04,2023-07-27 13:14:57,21.45,0.0
01-10-2024 14.22,01-10-2024 14.35,2024-10-01 14:53:03,13.42,36.0
2023/05/25 11:53:00,25-05-2023 12.23,2023-05-25 12:33:35,30.92,47.0
23-08-2024 09.27,23-08-2024 09.46,2024-08-23 09:57:27,19.46,47.0
06-12-2023 12.35,06-12-2023 12.59,2023-12-06 13:05:26,,37.0
07-03-2024 10.52,07-03-2024 11.20,2024-03-07 11:37:08,28.07,34.0
29-02-2024 10.29,29-02-2024 10.51,2024-02-29 11:07:43,22.49,32.0
16-02-2023 12.03,16-02-2023 12.33,2023-02-16 12:43:30,30.82,35.0
22-03-2024 12.16,22-03-2024 12.34,2024-03-22 12:44:46,18.52,33.0
19-05-2023 09.16,19-05-2023 09.40,2023-05-19 09:57:29,24.38,38.0
2024/10/08 12:26:00,08-10-2024 12.39,2024-10-08 12:49:32,13.18,40.0
2023/01/23 14:36:00,23-01-2023 14.47,2023-01-23 14:58:08,11.02,32.0
2024/06/14 11:13:00,14-06-2024 11.45,2024-06-14 11:52:41,32.01,43.0
19-09-2024 10.24,19-09-2024 10.34,2024-09-19 10:46:27,10.32,32.0
19-08-2023 13.00,19-08-2023 13.01,2023-08-19 13:02:00,1.0,49.0
2023/05/19 09:14:00,19-05-2023 09.19,2023-05-19 09:28:13,5.35,10.0
08-05-2024 09.54,08-05-2024 10.15,2024-05-08 10:32:51,20.83,10.0
26-01-2023 15.02,26-01-2023 15.22,2023-01-26 15:31:03,20.41,44.0
2024/10/30 10:36:00,30-10-2024 10.52,2024-10-30 11:02:53,16.3,14.0
06-09-2024 14.19,06-09-2024 14.32,2024-09-06 14:41:33,13.74,17.0
24-11-2023 09.09,24-11-2023 09.20,2023-11-24 09:28:10,11.32,20.0
2023/11/06 14:42:00,06-11-2023 15.07,2023-11-06 15:18:34,25.54,52.0
20-06-2024 09.54,20-06-2024 10.21,2024-06-20 10:30:08,27.97,26.0
26-04-2023 09.04,26-04-2023 09.28,2023-04-26 09:34:05,24.22,38.0
26-07-2023 11.17,26-07-2023 11.30,2023-07-26 11:37:52,13.89,43.0
10-01-2023 13.12,10-01-2023 13.35,2023-01-10 13:46:34,23.54,28.0
10-04-2023 12.22,10-04-2023 12.42,2023-04-10 12:51:19,20.33,33.0
08-04-2024 13.57,08-04-2024 14.12,2024-04-08 14:21:35,15.85,32.0
2024/07/13 11:51:00,13-07-2024 12.06,2024-07-13 12:12:26,15.73,15.0
03-11-2023 14.56,03-11-2023 15.12,2023-11-03 15:32:58,16.07,14.0
16-03-2023 13.31,16-03-2023 13.53,2023-03-16 14:08:46,22.56,27.0
2023/11/14 12:01:00,14-11-2023 12.27,2023-11-14 12:37:41,26.54,41.0
18-06-2024 12.57,18-06-2024 13.21,2024-06-18 13:27:41,24.0,32.0
07-12-2023 13.45,07-12-2023 14.02,2023-12-07 14:16:22,17.52,26.0
09-08-2023 12.56,09-08-2023 13.13,2023-08-09 13:27:10,17.58,41.0
22-03-2024 09.47,22-03-2024 09.57,2024-03-22 10:03:49,10.48,18.0
02-10-2024 10.23,02-10-2024 10.44,2024-10-02 10:55:24,21.03,58.0
16-11-2023 14.52,16-11-2023 15.24,2023-11-16 15:28:40,32.18,58.0
07-05-2024 15.43,07-05-2024 15.44,2024-05-07 15:45:00,1.0,35.0
26-01-2024 15.43,26-01-2024 15.44,2024-01-26 15:45:00,1.0,25.0
10-09-2024 14.16,10-09-2024 14.28,2024-09-10 14:43:28,12.78,17.0
14-10-2023 12.04,14-10-2023 12.32,2023-10-14 12:45:11,28.31,32.0
15-04-2023 09.00,15-04-2023 09.22,2023-04-15 09:33:57,22.24,28.0
24-01-2023 10.22,24-01-2023 10.35,2023-01-24 10:50:51,12.53,0.0
17-10-2024 11.34,17-10-2024 11.48,2024-10-17 11:58:42,14.59,29.0
01-10-2024 13.41,01-10-2024 14.04,2024-10-01 14:15:08,23.3,17.0
05-11-2024 12.53,05-11-2024 13.24,2024-11-05 13:33:42,31.02,49.0
10-10-2023 09.24,10-10-2023 10.05,2023-10-10 10:11:19,41.6,43.0
2024/05/22 12:34:00,22-05-2024 12.45,2024-05-22 12:57:56,11.99,40.0
06-07-2024 12.38,06-07-2024 12.49,2024-07-06 13:00:00,11.04,40.0
2024/03/23 10:51:00,23-03-2024 11.06,2024-03-23 11:14:23,15.03,42.0
2024/06/03 15:20:00,03-06-2024 15.44,2024-06-03 15:45:00,24.0,50.0
31-10-2023 12.01,31-10-2023 12.39,2023-10-31 12:43:36,38.81,44.0
29-11-2024 12.52,29-11-2024 13.09,2024-11-29 13:20:08,16.14,24.0
2024/08/03 13:00:00,03-08-2024 13.01,2024-08-03 13:02:00,1.0,27.0
05-05-2023 09.59,05-05-2023 10.11,2023-05-05 10:13:42,12.27,32.0
18-02-2023 13.00,18-02-2023 13.01,2023-02-18 13:02:00,1.0,25.0
,25-01-2024 13.18,2024-01-25 13:27:01,12.22,18.0
19-05-2023 09.26,19-05-2023 09.45,2023-05-19 10:07:28,19.32,30.0
07-03-2023 13.37,07-03-2023 13.55,2023-03-07 14:05:43,18.55,29.0
14-04-2023 12.48,14-04-2023 12.57,2023-04-14 13:05:15,9.65,32.0
2023/08/03 09:20:00,03-08-2023 09.41,2023-08-03 09:52:20,21.79,37.0
2024/05/30 13:39:00,30-05-2024 13.55,2024-05-30 13:58:50,16.33,20.0
04-09-2023 13.07,04-09-2023 13.25,2023-09-04 13:35:00,18.46,45.0
25-09-2024 12.47,25-09-2024 13.03,2024-09-25 13:12:11,16.63,45.0
27-03-2023 12.26,27-03-2023 12.49,2023-03-27 13:01:48,23.14,37.0
2023/02/21 12:54:00,21-02-2023 13.22,2023-02-21 13:32:15,28.98,31.0
09-01-2023 15.34,09-01-2023 15.44,2023-01-09 15:45:00,10.0,25.0
2023/11/22 12:33:00,22-11-2023 12.44,2023-11-22 12:55:45,11.69,40.0
2023/08/30 10:44:00,30-08-2023 11.16,2023-08-30 11:29:38,32.81,19.0
07-03-2023 12.23,07-03-2023 12.27,2023-03-07 12:33:59,4.88,32.0
27-11-2023 09.31,27-11-2023 09.57,2023-11-27 10:08:13,26.97,52.0
2024/11/26 09:44:00,26-11-2024 10.02,2024-11-26 10:15:37,18.73,38.0
05-01-2023 09.01,05-01-2023 09.26,2023-01-05 09:33:42,25.88,38.0
28-10-2023 10.24,28-10-2023 11.12,2023-10-28 11:19:51,48.69,22.0
2023/04/18 13:28:00,18-04-2023 13.54,2023-04-18 14:06:54,26.9,50.0
09-01-2024 12.15,09-01-2024 12.48,2024-01-09 13:01:19,33.86,45.0
25-11-2024 14.37,25-11-2024 14.49,2024-11-25 15:10:26,12.29,15.0
28-06-2023 15.33,28-06-2023 15.44,2023-06-28 15:45:00,11.0,25.0
02-11-2023 10.15,02-11-2023 10.33,2023-11-02 10:42:23,19.0,26.0
2023/12/07 10:42:00,07-12-2023 11.10,2023-12-07 11:28:50,28.78,40.0
27-02-2023 09.59,27-02-2023 10.33,2023-02-27 10:43:40,34.23,25.0
09-04-2024 14.03,09-04-2024 14.19,2024-04-09 14:30:43,16.63,25.0
02-03-2023 14.17,02-03-2023 14.22,2023-03-02 14:29:34,5.19,221.0
2023/01/06 14:24:00,06-01-2023 14.38,2023-01-06 14:52:01,14.64,31.0
29-01-2024 09.13,29-01-2024 09.36,2024-01-29 09:59:32,23.32,30.0
2023/08/14 13:56:00,14-08-2023 14.23,2023-08-14 14:28:31,27.1,37.0
21-08-2023 9.17,21-08-2023 09.49,2023-08-21 09:50:59,32.99,54.0
2023/05/12 10:05:00,12-05-2023 10.14,2023-05-12 10:25:50,9.33,21.0
2023/04/18 12:26:00,18-04-2023 12.46,2023-04-18 12:55:20,20.98,29.0
2023/05/24 10:46:00,24-05-2023 10.54,2023-05-24 11:06:36,8.91,32.0
2024/06/12 11:20:00,12-06-2024 11.42,2024-06-12 11:49:23,22.53,30.0
10-01-2024 10.24,10-01-2024 10.37,2024-01-10 10:50:56,13.31,32.0
04-09-2023 14.38,04-09-2023 15.01,2023-09-04 15:13:07,23.53,36.0
16-04-2024 14.44,16-04-2024 15.07,2024-04-16 15:16:49,23.33,36.0
,30-10-2023 14.36,2023-10-30 14:57:12,17.28,17.0
20-09-2024 10.42,20-09-2024 10.57,2024-09-20 10:58:28,15.15,24.0
2023/02/08 13:05:00,08-02-2023 13.25,2023-02-08 13:34:46,20.01,34.0
2023/04/22 12:11:00,22-04-2023 12.28,2023-04-22 12:37:46,17.89,29.0
13-12-2023 15.28,13-12-2023 15.44,2023-12-13 15:45:00,16.0,43.0
06-01-2024 11.45,06-01-2024 12.02,2024-01-06 12:13:26,17.76,34.0
19-04-2023 12.15,19-04-2023 12.25,2023-04-19 12:31:48,10.2,25.0
10-06-2023 10.15,10-06-2023 10.34,2023-06-10 10:35:31,19.52,18.0
04-05-2024 09.35,04-05-2024 09.58,2024-05-04 10:09:32,23.27,63.0
02-05-2024 11.04,02-05-2024 11.26,2024-05-02 11:42:26,22.5,25.0
26-04-2023 14.39,26-04-2023 15.07,2023-04-26 15:09:57,28.32,47.0
04-07-2024 13.49,04-07-2024 14.10,2024-07-04 14:27:22,21.38,25.0
18-11-2024 15.45,18-11-2024 15.46,2024-11-18 15:47:00,1.0,25.0
17-09-2024 14.29,17-09-2024 14.53,2024-09-17 15:05:14,24.14,54.0
2023/07/07 11:48:00,07-07-2023 12.05,2023-07-07 12:17:03,17.42,20.0
03-04-2024 12.31,03-04-2024 12.43,2024-04-03 12:56:15,12.86,40.0
24-08-2024 10.12,24-08-2024 10.31,2024-08-24 10:42:06,19.19,37.0
15-07-2024 11.44,15-07-2024 12.00,2024-07-15 12:10:39,16.06,47.0
07-09-2024 09.06,07-09-2024 09.31,2024-09-07 09:40:15,25.2,28.0
2023/05/25 13:24:00,25-05-2023 13.50,2023-05-25 14:00:14,26.45,32.0
17-06-2024 09.38,17-06-2024 09.57,2024-06-17 10:16:37,19.84,26.0
28-10-2024 09.49,28-10-2024 10.12,2024-10-28 10:17:29,23.17,51.0
2024/01/03 14:50:00,03-01-2024 15.11,2024-01-03 15:22:38,21.99,26.0
2023/02/04 13:00:00,04-02-2023 13.01,2023-02-04 13:02:00,1.0,43.0
07-09-2023 15.25,07-09-2023 15.44,2023-09-07 15:45:00,19.0,16.0
24-05-2023 12.43,24-05-2023 12.56,2023-05-24 13:08:25,13.63,14.0
03-02-2023 13.49,03-02-2023 14.05,2023-02-03 14:11:15,,27.0
11-05-2023 14.20,11-05-2023 14.27,2023-05-11 14:32:38,7.69,17.0
11-07-2024 13.57,11-07-2024 14.15,2024-07-11 14:35:17,18.67,17.0
14-01-2023 12.37,14-01-2023 12.42,2023-01-14 12:49:18,5.78,40.0
2023/06/20 12:06:00,20-06-2023 12.33,2023-06-20 12:51:36,26.37,24.0
11-05-2024 12.26,11-05-2024 12.31,2024-05-11 12:38:31,5.0,32.0
09-10-2023 11.05,09-10-2023 11.23,2023-10-09 11:34:15,18.59,39.0
12-03-2024 09.46,12-03-2024 10.01,2024-03-12 10:12:37,15.94,19.0
2024/09/04 12:39:00,04-09-2024 12.56,2024-09-04 13:10:49,17.05,22.0
19-01-2023 10.30,19-01-2023 10.36,2023-01-19 10:42:54,6.21,32.0
2023/02/02 09:47:00,02-02-2023 10.11,2023-02-02 10:23:52,24.53,35.0
2024/03/28 12:33:00,28-03-2024 12.36,2024-03-28 12:47:56,3.39,13.0
19-10-2024 10.40,19-10-2024 11.37,2024-10-19 11:50:23,57.45,32.0
19-07-2023 15.45,19-07-2023 15.46,2023-07-19 15:47:00,1.0,38.0
03-04-2023 11.14,03-04-2023 11.33,2023-04-03 11:45:33,18.53,31.0
15-08-2023 09.34,15-08-2023 10.10,2023-08-15 10:14:21,36.51,42.0
2024/06/11 11:02:00,11-06-2024 11.13,2024-06-11 11:30:00,11.51,33.0
25-03-2023 13.00,25-03-2023 13.01,2023-03-25 13:02:00,1.0,17.0
29-10-2024 11.54,29-10-2024 12.15,2024-10-29 12:22:35,21.41,36.0
19-12-2023 10.43,19-12-2023 11.03,2023-12-19 11:19:42,20.98,29.0
18-09-2023 11.16,18-09-2023 11.37,2023-09-18 11:53:29,21.06,40.0
27-12-2023 14.53,27-12-2023 15.21,2023-12-27 15:28:10,28.81,32.0
05-06-2023 12.04,05-06-2023 12.26,2023-06-05 12:35:10,22.82,30.0
12-10-2023 15.20,12-10-2023 15.44,2023-10-12 15:45:00,,34.0
23-05-2024 14.11,23-05-2024 14.23,2024-05-23 14:41:23,12.21,17.0
21-07-2023 14.26,21-07-2023 14.46,2023-07-21 14:53:30,20.16,37.0
15-12-2023 15.23,15-12-2023 15.33,2023-12-15 15:45:00,10.38,15.0
23-02-2024 10.30,23-02-2024 10.53,2024-02-23 11:05:02,23.97,37.0
2024/01/25 12:26:00,25-01-2024 12.30,2024-01-25 12:42:34,4.8,40.0
06-11-2023 12.21,06-11-2023 13.00,2023-11-06 13:15:12,39.09,45.0
04-09-2023 12.07,04-09-2023 12.34,2023-09-04 12:50:56,27.67,30.0
29-09-2023 14.11,29-09-2023 14.30,2023-09-29 14:47:14,19.57,17.0
21-07-2023 11.06,21-07-2023 11.27,2023-07-21 11:34:50,21.74,32.0
04-04-2023 14.08,04-04-2023 14.21,2023-04-04 14:35:00,13.56,25.0
15-08-2023 10.43,15-08-2023 11.00,2023-08-15 11:12:49,17.82,32.0
2024/01/16 12:27:00,16-01-2024 12.53,2024-01-16 13:04:34,26.53,35.0
01-02-2023 13.26,01-02-2023 13.57,2023-02-01 14:12:40,31.47,42.0
25-04-2024 11.01,25-04-2024 11.18,2024-04-25 11:28:15,17.96,30.0
14-10-2023 13.00,14-10-2023 13.01,2023-10-14 13:02:00,1.0,42.0
03-01-2024 14.38,03-01-2024 15.03,2024-01-03 15:15:39,25.87,45.0
25-10-2023 15.23,25-10-2023 15.44,2023-10-25 15:45:00,21.0,27.0
14-03-2023 12.00,14-03-2023 12.29,2023-03-14 12:42:47,29.26,43.0
17-02-2023 13.19,17-02-2023 13.44,2023-02-17 13:52:05,25.96,48.0
03-08-2024 10.30,03-08-2024 10.52,2024-08-03 11:04:35,,13.0
,19-10-2023 11.42,2023-10-19 11:52:12,23.87,25.0
2023/10/20 14:55:00,20-10-2023 15.23,2023-10-20 15:34:49,28.05,36.0
08-10-2024 10.02,08-10-2024 10.23,2024-10-08 10:34:07,20.25,30.0
2023/07/27 14:12:00,27-07-2023 14.34,2023-07-27 14:49:09,22.28,
06-05-2024 10.23,06-05-2024 10.49,2024-05-06 11:06:35,26.84,31.0
16-03-2023 10.43,16-03-2023 11.10,2023-03-16 11:22:14,27.86,29.0
2023/07/11 15:31:00,11-07-2023 15.44,2023-07-11 15:45:00,13.4,20.0
06-02-2024 09.48,06-02-2024 10.22,2024-02-06 10:32:52,34.3,46.0
06-02-2023 12.27,06-02-2023 12.28,2023-02-06 12:38:33,1.0,40.0
23-02-2023 11.52,23-02-2023 12.11,2023-02-23 12:23:14,19.12,11.0
30-03-2024 13.00,30-03-2024 13.01,2024-03-30 13:02:00,1.0,30.0
2024/07/29 13:28:00,29-07-2024 13.49,2024-07-29 13:56:09,20.87,38.0
31-01-2024 14.39,31-01-2024 14.57,2024-01-31 15:12:39,17.97,17.0
01-08-2024 10.59,01-08-2024 11.19,2024-08-01 11:29:05,19.95,49.0
18-03-2023 13.00,18-03-2023 13.01,2023-03-18 13:02:00,1.0,43.0
17-01-2024 09.40,17-01-2024 10.02,2024-01-17 10:14:11,22.88,35.0
2023/05/05 15:24:00,05-05-2023 15.44,2023-05-05 15:45:00,20.0,32.0
28-03-2023 12.17,28-03-2023 12.42,2023-03-28 12:50:39,25.9,
22-08-2023 11.21,22-08-2023 11.36,2023-08-22 11:44:59,15.67,37.0
2024/04/04 10:46:00,04-04-2024 11.02,2024-04-04 11:19:55,16.71,16.0
07-10-2023 13.00,07-10-2023 13.01,2023-10-07 13:02:00,1.0,33.0
14-06-2023 12.47,14-06-2023 12.52,2023-06-14 12:53:25,5.42,19.0
14-05-2024 12.18,14-05-2024 12.44,2024-05-14 12:56:10,26.95,37.0
26-06-2024 14.48,26-06-2024 15.14,2024-06-26 15:17:57,25.35,58.0
14-05-2024 9.59,14-05-2024 10.32,2024-05-14 10:44:28,33.29,36.0
16-01-2023 11.45,16-01-2023 12.05,2023-01-16 12:11:36,20.05,30.0
18-08-2023 14.27,18-08-2023 14.48,2023-08-18 14:53:22,21.02,37.0
02-10-2023 10.43,02-10-2023 10.44,2023-10-02 10:48:32,1.0,32.0
09-10-2023 15.02,09-10-2023 15.27,2023-10-09 15:33:57,25.23,157.0
2024/03/16 13:00:00,16-03-2024 13.01,2024-03-16 13:02:00,1.0,27.0
25-07-2023 09.01,25-07-2023 09.20,2023-07-25 09:33:00,19.14,23.0
24-05-2023 14.17,24-05-2023 14.32,2023-05-24 14:38:31,15.67,14.0
2024/03/06 13:01:00,06-03-2024 13.20,2024-03-06 13:29:38,19.33,34.0
08-06-2023 13.18,08-06-2023 13.30,2023-06-08 13:38:34,12.78,37.0
12-10-2024 13.00,12-10-2024 13.01,2024-10-12 13:02:00,1.0,162.0
11-04-2023 14.15,11-04-2023 14.35,2023-04-11 14:46:32,20.25,43.0
29-05-2023 10.18,29-05-2023 10.25,2023-05-29 10:31:57,7.63,32.0
,22-04-2024 11.03,2024-04-22 11:22:04,19.99,
2024/10/10 09:48:00,10-10-2024 10.05,2024-10-10 10:19:39,17.83,28.0
,06-03-2024 12.57,2024-03-06 13:01:13,13.69,143.0
28-08-2024 10.24,28-08-2024 10.49,2024-08-28 11:09:11,25.17,24.0
10-08-2024 12.36,10-08-2024 12.44,2024-08-10 12:57:05,8.03,40.0
01-12-2023 10.25,01-12-2023 10.50,2023-12-01 10:59:05,25.17,51.0
24-08-2024 13.00,24-08-2024 13.01,2024-08-24 13:02:00,1.0,36.0
08-11-2023 13.41,08-11-2023 14.07,2023-11-08 14:18:53,,36.0
15-12-2023 13.35,15-12-2023 13.58,2023-12-15 14:09:04,23.1,36.0
28-02-2023 12.31,28-02-2023 12.51,2023-02-28 13:03:12,20.01,26.0
22-06-2023 09.00,22-06-2023 09.29,2023-06-22 09:40:36,29.99,46.0
23-01-2023 10.59,23-01-2023 11.29,2023-01-23 11:45:35,30.11,40.0
20-02-2023 14.30,20-02-2023 15.02,2023-02-20 15:11:41,32.71,44.0
25-03-2023 13.00,25-03-2023 13.01,2023-03-25 13:02:00,1.0,17.0
20-08-2024 10.32,20-08-2024 10.53,2024-08-20 11:06:02,21.01,22.0
04-08-2023 09.50,04-08-2023 10.06,2023-08-04 10:19:38,16.82,22.0
14-02-2023 9.51,14-02-2023 10.33,2023-02-14 10:41:15,42.84,44.0
14-09-2023 12.44,14-09-2023 12.57,2023-09-14 13:13:59,13.47,40.0
2024/11/30 13:00:00,30-11-2024 13.01,2024-11-30 13:02:00,1.0,33.0
11-05-2024 09.28,11-05-2024 09.52,2024-05-11 09:55:01,24.46,43.0
2023/05/23 10:54:00,23-05-2023 11.27,2023-05-23 11:37:21,33.97,64.0
30-08-2023 12.50,30-08-2023 12.54,2023-08-30 13:03:45,4.87,13.0
04-10-2024 11.43,04-10-2024 11.59,2024-10-04 12:12:15,15.98,10.0
28-12-2023 12.13,28-12-2023 12.36,2023-12-28 12:48:24,23.25,37.0
16-05-2024 12.53,16-05-2024 13.28,2024-05-16 13:41:07,35.8,
16-08-2024 11.52,16-08-2024 12.11,2024-08-16 12:22:21,19.89,28.0
02-05-2024 13.44,02-05-2024 14.13,2024-05-02 14:22:44,29.23,53.0
,09-12-2023 13.01,2023-12-09 13:02:00,1.0,48.0
16-05-2024 11.55,16-05-2024 12.15,2024-05-16 12:25:06,20.77,41.0
,06-02-2023 12.10,2023-02-06 12:27:15,22.71,36.0
20-10-2023 10.16,20-10-2023 10.45,2023-10-20 10:55:40,30.0,51.0
19-12-2023 09.30,19-12-2023 10.05,2023-12-19 10:18:46,35.06,
04-06-2024 15.45,04-06-2024 15.46,2024-06-04 15:47:00,1.0,25.0
10-05-2023 11.53,10-05-2023 12.23,2023-05-10 12:29:13,30.07,29.0
29-11-2024 12.41,29-11-2024 13.01,2024-11-29 13:08:04,20.01,30.0
24-10-2024 10.40,24-10-2024 10.54,2024-10-24 11:02:16,14.2,32.0
14-10-2024 12.31,14-10-2024 12.50,2024-10-14 13:01:01,19.09,35.0
06-06-2024 13.25,06-06-2024 13.38,2024-06-06 13:47:13,13.91,18.0
2023/03/09 13:40:00,09-03-2023 13.58,2023-03-09 14:10:17,18.45,32.0
,21-08-2024 11.51,2024-08-21 12:01:37,32.4,35.0
08-03-2023 10.38,08-03-2023 11.01,2023-03-08 11:10:33,23.35,29.0
14-09-2023 09.20,14-09-2023 09.39,2023-09-14 09:55:11,19.8,33.0
2024/04/03 09:34:00,03-04-2024 10.09,2024-04-03 10:18:43,35.28,46.0
2023/09/26 15:28:00,26-09-2023 15.44,2023-09-26 15:45:00,16.0,27.0
05-06-2023 09.56,05-06-2023 10.24,2023-06-05 10:31:00,28.38,38.0
2023/02/13 15:43:00,13-02-2023 15.44,2023-02-13 15:45:00,1.0,35.0
2024/10/10 15:28:00,10-10-2024 15.44,2024-10-10 15:45:00,16.32,24.0
04-10-2024 10.11,04-10-2024 10.29,2024-10-04 10:38:36,18.14,
02-08-2024 11.02,02-08-2024 11.13,2024-08-02 11:25:19,11.83,38.0
07-03-2024 09.56,07-03-2024 10.25,2024-03-07 10:36:43,29.36,37.0
23-06-2023 09.45,23-06-2023 09.55,2023-06-23 10:06:30,10.16,10.0
31-01-2024 14.15,31-01-2024 14.45,2024-01-31 14:58:34,30.89,62.0
12-10-2023 13.00,12-10-2023 13.12,2023-10-12 13:15:06,12.89,40.0
13-03-2023 09.00,13-03-2023 09.26,2023-03-13 09:36:28,26.47,44.0
12-07-2024 13.44,12-07-2024 13.51,2024-07-12 14:00:04,7.4,146.0
07-07-2023 11.46,07-07-2023 12.19,2023-07-07 12:28:18,,22.0
2023/04/26 11:51:00,26-04-2023 12.16,2023-04-26 12:29:14,24.65,10.0
26-11-2024 10.44,26-11-2024 11.12,2024-11-26 11:23:17,28.24,41.0
17-06-2023 13.00,17-06-2023 13.01,2023-06-17 13:02:00,1.0,58.0
22-08-2023 11.19,22-08-2023 11.39,2023-08-22 11:51:17,20.06,3.0
2024/01/19 09:49:00,19-01-2024 09.52,2024-01-19 09:53:47,3.68,10.0
,23-11-2023 14.53,2023-11-23 15:00:40,19.0,26.0
2023/08/31 13:23:00,31-08-2023 13.31,2023-08-31 13:37:11,8.51,20.0
2024/01/03 09:56:00,03-01-2024 10.12,2024-01-03 10:22:43,16.4,17.0
2024/11/18 09:14:00,18-11-2024 09.32,2024-11-18 09:40:15,,32.0
09-08-2024 14.27,09-08-2024 14.41,2024-08-09 14:56:46,14.11,18.0
01-09-2023 14.01,01-09-2023 14.12,2023-09-01 14:26:34,11.66,17.0
26-09-2023 11.57,26-09-2023 12.22,2023-09-26 12:34:21,,56.0
13-07-2024 10.59,13-07-2024 11.17,2024-07-13 11:27:29,18.4,24.0
2023/03/14 11:52:00,14-03-2023 12.11,2023-03-14 12:29:59,19.61,21.0
29-08-2024 11.35,29-08-2024 11.53,2024-08-29 12:10:30,18.67,21.0
17-10-2024 14.15,17-10-2024 14.29,2024-10-17 14:40:20,14.05,38.0
29-12-2023 11.38,29-12-2023 12.08,2023-12-29 12:16:06,30.48,57.0
31-05-2024 12.42,31-05-2024 12.51,2024-05-31 13:04:24,9.98,13.0
05-10-2024 13.00,05-10-2024 13.01,2024-10-05 13:02:00,1.0,29.0
31-07-2023 14.00,31-07-2023 14.15,2023-07-31 14:25:08,15.46,25.0
2023/04/18 09:34:00,18-04-2023 09.59,2023-04-18 10:06:19,25.83,51.0
23-07-2024 11.23,23-07-2024 11.52,2024-07-23 12:01:53,29.0,42.0
2023/08/03 12:28:00,03-08-2023 12.58,2023-08-03 13:08:40,30.6,40.0
30-12-2023 13.00,30-12-2023 13.01,2023-12-30 13:02:00,1.0,39.0
08-02-2024 12.46,08-02-2024 13.00,2024-02-08 13:13:33,14.13,40.0
29-02-2024 12.57,29-02-2024 13.26,2024-02-29 13:38:23,29.46,41.0
2023/11/07 14:52:00,07-11-2023 15.14,2023-11-07 15:27:43,22.94,33.0
02-04-2024 10.17,02-04-2024 10.41,2024-04-02 10:52:31,24.67,37.0
2024/02/21 09:31:00,21-02-2024 09.54,2024-02-21 10:05:32,23.73,31.0
24-04-2023 12.39,24-04-2023 12.44,2023-04-24 12:49:04,5.89,32.0
09-10-2023 14.38,09-10-2023 14.57,2023-10-09 15:07:21,19.2,23.0
2024/04/27 13:00:00,27-04-2024 13.01,2024-04-27 13:02:00,1.0,42.0
20-11-2023 12.41,20-11-2023 12.59,2023-11-20 13:03:07,18.19,143.0
20-02-2024 14.29,20-02-2024 14.46,2024-02-20 15:06:46,17.57,
2024/07/18 12:40:00,18-07-2024 13.00,2024-07-18 13:11:13,20.05,19.0
27-06-2024 14.31,27-06-2024 14.47,2024-06-27 14:58:27,16.19,38.0
28-05-2024 11.05,28-05-2024 11.16,2024-05-28 11:36:52,11.37,0.0
14-08-2024 14.20,14-08-2024 14.41,2024-08-14 14:53:17,21.95,31.0
12-05-2023 10.03,12-05-2023 10.09,2023-05-12 10:23:12,6.89,22.0
22-03-2024 14.41,22-03-2024 15.12,2024-03-22 15:31:16,31.3,51.0
07-01-2023 12.47,07-01-2023 12.59,2023-01-07 13:00:00,12.0,33.0
24-08-2023 12.52,24-08-2023 13.07,2023-08-24 13:21:20,15.8,29.0
2023/05/30 12:29:00,30-05-2023 12.53,2023-05-30 13:04:07,24.58,30.0
23-07-2024 09.13,23-07-2024 09.46,2024-07-23 09:56:25,33.2,49.0
08-07-2023 09.58,08-07-2023 10.25,2023-07-08 10:31:19,27.53,45.0
22-05-2023 10.18,22-05-2023 10.36,2023-05-22 10:55:29,17.84,47.0
2023/10/21 09:04:00,21-10-2023 09.36,2023-10-21 09:37:23,32.4,56.0
28-12-2023 11.10,28-12-2023 11.28,2023-12-28 11:41:29,18.54,31.0
,05-09-2023 09.51,2023-09-05 10:03:11,19.86,20.0
28-10-2024 10.58,28-10-2024 11.11,2024-10-28 11:22:08,13.05,13.0
27-08-2024 10.16,27-08-2024 10.22,2024-08-27 10:28:13,6.72,32.0
2023/09/21 12:41:00,21-09-2023 12.45,2023-09-21 12:50:40,4.15,40.0
06-05-2024 11.48,06-05-2024 12.13,2024-05-06 12:24:03,25.02,41.0
02-10-2024 11.08,02-10-2024 11.35,2024-10-02 11:43:14,27.36,56.0
26-10-2023 12.25,26-10-2023 12.50,2023-10-26 12:58:48,25.42,41.0
01-04-2023 11.20,01-04-2023 11.36,2023-04-01 11:50:33,15.86,25.0
01-06-2023 12.37,01-06-2023 12.42,2023-06-01 12:50:33,5.03,40.0
21-09-2024 10.23,21-09-2024 10.31,2024-09-21 10:37:30,8.21,32.0
11-05-2023 13.05,11-05-2023 13.37,2023-05-11 13:51:52,32.89,33.0
16-01-2024 10.55,16-01-2024 11.02,2024-01-16 11:23:12,7.92,0.0
2024/10/07 10:25:00,07-10-2024 10.50,2024-10-07 11:09:54,25.52,24.0
06-08-2024 10.47,06-08-2024 11.04,2024-08-06 11:08:49,17.33,27.0
17-04-2023 14.05,17-04-2023 14.24,2023-04-17 14:35:42,19.19,15.0
2023/04/17 13:41:00,17-04-2023 14.04,2023-04-17 14:14:52,23.95,38.0
29-08-2023 15.21,29-08-2023 15.36,2023-08-29 15:40:24,15.11,25.0
26-04-2023 11.28,26-04-2023 12.00,2023-04-26 12:10:09,32.88,42.0
2024/02/26 10:47:00,26-02-2024 10.55,2024-02-26 11:09:03,8.8,32.0
29-04-2023 10.00,29-04-2023 10.22,2023-04-29 10:36:44,,39.0
05-08-2024 15.32,05-08-2024 15.43,2024-08-05 15:45:00,11.94,25.0
29-06-2023 11.05,29-06-2023 11.29,2023-06-29 11:42:03,24.09,51.0
14-11-2024 09.19,14-11-2024 09.44,2024-11-14 09:59:59,25.82,40.0
20-05-2023 13.00,20-05-2023 13.01,2023-05-20 13:02:00,1.0,15.0
08-08-2023 13.47,08-08-2023 14.16,2023-08-08 14:27:57,29.05,38.0
02-08-2024 14.19,02-08-2024 15.02,2024-08-02 15:14:19,43.55,71.0
17-11-2023 10.41,17-11-2023 11.00,2023-11-17 11:11:33,19.39,
22-06-2023 12.08,22-06-2023 12.28,2023-06-22 12:39:50,20.9,23.0
19-11-2024 12.05,19-11-2024 12.17,2024-11-19 12:28:23,12.6,32.0
2024/03/18 11:44:00,18-03-2024 12.08,2024-03-18 12:18:41,24.33,30.0
2023/04/19 10:04:00,19-04-2023 10.20,2023-04-19 10:33:54,16.85,24.0
08-06-2024 11.10,08-06-2024 11.36,2024-06-08 11:39:39,26.78,33.0
03-11-2023 10.46,03-11-2023 11.02,2023-11-03 11:07:55,16.92,22.0
15-12-2023 14.25,15-12-2023 14.44,2023-12-15 14:57:39,19.13,17.0
24-09-2024 14.48,24-09-2024 15.13,2024-09-24 15:22:03,25.02,47.0
2024/09/23 10:35:00,23-09-2024 10.58,2024-09-23 11:05:30,23.58,37.0
19-11-2024 13.40,19-11-2024 14.13,2024-11-19 14:19:50,33.15,37.0
30-08-2024 10.49,30-08-2024 11.16,2024-08-30 11:30:11,27.17,37.0
2024/05/29 12:28:00,29-05-2024 12.36,2024-05-29 12:40:53,8.22,40.0
13-10-2023 12.19,13-10-2023 12.27,2023-10-13 12:35:21,8.96,25.0
20-09-2024 13.16,20-09-2024 13.32,2024-09-20 13:41:21,16.85,200.0
30-05-2023 14.08,30-05-2023 14.14,2023-05-30 14:22:21,6.39,32.0
12-09-2023 12.58,12-09-2023 13.06,2023-09-12 13:21:20,8.74,6.0
07-09-2023 14.42,07-09-2023 15.44,2023-09-07 15:45:00,62.0,48.0
30-10-2023 10.51,30-10-2023 11.15,2023-10-30 11:22:58,24.81,27.0
2024/08/29 13:41:00,29-08-2024 14.00,2024-08-29 14:15:00,19.8,25.0
2023/07/12 11:55:00,12-07-2023 12.08,2023-07-12 12:15:09,13.6,27.0
2024/03/11 09:55:00,11-03-2024 10.16,2024-03-11 10:31:12,21.51,28.0
19-09-2023 10.33,19-09-2023 10.50,2023-09-19 11:07:49,17.89,0.0
26-06-2023 11.56,26-06-2023 12.16,2023-06-26 12:26:27,20.32,40.0
2023/07/05 15:40:00,05-07-2023 15.44,2023-07-05 15:45:00,,25.0
26-06-2023 09.55,26-06-2023 10.10,2023-06-26 10:22:55,15.2,10.0
23-01-2023 13.32,23-01-2023 13.54,2023-01-23 14:07:56,22.03,39.0
09-11-2023 14.09,09-11-2023 14.30,2023-11-09 14:49:07,21.17,27.0
18-10-2024 09.17,18-10-2024 09.37,2024-10-18 09:48:12,20.21,31.0
01-03-2023 12.57,01-03-2023 13.19,2023-03-01 13:28:46,22.27,36.0
2024/08/03 13:00:00,03-08-2024 13.01,2024-08-03 13:02:00,1.0,25.0
06-05-2024 9.44,06-05-2024 10.12,2024-05-06 10:25:45,28.83,52.0
02-08-2024 13.44,02-08-2024 14.02,2024-08-02 14:13:50,18.38,17.0
2023/07/27 11:00:00,27-07-2023 11.23,2023-07-27 11:40:16,23.75,31.0
31-07-2023 10.18,31-07-2023 11.48,2023-07-31 12:00:33,90.18,33.0
22-05-2023 15.45,22-05-2023 15.46,2023-05-22 15:47:00,1.0,0.0
2023/10/16 15:03:00,16-10-2023 15.29,2023-10-16 15:38:26,26.04,41.0
07-11-2023 11.42,07-11-2023 12.04,2023-11-07 12:13:24,21.72,38.0
01-07-2023 13.00,01-07-2023 13.01,2023-07-01 13:02:00,1.0,146.0
27-01-2024 11.41,27-01-2024 11.57,2024-01-27 12:09:19,16.82,11.0
03-02-2024 12.33,03-02-2024 12.59,2024-02-03 13:00:00,26.0,54.0
24-11-2023 13.23,24-11-2023 13.41,2023-11-24 13:52:12,18.82,25.0
21-12-2023 13.15,21-12-2023 13.48,2023-12-21 14:02:14,33.11,49.0
19-08-2024 10.45,19-08-2024 11.08,2024-08-19 11:20:53,23.72,32.0
07-03-2023 11.17,07-03-2023 11.43,2023-03-07 11:50:19,26.0,38.0
26-10-2024 12.43,26-10-2024 12.52,2024-10-26 13:00:00,9.85,40.0
2023/07/15 12:34:00,15-07-2023 12.35,2023-07-15 12:48:47,1.0,40.0
01-09-2023 13.47,01-09-2023 14.17,2023-09-01 14:27:16,30.17,49.0
21-10-2024 12.28,21-10-2024 12.52,2024-10-21 13:04:25,24.87,30.0
01-09-2023 14.42,01-09-2023 14.52,2023-09-01 15:05:24,10.17,15.0
07-06-2023 13.33,07-06-2023 13.52,2023-06-07 14:05:54,19.08,27.0
03-09-2024 13.43,03-09-2024 13.55,2024-09-03 14:07:05,12.5,25.0
24-08-2023 14.22,24-08-2023 14.49,2023-08-24 15:08:56,27.27,33.0
2024/01/16 10:33:00,16-01-2024 10.50,2024-01-16 11:06:04,17.81,32.0
25-10-2023 15.45,25-10-2023 15.46,2023-10-25 15:47:00,1.0,25.0
2024/03/27 12:53:00,27-03-2024 13.04,2024-03-27 13:06:24,11.87,40.0
2023/11/01 10:55:00,01-11-2023 11.09,2023-11-01 11:24:39,14.68,16.0
20-03-2023 13.55,20-03-2023 14.21,2023-03-20 14:28:40,26.04,35.0
30-12-2023 13.00,30-12-2023 13.01,2023-12-30 13:02:00,1.0,32.0
22-05-2023 15.42,22-05-2023 15.44,2023-05-22 15:45:00,2.0,28.0
2024/07/03 10:16:00,03-07-2024 10.58,2024-07-03 11:05:59,42.48,22.0
06-04-2024 12.13,06-04-2024 12.31,2024-04-06 12:42:04,18.74,15.0
05-08-2023 10.33,05-08-2023 10.44,2023-08-05 10:53:21,11.43,32.0
2024/05/09 09:19:00,09-05-2024 09.45,2024-05-09 09:55:45,26.19,63.0
19-01-2023 10.17,19-01-2023 10.21,2023-01-19 10:33:03,4.75,32.0
22-02-2024 12.32,22-02-2024 12.39,2024-02-22 12:53:16,7.9,40.0
17-09-2024 09.51,17-09-2024 10.05,2024-09-17 10:16:54,14.64,29.0
2024/04/24 15:31:00,24-04-2024 15.44,2024-04-24 15:45:00,13.0,25.0
2023/11/17 10:22:00,17-11-2023 10.29,2023-11-17 10:43:03,7.82,32.0
21-03-2023 09.50,21-03-2023 10.05,2023-03-21 10:18:45,15.45,10.0
06-02-2024 9.01,06-02-2024 09.26,2024-02-06 09:32:27,25.15,32.0
04-04-2024 12.32,04-04-2024 12.36,2024-04-04 12:42:51,4.18,32.0
28-07-2023 12.35,28-07-2023 12.55,2023-07-28 13:00:26,20.9,20.0
09-02-2024 10.41,09-02-2024 11.02,2024-02-09 11:14:50,,24.0
2024/05/23 13:07:00,23-05-2024 13.20,2024-05-23 13:29:01,13.68,17.0
08-08-2024 11.18,08-08-2024 11.31,2024-08-08 11:40:20,13.35,43.0
17-07-2023 14.30,17-07-2023 14.52,2023-07-17 15:02:32,22.66,26.0
08-05-2023 15.45,08-05-2023 15.46,2023-05-08 15:47:00,1.0,25.0
19-04-2024 09.48,19-04-2024 10.14,2024-04-19 10:26:46,26.93,46.0
27-12-2023 11.26,27-12-2023 11.59,2023-12-27 12:17:54,33.35,45.0
25-02-2023 12.09,25-02-2023 12.38,2023-02-25 12:53:59,29.43,32.0
17-04-2024 11.20,17-04-2024 11.46,2024-04-17 11:56:11,26.7,35.0
2023/08/10 09:57:00,10-08-2023 10.32,2023-08-10 10:37:12,35.79,29.0
29-12-2023 15.45,29-12-2023 15.46,2023-12-29 15:47:00,1.0,25.0
14-01-2023 13.00,14-01-2023 13.01,2023-01-14 13:02:00,,
2023/06/22 15:32:00,22-06-2023 15.44,2023-06-22 15:45:00,12.0,25.0
28-07-2023 10.38,28-07-2023 11.01,2023-07-28 11:09:27,23.32,29.0
03-06-2024 11.58,03-06-2024 12.12,2024-06-03 12:24:14,,25.0
07-08-2023 14.48,07-08-2023 15.08,2023-08-07 15:18:06,20.69,28.0
,05-07-2023 11.16,2023-07-05 11:36:51,18.15,29.0
2024/11/22 10:48:00,22-11-2024 11.11,2024-11-22 11:14:12,23.3,24.0
15-11-2024 9.06,15-11-2024 09.42,2024-11-15 09:45:19,37.0,52.0
2023/07/01 13:00:00,01-07-2023 13.01,2023-07-01 13:02:00,1.0,27.0
20-05-2024 09.59,20-05-2024 10.29,2024-05-20 10:41:06,30.92,32.0
19-06-2023 10.37,19-06-2023 10.51,2023-06-19 11:01:41,14.4,19.0
25-05-2024 12.40,25-05-2024 12.59,2024-05-25 13:00:00,19.0,37.0
06-11-2024 15.41,06-11-2024 15.44,2024-11-06 15:45:00,3.0,25.0
15-02-2023 11.21,15-02-2023 11.41,2023-02-15 11:52:27,20.93,25.0
28-05-2024 12.11,28-05-2024 12.24,2024-05-28 12:40:08,13.77,6.0
2023/10/24 12:37:00,24-10-2023 14.29,2023-10-24 14:37:33,112.63,46.0
07-04-2023 12.48,07-04-2023 13.16,2023-04-07 13:24:52,28.49,31.0
24-08-2023 09.40,24-08-2023 09.57,2023-08-24 10:00:34,17.87,26.0
15-05-2024 9.54,15-05-2024 10.08,2024-05-15 10:28:59,14.32,19.0
25-09-2023 15.07,25-09-2023 15.32,2023-09-25 15:44:03,25.23,37.0
01-02-2024 13.04,01-02-2024 13.20,2024-02-01 13:23:05,16.36,37.0
10-01-2024 10.24,10-01-2024 10.30,2024-01-10 10:38:49,6.43,32.0
24-01-2023 12.45,24-01-2023 13.12,2023-01-24 13:21:23,27.53,37.0
23-01-2023 15.11,23-01-2023 15.33,2023-01-23 15:39:28,22.15,22.0
2023/07/18 14:46:00,18-07-2023 15.14,2023-07-18 15:27:01,28.29,45.0
2023/06/19 10:45:00,19-06-2023 11.03,2023-06-19 11:13:32,18.08,18.0
31-03-2023 15.45,31-03-2023 15.46,2023-03-31 15:47:00,1.0,25.0
20-06-2023 11.10,20-06-2023 11.35,2023-06-20 11:45:04,25.98,25.0
10-03-2023 13.30,10-03-2023 13.47,2023-03-10 13:57:33,17.02,17.0
2023/08/14 12:01:00,14-08-2023 12.32,2023-08-14 12:42:21,31.31,22.0
2024/08/21 12:54:00,21-08-2024 13.27,2024-08-21 13:43:56,33.59,51.0
2024/08/22 09:42:00,22-08-2024 10.10,2024-08-22 10:19:30,28.69,32.0
22-05-2023 12.29,22-05-2023 12.59,2023-05-22 13:08:25,30.36,48.0
10-08-2023 13.15,10-08-2023 13.29,2023-08-10 13:38:20,14.16,20.0
22-06-2023 12.25,22-06-2023 12.30,2023-06-22 12:43:48,5.66,40.0
13-02-2023 12.59,13-02-2023 13.45,2023-02-13 13:50:55,46.75,19.0
22-06-2024 09.00,22-06-2024 09.08,2024-06-22 09:09:54,8.79,23.0
13-03-2024 12.22,13-03-2024 12.41,2024-03-13 12:46:08,19.01,40.0
2024/08/23 15:07:00,23-08-2024 15.40,2024-08-23 15:45:00,33.99,220.0
13-02-2023 14.17,13-02-2023 14.40,2023-02-13 14:58:16,,57.0
29-12-2023 09.31,29-12-2023 10.03,2023-12-29 10:09:10,32.55,43.0
2023/09/26 12:03:00,26-09-2023 12.15,2023-09-26 12:25:01,12.12,29.0
12-03-2024 09.36,12-03-2024 09.47,2024-03-12 09:59:09,11.71,10.0
13-07-2023 13.00,13-07-2023 13.28,2023-07-13 13:40:52,28.08,36.0
18-08-2023 11.15,18-08-2023 11.35,2023-08-18 11:47:04,20.47,11.0
2024/10/17 14:53:00,17-10-2024 15.19,2024-10-17 15:32:50,25.78,41.0
27-04-2023 11.50,27-04-2023 11.57,2023-04-27 12:10:47,7.49,19.0
06-04-2023 12.53,06-04-2023 13.12,2023-04-06 13:23:26,19.69,0.0
18-10-2023 12.21,18-10-2023 12.23,2023-10-18 12:34:02,2.66,40.0
24-07-2023 14.08,24-07-2023 14.21,2023-07-24 14:34:26,13.41,17.0
16-08-2024 12.06,16-08-2024 12.26,2024-08-16 12:36:41,20.94,15.0
09-09-2024 09.40,09-09-2024 09.48,2024-09-09 09:58:17,8.54,
30-06-2023 13.54,30-06-2023 14.10,2023-06-30 14:18:33,16.79,27.0
24-09-2024 12.48,24-09-2024 13.06,2024-09-24 13:17:29,18.45,29.0
30-03-2024 11.30,30-03-2024 11.51,2024-03-30 12:03:12,21.27,31.0
07-07-2023 13.43,07-07-2023 13.58,2023-07-07 14:13:47,15.05,25.0
20-04-2024 13.00,20-04-2024 13.01,2024-04-20 13:02:00,1.0,43.0
2023/04/29 10:12:00,29-04-2023 10.29,2023-04-29 10:35:58,17.86,32.0
24-05-2023 13.45,24-05-2023 13.59,2023-05-24 14:12:25,14.92,27.0
26-10-2024 13.00,26-10-2024 13.01,2024-10-26 13:02:00,1.0,25.0
2023/04/19 11:11:00,19-04-2023 11.29,2023-04-19 11:40:26,18.94,17.0
25-09-2023 14.10,25-09-2023 14.20,2023-09-25 14:30:30,10.11,25.0
22-11-2024 10.21,22-11-2024 10.51,2024-11-22 11:02:14,30.23,25.0
19-10-2023 09.00,19-10-2023 09.24,2023-10-19 09:30:06,24.16,38.0
29-09-2023 12.55,29-09-2023 13.12,2023-09-29 13:24:21,17.31,33.0
25-09-2024 15.03,25-09-2024 15.14,2024-09-25 15:24:06,11.22,12.0
2024/05/30 09:02:00,30-05-2024 09.22,2024-05-30 09:31:54,20.27,43.0
11-09-2024 10.11,11-09-2024 10.30,2024-09-11 10:35:58,19.4,28.0
18-07-2024 13.15,18-07-2024 13.48,2024-07-18 13:58:10,33.96,46.0
26-05-2023 12.50,26-05-2023 13.13,2023-05-26 13:24:02,23.26,45.0
23-06-2023 14.25,23-06-2023 14.41,2023-06-23 14:53:43,16.79,43.0
25-11-2023 13.00,25-11-2023 13.01,2023-11-25 13:02:00,1.0,43.0
28-09-2023 13.41,28-09-2023 14.05,2023-09-28 14:15:10,24.01,51.0
20-08-2024 09.15,20-08-2024 09.19,2024-08-20 09:29:00,4.06,10.0
24-11-2023 14.51,24-11-2023 15.19,2023-11-24 15:31:35,28.9,46.0
28-11-2023 10.10,28-11-2023 10.26,2023-11-28 10:37:09,16.33,26.0
01-02-2024 10.35,01-02-2024 10.53,2024-02-01 11:01:08,18.01,171.0
22-07-2023 11.42,22-07-2023 12.13,2023-07-22 12:21:18,31.25,59.0
18-08-2023 12.00,18-08-2023 12.20,2023-08-18 12:28:18,20.16,45.0
02-06-2023 15.45,02-06-2023 15.46,2023-06-02 15:47:00,1.0,25.0
14-03-2023 14.45,14-03-2023 14.59,2023-03-14 15:08:38,14.22,133.0
17-06-2023 10.00,17-06-2023 10.29,2023-06-17 10:40:56,29.66,
18-06-2024 15.40,18-06-2024 15.44,2024-06-18 15:45:00,4.0,43.0
26-03-2024 12.05,26-03-2024 12.34,2024-03-26 12:55:40,29.66,26.0
03-10-2023 11.40,03-10-2023 12.08,2023-10-03 12:13:53,28.63,41.0
21-06-2024 09.46,21-06-2024 09.52,2024-06-21 09:59:50,6.87,18.0
2024/05/01 13:19:00,01-05-2024 13.43,2024-05-01 13:52:17,24.07,50.0
30-11-2023 14.25,30-11-2023 14.47,2023-11-30 14:57:27,22.57,37.0
23-05-2023 14.34,23-05-2023 15.05,2023-05-23 15:14:25,31.85,39.0
18-04-2023 15.41,18-04-2023 15.44,2023-04-18 15:45:00,3.0,25.0
23-10-2024 14.57,23-10-2024 15.20,2024-10-23 15:29:44,23.36,37.0
27-01-2024 13.00,27-01-2024 13.01,2024-01-27 13:02:00,1.0,25.0
2023/04/24 10:51:00,24-04-2023 11.06,2023-04-24 11:16:20,,42.0
06-06-2024 09.25,06-06-2024 09.47,2024-06-06 09:55:23,22.34,31.0
19-10-2023 14.05,19-10-2023 14.33,2023-10-19 14:50:57,28.08,40.0
19-10-2023 14.56,19-10-2023 15.21,2023-10-19 15:41:22,25.29,51.0
24-07-2023 13.50,24-07-2023 14.02,2023-07-24 14:18:14,12.65,25.0
26-04-2024 09.49,26-04-2024 10.04,2024-04-26 10:16:09,15.27,16.0
04-11-2023 12.23,04-11-2023 12.46,2023-11-04 12:59:16,23.89,30.0
,22-11-2023 12.19,2023-11-22 12:27:14,26.48,38.0
13-09-2023 12.47,13-09-2023 13.09,2023-09-13 13:20:34,22.14,19.0
2024/03/19 14:27:00,19-03-2024 14.43,2024-03-19 14:58:37,16.56,41.0
03-10-2023 11.28,03-10-2023 11.50,2023-10-03 12:04:11,22.84,10.0
04-05-2023 13.23,04-05-2023 13.52,2023-05-04 14:01:54,29.5,35.0
2024/10/24 15:41:00,24-10-2024 15.44,2024-10-24 15:45:00,3.0,25.0
14-08-2023 10.35,14-08-2023 10.50,2023-08-14 11:02:24,15.35,21.0
26-05-2023 12.28,26-05-2023 12.58,2023-05-26 13:08:12,30.16,28.0
25-09-2024 13.30,25-09-2024 14.02,2024-09-25 14:16:34,32.22,42.0
23-11-2024 13.00,23-11-2024 13.01,2024-11-23 13:02:00,1.0,37.0
29-12-2023 09.27,29-12-2023 10.05,2023-12-29 10:11:41,,53.0
06-08-2024 12.09,06-08-2024 12.57,2024-08-06 13:05:45,48.6,57.0
25-01-2023 12.13,25-01-2023 12.35,2023-01-25 12:45:49,22.19,30.0
07-02-2023 9.22,07-02-2023 09.30,2023-02-07 09:41:30,8.49,10.0
02-11-2023 10.41,02-11-2023 11.05,2023-11-02 11:17:54,24.37,29.0
05-11-2024 10.41,05-11-2024 10.51,2024-11-05 11:03:13,10.79,32.0
15-06-2023 14.28,15-06-2023 14.56,2023-06-15 15:09:18,28.33,48.0
2023/09/05 09:35:00,05-09-2023 09.40,2023-09-05 09:45:43,5.16,10.0
07-10-2023 12.31,07-10-2023 12.59,2023-10-07 13:00:00,28.0,57.0
19-09-2024 10.55,19-09-2024 11.12,2024-09-19 11:29:53,17.82,16.0
26-04-2024 09.27,26-04-2024 09.57,2024-04-26 09:58:09,30.11,47.0
08-02-2024 12.38,08-02-2024 12.49,2024-02-08 12:57:18,11.95,40.0
30-05-2023 10.35,30-05-2023 10.52,2023-05-30 11:09:59,18.0,21.0
03-06-2024 9.54,03-06-2024 10.04,2024-06-03 10:07:58,10.34,24.0
03-04-2024 09.16,03-04-2024 09.39,2024-04-03 09:57:40,23.97,43.0
2024/01/30 10:40:00,30-01-2024 10.57,2024-01-30 11:00:06,17.28,24.0
17-07-2024 09.00,17-07-2024 09.19,2024-07-17 09:31:15,19.32,28.0
16-06-2023 10.49,16-06-2023 11.04,2023-06-16 11:11:48,15.89,25.0
2023/12/27 14:47:00,27-12-2023 15.03,2023-12-27 15:10:35,16.46,25.0
2023/03/09 10:23:00,09-03-2023 10.33,2023-03-09 10:43:23,10.54,32.0
29-03-2024 13.58,29-03-2024 14.08,2024-03-29 14:24:16,10.84,25.0
07-09-2023 09.16,07-09-2023 09.45,2023-09-07 09:47:03,29.31,47.0
17-04-2024 10.12,17-04-2024 10.41,2024-04-17 10:49:36,29.17,51.0
25-10-2023 10.05,25-10-2023 10.38,2023-10-25 10:39:37,33.62,42.0
11-09-2024 13.48,11-09-2024 15.21,2024-09-11 15:32:27,93.42,47.0
2023/08/09 10:03:00,09-08-2023 10.22,2023-08-09 10:38:57,19.72,23.0
2024/07/30 10:08:00,30-07-2024 10.31,2024-07-30 10:40:33,23.16,40.0
30-01-2024 12.35,30-01-2024 12.59,2024-01-30 13:14:57,24.53,16.0
09-09-2024 12.30,09-09-2024 12.38,2024-09-09 12:49:41,8.21,
2023/07/17 15:34:00,17-07-2023 15.43,2023-07-17 15:45:00,9.26,
2023/03/15 15:39:00,15-03-2023 15.44,2023-03-15 15:45:00,5.0,48.0
01-03-2024 11.07,01-03-2024 11.23,2024-03-01 11:29:34,16.03,39.0
05-08-2023 13.00,05-08-2023 13.01,2023-08-05 13:02:00,1.0,27.0
2023/07/18 09:11:00,18-07-2023 09.19,2023-07-18 09:24:03,8.61,23.0
11-11-2023 13.00,11-11-2023 13.01,2023-11-11 13:02:00,1.0,25.0
24-09-2024 15.45,24-09-2024 15.46,2024-09-24 15:47:00,1.0,25.0
2024/04/03 13:32:00,03-04-2024 13.48,2024-04-03 14:00:03,16.97,27.0
2023/11/03 10:51:00,03-11-2023 10.59,2023-11-03 11:07:55,8.42,19.0
2023/06/08 12:15:00,08-06-2023 12.34,2023-06-08 12:45:15,19.83,46.0
01-09-2023 14.48,01-09-2023 15.00,2023-09-01 15:11:53,12.3,
28-03-2023 09.32,28-03-2023 09.59,2023-03-28 10:10:54,27.73,39.0
,22-02-2024 12.32,2024-02-22 12:35:52,33.82,53.0
01-02-2023 13.12,01-02-2023 13.32,2023-02-01 13:43:33,20.76,41.0
15-10-2024 13.17,15-10-2024 13.42,2024-10-15 13:50:31,25.91,29.0
13-04-2024 11.26,13-04-2024 11.44,2024-04-13 11:58:35,18.18,20.0
03-11-2023 11.42,03-11-2023 12.03,2023-11-03 12:11:18,,38.0
09-03-2024 10.05,09-03-2024 10.33,2024-03-09 10:54:22,28.59,24.0
10-08-2023 12.28,10-08-2023 13.03,2023-08-10 13:15:51,35.49,54.0
04-03-2023 12.47,04-03-2023 12.59,2023-03-04 13:00:00,12.0,41.0
03-04-2024 14.53,03-04-2024 15.15,2024-04-03 15:24:17,22.08,33.0
04-10-2023 09.17,04-10-2023 09.41,2023-10-04 09:51:49,24.31,
06-05-2024 11.30,06-05-2024 12.02,2024-05-06 12:12:39,32.64,50.0
01-11-2023 11.35,01-11-2023 12.09,2023-11-01 12:27:07,34.07,45.0
2023/10/07 09:59:00,07-10-2023 10.28,2023-10-07 10:38:51,29.3,32.0
11-11-2024 13.50,11-11-2024 14.03,2024-11-11 14:12:55,13.19,32.0
15-12-2023 14.16,15-12-2023 14.26,2023-12-15 14:36:04,10.23,17.0
07-07-2023 13.29,07-07-2023 13.48,2023-07-07 13:54:42,19.02,27.0
16-11-2024 13.00,16-11-2024 13.01,2024-11-16 13:02:00,1.0,4.0
31-10-2023 11.27,31-10-2023 11.49,2023-10-31 12:01:32,22.25,31.0
13-11-2023 14.00,13-11-2023 14.17,2023-11-13 14:30:50,17.88,41.0
15-10-2024 13.29,15-10-2024 13.42,2024-10-15 13:51:05,13.41,14.0
05-04-2024 11.56,05-04-2024 12.15,2024-04-05 12:35:03,19.6,
24-06-2024 10.30,24-06-2024 10.52,2024-06-24 11:02:49,22.58,47.0
31-10-2023 12.36,31-10-2023 13.03,2023-10-31 13:21:30,27.74,38.0
26-06-2023 10.11,26-06-2023 10.30,2023-06-26 10:38:28,19.84,31.0
18-04-2023 10.56,18-04-2023 11.14,2023-04-18 11:23:30,18.29,27.0
06-03-2024 09.32,06-03-2024 09.55,2024-03-06 10:02:07,23.91,51.0
2023/11/07 15:45:00,07-11-2023 15.46,2023-11-07 15:47:00,1.0,25.0
08-08-2023 13.30,08-08-2023 13.45,2023-08-08 13:56:02,15.59,28.0
28-11-2023 12.05,28-11-2023 12.36,2023-11-28 12:47:41,31.14,40.0
17-06-2023 13.00,17-06-2023 13.01,2023-06-17 13:02:00,1.0,25.0
02-04-2024 14.19,02-04-2024 14.42,2024-04-02 14:55:44,23.69,29.0
05-07-2023 14.05,05-07-2023 14.09,2023-07-05 14:14:17,4.93,25.0
2024/02/14 09:51:00,14-02-2024 10.18,2024-02-14 10:30:34,27.65,26.0
2024/10/10 14:54:00,10-10-2024 15.24,2024-10-10 15:27:42,30.62,42.0
01-08-2024 10.25,01-08-2024 10.29,2024-08-01 10:31:10,4.84,32.0
01-08-2024 11.32,01-08-2024 12.01,2024-08-01 12:06:41,30.0,41.0
2024/06/13 13:47:00,13-06-2024 14.06,2024-06-13 14:20:11,19.83,17.0
19-10-2024 11.54,19-10-2024 12.20,2024-10-19 12:25:54,26.51,36.0
10-02-2024 12.41,10-02-2024 12.59,2024-02-10 13:00:00,18.0,40.0
07-08-2023 13.13,07-08-2023 13.46,2023-08-07 14:03:23,33.79,
08-05-2024 14.32,08-05-2024 14.47,2024-05-08 14:58:53,15.11,133.0
14-11-2023 10.21,14-11-2023 10.40,2023-11-14 10:59:07,18.44,0.0
14-09-2023 13.44,14-09-2023 14.09,2023-09-14 14:23:45,25.88,36.0
2023/02/25 13:00:00,25-02-2023 13.01,2023-02-25 13:02:00,1.0,4.0
17-04-2023 09.35,17-04-2023 10.08,2023-04-17 10:12:28,33.99,54.0
28-10-2024 13.43,28-10-2024 13.50,2024-10-28 14:00:44,7.35,25.0
13-01-2023 10.36,13-01-2023 11.05,2023-01-13 11:14:13,29.97,49.0
19-09-2023 14.24,19-09-2023 14.47,2023-09-19 15:06:56,23.98,27.0
29-02-2024 09.00,29-02-2024 09.23,2024-02-29 09:35:48,23.06,
23-08-2024 14.19,23-08-2024 14.26,2024-08-23 14:37:59,7.59,17.0
31-10-2023 12.06,31-10-2023 12.28,2023-10-31 12:38:42,22.83,41.0
05-05-2023 11.23,05-05-2023 11.46,2023-05-05 12:06:46,23.18,34.0
22-07-2024 10.59,22-07-2024 11.19,2024-07-22 11:28:47,20.21,125.0
02-08-2023 12.14,02-08-2023 12.41,2023-08-02 12:48:57,27.62,31.0
09-03-2023 09.25,09-03-2023 09.54,2023-03-09 10:02:57,29.01,63.0
19-01-2024 13.26,19-01-2024 14.02,2024-01-19 14:12:26,36.1,46.0
07-01-2023 13.00,07-01-2023 13.01,2023-01-07 13:02:00,1.0,43.0
2023/10/09 15:45:00,09-10-2023 15.46,2023-10-09 15:47:00,1.0,25.0
19-07-2024 13.26,19-07-2024 13.40,2024-07-19 13:51:03,14.37,14.0
21-01-2023 09.37,21-01-2023 09.53,2023-01-21 10:04:45,16.05,10.0
20-01-2024 10.10,20-01-2024 10.27,2024-01-20 10:36:06,17.52,40.0
19-12-2023 10.50,19-12-2023 11.15,2023-12-19 11:27:46,25.5,29.0
01-02-2023 09.16,01-02-2023 09.40,2023-02-01 09:53:04,24.06,37.0
12-02-2024 14.49,12-02-2024 15.01,2024-02-12 15:11:27,12.7,
13-03-2024 15.35,13-03-2024 15.44,2024-03-13 15:45:00,9.0,43.0
12-06-2023 14.53,12-06-2023 15.23,2023-06-12 15:30:20,30.16,32.0
04-06-2024 14.48,04-06-2024 15.10,2024-06-04 15:22:24,22.5,26.0
09-11-2024 10.21,09-11-2024 10.40,2024-11-09 10:43:21,19.07,22.0
2024/10/16 12:16:00,16-10-2024 12.43,2024-10-16 12:52:32,27.16,46.0
2023/05/29 12:19:00,29-05-2023 12.22,2023-05-29 12:27:12,,40.0
01-02-2024 11.24,01-02-2024 11.48,2024-02-01 11:59:17,24.23,10.0
2023/07/07 14:02:00,07-07-2023 14.07,2023-07-07 14:11:53,5.69,25.0
25-11-2024 13.58,25-11-2024 14.35,2024-11-25 14:48:41,37.51,75.0
2023/11/15 10:46:00,15-11-2023 11.07,2023-11-15 11:18:12,21.8,22.0
2023/12/22 10:03:00,22-12-2023 10.30,2023-12-22 10:42:22,27.45,38.0
03-07-2023 11.22,03-07-2023 11.45,2023-07-03 11:58:22,23.89,30.0
20-06-2024 12.25,20-06-2024 12.34,2024-06-20 12:45:00,9.09,40.0
2024/04/19 13:45:00,19-04-2024 14.12,2024-04-19 14:21:25,27.05,38.0
2024/05/02 15:20:00,02-05-2024 15.44,2024-05-02 15:45:00,24.0,32.0
2023/08/26 09:17:00,26-08-2023 09.46,2023-08-26 09:59:06,29.21,49.0
22-02-2023 10.08,22-02-2023 10.36,2023-02-22 10:47:38,28.47,38.0
16-10-2024 15.45,16-10-2024 15.46,2024-10-16 15:47:00,1.0,24.0
2024/08/17 10:29:00,17-08-2024 10.48,2024-08-17 10:49:46,19.78,34.0
28-02-2023 12.27,28-02-2023 12.45,2023-02-28 12:56:15,18.37,33.0
16-09-2024 13.49,16-09-2024 14.24,2024-09-16 14:34:44,35.94,46.0
18-07-2023 14.05,18-07-2023 14.23,2023-07-18 14:36:50,17.44,46.0
13-01-2024 13.00,13-01-2024 13.01,2024-01-13 13:02:00,1.0,27.0
23-02-2023 14.12,23-02-2023 14.30,2023-02-23 14:40:31,18.2,23.0
14-08-2023 10.07,14-08-2023 10.26,2023-08-14 10:41:28,19.58,22.0
28-10-2024 15.38,28-10-2024 15.44,2024-10-28 15:45:00,6.0,28.0
26-08-2023 11.07,26-08-2023 11.29,2023-08-26 11:32:30,22.3,29.0
2023/04/22 11:16:00,22-04-2023 11.36,2023-04-22 11:49:06,20.11,31.0
27-07-2024 11.44,27-07-2024 12.03,2024-07-27 12:13:54,19.16,23.0
14-11-2023 09.00,14-11-2023 09.28,2023-11-14 09:43:43,28.46,40.0
,29-03-2023 15.40,2023-03-29 15:45:00,21.18,30.0
08-02-2024 13.47,08-02-2024 13.57,2024-02-08 14:04:18,10.03,25.0
2024/09/27 11:30:00,27-09-2024 11.42,2024-09-27 11:50:39,12.76,43.0
29-08-2024 9.41,29-08-2024 10.03,2024-08-29 10:08:05,22.26,51.0
,10-06-2024 12.28,2024-06-10 12:39:43,22.44,29.0
26-09-2024 10.18,26-09-2024 10.36,2024-09-26 10:48:31,18.2,19.0
19-05-2023 12.27,19-05-2023 12.48,2023-05-19 12:59:40,21.61,30.0
07-08-2024 14.10,07-08-2024 14.42,2024-08-07 15:01:11,32.61,34.0
12-08-2023 13.00,12-08-2023 13.01,2023-08-12 13:02:00,1.0,27.0
2023/11/01 10:12:00,01-11-2023 10.42,2023-11-01 10:53:28,30.51,37.0
12-04-2024 9.38,12-04-2024 10.10,2024-04-12 10:13:14,32.28,63.0
17-10-2023 09.00,17-10-2023 09.31,2023-10-17 09:33:02,31.37,56.0
2024/11/02 10:02:00,02-11-2024 10.27,2024-11-02 10:47:16,25.24,
24-04-2023 13.16,24-04-2023 13.36,2023-04-24 13:51:02,20.15,42.0
2023/04/03 13:57:00,03-04-2023 14.07,2023-04-03 14:15:37,10.55,17.0
28-06-2023 14.31,28-06-2023 14.44,2023-06-28 14:58:36,13.64,19.0
06-08-2024 12.31,06-08-2024 12.55,2024-08-06 13:05:49,24.23,37.0
2023/12/21 14:23:00,21-12-2023 14.39,2023-12-21 14:54:50,16.5,15.0
30-01-2024 11.36,30-01-2024 12.08,2024-01-30 12:20:59,32.32,36.0
20-11-2023 14.38,20-11-2023 15.06,2023-11-20 15:14:29,28.25,
2023/09/07 12:17:00,07-09-2023 12.44,2023-09-07 12:54:39,27.78,48.0
09-11-2024 09.12,09-11-2024 09.35,2024-11-09 09:41:59,23.33,38.0
03-08-2023 14.06,03-08-2023 14.22,2023-08-03 14:34:45,16.44,0.0
08-01-2024 12.41,08-01-2024 12.45,2024-01-08 12:50:43,4.18,40.0
21-10-2024 14.10,21-10-2024 14.15,2024-10-21 14:22:46,5.74,25.0
02-11-2024 13.00,02-11-2024 13.01,2024-11-02 13:02:00,1.0,30.0
11-11-2023 11.54,11-11-2023 12.13,2023-11-11 12:34:02,18.83,26.0
23-03-2023 15.23,23-03-2023 15.41,2023-03-23 15:45:00,18.47,180.0
03-04-2023 15.10,03-04-2023 15.19,2023-04-03 15:30:31,9.96,18.0
04-03-2024 12.39,04-03-2024 12.49,2024-03-04 13:02:06,10.23,40.0
2023/06/30 15:33:00,30-06-2023 15.44,2023-06-30 15:45:00,11.0,48.0
16-03-2023 13.49,16-03-2023 13.55,2023-03-16 14:07:24,6.25,25.0
2023/07/03 13:13:00,03-07-2023 13.32,2023-07-03 13:48:24,19.62,9.0
,29-09-2023 14.59,2023-09-29 15:09:27,14.54,34.0
18-01-2023 09.26,18-01-2023 09.32,2023-01-18 09:37:32,6.96,18.0
2023/12/01 12:42:00,01-12-2023 13.10,2023-12-01 13:19:23,28.22,39.0
02-02-2023 09.18,02-02-2023 09.38,2023-02-02 09:43:35,20.32,32.0
28-11-2024 10.41,28-11-2024 10.57,2024-11-28 11:11:24,16.22,18.0
2024/02/23 09:55:00,23-02-2024 10.00,2024-02-23 10:11:53,5.37,5.0
30-01-2024 14.36,30-01-2024 15.02,2024-01-30 15:10:39,26.22,26.0
12-01-2024 12.33,12-01-2024 13.14,2024-01-12 13:18:41,41.94,19.0
27-01-2024 10.47,27-01-2024 11.14,2024-01-27 11:27:09,27.54,29.0
27-09-2023 13.50,27-09-2023 13.56,2023-09-27 13:57:09,6.17,25.0
06-02-2024 12.42,06-02-2024 13.03,2024-02-06 13:14:38,21.28,
01-04-2023 13.00,01-04-2023 13.01,2023-04-01 13:02:00,1.0,23.0
06-07-2023 15.03,06-07-2023 15.24,2023-07-06 15:45:00,,32.0
19-07-2024 11.38,19-07-2024 12.06,2024-07-19 12:26:34,28.74,45.0
27-01-2024 11.30,27-01-2024 11.36,2024-01-27 11:58:17,6.19,19.0
20-09-2024 14.32,20-09-2024 14.49,2024-09-20 15:06:26,17.47,14.0
06-12-2023 12.49,06-12-2023 13.08,2023-12-06 13:18:18,19.83,29.0
23-04-2024 12.15,23-04-2024 12.38,2024-04-23 12:47:18,23.03,46.0
13-02-2024 14.03,13-02-2024 14.25,2024-02-13 14:31:45,21.49,32.0
09-08-2024 11.31,09-08-2024 11.56,2024-08-09 11:58:24,25.34,33.0
09-07-2024 11.40,09-07-2024 12.05,2024-07-09 12:06:48,25.43,30.0
10-06-2024 12.40,10-06-2024 12.56,2024-06-10 13:08:37,16.46,17.0
26-08-2024 11.29,26-08-2024 11.43,2024-08-26 11:49:40,14.34,19.0
06-12-2023 14.35,06-12-2023 14.57,2023-12-06 15:07:45,22.3,43.0
02-04-2024 11.09,02-04-2024 11.29,2024-04-02 11:39:36,20.65,42.0
04-06-2024 12.59,04-06-2024 13.29,2024-06-04 13:39:17,30.34,57.0
2024/04/24 14:59:00,24-04-2024 15.30,2024-04-24 15:31:32,31.25,34.0
31-07-2024 12.32,31-07-2024 12.44,2024-07-31 13:00:44,12.49,40.0
27-09-2023 13.52,27-09-2023 14.22,2023-09-27 14:38:45,30.14,54.0
14-05-2024 12.52,14-05-2024 13.20,2024-05-14 13:29:49,27.56,26.0
28-05-2024 13.41,28-05-2024 14.17,2024-05-28 14:29:20,,201.0
08-03-2024 09.00,08-03-2024 09.33,2024-03-08 09:43:08,33.9,46.0
16-04-2024 12.02,16-04-2024 12.27,2024-04-16 12:36:45,25.16,30.0
12-07-2024 12.02,12-07-2024 12.24,2024-07-12 12:36:22,22.62,29.0
12-06-2024 10.50,12-06-2024 11.15,2024-06-12 11:26:11,25.82,31.0
24-04-2023 14.24,24-04-2023 14.41,2023-04-24 14:49:42,17.89,
2024/04/29 15:31:00,29-04-2024 15.44,2024-04-29 15:45:00,13.0,48.0
13-04-2024 13.00,13-04-2024 13.01,2024-04-13 13:02:00,1.0,36.0
22-08-2024 12.14,22-08-2024 12.32,2024-08-22 12:41:30,18.92,31.0
04-10-2023 9.16,04-10-2023 09.39,2023-10-04 09:55:30,23.83,35.0
01-10-2024 13.59,01-10-2024 14.00,2024-10-01 14:02:10,1.59,25.0
03-08-2023 15.27,03-08-2023 15.44,2023-08-03 15:45:00,16.28,38.0
23-03-2023 13.46,23-03-2023 13.57,2023-03-23 14:11:14,11.12,25.0
2023/04/19 13:07:00,19-04-2023 13.30,2023-04-19 13:44:20,,41.0
2023/03/09 09:00:00,09-03-2023 09.14,2023-03-09 09:26:08,14.71,12.0
19-10-2024 11.24,19-10-2024 11.48,2024-10-19 11:57:22,24.28,33.0
28-08-2024 11.35,28-08-2024 11.53,2024-08-28 12:10:01,18.14,21.0
21-05-2024 10.42,21-05-2024 11.08,2024-05-21 11:21:03,26.81,33.0
23-01-2024 13.22,23-01-2024 13.35,2024-01-23 13:38:38,13.35,40.0
10-07-2024 12.53,10-07-2024 13.09,2024-07-10 13:20:08,,33.0
2023/01/14 12:27:00,14-01-2023 12.40,2023-01-14 12:50:42,13.73,14.0
24-08-2024 13.00,24-08-2024 13.01,2024-08-24 13:02:00,1.0,25.0
14-02-2023 10.07,14-02-2023 10.26,2023-02-14 10:39:17,19.49,30.0
2023/02/22 10:51:00,22-02-2023 11.11,2023-02-22 11:28:02,20.53,25.0
18-08-2023 14.37,18-08-2023 15.04,2023-08-18 15:14:31,27.46,39.0
01-06-2024 11.48,01-06-2024 12.08,2024-06-01 12:20:31,20.92,38.0
2023/10/04 10:20:00,04-10-2023 10.46,2023-10-04 11:05:31,26.82,24.0
08-06-2024 13.00,08-06-2024 13.01,2024-06-08 13:02:00,1.0,24.0
22-11-2023 09.00,22-11-2023 09.29,2023-11-22 09:41:52,29.1,50.0
02-05-2024 10.24,02-05-2024 10.51,2024-05-02 10:59:57,27.2,28.0
2024/11/13 13:47:00,13-11-2024 13.53,2024-11-13 14:00:08,6.45,25.0
23-02-2023 12.28,23-02-2023 12.44,2023-02-23 13:03:14,16.5,40.0
04-01-2024 14.15,04-01-2024 14.28,2024-01-04 14:41:43,13.16,17.0
24-08-2023 09.41,24-08-2023 09.59,2023-08-24 10:06:31,18.71,33.0
10-07-2024 12.23,10-07-2024 12.56,2024-07-10 13:05:47,33.62,40.0
2024/03/16 13:00:00,16-03-2024 13.01,2024-03-16 13:02:00,1.0,24.0
13-09-2024 14.15,13-09-2024 14.33,2024-09-13 14:49:50,18.39,17.0
2023/04/24 15:41:00,24-04-2023 15.44,2023-04-24 15:45:00,3.0,51.0
15-11-2023 10.06,15-11-2023 10.22,2023-11-15 10:39:14,16.27,39.0
09-01-2024 10.14,09-01-2024 10.31,2024-01-09 10:49:19,16.94,0.0
2024/03/16 12:43:00,16-03-2024 12.59,2024-03-16 13:00:00,16.0,39.0
01-12-2023 15.39,01-12-2023 15.43,2023-12-01 15:45:00,4.04,25.0
11-10-2023 10.29,11-10-2023 10.53,2023-10-11 11:02:39,,40.0
2024/02/16 11:56:00,16-02-2024 12.21,2024-02-16 12:33:54,25.19,25.0
17-10-2023 09.56,17-10-2023 10.13,2023-10-17 10:24:51,17.21,32.0
28-10-2024 14.03,28-10-2024 14.21,2024-10-28 14:39:02,18.26,25.0
2024/09/27 14:22:00,27-09-2024 15.44,2024-09-27 15:45:00,82.0,48.0
11-11-2024 11.11,11-11-2024 11.34,2024-11-11 11:40:33,23.88,33.0
01-08-2024 15.45,01-08-2024 15.46,2024-08-01 15:47:00,1.0,35.0
14-02-2023 11.28,14-02-2023 11.51,2023-02-14 12:07:17,23.74,40.0
16-10-2023 15.15,16-10-2023 15.33,2023-10-16 15:45:00,18.6,
04-02-2023 13.00,04-02-2023 13.01,2023-02-04 13:02:00,1.0,45.0
21-05-2024 09.51,21-05-2024 09.59,2024-05-21 10:13:34,8.47,10.0
31-07-2023 10.27,31-07-2023 10.40,2023-07-31 10:52:55,13.47,32.0
31-08-2024 11.19,31-08-2024 11.34,2024-08-31 11:39:57,15.93,43.0
02-11-2023 14.07,02-11-2023 14.32,2023-11-02 15:09:44,25.03,36.0
21-06-2023 10.40,21-06-2023 10.57,2023-06-21 11:09:25,17.14,38.0
21-04-2023 12.18,21-04-2023 12.39,2023-04-21 12:58:41,21.64,40.0
06-07-2023 10.32,06-07-2023 10.50,2023-07-06 11:06:19,18.58,16.0
25-05-2023 09.00,25-05-2023 09.04,2023-05-25 09:08:17,4.15,13.0
02-03-2024 12.22,02-03-2024 12.26,2024-03-02 12:36:44,4.03,40.0
2023/08/24 09:46:00,24-08-2023 10.00,2023-08-24 10:19:40,14.86,19.0
17-09-2024 11.09,17-09-2024 11.28,2024-09-17 11:39:55,18.99,31.0
30-01-2024 15.33,30-01-2024 15.44,2024-01-30 15:45:00,11.0,25.0
2023/10/21 11:11:00,21-10-2023 11.34,2023-10-21 11:41:13,23.04,30.0
30-12-2023 13.00,30-12-2023 13.01,2023-12-30 13:02:00,1.0,30.0
16-11-2023 11.36,16-11-2023 12.04,2023-11-16 12:17:36,28.05,70.0
22-07-2024 11.13,22-07-2024 11.39,2024-07-22 11:54:34,26.76,32.0
22-02-2023 12.43,22-02-2023 13.15,2023-02-22 13:26:35,32.95,23.0
18-10-2023 15.00,18-10-2023 15.18,2023-10-18 15:30:18,18.32,34.0
31-10-2024 9.19,31-10-2024 09.34,2024-10-31 09:42:40,15.24,18.0
11-12-2023 09.32,11-12-2023 09.53,2023-12-11 10:00:57,21.21,38.0
2024/11/06 13:45:00,06-11-2024 14.02,2024-11-06 14:14:37,17.88,30.0
2023/12/19 09:20:00,19-12-2023 09.30,2023-12-19 09:46:43,10.25,0.0
16-05-2023 10.25,16-05-2023 10.51,2023-05-16 11:09:44,26.18,24.0
06-03-2023 10.32,06-03-2023 10.59,2023-03-06 11:11:04,27.83,20.0
13-02-2024 14.38,13-02-2024 15.03,2024-02-13 15:13:10,25.15,31.0
2024/02/21 11:48:00,21-02-2024 12.09,2024-02-21 12:18:29,21.2,40.0
03-01-2024 13.25,03-01-2024 13.42,2024-01-03 14:01:10,17.77,36.0
29-06-2023 13.57,29-06-2023 14.22,2023-06-29 14:33:51,,25.0
16-07-2024 14.42,16-07-2024 15.05,2024-07-16 15:12:04,23.33,23.0
29-08-2023 15.25,29-08-2023 15.44,2023-08-29 15:45:00,19.0,27.0
19-12-2023 10.09,19-12-2023 10.23,2023-12-19 10:33:48,14.08,32.0
08-12-2023 12.10,08-12-2023 12.30,2023-12-08 12:40:40,900.0,59.0
22-04-2024 10.34,22-04-2024 10.59,2024-04-22 11:11:13,25.43,30.0
2024/07/17 09:12:00,17-07-2024 09.40,2024-07-17 09:56:46,28.08,56.0
16-09-2023 09.31,16-09-2023 09.53,2023-09-16 10:03:47,22.34,20.0
04-11-2023 10.11,04-11-2023 10.45,2023-11-04 10:51:21,34.57,45.0
09-01-2023 13.08,09-01-2023 13.21,2023-01-09 13:31:52,13.55,6.0
11-12-2023 12.24,11-12-2023 12.37,2023-12-11 12:50:26,13.38,40.0
,31-05-2023 10.46,2023-05-31 10:57:26,21.15,9.0
01-09-2023 13.28,01-09-2023 13.38,2023-09-01 13:46:16,10.85,20.0
13-06-2024 13.18,13-06-2024 13.40,2024-06-13 13:47:55,22.37,39.0
,29-02-2024 10.24,2024-02-29 10:33:05,18.97,40.0
12-06-2024 10.23,12-06-2024 10.40,2024-06-12 10:41:57,17.83,34.0
02-02-2024 11.11,02-02-2024 11.44,2024-02-02 11:53:06,33.14,
29-08-2024 10.12,29-08-2024 10.45,2024-08-29 10:55:21,33.2,25.0
08-11-2024 12.56,08-11-2024 13.11,2024-11-08 13:28:18,15.82,29.0
05-01-2023 12.33,05-01-2023 12.54,2023-01-05 13:14:21,21.3,
31-03-2023 14.06,31-03-2023 14.34,2023-03-31 14:56:38,28.63,40.0
19-03-2024 13.10,19-03-2024 13.36,2024-03-19 13:40:30,26.89,23.0
20-02-2023 11.43,20-02-2023 12.03,2023-02-20 12:22:03,20.87,21.0
13-06-2023 09.37,13-06-2023 09.50,2023-06-13 10:03:50,13.41,10.0
22-10-2024 14.23,22-10-2024 14.57,2024-10-22 15:04:40,34.11,44.0
2023/09/23 12:20:00,23-09-2023 12.45,2023-09-23 13:00:00,25.71,44.0
2023/11/04 10:16:00,04-11-2023 10.26,2023-11-04 10:35:48,10.6,32.0
30-12-2023 12.17,30-12-2023 12.40,2023-12-30 12:52:30,23.72,30.0
11-11-2024 14.00,11-11-2024 14.19,2024-11-11 14:21:52,19.09,20.0
27-09-2023 09.45,27-09-2023 10.17,2023-09-27 10:18:06,,63.0
02-11-2024 13.00,02-11-2024 13.01,2024-11-02 13:02:00,1.0,8.0
31-10-2023 11.12,31-10-2023 11.27,2023-10-31 11:35:37,15.2,43.0
2023/03/04 13:00:00,04-03-2023 13.01,2023-03-04 13:02:00,1.0,17.0
2023/01/05 11:46:00,05-01-2023 12.08,2023-01-05 12:28:05,21.43,26.0
19-05-2023 13.07,19-05-2023 13.24,2023-05-19 13:34:40,17.62,15.0
27-07-2023 14.02,27-07-2023 14.19,2023-07-27 14:28:56,17.27,43.0
2023/11/22 15:09:00,22-11-2023 15.36,2023-11-22 15:45:00,27.66,48.0
20-07-2023 14.01,20-07-2023 14.15,2023-07-20 14:30:33,14.95,17.0
2024/02/29 13:59:00,29-02-2024 14.20,2024-02-29 14:51:35,21.54,31.0
16-09-2023 13.00,16-09-2023 13.01,2023-09-16 13:02:00,1.0,37.0
2023/08/03 13:37:00,03-08-2023 14.01,2023-08-03 14:06:19,24.55,54.0
17-07-2023 11.47,17-07-2023 12.03,2023-07-17 12:12:48,16.32,29.0
26-08-2023 13.00,26-08-2023 13.01,2023-08-26 13:02:00,1.0,17.0
24-06-2023 09.03,24-06-2023 09.35,2023-06-24 09:49:05,32.63,49.0
26-10-2024 13.00,26-10-2024 13.01,2024-10-26 13:02:00,1.0,26.0
21-09-2023 10.09,21-09-2023 10.38,2023-09-21 10:48:06,29.69,51.0
23-02-2023 13.57,23-02-2023 14.09,2023-02-23 14:22:54,12.19,17.0
27-07-2023 10.45,27-07-2023 11.06,2023-07-27 11:17:27,21.33,
2024/08/23 13:55:00,23-08-2024 14.13,2024-08-23 14:23:06,18.42,27.0
20-04-2024 11.40,20-04-2024 12.05,2024-04-20 12:17:51,24.71,70.0
24-11-2023 11.18,24-11-2023 11.36,2023-11-24 11:47:50,18.1,14.0
27-12-2023 14.17,27-12-2023 14.30,2023-12-27 14:36:38,13.87,35.0
27-07-2024 13.00,27-07-2024 13.01,2024-07-27 13:02:00,1.0,26.0
02-01-2024 10.28,02-01-2024 10.40,2024-01-02 10:53:32,12.49,32.0
23-04-2024 09.52,23-04-2024 10.09,2024-04-23 10:17:49,17.62,33.0
30-06-2023 12.19,30-06-2023 12.30,2023-06-30 12:43:10,12.0,40.0
23-09-2023 09.00,23-09-2023 09.29,2023-09-23 09:35:50,29.69,191.0
2024/05/28 13:54:00,28-05-2024 14.13,2024-05-28 14:26:47,19.87,27.0
16-05-2024 10.48,16-05-2024 11.07,2024-05-16 11:12:56,19.73,171.0
2023/01/13 11:39:00,13-01-2023 12.16,2023-01-13 12:29:19,37.39,
22-08-2024 12.56,22-08-2024 13.15,2024-08-22 13:24:33,19.59,32.0
17-08-2024 12.09,17-08-2024 12.45,2024-08-17 12:59:55,,62.0
05-03-2024 10.22,05-03-2024 10.56,2024-03-05 11:04:34,34.51,33.0
26-09-2023 15.36,26-09-2023 15.44,2023-09-26 15:45:00,8.0,43.0
01-05-2023 15.37,01-05-2023 15.44,2023-05-01 15:45:00,7.0,25.0
10-10-2024 10.23,10-10-2024 10.54,2024-10-10 11:01:47,31.06,45.0
09-01-2023 10.16,09-01-2023 10.42,2023-01-09 10:48:22,26.47,48.0
18-04-2023 15.35,18-04-2023 15.37,2023-04-18 15:39:44,2.64,25.0
31-07-2023 10.29,31-07-2023 10.47,2023-07-31 10:57:21,18.78,21.0
18-10-2023 11.53,18-10-2023 12.13,2023-10-18 12:22:56,20.55,24.0
2024/03/13 10:20:00,13-03-2024 10.39,2024-03-13 10:50:28,19.02,47.0
31-07-2024 09.44,31-07-2024 10.05,2024-07-31 10:16:19,21.1,26.0
2024/01/05 10:35:00,05-01-2024 10.58,2024-01-05 11:09:14,23.44,37.0
26-08-2024 11.38,26-08-2024 12.04,2024-08-26 12:21:22,26.91,16.0
2024/06/26 15:23:00,26-06-2024 15.44,2024-06-26 15:45:00,21.0,48.0
2023/02/17 13:07:00,17-02-2023 13.32,2023-02-17 13:38:05,25.54,23.0
09-10-2023 11.07,09-10-2023 11.25,2023-10-09 11:31:09,18.48,25.0
13-09-2024 12.19,13-09-2024 12.39,2024-09-13 12:52:55,20.67,30.0
24-03-2023 11.13,24-03-2023 11.31,2023-03-24 11:48:29,18.11,31.0
2023/12/08 13:50:00,08-12-2023 14.02,2023-12-08 14:15:21,12.19,25.0
16-03-2023 14.33,16-03-2023 14.58,2023-03-16 15:08:20,25.0,41.0
30-04-2024 09.00,30-04-2024 09.25,2024-04-30 09:37:22,25.97,28.0
2024/03/06 14:42:00,06-03-2024 15.04,2024-03-06 15:19:03,22.57,157.0
13-01-2023 14.59,13-01-2023 15.01,2023-01-13 15:14:11,2.11,7.0
11-05-2024 10.26,11-05-2024 10.35,2024-05-11 10:42:45,9.55,32.0
11-01-2023 13.26,11-01-2023 13.48,2023-01-11 13:59:10,22.2,17.0
21-11-2024 10.00,21-11-2024 10.21,2024-11-21 10:31:39,400.0,38.0
14-03-2024 14.15,14-03-2024 14.32,2024-03-14 14:37:57,17.09,45.0
2024/06/15 10:38:00,15-06-2024 11.01,2024-06-15 11:10:43,23.13,30.0
02-03-2024 10.41,02-03-2024 10.47,2024-03-02 10:56:49,6.74,32.0
19-07-2023 14.58,19-07-2023 15.23,2023-07-19 15:33:45,,52.0
24-10-2023 12.42,24-10-2023 13.04,2023-10-24 13:17:27,22.27,30.0
09-05-2023 10.23,09-05-2023 10.33,2023-05-09 10:44:26,10.71,32.0
15-03-2024 11.41,15-03-2024 12.08,2024-03-15 12:13:57,27.2,30.0
2024/04/13 12:24:00,13-04-2024 12.50,2024-04-13 13:00:00,26.08,23.0
2024/06/06 12:22:00,06-06-2024 12.33,2024-06-06 12:44:00,11.16,40.0
27-12-2023 12.31,27-12-2023 12.38,2023-12-27 12:44:45,7.43,
26-06-2023 11.29,26-06-2023 11.46,2023-06-26 11:54:02,17.2,194.0
06-04-2023 15.35,06-04-2023 15.44,2023-04-06 15:45:00,9.91,25.0
12-04-2023 10.37,12-04-2023 11.10,2023-04-12 11:23:33,33.66,50.0
13-06-2023 11.26,13-06-2023 11.51,2023-06-13 12:02:25,25.23,11.0
07-01-2023 09.04,07-01-2023 09.33,2023-01-07 09:44:24,29.33,35.0
02-06-2023 09.58,02-06-2023 10.22,2023-06-02 10:32:52,24.71,26.0
2023/07/04 09:18:00,04-07-2023 09.35,2023-07-04 09:45:36,17.54,28.0
20-06-2023 09.23,20-06-2023 09.45,2023-06-20 09:58:02,22.4,28.0
2024/11/13 09:52:00,13-11-2024 10.08,2024-11-13 10:13:49,16.27,18.0
26-04-2024 10.54,26-04-2024 11.16,2024-04-26 11:30:41,22.93,24.0
2023/10/17 13:46:00,17-10-2023 14.03,2023-10-17 14:14:45,17.6,17.0
02-07-2024 12.06,02-07-2024 12.33,2024-07-02 12:46:19,27.04,30.0
10-08-2023 11.19,10-08-2023 11.38,2023-08-10 11:48:36,19.37,37.0
2023/10/18 11:34:00,18-10-2023 11.58,2023-10-18 12:06:27,24.54,60.0
2024/08/22 11:10:00,22-08-2024 11.31,2024-08-22 11:40:37,21.82,50.0
18-12-2023 13.42,18-12-2023 14.11,2023-12-18 14:27:19,29.98,52.0
17-06-2024 14.35,17-06-2024 14.47,2024-06-17 14:52:24,12.22,26.0
10-06-2024 14.57,10-06-2024 15.12,2024-06-10 15:20:05,15.91,22.0
05-01-2023 10.28,05-01-2023 10.56,2023-01-05 11:09:27,28.02,40.0
20-05-2023 09.55,20-05-2023 10.10,2023-05-20 10:23:26,15.64,
2024/02/15 12:13:00,15-02-2024 12.35,2024-02-15 12:47:02,22.26,39.0
01-01-2024 15.18,01-01-2024 15.38,2024-01-01 15:42:38,20.06,47.0
01-08-2023 10.13,01-08-2023 10.31,2023-08-01 10:43:12,18.7,58.0
03-10-2024 13.36,03-10-2024 13.52,2024-10-03 14:00:56,16.91,29.0
07-07-2023 14.44,07-07-2023 15.05,2023-07-07 15:14:18,21.3,23.0
01-11-2023 14.43,01-11-2023 15.02,2023-11-01 15:12:23,19.18,157.0
27-06-2023 13.29,27-06-2023 14.04,2023-06-27 14:15:31,35.76,46.0
17-02-2023 13.42,17-02-2023 13.56,2023-02-17 14:10:07,,25.0
26-08-2023 13.00,26-08-2023 13.01,2023-08-26 13:02:00,1.0,32.0
2023/03/04 13:00:00,04-03-2023 13.01,2023-03-04 13:02:00,1.0,45.0
15-06-2023 12.26,15-06-2023 12.43,2023-06-15 12:55:51,17.69,31.0
2024/02/28 10:43:00,28-02-2024 11.04,2024-02-28 11:15:29,20.72,22.0
28-11-2024 13.17,28-11-2024 13.38,2024-11-28 13:54:58,21.13,42.0
15-05-2023 10.46,15-05-2023 11.11,2023-05-15 11:22:30,25.16,33.0
22-06-2024 13.00,22-06-2024 13.01,2024-06-22 13:02:00,1.0,20.0
11-04-2024 10.48,11-04-2024 11.05,2024-04-11 11:16:51,17.26,24.0
14-10-2023 13.00,14-10-2023 13.01,2023-10-14 13:02:00,1.0,42.0
01-07-2024 15.18,01-07-2024 15.44,2024-07-01 15:45:00,26.0,48.0
25-01-2024 15.37,25-01-2024 15.44,2024-01-25 15:45:00,7.0,25.0
02-11-2024 13.00,02-11-2024 13.01,2024-11-02 13:02:00,1.0,30.0
12-03-2024 13.46,12-03-2024 14.28,2024-03-12 14:40:20,42.6,47.0
12-05-2023 12.46,12-05-2023 12.52,2023-05-12 12:56:51,6.76,40.0
02-09-2024 12.31,02-09-2024 12.42,2024-09-02 12:53:22,11.76,40.0
17-09-2024 12.31,17-09-2024 12.46,2024-09-17 12:58:09,15.82,19.0
07-08-2023 14.47,07-08-2023 15.21,2023-08-07 15:30:45,34.5,48.0
24-02-2024 10.54,24-02-2024 11.30,2024-02-24 11:41:08,36.24,39.0
15-10-2024 15.45,15-10-2024 15.46,2024-10-15 15:47:00,1.0,25.0
20-07-2023 13.29,20-07-2023 14.10,2023-07-20 14:21:06,40.64,201.0
02-08-2023 09.07,02-08-2023 09.23,2023-08-02 09:36:01,15.32,20.0
13-11-2023 12.38,13-11-2023 13.01,2023-11-13 13:26:39,23.37,40.0
2024/02/16 11:15:00,16-02-2024 11.33,2024-02-16 11:40:11,18.67,20.0
08-02-2024 12.28,08-02-2024 12.48,2024-02-08 12:58:20,19.38,38.0
2023/09/21 13:15:00,21-09-2023 13.33,2023-09-21 13:45:14,18.03,42.0
26-06-2023 11.23,26-06-2023 11.32,2023-06-26 11:43:16,9.89,20.0
05-10-2023 12.07,05-10-2023 12.29,2023-10-05 12:36:24,22.42,
13-04-2023 09.14,13-04-2023 09.35,2023-04-13 09:56:56,21.06,27.0
17-03-2023 12.40,17-03-2023 13.00,2023-03-17 13:18:39,20.39,41.0
2023/09/18 09:52:00,18-09-2023 10.15,2023-09-18 10:21:41,23.05,51.0
17-02-2024 13.00,17-02-2024 13.01,2024-02-17 13:02:00,1.0,25.0
11-07-2023 12.09,11-07-2023 12.32,2023-07-11 12:46:16,23.73,41.0
06-07-2023 11.55,06-07-2023 12.17,2023-07-06 12:32:11,22.55,24.0
18-04-2023 10.35,18-04-2023 10.46,2023-04-18 10:56:23,11.98,19.0
12-09-2023 11.05,12-09-2023 11.22,2023-09-12 11:31:50,17.0,3.0
28-11-2024 12.59,28-11-2024 13.10,2024-11-28 13:24:05,11.09,26.0
03-06-2023 12.37,03-06-2023 12.49,2023-06-03 13:00:00,12.44,29.0
2023/07/15 11:48:00,15-07-2023 12.14,2023-07-15 12:21:58,26.09,41.0
13-07-2023 11.57,13-07-2023 12.34,2023-07-13 12:49:14,37.06,54.0
05-03-2024 10.31,05-03-2024 10.40,2024-03-05 10:56:15,9.42,33.0
16-09-2023 11.43,16-09-2023 12.10,2023-09-16 12:20:03,27.05,30.0
2024/05/27 10:41:00,27-05-2024 11.02,2024-05-27 11:11:43,21.99,29.0
2024/01/16 12:12:00,16-01-2024 12.43,2024-01-16 12:46:06,31.22,44.0
13-10-2023 10.34,13-10-2023 10.46,2023-10-13 10:56:11,12.35,32.0
03-02-2023 10.37,03-02-2023 10.59,2023-02-03 11:10:53,22.67,50.0
01-02-2024 10.23,01-02-2024 10.41,2024-02-01 10:53:03,18.45,40.0
2024/04/05 11:15:00,05-04-2024 11.33,2024-04-05 11:46:19,18.76,194.0
05-06-2024 10.09,05-06-2024 10.24,2024-06-05 10:42:39,15.07,0.0
,23-01-2024 10.48,2024-01-23 11:07:23,16.41,32.0
22-07-2024 12.20,22-07-2024 12.21,2024-07-22 12:29:10,1.0,40.0
26-01-2024 14.30,26-01-2024 14.58,2024-01-26 15:07:39,28.1,26.0
10-08-2024 12.34,10-08-2024 12.50,2024-08-10 13:00:00,,40.0
,02-05-2023 13.46,2023-05-02 13:59:15,13.82,17.0
06-04-2024 13.00,06-04-2024 13.01,2024-04-06 13:02:00,1.0,45.0
25-05-2024 13.00,25-05-2024 13.01,2024-05-25 13:02:00,1.0,58.0
15-04-2024 10.33,15-04-2024 10.40,2024-04-15 10:49:30,7.59,32.0
2023/08/24 12:56:00,24-08-2023 13.13,2023-08-24 13:17:30,17.42,20.0
05-04-2024 13.30,05-04-2024 13.46,2024-04-05 13:57:43,16.58,17.0
28-11-2023 15.23,28-11-2023 15.39,2023-11-28 15:45:00,16.6,8.0
04-07-2024 13.04,04-07-2024 13.30,2024-07-04 13:37:08,26.61,
2023/05/02 14:40:00,02-05-2023 15.02,2023-05-02 15:13:09,22.75,157.0
31-01-2023 14.01,31-01-2023 14.04,2023-01-31 14:09:42,3.3,32.0
06-08-2024 14.04,06-08-2024 14.14,2024-08-06 14:29:03,10.79,25.0
05-05-2023 12.26,05-05-2023 12.34,2023-05-05 12:40:36,8.15,40.0
09-09-2023 12.47,09-09-2023 12.59,2023-09-09 13:00:00,12.0,32.0
15-01-2024 10.12,15-01-2024 10.23,2024-01-15 10:38:03,11.97,10.0
19-09-2024 12.26,19-09-2024 12.34,2024-09-19 12:45:31,8.58,40.0
14-10-2023 09.29,14-10-2023 09.40,2023-10-14 09:42:21,11.24,6.0
17-03-2023 11.32,17-03-2023 11.53,2023-03-17 12:01:13,21.86,60.0
27-11-2023 14.05,27-11-2023 14.12,2023-11-27 14:23:11,7.64,17.0
2024/07/30 10:36:00,30-07-2024 10.50,2024-07-30 11:00:45,14.42,13.0
04-02-2023 12.20,04-02-2023 12.43,2023-02-04 12:58:42,23.73,44.0
02-10-2024 10.40,02-10-2024 11.02,2024-10-02 11:13:53,21.67,22.0
17-07-2024 11.36,17-07-2024 11.58,2024-07-17 11:59:07,22.13,30.0
28-07-2023 15.19,28-07-2023 15.34,2023-07-28 15:37:28,15.74,8.0
21-11-2023 11.35,21-11-2023 11.58,2023-11-21 12:10:54,23.33,32.0
20-06-2023 14.43,20-06-2023 15.00,2023-06-20 15:12:26,17.75,38.0
28-09-2023 13.59,28-09-2023 14.13,2023-09-28 14:24:44,14.91,41.0
23-05-2023 13.26,23-05-2023 13.51,2023-05-23 13:58:34,,
2024/03/27 10:40:00,27-03-2024 11.07,2024-03-27 11:11:49,27.84,62.0
2024/04/25 12:18:00,25-04-2024 12.35,2024-04-25 12:47:51,200.0,7.0
31-07-2024 15.45,31-07-2024 15.46,2024-07-31 15:47:00,1.0,25.0
14-01-2023 13.00,14-01-2023 13.01,2023-01-14 13:02:00,1.0,
16-06-2023 09.00,16-06-2023 09.11,2023-06-16 09:16:04,11.11,23.0
30-03-2024 10.47,30-03-2024 11.03,2024-03-30 11:05:14,16.52,27.0
11-03-2023 09.43,11-03-2023 10.09,2023-03-11 10:21:34,26.69,26.0
06-10-2023 14.21,06-10-2023 14.37,2023-10-06 14:47:03,16.93,41.0
17-01-2023 9.38,17-01-2023 10.06,2023-01-17 10:09:49,28.64,53.0
22-03-2024 12.16,22-03-2024 12.41,2024-03-22 12:56:29,25.67,33.0
2023/12/08 09:24:00,08-12-2023 09.54,2023-12-08 10:05:05,30.48,52.0
20-12-2023 14.22,20-12-2023 14.41,2023-12-20 15:03:34,19.93,17.0
13-09-2024 12.27,13-09-2024 12.47,2024-09-13 12:52:49,19.94,43.0
04-11-2024 13.20,04-11-2024 13.40,2024-11-04 13:45:45,20.92,37.0
10-10-2023 10.42,10-10-2023 10.56,2023-10-10 10:59:34,14.66,28.0
23-12-2023 11.13,23-12-2023 11.39,2023-12-23 11:48:49,26.78,51.0
2024/01/12 10:08:00,12-01-2024 10.23,2024-01-12 10:27:52,15.64,22.0
11-06-2024 10.26,11-06-2024 10.51,2024-06-11 11:12:00,25.48,24.0
11-10-2023 10.46,11-10-2023 11.09,2023-10-11 11:28:41,23.47,29.0
08-05-2023 13.15,08-05-2023 13.35,2023-05-08 13:52:28,20.65,30.0
08-11-2023 12.50,08-11-2023 13.15,2023-11-08 13:28:33,25.14,31.0
09-07-2024 10.34,09-07-2024 11.01,2024-07-09 11:13:17,26.32,22.0
01-12-2023 13.23,01-12-2023 13.36,2023-12-01 13:48:23,13.51,37.0
2024/02/16 13:57:00,16-02-2024 14.12,2024-02-16 14:22:23,15.38,35.0
19-06-2023 15.05,19-06-2023 15.31,2023-06-19 15:41:34,26.24,31.0
02-03-2023 09.14,02-03-2023 09.46,2023-03-02 09:59:00,32.59,49.0
19-07-2024 14.27,19-07-2024 14.47,2024-07-19 14:54:53,20.78,45.0
2024/10/30 14:09:00,30-10-2024 14.22,2024-10-30 14:30:49,13.5,15.0
30-04-2024 10.50,30-04-2024 10.59,2024-04-30 11:06:59,9.54,15.0
10-03-2023 11.06,10-03-2023 11.29,2023-03-10 11:38:33,23.46,
14-08-2024 15.19,14-08-2024 15.20,2024-08-14 15:31:07,1.0,7.0
19-07-2024 11.49,19-07-2024 12.03,2024-07-19 12:14:34,14.65,31.0
23-11-2023 12.27,23-11-2023 12.55,2023-11-23 13:05:28,28.74,28.0
13-03-2023 12.25,13-03-2023 12.48,2023-03-13 13:12:52,23.81,40.0
05-08-2023 12.45,05-08-2023 12.59,2023-08-05 13:00:00,14.0,40.0
02-05-2024 9.40,02-05-2024 10.03,2024-05-02 10:15:54,23.21,38.0
16-10-2023 10.30,16-10-2023 11.07,2023-10-16 11:18:32,37.83,33.0
2023/10/12 13:31:00,12-10-2023 13.47,2023-10-12 13:58:00,16.58,23.0
2023/08/05 09:14:00,05-08-2023 09.36,2023-08-05 09:43:27,22.83,29.0
19-06-2024 13.32,19-06-2024 13.59,2024-06-19 14:00:50,27.58,33.0
23-03-2023 14.49,23-03-2023 15.11,2023-03-23 15:22:30,22.05,31.0
14-03-2024 09.40,14-03-2024 10.01,2024-03-14 10:15:00,21.6,47.0
2024/06/06 11:36:00,06-06-2024 12.08,2024-06-06 12:14:25,32.28,48.0
12-11-2024 13.17,12-11-2024 13.50,2024-11-12 14:04:16,33.93,42.0
29-04-2023 13.00,29-04-2023 13.01,2023-04-29 13:02:00,1.0,200.0
03-01-2024 09.23,03-01-2024 09.54,2024-01-03 10:03:16,31.89,53.0
17-03-2023 12.04,17-03-2023 12.45,2023-03-17 13:00:35,41.78,45.0
12-09-2023 12.13,12-09-2023 12.37,2023-09-12 12:53:06,24.8,32.0
26-10-2024 12.26,26-10-2024 12.59,2024-10-26 13:00:00,33.0,54.0
2023/07/22 09:35:00,22-07-2023 10.07,2023-07-22 10:08:18,32.31,54.0
08-04-2023 11.57,08-04-2023 12.14,2023-04-08 12:21:19,17.55,23.0
2024/01/29 13:05:00,29-01-2024 13.27,2024-01-29 13:42:19,22.38,27.0
01-11-2024 14.04,01-11-2024 14.14,2024-11-01 14:29:23,10.78,25.0
,21-04-2023 12.57,2023-04-21 13:08:57,17.63,35.0
08-07-2024 15.44,08-07-2024 15.45,2024-07-08 15:46:00,1.0,25.0
2024/09/28 13:00:00,28-09-2024 13.01,2024-09-28 13:02:00,1.0,45.0
20-06-2023 11.57,20-06-2023 12.13,2023-06-20 12:17:15,16.83,23.0
05-06-2023 15.38,05-06-2023 15.44,2023-06-05 15:45:00,6.0,0.0
03-10-2023 09.35,03-10-2023 09.57,2023-10-03 10:09:45,22.89,47.0
07-08-2023 14.21,07-08-2023 14.45,2023-08-07 14:58:15,24.52,27.0
11-09-2024 13.35,11-09-2024 13.50,2024-09-11 13:59:48,15.53,25.0
10-07-2023 11.11,10-07-2023 11.41,2023-07-10 11:56:38,30.38,28.0
28-10-2024 10.14,28-10-2024 10.46,2024-10-28 10:51:58,32.48,45.0
13-11-2023 10.50,13-11-2023 11.16,2023-11-13 11:21:42,26.65,29.0
18-09-2023 11.29,18-09-2023 11.50,2023-09-18 12:03:59,21.83,23.0
12-12-2023 09.12,12-12-2023 09.42,2023-12-12 09:55:29,30.45,36.0
12-11-2024 09.42,12-11-2024 10.01,2024-11-12 10:18:37,19.68,21.0
06-04-2023 13.27,06-04-2023 13.51,2023-04-06 14:04:03,24.11,26.0
2023/03/04 09:23:00,04-03-2023 09.38,2023-03-04 09:44:05,15.11,169.0
23-03-2024 11.11,23-03-2024 11.37,2024-03-23 11:46:41,26.9,25.0
25-06-2024 10.14,25-06-2024 10.41,2024-06-25 10:54:53,27.37,20.0
30-01-2023 14.01,30-01-2023 14.11,2023-01-30 14:22:15,10.96,146.0
2023/09/16 13:00:00,16-09-2023 13.01,2023-09-16 13:02:00,1.0,48.0
18-04-2024 10.44,18-04-2024 10.59,2024-04-18 11:12:20,15.71,16.0
27-05-2024 14.55,27-05-2024 14.59,2024-05-27 15:13:15,4.37,32.0
,30-11-2023 12.26,2023-11-30 12:49:40,29.85,26.0
31-05-2023 15.33,31-05-2023 15.44,2023-05-31 15:45:00,11.0,51.0
29-07-2024 11.26,29-07-2024 11.45,2024-07-29 11:57:58,20.0,32.0
03-04-2024 13.52,03-04-2024 14.04,2024-04-03 14:15:32,12.47,25.0
2023/05/17 15:20:00,17-05-2023 15.39,2023-05-17 15:45:00,19.77,23.0
08-10-2024 15.28,08-10-2024 15.44,2024-10-08 15:45:00,16.0,24.0
18-02-2023 13.00,18-02-2023 13.01,2023-02-18 13:02:00,1.0,25.0
17-02-2023 14.01,17-02-2023 14.26,2023-02-17 14:37:56,25.62,26.0
11-05-2023 14.35,11-05-2023 15.44,2023-05-11 15:45:00,69.0,48.0
23-03-2023 9.00,23-03-2023 09.25,2023-03-23 09:31:47,25.11,38.0
23-01-2023 13.54,23-01-2023 14.09,2023-01-23 14:20:44,15.78,32.0
07-08-2024 10.06,07-08-2024 10.25,2024-08-07 10:29:45,19.44,34.0
23-01-2024 11.45,23-01-2024 12.11,2024-01-23 12:19:02,26.87,46.0
2023/03/20 12:36:00,20-03-2023 12.42,2023-03-20 12:54:43,6.49,17.0
05-12-2023 11.45,05-12-2023 12.01,2023-12-05 12:12:46,16.23,23.0
05-08-2024 15.26,05-08-2024 15.42,2024-08-05 15:45:00,16.2,37.0
08-03-2023 10.49,08-03-2023 11.05,2023-03-08 11:12:31,16.02,22.0
16-01-2023 12.05,16-01-2023 12.32,2023-01-16 12:44:19,27.41,29.0
01-12-2023 10.45,01-12-2023 11.06,2023-12-01 11:16:07,21.87,22.0
27-10-2023 9.22,27-10-2023 09.40,2023-10-27 09:53:44,18.5,12.0
08-04-2024 10.56,08-04-2024 11.25,2024-04-08 11:35:55,,51.0
2024/02/19 09:48:00,19-02-2024 09.57,2024-02-19 10:01:17,9.68,18.0
2023/11/24 10:57:00,24-11-2023 11.22,2023-11-24 11:34:14,25.61,42.0
14-08-2023 12.11,14-08-2023 12.25,2023-08-14 12:40:35,14.66,7.0
18-10-2024 12.07,18-10-2024 12.32,2024-10-18 12:47:05,25.41,38.0
,07-04-2023 09.35,2023-04-07 09:38:09,23.88,20.0
17-10-2023 13.43,17-10-2023 14.05,2023-10-17 14:14:09,22.22,17.0
24-10-2023 11.54,24-10-2023 12.24,2023-10-24 12:41:44,29.82,36.0
2023/07/13 14:20:00,13-07-2023 14.36,2023-07-13 14:49:26,16.21,17.0
08-04-2023 10.23,08-04-2023 10.49,2023-04-08 11:00:52,25.54,40.0
2023/05/31 11:54:00,31-05-2023 12.11,2023-05-31 12:26:43,17.3,33.0
09-02-2023 10.53,09-02-2023 11.18,2023-02-09 11:29:04,25.53,31.0
23-08-2024 09.12,23-08-2024 09.39,2024-08-23 09:48:02,27.82,36.0
06-04-2023 11.45,06-04-2023 11.47,2023-04-06 11:53:51,2.86,2.0
24-07-2023 14.40,24-07-2023 15.11,2023-07-24 15:26:38,31.52,31.0
25-12-2023 12.42,25-12-2023 12.54,2023-12-25 12:58:36,12.45,19.0
07-10-2024 09.20,07-10-2024 09.52,2024-10-07 10:04:19,32.56,36.0
22-04-2023 13.00,22-04-2023 13.01,2023-04-22 13:02:00,1.0,8.0
2023/01/24 10:35:00,24-01-2023 10.45,2023-01-24 10:56:53,10.51,32.0
06-09-2023 11.54,06-09-2023 12.16,2023-09-06 12:23:44,,28.0
10-07-2024 11.24,10-07-2024 11.45,2024-07-10 11:58:15,21.02,31.0
30-03-2024 13.00,30-03-2024 13.01,2024-03-30 13:02:00,1.0,38.0
10-02-2023 10.04,10-02-2023 10.36,2023-02-10 10:40:17,32.43,48.0
2024/06/26 11:01:00,26-06-2024 11.22,2024-06-26 11:33:26,21.71,0.0
28-02-2023 10.25,28-02-2023 10.53,2023-02-28 10:56:34,28.57,48.0
19-09-2024 13.57,19-09-2024 14.06,2024-09-19 14:14:53,9.21,25.0
20-05-2024 13.44,20-05-2024 15.23,2024-05-20 15:34:57,99.96,22.0
24-05-2023 15.21,24-05-2023 15.44,2023-05-24 15:45:00,23.0,59.0
19-11-2024 13.53,19-11-2024 14.25,2024-11-19 14:42:47,32.17,40.0
2024/08/17 12:04:00,17-08-2024 12.26,2024-08-17 12:36:58,22.29,30.0
17-07-2023 13.36,17-07-2023 14.49,2023-07-17 14:58:33,72.52,20.0
29-07-2024 10.14,29-07-2024 10.33,2024-07-29 10:50:59,19.22,47.0
12-09-2023 13.57,12-09-2023 14.06,2023-09-12 14:17:49,9.12,25.0
09-01-2024 09.02,09-01-2024 09.26,2024-01-09 09:39:25,24.22,28.0
2024/07/30 12:44:00,30-07-2024 12.59,2024-07-30 13:17:18,15.42,40.0
14-08-2024 14.41,14-08-2024 14.53,2024-08-14 15:02:29,12.01,17.0
07-10-2023 10.27,07-10-2023 11.02,2023-10-07 11:15:29,,39.0
01-07-2024 10.57,01-07-2024 11.11,2024-07-01 11:12:39,14.46,28.0
11-07-2023 12.55,11-07-2023 13.16,2023-07-11 13:26:42,21.11,22.0
2023/10/31 12:43:00,31-10-2023 12.49,2023-10-31 12:56:06,6.88,26.0
22-09-2023 11.24,22-09-2023 11.41,2023-09-22 11:53:01,,11.0
,29-09-2023 13.57,2023-09-29 14:10:47,18.68,27.0
31-05-2023 11.26,31-05-2023 11.47,2023-05-31 12:00:50,21.69,50.0
01-07-2024 11.51,01-07-2024 12.20,2024-07-01 12:30:25,29.17,48.0
13-04-2023 09.20,13-04-2023 09.22,2023-04-13 09:31:03,2.57,10.0
22-01-2024 10.18,22-01-2024 10.59,2024-01-22 11:09:13,41.0,44.0
22-03-2024 10.25,22-03-2024 10.54,2024-03-22 11:06:57,28.29,40.0
,06-07-2024 12.42,2024-07-06 12:58:22,30.38,44.0
08-05-2023 10.42,08-05-2023 10.58,2023-05-08 11:07:13,16.06,171.0
02-11-2024 11.42,02-11-2024 11.58,2024-11-02 12:11:03,16.9,25.0
21-01-2023 09.43,21-01-2023 10.08,2023-01-21 10:25:50,25.35,30.0
15-06-2023 09.03,15-06-2023 09.11,2023-06-15 09:17:30,8.35,13.0
20-12-2023 13.25,20-12-2023 13.49,2023-12-20 14:00:56,24.53,26.0
09-11-2024 09.22,09-11-2024 09.39,2024-11-09 09:50:02,17.85,39.0
30-11-2023 13.52,30-11-2023 14.32,2023-11-30 14:44:45,40.81,75.0
16-08-2024 09.54,16-08-2024 10.17,2024-08-16 10:25:39,23.33,52.0
21-09-2023 09.29,21-09-2023 09.42,2023-09-21 09:49:56,13.63,23.0
24-08-2024 13.00,24-08-2024 13.01,2024-08-24 13:02:00,1.0,32.0
21-10-2024 11.30,21-10-2024 11.57,2024-10-21 12:05:08,27.05,55.0
14-07-2023 10.11,14-07-2023 10.33,2023-07-14 10:45:28,22.8,34.0
20-08-2024 15.25,20-08-2024 15.44,2024-08-20 15:45:00,19.0,32.0
2024/09/23 09:06:00,23-09-2024 09.32,2024-09-23 09:42:45,26.21,28.0
31-01-2023 09.19,31-01-2023 09.34,2023-01-31 09:49:48,14.42,600.0
07-01-2023 10.55,07-01-2023 11.18,2023-01-07 11:42:44,23.13,
09-05-2023 11.47,09-05-2023 12.10,2023-05-09 12:17:59,23.47,31.0
02-09-2023 13.00,02-09-2023 13.01,2023-09-02 13:02:00,1.0,57.0
17-11-2023 9.10,17-11-2023 09.34,2023-11-17 09:49:57,24.66,43.0
2023/09/14 13:58:00,14-09-2023 14.17,2023-09-14 14:24:31,19.43,8.0
20-08-2024 13.50,20-08-2024 14.03,2024-08-20 14:15:33,13.74,25.0
17-01-2023 14.22,17-01-2023 14.33,2023-01-17 14:43:35,11.58,17.0
20-10-2023 10.27,20-10-2023 11.27,2023-10-20 11:42:34,60.48,32.0
26-03-2024 12.34,26-03-2024 12.59,2024-03-26 13:17:08,25.57,41.0
2024/06/11 10:15:00,11-06-2024 10.31,2024-06-11 10:42:39,16.93,18.0
14-03-2024 10.08,14-03-2024 10.43,2024-03-14 10:57:31,35.68,39.0
19-06-2024 11.55,19-06-2024 12.12,2024-06-19 12:23:01,17.43,34.0
29-03-2024 09.47,29-03-2024 09.55,2024-03-29 10:01:10,8.84,18.0
16-08-2024 15.21,16-08-2024 15.44,2024-08-16 15:45:00,22.37,41.0
13-10-2023 10.33,13-10-2023 10.39,2023-10-13 10:47:34,6.83,32.0
20-09-2024 11.50,20-09-2024 12.01,2024-09-20 12:09:19,11.06,27.0
21-10-2023 12.02,21-10-2023 12.16,2023-10-21 12:25:59,14.68,29.0
2023/08/25 15:30:00,25-08-2023 15.44,2023-08-25 15:45:00,14.45,22.0
15-07-2024 10.28,15-07-2024 10.44,2024-07-15 10:55:52,16.83,20.0
19-12-2023 14.35,19-12-2023 14.57,2023-12-19 15:03:32,22.03,23.0
08-05-2024 14.19,08-05-2024 14.36,2024-05-08 14:56:37,17.82,17.0
08-06-2024 12.27,08-06-2024 12.43,2024-06-08 12:46:43,16.4,28.0
2023/12/21 14:12:00,21-12-2023 14.28,2023-12-21 14:32:38,16.38,20.0
22-05-2023 11.15,22-05-2023 11.35,2023-05-22 11:47:54,20.59,33.0
19-03-2024 15.12,19-03-2024 15.38,2024-03-19 15:45:00,26.17,30.0
2024/02/06 10:55:00,06-02-2024 11.12,2024-02-06 11:27:35,17.64,47.0
16-05-2023 14.47,16-05-2023 15.12,2023-05-16 15:18:58,25.05,36.0
10-01-2024 09.00,10-01-2024 09.22,2024-01-10 09:37:44,22.62,24.0
2023/05/04 12:26:00,04-05-2023 12.45,2023-05-04 12:48:25,19.18,36.0
06-02-2023 11.22,06-02-2023 11.55,2023-02-06 12:09:04,33.55,
23-01-2024 10.28,23-01-2024 10.56,2024-01-23 11:09:44,28.92,31.0
2023/11/06 12:36:00,06-11-2023 12.56,2023-11-06 13:09:54,20.27,17.0
2024/05/07 15:19:00,07-05-2024 15.44,2024-05-07 15:45:00,25.37,36.0
27-07-2024 12.32,27-07-2024 12.55,2024-07-27 13:00:00,23.66,37.0
20-02-2024 09.46,20-02-2024 10.07,2024-02-20 10:15:09,21.58,33.0
05-01-2023 15.16,05-01-2023 15.22,2023-01-05 15:35:42,6.82,15.0
2023/12/11 15:05:00,11-12-2023 15.36,2023-12-11 15:45:00,31.97,34.0
14-10-2024 12.37,14-10-2024 13.08,2024-10-14 13:19:00,31.9,33.0
16-05-2024 13.58,16-05-2024 14.07,2024-05-16 14:20:40,9.77,25.0
23-04-2024 14.35,23-04-2024 14.58,2024-04-23 15:06:06,23.61,28.0
2023/01/05 13:19:00,05-01-2023 13.36,2023-01-05 13:49:15,17.25,37.0
2023/09/28 15:27:00,28-09-2023 15.44,2023-09-28 15:45:00,17.0,26.0
14-12-2023 13.21,14-12-2023 13.43,2023-12-14 13:53:14,22.59,26.0
22-07-2023 13.00,22-07-2023 13.01,2023-07-22 13:02:00,1.0,
2023/11/01 10:04:00,01-11-2023 10.31,2023-11-01 10:43:20,27.65,28.0
2023/02/01 09:52:00,01-02-2023 10.09,2023-02-01 10:20:01,17.05,38.0
05-08-2024 10.39,05-08-2024 10.41,2024-08-05 10:49:13,2.72,32.0
15-05-2023 14.50,15-05-2023 15.16,2023-05-15 15:26:56,26.47,48.0
10-04-2024 13.21,10-04-2024 13.41,2024-04-10 13:49:43,20.53,24.0
30-09-2024 09.13,30-09-2024 09.44,2024-09-30 09:52:50,31.53,36.0
10-04-2023 12.47,10-04-2023 12.54,2023-04-10 12:58:58,7.9,40.0
06-09-2023 12.07,06-09-2023 12.26,2023-09-06 12:29:46,19.15,36.0
30-06-2023 09.55,30-06-2023 10.13,2023-06-30 10:22:09,18.1,26.0
2023/10/14 13:00:00,14-10-2023 13.01,2023-10-14 13:02:00,1.0,17.0
29-05-2023 13.00,29-05-2023 13.20,2023-05-29 13:30:37,20.88,32.0
31-05-2023 12.26,31-05-2023 12.48,2023-05-31 12:57:52,22.07,39.0
12-01-2024 13.19,12-01-2024 13.35,2024-01-12 13:45:33,16.84,28.0
19-10-2023 10.36,19-10-2023 11.06,2023-10-19 11:18:43,30.6,49.0
30-05-2023 14.28,30-05-2023 14.49,2023-05-30 15:01:22,21.8,43.0
01-02-2024 13.02,01-02-2024 13.29,2024-02-01 13:39:36,27.68,57.0
24-05-2023 10.38,24-05-2023 10.49,2023-05-24 11:00:17,11.42,32.0
08-01-2024 13.04,08-01-2024 13.25,2024-01-08 13:38:24,21.96,32.0
2024/02/28 13:56:00,28-02-2024 14.29,2024-02-28 14:36:05,33.28,46.0
10-08-2023 13.00,10-08-2023 13.22,2023-08-10 13:33:10,,34.0
2023/11/15 10:37:00,15-11-2023 10.49,2023-11-15 11:01:10,12.05,32.0
2023/07/01 13:00:00,01-07-2023 13.01,2023-07-01 13:02:00,1.0,25.0
2023/11/11 12:17:00,11-11-2023 12.30,2023-11-11 12:39:37,13.93,25.0
21-05-2024 11.26,21-05-2024 11.50,2024-05-21 12:02:43,,24.0
24-04-2023 09.16,24-04-2023 09.43,2023-04-24 09:47:25,27.3,54.0
24-10-2023 11.06,24-10-2023 11.20,2023-10-24 11:36:55,14.62,33.0
11-01-2024 13.00,11-01-2024 13.20,2024-01-11 13:31:39,20.41,36.0
27-07-2023 13.44,27-07-2023 14.05,2023-07-27 14:20:39,21.48,25.0
2024/08/10 13:00:00,10-08-2024 13.01,2024-08-10 13:02:00,1.0,15.0
26-08-2023 13.00,26-08-2023 13.01,2023-08-26 13:02:00,1.0,17.0
20-01-2023 14.32,20-01-2023 14.52,2023-01-20 15:02:00,20.17,47.0
11-10-2024 11.32,11-10-2024 11.54,2024-10-11 12:08:15,22.01,21.0
26-05-2023 12.34,26-05-2023 12.53,2023-05-26 13:04:54,19.19,31.0
05-12-2023 11.34,05-12-2023 11.49,2023-12-05 12:00:32,15.37,194.0
04-11-2024 12.09,04-11-2024 12.34,2024-11-04 12:45:21,25.06,46.0
29-05-2024 14.09,29-05-2024 14.25,2024-05-29 14:42:38,16.07,25.0
21-03-2023 10.21,21-03-2023 10.38,2023-03-21 10:47:27,17.84,32.0
17-07-2023 09.41,17-07-2023 10.04,2023-07-17 10:15:12,23.48,35.0
22-07-2023 12.31,22-07-2023 12.47,2023-07-22 13:00:00,16.13,27.0
04-10-2024 12.51,04-10-2024 13.17,2024-10-04 13:22:03,26.35,21.0
2023/06/10 10:24:00,10-06-2023 10.37,2023-06-10 10:54:35,13.02,0.0
07-02-2024 12.18,07-02-2024 12.44,2024-02-07 12:57:17,26.26,0.0
21-01-2023 13.00,21-01-2023 13.01,2023-01-21 13:02:00,1.0,19.0
01-03-2024 11.19,01-03-2024 11.32,2024-03-01 11:45:02,13.89,22.0
08-02-2023 10.37,08-02-2023 11.12,2023-02-08 11:25:21,35.11,39.0
28-08-2023 11.31,28-08-2023 11.46,2023-08-28 12:02:47,15.78,
18-01-2024 12.30,18-01-2024 12.55,2024-01-18 13:09:17,25.11,44.0
2023/01/09 13:46:00,09-01-2023 14.18,2023-01-09 14:28:11,32.01,46.0
14-08-2024 14.00,14-08-2024 14.24,2024-08-14 14:30:29,24.16,44.0
09-09-2023 10.17,09-09-2023 10.27,2023-09-09 10:38:06,10.51,5.0
07-09-2024 11.32,07-09-2024 11.55,2024-09-07 12:08:54,23.11,31.0
30-06-2023 11.46,30-06-2023 12.06,2023-06-30 12:19:36,20.79,56.0
31-05-2024 09.00,31-05-2024 09.09,2024-05-31 09:16:00,9.57,13.0
14-02-2024 11.33,14-02-2024 11.45,2024-02-14 11:55:28,12.17,29.0
02-07-2024 11.35,02-07-2024 11.55,2024-07-02 12:07:56,20.45,56.0
06-04-2023 12.31,06-04-2023 13.03,2023-04-06 13:12:21,31.37,36.0
06-02-2024 10.06,06-02-2024 10.18,2024-02-06 10:33:10,12.52,21.0
29-09-2023 14.25,29-09-2023 14.40,2023-09-29 14:52:05,15.84,33.0
31-07-2024 10.05,31-07-2024 10.24,2024-07-31 10:31:31,19.09,28.0
28-10-2023 13.00,28-10-2023 13.01,2023-10-28 13:02:00,1.0,47.0
17-05-2023 15.39,17-05-2023 15.44,2023-05-17 15:45:00,5.0,25.0
03-09-2024 11.07,03-09-2024 11.34,2024-09-03 11:47:18,27.77,28.0
11-03-2024 10.23,11-03-2024 10.46,2024-03-11 10:59:23,23.21,40.0
2024/02/02 13:44:00,02-02-2024 14.16,2024-02-02 14:23:30,32.57,25.0
21-03-2023 12.38,21-03-2023 12.48,2023-03-21 12:59:26,10.53,40.0
22-11-2024 14.16,22-11-2024 14.30,2024-11-22 14:41:45,14.99,38.0
27-05-2024 10.02,27-05-2024 10.29,2024-05-27 10:44:33,27.58,31.0
2023/05/24 11:29:00,24-05-2023 11.46,2023-05-24 12:01:35,17.02,31.0
05-06-2023 10.43,05-06-2023 11.02,2023-06-05 11:15:22,18.93,49.0
22-03-2023 12.34,22-03-2023 13.03,2023-03-22 13:16:15,28.34,26.0
04-12-2023 11.51,04-12-2023 12.14,2023-12-04 12:24:47,23.14,28.0
2023/06/15 11:38:00,15-06-2023 12.02,2023-06-15 12:17:25,24.04,42.0
04-11-2023 09.55,04-11-2023 10.18,2023-11-04 10:32:35,23.28,30.0
2024/05/24 10:25:00,24-05-2024 10.55,2024-05-24 11:03:58,30.66,36.0
04-10-2023 10.31,04-10-2023 10.36,2023-10-04 10:44:34,5.92,32.0
2023/03/09 14:24:00,09-03-2023 14.35,2023-03-09 14:43:06,11.23,17.0
13-09-2023 13.25,13-09-2023 13.46,2023-09-13 13:59:10,21.6,15.0
17-08-2024 09.32,17-08-2024 09.54,2024-08-17 10:17:48,22.23,30.0
19-06-2023 12.38,19-06-2023 12.44,2023-06-19 12:52:46,6.67,40.0
27-02-2024 12.45,27-02-2024 13.06,2024-02-27 13:18:18,21.01,0.0
04-12-2023 11.07,04-12-2023 11.37,2023-12-04 11:45:43,30.06,30.0
13-05-2024 15.45,13-05-2024 15.46,2024-05-13 15:47:00,1.0,25.0
13-02-2024 09.11,13-02-2024 09.27,2024-02-13 09:37:58,15.25,20.0
27-09-2023 09.16,27-09-2023 09.44,2023-09-27 09:59:11,28.55,56.0
25-01-2024 15.39,25-01-2024 15.44,2024-01-25 15:45:00,5.0,43.0
2023/09/20 13:54:00,20-09-2023 13.59,2023-09-20 14:08:34,5.32,25.0
03-05-2023 11.12,03-05-2023 11.28,2023-05-03 11:45:05,16.8,29.0
18-03-2024 11.59,18-03-2024 12.20,2024-03-18 12:30:32,21.72,30.0
25-04-2024 12.42,25-04-2024 13.02,2024-04-25 13:05:16,20.87,20.0
2024/02/21 12:10:00,21-02-2024 12.57,2024-02-21 13:05:44,47.12,57.0
08-05-2023 12.27,08-05-2023 12.49,2023-05-08 13:02:36,22.51,44.0
13-07-2024 13.00,13-07-2024 13.01,2024-07-13 13:02:00,1.0,37.0
2023/10/10 10:55:00,10-10-2023 11.15,2023-10-10 11:25:30,20.7,50.0
2024/11/25 09:00:00,25-11-2024 09.29,2024-11-25 09:46:04,29.92,32.0
14-03-2024 09.04,14-03-2024 09.21,2024-03-14 09:41:50,17.07,27.0
10-04-2024 14.42,10-04-2024 14.56,2024-04-10 15:16:45,14.89,14.0
23-10-2023 13.17,23-10-2023 13.43,2023-10-23 13:54:18,26.09,36.0
25-07-2023 9.15,25-07-2023 09.28,2023-07-25 09:40:41,,36.0
20-02-2024 13.59,20-02-2024 14.27,2024-02-20 14:34:36,27.4,32.0
01-08-2024 10.18,01-08-2024 10.32,2024-08-01 10:34:19,14.27,34.0
,06-05-2023 13.01,2023-05-06 13:02:00,,13.0
27-09-2024 13.05,27-09-2024 13.24,2024-09-27 13:31:50,19.16,19.0
02-09-2024 11.06,02-09-2024 11.36,2024-09-02 11:46:05,30.77,51.0
09-10-2024 10.04,09-10-2024 10.51,2024-10-09 11:01:26,47.52,22.0
25-10-2023 09.19,25-10-2023 09.38,2023-10-25 09:45:11,19.4,29.0
2023/03/13 11:03:00,13-03-2023 11.35,2023-03-13 11:45:35,32.83,52.0
2023/10/31 12:12:00,31-10-2023 12.33,2023-10-31 12:39:40,21.22,36.0
06-05-2023 12.50,06-05-2023 12.59,2023-05-06 13:00:00,9.0,
17-06-2024 15.03,17-06-2024 15.31,2024-06-17 15:45:00,28.72,51.0
22-02-2024 13.52,22-02-2024 14.01,2024-02-22 14:13:57,9.89,25.0
04-06-2024 14.56,04-06-2024 15.22,2024-06-04 15:30:30,25.91,30.0
28-01-2023 10.35,28-01-2023 10.36,2023-01-28 10:37:00,1.0,32.0
2024/10/31 15:12:00,31-10-2024 15.44,2024-10-31 15:45:00,32.0,43.0
2023/10/07 13:00:00,07-10-2023 13.01,2023-10-07 13:02:00,,15.0
2024/04/26 11:55:00,26-04-2024 12.21,2024-04-26 12:23:18,26.41,29.0
2024/10/12 13:00:00,12-10-2024 13.01,2024-10-12 13:02:00,1.0,32.0
2023/07/15 11:10:00,15-07-2023 11.37,2023-07-15 11:47:56,27.39,34.0
22-09-2023 10.55,22-09-2023 11.21,2023-09-22 11:25:04,26.08,19.0
2023/11/17 12:25:00,17-11-2023 12.43,2023-11-17 12:50:33,18.13,33.0
04-07-2023 13.54,04-07-2023 14.02,2023-07-04 14:09:14,8.32,25.0
22-12-2023 12.29,22-12-2023 12.41,2023-12-22 12:45:17,12.06,25.0
12-08-2023 09.12,12-08-2023 09.43,2023-08-12 09:57:42,31.52,40.0
15-04-2023 10.37,15-04-2023 11.04,2023-04-15 11:13:34,27.58,34.0
21-11-2023 12.40,21-11-2023 13.01,2023-11-21 13:12:56,21.6,32.0
27-01-2023 14.59,27-01-2023 15.13,2023-01-27 15:28:36,14.25,14.0
11-01-2024 14.48,11-01-2024 15.11,2024-01-11 15:22:00,23.01,36.0
04-05-2023 11.11,04-05-2023 11.36,2023-05-04 11:47:36,25.83,34.0
2024/05/18 11:38:00,18-05-2024 12.09,2024-05-18 12:24:11,31.61,39.0
31-01-2024 14.55,31-01-2024 15.15,2024-01-31 15:24:55,20.67,34.0
05-11-2024 10.27,05-11-2024 10.52,2024-11-05 11:14:51,25.88,153.0
05-02-2024 11.45,05-02-2024 12.21,2024-02-05 12:24:56,36.24,48.0
03-10-2023 11.04,03-10-2023 11.19,2023-10-03 11:29:23,15.75,24.0
27-04-2023 10.20,27-04-2023 10.36,2023-04-27 10:47:54,16.07,21.0
2023/10/02 10:17:00,02-10-2023 10.37,2023-10-02 10:45:08,20.05,26.0
21-05-2024 09.00,21-05-2024 09.27,2024-05-21 09:42:49,27.19,32.0
24-04-2023 13.46,24-04-2023 14.02,2023-04-24 14:12:03,16.3,30.0
31-10-2024 10.28,31-10-2024 10.56,2024-10-31 11:04:57,27.34,40.0
08-10-2024 14.30,08-10-2024 14.43,2024-10-08 14:50:24,13.26,35.0
2023/12/29 11:58:00,29-12-2023 12.39,2023-12-29 12:49:16,41.35,57.0
02-01-2024 11.49,02-01-2024 12.07,2024-01-02 12:24:32,18.76,29.0
2024/06/24 11:22:00,24-06-2024 11.41,2024-06-24 11:53:32,19.11,3.0
19-11-2024 11.10,19-11-2024 11.29,2024-11-19 11:42:40,19.09,31.0
14-02-2023 15.22,14-02-2023 15.44,2023-02-14 15:45:00,22.96,25.0
13-02-2023 10.37,13-02-2023 10.53,2023-02-13 11:02:51,16.29,40.0
2023/04/01 09:36:00,01-04-2023 09.44,2023-04-01 09:53:18,9.0,10.0
2023/12/30 13:00:00,30-12-2023 13.01,2023-12-30 13:02:00,1.0,32.0
06-11-2023 15.10,06-11-2023 15.33,2023-11-06 15:42:04,23.66,25.0
2023/11/14 14:04:00,14-11-2023 14.29,2023-11-14 14:34:31,25.13,38.0
03-06-2023 13.00,03-06-2023 13.01,2023-06-03 13:02:00,1.0,43.0
26-11-2024 10.59,26-11-2024 11.20,2024-11-26 11:31:18,21.78,10.0
2023/08/25 11:58:00,25-08-2023 12.24,2023-08-25 12:31:37,26.07,25.0
26-10-2024 13.00,26-10-2024 13.01,2024-10-26 13:02:00,1.0,25.0
01-03-2023 10.09,01-03-2023 11.41,2023-03-01 11:51:41,92.01,33.0
22-04-2023 13.00,22-04-2023 13.01,2023-04-22 13:02:00,1.0,48.0
09-01-2023 09.34,09-01-2023 09.55,2023-01-09 10:18:11,21.1,24.0
2023/12/14 14:33:00,14-12-2023 15.06,2023-12-14 15:17:06,33.44,55.0
28-06-2024 12.20,28-06-2024 12.30,2024-06-28 12:35:24,10.01,32.0
08-10-2024 12.56,08-10-2024 13.21,2024-10-08 13:33:18,25.76,36.0
19-07-2024 12.34,19-07-2024 13.09,2024-07-19 13:20:43,34.46,36.0
06-03-2024 10.40,06-03-2024 10.59,2024-03-06 11:23:59,19.16,40.0
2024/01/22 10:24:00,22-01-2024 10.51,2024-01-22 11:00:22,27.29,31.0
2023/10/06 12:15:00,06-10-2023 12.41,2023-10-06 12:52:04,26.2,29.0
29-04-2024 15.37,29-04-2024 15.44,2024-04-29 15:45:00,7.0,35.0
11-01-2023 10.23,11-01-2023 10.29,2023-01-11 10:36:33,6.31,32.0
17-01-2023 12.53,17-01-2023 13.01,2023-01-17 13:12:05,8.58,32.0
22-05-2024 09.34,22-05-2024 09.59,2024-05-22 10:11:00,25.84,39.0
08-01-2024 10.25,08-01-2024 10.54,2024-01-08 11:09:47,29.89,38.0
21-03-2024 10.13,21-03-2024 10.35,2024-03-21 10:39:54,22.1,22.0
29-11-2024 15.45,29-11-2024 15.46,2024-11-29 15:47:00,1.0,180.0
30-11-2024 13.00,30-11-2024 13.01,2024-11-30 13:02:00,1.0,50.0
01-01-2024 10.59,01-01-2024 11.30,2024-01-01 11:43:19,31.08,32.0
11-10-2024 11.03,11-10-2024 11.23,2024-10-11 11:31:32,20.83,25.0
2024/06/20 09:07:00,20-06-2024 09.29,2024-06-20 09:43:02,22.15,38.0
22-06-2023 11.37,22-06-2023 11.54,2023-06-22 12:06:21,17.97,47.0
04-04-2023 13.26,04-04-2023 13.36,2023-04-04 13:49:22,10.48,14.0
2024/07/01 13:59:00,01-07-2024 14.08,2024-07-01 14:20:09,9.94,17.0
2023/01/31 11:42:00,31-01-2023 12.03,2023-01-31 12:16:32,20.64,10.0
30-01-2024 09.52,30-01-2024 10.25,2024-01-30 10:29:25,33.07,29.0
30-10-2023 13.11,30-10-2023 13.23,2023-10-30 13:33:49,12.6,17.0
04-06-2024 13.15,04-06-2024 13.40,2024-06-04 13:48:13,25.72,48.0
19-08-2023 13.00,19-08-2023 13.01,2023-08-19 13:02:00,1.0,27.0
04-10-2024 12.13,04-10-2024 12.37,2024-10-04 12:45:39,24.13,30.0
28-04-2023 13.27,28-04-2023 13.50,2023-04-28 13:58:20,23.71,32.0
03-05-2024 14.57,03-05-2024 15.26,2024-05-03 15:39:34,29.67,29.0
15-04-2024 10.59,15-04-2024 11.21,2024-04-15 11:32:45,22.26,50.0
2023/12/12 14:00:00,12-12-2023 14.24,2023-12-12 14:34:29,24.24,29.0
25-06-2024 11.22,25-06-2024 11.47,2024-06-25 11:58:23,25.96,25.0
2024/04/03 13:40:00,03-04-2024 14.14,2024-04-03 14:27:46,34.53,42.0
2023/03/11 13:00:00,11-03-2023 13.01,2023-03-11 13:02:00,1.0,26.0
2024/01/15 09:38:00,15-01-2024 09.45,2024-01-15 09:52:37,7.06,10.0
19-08-2023 13.00,19-08-2023 13.01,2023-08-19 13:02:00,1.0,25.0
,15-02-2023 15.05,2023-02-15 15:22:52,23.59,57.0
2023/12/29 11:40:00,29-12-2023 12.01,2023-12-29 12:17:31,21.91,32.0
06-09-2023 11.55,06-09-2023 12.30,2023-09-06 12:32:45,35.19,48.0
07-11-2023 09.19,07-11-2023 09.48,2023-11-07 09:59:42,29.19,50.0
2023/09/07 09:09:00,07-09-2023 09.40,2023-09-07 09:51:23,31.7,52.0
21-03-2024 15.25,21-03-2024 15.39,2024-03-21 15:45:00,14.97,26.0
23-11-2024 13.00,23-11-2024 13.01,2024-11-23 13:02:00,1.0,29.0
01-02-2024 09.00,01-02-2024 09.28,2024-02-01 09:41:19,28.08,50.0
2023/05/09 15:36:00,09-05-2023 15.44,2023-05-09 15:45:00,7.67,38.0
21-06-2023 9.27,21-06-2023 09.50,2023-06-21 09:59:35,23.33,26.0
09-09-2023 12.05,09-09-2023 12.37,2023-09-09 12:50:18,32.56,57.0
2023/09/21 13:36:00,21-09-2023 14.02,2023-09-21 14:13:20,26.49,25.0
11-06-2024 14.51,11-06-2024 15.12,2024-06-11 15:20:38,20.75,41.0
08-08-2023 13.58,08-08-2023 14.21,2023-08-08 14:57:53,23.19,31.0
05-09-2023 10.29,05-09-2023 10.49,2023-09-05 11:01:31,20.15,29.0
2023/07/11 13:16:00,11-07-2023 13.33,2023-07-11 13:41:22,17.78,200.0
22-08-2024 09.47,22-08-2024 10.13,2024-08-22 10:16:09,26.57,43.0
09-09-2024 14.35,09-09-2024 15.01,2024-09-09 15:06:58,26.61,44.0
19-08-2024 13.37,19-08-2024 14.02,2024-08-19 14:11:44,25.63,28.0
2023/05/12 11:59:00,12-05-2023 12.19,2023-05-12 12:28:50,20.32,300.0
05-05-2023 10.46,05-05-2023 10.51,2023-05-05 10:58:00,5.66,32.0
23-08-2023 12.48,23-08-2023 13.20,2023-08-23 13:34:34,32.93,45.0
2023/06/27 14:38:00,27-06-2023 15.04,2023-06-27 15:15:16,26.12,31.0
26-06-2023 09.12,26-06-2023 09.38,2023-06-26 09:48:32,26.4,63.0
13-06-2024 13.42,13-06-2024 14.17,2024-06-13 14:26:29,35.2,201.0
29-06-2023 11.35,29-06-2023 12.00,2023-06-29 12:13:48,25.62,39.0
2024/08/17 13:00:00,17-08-2024 13.01,2024-08-17 13:02:00,1.0,11.0
22-05-2024 09.04,22-05-2024 09.18,2024-05-22 09:33:51,14.5,27.0
07-06-2024 12.44,07-06-2024 13.24,2024-06-07 13:35:41,40.22,49.0
26-12-2023 10.43,26-12-2023 11.10,2023-12-26 11:18:42,27.37,32.0
03-04-2023 11.54,03-04-2023 12.12,2023-04-03 12:23:06,18.49,40.0
14-10-2023 13.00,14-10-2023 13.01,2023-10-14 13:02:00,1.0,25.0
29-10-2024 11.58,29-10-2024 12.17,2024-10-29 12:28:21,19.39,28.0
02-10-2024 10.36,02-10-2024 10.58,2024-10-02 11:01:11,22.03,
2023/05/05 11:35:00,05-05-2023 11.57,2023-05-05 12:04:19,21.88,38.0
29-04-2024 10.42,29-04-2024 10.55,2024-04-29 11:06:04,13.71,32.0
28-07-2023 12.03,28-07-2023 12.18,2023-07-28 12:28:50,15.09,38.0
11-10-2023 12.55,11-10-2023 13.09,2023-10-11 13:19:06,14.77,26.0
01-11-2024 13.11,01-11-2024 13.23,2024-11-01 13:32:20,12.34,23.0
26-09-2024 09.00,26-09-2024 09.11,2024-09-26 09:15:59,11.17,23.0
23-08-2023 09.43,23-08-2023 10.09,2023-08-23 10:21:07,26.41,39.0
15-04-2023 13.00,15-04-2023 13.01,2023-04-15 13:02:00,1.0,43.0
26-07-2023 10.33,26-07-2023 10.57,2023-07-26 11:07:00,,47.0
31-07-2024 14.44,31-07-2024 15.16,2024-07-31 15:18:03,32.22,47.0
08-11-2023 10.40,08-11-2023 11.03,2023-11-08 11:09:00,23.67,29.0
12-11-2024 09.58,12-11-2024 10.16,2024-11-12 10:30:56,18.35,31.0
2024/10/10 14:29:00,10-10-2024 14.54,2024-10-10 15:09:22,25.29,43.0
13-08-2024 12.15,13-08-2024 12.33,2024-08-13 12:49:35,18.59,16.0
25-11-2024 13.26,25-11-2024 13.59,2024-11-25 14:07:44,33.2,53.0
21-08-2024 12.38,21-08-2024 12.57,2024-08-21 13:12:14,19.04,17.0
18-07-2023 11.43,18-07-2023 11.59,2023-07-18 12:10:15,16.59,25.0
31-07-2023 15.30,31-07-2023 15.44,2023-07-31 15:45:00,13.67,38.0
26-05-2023 11.01,26-05-2023 11.25,2023-05-26 11:35:07,24.17,36.0
18-10-2023 11.05,18-10-2023 11.11,2023-10-18 11:17:11,6.45,10.0
13-11-2024 12.55,13-11-2024 12.56,2024-11-13 13:09:16,1.0,3.0
13-04-2023 11.54,13-04-2023 12.20,2023-04-13 12:29:49,26.64,24.0
19-10-2024 10.31,19-10-2024 10.43,2024-10-19 10:55:14,12.61,32.0
,01-04-2023 13.01,2023-04-01 13:02:00,1.0,171.0
2023/01/17 15:05:00,17-01-2023 15.32,2023-01-17 15:44:49,26.79,41.0
18-04-2024 11.05,18-04-2024 11.37,2024-04-18 11:44:55,32.36,55.0
2024/11/28 15:20:00,28-11-2024 15.22,2024-11-28 15:34:12,2.58,32.0
09-07-2024 11.35,09-07-2024 11.56,2024-07-09 12:13:54,21.49,32.0
2024/01/02 10:56:00,02-01-2024 11.25,2024-01-02 11:39:52,29.48,50.0
04-04-2024 13.48,04-04-2024 14.08,2024-04-04 14:18:40,20.82,26.0
07-11-2024 09.28,07-11-2024 09.51,2024-11-07 10:03:05,23.93,37.0
05-03-2024 12.25,05-03-2024 12.30,2024-03-05 12:35:43,5.92,40.0
15-11-2023 10.43,15-11-2023 10.50,2023-11-15 11:02:48,7.55,32.0
2023/03/10 10:23:00,10-03-2023 10.40,2023-03-10 10:51:22,17.94,24.0
16-07-2024 15.34,16-07-2024 15.44,2024-07-16 15:45:00,,43.0
18-10-2024 14.00,18-10-2024 14.21,2024-10-18 15:00:35,21.9,36.0
20-05-2024 10.51,20-05-2024 11.20,2024-05-20 11:31:02,29.28,52.0
2024/09/16 11:36:00,16-09-2024 12.01,2024-09-16 12:04:45,25.72,32.0
06-12-2023 14.36,06-12-2023 14.50,2023-12-06 15:00:46,14.96,30.0
19-12-2023 11.43,19-12-2023 12.04,2023-12-19 12:11:18,21.2,15.0
2024/06/17 15:18:00,17-06-2024 15.42,2024-06-17 15:45:00,24.07,30.0
2023/11/06 11:22:00,06-11-2023 11.33,2023-11-06 11:43:05,11.68,43.0
19-07-2024 13.22,19-07-2024 13.39,2024-07-19 13:50:07,17.74,28.0
03-09-2024 11.42,03-09-2024 12.11,2024-09-03 12:27:16,29.53,32.0
2024/08/26 14:43:00,26-08-2024 14.57,2024-08-26 15:15:02,14.62,20.0
23-12-2023 09.08,23-12-2023 09.30,2023-12-23 09:36:43,22.96,32.0
01-11-2023 13.48,01-11-2023 14.16,2023-11-01 14:25:57,28.35,38.0
02-02-2024 14.17,02-02-2024 14.29,2024-02-02 14:42:32,12.34,17.0
23-01-2024 10.59,23-01-2024 11.17,2024-01-23 11:34:05,18.8,40.0
05-07-2023 12.10,05-07-2023 12.29,2023-07-05 12:42:20,19.92,26.0
15-12-2023 11.25,15-12-2023 11.53,2023-12-15 12:05:44,28.87,34.0
17-09-2024 15.40,17-09-2024 15.44,2024-09-17 15:45:00,4.0,25.0
12-07-2023 11.33,12-07-2023 11.58,2023-07-12 12:01:13,25.56,32.0
01-04-2023 10.21,01-04-2023 10.29,2023-04-01 10:40:26,8.37,32.0
12-10-2024 10.21,12-10-2024 10.28,2024-10-12 10:34:18,7.13,32.0
08-08-2024 10.39,08-08-2024 10.55,2024-08-08 11:07:52,16.72,20.0
19-05-2023 10.42,19-05-2023 11.09,2023-05-19 11:13:01,27.32,62.0
23-07-2024 10.42,23-07-2024 10.59,2024-07-23 11:07:38,17.28,171.0
19-03-2024 12.45,19-03-2024 12.56,2024-03-19 13:06:28,11.95,40.0
12-06-2023 09.57,12-06-2023 10.20,2023-06-12 10:21:12,23.22,53.0
2023/03/09 11:10:00,09-03-2023 11.26,2023-03-09 11:34:57,16.86,43.0
14-03-2023 10.07,14-03-2023 10.44,2023-03-14 10:54:36,37.47,57.0
2024/03/27 11:43:00,27-03-2024 12.02,2024-03-27 12:12:21,19.71,31.0
16-10-2023 10.02,16-10-2023 10.23,2023-10-16 10:32:36,21.24,33.0
25-12-2023 12.54,25-12-2023 13.08,2023-12-25 13:12:10,14.41,37.0
2023/07/14 13:32:00,14-07-2023 13.51,2023-07-14 13:59:43,19.93,200.0
2024/02/19 14:30:00,19-02-2024 14.46,2024-02-19 14:54:33,16.25,26.0
03-02-2024 11.26,03-02-2024 11.58,2024-02-03 12:09:56,32.59,42.0
25-05-2024 10.19,25-05-2024 10.50,2024-05-25 11:00:24,31.84,31.0
04-09-2023 10.03,04-09-2023 10.28,2023-09-04 10:34:49,25.37,32.0
11-01-2023 14.19,11-01-2023 14.38,2023-01-11 14:46:55,19.37,
30-12-2023 9.18,30-12-2023 09.46,2023-12-30 09:56:16,28.17,63.0
2024/01/12 10:11:00,12-01-2024 10.27,2024-01-12 10:38:09,16.53,22.0
30-01-2024 12.26,30-01-2024 12.27,2024-01-30 12:29:58,1.15,40.0
06-01-2024 12.57,06-01-2024 12.59,2024-01-06 13:00:00,2.0,34.0
08-01-2024 15.45,08-01-2024 15.46,2024-01-08 15:47:00,1.0,25.0
26-10-2023 12.01,26-10-2023 12.30,2023-10-26 12:31:57,29.77,53.0
24-09-2024 10.16,24-09-2024 10.33,2024-09-24 10:48:13,17.53,32.0
25-02-2023 12.38,25-02-2023 12.59,2023-02-25 13:00:00,21.0,35.0
25-02-2023 12.19,25-02-2023 12.49,2023-02-25 12:58:14,30.58,43.0
22-07-2023 10.28,22-07-2023 10.29,2023-07-22 10:30:00,1.0,32.0
17-09-2024 12.16,17-09-2024 13.07,2024-09-17 13:18:27,51.96,57.0
09-11-2024 13.00,09-11-2024 13.01,2024-11-09 13:02:00,1.0,17.0
2023/05/13 09:42:00,13-05-2023 09.54,2023-05-13 10:01:30,12.82,18.0
18-08-2023 12.13,18-08-2023 12.38,2023-08-18 12:49:44,25.58,48.0
23-02-2024 10.25,23-02-2024 10.45,2024-02-23 11:04:29,20.58,32.0
20-02-2024 12.19,20-02-2024 12.31,2024-02-20 12:43:22,12.98,40.0
12-11-2024 13.55,12-11-2024 14.04,2024-11-12 14:17:48,9.71,25.0
14-06-2023 10.59,14-06-2023 11.18,2023-06-14 11:28:23,19.58,50.0
15-06-2024 11.14,15-06-2024 11.40,2024-06-15 11:44:02,26.57,41.0
20-05-2024 10.46,20-05-2024 11.17,2024-05-20 11:25:38,31.64,56.0
2023/12/02 13:00:00,02-12-2023 13.01,2023-12-02 13:02:00,1.0,24.0
22-08-2023 14.30,22-08-2023 14.45,2023-08-22 14:54:17,15.18,26.0
11-07-2024 12.45,11-07-2024 13.08,2024-07-11 13:32:45,23.91,40.0
23-05-2024 13.24,23-05-2024 13.42,2024-05-23 14:03:39,18.95,36.0
,29-04-2023 10.52,2023-04-29 11:01:12,26.47,29.0
,25-11-2023 12.59,2023-11-25 13:00:00,3.0,41.0
2023/08/10 14:10:00,10-08-2023 14.26,2023-08-10 14:37:13,16.34,26.0
2024/07/09 12:15:00,09-07-2024 12.43,2024-07-09 12:50:45,28.1,48.0
27-03-2023 15.16,27-03-2023 15.44,2023-03-27 15:45:00,,48.0
16-10-2024 14.28,16-10-2024 14.48,2024-10-16 14:56:23,20.36,23.0
19-01-2023 11.00,19-01-2023 11.28,2023-01-19 11:41:45,,50.0
2024/06/21 10:37:00,21-06-2024 11.02,2024-06-21 11:13:15,25.42,32.0
14-07-2023 15.09,14-07-2023 15.33,2023-07-14 15:45:00,24.13,41.0
07-09-2024 12.29,07-09-2024 12.38,2024-09-07 12:42:13,9.27,19.0
31-03-2023 12.22,31-03-2023 12.42,2023-03-31 12:45:49,20.36,33.0
14-01-2023 13.00,14-01-2023 13.01,2023-01-14 13:02:00,1.0,
2024/04/20 13:00:00,20-04-2024 13.01,2024-04-20 13:02:00,1.0,36.0
25-01-2023 10.08,25-01-2023 10.27,2023-01-25 10:39:48,19.74,37.0
16-03-2024 12.14,16-03-2024 12.33,2024-03-16 12:45:13,19.57,15.0
25-02-2023 13.00,25-02-2023 13.01,2023-02-25 13:02:00,1.0,26.0
11-04-2024 12.50,11-04-2024 13.01,2024-04-11 13:14:03,11.04,32.0
16-09-2023 13.00,16-09-2023 13.01,2023-09-16 13:02:00,1.0,24.0
23-11-2023 13.37,23-11-2023 14.05,2023-11-23 14:17:53,28.32,27.0
29-03-2024 12.59,29-03-2024 13.38,2024-03-29 13:43:51,39.66,36.0
24-08-2023 09.50,24-08-2023 09.51,2023-08-24 09:59:32,1.0,10.0
30-06-2023 10.41,30-06-2023 10.52,2023-06-30 10:58:54,11.12,12.0
17-01-2023 10.17,17-01-2023 10.39,2023-01-17 10:57:28,22.04,32.0
26-08-2023 11.33,26-08-2023 12.06,2023-08-26 12:21:41,33.39,36.0
24-01-2023 10.44,24-01-2023 10.59,2023-01-24 11:08:09,15.58,14.0
26-09-2024 15.22,26-09-2024 15.44,2024-09-26 15:45:00,22.0,48.0
12-06-2023 14.51,12-06-2023 15.20,2023-06-12 15:33:37,29.54,39.0
18-03-2023 11.36,18-03-2023 12.15,2023-03-18 12:19:20,39.38,57.0
11-05-2024 13.00,11-05-2024 13.01,2024-05-11 13:02:00,1.0,25.0
14-08-2024 09.51,14-08-2024 10.23,2024-08-14 10:27:55,32.71,29.0
23-10-2023 13.06,23-10-2023 13.18,2023-10-23 13:22:08,12.84,37.0
2023/03/10 10:29:00,10-03-2023 11.04,2023-03-10 11:16:19,35.7,38.0
25-05-2023 12.19,25-05-2023 12.43,2023-05-25 12:45:10,24.16,52.0
06-05-2024 11.04,06-05-2024 11.25,2024-05-06 11:36:49,21.38,33.0
2024/04/05 09:15:00,05-04-2024 09.32,2024-04-05 09:38:49,17.19,169.0
17-07-2023 10.26,17-07-2023 10.58,2023-07-17 11:08:22,32.12,33.0
21-05-2024 12.07,21-05-2024 12.32,2024-05-21 12:39:33,25.01,28.0
03-02-2023 10.04,03-02-2023 10.14,2023-02-03 10:26:27,10.21,19.0
13-11-2024 10.06,13-11-2024 10.21,2024-11-13 10:32:36,15.01,5.0
03-02-2024 12.57,03-02-2024 12.59,2024-02-03 13:00:00,2.0,13.0
26-10-2024 12.24,26-10-2024 12.46,2024-10-26 12:53:59,22.03,37.0
17-02-2024 13.00,17-02-2024 13.01,2024-02-17 13:02:00,1.0,17.0
25-06-2024 12.27,25-06-2024 12.53,2024-06-25 13:00:49,26.96,43.0
28-12-2023 14.05,28-12-2023 14.07,2023-12-28 14:14:33,2.93,25.0
20-01-2023 15.38,20-01-2023 15.44,2023-01-20 15:45:00,6.0,25.0
03-02-2023 10.20,03-02-2023 10.32,2023-02-03 10:45:16,12.6,32.0
19-02-2024 11.53,19-02-2024 12.07,2024-02-19 12:15:52,14.17,15.0
2024/07/08 09:44:00,08-07-2024 10.07,2024-07-08 10:18:09,23.98,47.0
20-02-2024 12.49,20-02-2024 13.16,2024-02-20 13:37:37,27.74,40.0
01-07-2023 12.23,01-07-2023 12.47,2023-07-01 12:59:16,24.93,23.0
03-11-2023 10.23,03-11-2023 10.36,2023-11-03 10:46:37,12.87,5.0
30-04-2024 14.23,30-04-2024 15.01,2024-04-30 15:10:44,38.31,55.0
05-07-2024 11.20,05-07-2024 11.53,2024-07-05 12:04:01,33.03,50.0
16-11-2023 12.14,16-11-2023 12.39,2023-11-16 12:51:07,25.08,37.0
10-04-2023 11.41,10-04-2023 12.04,2023-04-10 12:12:48,23.18,60.0
12-07-2024 09.06,12-07-2024 09.28,2024-07-12 09:46:56,22.84,38.0
29-09-2023 13.56,29-09-2023 14.06,2023-09-29 14:20:35,10.52,0.0
01-04-2023 11.37,01-04-2023 12.03,2023-04-01 12:14:04,26.28,30.0
25-05-2023 14.22,25-05-2023 14.29,2023-05-25 14:42:08,7.35,17.0
17-01-2024 13.22,17-01-2024 13.48,2024-01-17 13:55:10,26.11,25.0
17-05-2024 10.48,17-05-2024 11.05,2024-05-17 11:18:12,17.33,24.0
28-11-2024 09.33,28-11-2024 10.06,2024-11-28 10:16:34,33.8,36.0
26-11-2024 14.01,26-11-2024 14.27,2024-11-26 14:33:11,26.36,37.0
17-06-2023 13.00,17-06-2023 13.01,2023-06-17 13:02:00,1.0,50.0
11-11-2024 13.06,11-11-2024 13.33,2024-11-11 13:44:58,27.3,29.0
09-01-2024 10.42,09-01-2024 10.57,2024-01-09 11:08:36,15.32,16.0
2024/02/02 14:18:00,02-02-2024 14.51,2024-02-02 15:09:05,33.82,42.0
22-03-2024 13.53,22-03-2024 14.01,2024-03-22 14:19:46,8.88,25.0
06-01-2024 13.00,06-01-2024 13.01,2024-01-06 13:02:00,1.0,15.0
29-06-2023 13.26,29-06-2023 13.48,2023-06-29 13:56:45,22.31,36.0
2023/05/31 11:46:00,31-05-2023 12.05,2023-05-31 12:18:01,19.7,23.0
31-10-2023 11.17,31-10-2023 11.40,2023-10-31 11:50:38,23.76,10.0
22-04-2024 11.50,22-04-2024 12.19,2024-04-22 12:26:32,29.36,41.0
2024/10/05 11:25:00,05-10-2024 11.29,2024-10-05 11:34:56,4.61,2.0
10-05-2023 12.29,10-05-2023 13.17,2023-05-10 13:29:13,48.98,57.0
2023/04/13 09:51:00,13-04-2023 11.56,2023-04-13 12:05:54,125.61,28.0
09-10-2023 11.10,09-10-2023 11.34,2023-10-09 11:46:24,24.54,51.0
30-01-2024 11.33,30-01-2024 12.00,2024-01-30 12:09:45,27.4,29.0
05-11-2024 10.20,05-11-2024 10.40,2024-11-05 10:46:10,19.88,45.0
20-07-2023 14.38,20-07-2023 15.10,2023-07-20 15:23:13,32.54,39.0
2023/04/25 12:45:00,25-04-2023 12.58,2023-04-25 13:09:57,13.59,40.0
12-09-2024 15.39,12-09-2024 15.44,2024-09-12 15:45:00,5.0,24.0
2024/02/09 13:52:00,09-02-2024 14.02,2024-02-09 14:13:12,10.87,25.0
03-07-2024 13.45,03-07-2024 13.46,2024-07-03 13:53:23,1.89,25.0
23-02-2024 10.01,23-02-2024 10.28,2024-02-23 10:39:41,27.55,38.0
2023/03/02 11:52:00,02-03-2023 12.09,2023-03-02 12:19:19,17.5,26.0
04-07-2023 10.06,04-07-2023 10.29,2023-07-04 10:42:27,23.43,33.0
2024/03/02 12:18:00,02-03-2024 12.34,2024-03-02 12:42:31,16.35,29.0
16-09-2024 10.19,16-09-2024 10.29,2024-09-16 10:38:55,10.05,32.0
12-05-2023 13.45,12-05-2023 14.05,2023-05-12 14:15:48,20.35,7.0
06-10-2023 13.47,06-10-2023 14.00,2023-10-06 14:10:04,13.7,25.0
09-09-2023 12.11,09-09-2023 12.49,2023-09-09 12:53:40,38.52,44.0
19-01-2024 12.40,19-01-2024 12.49,2024-01-19 13:02:10,9.51,40.0
14-10-2023 12.54,14-10-2023 12.59,2023-10-14 13:00:00,5.0,57.0
18-03-2024 10.42,18-03-2024 11.02,2024-03-18 11:15:19,20.44,55.0
02-10-2024 12.06,02-10-2024 12.28,2024-10-02 12:48:01,22.85,22.0
2024/11/28 12:06:00,28-11-2024 12.30,2024-11-28 12:38:48,24.02,28.0
01-08-2023 11.50,01-08-2023 12.10,2023-08-01 12:20:26,20.35,30.0
15-11-2024 11.54,15-11-2024 12.15,2024-11-15 12:24:48,21.21,31.0
2024/11/18 12:04:00,18-11-2024 12.30,2024-11-18 12:41:40,26.0,43.0
11-07-2024 09.57,11-07-2024 10.16,2024-07-11 10:23:05,19.66,28.0
22-02-2024 09.39,22-02-2024 09.53,2024-02-22 10:02:22,14.32,26.0
17-04-2023 10.53,17-04-2023 11.14,2023-04-17 11:28:14,21.3,47.0
13-02-2024 12.54,13-02-2024 13.10,2024-02-13 13:22:51,16.75,30.0
30-12-2023 09.15,30-12-2023 09.46,2023-12-30 09:53:22,31.02,43.0
16-05-2023 12.08,16-05-2023 12.30,2023-05-16 12:39:15,22.12,30.0
24-06-2023 10.16,24-06-2023 10.19,2023-06-24 10:22:03,3.24,32.0
07-04-2023 14.53,07-04-2023 15.17,2023-04-07 15:27:25,24.61,47.0
23-03-2024 11.21,23-03-2024 11.48,2024-03-23 11:54:50,27.25,55.0
15-01-2024 13.28,15-01-2024 13.44,2024-01-15 13:56:02,16.96,23.0
25-03-2024 15.45,25-03-2024 15.46,2024-03-25 15:47:00,1.0,43.0
29-08-2023 12.10,29-08-2023 12.38,2023-08-29 12:48:11,28.57,28.0
2023/11/16 09:30:00,16-11-2023 09.51,2023-11-16 10:00:27,21.19,31.0
13-07-2024 10.12,13-07-2024 10.26,2024-07-13 10:32:17,14.59,0.0
03-05-2024 14.24,03-05-2024 14.39,2024-05-03 14:56:24,15.44,18.0
14-10-2024 14.45,14-10-2024 15.05,2024-10-14 15:14:46,20.31,26.0
30-11-2024 13.00,30-11-2024 13.01,2024-11-30 13:02:00,1.0,
10-08-2024 12.45,10-08-2024 12.59,2024-08-10 13:00:00,14.0,51.0
09-02-2024 12.35,09-02-2024 12.55,2024-02-09 13:13:57,20.75,40.0
2024/01/23 14:07:00,23-01-2024 14.14,2024-01-23 14:22:32,7.21,25.0
12-10-2024 10.44,12-10-2024 10.59,2024-10-12 11:15:40,15.01,32.0
2024/09/16 10:43:00,16-09-2024 10.52,2024-09-16 11:06:21,9.89,32.0
20-01-2023 13.00,20-01-2023 13.16,2023-01-20 13:29:45,16.31,29.0
31-01-2024 14.51,31-01-2024 15.08,2024-01-31 15:16:57,17.5,33.0
16-10-2023 14.49,16-10-2023 15.21,2023-10-16 15:31:22,32.0,48.0
30-11-2024 10.25,30-11-2024 10.34,2024-11-30 10:49:18,9.81,32.0
02-07-2024 13.03,02-07-2024 13.29,2024-07-02 13:39:26,26.24,35.0
2023/12/28 11:53:00,28-12-2023 12.21,2023-12-28 12:36:57,28.12,32.0
2023/07/28 12:06:00,28-07-2023 12.39,2023-07-28 12:41:36,34.0,44.0
25-11-2023 13.00,25-11-2023 13.01,2023-11-25 13:02:00,1.0,7.0
25-08-2023 11.07,25-08-2023 11.41,2023-08-25 11:49:53,34.38,43.0
07-01-2023 10.50,07-01-2023 11.22,2023-01-07 11:30:34,32.52,43.0
2024/06/19 12:42:00,19-06-2024 13.16,2024-06-19 13:30:03,34.21,51.0
04-03-2024 09.53,04-03-2024 09.54,2024-03-04 10:05:18,1.0,22.0
05-01-2023 12.03,05-01-2023 12.24,2023-01-05 12:32:21,21.83,28.0
05-08-2023 11.51,05-08-2023 12.08,2023-08-05 12:20:18,17.97,25.0
15-02-2024 10.15,15-02-2024 11.00,2024-02-15 11:10:44,45.7,22.0
09-11-2023 12.28,09-11-2023 12.35,2023-11-09 12:42:41,7.5,40.0
2024/03/05 14:00:00,05-03-2024 14.39,2024-03-05 14:49:10,39.79,71.0
28-02-2024 14.08,28-02-2024 14.32,2024-02-28 14:43:22,24.33,51.0
2023/08/05 13:00:00,05-08-2023 13.01,2023-08-05 13:02:00,1.0,51.0
16-05-2024 12.53,16-05-2024 13.15,2024-05-16 13:29:54,22.11,31.0
01-09-2023 15.28,01-09-2023 15.44,2023-09-01 15:45:00,16.0,25.0
24-06-2024 10.00,24-06-2024 10.22,2024-06-24 10:39:25,21.29,47.0
31-01-2024 15.45,31-01-2024 15.46,2024-01-31 15:47:00,1.0,25.0
03-08-2024 13.00,03-08-2024 13.01,2024-08-03 13:02:00,1.0,20.0
27-05-2024 09.51,27-05-2024 10.04,2024-05-27 10:15:45,13.55,29.0
16-09-2024 10.47,16-09-2024 11.01,2024-09-16 11:08:34,14.56,22.0
22-06-2023 14.46,22-06-2023 15.03,2023-06-22 15:17:33,17.44,28.0
08-02-2024 12.03,08-02-2024 12.32,2024-02-08 12:38:12,29.16,35.0
10-09-2024 14.58,10-09-2024 15.27,2024-09-10 15:45:00,29.21,51.0
11-04-2024 13.47,11-04-2024 14.01,2024-04-11 14:08:58,14.84,12.0
2024/10/26 11:09:00,26-10-2024 11.25,2024-10-26 11:29:16,16.02,28.0
15-05-2024 09.46,15-05-2024 11.53,2024-05-15 12:07:09,127.79,28.0
2023/03/21 09:34:00,21-03-2023 09.51,2023-03-21 10:01:15,17.94,40.0
01-07-2024 15.25,01-07-2024 15.44,2024-07-01 15:45:00,19.0,16.0
05-04-2023 12.32,05-04-2023 12.34,2023-04-05 12:49:17,2.03,40.0
20-01-2024 10.53,20-01-2024 11.17,2024-01-20 11:25:40,24.61,37.0
2024/02/22 10:16:00,22-02-2024 10.26,2024-02-22 10:28:27,10.04,11.0
24-06-2024 13.05,24-06-2024 13.25,2024-06-24 13:32:11,20.71,43.0
21-03-2024 14.01,21-03-2024 14.27,2024-03-21 14:36:58,26.02,30.0
23-03-2023 10.34,23-03-2023 11.05,2023-03-23 11:17:07,31.88,33.0
02-12-2023 09.14,02-12-2023 09.36,2023-12-02 09:50:52,22.26,44.0
19-08-2024 14.00,19-08-2024 14.16,2024-08-19 14:30:26,16.46,17.0
18-04-2024 14.58,18-04-2024 15.20,2024-04-18 15:31:33,22.7,33.0
05-10-2023 11.29,05-10-2023 12.00,2023-10-05 12:09:15,31.17,42.0
20-07-2023 14.52,20-07-2023 15.02,2023-07-20 15:23:15,10.37,20.0
28-10-2023 12.30,28-10-2023 12.57,2023-10-28 13:00:00,27.13,24.0
22-02-2024 12.05,22-02-2024 12.24,2024-02-22 12:26:02,19.69,52.0
28-10-2023 11.02,28-10-2023 11.18,2023-10-28 11:27:39,16.03,24.0
2024/04/11 11:12:00,11-04-2024 11.35,2024-04-11 11:45:51,23.62,37.0
06-07-2024 11.29,06-07-2024 11.50,2024-07-06 11:57:40,21.01,40.0
12-04-2023 09.43,12-04-2023 10.06,2023-04-12 10:16:30,23.8,38.0
21-09-2024 09.23,21-09-2024 09.44,2024-09-21 09:50:43,21.02,31.0
28-06-2024 13.11,28-06-2024 13.32,2024-06-28 13:42:18,21.8,15.0
21-03-2023 13.27,21-03-2023 13.48,2023-03-21 13:58:44,21.14,25.0
23-01-2024 11.56,23-01-2024 12.11,2024-01-23 12:22:07,15.09,7.0
2023/03/18 13:00:00,18-03-2023 13.01,2023-03-18 13:02:00,1.0,20.0
31-07-2023 10.56,31-07-2023 11.20,2023-07-31 11:31:57,24.03,
2024/02/23 09:51:00,23-02-2024 10.07,2024-02-23 10:16:34,16.26,34.0
17-10-2023 12.49,17-10-2023 13.32,2023-10-17 13:40:37,43.64,49.0
28-10-2024 14.37,28-10-2024 14.58,2024-10-28 15:12:51,21.42,32.0
27-11-2024 12.06,27-11-2024 12.23,2024-11-27 12:34:09,17.21,33.0
14-09-2024 10.04,14-09-2024 10.22,2024-09-14 10:31:33,18.46,32.0
,09-04-2024 15.44,2024-04-09 15:45:00,14.0,47.0
17-04-2023 11.06,17-04-2023 11.23,2023-04-17 11:40:41,17.02,40.0
17-06-2024 12.16,17-06-2024 12.45,2024-06-17 12:52:41,29.83,28.0
07-05-2024 10.46,07-05-2024 11.01,2024-05-07 11:22:26,15.62,32.0
25-11-2024 15.07,25-11-2024 15.43,2024-11-25 15:45:00,36.03,52.0
02-05-2023 12.35,02-05-2023 12.55,2023-05-02 13:05:16,20.64,32.0
25-10-2024 10.17,25-10-2024 10.19,2024-10-25 10:25:15,2.86,32.0
2023/05/31 15:32:00,31-05-2023 15.39,2023-05-31 15:42:59,7.53,25.0
06-02-2023 9.00,06-02-2023 09.27,2023-02-06 09:43:16,27.78,49.0
29-06-2023 14.06,29-06-2023 15.38,2023-06-29 15:45:00,92.29,47.0
28-06-2023 12.27,28-06-2023 12.46,2023-06-28 12:59:07,19.08,15.0
30-12-2023 13.00,30-12-2023 13.01,2023-12-30 13:02:00,1.0,25.0
2024/03/12 10:33:00,12-03-2024 10.37,2024-03-12 10:42:16,4.79,32.0
08-10-2024 09.18,08-10-2024 09.36,2024-10-08 09:44:14,18.46,29.0
06-10-2023 09.59,06-10-2023 10.15,2023-10-06 10:25:02,16.53,32.0
13-05-2024 14.29,13-05-2024 14.47,2024-05-13 14:57:17,18.98,37.0
19-11-2024 14.20,19-11-2024 14.37,2024-11-19 14:56:21,17.03,17.0
01-04-2024 10.45,01-04-2024 11.19,2024-04-01 11:33:36,34.14,40.0
12-03-2024 10.22,12-03-2024 10.48,2024-03-12 11:00:34,26.24,39.0
30-09-2024 10.08,30-09-2024 10.25,2024-09-30 10:33:27,17.16,27.0
06-05-2023 11.34,06-05-2023 12.01,2023-05-06 12:11:16,27.03,28.0
04-04-2024 15.28,04-04-2024 15.44,2024-04-04 15:45:00,16.0,180.0
31-08-2023 12.42,31-08-2023 13.10,2023-08-31 13:19:59,28.94,0.0
2023/11/17 12:52:00,17-11-2023 13.32,2023-11-17 13:44:12,40.42,49.0
21-06-2023 12.57,21-06-2023 13.14,2023-06-21 13:23:37,17.55,32.0
20-08-2024 11.51,20-08-2024 12.13,2024-08-20 12:29:56,22.31,
22-04-2023 10.03,22-04-2023 10.21,2023-04-22 10:33:18,18.85,33.0
12-08-2023 13.00,12-08-2023 13.01,2023-08-12 13:02:00,1.0,25.0
02-12-2024 09.25,02-12-2024 09.59,2024-12-02 10:04:21,34.27,52.0
19-04-2023 10.41,19-04-2023 10.59,2023-04-19 11:07:41,17.31,49.0
2024/09/05 11:58:00,05-09-2024 12.14,2024-09-05 12:23:50,16.51,20.0
11-03-2024 11.19,11-03-2024 11.47,2024-03-11 11:52:23,28.29,30.0
09-11-2023 14.46,09-11-2023 15.14,2023-11-09 15:27:35,28.23,18.0
06-04-2023 11.57,06-04-2023 12.13,2023-04-06 12:18:31,16.82,23.0
21-11-2023 09.35,21-11-2023 09.59,2023-11-21 10:11:31,24.59,39.0
31-07-2023 11.41,31-07-2023 11.57,2023-07-31 12:09:16,16.15,13.0
04-05-2023 11.28,04-05-2023 11.53,2023-05-04 12:04:12,25.62,34.0
2023/08/21 12:26:00,21-08-2023 12.33,2023-08-21 12:37:49,7.44,40.0
22-08-2024 13.15,22-08-2024 13.34,2024-08-22 13:39:42,19.96,162.0
14-09-2024 11.52,14-09-2024 12.08,2024-09-14 12:12:38,16.15,21.0
26-10-2024 10.39,26-10-2024 10.51,2024-10-26 11:01:03,12.17,14.0
2023/10/06 12:55:00,06-10-2023 13.12,2023-10-06 13:23:27,17.75,36.0
10-02-2024 09.00,10-02-2024 09.22,2024-02-10 09:34:31,22.52,28.0
07-10-2023 10.07,07-10-2023 10.24,2023-10-07 10:37:20,17.32,26.0
2023/09/05 14:47:00,05-09-2023 15.13,2023-09-05 15:23:57,26.15,45.0
21-08-2024 09.02,21-08-2024 09.28,2024-08-21 09:37:59,26.33,37.0
2024/03/04 13:46:00,04-03-2024 14.00,2024-03-04 14:11:08,14.2,25.0
03-05-2024 14.25,03-05-2024 14.56,2024-05-03 15:07:33,31.97,62.0
10-09-2024 09.22,10-09-2024 09.50,2024-09-10 10:05:28,28.35,40.0
02-10-2023 13.45,02-10-2023 14.09,2023-10-02 14:21:04,24.32,38.0
13-09-2023 12.16,13-09-2023 12.37,2023-09-13 12:45:07,21.98,33.0
04-07-2024 10.19,04-07-2024 11.21,2024-07-04 11:36:09,62.35,32.0
14-01-2023 09.59,14-01-2023 10.08,2023-01-14 10:21:36,9.17,10.0
12-02-2024 15.29,12-02-2024 15.44,2024-02-12 15:45:00,15.0,57.0
17-08-2023 11.41,17-08-2023 11.58,2023-08-17 12:12:50,16.73,10.0
18-11-2023 13.00,18-11-2023 13.01,2023-11-18 13:02:00,1.0,37.0
06-03-2024 14.06,06-03-2024 14.15,2024-03-06 14:29:03,9.97,17.0
06-09-2023 09.46,06-09-2023 09.58,2023-09-06 10:08:42,12.23,16.0
27-01-2023 09.29,27-01-2023 09.39,2023-01-27 09:45:14,10.09,5.0
2024/10/15 12:45:00,15-10-2024 13.13,2024-10-15 13:24:39,28.65,41.0
22-10-2024 12.47,22-10-2024 13.08,2024-10-22 13:14:31,21.82,37.0
10-06-2023 13.00,10-06-2023 13.01,2023-06-10 13:02:00,1.0,26.0
27-06-2023 11.44,27-06-2023 12.10,2023-06-27 12:26:13,26.26,32.0
21-04-2023 10.28,21-04-2023 10.40,2023-04-21 10:53:39,12.81,32.0
16-12-2023 13.00,16-12-2023 13.01,2023-12-16 13:02:00,1.0,43.0
03-05-2024 13.54,03-05-2024 14.15,2024-05-03 14:18:56,21.51,30.0
29-06-2024 09.34,29-06-2024 10.02,2024-06-29 10:17:48,28.26,40.0
2024/10/19 10:16:00,19-10-2024 10.47,2024-10-19 10:57:29,31.26,20.0
2023/11/24 12:30:00,24-11-2023 13.07,2023-11-24 13:20:56,37.0,54.0
05-06-2024 9.32,05-06-2024 09.46,2024-06-05 10:01:18,14.14,27.0
2023/05/20 10:45:00,20-05-2023 11.11,2023-05-20 11:22:19,26.2,27.0
2024/11/25 15:15:00,25-11-2024 15.20,2024-11-25 15:30:02,5.26,18.0
29-01-2024 14.24,29-01-2024 14.37,2024-01-29 14:54:51,13.35,18.0
31-03-2023 09.57,31-03-2023 10.18,2023-03-31 10:22:07,21.16,18.0
13-03-2024 14.44,13-03-2024 15.01,2024-03-13 15:20:54,17.28,20.0
05-07-2024 10.17,05-07-2024 10.22,2024-07-05 10:32:33,5.26,32.0
06-09-2024 09.08,06-09-2024 09.26,2024-09-06 09:37:04,18.91,31.0
27-11-2023 09.27,27-11-2023 09.53,2023-11-27 10:04:43,26.94,63.0
19-07-2023 11.37,19-07-2023 12.01,2023-07-19 12:20:25,24.53,34.0
27-01-2024 13.00,27-01-2024 13.01,2024-01-27 13:02:00,1.0,25.0
10-10-2024 13.44,10-10-2024 14.12,2024-10-10 14:16:44,28.08,38.0
05-08-2023 12.04,05-08-2023 12.23,2023-08-05 12:32:17,19.06,33.0
09-03-2023 12.07,09-03-2023 12.37,2023-03-09 12:50:28,30.02,43.0
15-06-2024 13.00,15-06-2024 13.01,2024-06-15 13:02:00,1.0,17.0
21-08-2024 12.43,21-08-2024 13.07,2024-08-21 13:17:09,24.16,37.0
2024/06/29 13:00:00,29-06-2024 13.01,2024-06-29 13:02:00,1.0,28.0
2024/10/26 13:00:00,26-10-2024 13.01,2024-10-26 13:02:00,1.0,49.0
2024/01/30 15:12:00,30-01-2024 15.32,2024-01-30 15:40:59,20.11,12.0
2024/11/05 12:03:00,05-11-2024 12.27,2024-11-05 12:37:34,24.78,35.0
2023/09/15 10:14:00,15-09-2023 10.37,2023-09-15 10:46:25,23.26,37.0
25-08-2023 15.30,25-08-2023 15.44,2023-08-25 15:45:00,14.0,25.0
14-09-2023 11.58,14-09-2023 12.24,2023-09-14 12:28:57,26.35,52.0
16-09-2023 10.28,16-09-2023 10.50,2023-09-16 11:06:59,22.89,32.0
18-07-2023 14.46,18-07-2023 14.59,2023-07-18 15:20:04,13.01,20.0
11-05-2023 11.07,11-05-2023 11.28,2023-05-11 11:38:24,21.09,26.0
22-11-2024 11.15,22-11-2024 11.33,2024-11-22 11:45:57,18.94,42.0
2023/12/06 10:28:00,06-12-2023 10.42,2023-12-06 10:53:10,14.32,32.0
09-04-2024 12.37,09-04-2024 13.03,2024-04-09 13:14:11,26.9,33.0
2023/01/27 10:16:00,27-01-2023 10.41,2023-01-27 10:50:36,24.26,40.0
25-10-2024 9.29,25-10-2024 10.05,2024-10-25 10:12:53,36.85,53.0
07-03-2024 13.36,07-03-2024 13.51,2024-03-07 14:03:45,15.54,32.0
12-10-2024 11.37,12-10-2024 11.54,2024-10-12 11:58:42,17.48,19.0
06-02-2024 13.05,06-02-2024 13.36,2024-02-06 13:47:13,31.42,35.0
22-02-2023 13.40,22-02-2023 14.08,2023-02-22 14:21:14,28.93,33.0
24-03-2023 14.36,24-03-2023 15.11,2023-03-24 15:21:35,35.17,44.0
2023/06/29 15:02:00,29-06-2023 15.20,2023-06-29 15:30:04,18.78,22.0
23-01-2024 12.07,23-01-2024 12.30,2024-01-23 12:40:59,23.41,29.0
07-11-2024 09.13,07-11-2024 09.32,2024-11-07 09:40:48,19.62,31.0
12-08-2023 11.29,12-08-2023 11.36,2023-08-12 11:47:45,7.26,19.0
15-01-2024 10.16,15-01-2024 10.54,2024-01-15 11:11:58,38.19,34.0
02-12-2024 12.04,02-12-2024 12.31,2024-12-02 12:44:05,27.2,47.0
08-06-2023 09.08,08-06-2023 09.32,2023-06-08 09:41:52,24.07,36.0
01-03-2024 14.08,01-03-2024 14.37,2024-03-01 14:48:18,29.63,62.0
14-04-2023 13.19,14-04-2023 13.44,2023-04-14 13:57:18,25.03,26.0
24-08-2023 13.59,24-08-2023 14.14,2023-08-24 14:24:41,15.99,27.0
05-09-2024 11.37,05-09-2024 11.58,2024-09-05 12:10:28,21.89,42.0
29-01-2024 12.29,29-01-2024 12.52,2024-01-29 13:12:22,23.74,40.0
11-12-2023 10.02,11-12-2023 10.13,2023-12-11 10:26:30,11.7,10.0
25-10-2023 10.33,25-10-2023 10.50,2023-10-25 11:02:35,17.41,24.0
19-10-2024 10.21,19-10-2024 10.48,2024-10-19 11:01:30,27.95,40.0
24-06-2024 12.56,24-06-2024 13.20,2024-06-24 13:42:07,24.79,20.0
28-07-2023 11.06,28-07-2023 11.35,2023-07-28 11:45:16,29.78,25.0
30-03-2024 13.00,30-03-2024 13.01,2024-03-30 13:02:00,1.0,44.0
08-11-2024 12.29,08-11-2024 12.35,2024-11-08 12:43:11,6.36,32.0
21-02-2024 11.01,21-02-2024 11.16,2024-02-21 11:27:42,15.4,13.0
2023/04/11 13:36:00,11-04-2023 13.57,2023-04-11 14:05:56,21.17,25.0
,29-02-2024 12.41,2024-02-29 12:52:41,19.9,30.0
27-11-2024 09.06,27-11-2024 09.25,2024-11-27 09:36:50,18.45,25.0
2024/05/08 09:00:00,08-05-2024 09.19,2024-05-08 09:31:29,19.49,34.0
01-09-2023 10.29,01-09-2023 10.55,2023-09-01 11:04:30,26.33,40.0
09-09-2023 11.23,09-09-2023 11.47,2023-09-09 11:58:05,24.06,30.0
21-02-2023 12.22,21-02-2023 12.43,2023-02-21 12:55:06,22.0,36.0
,08-02-2024 15.24,2024-02-08 15:43:38,12.75,20.0
02-08-2023 15.41,02-08-2023 15.44,2023-08-02 15:45:00,3.0,47.0
2024/05/16 15:30:00,16-05-2024 15.35,2024-05-16 15:40:59,5.38,25.0
15-02-2023 12.41,15-02-2023 12.57,2023-02-15 13:12:05,16.98,32.0
14-10-2023 12.51,14-10-2023 12.59,2023-10-14 13:00:00,7.05,24.0
06-06-2024 13.59,06-06-2024 14.26,2024-06-06 14:33:38,27.55,49.0
21-11-2024 12.45,21-11-2024 13.11,2024-11-21 13:22:52,26.34,39.0
19-11-2024 11.32,19-11-2024 11.56,2024-11-19 12:05:54,24.19,30.0
2023/05/09 14:45:00,09-05-2023 15.05,2023-05-09 15:15:34,20.73,157.0
25-05-2023 10.43,25-05-2023 11.05,2023-05-25 11:16:39,22.6,32.0
2024/06/25 12:27:00,25-06-2024 12.55,2024-06-25 13:09:03,28.46,33.0
10-08-2024 12.45,10-08-2024 12.59,2024-08-10 13:00:00,14.0,40.0
20-08-2024 11.58,20-08-2024 12.24,2024-08-20 12:41:05,,30.0
20-10-2023 14.08,20-10-2023 14.26,2023-10-20 14:34:45,18.12,35.0
2023/08/28 12:07:00,28-08-2023 12.43,2023-08-28 12:54:33,36.16,57.0
12-12-2023 13.49,12-12-2023 13.55,2023-12-12 14:03:03,6.93,25.0
09-06-2023 12.47,09-06-2023 12.55,2023-06-09 13:02:26,8.35,40.0
23-08-2024 11.08,23-08-2024 11.34,2024-08-23 11:47:49,26.62,32.0
20-03-2023 10.40,20-03-2023 10.48,2023-03-20 11:01:33,8.79,32.0
01-09-2023 09.10,01-09-2023 09.41,2023-09-01 09:52:40,31.56,46.0
07-02-2024 10.32,07-02-2024 10.39,2024-02-07 10:46:45,7.58,32.0
18-05-2023 09.43,18-05-2023 10.05,2023-05-18 10:14:21,22.48,51.0
02-01-2024 11.01,02-01-2024 11.20,2024-01-02 11:30:45,19.52,125.0
23-10-2023 10.23,23-10-2023 10.24,2023-10-23 10:32:23,1.83,32.0
2023/05/13 13:00:00,13-05-2023 13.01,2023-05-13 13:02:00,1.0,38.0
14-12-2023 14.47,14-12-2023 15.08,2023-12-14 15:19:34,21.82,36.0
2024/11/25 11:34:00,25-11-2024 11.39,2024-11-25 11:50:33,5.08,13.0
2023/08/08 10:35:00,08-08-2023 10.51,2023-08-08 11:02:46,16.85,24.0
11-03-2024 13.53,11-03-2024 14.07,2024-03-11 14:22:34,14.61,25.0
23-12-2023 13.00,23-12-2023 13.01,2023-12-23 13:02:00,1.0,34.0
16-08-2024 10.22,16-08-2024 10.38,2024-08-16 10:55:25,16.79,32.0
25-02-2023 12.41,25-02-2023 12.51,2023-02-25 13:00:00,10.12,40.0
08-02-2023 12.01,08-02-2023 12.23,2023-02-08 12:32:56,22.29,47.0
29-10-2024 13.55,29-10-2024 14.08,2024-10-29 14:12:39,13.41,43.0
23-05-2024 11.59,23-05-2024 12.17,2024-05-23 12:28:48,18.87,38.0
02-05-2023 09.14,02-05-2023 09.44,2023-05-02 09:51:09,30.37,52.0
2024/01/11 15:25:00,11-01-2024 15.44,2024-01-11 15:45:00,19.0,48.0
25-04-2023 11.24,25-04-2023 11.52,2023-04-25 12:07:03,28.08,28.0
24-06-2024 14.49,24-06-2024 15.03,2024-06-24 15:12:47,14.73,28.0
2023/11/02 13:23:00,02-11-2023 13.33,2023-11-02 13:37:24,10.47,37.0
17-07-2024 11.06,17-07-2024 11.33,2024-07-17 11:39:59,27.02,30.0
12-10-2024 13.00,12-10-2024 13.01,2024-10-12 13:02:00,1.0,26.0
2023/12/30 13:00:00,30-12-2023 13.01,2023-12-30 13:02:00,1.0,38.0
18-01-2023 13.53,18-01-2023 14.08,2023-01-18 14:11:39,15.32,20.0
25-01-2023 13.05,25-01-2023 13.28,2023-01-25 13:39:53,23.78,32.0
11-07-2023 11.29,11-07-2023 11.58,2023-07-11 12:08:31,29.77,46.0
2024/09/07 13:00:00,07-09-2024 13.01,2024-09-07 13:02:00,1.0,17.0
16-12-2023 13.00,16-12-2023 13.01,2023-12-16 13:02:00,1.0,26.0
27-06-2024 12.27,27-06-2024 12.44,2024-06-27 12:55:28,17.7,19.0
24-01-2023 10.23,24-01-2023 10.33,2023-01-24 10:45:53,10.22,32.0
19-08-2024 12.34,19-08-2024 12.53,2024-08-19 13:05:09,19.36,46.0
05-10-2024 13.00,05-10-2024 13.01,2024-10-05 13:02:00,1.0,41.0
07-11-2023 12.13,07-11-2023 12.50,2023-11-07 12:53:20,,44.0
2024/02/23 15:16:00,23-02-2024 15.38,2024-02-23 15:45:00,22.44,31.0
04-03-2024 09.42,04-03-2024 10.14,2024-03-04 10:17:06,32.11,63.0
26-06-2024 10.55,26-06-2024 11.23,2024-06-26 11:41:28,28.92,40.0
08-01-2024 12.06,08-01-2024 12.35,2024-01-08 12:45:12,29.42,37.0
23-12-2023 11.42,23-12-2023 12.00,2023-12-23 12:12:49,18.65,37.0
05-01-2023 11.09,05-01-2023 11.13,2023-01-05 11:33:59,4.24,14.0
13-07-2023 12.01,13-07-2023 12.17,2023-07-13 12:27:15,16.67,23.0
25-02-2023 10.02,25-02-2023 10.14,2023-02-25 10:31:30,12.78,24.0
20-06-2023 15.03,20-06-2023 15.22,2023-06-20 15:33:32,19.38,44.0
06-04-2024 13.00,06-04-2024 13.01,2024-04-06 13:02:00,1.0,53.0
31-01-2023 13.57,31-01-2023 14.11,2023-01-31 14:25:16,14.58,25.0
22-03-2024 13.24,22-03-2024 13.54,2024-03-22 14:09:14,30.62,42.0
2023/02/01 11:59:00,01-02-2023 12.29,2023-02-01 12:39:30,29.51,30.0
13-03-2023 10.18,13-03-2023 10.33,2023-03-13 10:37:06,15.02,21.0
2023/12/08 09:01:00,08-12-2023 09.18,2023-12-08 09:27:16,17.46,31.0
2023/03/30 13:27:00,30-03-2023 13.47,2023-03-30 13:56:37,20.44,30.0
08-08-2023 15.10,08-08-2023 15.28,2023-08-08 15:40:30,18.82,23.0
2023/10/19 10:26:00,19-10-2023 10.56,2023-10-19 11:08:27,30.67,50.0
01-10-2024 11.44,01-10-2024 12.08,2024-10-01 12:21:21,24.57,56.0
13-02-2023 09.17,13-02-2023 09.28,2023-02-13 09:48:54,11.5,27.0
14-01-2023 09.57,14-01-2023 10.19,2023-01-14 10:29:09,22.34,40.0
25-09-2023 09.18,25-09-2023 09.36,2023-09-25 09:48:29,18.16,23.0
27-01-2023 11.09,27-01-2023 11.34,2023-01-27 11:49:57,25.71,28.0
19-06-2024 09.04,19-06-2024 09.39,2024-06-19 09:44:51,35.88,52.0
15-04-2023 11.05,15-04-2023 11.30,2023-04-15 11:42:19,25.41,25.0
18-06-2024 13.03,18-06-2024 13.25,2024-06-18 13:27:18,22.61,21.0
18-11-2024 14.29,18-11-2024 14.58,2024-11-18 15:15:43,29.04,51.0
29-01-2024 12.21,29-01-2024 12.29,2024-01-29 12:36:12,8.13,40.0
21-03-2023 13.24,21-03-2023 13.46,2023-03-21 13:59:32,22.34,39.0
08-03-2024 12.16,08-03-2024 12.37,2024-03-08 12:48:53,21.2,28.0
30-03-2023 14.27,30-03-2023 14.35,2023-03-30 14:40:14,,17.0
11-05-2023 12.03,11-05-2023 12.16,2023-05-11 12:30:13,13.1,25.0
12-01-2023 12.44,12-01-2023 13.20,2023-01-12 13:30:59,,36.0
15-05-2024 14.02,15-05-2024 14.14,2024-05-15 14:29:14,12.42,17.0
2023/08/09 14:02:00,09-08-2023 14.22,2023-08-09 14:29:45,20.14,35.0
11-07-2023 13.02,11-07-2023 13.29,2023-07-11 13:37:27,27.47,36.0
18-09-2024 09.42,18-09-2024 09.44,2024-09-18 09:56:36,2.02,22.0
18-09-2023 09.05,18-09-2023 09.37,2023-09-18 09:40:11,32.27,52.0
2023/09/29 12:24:00,29-09-2023 12.29,2023-09-29 12:30:10,5.14,40.0
01-06-2023 13.48,01-06-2023 14.15,2023-06-01 14:25:35,26.56,30.0
25-10-2023 15.33,25-10-2023 15.40,2023-10-25 15:45:00,7.35,25.0
13-05-2024 14.15,13-05-2024 14.27,2024-05-13 14:38:44,12.39,221.0
06-10-2023 13.50,06-10-2023 14.04,2023-10-06 14:19:29,14.15,25.0
27-04-2023 14.47,27-04-2023 15.08,2023-04-27 15:18:23,21.45,37.0
01-02-2023 11.08,01-02-2023 11.28,2023-02-01 11:38:21,20.86,32.0
14-08-2023 15.16,14-08-2023 15.41,2023-08-14 15:45:00,25.05,25.0
22-08-2024 10.00,22-08-2024 10.02,2024-08-22 10:07:32,2.66,10.0
,22-02-2023 10.22,2023-02-22 10:30:20,19.48,34.0
21-03-2023 12.23,21-03-2023 12.27,2023-03-21 12:35:12,4.98,40.0
20-03-2023 10.05,20-03-2023 10.29,2023-03-20 10:40:07,24.38,28.0
2023/07/14 11:33:00,14-07-2023 11.57,2023-07-14 12:11:31,24.22,40.0
27-05-2023 10.17,27-05-2023 10.24,2023-05-27 10:35:01,7.41,32.0
08-05-2023 12.02,08-05-2023 12.33,2023-05-08 12:44:22,31.4,48.0
22-08-2023 13.12,22-08-2023 13.31,2023-08-22 13:44:55,19.29,15.0
2023/01/30 12:13:00,30-01-2023 12.32,2023-01-30 12:43:41,19.29,28.0
10-04-2023 12.51,10-04-2023 13.08,2023-04-10 13:20:27,17.48,29.0
2024/05/24 13:48:00,24-05-2024 14.08,2024-05-24 14:16:49,20.5,10.0
07-11-2023 13.38,07-11-2023 14.08,2023-11-07 14:21:14,30.98,38.0
05-12-2023 12.35,05-12-2023 13.06,2023-12-05 13:16:04,31.13,39.0
15-03-2023 09.58,15-03-2023 10.18,2023-03-15 10:30:45,20.44,31.0
16-03-2024 13.00,16-03-2024 13.01,2024-03-16 13:02:00,1.0,19.0
2023/10/14 09:56:00,14-10-2023 10.37,2023-10-14 10:48:01,41.88,44.0
2023/11/27 11:47:00,27-11-2023 12.19,2023-11-27 12:22:05,32.46,57.0
15-07-2024 13.10,15-07-2024 13.29,2024-07-15 13:40:32,,30.0
2024/08/27 09:56:00,27-08-2024 10.19,2024-08-27 10:34:33,22.57,24.0
02-01-2024 14.41,02-01-2024 14.56,2024-01-02 15:06:23,15.39,16.0
19-03-2024 13.17,19-03-2024 13.30,2024-03-19 13:36:53,13.82,20.0
12-10-2024 13.00,12-10-2024 13.01,2024-10-12 13:02:00,1.0,45.0
23-10-2023 09.07,23-10-2023 09.12,2023-10-23 09:17:31,5.5,13.0
2024/04/05 12:21:00,05-04-2024 12.32,2024-04-05 12:44:50,11.35,40.0
03-01-2024 12.32,03-01-2024 12.43,2024-01-03 12:54:31,11.59,40.0
10-08-2024 10.58,10-08-2024 11.21,2024-08-10 11:30:08,23.03,171.0
10-06-2023 12.00,10-06-2023 12.26,2023-06-10 12:38:04,26.39,30.0
06-01-2023 09.56,06-01-2023 09.59,2023-01-06 10:09:29,3.87,22.0
04-02-2023 11.19,04-02-2023 11.34,2023-02-04 11:46:30,14.95,25.0
06-03-2024 11.17,06-03-2024 11.48,2024-03-06 12:03:08,,56.0
21-04-2023 11.38,21-04-2023 11.54,2023-04-21 12:04:45,16.97,23.0
01-04-2023 13.00,01-04-2023 13.01,2023-04-01 13:02:00,1.0,25.0
24-11-2023 13.34,24-11-2023 15.10,2023-11-24 15:21:20,96.06,22.0
07-10-2023 13.00,07-10-2023 13.01,2023-10-07 13:02:00,1.0,
09-09-2024 10.35,09-09-2024 10.55,2024-09-09 11:07:01,20.72,24.0
20-09-2024 15.41,20-09-2024 15.44,2024-09-20 15:45:00,3.0,
2023/10/12 13:41:00,12-10-2023 14.03,2023-10-12 14:12:09,21.7,38.0
23-08-2024 14.34,23-08-2024 15.06,2024-08-23 15:09:36,32.04,47.0
2023/03/27 10:12:00,27-03-2023 10.28,2023-03-27 10:37:15,16.51,19.0
13-09-2023 09.07,13-09-2023 09.34,2023-09-13 09:45:34,27.97,63.0
15-03-2024 10.13,15-03-2024 10.32,2024-03-15 10:47:43,19.66,39.0
10-05-2024 10.35,10-05-2024 11.08,2024-05-10 11:19:13,33.45,44.0
02-07-2024 11.25,02-07-2024 11.48,2024-07-02 11:51:49,22.56,29.0
2023/09/06 11:25:00,06-09-2023 11.49,2023-09-06 11:55:40,23.78,30.0
01-05-2024 09.00,01-05-2024 09.16,2024-05-01 09:29:34,16.59,12.0
17-07-2023 10.39,17-07-2023 10.48,2023-07-17 10:59:10,9.48,32.0
05-08-2024 13.55,05-08-2024 14.17,2024-08-05 14:18:58,22.98,36.0
01-02-2024 11.01,01-02-2024 11.19,2024-02-01 11:31:57,,24.0
16-01-2023 14.19,16-01-2023 14.55,2023-01-16 15:14:56,36.77,54.0
15-04-2023 11.55,15-04-2023 12.10,2023-04-15 12:16:33,15.92,29.0
09-07-2024 10.21,09-07-2024 10.41,2024-07-09 10:51:36,20.49,40.0
27-05-2024 09.56,27-05-2024 10.17,2024-05-27 10:22:29,21.96,56.0
14-10-2023 13.00,14-10-2023 13.01,2023-10-14 13:02:00,1.0,36.0
24-03-2023 15.25,24-03-2023 15.44,2023-03-24 15:45:00,19.0,43.0
23-02-2024 09.00,23-02-2024 09.22,2024-02-23 09:36:33,22.73,44.0
19-08-2024 12.22,19-08-2024 12.32,2024-08-19 12:42:58,10.37,32.0
,22-07-2024 14.07,2024-07-22 14:14:12,9.19,25.0
21-07-2023 13.18,21-07-2023 13.41,2023-07-21 13:51:41,23.73,25.0
21-01-2023 10.59,21-01-2023 11.14,2023-01-21 11:27:57,15.99,15.0
16-02-2023 12.03,16-02-2023 12.27,2023-02-16 12:38:22,24.33,45.0
19-08-2024 10.29,19-08-2024 10.39,2024-08-19 10:48:43,10.31,32.0
20-11-2023 13.59,20-11-2023 14.21,2023-11-20 14:24:19,22.4,26.0
03-08-2023 15.10,03-08-2023 15.33,2023-08-03 15:44:15,23.12,25.0
01-06-2023 15.18,01-06-2023 15.35,2023-06-01 15:45:00,17.5,26.0
2023/08/28 15:42:00,28-08-2023 15.44,2023-08-28 15:45:00,2.0,25.0
17-04-2023 13.42,17-04-2023 14.09,2023-04-17 14:25:27,27.59,52.0
02-03-2024 11.33,02-03-2024 11.55,2024-03-02 12:04:21,22.43,30.0
29-07-2024 12.10,29-07-2024 12.19,2024-07-29 12:31:23,9.11,
,04-05-2024 12.49,2024-05-04 12:59:54,3.32,40.0
15-04-2023 10.32,15-04-2023 10.41,2023-04-15 10:51:12,9.54,0.0
2023/09/18 13:40:00,18-09-2023 13.51,2023-09-18 14:06:24,11.57,25.0
23-08-2023 12.26,23-08-2023 12.41,2023-08-23 12:48:26,15.54,32.0
04-07-2023 13.15,04-07-2023 13.41,2023-07-04 13:45:30,26.44,44.0
2023/04/05 09:14:00,05-04-2023 09.31,2023-04-05 09:43:59,17.87,43.0
08-08-2023 9.48,08-08-2023 10.00,2023-08-08 10:14:52,12.83,10.0
06-06-2024 15.04,06-06-2024 15.28,2024-06-06 15:35:43,24.64,32.0
05-01-2024 09.16,05-01-2024 09.36,2024-01-05 09:47:36,19.88,39.0
24-09-2024 13.38,24-09-2024 14.00,2024-09-24 14:12:33,22.08,26.0
09-03-2024 10.43,09-03-2024 11.07,2024-03-09 11:21:00,24.34,32.0
05-07-2024 10.26,05-07-2024 10.59,2024-07-05 11:09:24,33.35,33.0
2023/03/07 13:45:00,07-03-2023 13.53,2023-03-07 14:04:04,8.65,25.0
2024/07/26 13:49:00,26-07-2024 14.04,2024-07-26 14:18:06,15.56,25.0
05-10-2024 11.41,05-10-2024 12.02,2024-10-05 12:18:23,21.18,34.0
21-07-2023 12.05,21-07-2023 12.35,2023-07-21 12:45:22,30.0,40.0
22-12-2023 14.59,22-12-2023 15.14,2023-12-22 15:25:43,15.13,18.0
16-10-2024 10.30,16-10-2024 11.02,2024-10-16 11:09:24,32.18,36.0
09-05-2024 11.46,09-05-2024 11.55,2024-05-09 12:09:18,9.43,19.0
20-11-2024 14.57,20-11-2024 15.14,2024-11-20 15:26:38,17.7,23.0
05-11-2024 12.34,05-11-2024 12.56,2024-11-05 13:06:48,22.01,26.0
26-02-2024 13.33,26-02-2024 13.57,2024-02-26 14:11:34,24.55,26.0
25-07-2024 14.31,25-07-2024 14.48,2024-07-25 14:59:40,17.15,26.0
30-08-2023 11.39,30-08-2023 12.10,2023-08-30 12:21:29,31.97,35.0
07-04-2023 15.32,07-04-2023 15.44,2023-04-07 15:45:00,12.0,31.0
2023/06/16 14:28:00,16-06-2023 14.45,2023-06-16 14:56:09,17.83,38.0
28-06-2024 12.50,28-06-2024 13.02,2024-06-28 13:10:18,12.21,6.0
2024/11/04 11:11:00,04-11-2024 11.33,2024-11-04 11:43:10,22.82,15.0
18-04-2023 13.03,18-04-2023 13.23,2023-04-18 13:29:27,20.4,32.0
2023/11/17 10:03:00,17-11-2023 10.26,2023-11-17 10:44:36,23.89,32.0
10-03-2023 13.05,10-03-2023 13.11,2023-03-10 13:24:41,6.98,32.0
08-02-2023 11.08,08-02-2023 11.23,2023-02-08 11:25:20,15.47,28.0
2023/11/25 09:46:00,25-11-2023 10.06,2023-11-25 10:25:15,20.92,26.0
13-04-2023 14.14,13-04-2023 14.31,2023-04-13 14:41:42,17.33,15.0
11-03-2023 13.00,11-03-2023 13.01,2023-03-11 13:02:00,1.0,25.0
04-09-2024 15.45,04-09-2024 15.46,2024-09-04 15:47:00,1.0,25.0
18-02-2023 10.26,18-02-2023 11.56,2023-02-18 12:07:17,90.02,33.0
06-04-2024 13.00,06-04-2024 13.01,2024-04-06 13:02:00,1.0,25.0
20-01-2024 11.30,20-01-2024 11.58,2024-01-20 12:04:25,28.5,30.0
2024/05/07 13:55:00,07-05-2024 14.26,2024-05-07 14:33:21,31.42,49.0
09-03-2023 11.08,09-03-2023 11.29,2023-03-09 11:40:50,21.59,26.0
28-08-2023 13.22,28-08-2023 13.51,2023-08-28 14:02:50,29.44,
11-04-2024 11.11,11-04-2024 11.31,2024-04-11 11:43:24,20.9,10.0
2024/09/05 13:52:00,05-09-2024 13.55,2024-09-05 14:00:57,3.99,25.0
01-08-2023 11.41,01-08-2023 12.03,2023-08-01 12:05:09,22.06,30.0
17-02-2023 09.40,17-02-2023 09.56,2023-02-17 10:09:46,15.75,40.0
01-12-2023 12.38,01-12-2023 12.49,2023-12-01 12:56:25,11.72,31.0
25-06-2024 11.16,25-06-2024 11.39,2024-06-25 11:50:30,23.0,3.0
27-05-2023 13.00,27-05-2023 13.01,2023-05-27 13:02:00,1.0,46.0
11-03-2023 13.00,11-03-2023 13.01,2023-03-11 13:02:00,1.0,53.0
26-12-2023 12.02,26-12-2023 12.23,2023-12-26 12:33:19,20.61,38.0
27-09-2024 12.56,27-09-2024 13.13,2024-09-27 13:25:01,17.91,29.0
19-02-2024 12.18,19-02-2024 12.23,2024-02-19 12:30:57,5.44,32.0
18-10-2023 12.11,18-10-2023 12.29,2023-10-18 12:38:44,18.93,33.0
15-12-2023 11.51,15-12-2023 12.16,2023-12-15 12:24:38,25.85,31.0
08-03-2024 12.29,08-03-2024 12.41,2024-03-08 12:50:58,12.12,40.0
20-08-2024 10.25,20-08-2024 10.41,2024-08-20 10:49:50,16.56,9.0
28-09-2024 13.00,28-09-2024 13.01,2024-09-28 13:02:00,1.0,27.0
30-07-2024 11.29,30-07-2024 11.47,2024-07-30 11:58:17,18.83,60.0
26-09-2024 11.32,26-09-2024 11.55,2024-09-26 12:00:27,23.22,41.0
24-04-2023 11.50,24-04-2023 12.08,2023-04-24 12:18:51,18.01,
20-03-2024 09.47,20-03-2024 10.04,2024-03-20 10:17:18,17.94,45.0
03-08-2023 11.28,03-08-2023 11.59,2023-08-03 12:17:57,31.1,45.0
07-08-2024 11.23,07-08-2024 11.46,2024-08-07 11:52:52,23.82,33.0
,17-01-2023 10.26,2023-01-17 10:35:28,23.2,32.0
13-09-2024 13.51,13-09-2024 14.14,2024-09-13 14:27:43,23.67,
10-03-2023 09.30,10-03-2023 09.52,2023-03-10 10:02:51,22.33,26.0
21-06-2023 10.16,21-06-2023 10.34,2023-06-21 10:50:11,18.7,32.0
23-10-2023 13.56,23-10-2023 14.24,2023-10-23 14:38:31,28.03,32.0
04-12-2023 11.03,04-12-2023 11.07,2023-12-04 11:22:57,4.01,33.0
27-06-2023 10.19,27-06-2023 10.34,2023-06-27 10:44:19,15.12,32.0
14-03-2023 12.56,14-03-2023 13.26,2023-03-14 13:39:13,30.38,57.0
14-03-2023 12.02,14-03-2023 12.33,2023-03-14 12:46:02,31.79,40.0
2024/03/15 10:30:00,15-03-2024 10.36,2024-03-15 10:43:19,6.3,32.0
26-07-2023 10.19,26-07-2023 10.40,2023-07-26 10:57:18,21.69,39.0
2023/02/03 09:33:00,03-02-2023 09.59,2023-02-03 10:12:29,26.94,40.0
14-09-2023 12.55,14-09-2023 13.14,2023-09-14 13:22:21,19.89,37.0
02-08-2024 10.19,02-08-2024 10.27,2024-08-02 10:37:22,8.8,32.0
29-03-2024 12.20,29-03-2024 12.34,2024-03-29 12:49:16,14.03,7.0
05-03-2024 11.22,05-03-2024 11.43,2024-03-05 11:51:37,21.63,3.0
2023/08/25 11:38:00,25-08-2023 11.55,2023-08-25 12:11:13,17.63,29.0
27-08-2024 11.05,27-08-2024 11.22,2024-08-27 11:33:30,17.08,26.0
2024/03/30 11:45:00,30-03-2024 12.01,2024-03-30 12:20:06,16.49,20.0
03-09-2024 11.58,03-09-2024 12.20,2024-09-03 12:22:57,22.19,31.0
2023/04/18 10:36:00,18-04-2023 10.56,2023-04-18 10:59:32,20.27,27.0
2023/07/01 10:49:00,01-07-2023 11.13,2023-07-01 11:22:31,24.14,19.0
01-12-2023 10.01,01-12-2023 10.02,2023-12-01 10:05:37,1.0,10.0
20-02-2024 12.47,20-02-2024 12.59,2024-02-20 13:12:33,12.24,29.0
11-08-2023 12.28,11-08-2023 12.38,2023-08-11 12:50:25,10.01,40.0
22-08-2024 10.25,22-08-2024 10.35,2024-08-22 10:48:31,10.49,32.0
2024/08/14 12:15:00,14-08-2024 12.34,2024-08-14 12:43:51,19.21,38.0
07-06-2023 09.51,07-06-2023 10.01,2023-06-07 10:11:06,,10.0
01-07-2024 11.56,01-07-2024 12.13,2024-07-01 12:15:21,17.04,23.0
21-03-2024 13.19,21-03-2024 13.35,2024-03-21 13:50:22,16.58,9.0
16-02-2023 14.29,16-02-2023 14.52,2023-02-16 15:02:00,,36.0
2023/04/21 14:32:00,21-04-2023 14.53,2023-04-21 15:03:12,21.62,37.0
27-04-2023 10.13,27-04-2023 10.28,2023-04-27 10:39:49,15.41,27.0
27-06-2024 10.01,27-06-2024 10.18,2024-06-27 10:28:42,17.25,22.0
2024/05/20 12:33:00,20-05-2024 12.39,2024-05-20 12:44:09,,40.0
11-09-2024 12.16,11-09-2024 12.37,2024-09-11 12:48:15,21.38,39.0
19-10-2023 09.17,19-10-2023 09.49,2023-10-19 10:03:51,32.33,40.0
12-06-2024 14.37,12-06-2024 14.45,2024-06-12 14:59:24,8.79,18.0
06-10-2023 10.11,06-10-2023 10.36,2023-10-06 10:56:26,25.12,24.0
01-04-2024 11.40,01-04-2024 12.06,2024-04-01 12:18:44,26.14,32.0
2024/01/11 14:26:00,11-01-2024 14.46,2024-01-11 14:59:24,20.52,41.0
04-08-2023 13.52,04-08-2023 14.10,2023-08-04 14:20:43,18.46,25.0
2023/11/23 10:26:00,23-11-2023 10.37,2023-11-23 10:48:50,11.62,32.0
2023/08/17 14:07:00,17-08-2023 14.18,2023-08-17 14:32:40,11.71,0.0
2024/09/27 13:19:00,27-09-2024 13.44,2024-09-27 13:50:57,25.42,37.0
30-10-2024 13.11,30-10-2024 13.30,2024-10-30 13:41:59,19.8,45.0
19-05-2023 09.00,19-05-2023 09.18,2023-05-19 09:26:13,18.56,20.0
16-12-2023 13.00,16-12-2023 13.01,2023-12-16 13:02:00,1.0,14.0
07-08-2023 12.42,07-08-2023 13.10,2023-08-07 13:21:52,28.88,36.0
25-06-2024 09.35,25-06-2024 09.56,2024-06-25 10:03:56,,31.0
10-05-2024 15.20,10-05-2024 15.40,2024-05-10 15:45:00,20.96,180.0
20-04-2023 14.00,20-04-2023 14.43,2023-04-20 14:54:01,43.7,71.0
23-09-2024 12.27,23-09-2024 12.43,2024-09-23 13:00:29,16.29,40.0
07-04-2023 11.13,07-04-2023 11.22,2023-04-07 11:29:47,9.22,39.0
02-12-2023 11.48,02-12-2023 12.03,2023-12-02 12:16:23,15.1,31.0
28-08-2023 15.30,28-08-2023 15.44,2023-08-28 15:45:00,14.0,50.0
08-11-2024 13.47,08-11-2024 13.53,2024-11-08 14:04:01,6.36,146.0
29-12-2023 09.32,29-12-2023 10.01,2023-12-29 10:11:25,29.36,36.0
2023/10/24 11:50:00,24-10-2023 12.13,2023-10-24 12:17:50,23.09,29.0
2024/06/17 10:38:00,17-06-2024 10.50,2024-06-17 11:02:38,12.12,32.0
12-10-2024 11.06,12-10-2024 11.25,2024-10-12 11:39:24,19.89,47.0
12-01-2023 11.50,12-01-2023 12.10,2023-01-12 12:24:56,20.36,32.0
12-07-2024 14.38,12-07-2024 14.53,2024-07-12 15:05:07,15.2,19.0
16-10-2023 12.43,16-10-2023 13.01,2023-10-16 13:15:33,18.83,35.0
06-02-2023 12.44,06-02-2023 12.48,2023-02-06 12:56:04,4.87,40.0
29-11-2023 15.41,29-11-2023 15.44,2023-11-29 15:45:00,3.0,25.0
2023/11/04 12:11:00,04-11-2023 12.49,2023-11-04 12:59:07,38.3,57.0
2023/04/19 10:39:00,19-04-2023 10.43,2023-04-19 10:50:46,4.81,32.0
2023/03/14 11:07:00,14-03-2023 11.33,2023-03-14 11:41:26,26.56,41.0
18-05-2023 10.49,18-05-2023 11.16,2023-05-18 11:26:30,,56.0
15-04-2023 10.50,15-04-2023 11.15,2023-04-15 11:29:31,25.01,31.0
2023/05/19 09:36:00,19-05-2023 09.48,2023-05-19 09:53:13,12.75,169.0
05-04-2024 13.14,05-04-2024 13.41,2024-04-05 13:47:08,27.97,44.0
31-08-2024 13.00,31-08-2024 13.01,2024-08-31 13:02:00,1.0,41.0
08-10-2024 13.13,08-10-2024 13.33,2024-10-08 13:44:20,20.68,20.0
04-03-2024 13.28,04-03-2024 13.44,2024-03-04 14:06:16,16.31,
17-05-2024 13.12,17-05-2024 13.25,2024-05-17 13:38:30,13.7,29.0
27-05-2023 12.31,27-05-2023 12.59,2023-05-27 13:00:00,28.0,54.0
08-07-2023 13.00,08-07-2023 13.01,2023-07-08 13:02:00,1.0,23.0
04-03-2024 10.05,04-03-2024 10.18,2024-03-04 10:22:10,13.33,11.0
04-07-2023 12.51,04-07-2023 13.17,2023-07-04 13:28:12,25.88,26.0
22-10-2024 11.09,22-10-2024 11.30,2024-10-22 11:36:59,21.94,48.0
30-10-2024 12.47,30-10-2024 13.17,2024-10-30 13:28:19,30.17,44.0
2023/04/12 10:16:00,12-04-2023 10.39,2023-04-12 10:44:36,23.41,37.0
22-11-2024 15.36,22-11-2024 15.40,2024-11-22 15:45:00,4.08,25.0
26-06-2023 09.06,26-06-2023 09.40,2023-06-26 09:43:25,34.83,55.0
02-01-2024 10.10,02-01-2024 10.41,2024-01-02 10:52:32,31.68,41.0
03-01-2024 10.52,03-01-2024 11.05,2024-01-03 11:14:57,13.48,15.0
2024/11/12 09:20:00,12-11-2024 09.53,2024-11-12 10:10:11,33.23,56.0
17-04-2024 12.38,17-04-2024 12.52,2024-04-17 13:03:16,14.94,26.0
26-02-2024 15.45,26-02-2024 15.46,2024-02-26 15:47:00,1.0,25.0
23-05-2024 12.29,23-05-2024 12.44,2024-05-23 12:55:34,15.58,40.0
19-09-2024 13.26,19-09-2024 13.54,2024-09-19 13:56:33,28.54,53.0
2023/03/21 11:19:00,21-03-2023 11.36,2023-03-21 11:52:21,17.31,40.0
03-05-2024 14.23,03-05-2024 14.52,2024-05-03 15:05:16,29.96,48.0
2024/01/10 12:31:00,10-01-2024 12.50,2024-01-10 12:54:23,19.54,36.0
2023/01/28 10:38:00,28-01-2023 10.50,2023-01-28 11:05:16,12.98,33.0
08-04-2024 12.14,08-04-2024 12.40,2024-04-08 12:54:02,26.17,37.0
03-01-2024 10.47,03-01-2024 11.13,2024-01-03 11:16:24,26.31,19.0
22-05-2023 11.38,22-05-2023 11.58,2023-05-22 12:10:29,20.62,24.0
12-11-2024 9.00,12-11-2024 09.25,2024-11-12 09:34:23,25.82,44.0
18-11-2024 11.10,18-11-2024 11.38,2024-11-18 11:40:12,28.45,33.0
28-06-2023 10.53,28-06-2023 11.03,2023-06-28 11:17:36,10.79,33.0
04-10-2024 10.55,04-10-2024 11.05,2024-10-04 11:21:04,10.94,33.0
29-07-2024 12.53,29-07-2024 13.16,2024-07-29 13:21:15,23.26,143.0
13-08-2024 13.56,13-08-2024 14.18,2024-08-13 14:35:44,22.94,32.0
14-02-2024 09.00,14-02-2024 09.30,2024-02-14 09:41:42,30.5,44.0
03-06-2024 11.31,03-06-2024 11.47,2024-06-03 12:00:43,15.57,
2023/05/13 12:47:00,13-05-2023 12.59,2023-05-13 13:00:00,12.0,32.0
16-08-2024 11.38,16-08-2024 11.59,2024-08-16 12:04:02,21.99,30.0
30-10-2024 10.35,30-10-2024 11.05,2024-10-30 11:11:19,30.35,205.0
23-10-2023 15.01,23-10-2023 15.29,2023-10-23 15:40:15,28.81,37.0
27-12-2023 14.08,27-12-2023 14.30,2023-12-27 14:36:23,22.22,45.0
10-08-2024 13.00,10-08-2024 13.01,2024-08-10 13:02:00,1.0,10.0
08-05-2024 13.27,08-05-2024 13.44,2024-05-08 13:54:01,17.9,27.0
2024/11/12 13:50:00,12-11-2024 14.28,2024-11-12 14:38:12,38.36,75.0
2023/10/13 13:59:00,13-10-2023 14.18,2023-10-13 14:20:20,19.81,26.0
2023/04/26 10:21:00,26-04-2023 10.55,2023-04-26 11:09:17,34.91,38.0
28-02-2023 11.04,28-02-2023 11.25,2023-02-28 11:36:22,21.44,17.0
27-04-2023 09.39,27-04-2023 10.02,2023-04-27 10:13:36,23.56,26.0
21-06-2023 9.13,21-06-2023 09.47,2023-06-21 09:52:52,34.7,42.0
2023/01/24 10:58:00,24-01-2023 11.09,2023-01-24 11:20:58,11.2,13.0
14-05-2024 14.09,14-05-2024 14.29,2024-05-14 14:47:54,20.24,25.0
13-06-2024 15.20,13-06-2024 15.32,2024-06-13 15:45:00,12.9,22.0
05-07-2023 11.36,05-07-2023 11.52,2023-07-05 12:07:50,16.3,21.0
26-08-2023 12.39,26-08-2023 12.59,2023-08-26 13:00:00,20.0,44.0
05-09-2024 11.28,05-09-2024 11.49,2024-09-05 12:06:48,21.85,42.0
09-11-2024 12.25,09-11-2024 12.42,2024-11-09 12:53:53,17.02,38.0
29-07-2023 09.21,29-07-2023 09.59,2023-07-29 10:11:01,38.52,45.0
01-08-2024 09.00,01-08-2024 09.21,2024-08-01 09:36:18,21.73,33.0
22-10-2024 12.22,22-10-2024 12.26,2024-10-22 12:31:44,4.91,40.0
2023/11/14 11:07:00,14-11-2023 11.27,2023-11-14 11:49:40,20.43,34.0
15-08-2023 10.23,15-08-2023 10.29,2023-08-15 10:39:23,6.21,32.0
24-02-2023 10.54,24-02-2023 11.15,2023-02-24 11:33:35,21.32,29.0
2024/04/29 09:09:00,29-04-2024 09.34,2024-04-29 09:44:38,25.83,21.0
10-10-2023 12.21,10-10-2023 12.31,2023-10-10 12:38:42,10.72,40.0
18-08-2023 11.10,18-08-2023 11.23,2023-08-18 11:36:26,12.35,25.0
04-03-2023 11.34,04-03-2023 11.40,2023-03-04 11:45:04,6.82,2.0
2024/01/12 14:40:00,12-01-2024 15.03,2024-01-12 15:19:01,23.09,57.0
14-10-2024 09.52,14-10-2024 10.13,2024-10-14 10:23:14,21.57,31.0
01-09-2023 14.39,01-09-2023 15.00,2023-09-01 15:14:57,21.11,27.0
04-01-2024 13.41,04-01-2024 13.45,2024-01-04 13:51:48,4.67,25.0
10-10-2024 10.18,10-10-2024 10.36,2024-10-10 10:47:49,18.71,13.0
31-10-2023 10.01,31-10-2023 10.14,2023-10-31 10:31:34,13.24,19.0
04-12-2023 13.29,04-12-2023 14.00,2023-12-04 14:12:13,32.0,53.0
30-04-2024 11.47,30-04-2024 12.02,2024-04-30 12:11:54,15.15,29.0
2023/10/10 09:25:00,10-10-2023 09.57,2023-10-10 10:08:46,32.04,52.0
16-05-2024 09.00,16-05-2024 09.32,2024-05-16 09:40:17,32.9,38.0
02-07-2024 12.13,02-07-2024 12.35,2024-07-02 12:46:15,22.85,30.0
2023/09/02 13:00:00,02-09-2023 13.01,2023-09-02 13:02:00,1.0,29.0
14-06-2024 12.25,14-06-2024 12.35,2024-06-14 12:48:44,10.34,40.0
2024/05/23 09:14:00,23-05-2024 09.46,2024-05-23 10:02:57,32.53,56.0
2023/08/11 13:53:00,11-08-2023 14.10,2023-08-11 14:12:40,17.39,30.0
2023/08/21 14:43:00,21-08-2023 14.59,2023-08-21 15:12:30,16.14,33.0
16-05-2024 13.47,16-05-2024 14.03,2024-05-16 14:17:05,16.53,25.0
20-02-2023 12.43,20-02-2023 12.51,2023-02-20 12:53:10,8.35,19.0
06-10-2023 09.11,06-10-2023 09.32,2023-10-06 09:54:38,21.9,30.0
29-04-2023 09.43,29-04-2023 09.56,2023-04-29 10:18:36,13.1,19.0
04-09-2024 10.06,04-09-2024 10.35,2024-09-04 10:46:06,29.24,31.0
19-05-2023 10.05,19-05-2023 10.33,2023-05-19 10:43:06,28.56,26.0
2024/11/23 09:20:00,23-11-2024 09.59,2024-11-23 10:12:04,39.7,44.0
15-07-2024 09.35,15-07-2024 09.47,2024-07-15 09:58:51,12.41,10.0
14-09-2023 12.29,14-09-2023 12.47,2023-09-14 12:57:38,18.37,29.0
04-10-2023 11.56,04-10-2023 12.24,2023-10-04 12:30:56,28.38,47.0
03-02-2023 14.02,03-02-2023 14.27,2023-02-03 14:44:50,25.1,32.0
21-02-2023 11.30,21-02-2023 11.47,2023-02-21 11:53:45,17.55,25.0
29-11-2024 12.42,29-11-2024 12.53,2024-11-29 13:04:19,11.94,40.0
2023/04/18 14:00:00,18-04-2023 14.19,2023-04-18 14:30:41,19.56,15.0
02-03-2024 09.47,02-03-2024 10.11,2024-03-02 10:20:57,24.31,38.0
29-12-2023 14.48,29-12-2023 15.09,2023-12-29 15:19:05,21.17,43.0
09-07-2024 13.25,09-07-2024 13.55,2024-07-09 14:05:08,30.8,53.0
06-11-2023 11.43,06-11-2023 11.49,2023-11-06 11:58:25,6.43,13.0
24-09-2024 11.40,24-09-2024 12.09,2024-09-24 12:27:05,29.14,22.0
03-04-2024 13.57,03-04-2024 14.23,2024-04-03 14:33:37,25.24,30.0
02-12-2024 12.42,02-12-2024 13.07,2024-12-02 13:21:03,25.55,33.0
22-06-2024 10.37,22-06-2024 10.52,2024-06-22 11:05:02,15.92,18.0
06-12-2023 14.53,06-12-2023 15.29,2023-12-06 15:39:03,36.09,39.0
12-04-2023 10.03,12-04-2023 10.23,2023-04-12 10:35:08,20.87,38.0
14-04-2023 12.42,14-04-2023 12.51,2023-04-14 13:01:00,9.82,40.0
2023/08/26 09:00:00,26-08-2023 09.06,2023-08-26 09:09:27,6.05,23.0
07-09-2024 11.40,07-09-2024 11.59,2024-09-07 12:14:51,19.52,21.0
2024/07/04 10:46:00,04-07-2024 11.08,2024-07-04 11:19:58,22.45,42.0
31-03-2023 09.32,31-03-2023 09.55,2023-03-31 09:56:49,23.83,43.0
19-08-2024 11.34,19-08-2024 11.59,2024-08-19 12:10:21,25.83,39.0
31-01-2023 12.22,31-01-2023 12.42,2023-01-31 12:54:35,20.82,31.0
11-07-2023 14.38,11-07-2023 15.00,2023-07-11 15:10:19,22.5,52.0
2023/12/20 09:28:00,20-12-2023 09.52,2023-12-20 10:11:23,24.75,56.0
22-07-2023 13.00,22-07-2023 13.01,2023-07-22 13:02:00,1.0,36.0
2024/01/27 12:21:00,27-01-2024 12.27,2024-01-27 12:34:14,6.51,32.0
2023/09/23 13:00:00,23-09-2023 13.01,2023-09-23 13:02:00,1.0,42.0
08-11-2024 15.26,08-11-2024 15.44,2024-11-08 15:45:00,18.0,43.0
25-07-2024 10.56,25-07-2024 11.09,2024-07-25 11:10:25,13.43,28.0
01-12-2023 09.44,01-12-2023 10.16,2023-12-01 10:25:52,32.14,39.0
28-08-2024 10.16,28-08-2024 10.34,2024-08-28 10:42:06,18.2,40.0
11-04-2023 14.22,11-04-2023 14.36,2023-04-11 14:56:35,14.03,17.0
27-09-2023 09.48,27-09-2023 09.58,2023-09-27 10:06:55,10.1,10.0
2023/02/08 09:12:00,08-02-2023 09.30,2023-02-08 09:41:16,18.88,23.0
09-10-2023 10.22,09-10-2023 10.27,2023-10-09 10:35:48,5.57,32.0
19-09-2024 15.20,19-09-2024 15.44,2024-09-19 15:45:00,24.0,25.0
11-10-2023 9.04,11-10-2023 09.31,2023-10-11 09:38:21,27.37,191.0
10-08-2024 09.56,10-08-2024 10.10,2024-08-10 10:21:46,14.58,22.0
2023/02/02 12:30:00,02-02-2023 12.55,2023-02-02 13:07:47,25.6,33.0
12-10-2024 13.00,12-10-2024 13.01,2024-10-12 13:02:00,1.0,28.0
2024/09/18 11:29:00,18-09-2024 11.32,2024-09-18 11:36:40,3.56,1.0
2024/05/14 11:03:00,14-05-2024 11.23,2024-05-14 11:33:32,20.91,41.0
2024/02/14 14:18:00,14-02-2024 14.30,2024-02-14 14:41:19,12.41,17.0
24-11-2023 13.56,24-11-2023 14.13,2023-11-24 14:24:52,17.24,10.0
2024/03/04 11:48:00,04-03-2024 12.06,2024-03-04 12:16:51,18.34,31.0
26-11-2024 12.24,26-11-2024 12.53,2024-11-26 13:02:31,29.09,48.0
08-08-2023 12.37,08-08-2023 13.06,2023-08-08 13:23:28,29.75,41.0
,22-03-2023 14.07,2023-03-22 14:14:52,5.63,171.0
07-09-2023 14.24,07-09-2023 14.45,2023-09-07 15:00:33,21.86,32.0
20-09-2023 11.20,20-09-2023 11.50,2023-09-20 11:57:54,30.77,64.0
11-05-2023 11.29,11-05-2023 11.52,2023-05-11 12:05:29,23.28,35.0
22-02-2023 14.21,22-02-2023 14.25,2023-02-22 14:32:31,4.1,17.0
27-04-2023 12.47,27-04-2023 13.10,2023-04-27 13:29:18,23.53,20.0
2023/07/13 11:35:00,13-07-2023 11.55,2023-07-13 12:05:37,20.15,30.0
23-12-2023 11.14,23-12-2023 11.28,2023-12-23 11:38:59,13.67,25.0
21-06-2024 14.25,21-06-2024 15.00,2024-06-21 15:03:25,35.06,47.0
01-02-2024 12.05,01-02-2024 12.28,2024-02-01 12:40:02,23.65,28.0
20-09-2024 9.09,20-09-2024 09.13,2024-09-20 09:18:18,4.44,13.0
03-03-2023 12.58,03-03-2023 13.15,2023-03-03 13:24:17,17.29,37.0
15-01-2024 12.26,15-01-2024 12.45,2024-01-15 12:53:45,19.83,35.0
25-07-2023 10.56,25-07-2023 11.18,2023-07-25 11:28:36,,42.0
2024/03/18 14:22:00,18-03-2024 14.47,2024-03-18 15:07:18,25.46,27.0
2023/11/15 12:18:00,15-11-2023 12.42,2023-11-15 12:52:20,24.84,37.0
19-07-2024 13.29,19-07-2024 13.52,2024-07-19 14:01:20,23.36,38.0
29-05-2023 10.04,29-05-2023 10.26,2023-05-29 10:38:07,22.82,28.0
14-04-2023 12.04,14-04-2023 12.13,2023-04-14 12:20:48,9.01,25.0
02-08-2024 15.45,02-08-2024 15.46,2024-08-02 15:47:00,1.0,13.0
2023/09/06 10:53:00,06-09-2023 11.08,2023-09-06 11:18:15,15.85,15.0
24-04-2023 12.10,24-04-2023 12.22,2023-04-24 12:41:48,12.44,6.0
2023/07/22 13:00:00,22-07-2023 13.01,2023-07-22 13:02:00,1.0,29.0
13-11-2024 10.03,13-11-2024 10.24,2024-11-13 10:38:30,21.32,30.0
03-11-2023 13.25,03-11-2023 13.49,2023-11-03 14:01:40,24.32,39.0
2024/06/01 12:16:00,01-06-2024 12.28,2024-06-01 12:35:12,12.72,32.0
2023/02/01 09:58:00,01-02-2023 10.19,2023-02-01 10:37:19,21.9,26.0
2023/06/23 11:05:00,23-06-2023 11.24,2023-06-23 11:35:09,19.8,194.0
,19-06-2023 11.31,2023-06-19 11:47:00,23.87,31.0
2023/05/11 10:13:00,11-05-2023 10.35,2023-05-11 10:47:54,22.99,37.0
30-10-2023 11.34,30-10-2023 11.47,2023-10-30 11:58:14,13.38,31.0
25-04-2023 10.55,25-04-2023 11.17,2023-04-25 11:27:54,22.83,41.0
11-03-2024 13.36,11-03-2024 13.58,2024-03-11 14:08:52,22.96,32.0
27-02-2024 14.03,27-02-2024 14.15,2024-02-27 14:29:59,12.3,20.0
22-06-2023 10.09,22-06-2023 10.42,2023-06-22 10:51:44,33.69,31.0
2024/06/10 10:06:00,10-06-2024 10.14,2024-06-10 10:27:14,8.86,10.0
22-03-2023 11.54,22-03-2023 12.12,2023-03-22 12:22:12,18.96,26.0
23-03-2023 09.15,23-03-2023 09.27,2023-03-23 09:41:24,12.27,23.0
13-11-2023 09.46,13-11-2023 10.10,2023-11-13 10:25:30,24.46,30.0
21-05-2024 10.43,21-05-2024 10.58,2024-05-21 11:10:46,15.2,32.0
17-08-2023 11.49,17-08-2023 12.16,2023-08-17 12:25:03,27.43,46.0
22-06-2023 10.04,22-06-2023 10.20,2023-06-22 10:24:41,16.68,18.0
25-06-2024 13.50,25-06-2024 14.03,2024-06-25 14:15:13,12.94,0.0
27-01-2024 09.24,27-01-2024 10.00,2024-01-27 10:02:17,36.07,54.0
2024/05/03 10:16:00,03-05-2024 10.29,2024-05-03 10:45:41,13.16,32.0
06-07-2024 09.58,06-07-2024 10.18,2024-07-06 10:29:58,20.7,38.0
05-10-2023 15.41,05-10-2023 15.44,2023-10-05 15:45:00,3.0,43.0
21-11-2024 14.15,21-11-2024 14.33,2024-11-21 14:34:25,18.43,36.0
23-11-2023 09.32,23-11-2023 09.59,2023-11-23 10:02:05,27.69,63.0
24-03-2023 11.41,24-03-2023 12.13,2023-03-24 12:18:38,32.05,30.0
2024/09/03 14:15:00,03-09-2024 14.29,2024-09-03 14:46:17,14.82,17.0
06-05-2024 10.26,06-05-2024 10.57,2024-05-06 11:07:16,31.11,49.0
25-03-2023 13.00,25-03-2023 13.01,2023-03-25 13:02:00,1.0,26.0
15-06-2023 12.16,15-06-2023 12.40,2023-06-15 12:52:46,24.69,59.0
2024/07/10 13:11:00,10-07-2024 13.42,2024-07-10 13:52:40,31.17,57.0
12-01-2023 09.00,12-01-2023 09.09,2023-01-12 09:21:08,9.11,32.0
,18-10-2024 13.37,2024-10-18 13:54:20,20.57,27.0
15-05-2024 11.14,15-05-2024 11.37,2024-05-15 11:52:31,23.06,24.0
2024/05/30 14:25:00,30-05-2024 14.38,2024-05-30 14:54:54,13.86,18.0
26-01-2024 11.04,26-01-2024 11.27,2024-01-26 11:39:29,23.49,32.0
28-08-2024 15.45,28-08-2024 15.46,2024-08-28 15:47:00,1.0,25.0
06-10-2023 14.27,06-10-2023 14.50,2023-10-06 15:01:19,23.04,37.0
04-12-2023 12.01,04-12-2023 12.19,2023-12-04 12:28:18,18.12,23.0
2023/02/06 12:03:00,06-02-2023 12.20,2023-02-06 12:36:53,17.43,20.0
15-05-2023 12.21,15-05-2023 12.39,2023-05-15 12:53:18,17.84,38.0
25-01-2024 09.57,25-01-2024 10.07,2024-01-25 10:17:45,10.41,
12-04-2023 12.12,12-04-2023 12.35,2023-04-12 12:45:07,23.05,41.0
22-02-2024 09.37,22-02-2024 10.00,2024-02-22 10:12:33,23.79,46.0
2024/09/02 11:22:00,02-09-2024 11.50,2024-09-02 11:56:22,28.94,42.0
15-08-2024 11.34,15-08-2024 13.05,2024-08-15 13:20:48,,30.0
2023/03/16 09:13:00,16-03-2023 09.36,2023-03-16 09:41:24,23.34,25.0
21-02-2024 10.45,21-02-2024 11.07,2024-02-21 11:21:50,22.44,29.0
20-09-2023 13.43,20-09-2023 14.03,2023-09-20 14:08:45,20.23,20.0
23-01-2023 11.57,23-01-2023 12.17,2023-01-23 12:33:36,20.02,10.0
2024/08/27 10:15:00,27-08-2024 10.33,2024-08-27 10:44:13,18.06,22.0
18-10-2024 10.07,18-10-2024 10.39,2024-10-18 10:42:48,32.8,42.0
15-01-2024 13.47,15-01-2024 14.00,2024-01-15 14:10:46,13.4,17.0
08-01-2024 11.55,08-01-2024 12.18,2024-01-08 12:28:55,23.5,47.0
20-09-2023 12.54,20-09-2023 13.07,2023-09-20 13:19:42,13.9,22.0
12-06-2024 13.54,12-06-2024 14.06,2024-06-12 14:17:16,12.72,32.0
18-06-2024 11.44,18-06-2024 12.06,2024-06-18 12:14:37,22.17,38.0
2024/02/16 13:26:00,16-02-2024 13.47,2024-02-16 13:54:48,21.6,35.0
03-05-2023 11.42,03-05-2023 11.59,2023-05-03 12:10:01,17.17,25.0
28-04-2023 11.46,28-04-2023 12.19,2023-04-28 12:23:18,33.75,57.0
13-04-2023 13.05,13-04-2023 13.24,2023-04-13 13:33:27,19.81,19.0
19-10-2024 13.00,19-10-2024 13.01,2024-10-19 13:02:00,1.0,32.0
16-09-2024 14.32,16-09-2024 14.48,2024-09-16 15:05:49,16.63,25.0
19-04-2024 09.08,19-04-2024 09.42,2024-04-19 09:43:56,34.28,42.0
25-06-2024 11.41,25-06-2024 12.00,2024-06-25 12:21:26,18.94,26.0
25-07-2024 12.32,25-07-2024 12.58,2024-07-25 13:11:58,26.03,28.0
2023/08/21 11:32:00,21-08-2023 12.00,2023-08-21 12:15:58,28.97,39.0
09-11-2024 10.23,09-11-2024 10.32,2024-11-09 10:47:08,9.21,21.0
05-05-2023 10.33,05-05-2023 10.46,2023-05-05 10:54:49,13.19,14.0
2024/09/21 09:37:00,21-09-2024 10.04,2024-09-21 10:16:38,27.62,46.0
2024/04/10 09:00:00,10-04-2024 09.24,2024-04-10 09:36:42,24.96,35.0
07-05-2024 11.27,07-05-2024 11.49,2024-05-07 11:50:34,22.58,30.0
26-02-2024 09.14,26-02-2024 09.34,2024-02-26 09:41:03,20.8,31.0
02-03-2024 10.35,02-03-2024 10.48,2024-03-02 10:58:32,13.81,
02-05-2024 10.35,02-05-2024 11.00,2024-05-02 11:11:29,25.96,39.0
31-10-2023 13.06,31-10-2023 13.31,2023-10-31 13:47:30,25.59,41.0
16-02-2024 11.25,16-02-2024 12.01,2024-02-16 12:06:26,36.18,57.0
15-08-2023 09.14,15-08-2023 09.34,2023-08-15 09:58:11,20.86,30.0
04-03-2023 12.49,04-03-2023 12.59,2023-03-04 13:00:00,10.0,
01-04-2024 15.27,01-04-2024 15.33,2024-04-01 15:45:00,6.56,4.0
04-02-2023 13.00,04-02-2023 13.01,2023-02-04 13:02:00,1.0,25.0
05-07-2023 10.48,05-07-2023 11.06,2023-07-05 11:10:48,18.85,14.0
04-03-2023 13.00,04-03-2023 13.01,2023-03-04 13:02:00,1.0,41.0
2023/02/14 13:56:00,14-02-2023 14.21,2023-02-14 14:26:41,25.74,49.0
04-04-2024 09.00,04-04-2024 09.26,2024-04-04 09:38:28,26.03,28.0
01-12-2023 10.12,01-12-2023 10.34,2023-12-01 10:36:11,22.91,34.0
08-02-2023 09.21,08-02-2023 09.40,2023-02-08 09:44:59,19.34,29.0
20-01-2023 09.46,20-01-2023 10.19,2023-01-20 10:22:01,33.34,42.0
09-03-2023 13.48,09-03-2023 14.21,2023-03-09 14:40:15,32.76,34.0
14-09-2024 10.58,14-09-2024 11.31,2024-09-14 11:46:38,33.38,40.0
22-02-2023 11.37,22-02-2023 12.06,2023-02-22 12:12:17,29.89,57.0
07-11-2024 15.40,07-11-2024 15.44,2024-11-07 15:45:00,4.0,35.0
27-08-2024 12.00,27-08-2024 12.23,2024-08-27 12:32:46,23.34,47.0
24-11-2023 13.23,24-11-2023 13.49,2023-11-24 13:59:35,26.0,25.0
19-11-2024 11.49,19-11-2024 12.08,2024-11-19 12:18:50,19.53,41.0
2023/05/27 13:00:00,27-05-2023 13.01,2023-05-27 13:02:00,1.0,25.0
30-01-2023 11.11,30-01-2023 11.29,2023-01-30 11:42:27,18.24,29.0
18-10-2023 15.00,18-10-2023 15.14,2023-10-18 15:22:31,14.97,12.0
27-03-2023 10.36,27-03-2023 10.50,2023-03-27 11:04:38,14.1,32.0
25-01-2024 13.31,25-01-2024 13.44,2024-01-25 13:53:59,13.22,28.0
09-09-2024 11.00,09-09-2024 11.22,2024-09-09 11:31:21,21.29,49.0
25-11-2024 10.29,25-11-2024 10.38,2024-11-25 10:47:00,9.01,14.0
25-10-2023 15.45,25-10-2023 15.46,2023-10-25 15:47:00,1.0,24.0
01-11-2024 10.22,01-11-2024 10.47,2024-11-01 10:55:00,25.45,45.0
18-05-2023 15.25,18-05-2023 15.44,2023-05-18 15:45:00,19.0,43.0
05-03-2024 10.25,05-03-2024 11.00,2024-03-05 11:08:39,35.52,49.0
01-11-2023 12.26,01-11-2023 12.50,2023-11-01 13:06:49,24.33,16.0
19-07-2023 09.15,19-07-2023 09.28,2023-07-19 09:33:52,13.85,23.0
2023/08/08 12:31:00,08-08-2023 12.52,2023-08-08 12:57:06,21.6,15.0
15-04-2024 09.12,15-04-2024 09.41,2024-04-15 09:47:44,29.25,32.0
19-07-2023 14.13,19-07-2023 14.21,2023-07-19 14:32:01,,
01-04-2023 10.14,01-04-2023 10.38,2023-04-01 10:47:52,23.56,24.0
09-05-2024 14.10,09-05-2024 14.33,2024-05-09 14:40:45,23.19,37.0
02-11-2024 11.56,02-11-2024 12.24,2024-11-02 12:40:02,28.08,14.0
02-05-2023 13.12,02-05-2023 13.30,2023-05-02 13:40:49,18.78,37.0
16-09-2023 10.15,16-09-2023 10.41,2023-09-16 10:54:45,26.59,33.0
,08-08-2024 09.59,2024-08-08 10:01:45,33.81,54.0
28-09-2023 10.52,28-09-2023 11.13,2023-09-28 11:21:07,21.57,32.0
26-07-2023 13.24,26-07-2023 13.45,2023-07-26 13:56:30,21.2,34.0
2024/09/04 10:44:00,04-09-2024 10.55,2024-09-04 11:05:56,11.13,15.0
02-04-2024 9.55,02-04-2024 10.19,2024-04-02 10:31:16,24.05,30.0
2023/10/19 12:09:00,19-10-2023 12.35,2023-10-19 12:48:50,26.34,43.0
23-09-2023 10.12,23-09-2023 10.38,2023-09-23 10:57:45,26.89,153.0
2023/06/07 12:26:00,07-06-2023 12.36,2023-06-07 12:50:16,10.12,40.0
2023/06/17 13:00:00,17-06-2023 13.01,2023-06-17 13:02:00,1.0,46.0
30-05-2023 12.26,30-05-2023 12.37,2023-05-30 12:39:30,11.73,5.0
2024/07/25 12:26:00,25-07-2024 12.52,2024-07-25 13:04:11,26.16,26.0
2023/12/26 10:37:00,26-12-2023 11.11,2023-12-26 11:19:05,34.53,36.0
13-02-2024 09.20,13-02-2024 09.36,2024-02-13 09:47:20,16.24,26.0
13-03-2023 11.48,13-03-2023 12.10,2023-03-13 12:20:43,22.43,28.0
30-09-2024 12.36,30-09-2024 13.15,2024-09-30 13:28:58,39.46,51.0
2024/01/24 10:15:00,24-01-2024 10.33,2024-01-24 10:46:41,18.61,19.0
20-07-2024 13.00,20-07-2024 13.01,2024-07-20 13:02:00,1.0,44.0
2023/09/27 14:04:00,27-09-2023 14.19,2023-09-27 14:35:55,15.82,28.0
16-10-2023 12.56,16-10-2023 13.14,2023-10-16 13:26:15,18.58,34.0
2024/09/30 15:42:00,30-09-2024 15.44,2024-09-30 15:45:00,2.0,43.0
25-05-2024 10.48,25-05-2024 11.15,2024-05-25 11:25:38,27.88,50.0
26-10-2023 9.57,26-10-2023 10.15,2023-10-26 10:24:31,17.27,24.0
05-07-2023 14.09,05-07-2023 14.17,2023-07-05 14:22:50,8.1,17.0
2023/12/23 10:42:00,23-12-2023 11.09,2023-12-23 11:20:14,27.83,34.0
,07-11-2024 11.53,2024-11-07 12:05:16,27.74,35.0
2024/05/09 12:41:00,09-05-2024 13.02,2024-05-09 13:13:00,21.95,36.0
,23-01-2024 13.06,2024-01-23 13:14:58,33.8,36.0
29-09-2023 10.30,29-09-2023 10.48,2023-09-29 10:59:51,18.08,24.0
22-03-2024 11.08,22-03-2024 11.28,2024-03-22 11:40:07,20.7,37.0
04-12-2023 09.14,04-12-2023 09.48,2023-12-04 09:52:44,34.91,42.0
2024/09/27 10:31:00,27-09-2024 10.47,2024-09-27 10:52:19,16.22,21.0
07-10-2024 12.55,07-10-2024 13.10,2024-10-07 13:11:22,15.38,21.0
21-05-2024 12.09,21-05-2024 12.43,2024-05-21 12:52:34,34.26,43.0
06-06-2023 14.09,06-06-2023 14.30,2023-06-06 14:38:27,21.87,45.0
10-11-2023 09.00,10-11-2023 09.22,2023-11-10 09:31:21,22.13,35.0
24-01-2024 10.36,24-01-2024 10.56,2024-01-24 11:05:46,20.13,19.0
22-10-2024 11.39,22-10-2024 12.00,2024-10-22 12:11:05,200.0,24.0
2024/10/07 13:51:00,07-10-2024 14.23,2024-10-07 14:40:39,32.63,54.0
19-01-2024 14.04,19-01-2024 14.55,2024-01-19 15:07:25,51.42,71.0
05-05-2023 12.55,05-05-2023 13.18,2023-05-05 13:34:50,23.16,41.0
18-09-2023 9.52,18-09-2023 10.16,2023-09-18 10:31:08,24.64,46.0
12-10-2023 15.45,12-10-2023 15.46,2023-10-12 15:47:00,1.0,35.0
2023/06/17 13:00:00,17-06-2023 13.01,2023-06-17 13:02:00,1.0,0.0
20-03-2023 11.19,20-03-2023 11.35,2023-03-20 11:45:51,16.14,11.0
11-03-2024 09.00,11-03-2024 09.28,2024-03-11 09:33:18,28.27,25.0
05-07-2024 12.26,05-07-2024 12.57,2024-07-05 13:08:38,30.5,26.0
06-12-2023 09.52,06-12-2023 10.10,2023-12-06 10:17:32,18.95,31.0
12-01-2024 11.48,12-01-2024 12.12,2024-01-12 12:23:15,23.78,45.0
29-06-2024 13.00,29-06-2024 13.01,2024-06-29 13:02:00,1.0,25.0
22-11-2024 14.56,22-11-2024 15.19,2024-11-22 15:30:11,24.0,37.0
06-05-2023 13.00,06-05-2023 13.01,2023-05-06 13:02:00,1.0,38.0
25-01-2024 12.03,25-01-2024 12.37,2024-01-25 12:52:01,34.26,62.0
24-07-2023 10.22,24-07-2023 10.52,2023-07-24 11:03:27,30.43,20.0
2023/12/23 11:28:00,23-12-2023 11.48,2023-12-23 11:56:41,20.57,11.0
22-10-2024 09.22,22-10-2024 09.41,2024-10-22 09:50:42,19.74,39.0
2024/03/22 14:28:00,22-03-2024 14.50,2024-03-22 15:01:55,22.1,37.0
02-03-2023 12.36,02-03-2023 12.43,2023-03-02 12:47:22,7.42,40.0
05-09-2024 14.24,05-09-2024 14.40,2024-09-05 14:55:40,16.33,25.0
07-09-2024 13.00,07-09-2024 13.01,2024-09-07 13:02:00,1.0,75.0
06-06-2023 09.08,06-06-2023 09.40,2023-06-06 09:42:11,32.04,56.0
18-03-2023 10.11,18-03-2023 11.00,2023-03-18 11:07:51,49.4,22.0
24-04-2023 13.22,24-04-2023 13.49,2023-04-24 13:58:59,27.2,50.0
28-01-2023 13.00,28-01-2023 13.01,2023-01-28 13:02:00,1.0,71.0
30-03-2023 09.54,30-03-2023 10.19,2023-03-30 10:29:29,25.82,47.0
08-04-2023 13.00,08-04-2023 13.01,2023-04-08 13:02:00,1.0,41.0
2024/01/06 13:00:00,06-01-2024 13.01,2024-01-06 13:02:00,1.0,23.0
2023/10/06 11:40:00,06-10-2023 12.01,2023-10-06 12:16:43,21.53,34.0
02-08-2023 13.59,02-08-2023 14.07,2023-08-02 14:16:35,8.65,25.0
2023/01/16 09:06:00,16-01-2023 09.25,2023-01-16 09:42:48,19.12,33.0
09-03-2023 13.43,09-03-2023 15.24,2023-03-09 15:37:25,101.69,22.0
10-06-2023 11.51,10-06-2023 12.06,2023-06-10 12:24:39,15.8,20.0
06-05-2024 14.26,06-05-2024 14.53,2024-05-06 15:04:21,27.46,48.0
16-02-2023 11.14,16-02-2023 11.44,2023-02-16 11:53:20,30.07,56.0
01-01-2024 12.10,01-01-2024 12.28,2024-01-01 12:37:41,,38.0
2023/10/07 13:00:00,07-10-2023 13.01,2023-10-07 13:02:00,1.0,25.0
10-01-2023 14.45,10-01-2023 15.25,2023-01-10 15:33:21,39.43,32.0
2023/11/24 12:15:00,24-11-2023 12.46,2023-11-24 12:55:07,31.77,41.0
2024/07/24 10:54:00,24-07-2024 11.16,2024-07-24 11:29:22,22.47,31.0
24-11-2023 11.25,24-11-2023 11.53,2023-11-24 12:04:09,28.04,24.0
02-07-2024 14.28,02-07-2024 14.48,2024-07-02 14:59:28,20.72,26.0
2024/01/16 09:26:00,16-01-2024 09.47,2024-01-16 09:52:57,21.26,31.0
2024/05/18 13:00:00,18-05-2024 13.01,2024-05-18 13:02:00,1.0,11.0
21-11-2024 12.33,21-11-2024 13.18,2024-11-21 13:20:47,45.32,19.0
11-01-2023 10.36,11-01-2023 10.44,2023-01-11 10:55:10,8.99,32.0
02-08-2023 13.53,02-08-2023 14.12,2023-08-02 14:20:16,19.82,17.0
26-07-2024 09.49,26-07-2024 10.07,2024-07-26 10:17:14,18.64,22.0
30-04-2024 13.55,30-04-2024 14.00,2024-04-30 14:04:15,5.08,25.0
,01-03-2024 10.17,2024-03-01 10:27:49,26.21,38.0
08-07-2023 10.36,08-07-2023 10.52,2023-07-08 11:04:36,16.51,18.0
01-05-2024 12.48,01-05-2024 13.10,2024-05-01 13:26:56,22.87,41.0
25-04-2024 11.32,25-04-2024 11.57,2024-04-25 12:10:16,25.67,42.0
09-05-2023 13.57,09-05-2023 14.28,2023-05-09 14:40:38,31.54,36.0
09-12-2023 11.19,09-12-2023 11.46,2023-12-09 11:56:40,27.43,37.0
03-04-2024 11.11,03-04-2024 11.29,2024-04-03 11:33:57,18.96,39.0
05-10-2023 12.38,05-10-2023 13.05,2023-10-05 13:15:07,27.18,39.0
24-10-2023 12.35,24-10-2023 12.51,2023-10-24 13:10:59,16.96,40.0
05-01-2024 14.34,05-01-2024 14.48,2024-01-05 14:58:19,14.91,38.0
31-07-2024 10.18,31-07-2024 10.23,2024-07-31 10:35:41,5.04,10.0
18-05-2024 09.09,18-05-2024 09.39,2024-05-18 09:59:18,30.38,40.0
11-06-2024 11.06,11-06-2024 11.27,2024-06-11 11:31:20,21.16,29.0
14-01-2023 12.28,14-01-2023 12.48,2023-01-14 12:54:49,20.17,33.0
10-10-2023 13.03,10-10-2023 13.26,2023-10-10 13:33:34,23.69,32.0
05-07-2024 15.44,05-07-2024 15.44,2024-07-05 15:45:00,0.0,
14-11-2024 12.34,14-11-2024 13.07,2024-11-14 13:20:53,33.61,51.0
2023/01/30 12:54:00,30-01-2023 13.10,2023-01-30 13:18:13,16.25,45.0
30-12-2023 12.46,30-12-2023 12.59,2023-12-30 13:00:00,13.0,33.0
02-10-2023 14.05,02-10-2023 14.37,2023-10-02 14:47:42,32.73,51.0
29-06-2023 15.34,29-06-2023 15.44,2023-06-29 15:45:00,10.0,22.0
21-09-2023 13.44,21-09-2023 14.09,2023-09-21 14:18:39,25.07,28.0
07-09-2024 12.43,07-09-2024 12.55,2024-09-07 13:00:00,12.29,13.0
13-01-2023 12.22,13-01-2023 12.45,2023-01-13 12:51:58,23.55,28.0
11-01-2024 13.48,11-01-2024 13.49,2024-01-11 13:54:10,1.0,25.0
04-09-2023 13.26,04-09-2023 13.55,2023-09-04 14:07:21,29.86,26.0
20-06-2023 11.27,20-06-2023 11.40,2023-06-20 11:54:52,,22.0
23-08-2023 14.57,23-08-2023 15.18,2023-08-23 15:27:55,21.45,25.0
2023/11/21 15:12:00,21-11-2023 15.38,2023-11-21 15:45:00,26.03,31.0
17-03-2023 11.03,17-03-2023 11.20,2023-03-17 11:23:05,17.4,24.0
23-11-2024 13.00,23-11-2024 13.01,2024-11-23 13:02:00,,32.0
24-04-2024 09.00,24-04-2024 09.14,2024-04-24 09:20:46,14.28,13.0
30-09-2024 14.17,30-09-2024 14.39,2024-09-30 14:49:43,22.12,31.0
10-06-2024 13.21,10-06-2024 13.51,2024-06-10 14:04:12,30.7,57.0
26-04-2024 13.01,26-04-2024 13.40,2024-04-26 13:52:51,39.72,49.0
10-07-2024 14.57,10-07-2024 15.21,2024-07-10 15:33:05,24.93,45.0
04-03-2023 13.00,04-03-2023 13.01,2023-03-04 13:02:00,1.0,49.0
2024/06/04 14:12:00,04-06-2024 14.30,2024-06-04 14:36:26,18.95,32.0
23-02-2024 09.43,23-02-2024 10.08,2024-02-23 10:21:36,25.51,30.0
28-09-2024 11.26,28-09-2024 11.51,2024-09-28 12:11:42,25.7,45.0
08-07-2024 10.49,08-07-2024 11.15,2024-07-08 11:17:45,26.34,35.0
21-08-2024 12.35,21-08-2024 12.54,2024-08-21 13:08:08,19.88,26.0
08-05-2024 11.34,08-05-2024 12.01,2024-05-08 12:12:09,27.23,30.0
13-06-2023 14.11,13-06-2023 14.22,2023-06-13 14:32:18,11.45,17.0
06-04-2023 11.28,06-04-2023 11.53,2023-04-06 12:05:10,25.46,47.0
10-08-2023 09.11,10-08-2023 09.27,2023-08-10 09:34:53,16.86,31.0
26-09-2024 14.57,26-09-2024 15.19,2024-09-26 15:41:24,22.4,32.0
19-01-2023 13.49,19-01-2023 14.16,2023-01-19 14:21:40,27.05,38.0
31-10-2023 11.35,31-10-2023 11.40,2023-10-31 11:52:16,5.86,32.0
01-12-2023 10.32,01-12-2023 10.53,2023-12-01 11:03:44,21.26,
19-06-2024 10.01,19-06-2024 10.31,2024-06-19 10:43:08,30.71,38.0
25-10-2023 12.47,25-10-2023 12.54,2023-10-25 12:57:16,7.18,19.0
22-08-2024 12.45,22-08-2024 13.13,2024-08-22 13:15:38,28.24,23.0
2023/09/09 13:00:00,09-09-2023 13.01,2023-09-09 13:02:00,1.0,18.0
05-04-2024 10.44,05-04-2024 11.13,2024-04-05 11:14:49,29.83,19.0
11-06-2024 10.37,11-06-2024 11.00,2024-06-11 11:07:43,23.79,29.0
15-06-2023 12.26,15-06-2023 12.45,2023-06-15 12:58:14,19.46,26.0
16-01-2023 13.22,16-01-2023 13.42,2023-01-16 13:58:43,20.31,27.0
08-05-2023 10.30,08-05-2023 10.40,2023-05-08 10:51:45,10.21,32.0
01-07-2024 10.51,01-07-2024 11.21,2024-07-01 11:33:36,30.58,32.0
11-08-2023 14.48,11-08-2023 15.14,2023-08-11 15:32:36,26.07,33.0
25-10-2023 14.37,25-10-2023 14.58,2023-10-25 15:08:59,21.21,33.0
20-03-2023 13.06,20-03-2023 13.29,2023-03-20 13:36:23,23.33,51.0
16-02-2024 09.11,16-02-2024 09.40,2024-02-16 09:43:03,29.18,56.0
12-04-2023 12.22,12-04-2023 12.43,2023-04-12 12:53:34,21.04,30.0
2023/11/22 10:09:00,22-11-2023 10.34,2023-11-22 10:46:50,25.75,31.0
,20-11-2024 15.44,2024-11-20 15:45:00,4.0,
11-01-2023 14.01,11-01-2023 14.23,2023-01-11 14:33:50,22.88,32.0
12-05-2023 11.19,12-05-2023 11.41,2023-05-12 11:46:06,22.43,25.0
18-05-2023 09.26,18-05-2023 09.50,2023-05-18 09:58:08,24.8,20.0
20-11-2023 09.34,20-11-2023 09.35,2023-11-20 09:43:35,,10.0
01-01-2024 12.26,01-01-2024 12.45,2024-01-01 12:58:35,19.59,33.0
15-04-2023 11.55,15-04-2023 12.10,2023-04-15 12:26:59,15.16,10.0
09-01-2023 13.01,09-01-2023 13.18,2023-01-09 13:28:48,17.78,34.0
2023/01/13 12:16:00,13-01-2023 12.38,2023-01-13 12:47:54,22.11,29.0
11-11-2023 13.00,11-11-2023 13.01,2023-11-11 13:02:00,1.0,40.0
16-07-2024 14.03,16-07-2024 14.07,2024-07-16 14:10:26,4.03,25.0
11-11-2024 12.46,11-11-2024 13.06,2024-11-11 13:31:14,20.91,40.0
25-05-2024 10.39,25-05-2024 10.56,2024-05-25 11:24:15,17.55,40.0
10-03-2023 15.11,10-03-2023 15.43,2023-03-10 15:45:00,,42.0
14-11-2024 11.37,14-11-2024 12.05,2024-11-14 12:11:38,28.04,46.0
24-10-2024 09.17,24-10-2024 09.36,2024-10-24 09:43:04,19.49,29.0
16-03-2024 12.13,16-03-2024 12.38,2024-03-16 12:40:02,25.31,36.0
25-05-2023 12.34,25-05-2023 12.53,2023-05-25 13:03:50,19.08,36.0
2023/04/20 12:07:00,20-04-2023 12.35,2023-04-20 12:53:57,27.91,24.0
17-07-2024 13.49,17-07-2024 14.24,2024-07-17 14:35:44,35.13,201.0
22-07-2023 13.00,22-07-2023 13.01,2023-07-22 13:02:00,1.0,26.0
2024/08/21 14:11:00,21-08-2024 14.30,2024-08-21 14:40:31,19.5,37.0
06-09-2024 09.17,06-09-2024 09.18,2024-09-06 09:28:08,1.0,10.0
29-03-2024 10.16,29-03-2024 10.44,2024-03-29 10:55:58,28.92,41.0
27-04-2024 11.16,27-04-2024 11.33,2024-04-27 11:45:08,17.09,39.0
2024/11/15 11:30:00,15-11-2024 11.57,2024-11-15 12:07:10,27.27,70.0
26-11-2024 14.12,26-11-2024 14.24,2024-11-26 14:32:34,12.64,17.0
01-08-2024 15.33,01-08-2024 15.44,2024-08-01 15:45:00,11.0,43.0
2024/02/20 15:45:00,20-02-2024 15.46,2024-02-20 15:47:00,1.0,59.0
04-07-2023 12.32,04-07-2023 12.41,2023-07-04 12:42:41,9.34,19.0
2024/05/02 10:32:00,02-05-2024 10.42,2024-05-02 10:55:04,10.89,32.0
2024/05/14 13:52:00,14-05-2024 14.10,2024-05-14 14:26:27,18.82,25.0
2024/03/07 09:28:00,07-03-2024 09.51,2024-03-07 10:03:36,,20.0
06-03-2024 14.43,06-03-2024 15.02,2024-03-06 15:13:53,19.48,26.0
10-05-2023 13.14,10-05-2023 13.28,2023-05-10 13:41:59,14.17,34.0
25-11-2024 14.22,25-11-2024 14.40,2024-11-25 14:48:18,18.43,38.0
09-06-2023 09.00,09-06-2023 09.22,2023-06-09 09:42:04,22.7,24.0
11-09-2023 15.20,11-09-2023 15.42,2023-09-11 15:45:00,21.98,30.0
2023/07/08 12:22:00,08-07-2023 12.43,2023-07-08 12:49:28,21.11,33.0
14-06-2024 09.43,14-06-2024 09.57,2024-06-14 10:10:19,14.1,16.0
10-05-2024 13.41,10-05-2024 13.58,2024-05-10 14:09:06,17.65,10.0
31-03-2023 10.51,31-03-2023 11.07,2023-03-31 11:12:25,16.38,19.0
06-03-2023 12.01,06-03-2023 12.18,2023-03-06 12:36:39,17.36,6.0
19-07-2024 14.45,19-07-2024 15.09,2024-07-19 15:22:02,24.78,47.0
21-11-2024 10.53,21-11-2024 11.17,2024-11-21 11:24:26,24.32,27.0
2023/12/29 13:00:00,29-12-2023 13.14,2023-12-29 13:17:46,14.16,162.0
07-06-2023 11.40,07-06-2023 12.02,2023-06-07 12:11:23,22.42,40.0
26-04-2024 09.16,26-04-2024 09.40,2024-04-26 09:50:33,24.85,26.0
08-03-2024 11.12,08-03-2024 11.34,2024-03-08 11:46:25,22.74,30.0
24-05-2024 10.30,24-05-2024 10.55,2024-05-24 11:06:07,25.23,30.0
2023/06/28 13:55:00,28-06-2023 14.05,2023-06-28 14:16:09,10.8,0.0
2023/06/03 13:00:00,03-06-2023 13.01,2023-06-03 13:02:00,1.0,37.0
10-08-2024 13.00,10-08-2024 13.01,2024-08-10 13:02:00,1.0,32.0
2024/01/18 15:13:00,18-01-2024 15.22,2024-01-18 15:31:26,9.42,32.0
30-10-2023 12.40,30-10-2023 13.00,2023-10-30 13:16:30,20.14,41.0
29-09-2023 11.31,29-09-2023 11.45,2023-09-29 11:51:17,14.64,19.0
2023/07/17 14:43:00,17-07-2023 15.02,2023-07-17 15:11:37,19.26,47.0
12-08-2024 11.13,12-08-2024 11.41,2024-08-12 11:47:57,28.95,64.0
04-11-2024 14.24,04-11-2024 14.43,2024-11-04 14:57:36,19.64,43.0
25-01-2023 12.52,25-01-2023 13.14,2023-01-25 13:27:55,22.27,36.0
27-03-2024 13.38,27-03-2024 13.58,2024-03-27 14:14:09,20.8,26.0
15-03-2024 11.51,15-03-2024 12.08,2024-03-15 12:17:12,17.76,40.0
11-03-2023 13.00,11-03-2023 13.01,2023-03-11 13:02:00,1.0,40.0
19-06-2023 10.10,19-06-2023 10.33,2023-06-19 10:41:03,23.38,28.0
31-07-2024 10.15,31-07-2024 10.39,2024-07-31 10:50:27,24.93,47.0
2024/10/11 14:15:00,11-10-2024 14.49,2024-10-11 14:53:22,34.2,35.0
25-12-2023 09.22,25-12-2023 09.44,2023-12-25 10:00:20,22.57,44.0
2023/11/08 13:17:00,08-11-2023 13.33,2023-11-08 13:46:47,16.83,9.0
14-05-2024 14.18,14-05-2024 14.49,2024-05-14 15:01:36,31.99,62.0
02-12-2024 11.21,02-12-2024 11.44,2024-12-02 11:47:52,23.34,33.0
31-07-2023 12.10,31-07-2023 12.29,2023-07-31 12:40:43,19.55,18.0
2024/09/26 12:46:00,26-09-2024 13.03,2024-09-26 13:04:24,17.4,143.0
30-10-2023 10.21,30-10-2023 10.34,2023-10-30 10:45:30,13.08,32.0
2023/03/22 10:49:00,22-03-2023 11.19,2023-03-22 11:24:25,,45.0
27-03-2023 13.05,27-03-2023 13.22,2023-03-27 13:33:43,17.26,15.0
24-08-2024 09.10,24-08-2024 09.20,2024-08-24 09:25:13,10.31,23.0
10-05-2023 10.41,10-05-2023 11.03,2023-05-10 11:14:06,22.8,40.0
05-08-2024 13.47,05-08-2024 14.15,2024-08-05 14:21:57,28.64,37.0
23-03-2024 13.00,23-03-2024 13.01,2024-03-23 13:02:00,1.0,17.0
17-07-2024 12.22,17-07-2024 12.34,2024-07-17 12:42:31,12.09,31.0
,05-04-2024 09.37,2024-04-05 09:53:34,28.56,40.0
26-04-2023 15.27,26-04-2023 15.36,2023-04-26 15:45:00,9.06,21.0
17-03-2023 12.16,17-03-2023 12.34,2023-03-17 12:36:15,18.13,23.0
13-05-2023 09.56,13-05-2023 10.26,2023-05-13 10:27:05,30.1,42.0
17-09-2024 13.43,17-09-2024 14.08,2024-09-17 14:18:53,25.7,25.0
15-07-2023 11.00,15-07-2023 11.17,2023-07-15 11:25:04,17.87,25.0
02-06-2023 11.17,02-06-2023 11.36,2023-06-02 11:53:25,19.79,31.0
16-03-2024 13.00,16-03-2024 13.01,2024-03-16 13:02:00,1.0,25.0
10-10-2024 11.11,10-10-2024 11.41,2024-10-10 11:52:37,30.49,25.0
12-10-2023 13.09,12-10-2023 13.33,2023-10-12 13:40:52,24.46,29.0
2024/10/18 15:36:00,18-10-2024 15.44,2024-10-18 15:45:00,8.0,
26-08-2024 12.05,26-08-2024 12.24,2024-08-26 12:30:43,19.03,28.0
03-08-2024 10.32,03-08-2024 11.00,2024-08-03 11:04:47,28.95,48.0
2023/11/28 12:50:00,28-11-2023 13.16,2023-11-28 13:25:01,26.51,37.0
07-08-2024 11.25,07-08-2024 11.44,2024-08-07 11:55:28,19.19,37.0
22-05-2024 12.30,22-05-2024 13.11,2024-05-22 13:20:53,41.73,57.0
2023/01/10 10:12:00,10-01-2023 10.30,2023-01-10 10:32:17,18.31,34.0
2024/06/03 09:22:00,03-06-2024 09.48,2024-06-03 10:00:46,26.2,28.0
22-03-2023 10.04,22-03-2023 10.27,2023-03-22 10:43:01,23.33,30.0
14-06-2023 09.00,14-06-2023 09.27,2023-06-14 09:46:49,27.79,32.0
07-06-2023 10.38,07-06-2023 10.49,2023-06-07 10:59:09,11.12,32.0
2024/09/02 10:46:00,02-09-2024 11.08,2024-09-02 11:18:26,22.18,32.0
2023/02/10 11:27:00,10-02-2023 11.49,2023-02-10 11:56:21,22.52,38.0
30-09-2023 13.00,30-09-2023 13.01,2023-09-30 13:02:00,1.0,14.0
20-06-2024 12.34,20-06-2024 13.15,2024-06-20 13:26:21,41.3,57.0
01-01-2024 12.58,01-01-2024 13.17,2024-01-01 13:33:52,19.82,17.0
04-05-2023 14.37,04-05-2023 14.51,2023-05-04 15:06:25,14.31,42.0
22-05-2024 12.09,22-05-2024 12.32,2024-05-22 12:37:58,23.8,32.0
11-08-2023 10.17,11-08-2023 10.38,2023-08-11 10:48:40,21.22,30.0
12-04-2024 10.44,12-04-2024 11.02,2024-04-12 11:03:36,18.56,28.0
26-02-2024 13.44,26-02-2024 13.56,2024-02-26 14:10:10,12.82,25.0
10-10-2024 15.45,10-10-2024 15.46,2024-10-10 15:47:00,1.0,25.0
16-11-2024 12.21,16-11-2024 12.46,2024-11-16 12:56:59,25.02,48.0
10-08-2024 13.00,10-08-2024 13.01,2024-08-10 13:02:00,1.0,25.0
01-04-2023 12.00,01-04-2023 12.18,2023-04-01 12:26:28,17.33,38.0
2023/05/15 13:46:00,15-05-2023 14.11,2023-05-15 14:24:10,25.54,25.0
14-12-2023 09.05,14-12-2023 09.38,2023-12-14 09:44:56,33.77,55.0
30-05-2024 15.45,30-05-2024 15.46,2024-05-30 15:47:00,1.0,25.0
28-09-2023 13.22,28-09-2023 13.45,2023-09-28 13:55:18,23.61,37.0
10-11-2023 10.10,10-11-2023 10.42,2023-11-10 10:45:32,32.18,42.0
05-03-2024 14.14,05-03-2024 14.38,2024-03-05 14:52:24,24.82,28.0
20-04-2023 13.05,20-04-2023 13.26,2023-04-20 13:38:48,21.3,42.0
11-02-2023 13.00,11-02-2023 13.01,2023-02-11 13:02:00,1.0,
27-02-2023 10.38,27-02-2023 11.01,2023-02-27 11:11:57,23.09,37.0
30-05-2024 12.26,30-05-2024 12.38,2024-05-30 12:42:50,12.46,40.0
19-12-2023 15.38,19-12-2023 15.44,2023-12-19 15:45:00,6.0,27.0
10-07-2024 09.35,10-07-2024 10.05,2024-07-10 10:09:49,30.68,47.0
23-06-2023 12.25,23-06-2023 13.12,2023-06-23 13:22:32,47.19,57.0
31-08-2024 10.09,31-08-2024 10.58,2024-08-31 11:07:55,49.14,22.0
17-02-2023 10.24,17-02-2023 10.59,2023-02-17 11:10:20,35.85,25.0
06-03-2024 12.09,06-03-2024 12.28,2024-03-06 12:38:50,19.14,26.0
27-07-2024 10.53,27-07-2024 11.10,2024-07-27 11:12:48,17.79,27.0
07-11-2023 15.43,07-11-2023 15.44,2023-11-07 15:45:00,1.0,25.0
2023/06/02 13:29:00,02-06-2023 13.59,2023-06-02 14:10:30,30.6,54.0
2023/10/30 13:15:00,30-10-2023 13.27,2023-10-30 13:38:21,12.28,6.0
2023/12/23 10:40:00,23-12-2023 11.06,2023-12-23 11:19:38,26.87,39.0
18-07-2024 11.49,18-07-2024 12.05,2024-07-18 12:16:42,16.64,47.0
22-06-2023 15.30,22-06-2023 15.43,2023-06-22 15:45:00,13.42,8.0
04-05-2023 11.13,04-05-2023 11.38,2023-05-04 11:50:18,25.34,17.0
06-09-2024 14.13,06-09-2024 15.44,2024-09-06 15:45:00,91.0,47.0
11-07-2023 14.50,11-07-2023 15.08,2023-07-11 15:17:43,18.73,37.0
03-06-2023 10.22,03-06-2023 11.27,2023-06-03 11:43:00,65.09,32.0
03-04-2023 14.09,03-04-2023 14.31,2023-04-03 14:38:23,22.55,20.0
27-02-2024 10.17,27-02-2024 10.45,2024-02-27 11:00:38,28.84,31.0
16-10-2024 11.33,16-10-2024 11.51,2024-10-16 12:01:58,18.11,32.0
09-12-2023 13.00,09-12-2023 13.01,2023-12-09 13:02:00,1.0,17.0
12-07-2024 12.27,12-07-2024 13.01,2024-07-12 13:17:24,34.34,62.0
2024/06/15 10:33:00,15-06-2024 11.01,2024-06-15 11:04:11,28.08,62.0
26-05-2023 11.26,26-05-2023 11.55,2023-05-26 12:08:06,28.66,70.0
13-11-2024 12.20,13-11-2024 12.41,2024-11-13 12:55:22,21.96,26.0
26-10-2024 10.27,26-10-2024 10.40,2024-10-26 10:58:50,13.26,0.0
24-08-2023 10.59,24-08-2023 11.20,2023-08-24 11:29:58,21.47,24.0
04-10-2024 15.20,04-10-2024 15.44,2024-10-04 15:45:00,24.0,58.0
05-06-2023 15.45,05-06-2023 15.46,2023-06-05 15:47:00,1.0,25.0
16-04-2024 14.09,16-04-2024 14.21,2024-04-16 14:37:10,12.84,
06-01-2024 13.00,06-01-2024 13.01,2024-01-06 13:02:00,1.0,42.0
19-07-2024 12.42,19-07-2024 12.52,2024-07-19 13:01:15,10.74,40.0
2024/05/04 13:00:00,04-05-2024 13.01,2024-05-04 13:02:00,1.0,16.0
20-12-2023 15.10,20-12-2023 15.36,2023-12-20 15:45:00,26.03,38.0
12-06-2024 11.17,12-06-2024 11.46,2024-06-12 11:55:37,29.55,64.0
17-09-2024 14.22,17-09-2024 14.25,2024-09-17 14:30:11,3.52,17.0
25-10-2024 09.17,25-10-2024 09.31,2024-10-25 09:44:06,14.24,36.0
29-02-2024 13.49,29-02-2024 13.57,2024-02-29 14:06:00,8.79,25.0
20-07-2023 15.27,20-07-2023 15.44,2023-07-20 15:45:00,17.0,43.0
28-06-2023 14.01,28-06-2023 14.22,2023-06-28 14:30:23,21.11,27.0
07-06-2024 09.44,07-06-2024 09.58,2024-06-07 10:12:56,14.81,22.0
10-01-2023 12.49,10-01-2023 13.12,2023-01-10 13:31:28,23.03,
20-10-2023 10.27,20-10-2023 10.46,2023-10-20 10:57:43,19.86,20.0
2024/06/28 12:32:00,28-06-2024 12.55,2024-06-28 13:07:18,23.75,33.0
13-01-2023 15.26,13-01-2023 15.44,2023-01-13 15:45:00,18.0,35.0
2024/02/02 09:57:00,02-02-2024 10.01,2024-02-02 10:03:38,4.76,10.0
25-11-2024 15.15,25-11-2024 15.40,2024-11-25 15:45:00,25.51,25.0
28-07-2023 13.11,28-07-2023 13.24,2023-07-28 13:35:20,13.34,18.0
18-01-2024 12.12,18-01-2024 12.55,2024-01-18 13:04:47,43.41,57.0
2023/10/28 13:00:00,28-10-2023 13.01,2023-10-28 13:02:00,1.0,8.0
27-11-2024 09.54,27-11-2024 10.07,2024-11-27 10:23:13,13.31,10.0
22-04-2024 11.40,22-04-2024 12.01,2024-04-22 12:20:51,21.63,47.0
20-02-2023 13.00,20-02-2023 13.21,2023-02-20 13:32:23,21.68,0.0
31-07-2024 09.19,31-07-2024 09.43,2024-07-31 09:50:48,24.48,35.0
10-10-2024 12.00,10-10-2024 12.24,2024-10-10 12:30:28,24.21,35.0
15-08-2024 13.58,15-08-2024 14.12,2024-08-15 14:28:40,,25.0
02-11-2023 14.07,02-11-2023 14.26,2023-11-02 14:29:33,19.48,8.0
2023/09/09 11:50:00,09-09-2023 12.16,2023-09-09 12:33:19,26.91,14.0
22-09-2023 11.08,22-09-2023 11.25,2023-09-22 11:36:47,17.45,23.0
2023/02/21 11:39:00,21-02-2023 12.01,2023-02-21 12:19:25,22.76,47.0
,06-08-2024 12.18,2024-08-06 12:25:17,36.68,36.0
07-02-2024 13.21,07-02-2024 13.37,2024-02-07 13:48:52,16.8,17.0
10-04-2024 12.29,10-04-2024 12.43,2024-04-10 12:58:29,14.19,40.0
12-08-2024 13.01,12-08-2024 13.20,2024-08-12 13:24:52,19.17,37.0
2023/01/13 09:02:00,13-01-2023 09.32,2023-01-13 09:48:25,30.53,32.0
08-09-2023 11.31,08-09-2023 11.58,2023-09-08 12:08:10,27.25,39.0
05-08-2023 09.00,05-08-2023 09.36,2023-08-05 09:40:08,36.58,56.0
29-04-2023 13.00,29-04-2023 13.01,2023-04-29 13:02:00,1.0,15.0
06-01-2024 11.47,06-01-2024 12.12,2024-01-06 12:27:42,25.87,32.0
06-03-2023 14.36,06-03-2023 14.50,2023-03-06 14:59:45,14.92,17.0
21-10-2024 15.45,21-10-2024 15.46,2024-10-21 15:47:00,1.0,25.0
2024/02/21 10:43:00,21-02-2024 11.15,2024-02-21 11:31:00,32.29,37.0
14-04-2023 14.11,14-04-2023 14.20,2023-04-14 14:28:22,9.64,14.0
,08-01-2024 11.21,2024-01-08 11:37:00,18.77,33.0
17-03-2023 13.32,17-03-2023 13.51,2023-03-17 14:11:47,19.56,36.0
05-09-2023 13.41,05-09-2023 14.01,2023-09-05 14:12:04,20.26,17.0
2024/11/30 12:59:00,30-11-2024 12.59,2024-11-30 13:00:00,0.0,44.0
2024/02/21 10:44:00,21-02-2024 10.48,2024-02-21 10:55:10,4.58,32.0
28-06-2024 15.10,28-06-2024 15.35,2024-06-28 15:45:00,25.45,41.0
2023/11/03 09:57:00,03-11-2023 10.28,2023-11-03 10:41:11,31.71,37.0
18-05-2024 13.00,18-05-2024 13.01,2024-05-18 13:02:00,1.0,25.0
2023/02/21 09:25:00,21-02-2023 09.51,2023-02-21 10:01:06,26.14,63.0
2024/04/18 13:00:00,18-04-2024 13.26,2024-04-18 13:48:48,26.76,40.0
22-07-2023 13.00,22-07-2023 13.01,2023-07-22 13:02:00,1.0,32.0
06-05-2023 12.53,06-05-2023 12.59,2023-05-06 13:00:00,6.0,35.0
31-08-2023 11.24,31-08-2023 11.53,2023-08-31 12:06:58,29.99,42.0
22-06-2023 11.40,22-06-2023 12.12,2023-06-22 12:18:14,32.59,39.0
18-08-2023 13.23,18-08-2023 13.39,2023-08-18 13:53:24,16.98,32.0
22-11-2023 12.01,22-11-2023 12.26,2023-11-22 12:32:13,25.85,29.0
19-10-2023 12.47,19-10-2023 13.12,2023-10-19 13:22:19,25.63,41.0
2023/09/09 12:55:00,09-09-2023 12.59,2023-09-09 13:00:00,4.0,6.0
25-07-2024 10.19,25-07-2024 10.42,2024-07-25 10:50:36,23.26,34.0
01-06-2024 12.37,01-06-2024 12.57,2024-06-01 13:00:00,20.86,143.0
18-12-2023 12.27,18-12-2023 12.48,2023-12-18 13:02:19,21.02,22.0
02-08-2023 10.37,02-08-2023 10.47,2023-08-02 11:02:38,10.78,32.0
09-02-2023 15.44,09-02-2023 15.44,2023-02-09 15:45:00,0.0,38.0
15-04-2023 09.06,15-04-2023 09.24,2023-04-15 09:32:24,18.2,39.0
03-05-2024 14.47,03-05-2024 15.07,2024-05-03 15:30:53,20.22,32.0
02-12-2024 15.36,02-12-2024 15.44,2024-12-02 15:45:00,8.0,25.0
05-03-2024 14.02,05-03-2024 14.25,2024-03-05 14:26:31,23.52,36.0
18-01-2023 10.27,18-01-2023 10.52,2023-01-18 11:03:48,25.03,30.0
15-08-2024 15.45,15-08-2024 15.46,2024-08-15 15:47:00,1.0,25.0
23-02-2023 09.08,23-02-2023 09.49,2023-02-23 09:58:51,41.83,44.0
28-02-2023 11.27,28-02-2023 11.51,2023-02-28 11:57:59,23.72,30.0
09-09-2023 9.46,09-09-2023 11.55,2023-09-09 12:08:21,129.18,28.0
30-01-2023 10.49,30-01-2023 11.12,2023-01-30 11:20:18,23.24,27.0
21-04-2023 11.46,21-04-2023 12.04,2023-04-21 12:14:43,18.73,47.0
2023/02/20 10:36:00,20-02-2023 10.50,2023-02-20 10:51:49,14.83,37.0
25-03-2024 14.11,25-03-2024 14.32,2024-03-25 14:43:31,21.16,14.0
14-10-2023 13.00,14-10-2023 13.01,2023-10-14 13:02:00,1.0,41.0
17-01-2024 09.45,17-01-2024 10.12,2024-01-17 10:22:40,27.62,26.0
16-10-2023 12.43,16-10-2023 12.57,2023-10-16 13:07:54,14.48,36.0
08-04-2024 15.38,08-04-2024 15.44,2024-04-08 15:45:00,6.0,25.0
02-02-2023 12.17,02-02-2023 12.46,2023-02-02 13:01:24,29.61,44.0
2023/05/27 10:10:00,27-05-2023 10.17,2023-05-27 10:28:44,7.79,32.0
04-09-2024 11.42,04-09-2024 12.00,2024-09-04 12:10:58,18.62,31.0
10-04-2024 15.31,10-04-2024 15.44,2024-04-10 15:45:00,13.0,30.0
17-07-2024 12.29,17-07-2024 12.31,2024-07-17 12:40:33,2.4,40.0
03-07-2024 09.00,03-07-2024 09.23,2024-07-03 09:35:13,23.06,34.0
15-11-2024 10.12,15-11-2024 10.38,2024-11-15 11:01:05,26.83,153.0
24-08-2024 12.09,24-08-2024 12.31,2024-08-24 12:43:14,22.47,33.0
2023/09/30 09:55:00,30-09-2023 10.13,2023-09-30 10:21:33,18.06,31.0
16-09-2023 10.05,16-09-2023 10.45,2023-09-16 11:01:57,40.05,34.0
18-08-2023 14.19,18-08-2023 14.33,2023-08-18 14:45:44,14.71,0.0
28-11-2024 12.31,28-11-2024 12.39,2024-11-28 12:47:21,8.93,31.0
15-11-2023 11.53,15-11-2023 12.17,2023-11-15 12:20:32,24.74,38.0
2023/04/24 09:51:00,24-04-2023 10.08,2023-04-24 10:12:35,17.88,18.0
23-10-2024 14.27,23-10-2024 14.53,2024-10-23 15:06:05,26.73,18.0
04-11-2024 11.52,04-11-2024 12.08,2024-11-04 12:24:27,16.38,20.0
09-02-2023 14.32,09-02-2023 14.55,2023-02-09 15:02:22,23.84,45.0
2023/09/29 09:22:00,29-09-2023 09.57,2023-09-29 10:02:51,35.84,42.0
08-04-2024 11.02,08-04-2024 11.22,2024-04-08 11:30:46,20.07,30.0
09-06-2023 13.33,09-06-2023 13.52,2023-06-09 14:02:08,19.44,28.0
2024/05/07 12:50:00,07-05-2024 13.19,2024-05-07 13:30:35,29.08,41.0
05-07-2024 9.43,05-07-2024 09.57,2024-07-05 10:17:49,14.29,19.0
21-08-2024 10.40,21-08-2024 10.58,2024-08-21 10:59:11,18.17,24.0
29-10-2024 12.10,29-10-2024 12.33,2024-10-29 12:41:38,23.21,28.0
26-09-2024 09.41,26-09-2024 10.01,2024-09-26 10:11:32,20.85,33.0
14-09-2023 12.37,14-09-2023 13.01,2023-09-14 13:21:51,24.26,20.0
2024/07/12 09:13:00,12-07-2024 09.38,2024-07-12 09:47:38,25.89,32.0
06-06-2024 14.23,06-06-2024 14.36,2024-06-06 14:42:07,13.73,26.0
11-03-2024 15.37,11-03-2024 15.44,2024-03-11 15:45:00,7.0,41.0
2024/01/29 15:35:00,29-01-2024 15.44,2024-01-29 15:45:00,,16.0
14-10-2023 9.58,14-10-2023 10.16,2023-10-14 10:36:12,18.49,26.0
2024/03/06 10:17:00,06-03-2024 10.27,2024-03-06 10:35:23,10.3,32.0
03-01-2024 13.42,03-01-2024 13.59,2024-01-03 14:12:45,17.74,32.0
2024/01/08 12:25:00,08-01-2024 13.10,2024-01-08 13:19:05,45.84,57.0
08-12-2023 15.28,08-12-2023 15.33,2023-12-08 15:45:00,5.45,15.0
07-09-2023 10.40,07-09-2023 10.43,2023-09-07 10:48:57,3.03,32.0
29-12-2023 09.19,29-12-2023 09.40,2023-12-29 09:55:43,21.94,33.0
09-03-2024 10.21,09-03-2024 10.50,2024-03-09 11:03:57,29.1,41.0
2024/09/19 11:21:00,19-09-2024 11.45,2024-09-19 12:00:17,24.59,24.0
18-04-2023 9.46,18-04-2023 10.04,2023-04-18 10:06:57,18.6,26.0
29-01-2024 11.44,29-01-2024 12.14,2024-01-29 12:18:46,30.73,36.0
07-06-2023 15.39,07-06-2023 15.44,2023-06-07 15:45:00,5.0,25.0
28-05-2024 09.14,28-05-2024 09.25,2024-05-28 09:31:10,11.17,5.0
13-11-2023 09.10,13-11-2023 09.41,2023-11-13 09:47:14,31.67,42.0
08-10-2024 10.46,08-10-2024 10.53,2024-10-08 10:59:14,7.99,32.0
,17-07-2024 15.44,2024-07-17 15:45:00,8.0,25.0
18-03-2023 10.39,18-03-2023 10.55,2023-03-18 11:08:12,16.7,32.0
2023/07/07 10:33:00,07-07-2023 11.04,2023-07-07 11:16:36,31.93,32.0
08-03-2023 13.12,08-03-2023 13.29,2023-03-08 13:39:42,17.5,25.0
18-12-2023 13.06,18-12-2023 13.32,2023-12-18 13:35:30,26.99,53.0
11-02-2023 13.00,11-02-2023 13.01,2023-02-11 13:02:00,1.0,28.0
28-06-2024 14.36,28-06-2024 14.51,2024-06-28 14:54:57,15.7,20.0
08-08-2024 11.00,08-08-2024 11.24,2024-08-08 11:40:08,24.59,24.0
23-07-2024 10.41,23-07-2024 10.44,2024-07-23 10:51:24,3.92,32.0
23-02-2023 11.57,23-02-2023 12.12,2023-02-23 12:25:59,15.39,28.0
11-04-2023 11.24,11-04-2023 11.58,2023-04-11 12:09:32,34.05,28.0
09-02-2023 11.48,09-02-2023 12.17,2023-02-09 12:19:05,29.97,
04-02-2023 12.35,04-02-2023 12.48,2023-02-04 13:00:00,13.71,40.0
02-03-2024 10.39,02-03-2024 11.13,2024-03-02 11:25:17,34.98,19.0
18-06-2024 09.49,18-06-2024 10.22,2024-06-18 10:36:08,33.17,37.0
01-02-2024 14.38,01-02-2024 15.10,2024-02-01 15:22:19,32.04,31.0
07-03-2023 13.08,07-03-2023 13.22,2023-03-07 13:34:31,14.74,18.0
29-03-2023 14.17,29-03-2023 14.35,2023-03-29 14:46:19,18.74,35.0
11-08-2023 11.12,11-08-2023 11.36,2023-08-11 11:41:50,24.71,33.0
01-02-2024 12.02,01-02-2024 12.14,2024-02-01 12:26:52,12.28,7.0
12-01-2023 10.00,12-01-2023 10.16,2023-01-12 10:19:29,16.32,18.0
2024/07/23 11:13:00,23-07-2024 11.39,2024-07-23 11:52:39,25.95,34.0
07-06-2023 15.19,07-06-2023 15.29,2023-06-07 15:43:31,10.08,4.0
14-11-2023 15.45,14-11-2023 15.46,2023-11-14 15:47:00,1.0,25.0
07-02-2024 10.40,07-02-2024 11.06,2024-02-07 11:17:32,26.23,37.0
07-12-2023 09.04,07-12-2023 09.31,2023-12-07 09:43:54,27.2,21.0
07-06-2023 11.59,07-06-2023 12.16,2023-06-07 12:23:40,17.8,21.0
2024/07/25 12:19:00,25-07-2024 12.41,2024-07-25 12:49:29,21.91,43.0
18-03-2023 13.00,18-03-2023 13.01,2023-03-18 13:02:00,1.0,33.0
12-01-2023 11.19,12-01-2023 11.37,2023-01-12 11:51:56,18.82,3.0
30-05-2023 14.12,30-05-2023 14.30,2023-05-30 14:36:58,18.99,32.0
30-04-2024 13.29,30-04-2024 13.47,2024-04-30 13:56:49,18.14,32.0
29-05-2024 09.03,29-05-2024 09.45,2024-05-29 09:56:33,42.74,
08-07-2023 13.00,08-07-2023 13.01,2023-07-08 13:02:00,1.0,15.0
19-06-2024 09.09,19-06-2024 09.44,2024-06-19 09:48:24,35.51,56.0
2024/11/07 12:41:00,07-11-2024 12.55,2024-11-07 13:00:24,14.47,143.0
22-07-2024 14.18,22-07-2024 14.29,2024-07-22 14:40:42,11.05,20.0
2023/12/22 11:04:00,22-12-2023 11.18,2023-12-22 11:27:56,14.26,13.0
03-03-2023 10.20,03-03-2023 10.50,2023-03-03 11:00:37,30.37,33.0
01-07-2024 14.10,01-07-2024 14.26,2024-07-01 14:43:48,16.67,17.0
01-11-2024 14.43,01-11-2024 15.06,2024-11-01 15:18:39,23.23,43.0
24-06-2024 11.31,24-06-2024 12.02,2024-06-24 12:14:46,30.58,70.0
2023/11/04 13:00:00,04-11-2023 13.01,2023-11-04 13:02:00,1.0,34.0
19-09-2024 11.47,19-09-2024 12.14,2024-09-19 12:25:27,26.99,30.0
2024/09/26 11:58:00,26-09-2024 12.22,2024-09-26 12:36:44,24.76,32.0
27-02-2024 9.00,27-02-2024 09.24,2024-02-27 09:34:02,24.98,
11-04-2023 09.12,11-04-2023 09.29,2023-04-11 09:36:14,17.29,31.0
24-01-2024 12.27,24-01-2024 12.35,2024-01-24 12:46:08,8.17,600.0
19-08-2024 11.18,19-08-2024 11.45,2024-08-19 12:02:15,27.57,47.0
2024/04/09 10:17:00,09-04-2024 10.22,2024-04-09 10:26:26,,
2024/04/20 11:45:00,20-04-2024 11.59,2024-04-20 12:16:19,14.74,21.0
30-09-2023 13.00,30-09-2023 13.01,2023-09-30 13:02:00,1.0,28.0
10-08-2023 10.09,10-08-2023 10.49,2023-08-10 11:04:50,40.35,34.0
03-08-2024 10.02,03-08-2024 10.24,2024-08-03 10:32:02,22.77,28.0
03-06-2024 11.59,03-06-2024 12.28,2024-06-03 12:35:55,29.12,22.0
21-10-2024 10.42,21-10-2024 11.07,2024-10-21 11:09:11,25.49,19.0
23-05-2024 14.38,23-05-2024 15.02,2024-05-23 15:20:53,24.56,33.0
25-07-2023 13.53,25-07-2023 14.10,2023-07-25 14:20:39,17.51,25.0
2024/03/22 10:36:00,22-03-2024 11.10,2024-03-22 11:16:31,34.47,36.0
25-03-2024 09.30,25-03-2024 09.49,2024-03-25 10:07:57,19.49,45.0
31-07-2024 12.24,31-07-2024 12.53,2024-07-31 13:07:17,29.83,38.0
21-06-2023 14.09,21-06-2023 14.19,2023-06-21 14:36:00,10.92,25.0
2023/02/09 15:19:00,09-02-2023 15.44,2023-02-09 15:45:00,24.51,41.0
24-05-2023 12.44,24-05-2023 12.54,2023-05-24 13:02:04,10.29,40.0
06-10-2023 10.56,06-10-2023 11.12,2023-10-06 11:26:30,16.21,16.0
20-04-2023 12.01,20-04-2023 12.27,2023-04-20 12:35:50,26.71,45.0
2024/02/22 13:01:00,22-02-2024 13.35,2024-02-22 13:43:44,,57.0
30-05-2024 10.19,30-05-2024 10.34,2024-05-30 10:39:36,15.88,21.0
15-05-2024 15.27,15-05-2024 15.44,2024-05-15 15:45:00,17.0,43.0
20-10-2023 11.19,20-10-2023 11.39,2023-10-20 11:42:39,20.29,29.0
23-08-2023 12.40,23-08-2023 13.04,2023-08-23 13:23:48,24.8,41.0
11-07-2023 11.49,11-07-2023 12.23,2023-07-11 12:34:20,34.96,54.0
10-02-2024 09.00,10-02-2024 09.21,2024-02-10 09:29:45,21.39,29.0
31-08-2023 13.55,31-08-2023 14.03,2023-08-31 14:08:51,8.19,32.0
09-09-2023 12.09,09-09-2023 12.34,2023-09-09 12:44:58,25.19,41.0
25-03-2024 09.55,25-03-2024 10.25,2024-03-25 10:30:08,30.12,47.0
31-05-2024 10.28,31-05-2024 10.39,2024-05-31 10:47:59,11.67,32.0
18-01-2024 09.55,18-01-2024 10.04,2024-01-18 10:11:52,9.18,10.0
06-02-2024 14.16,06-02-2024 14.37,2024-02-06 14:43:43,21.41,8.0
16-09-2023 10.24,16-09-2023 10.47,2023-09-16 10:52:59,23.53,45.0
29-07-2023 13.00,29-07-2023 13.01,2023-07-29 13:02:00,1.0,43.0
11-05-2024 09.30,11-05-2024 09.49,2024-05-11 09:55:05,19.06,31.0
19-04-2023 12.09,19-04-2023 12.34,2023-04-19 12:48:23,25.59,38.0
2023/08/30 11:36:00,30-08-2023 12.08,2023-08-30 12:21:30,31.56,70.0
10-03-2023 11.24,10-03-2023 11.44,2023-03-10 11:53:07,,25.0
03-03-2023 13.33,03-03-2023 13.50,2023-03-03 14:02:21,,27.0
11-04-2023 11.47,11-04-2023 12.09,2023-04-11 12:25:06,22.46,23.0
24-05-2023 09.50,24-05-2023 10.10,2023-05-24 10:24:41,20.7,23.0
22-02-2023 14.56,22-02-2023 15.19,2023-02-22 15:23:44,23.07,58.0
13-05-2023 13.00,13-05-2023 13.01,2023-05-13 13:02:00,1.0,36.0
2024/01/13 11:56:00,13-01-2024 12.17,2024-01-13 12:27:25,21.3,28.0
13-01-2023 12.06,13-01-2023 12.21,2023-01-13 12:27:53,15.05,29.0
27-10-2023 11.50,27-10-2023 12.08,2023-10-27 12:27:37,18.89,29.0
22-08-2023 14.14,22-08-2023 14.25,2023-08-22 14:38:28,11.85,14.0
11-08-2023 13.43,11-08-2023 13.49,2023-08-11 13:56:34,6.94,171.0
2024/09/03 10:39:00,03-09-2024 10.41,2024-09-03 10:44:38,2.92,32.0
03-10-2023 10.36,03-10-2023 10.52,2023-10-03 11:07:59,16.89,21.0
01-09-2023 13.45,01-09-2023 14.13,2023-09-01 14:23:21,28.94,51.0
29-08-2023 13.53,29-08-2023 14.07,2023-08-29 14:20:13,14.98,25.0
11-11-2023 12.30,11-11-2023 12.45,2023-11-11 13:00:00,15.67,40.0
29-08-2023 10.44,29-08-2023 11.02,2023-08-29 11:09:06,18.98,39.0
23-09-2023 09.07,23-09-2023 09.31,2023-09-23 09:40:26,24.84,32.0
2023/02/07 09:01:00,07-02-2023 09.23,2023-02-07 09:33:32,22.36,35.0
03-10-2023 12.53,03-10-2023 13.17,2023-10-03 13:30:31,24.8,31.0
11-08-2023 11.44,11-08-2023 11.56,2023-08-11 12:01:59,12.97,27.0
13-05-2024 10.00,13-05-2024 10.33,2024-05-13 10:43:12,33.42,25.0
2023/04/05 11:32:00,05-04-2023 12.05,2023-04-05 12:15:00,33.69,50.0
19-11-2024 10.14,19-11-2024 10.39,2024-11-19 10:59:19,25.94,24.0
23-02-2024 10.44,23-02-2024 10.59,2024-02-23 11:17:01,15.53,16.0
05-07-2023 14.08,05-07-2023 14.29,2023-07-05 14:37:22,,35.0
11-01-2023 09.38,11-01-2023 10.12,2023-01-11 10:18:01,34.89,53.0
2023/02/21 10:45:00,21-02-2023 10.49,2023-02-21 10:54:33,4.84,32.0
03-06-2023 10.00,03-06-2023 10.24,2023-06-03 10:31:46,24.88,33.0
02-08-2023 10.53,02-08-2023 11.15,2023-08-02 11:18:43,22.5,19.0
2024/11/29 14:32:00,29-11-2024 15.12,2024-11-29 15:33:09,40.2,54.0
07-09-2024 13.00,07-09-2024 13.01,2024-09-07 13:02:00,1.0,25.0
25-11-2024 09.02,25-11-2024 09.15,2024-11-25 09:25:11,13.03,20.0
26-11-2024 13.18,26-11-2024 13.41,2024-11-26 13:44:27,23.76,33.0
01-12-2023 11.37,01-12-2023 11.58,2023-12-01 12:06:49,21.03,28.0
2023/08/09 15:01:00,09-08-2023 15.07,2023-08-09 15:17:12,6.92,32.0
25-02-2023 10.14,25-02-2023 10.49,2023-02-25 11:00:35,35.83,39.0
03-10-2023 12.54,03-10-2023 13.04,2023-10-03 13:13:28,10.39,17.0
15-07-2024 11.00,15-07-2024 11.30,2024-07-15 11:40:58,30.18,34.0
2024/10/04 13:04:00,04-10-2024 13.19,2024-10-04 13:31:19,15.42,34.0
26-04-2024 09.47,26-04-2024 10.15,2024-04-26 10:30:21,28.33,37.0
2024/07/15 14:38:00,15-07-2024 15.01,2024-07-15 15:11:22,23.06,36.0
2024/01/26 13:27:00,26-01-2024 14.01,2024-01-26 14:12:15,34.04,53.0
15-01-2024 10.01,15-01-2024 10.02,2024-01-15 10:06:37,1.0,10.0
2024/01/27 13:00:00,27-01-2024 13.01,2024-01-27 13:02:00,1.0,37.0
10-04-2024 12.02,10-04-2024 12.31,2024-04-10 12:41:52,29.94,48.0
20-04-2024 13.00,20-04-2024 13.01,2024-04-20 13:02:00,1.0,33.0
,10-01-2024 15.24,2024-01-10 15:36:08,28.23,46.0
23-05-2024 14.38,23-05-2024 14.55,2024-05-23 15:05:11,17.14,38.0
2023/02/02 11:02:00,02-02-2023 11.14,2023-02-02 11:28:00,12.5,22.0
23-01-2023 12.08,23-01-2023 12.32,2023-01-23 12:40:50,24.5,35.0
04-11-2023 10.14,04-11-2023 10.42,2023-11-04 10:54:24,28.71,41.0
2023/04/24 09:48:00,24-04-2023 10.10,2023-04-24 10:18:26,22.63,31.0
08-04-2023 13.00,08-04-2023 13.01,2023-04-08 13:02:00,1.0,43.0
2024/06/01 12:32:00,01-06-2024 12.43,2024-06-01 12:54:33,11.38,40.0
2024/02/03 09:32:00,03-02-2024 09.54,2024-02-03 10:06:35,22.28,31.0
27-03-2024 13.03,27-03-2024 13.35,2024-03-27 13:37:19,32.45,44.0
15-08-2023 09.51,15-08-2023 10.29,2023-08-15 10:34:06,38.13,63.0
08-12-2023 13.43,08-12-2023 14.14,2023-12-08 14:23:29,31.42,53.0
2024/10/11 14:27:00,11-10-2024 14.43,2024-10-11 14:57:11,16.94,41.0
27-04-2023 10.47,27-04-2023 11.10,2023-04-27 11:19:38,23.6,40.0
11-10-2023 13.51,11-10-2023 14.04,2023-10-11 14:18:37,13.24,25.0
04-11-2024 09.40,04-11-2024 09.53,2024-11-04 10:07:28,13.47,10.0
21-08-2023 11.04,21-08-2023 11.24,2023-08-21 11:29:13,20.29,25.0
02-05-2024 11.13,02-05-2024 11.37,2024-05-02 11:44:10,24.98,25.0
04-11-2023 09.09,04-11-2023 09.42,2023-11-04 09:47:27,33.45,52.0
2023/10/03 11:09:00,03-10-2023 11.28,2023-10-03 11:36:46,19.74,36.0
18-04-2024 12.27,18-04-2024 12.46,2024-04-18 12:59:08,19.43,31.0
2024/11/12 12:29:00,12-11-2024 12.57,2024-11-12 13:02:57,28.4,40.0
,23-02-2024 12.17,2024-02-23 12:19:26,,48.0
19-10-2024 13.00,19-10-2024 13.01,2024-10-19 13:02:00,1.0,17.0
2023/03/20 13:14:00,20-03-2023 13.39,2023-03-20 13:52:40,25.94,50.0
06-05-2023 10.53,06-05-2023 11.22,2023-05-06 11:35:23,29.44,166.0
07-04-2023 09.27,07-04-2023 09.43,2023-04-07 09:52:15,15.79,37.0
13-07-2023 09.22,13-07-2023 09.40,2023-07-13 09:48:44,18.15,26.0
10-08-2024 11.08,10-08-2024 11.34,2024-08-10 11:44:02,,55.0
08-05-2024 11.01,08-05-2024 11.31,2024-05-08 11:44:04,30.94,50.0
2023/03/18 12:45:00,18-03-2023 12.59,2023-03-18 13:00:00,14.0,20.0
26-04-2023 11.13,26-04-2023 11.42,2023-04-26 11:51:16,29.66,50.0
14-04-2023 14.12,14-04-2023 14.20,2023-04-14 14:26:40,8.29,17.0
21-02-2024 13.11,21-02-2024 13.28,2024-02-21 13:40:51,17.08,9.0
10-05-2024 12.09,10-05-2024 12.35,2024-05-10 12:46:49,26.34,47.0
08-02-2024 09.08,08-02-2024 09.42,2024-02-08 09:54:54,34.45,46.0
12-07-2024 12.32,12-07-2024 12.33,2024-07-12 12:40:31,1.0,40.0
08-06-2023 12.48,08-06-2023 13.24,2023-06-08 13:40:13,36.75,45.0
2024/04/23 14:08:00,23-04-2024 14.15,2024-04-23 14:21:59,7.03,146.0
29-12-2023 10.55,29-12-2023 11.17,2023-12-29 11:28:27,22.94,33.0
03-02-2023 09.30,03-02-2023 09.52,2023-02-03 10:04:59,22.54,31.0
12-01-2023 14.37,12-01-2023 15.00,2023-01-12 15:10:31,23.84,26.0
01-11-2023 10.02,01-11-2023 10.08,2023-11-01 10:17:40,6.92,5.0
19-12-2023 15.40,19-12-2023 15.44,2023-12-19 15:45:00,4.0,25.0
2023/12/08 13:12:00,08-12-2023 13.35,2023-12-08 13:48:51,23.97,28.0
27-11-2023 14.59,27-11-2023 15.26,2023-11-27 15:35:32,27.25,32.0
14-09-2024 10.19,14-09-2024 10.34,2024-09-14 10:45:59,15.46,32.0
09-06-2023 12.26,09-06-2023 12.28,2023-06-09 12:40:21,2.33,40.0
17-01-2023 14.39,17-01-2023 15.09,2023-01-17 15:14:33,30.78,47.0
2024/09/07 13:00:00,07-09-2024 13.01,2024-09-07 13:02:00,1.0,36.0
18-05-2023 10.25,18-05-2023 10.37,2023-05-18 10:46:56,11.38,5.0
18-07-2024 13.53,18-07-2024 14.07,2024-07-18 14:15:25,14.29,44.0
2023/11/03 13:58:00,03-11-2023 14.06,2023-11-03 14:15:12,8.38,25.0
19-06-2024 9.24,19-06-2024 09.38,2024-06-19 09:50:45,14.38,34.0
2024/07/04 12:53:00,04-07-2024 13.23,2024-07-04 13:36:59,30.92,57.0
16-05-2024 14.21,16-05-2024 14.41,2024-05-16 14:48:56,20.03,28.0
2024/11/23 12:19:00,23-11-2024 12.44,2024-11-23 12:58:05,25.8,43.0
30-08-2024 09.07,30-08-2024 09.27,2024-08-30 09:41:55,20.4,23.0
01-08-2023 13.19,01-08-2023 13.40,2023-08-01 13:59:59,21.5,36.0
23-12-2023 13.00,23-12-2023 13.01,2023-12-23 13:02:00,1.0,25.0
15-04-2023 13.00,15-04-2023 13.01,2023-04-15 13:02:00,1.0,14.0
26-01-2023 12.35,26-01-2023 12.41,2023-01-26 12:53:36,7.0,31.0
23-10-2023 10.31,23-10-2023 10.53,2023-10-23 11:11:04,22.77,32.0
20-06-2023 13.25,20-06-2023 13.52,2023-06-20 14:02:44,27.43,54.0
2023/10/27 09:41:00,27-10-2023 09.50,2023-10-27 09:56:18,9.2,10.0
2023/01/21 12:13:00,21-01-2023 12.37,2023-01-21 12:41:50,24.05,33.0
19-06-2024 15.26,19-06-2024 15.44,2024-06-19 15:45:00,17.37,41.0
2024/08/28 12:02:00,28-08-2024 12.16,2024-08-28 12:28:36,14.25,23.0
13-05-2023 09.01,13-05-2023 09.24,2023-05-13 09:39:25,23.7,24.0
15-06-2024 11.23,15-06-2024 11.41,2024-06-15 11:50:31,18.36,30.0
2023/06/05 10:38:00,05-06-2023 10.48,2023-06-05 10:58:39,10.72,32.0
20-02-2024 11.44,20-02-2024 12.10,2024-02-20 12:19:18,26.98,30.0
17-04-2023 15.33,17-04-2023 15.44,2023-04-17 15:45:00,11.16,37.0
20-08-2024 15.02,20-08-2024 15.35,2024-08-20 15:38:33,33.56,49.0
22-04-2023 11.03,22-04-2023 11.17,2023-04-22 11:20:12,14.24,28.0
2023/01/28 13:00:00,28-01-2023 13.01,2023-01-28 13:02:00,1.0,10.0
29-08-2023 09.08,29-08-2023 09.41,2023-08-29 09:49:47,33.34,52.0
14-09-2023 14.10,14-09-2023 14.33,2023-09-14 14:42:17,23.41,10.0
,25-01-2023 11.02,2023-01-25 11:13:30,24.99,32.0
21-12-2023 13.38,21-12-2023 13.57,2023-12-21 14:09:31,19.85,17.0
05-10-2023 12.14,05-10-2023 12.35,2023-10-05 12:47:45,21.99,31.0
29-04-2024 11.16,29-04-2024 11.41,2024-04-29 11:50:42,25.48,30.0
2023/06/02 14:27:00,02-06-2023 14.41,2023-06-02 14:56:21,14.91,17.0
17-08-2024 11.24,17-08-2024 11.58,2024-08-17 12:15:54,34.43,56.0
2024/08/02 11:23:00,02-08-2024 11.51,2024-08-02 12:10:09,28.16,45.0
27-05-2023 13.00,27-05-2023 13.01,2023-05-27 13:02:00,1.0,33.0
2024/06/25 10:03:00,25-06-2024 10.18,2024-06-25 10:30:53,15.78,34.0
17-05-2024 09.55,17-05-2024 10.08,2024-05-17 10:22:03,13.35,10.0
31-08-2024 12.52,31-08-2024 12.59,2024-08-31 13:00:00,7.0,29.0
09-04-2024 13.47,09-04-2024 14.01,2024-04-09 14:11:22,14.86,15.0
27-06-2023 15.06,27-06-2023 15.16,2023-06-27 15:38:52,10.18,20.0
2023/07/19 14:04:00,19-07-2023 14.14,2023-07-19 14:25:29,10.63,17.0
22-02-2023 09.47,22-02-2023 10.11,2023-02-22 10:22:35,24.67,26.0
2024/05/13 09:40:00,13-05-2024 10.02,2024-05-13 10:07:25,22.85,53.0
07-06-2023 12.50,07-06-2023 13.18,2023-06-07 13:34:07,28.52,41.0
04-07-2024 09.45,04-07-2024 10.05,2024-07-04 10:21:12,20.16,21.0
10-04-2024 12.34,10-04-2024 12.58,2024-04-10 13:06:13,24.02,30.0
11-11-2023 13.00,11-11-2023 13.01,2023-11-11 13:02:00,1.0,12.0
07-08-2024 13.10,07-08-2024 13.27,2024-08-07 13:38:29,17.6,27.0
05-10-2023 12.29,05-10-2023 13.01,2023-10-05 13:15:18,32.36,62.0
2023/04/28 12:19:00,28-04-2023 12.54,2023-04-28 12:56:33,35.95,44.0
16-05-2024 10.10,16-05-2024 10.34,2024-05-16 10:47:07,24.27,29.0
20-03-2024 10.09,20-03-2024 10.34,2024-03-20 10:48:41,25.6,37.0
10-05-2024 12.09,10-05-2024 12.45,2024-05-10 13:01:13,36.34,54.0
12-08-2023 10.39,12-08-2023 10.54,2023-08-12 11:01:05,15.21,25.0
18-03-2024 14.03,18-03-2024 14.44,2024-03-18 14:55:07,41.9,71.0
07-11-2024 15.45,07-11-2024 15.46,2024-11-07 15:47:00,1.0,25.0
16-02-2023 14.25,16-02-2023 14.41,2023-02-16 14:52:26,16.13,37.0
18-01-2024 14.17,18-01-2024 14.49,2024-01-18 15:06:45,32.57,51.0
05-06-2024 14.08,05-06-2024 14.16,2024-06-05 14:27:51,8.58,25.0
21-09-2024 12.46,21-09-2024 12.51,2024-09-21 13:00:00,5.0,13.0
07-05-2024 11.29,07-05-2024 11.51,2024-05-07 11:53:51,22.23,15.0
16-01-2024 13.54,16-01-2024 14.18,2024-01-16 14:27:07,24.11,29.0
04-07-2023 14.49,04-07-2023 15.15,2023-07-04 15:28:13,26.49,71.0
23-09-2023 13.00,23-09-2023 13.01,2023-09-23 13:02:00,1.0,39.0
2024/04/03 09:41:00,03-04-2024 09.53,2024-04-03 10:06:03,12.15,10.0
10-02-2024 13.00,10-02-2024 13.01,2024-02-10 13:02:00,1.0,38.0
20-09-2023 09.10,20-09-2023 09.47,2023-09-20 09:57:36,37.31,44.0
16-05-2024 11.53,16-05-2024 12.18,2024-05-16 12:30:37,25.63,45.0
16-06-2023 13.55,16-06-2023 14.13,2023-06-16 14:23:30,18.05,32.0
28-10-2024 11.34,28-10-2024 12.04,2024-10-28 12:26:12,30.5,45.0
2024/09/30 10:19:00,30-09-2024 10.57,2024-09-30 11:13:00,38.45,34.0
2023/01/25 11:20:00,25-01-2023 11.46,2023-01-25 12:04:15,26.85,47.0
22-10-2024 10.31,22-10-2024 10.40,2024-10-22 10:43:47,9.94,11.0
15-03-2024 12.34,15-03-2024 13.00,2024-03-15 13:13:50,26.57,39.0
18-11-2024 14.55,18-11-2024 15.10,2024-11-18 15:19:23,15.29,19.0
19-09-2023 13.58,19-09-2023 14.30,2023-09-19 14:36:22,31.93,47.0
14-08-2023 13.54,14-08-2023 14.23,2023-08-14 14:41:47,29.31,34.0
13-12-2023 10.17,13-12-2023 10.26,2023-12-13 10:33:35,9.61,32.0
09-04-2024 12.16,09-04-2024 12.40,2024-04-09 12:52:22,24.71,45.0
23-10-2023 14.07,23-10-2023 14.38,2023-10-23 15:03:59,31.73,30.0
09-06-2023 12.31,09-06-2023 12.36,2023-06-09 12:42:45,5.16,40.0
04-05-2024 10.58,04-05-2024 11.10,2024-05-04 11:18:45,12.1,22.0
10-08-2023 10.15,10-08-2023 10.42,2023-08-10 10:57:17,27.94,31.0
28-03-2024 13.44,28-03-2024 14.03,2024-03-28 14:11:43,19.45,17.0
17-08-2024 10.25,17-08-2024 10.47,2024-08-17 10:53:51,22.28,29.0
16-02-2023 12.22,16-02-2023 12.40,2023-02-16 12:50:50,18.87,31.0
13-04-2024 13.00,13-04-2024 13.01,2024-04-13 13:02:00,1.0,25.0
15-07-2024 15.03,15-07-2024 15.29,2024-07-15 15:40:43,26.7,31.0
12-10-2023 13.08,12-10-2023 13.26,2023-10-12 13:38:08,18.83,34.0
23-01-2023 10.36,23-01-2023 11.12,2023-01-23 11:25:33,36.78,39.0
08-08-2023 09.41,08-08-2023 09.55,2023-08-08 09:57:57,14.78,26.0
10-01-2023 15.45,10-01-2023 15.46,2023-01-10 15:47:00,1.0,25.0
2024/02/01 12:17:00,01-02-2024 12.40,2024-02-01 12:45:44,23.84,40.0
03-10-2024 14.15,03-10-2024 14.25,2024-10-03 14:41:04,10.92,17.0
2024/10/14 11:18:00,14-10-2024 11.45,2024-10-14 11:52:38,27.36,64.0
05-12-2023 12.11,05-12-2023 12.29,2023-12-05 12:35:23,18.54,32.0
15-08-2024 15.11,15-08-2024 15.33,2024-08-15 15:38:10,22.6,25.0
09-07-2024 15.41,09-07-2024 15.44,2024-07-09 15:45:00,3.0,25.0
20-05-2023 9.03,20-05-2023 09.13,2023-05-20 09:19:07,10.08,6.0
26-07-2024 13.45,26-07-2024 13.57,2024-07-26 14:11:12,,25.0
10-10-2024 09.29,10-10-2024 09.52,2024-10-10 10:13:49,,
23-08-2023 12.32,23-08-2023 12.39,2023-08-23 12:47:58,7.67,40.0
10-10-2024 10.40,10-10-2024 10.54,2024-10-10 11:04:18,14.9,15.0
01-02-2024 14.01,01-02-2024 14.29,2024-02-01 14:48:20,28.65,40.0
18-11-2023 13.00,18-11-2023 13.01,2023-11-18 13:02:00,1.0,17.0
09-09-2023 13.00,09-09-2023 13.01,2023-09-09 13:02:00,1.0,20.0
,28-02-2024 15.30,2024-02-28 15:41:40,21.53,41.0
01-03-2024 11.55,01-03-2024 12.29,2024-03-01 12:32:52,34.0,48.0
15-08-2024 13.49,15-08-2024 13.56,2024-08-15 14:01:55,7.22,25.0
07-01-2023 12.40,07-01-2023 12.59,2023-01-07 13:00:00,18.2,27.0
29-10-2024 15.42,29-10-2024 15.44,2024-10-29 15:45:00,2.0,27.0
26-12-2023 09.07,26-12-2023 09.31,2023-12-26 09:41:06,24.38,36.0
11-05-2024 10.56,11-05-2024 11.13,2024-05-11 11:26:04,17.66,3.0
27-09-2023 14.34,27-09-2023 14.42,2023-09-27 15:00:34,8.34,0.0
03-04-2024 11.21,03-04-2024 11.47,2024-04-03 11:56:49,26.09,29.0
26-12-2023 10.31,26-12-2023 10.35,2023-12-26 10:41:53,4.98,32.0
26-04-2023 10.26,26-04-2023 10.57,2023-04-26 11:07:26,31.06,31.0
06-05-2024 13.40,06-05-2024 14.08,2024-05-06 14:11:37,28.72,47.0
2024/10/30 12:23:00,30-10-2024 12.42,2024-10-30 12:51:34,19.02,33.0
2023/10/28 13:00:00,28-10-2023 13.01,2023-10-28 13:02:00,1.0,38.0
16-04-2024 09.00,16-04-2024 09.22,2024-04-16 09:29:09,22.04,29.0
02-02-2023 12.19,02-02-2023 12.32,2023-02-02 12:41:53,13.18,31.0
01-02-2023 14.45,01-02-2023 15.06,2023-02-01 15:16:28,21.85,34.0
2023/09/05 14:12:00,05-09-2023 14.37,2023-09-05 14:51:16,25.3,31.0
31-01-2024 10.47,31-01-2024 11.02,2024-01-31 11:20:43,15.94,0.0
23-07-2024 09.00,23-07-2024 09.33,2024-07-23 09:38:58,33.82,52.0
01-03-2024 11.41,01-03-2024 12.06,2024-03-01 12:13:36,25.82,60.0
20-09-2024 09.39,20-09-2024 10.07,2024-09-20 10:10:58,28.6,53.0
14-05-2024 11.12,14-05-2024 11.41,2024-05-14 11:58:10,29.0,40.0
2024/02/07 09:22:00,07-02-2024 09.28,2024-02-07 09:32:54,6.1,13.0
2024/01/27 13:00:00,27-01-2024 13.01,2024-01-27 13:02:00,1.0,33.0
15-06-2023 10.09,15-06-2023 10.18,2023-06-15 10:20:16,9.82,21.0
03-04-2024 13.03,03-04-2024 13.30,2024-04-03 13:37:47,27.09,35.0
22-02-2023 14.38,22-02-2023 15.09,2023-02-22 15:31:09,31.14,51.0
14-04-2023 11.16,14-04-2023 11.39,2023-04-14 11:50:51,23.82,29.0
23-11-2024 12.55,23-11-2024 12.59,2024-11-23 13:00:00,4.0,22.0
01-03-2024 09.38,01-03-2024 09.59,2024-03-01 10:10:55,21.96,47.0
2023/11/29 13:44:00,29-11-2023 14.04,2023-11-29 14:16:50,20.45,26.0
2023/03/14 15:45:00,14-03-2023 15.46,2023-03-14 15:47:00,1.0,25.0
25-07-2023 10.30,25-07-2023 10.56,2023-07-25 11:06:51,26.24,58.0
27-02-2024 12.36,27-02-2024 12.59,2024-02-27 13:05:58,23.77,40.0
08-02-2023 14.10,08-02-2023 14.32,2023-02-08 14:36:11,22.02,27.0
09-09-2023 09.58,09-09-2023 10.22,2023-09-09 10:37:55,24.89,30.0
20-03-2023 09.32,20-03-2023 10.13,2023-03-20 10:22:55,41.42,44.0
19-06-2024 10.52,19-06-2024 11.18,2024-06-19 11:36:05,26.28,31.0
02-12-2024 12.13,02-12-2024 12.28,2024-12-02 12:33:33,15.19,23.0
2023/04/21 10:30:00,21-04-2023 10.58,2023-04-21 11:02:12,28.39,19.0
25-11-2023 12.30,25-11-2023 12.48,2023-11-25 12:57:09,18.81,26.0
20-01-2023 13.09,20-01-2023 13.30,2023-01-20 13:41:45,21.1,19.0
31-08-2023 10.38,31-08-2023 10.58,2023-08-31 11:05:16,20.48,37.0
2024/03/23 13:00:00,23-03-2024 13.01,2024-03-23 13:02:00,1.0,7.0
18-08-2023 12.20,18-08-2023 12.48,2023-08-18 13:02:25,28.38,28.0
21-08-2024 12.47,21-08-2024 12.54,2024-08-21 13:06:31,7.73,40.0
20-07-2023 12.34,20-07-2023 12.56,2023-07-20 13:07:12,22.48,46.0
22-05-2024 09.49,22-05-2024 10.10,2024-05-22 10:16:12,21.98,33.0
2023/03/07 13:55:00,07-03-2023 14.22,2023-03-07 14:39:12,27.2,52.0
02-12-2024 12.57,02-12-2024 13.13,2024-12-02 13:28:43,16.99,17.0
2023/12/21 09:12:00,21-12-2023 09.38,2023-12-21 09:50:17,26.38,63.0
30-11-2023 10.05,30-11-2023 10.19,2023-11-30 10:33:30,14.67,21.0
18-01-2023 13.50,18-01-2023 14.05,2023-01-18 14:22:36,15.65,28.0
27-07-2024 13.00,27-07-2024 13.01,2024-07-27 13:02:00,1.0,37.0
08-04-2023 12.17,08-04-2023 12.37,2023-04-08 12:46:04,20.15,18.0
19-06-2024 10.30,19-06-2024 10.48,2024-06-19 11:00:53,18.75,42.0
23-01-2024 10.50,23-01-2024 11.16,2024-01-23 11:28:13,26.67,166.0
26-08-2023 13.00,26-08-2023 13.01,2023-08-26 13:02:00,1.0,33.0
2024/08/03 10:48:00,03-08-2024 11.09,2024-08-03 11:16:28,21.42,30.0
2024/08/27 10:35:00,27-08-2024 10.47,2024-08-27 10:59:40,12.76,32.0
01-07-2024 13.09,01-07-2024 13.27,2024-07-01 13:36:14,18.37,33.0
05-04-2023 11.51,05-04-2023 12.12,2023-04-05 12:19:56,21.12,28.0
29-02-2024 10.03,29-02-2024 10.31,2024-02-29 10:35:06,28.71,48.0
29-12-2023 14.40,29-12-2023 15.10,2023-12-29 15:19:52,30.91,26.0
2024/04/26 15:28:00,26-04-2024 15.44,2024-04-26 15:45:00,16.0,43.0
,04-05-2024 11.06,2024-05-04 11:19:48,19.8,25.0
14-09-2023 10.40,14-09-2023 11.01,2023-09-14 11:11:47,21.19,40.0
26-09-2023 13.49,26-09-2023 14.10,2023-09-26 14:23:26,21.19,23.0
09-01-2023 14.31,09-01-2023 15.05,2023-01-09 15:08:48,34.27,47.0
21-10-2024 11.14,21-10-2024 11.29,2024-10-21 11:46:19,15.04,31.0
29-06-2023 14.36,29-06-2023 15.44,2023-06-29 15:45:00,68.0,48.0
07-02-2023 10.47,07-02-2023 11.06,2023-02-07 11:17:40,19.7,36.0
2024/01/09 10:47:00,09-01-2024 11.17,2024-01-09 11:27:47,30.06,166.0
2023/03/01 12:41:00,01-03-2023 12.45,2023-03-01 12:56:45,4.53,40.0
19-10-2024 12.23,19-10-2024 12.53,2024-10-19 13:00:00,30.6,31.0
02-10-2023 13.46,02-10-2023 14.04,2023-10-02 14:18:21,18.35,25.0
17-03-2023 11.37,17-03-2023 12.04,2023-03-17 12:19:58,600.0,36.0
16-06-2023 13.48,16-06-2023 14.05,2023-06-16 14:17:43,17.87,28.0
10-03-2023 14.47,10-03-2023 15.18,2023-03-10 15:33:50,31.12,42.0
2024/06/15 11:36:00,15-06-2024 12.07,2024-06-15 12:21:17,31.39,39.0
10-02-2024 10.59,10-02-2024 11.20,2024-02-10 11:30:30,21.44,51.0
13-04-2024 09.48,13-04-2024 10.00,2024-04-13 10:06:25,12.3,34.0
21-03-2024 12.30,21-03-2024 12.56,2024-03-21 13:01:00,26.08,40.0
20-11-2023 10.01,20-11-2023 10.10,2023-11-20 10:23:06,9.29,17.0
13-04-2023 13.41,13-04-2023 13.57,2023-04-13 14:10:39,16.75,25.0
12-11-2024 10.21,12-11-2024 10.41,2024-11-12 10:57:38,20.48,21.0
29-12-2023 14.01,29-12-2023 14.11,2023-12-29 14:19:04,10.71,146.0
13-01-2024 11.23,13-01-2024 11.48,2024-01-13 12:05:16,25.13,40.0
08-11-2024 14.46,08-11-2024 15.01,2024-11-08 15:11:01,15.09,42.0
01-06-2024 9.08,01-06-2024 09.36,2024-06-01 09:38:32,28.76,54.0
31-10-2024 14.56,31-10-2024 15.29,2024-10-31 15:39:23,33.18,220.0
03-11-2023 09.57,03-11-2023 10.25,2023-11-03 10:37:44,28.62,30.0
13-04-2024 11.14,13-04-2024 11.38,2024-04-13 11:51:15,24.97,17.0
2024/04/29 15:34:00,29-04-2024 15.44,2024-04-29 15:45:00,10.0,35.0
25-05-2024 10.01,25-05-2024 10.19,2024-05-25 10:29:22,18.93,32.0
21-05-2024 14.15,21-05-2024 14.27,2024-05-21 14:38:26,12.39,17.0
29-08-2023 10.53,29-08-2023 11.13,2023-08-29 11:23:19,20.59,32.0
14-02-2024 12.56,14-02-2024 13.23,2024-02-14 13:37:19,27.08,41.0
02-04-2024 10.59,02-04-2024 11.26,2024-04-02 11:36:40,27.48,30.0
12-05-2023 13.06,12-05-2023 13.28,2023-05-12 13:37:50,22.9,15.0
28-08-2024 10.11,28-08-2024 10.33,2024-08-28 10:40:59,22.22,21.0
01-04-2023 09.27,01-04-2023 09.46,2023-04-01 09:58:17,19.06,37.0
05-04-2023 13.44,05-04-2023 13.57,2023-04-05 14:10:03,13.58,32.0
19-04-2024 12.13,19-04-2024 12.27,2024-04-19 12:32:27,14.65,23.0
2024/10/15 11:09:00,15-10-2024 11.25,2024-10-15 11:33:59,16.99,32.0
08-08-2023 12.36,08-08-2023 12.43,2023-08-08 12:53:45,7.16,40.0
21-08-2023 10.27,21-08-2023 10.39,2023-08-21 10:54:26,12.98,32.0
24-02-2023 10.43,24-02-2023 10.44,2023-02-24 10:45:35,1.43,32.0
,26-08-2023 13.01,2023-08-26 13:02:00,1.0,33.0
22-05-2024 09.29,22-05-2024 09.46,2024-05-22 10:01:06,17.26,36.0
27-04-2024 10.23,27-04-2024 10.41,2024-04-27 10:53:49,18.48,20.0
05-02-2024 09.55,05-02-2024 12.03,2024-02-05 12:13:56,128.02,28.0
08-04-2023 12.06,08-04-2023 12.46,2023-04-08 12:50:01,40.49,44.0
28-09-2024 13.00,28-09-2024 13.01,2024-09-28 13:02:00,1.0,27.0
14-03-2024 10.11,14-03-2024 10.38,2024-03-14 10:49:30,27.15,25.0
26-09-2023 09.31,26-09-2023 09.51,2023-09-26 10:09:13,20.85,45.0
09-02-2024 10.14,09-02-2024 10.26,2024-02-09 10:37:54,12.81,22.0
16-08-2024 15.44,16-08-2024 15.44,2024-08-16 15:45:00,0.0,25.0
20-02-2023 14.50,20-02-2023 15.03,2023-02-20 15:12:39,13.96,12.0
2023/09/12 14:38:00,12-09-2023 14.58,2023-09-12 15:10:27,20.93,37.0
04-04-2023 12.49,04-04-2023 13.11,2023-04-04 13:26:55,22.31,17.0
21-11-2024 11.38,21-11-2024 12.05,2024-11-21 12:11:25,27.03,42.0
19-10-2023 09.35,19-10-2023 10.01,2023-10-19 10:12:25,26.09,47.0
16-02-2024 14.56,16-02-2024 15.21,2024-02-16 15:31:13,25.4,36.0
2023/06/01 14:04:00,01-06-2023 14.12,2023-06-01 14:27:33,8.38,20.0
06-09-2024 14.13,06-09-2024 14.31,2024-09-06 14:43:54,18.89,38.0
20-10-2023 12.27,20-10-2023 12.45,2023-10-20 12:52:42,18.02,33.0
16-01-2023 10.54,16-01-2023 11.16,2023-01-16 11:30:09,22.92,29.0
2023/08/05 10:24:00,05-08-2023 10.41,2023-08-05 10:53:30,17.57,32.0
30-08-2024 09.31,30-08-2024 09.52,2024-08-30 10:03:53,21.37,46.0
15-01-2024 10.44,15-01-2024 11.09,2024-01-15 11:17:08,25.1,56.0
10-10-2023 10.55,10-10-2023 11.15,2023-10-10 11:24:44,20.66,29.0
09-07-2024 13.14,09-07-2024 13.18,2024-07-09 13:26:40,4.88,6.0
02-06-2023 12.12,02-06-2023 12.42,2023-06-02 12:58:33,30.6,38.0
26-12-2023 14.17,26-12-2023 14.33,2023-12-26 14:55:12,16.77,17.0
30-08-2023 12.41,30-08-2023 13.00,2023-08-30 13:10:14,19.73,45.0
30-03-2023 09.46,30-03-2023 10.06,2023-03-30 10:19:01,20.66,38.0
18-03-2023 13.00,18-03-2023 13.01,2023-03-18 13:02:00,1.0,26.0
09-07-2024 13.52,09-07-2024 14.03,2024-07-09 14:17:07,11.6,25.0
16-04-2024 11.27,16-04-2024 11.46,2024-04-16 11:55:10,19.86,30.0
13-05-2024 09.18,13-05-2024 09.44,2024-05-13 09:55:50,26.73,21.0
13-04-2023 13.48,13-04-2023 14.06,2023-04-13 14:22:29,18.62,25.0
2023/03/16 15:42:00,16-03-2023 15.44,2023-03-16 15:45:00,2.0,25.0
29-04-2024 13.35,29-04-2024 13.57,2024-04-29 14:02:38,22.74,37.0
23-10-2023 14.12,23-10-2023 14.21,2023-10-23 14:30:39,9.89,14.0
2023/09/06 09:53:00,06-09-2023 10.12,2023-09-06 10:26:03,19.08,32.0
,15-09-2023 15.44,2023-09-15 15:45:00,7.0,35.0
15-01-2024 12.00,15-01-2024 12.22,2024-01-15 12:26:32,22.45,31.0
07-09-2023 11.00,07-09-2023 11.22,2023-09-07 11:34:31,22.17,24.0
04-10-2023 10.52,04-10-2023 11.04,2023-10-04 11:05:18,12.31,37.0
14-01-2023 12.47,14-01-2023 12.59,2023-01-14 13:00:00,12.0,40.0
09-10-2024 09.45,09-10-2024 10.02,2024-10-09 10:14:06,17.58,19.0
06-05-2023 12.34,06-05-2023 12.41,2023-05-06 12:47:35,7.76,40.0
30-09-2024 09.18,30-09-2024 09.54,2024-09-30 09:57:57,36.53,55.0
2024/05/03 10:31:00,03-05-2024 10.48,2024-05-03 11:06:30,17.44,0.0
14-06-2024 15.16,14-06-2024 15.44,2024-06-14 15:45:00,28.23,34.0
28-08-2023 10.44,28-08-2023 11.07,2023-08-28 11:18:35,23.95,40.0
2023/08/03 13:22:00,03-08-2023 13.38,2023-08-03 13:46:17,16.69,17.0
30-08-2023 14.29,30-08-2023 14.49,2023-08-30 15:06:57,20.02,27.0
2023/06/14 14:36:00,14-06-2023 14.54,2023-06-14 15:10:18,18.18,36.0
01-11-2024 11.28,01-11-2024 12.01,2024-11-01 12:09:43,33.25,59.0
29-06-2024 10.53,29-06-2024 11.16,2024-06-29 11:26:07,23.57,215.0
08-04-2024 10.30,08-04-2024 10.55,2024-04-08 11:09:47,25.07,31.0
05-07-2023 14.22,05-07-2023 14.52,2023-07-05 15:07:06,30.4,51.0
01-07-2024 12.20,01-07-2024 12.40,2024-07-01 12:53:34,20.91,31.0
2023/02/17 15:05:00,17-02-2023 15.33,2023-02-17 15:42:31,28.27,25.0
2023/02/18 13:00:00,18-02-2023 13.01,2023-02-18 13:02:00,1.0,32.0
01-03-2024 15.45,01-03-2024 15.46,2024-03-01 15:47:00,1.0,25.0
22-02-2024 14.00,22-02-2024 14.22,2024-02-22 14:39:38,22.49,32.0
10-06-2023 09.57,10-06-2023 10.15,2023-06-10 10:22:25,18.7,28.0
2024/01/09 14:44:00,09-01-2024 15.02,2024-01-09 15:11:26,18.39,37.0
06-01-2024 13.00,06-01-2024 13.01,2024-01-06 13:02:00,1.0,22.0
2023/10/14 13:00:00,14-10-2023 13.01,2023-10-14 13:02:00,1.0,26.0
29-07-2024 14.51,29-07-2024 15.19,2024-07-29 15:24:54,28.7,42.0
29-09-2023 12.01,29-09-2023 12.18,2023-09-29 12:28:40,17.7,34.0
23-05-2023 12.35,23-05-2023 13.01,2023-05-23 13:10:30,26.79,0.0
23-10-2024 12.06,23-10-2024 12.24,2024-10-23 12:37:05,18.35,25.0
05-05-2023 10.20,05-05-2023 10.42,2023-05-05 10:54:08,22.57,58.0
2023/12/15 10:12:00,15-12-2023 10.26,2023-12-15 10:38:00,14.78,22.0
26-08-2024 11.24,26-08-2024 11.45,2024-08-26 12:03:37,21.14,28.0
14-03-2023 12.19,14-03-2023 12.36,2023-03-14 12:46:28,17.16,40.0
10-09-2024 13.34,10-09-2024 13.47,2024-09-10 13:54:50,13.06,12.0
10-08-2023 13.45,10-08-2023 13.57,2023-08-10 14:09:01,12.28,25.0
09-02-2023 10.14,09-02-2023 10.37,2023-02-09 10:39:25,23.14,22.0
2024/10/26 13:00:00,26-10-2024 13.01,2024-10-26 13:02:00,1.0,53.0
2023/03/22 10:28:00,22-03-2023 10.52,2023-03-22 11:05:09,24.2,34.0
15-07-2024 12.01,15-07-2024 12.20,2024-07-15 12:31:13,19.65,25.0
27-01-2023 13.15,27-01-2023 13.36,2023-01-27 13:45:51,21.1,50.0
15-04-2023 13.00,15-04-2023 13.01,2023-04-15 13:02:00,1.0,55.0
2023/04/07 11:33:00,07-04-2023 11.48,2023-04-07 11:58:28,15.66,47.0
29-09-2023 11.37,29-09-2023 11.53,2023-09-29 12:02:07,16.24,23.0
11-04-2023 11.58,11-04-2023 12.16,2023-04-11 12:31:04,18.85,28.0
2023/01/13 13:28:00,13-01-2023 13.40,2023-01-13 13:51:05,12.1,18.0
2023/02/15 09:24:00,15-02-2023 09.40,2023-02-15 09:48:40,16.44,20.0
08-12-2023 14.29,08-12-2023 14.52,2023-12-08 15:07:57,23.49,26.0
20-02-2024 15.45,20-02-2024 15.46,2024-02-20 15:47:00,1.0,25.0
11-02-2023 13.00,11-02-2023 13.01,2023-02-11 13:02:00,1.0,32.0
,20-09-2023 14.13,2023-09-20 14:22:26,5.66,17.0
19-12-2023 15.42,19-12-2023 15.44,2023-12-19 15:45:00,2.0,25.0
23-01-2023 15.45,23-01-2023 15.46,2023-01-23 15:47:00,1.0,25.0
20-02-2023 12.09,20-02-2023 12.39,2023-02-20 12:51:09,30.61,29.0
20-02-2023 11.33,20-02-2023 11.59,2023-02-20 12:15:49,26.88,42.0
19-10-2023 11.41,19-10-2023 12.05,2023-10-19 12:14:28,24.64,28.0
28-09-2023 09.03,28-09-2023 09.33,2023-09-28 09:44:53,30.5,21.0
17-01-2023 11.33,17-01-2023 12.02,2023-01-17 12:12:30,29.58,59.0
2023/04/05 11:53:00,05-04-2023 12.18,2023-04-05 12:34:15,24.67,36.0
30-11-2023 14.38,30-11-2023 14.53,2023-11-30 15:04:24,15.13,19.0
2023/05/06 10:39:00,06-05-2023 10.45,2023-05-06 10:59:43,6.93,32.0
01-09-2023 11.26,01-09-2023 11.38,2023-09-01 11:49:16,12.54,13.0
24-11-2023 12.00,24-11-2023 12.15,2023-11-24 12:25:38,15.19,20.0
2023/09/15 13:41:00,15-09-2023 14.05,2023-09-15 14:23:12,24.94,43.0
09-08-2024 15.32,09-08-2024 15.41,2024-08-09 15:45:00,9.31,4.0
16-06-2023 11.57,16-06-2023 12.22,2023-06-16 12:31:18,25.48,22.0
02-11-2024 13.00,02-11-2024 13.01,2024-11-02 13:02:00,1.0,32.0
25-02-2023 12.18,25-02-2023 12.43,2023-02-25 12:50:45,25.16,33.0
11-01-2023 14.25,11-01-2023 14.39,2023-01-11 14:53:54,15.0,15.0
22-07-2023 10.44,22-07-2023 11.03,2023-07-22 11:18:22,19.3,25.0
05-12-2023 15.00,05-12-2023 15.01,2023-12-05 15:14:51,1.0,7.0
22-10-2024 10.05,22-10-2024 10.28,2024-10-22 10:36:54,23.77,37.0
09-07-2024 12.39,09-07-2024 12.49,2024-07-09 13:00:54,10.24,14.0
01-07-2023 10.44,01-07-2023 11.06,2023-07-01 11:15:14,22.16,42.0
30-09-2023 12.39,30-09-2023 12.59,2023-09-30 13:00:00,20.0,20.0
01-06-2024 11.42,01-06-2024 12.09,2024-06-01 12:25:37,27.14,22.0
06-06-2023 10.09,06-06-2023 10.31,2023-06-06 10:45:45,22.57,33.0
08-05-2024 10.37,08-05-2024 11.01,2024-05-08 11:10:25,200.0,30.0
24-01-2024 12.19,24-01-2024 12.31,2024-01-24 12:42:04,12.66,40.0
21-11-2024 15.19,21-11-2024 15.23,2024-11-21 15:32:57,4.32,32.0
03-11-2023 15.35,03-11-2023 15.37,2023-11-03 15:41:15,2.95,25.0
28-05-2024 14.36,28-05-2024 14.43,2024-05-28 14:55:35,7.29,16.0
2023/04/13 12:46:00,13-04-2023 12.59,2023-04-13 13:15:11,13.58,40.0
2024/06/01 13:00:00,01-06-2024 13.01,2024-06-01 13:02:00,1.0,38.0
26-04-2023 09.19,26-04-2023 09.44,2023-04-26 09:59:21,25.08,37.0
10-04-2024 09.47,10-04-2024 10.07,2024-04-10 10:18:10,20.73,22.0
23-11-2023 11.57,23-11-2023 12.13,2023-11-23 12:35:25,15.88,26.0
2023/09/16 13:00:00,16-09-2023 13.01,2023-09-16 13:02:00,1.0,25.0
2023/11/06 13:12:00,06-11-2023 13.26,2023-11-06 13:36:04,13.43,14.0
02-05-2024 12.17,02-05-2024 12.42,2024-05-02 13:01:22,25.31,30.0
15-05-2023 13.58,15-05-2023 14.07,2023-05-15 14:16:02,9.22,25.0
08-08-2024 09.42,08-08-2024 10.03,2024-08-08 10:19:11,21.29,31.0
2023/10/18 09:24:00,18-10-2023 09.54,2023-10-18 10:09:03,30.59,35.0
2024/05/07 10:28:00,07-05-2024 10.30,2024-05-07 10:38:07,2.26,32.0
19-02-2024 12.03,19-02-2024 12.22,2024-02-19 12:37:27,19.17,33.0
03-10-2024 11.33,03-10-2024 12.02,2024-10-03 12:19:31,29.19,45.0
16-08-2023 09.39,16-08-2023 09.52,2023-08-16 10:10:01,13.81,45.0
29-07-2024 09.38,29-07-2024 10.05,2024-07-29 10:06:39,27.29,53.0
2024/07/26 10:26:00,26-07-2024 10.30,2024-07-26 10:38:10,4.35,32.0
13-01-2024 10.22,13-01-2024 10.50,2024-01-13 10:58:37,28.83,51.0
07-02-2023 11.52,07-02-2023 12.12,2023-02-07 12:19:15,20.14,15.0
24-03-2023 10.56,24-03-2023 11.13,2023-03-24 11:24:19,17.56,41.0
16-10-2023 15.13,16-10-2023 15.38,2023-10-16 15:45:00,24.93,38.0
2024/08/29 12:20:00,29-08-2024 12.40,2024-08-29 12:47:47,19.47,43.0
23-06-2023 10.49,23-06-2023 11.00,2023-06-23 11:09:16,11.7,19.0
2024/01/16 10:41:00,16-01-2024 10.54,2024-01-16 11:06:24,13.14,32.0
14-03-2023 10.53,14-03-2023 11.22,2023-03-14 11:31:53,29.09,56.0
26-09-2023 11.14,26-09-2023 11.37,2023-09-26 11:41:58,23.98,41.0
04-08-2023 12.09,04-08-2023 12.37,2023-08-04 12:49:59,28.21,30.0
27-01-2023 12.44,27-01-2023 13.14,2023-01-27 13:36:42,30.79,40.0
28-11-2024 15.09,28-11-2024 15.24,2024-11-28 15:43:31,15.4,20.0
12-01-2024 12.58,12-01-2024 13.32,2024-01-12 13:37:51,34.8,36.0
14-11-2023 11.06,14-11-2023 11.39,2023-11-14 11:53:27,33.53,32.0
20-12-2023 11.46,20-12-2023 12.09,2023-12-20 12:25:05,23.0,23.0
04-03-2023 12.37,04-03-2023 12.47,2023-03-04 13:00:00,10.75,40.0
24-01-2024 11.47,24-01-2024 12.06,2024-01-24 12:16:34,,24.0
2023/06/12 09:41:00,12-06-2023 10.03,2023-06-12 10:14:59,22.24,47.0
2023/12/07 10:30:00,07-12-2023 10.44,2023-12-07 10:52:42,14.01,14.0
06-04-2024 10.26,06-04-2024 10.46,2024-04-06 10:57:29,20.51,55.0
02-07-2024 13.03,02-07-2024 13.31,2024-07-02 13:42:23,28.32,36.0
11-06-2024 12.23,11-06-2024 12.53,2024-06-11 13:04:50,30.69,30.0
2023/02/03 12:33:00,03-02-2023 12.55,2023-02-03 13:05:21,22.74,59.0
01-04-2023 12.44,01-04-2023 12.59,2023-04-01 13:00:00,15.0,41.0
12-02-2024 11.49,12-02-2024 12.08,2024-02-12 12:18:47,19.91,11.0
13-11-2023 09.02,13-11-2023 09.24,2023-11-13 09:31:57,22.2,31.0
2023/10/14 10:01:00,14-10-2023 10.16,2023-10-14 10:35:27,15.91,26.0
08-07-2023 10.02,08-07-2023 10.38,2023-07-08 10:49:42,36.09,31.0
07-03-2024 14.16,07-03-2024 14.35,2024-03-07 14:45:17,19.56,31.0
21-05-2024 14.14,21-05-2024 14.37,2024-05-21 14:55:16,23.77,40.0
17-03-2023 11.44,17-03-2023 12.07,2023-03-17 12:12:33,23.81,24.0
2024/09/04 12:20:00,04-09-2024 12.40,2024-09-04 12:43:19,20.34,31.0
04-12-2023 14.05,04-12-2023 14.41,2023-12-04 14:48:51,36.93,37.0
23-01-2024 13.45,23-01-2024 13.57,2024-01-23 14:14:53,12.68,25.0
05-04-2023 14.40,05-04-2023 15.12,2023-04-05 15:25:58,32.36,42.0
10-07-2023 12.47,10-07-2023 13.06,2023-07-10 13:09:16,19.11,20.0
16-08-2023 12.32,16-08-2023 12.49,2023-08-16 12:54:45,17.5,40.0
22-08-2023 10.00,22-08-2023 10.21,2023-08-22 10:39:22,21.94,30.0
2023/09/13 15:45:00,13-09-2023 15.46,2023-09-13 15:47:00,1.0,25.0
02-05-2023 09.07,02-05-2023 09.17,2023-05-02 09:21:56,10.34,6.0
07-08-2023 11.24,07-08-2023 11.44,2023-08-07 11:56:29,20.12,11.0
13-09-2023 10.57,13-09-2023 11.13,2023-09-13 11:21:57,16.48,22.0
20-11-2023 12.05,20-11-2023 12.29,2023-11-20 12:30:00,24.01,31.0
04-06-2024 15.09,04-06-2024 15.35,2024-06-04 15:41:30,26.38,49.0
14-06-2024 11.07,14-06-2024 11.32,2024-06-14 11:49:11,25.08,31.0
03-08-2024 13.00,03-08-2024 13.01,2024-08-03 13:02:00,1.0,23.0
02-11-2023 10.37,02-11-2023 11.07,2023-11-02 11:08:53,30.83,19.0
15-06-2024 10.20,15-06-2024 10.22,2024-06-15 10:26:44,2.9,12.0
14-08-2023 11.01,14-08-2023 11.20,2023-08-14 11:33:22,18.64,31.0
23-08-2024 10.29,23-08-2024 10.55,2024-08-23 11:10:07,26.23,40.0
13-10-2023 12.48,13-10-2023 13.09,2023-10-13 13:25:21,21.1,40.0
2023/12/23 13:00:00,23-12-2023 13.01,2023-12-23 13:02:00,1.0,28.0
01-10-2024 09.57,01-10-2024 10.16,2024-10-01 10:22:18,19.73,15.0
18-06-2024 11.20,18-06-2024 11.51,2024-06-18 11:58:07,31.1,38.0
09-04-2024 13.00,09-04-2024 13.18,2024-04-09 13:28:39,18.79,36.0
25-10-2024 10.12,25-10-2024 10.34,2024-10-25 10:44:38,22.78,200.0
15-03-2023 12.07,15-03-2023 12.34,2023-03-15 12:42:23,27.74,41.0
05-07-2023 09.20,05-07-2023 09.47,2023-07-05 09:56:03,27.57,32.0
08-07-2023 13.00,08-07-2023 13.01,2023-07-08 13:02:00,1.0,28.0
10-06-2023 12.51,10-06-2023 12.59,2023-06-10 13:00:00,8.0,31.0
29-03-2023 14.45,29-03-2023 15.00,2023-03-29 15:19:32,15.86,14.0
21-03-2024 14.21,21-03-2024 14.45,2024-03-21 14:55:57,24.74,26.0
08-08-2024 10.29,08-08-2024 10.52,2024-08-08 11:04:58,23.93,
08-04-2023 12.29,08-04-2023 12.50,2023-04-08 13:00:00,21.57,31.0
2023/05/10 13:07:00,10-05-2023 13.37,2023-05-10 13:47:52,30.65,57.0
,09-09-2023 13.01,2023-09-09 13:02:00,1.0,25.0
07-11-2023 10.40,07-11-2023 10.58,2023-11-07 11:05:12,18.78,25.0
10-01-2024 13.39,10-01-2024 13.51,2024-01-10 14:02:09,12.3,43.0
18-02-2023 12.08,18-02-2023 12.28,2023-02-18 12:38:13,20.34,29.0
27-09-2023 15.14,27-09-2023 15.39,2023-09-27 15:45:00,25.31,23.0
2024/07/24 15:02:00,24-07-2024 15.26,2024-07-24 15:37:59,24.32,34.0
20-02-2023 14.05,20-02-2023 14.17,2023-02-20 14:29:45,12.62,25.0
23-09-2024 10.10,23-09-2024 10.27,2024-09-23 10:32:19,17.31,34.0
2024/01/12 12:28:00,12-01-2024 12.53,2024-01-12 13:03:59,25.72,37.0
08-12-2023 12.00,08-12-2023 12.13,2023-12-08 12:22:20,13.29,32.0
30-09-2024 10.04,30-09-2024 10.07,2024-09-30 10:17:24,3.13,22.0
22-05-2023 09.34,22-05-2023 10.00,2023-05-22 10:14:47,26.14,39.0
01-08-2023 11.33,01-08-2023 11.34,2023-08-01 11:38:15,1.0,2.0
24-09-2024 13.00,24-09-2024 13.40,2024-09-24 13:46:29,,19.0
28-05-2024 13.29,28-05-2024 13.42,2024-05-28 13:44:55,13.63,33.0
24-05-2023 09.40,24-05-2023 10.02,2023-05-24 10:04:33,22.71,53.0
04-08-2023 14.39,04-08-2023 14.51,2023-08-04 15:05:29,12.96,15.0
02-02-2024 11.47,02-02-2024 12.08,2024-02-02 12:27:58,20.18,26.0
02-01-2024 10.50,02-01-2024 11.11,2024-01-02 11:22:15,21.6,42.0
29-08-2023 13.51,29-08-2023 14.19,2023-08-29 14:54:53,28.32,36.0
23-07-2024 13.48,23-07-2024 14.15,2024-07-23 14:29:06,27.73,36.0
11-11-2023 10.02,11-11-2023 10.27,2023-11-11 10:36:48,25.43,37.0
2024/11/12 12:30:00,12-11-2024 12.41,2024-11-12 12:51:53,11.03,40.0
22-10-2024 10.52,22-10-2024 11.14,2024-10-22 11:25:31,22.94,50.0
08-03-2023 15.27,08-03-2023 15.40,2023-03-08 15:45:00,13.08,25.0
09-01-2023 10.43,09-01-2023 11.07,2023-01-09 11:19:00,24.87,37.0
,13-02-2023 12.13,2023-02-13 12:20:23,18.14,26.0
15-08-2024 11.21,15-08-2024 11.41,2024-08-15 11:58:00,,16.0
23-01-2023 11.05,23-01-2023 11.23,2023-01-23 11:30:03,18.94,171.0
2023/05/05 10:53:00,05-05-2023 11.10,2023-05-05 11:22:18,17.69,42.0
25-08-2023 12.29,25-08-2023 12.35,2023-08-25 12:41:03,6.26,40.0
30-10-2023 13.04,30-10-2023 13.21,2023-10-30 13:31:44,17.93,0.0
2024/10/19 11:59:00,19-10-2024 12.13,2024-10-19 12:28:16,14.02,6.0
27-02-2024 10.09,27-02-2024 10.24,2024-02-27 10:34:01,15.76,27.0
2023/03/25 09:49:00,25-03-2023 10.05,2023-03-25 10:26:05,16.58,19.0
09-11-2023 10.34,09-11-2023 10.50,2023-11-09 11:00:48,16.3,18.0
,20-08-2024 12.11,2024-08-20 12:24:37,15.07,7.0
15-03-2024 11.56,15-03-2024 12.22,2024-03-15 12:29:18,26.28,41.0
2023/11/04 13:00:00,04-11-2023 13.01,2023-11-04 13:02:00,1.0,48.0
11-12-2023 14.21,11-12-2023 14.41,2023-12-11 14:50:46,20.54,32.0
28-08-2023 12.46,28-08-2023 12.53,2023-08-28 13:01:46,7.78,40.0
20-08-2024 15.36,20-08-2024 15.44,2024-08-20 15:45:00,8.0,13.0
26-01-2024 13.37,26-01-2024 13.49,2024-01-26 13:59:28,12.6,25.0
13-02-2024 11.23,13-02-2024 11.50,2024-02-13 12:00:33,27.44,42.0
03-09-2024 11.15,03-09-2024 11.47,2024-09-03 11:55:47,32.17,39.0
05-06-2024 10.44,05-06-2024 11.07,2024-06-05 11:18:21,22.15,
21-03-2024 13.03,21-03-2024 13.17,2024-03-21 13:29:56,14.01,23.0
04-07-2024 14.19,04-07-2024 14.35,2024-07-04 14:48:01,16.22,41.0
20-11-2024 11.08,20-11-2024 11.35,2024-11-20 11:45:32,27.54,51.0
24-09-2024 13.45,24-09-2024 14.05,2024-09-24 14:44:41,20.0,31.0
24-01-2024 12.27,24-01-2024 12.35,2024-01-24 12:47:27,8.59,40.0
29-05-2023 12.04,29-05-2023 12.27,2023-05-29 12:36:01,23.55,18.0
03-06-2024 14.06,03-06-2024 14.19,2024-06-03 14:33:02,13.29,17.0
26-07-2023 11.05,26-07-2023 11.32,2023-07-26 11:42:44,27.33,34.0
15-02-2024 15.45,15-02-2024 15.46,2024-02-15 15:47:00,1.0,41.0
26-01-2024 11.04,26-01-2024 11.29,2024-01-26 11:39:36,25.61,215.0
19-06-2024 13.54,19-06-2024 13.59,2024-06-19 14:05:18,5.67,25.0
2023/10/16 13:38:00,16-10-2023 14.13,2023-10-16 14:19:18,35.03,46.0
2023/06/01 14:49:00,01-06-2023 15.19,2023-06-01 15:22:57,30.01,58.0
08-12-2023 11.34,08-12-2023 11.51,2023-12-08 11:58:28,17.53,60.0
2024/08/19 14:13:00,19-08-2024 14.47,2024-08-19 15:03:27,34.29,51.0
2023/09/28 12:45:00,28-09-2023 12.58,2023-09-28 13:07:55,13.13,14.0
17-11-2023 14.44,17-11-2023 15.12,2023-11-17 15:26:23,29.0,31.0
22-07-2024 13.49,22-07-2024 14.06,2024-07-22 14:24:25,17.32,25.0
03-05-2024 12.27,03-05-2024 12.43,2024-05-03 12:58:08,16.92,40.0
08-03-2024 12.39,08-03-2024 12.52,2024-03-08 13:06:39,13.37,40.0
16-06-2023 15.45,16-06-2023 15.46,2023-06-16 15:47:00,1.0,25.0
29-08-2023 11.19,29-08-2023 11.35,2023-08-29 11:50:16,16.29,22.0
12-08-2023 11.03,12-08-2023 11.23,2023-08-12 11:39:21,20.64,
2023/01/30 12:22:00,30-01-2023 12.50,2023-01-30 13:01:08,28.23,33.0
,15-11-2024 14.02,2024-11-15 14:08:39,19.18,27.0
16-12-2023 10.31,16-12-2023 10.39,2023-12-16 10:51:00,8.95,32.0
11-11-2023 13.00,11-11-2023 13.01,2023-11-11 13:02:00,1.0,26.0
09-06-2023 10.04,09-06-2023 10.24,2023-06-09 10:33:50,20.8,34.0
01-08-2023 10.08,01-08-2023 10.43,2023-08-01 10:57:14,35.9,34.0
2024/06/14 11:02:00,14-06-2024 11.27,2024-06-14 11:39:37,25.83,30.0
29-11-2024 13.57,29-11-2024 14.09,2024-11-29 14:21:34,12.97,25.0
20-11-2023 13.07,20-11-2023 13.29,2023-11-20 13:38:50,22.04,20.0
25-05-2023 10.15,25-05-2023 10.42,2023-05-25 11:04:23,27.88,153.0
16-11-2024 11.06,16-11-2024 11.25,2024-11-16 11:42:08,19.7,40.0
08-10-2024 10.30,08-10-2024 10.41,2024-10-08 10:52:22,11.27,32.0
2023/04/12 13:47:00,12-04-2023 14.08,2023-04-12 14:14:30,21.09,32.0
,30-08-2024 09.58,2024-08-30 10:10:44,21.74,38.0
,01-09-2023 11.10,2023-09-01 11:23:04,26.67,32.0
27-09-2023 10.50,27-09-2023 11.00,2023-09-27 11:14:53,10.64,33.0
08-08-2024 13.29,08-08-2024 13.46,2024-08-08 13:57:40,17.25,200.0
18-07-2023 13.21,18-07-2023 13.36,2023-07-18 13:48:09,15.23,34.0
08-08-2024 09.50,08-08-2024 10.08,2024-08-08 10:21:00,18.63,800.0
19-07-2024 13.17,19-07-2024 13.31,2024-07-19 13:41:50,14.24,28.0
04-11-2024 10.33,04-11-2024 10.34,2024-11-04 10:35:39,1.05,32.0
21-03-2023 11.30,21-03-2023 11.46,2023-03-21 12:02:16,16.32,31.0
17-08-2023 09.08,17-08-2023 09.26,2023-08-17 09:38:00,18.49,23.0
2024/07/29 10:29:00,29-07-2024 10.42,2024-07-29 10:56:24,13.56,32.0
23-04-2024 14.40,23-04-2024 15.09,2024-04-23 15:16:13,29.16,44.0
25-11-2023 11.50,25-11-2023 12.16,2023-11-25 12:24:19,26.88,32.0
21-06-2023 12.44,21-06-2023 13.19,2023-06-21 13:29:08,35.83,44.0
05-04-2023 14.04,05-04-2023 14.21,2023-04-05 14:39:57,17.96,25.0
09-05-2024 12.39,09-05-2024 12.43,2024-05-09 12:55:30,4.55,40.0
19-08-2024 12.49,19-08-2024 13.08,2024-08-19 13:19:11,19.4,35.0
12-07-2024 10.23,12-07-2024 10.29,2024-07-12 10:36:10,6.36,32.0
24-02-2023 13.43,24-02-2023 14.11,2023-02-24 14:20:53,28.35,38.0
27-05-2024 12.46,27-05-2024 13.03,2024-05-27 13:12:58,16.51,24.0
22-10-2024 10.54,22-10-2024 11.23,2024-10-22 11:36:54,29.59,30.0
13-09-2023 10.17,13-09-2023 10.47,2023-09-13 10:56:58,30.39,39.0
07-06-2024 13.58,07-06-2024 14.13,2024-06-07 14:23:16,15.43,32.0
11-01-2024 09.25,11-01-2024 09.40,2024-01-11 09:49:45,15.67,26.0
18-10-2024 11.20,18-10-2024 11.47,2024-10-18 12:07:05,27.14,45.0
15-01-2024 15.31,15-01-2024 15.32,2024-01-15 15:35:56,1.0,25.0
2023/12/11 12:21:00,11-12-2023 12.47,2023-12-11 12:59:00,26.86,37.0
23-04-2024 11.50,23-04-2024 12.15,2024-04-23 12:32:16,25.41,14.0
24-02-2023 11.37,24-02-2023 12.03,2023-02-24 12:10:09,26.55,41.0
27-06-2024 09.48,27-06-2024 10.05,2024-06-27 10:20:31,17.1,45.0
18-06-2024 10.55,18-06-2024 11.22,2024-06-18 11:25:25,27.09,19.0
06-09-2023 12.51,06-09-2023 13.09,2023-09-06 13:23:28,18.77,30.0
2023/06/17 10:13:00,17-06-2023 10.35,2023-06-17 10:52:16,22.8,32.0
08-11-2024 10.40,08-11-2024 10.59,2024-11-08 11:12:29,19.47,55.0
25-05-2023 12.48,25-05-2023 12.57,2023-05-25 13:09:46,9.85,40.0
25-03-2024 10.35,25-03-2024 10.41,2024-03-25 10:47:24,6.6,32.0
11-09-2023 14.53,11-09-2023 15.21,2023-09-11 15:33:54,,46.0
2023/12/04 12:02:00,04-12-2023 12.26,2023-12-04 12:35:42,24.04,33.0
09-09-2023 12.00,09-09-2023 12.24,2023-09-09 12:32:15,24.08,45.0
08-01-2024 13.18,08-01-2024 13.35,2024-01-08 13:49:16,17.27,42.0
13-11-2024 12.02,13-11-2024 12.35,2024-11-13 12:47:33,33.25,25.0
01-08-2024 11.16,01-08-2024 11.32,2024-08-01 11:43:40,16.31,17.0
20-08-2024 11.50,20-08-2024 12.23,2024-08-20 12:30:41,33.59,42.0
03-07-2023 11.07,03-07-2023 11.38,2023-07-03 11:56:18,31.42,40.0
29-11-2024 14.31,29-11-2024 14.53,2024-11-29 15:09:37,22.55,18.0
03-08-2024 13.00,03-08-2024 13.01,2024-08-03 13:02:00,1.0,25.0
13-05-2023 11.42,13-05-2023 11.55,2023-05-13 12:01:29,13.64,
17-05-2024 10.47,17-05-2024 11.10,2024-05-17 11:27:04,23.77,55.0
13-11-2023 14.12,13-11-2023 14.27,2023-11-13 14:41:40,15.9,17.0
2024/10/23 13:52:00,23-10-2024 14.11,2024-10-23 14:20:59,19.16,26.0
17-10-2024 14.46,17-10-2024 15.10,2024-10-17 15:18:30,24.32,33.0
01-05-2023 12.14,01-05-2023 12.35,2023-05-01 12:41:04,21.26,33.0
2023/12/23 13:00:00,23-12-2023 13.01,2023-12-23 13:02:00,1.0,42.0
12-09-2024 10.53,12-09-2024 11.09,2024-09-12 11:19:52,16.31,24.0
16-09-2023 13.00,16-09-2023 13.01,2023-09-16 13:02:00,1.0,25.0
30-07-2024 10.47,30-07-2024 11.18,2024-07-30 11:21:52,31.9,62.0
15-01-2024 10.05,15-01-2024 10.24,2024-01-15 10:37:53,19.93,31.0
12-12-2023 11.22,12-12-2023 11.40,2023-12-12 11:47:41,18.49,30.0
2023/09/04 10:05:00,04-09-2023 10.22,2023-09-04 10:29:42,17.77,32.0
10-07-2024 10.32,10-07-2024 11.03,2024-07-10 11:13:08,30.84,40.0
02-05-2024 12.41,02-05-2024 13.04,2024-05-02 13:12:42,23.51,36.0
14-06-2023 14.42,14-06-2023 15.09,2023-06-14 15:22:08,27.95,18.0
31-05-2023 09.10,31-05-2023 09.17,2023-05-31 09:25:36,7.93,13.0
11-01-2024 12.25,11-01-2024 12.49,2024-01-11 12:59:49,24.23,30.0
09-09-2024 12.47,09-09-2024 13.03,2024-09-09 13:13:47,16.38,35.0
13-06-2023 13.34,13-06-2023 13.56,2023-06-13 14:05:52,22.44,36.0
15-06-2023 13.57,15-06-2023 14.20,2023-06-15 14:24:22,23.41,36.0
16-08-2024 09.19,16-08-2024 09.40,2024-08-16 09:51:15,21.11,37.0
21-07-2023 10.46,21-07-2023 11.03,2023-07-21 11:20:40,17.37,16.0
19-07-2023 09.26,19-07-2023 09.44,2023-07-19 09:56:32,18.05,23.0
01-06-2024 10.11,01-06-2024 10.41,2024-06-01 10:54:06,29.75,40.0
05-10-2024 13.00,05-10-2024 13.01,2024-10-05 13:02:00,1.0,35.0
16-09-2023 09.42,16-09-2023 10.13,2023-09-16 10:18:54,,29.0
24-06-2024 12.26,24-06-2024 12.40,2024-06-24 12:50:46,14.84,31.0
10-04-2023 14.26,10-04-2023 14.52,2023-04-10 15:03:12,26.76,26.0
20-03-2024 12.46,20-03-2024 13.07,2024-03-20 13:20:04,21.4,19.0
01-11-2024 11.48,01-11-2024 12.21,2024-11-01 12:37:10,33.3,54.0
19-09-2024 11.37,19-09-2024 11.59,2024-09-19 12:10:35,22.24,40.0
07-02-2023 10.06,07-02-2023 10.16,2023-02-07 10:28:33,10.93,10.0
19-01-2023 11.55,19-01-2023 12.14,2023-01-19 12:31:17,19.84,29.0
11-12-2023 12.12,11-12-2023 12.35,2023-12-11 12:40:37,23.24,33.0
2024/02/19 14:43:00,19-02-2024 14.55,2024-02-19 15:05:41,12.27,32.0
2023/11/10 14:57:00,10-11-2023 15.05,2023-11-10 15:19:26,8.33,27.0
07-05-2024 09.06,07-05-2024 09.25,2024-05-07 09:37:35,19.66,34.0
16-08-2024 09.43,16-08-2024 10.00,2024-08-16 10:09:37,,34.0
09-02-2023 13.20,09-02-2023 13.40,2023-02-09 13:50:22,20.74,20.0
2024/07/02 12:19:00,02-07-2024 12.41,2024-07-02 12:51:21,22.37,30.0
26-06-2024 10.52,26-06-2024 11.15,2024-06-26 11:27:15,23.99,50.0
26-03-2024 13.55,26-03-2024 14.19,2024-03-26 14:21:45,24.83,36.0
23-11-2023 10.21,23-11-2023 10.27,2023-11-23 10:39:57,6.91,5.0
25-07-2024 10.52,25-07-2024 11.12,2024-07-25 11:21:33,20.17,31.0
17-03-2023 14.59,17-03-2023 15.19,2023-03-17 15:30:09,20.3,37.0
31-05-2024 12.35,31-05-2024 12.53,2024-05-31 13:07:13,18.01,31.0
10-01-2023 10.33,10-01-2023 11.02,2023-01-10 11:15:02,29.33,32.0
19-09-2023 09.56,19-09-2023 10.17,2023-09-19 10:34:42,21.68,30.0
2023/03/16 13:59:00,16-03-2023 14.28,2023-03-16 14:34:06,29.54,38.0
01-02-2024 12.28,01-02-2024 12.59,2024-02-01 13:13:08,31.29,38.0
16-12-2023 10.44,16-12-2023 10.57,2023-12-16 11:09:02,13.6,32.0
16-02-2023 10.50,16-02-2023 11.10,2023-02-16 11:24:28,20.45,31.0
30-11-2024 11.09,30-11-2024 11.33,2024-11-30 11:43:52,24.12,
2024/01/09 13:32:00,09-01-2024 13.53,2024-01-09 14:01:07,21.1,28.0
29-09-2023 13.58,29-09-2023 14.07,2023-09-29 14:17:20,9.96,17.0
27-01-2023 13.49,27-01-2023 14.10,2023-01-27 14:21:31,21.45,37.0
2024/02/03 09:43:00,03-02-2024 10.17,2024-02-03 10:23:53,34.45,29.0
08-04-2023 10.05,08-04-2023 10.38,2023-04-08 10:53:40,33.04,36.0
30-09-2023 13.00,30-09-2023 13.01,2023-09-30 13:02:00,1.0,30.0
06-04-2023 11.24,06-04-2023 11.45,2023-04-06 11:56:36,21.93,50.0
24-01-2024 13.37,24-01-2024 13.52,2024-01-24 13:56:44,15.05,33.0
17-01-2023 15.45,17-01-2023 15.46,2023-01-17 15:47:00,1.0,25.0
13-10-2023 10.17,13-10-2023 10.22,2023-10-13 10:29:23,5.61,32.0
2023/12/12 10:22:00,12-12-2023 10.44,2023-12-12 10:52:07,22.38,28.0
07-11-2023 10.39,07-11-2023 11.10,2023-11-07 11:19:23,31.57,39.0
2024/07/29 14:52:00,29-07-2024 15.18,2024-07-29 15:31:31,26.56,31.0
29-05-2023 11.37,29-05-2023 11.54,2023-05-29 12:10:28,17.25,31.0
26-06-2024 10.56,26-06-2024 11.17,2024-06-26 11:19:00,21.06,19.0
2024/01/08 15:04:00,08-01-2024 15.14,2024-01-08 15:33:59,10.89,21.0
04-12-2023 14.11,04-12-2023 14.30,2023-12-04 14:38:31,18.91,32.0
07-10-2024 13.23,07-10-2024 13.44,2024-10-07 13:56:11,20.96,20.0
05-12-2023 11.37,05-12-2023 11.59,2023-12-05 12:12:56,21.88,30.0
25-12-2023 13.42,25-12-2023 14.08,2023-12-25 14:18:15,26.65,33.0
2023/05/31 12:03:00,31-05-2023 12.18,2023-05-31 12:30:05,15.23,23.0
22-12-2023 11.05,22-12-2023 11.32,2023-12-22 11:44:17,27.51,41.0
28-06-2024 15.32,28-06-2024 15.36,2024-06-28 15:45:00,4.45,4.0
18-03-2023 12.25,18-03-2023 12.52,2023-03-18 13:00:00,27.14,23.0
01-01-2024 13.57,01-01-2024 14.20,2024-01-01 14:27:36,23.63,29.0
04-02-2023 13.00,04-02-2023 13.01,2023-02-04 13:02:00,1.0,16.0
14-03-2024 11.08,14-03-2024 11.34,2024-03-14 11:44:23,26.5,51.0
15-08-2023 12.06,15-08-2023 12.37,2023-08-15 12:50:32,31.78,40.0
13-01-2024 11.54,13-01-2024 12.11,2024-01-13 12:22:03,17.62,34.0
05-06-2023 10.01,05-06-2023 10.27,2023-06-05 10:43:47,26.06,33.0
08-05-2023 12.50,08-05-2023 13.19,2023-05-08 13:28:31,29.23,32.0
13-06-2023 09.14,13-06-2023 09.36,2023-06-13 09:47:09,22.37,26.0
14-10-2024 09.14,14-10-2024 09.40,2024-10-14 09:53:28,26.77,28.0
18-03-2023 13.00,18-03-2023 13.01,2023-03-18 13:02:00,1.0,47.0
12-06-2023 13.50,12-06-2023 14.22,2023-06-12 14:42:36,32.47,30.0
21-08-2024 13.04,21-08-2024 13.18,2024-08-21 13:29:43,14.0,32.0
02-02-2024 11.22,02-02-2024 11.53,2024-02-02 12:06:32,31.33,56.0
2023/09/08 12:18:00,08-09-2023 12.45,2023-09-08 12:57:38,27.23,30.0
21-08-2023 09.57,21-08-2023 10.21,2023-08-21 10:38:18,23.32,10.0
17-05-2023 11.00,17-05-2023 11.29,2023-05-17 11:44:39,28.98,34.0
2024/02/01 09:40:00,01-02-2024 10.10,2024-02-01 10:22:02,30.41,32.0
30-08-2024 09.08,30-08-2024 09.27,2024-08-30 09:42:50,19.66,24.0
2023/02/09 09:19:00,09-02-2023 09.44,2023-02-09 09:54:07,25.14,39.0
01-07-2024 13.57,01-07-2024 14.17,2024-07-01 14:32:10,20.68,17.0
12-11-2024 9.27,12-11-2024 09.54,2024-11-12 10:03:30,27.82,33.0
07-07-2023 11.19,07-07-2023 11.48,2023-07-07 11:54:31,29.84,55.0
23-09-2024 09.41,23-09-2024 10.09,2024-09-23 10:18:06,28.03,28.0
01-04-2023 09.23,01-04-2023 09.50,2023-04-01 10:02:41,27.68,63.0
22-07-2023 11.03,22-07-2023 11.34,2023-07-22 11:44:47,31.98,28.0
03-07-2023 11.42,03-07-2023 12.10,2023-07-03 12:26:09,27.9,36.0
2023/12/26 09:09:00,26-12-2023 09.41,2023-12-26 09:56:39,32.49,49.0
13-06-2024 12.24,13-06-2024 12.34,2024-06-13 12:45:40,9.29,31.0
20-01-2024 13.00,20-01-2024 13.01,2024-01-20 13:02:00,1.0,27.0
2024/07/05 14:03:00,05-07-2024 14.16,2024-07-05 14:30:18,13.28,25.0
23-11-2023 15.17,23-11-2023 15.44,2023-11-23 15:45:00,27.0,39.0
23-08-2023 13.48,23-08-2023 14.14,2023-08-23 14:19:13,26.66,27.0
26-01-2024 15.12,26-01-2024 15.31,2024-01-26 15:38:39,19.8,23.0
05-09-2024 11.12,05-09-2024 11.36,2024-09-05 11:51:57,24.69,24.0
06-03-2023 10.24,06-03-2023 10.47,2023-03-06 10:56:43,,40.0
11-10-2024 09.00,11-10-2024 09.20,2024-10-11 09:35:07,20.51,33.0
25-02-2023 11.59,25-02-2023 12.14,2023-02-25 12:22:54,15.1,29.0
05-01-2024 09.46,05-01-2024 10.03,2024-01-05 10:15:15,17.68,31.0
18-08-2023 10.16,18-08-2023 10.27,2023-08-18 10:36:16,11.05,800.0
16-01-2024 13.00,16-01-2024 13.20,2024-01-16 13:28:17,20.48,43.0
30-08-2024 13.47,30-08-2024 14.05,2024-08-30 14:17:10,18.81,32.0
28-12-2023 15.13,28-12-2023 15.29,2023-12-28 15:44:43,16.86,20.0
25-08-2023 12.11,25-08-2023 12.34,2023-08-25 12:53:55,23.7,14.0
19-12-2023 10.01,19-12-2023 10.15,2023-12-19 10:19:54,14.09,34.0
28-06-2024 12.30,28-06-2024 12.54,2024-06-28 13:03:38,24.18,41.0
01-09-2023 09.00,01-09-2023 09.04,2023-09-01 09:13:58,4.87,13.0
2023/03/30 14:06:00,30-03-2023 14.24,2023-03-30 14:35:02,18.25,32.0
13-02-2024 12.14,13-02-2024 12.33,2024-02-13 12:41:55,19.65,23.0
,20-03-2024 11.57,2024-03-20 12:04:32,28.91,55.0
09-03-2023 11.02,09-03-2023 11.28,2023-03-09 11:41:33,26.98,24.0
29-04-2023 11.10,29-04-2023 11.35,2023-04-29 11:46:53,25.58,25.0
30-01-2023 10.47,30-01-2023 11.17,2023-01-30 11:24:54,30.56,43.0
2023/08/24 11:48:00,24-08-2023 12.11,2023-08-24 12:26:52,23.09,34.0
2023/05/06 13:00:00,06-05-2023 13.01,2023-05-06 13:02:00,1.0,35.0
2023/08/18 12:56:00,18-08-2023 13.11,2023-08-18 13:12:19,15.32,40.0
27-11-2024 11.18,27-11-2024 11.45,2024-11-27 11:55:27,27.02,42.0
02-05-2023 11.22,02-05-2023 11.55,2023-05-02 12:12:31,33.3,45.0
08-12-2023 12.45,08-12-2023 12.51,2023-12-08 13:02:41,6.62,13.0
08-05-2023 13.27,08-05-2023 13.46,2023-05-08 13:56:49,19.52,32.0
16-10-2024 09.19,16-10-2024 09.46,2024-10-16 09:50:37,27.07,191.0
10-02-2023 10.06,10-02-2023 10.37,2023-02-10 10:44:47,31.83,45.0
11-06-2024 12.45,11-06-2024 13.09,2024-06-11 13:16:11,24.26,15.0
2024/04/18 10:38:00,18-04-2024 10.52,2024-04-18 11:07:48,14.9,32.0
18-10-2024 11.29,18-10-2024 12.03,2024-10-18 12:08:04,34.38,
29-08-2024 12.01,29-08-2024 12.21,2024-08-29 12:41:43,20.95,20.0
2023/10/30 15:27:00,30-10-2023 15.44,2023-10-30 15:45:00,17.0,30.0
23-10-2023 10.47,23-10-2023 11.03,2023-10-23 11:11:51,16.67,20.0
23-05-2023 10.05,23-05-2023 10.23,2023-05-23 10:34:44,18.03,40.0
20-09-2024 12.02,20-09-2024 12.33,2024-09-20 12:44:57,31.95,35.0
30-05-2023 14.14,30-05-2023 14.35,2023-05-30 14:36:53,21.46,26.0
01-07-2023 13.00,01-07-2023 13.01,2023-07-01 13:02:00,1.0,58.0
24-03-2023 12.02,24-03-2023 12.28,2023-03-24 12:35:25,26.17,29.0
23-02-2024 10.04,23-02-2024 10.29,2024-02-23 10:38:41,25.53,45.0
04-03-2024 12.50,04-03-2024 13.28,2024-03-04 13:43:17,38.33,54.0
25-04-2024 14.42,25-04-2024 15.10,2024-04-25 15:12:43,28.88,47.0
07-05-2024 10.42,07-05-2024 11.02,2024-05-07 11:12:52,20.26,31.0
30-03-2023 10.23,30-03-2023 10.37,2023-03-30 10:45:51,14.77,18.0
04-02-2023 10.32,04-02-2023 10.59,2023-02-04 11:11:37,27.63,39.0
09-04-2024 11.52,09-04-2024 12.16,2024-04-09 12:26:56,24.95,31.0
21-02-2024 12.17,21-02-2024 12.46,2024-02-21 12:56:56,29.37,30.0
25-07-2023 9.29,25-07-2023 09.50,2023-07-25 10:03:00,21.63,26.0
31-08-2024 13.00,31-08-2024 13.01,2024-08-31 13:02:00,1.0,14.0
13-01-2024 13.00,13-01-2024 13.01,2024-01-13 13:02:00,1.0,17.0
01-03-2024 10.43,01-03-2024 10.55,2024-03-01 11:04:46,12.05,32.0
11-12-2023 13.05,11-12-2023 13.27,2023-12-11 13:40:18,22.89,41.0
03-02-2024 12.45,03-02-2024 12.59,2024-02-03 13:00:00,13.2,27.0
15-08-2023 10.02,15-08-2023 10.20,2023-08-15 10:31:46,18.14,30.0
28-07-2023 11.57,28-07-2023 12.18,2023-07-28 12:23:38,21.03,41.0
24-06-2023 13.00,24-06-2023 13.01,2023-06-24 13:02:00,1.0,29.0
,27-08-2024 12.16,2024-08-27 12:26:01,22.4,28.0
16-08-2023 13.41,16-08-2023 14.08,2023-08-16 14:20:32,27.93,50.0
04-04-2023 09.03,04-04-2023 09.22,2023-04-04 09:43:51,19.87,30.0
28-11-2024 14.05,28-11-2024 14.22,2024-11-28 14:33:35,17.04,25.0
21-11-2024 13.26,21-11-2024 13.49,2024-11-21 13:53:51,23.62,37.0
18-09-2023 10.00,18-09-2023 10.22,2023-09-18 10:31:36,22.17,40.0
2023/03/27 10:34:00,27-03-2023 10.53,2023-03-27 11:03:54,19.08,13.0
2023/09/20 09:00:00,20-09-2023 09.19,2023-09-20 09:30:42,19.83,32.0
2023/07/07 09:10:00,07-07-2023 09.31,2023-07-07 09:56:09,21.6,30.0
04-04-2024 12.16,04-04-2024 12.43,2024-04-04 12:52:24,27.53,37.0
30-08-2023 11.30,30-08-2023 11.46,2023-08-30 12:04:31,15.92,26.0
13-12-2023 15.45,13-12-2023 15.46,2023-12-13 15:47:00,1.0,57.0
13-06-2024 12.52,13-06-2024 13.15,2024-06-13 13:25:54,23.15,22.0
04-06-2024 10.36,04-06-2024 10.50,2024-06-04 10:54:21,14.58,27.0
03-08-2023 10.57,03-08-2023 11.35,2023-08-03 11:41:35,38.23,64.0
06-12-2023 13.21,06-12-2023 13.44,2023-12-06 13:52:26,23.9,32.0
10-08-2024 10.22,10-08-2024 10.35,2024-08-10 10:44:42,13.63,15.0
2023/11/06 10:00:00,06-11-2023 10.12,2023-11-06 10:23:55,12.25,10.0
07-03-2024 09.45,07-03-2024 10.17,2024-03-07 10:20:08,32.34,47.0
10-04-2024 14.57,10-04-2024 14.59,2024-04-10 15:14:22,2.58,7.0
26-10-2024 13.00,26-10-2024 13.01,2024-10-26 13:02:00,1.0,28.0
15-01-2024 09.16,15-01-2024 09.47,2024-01-15 09:54:30,31.01,32.0
2023/04/26 11:06:00,26-04-2023 11.17,2023-04-26 11:39:22,11.94,0.0
08-02-2024 12.48,08-02-2024 13.00,2024-02-08 13:10:19,12.47,40.0
2023/08/28 10:46:00,28-08-2023 10.48,2023-08-28 10:53:47,2.72,32.0
30-09-2024 15.23,30-09-2024 15.44,2024-09-30 15:45:00,21.0,25.0
17-11-2023 15.45,17-11-2023 15.46,2023-11-17 15:47:00,1.0,50.0
09-09-2024 10.26,09-09-2024 10.40,2024-09-09 10:51:55,14.61,24.0
01-11-2024 14.49,01-11-2024 15.12,2024-11-01 15:24:17,23.78,27.0
01-09-2023 13.10,01-09-2023 13.26,2023-09-01 13:35:40,16.41,33.0
04-03-2023 13.00,04-03-2023 13.01,2023-03-04 13:02:00,1.0,17.0
2024/05/23 14:47:00,23-05-2024 15.03,2024-05-23 15:15:21,16.7,23.0
23-05-2024 13.37,23-05-2024 13.42,2024-05-23 13:49:30,5.03,20.0
2024/08/30 12:03:00,30-08-2024 12.29,2024-08-30 12:38:13,26.88,47.0
10-08-2023 11.40,10-08-2023 11.55,2023-08-10 12:07:48,15.86,23.0
2024/08/07 12:33:00,07-08-2024 13.00,2024-08-07 13:17:16,27.19,41.0
08-04-2023 12.33,08-04-2023 12.52,2023-04-08 12:57:16,19.57,143.0
18-09-2024 12.25,18-09-2024 12.39,2024-09-18 12:50:34,14.69,40.0
03-08-2024 09.06,03-08-2024 09.22,2024-08-03 09:33:59,17.0,26.0
17-04-2024 13.40,17-04-2024 14.02,2024-04-17 14:13:49,22.9,23.0
2024/11/12 10:55:00,12-11-2024 11.19,2024-11-12 11:30:51,24.73,29.0
01-06-2024 12.42,01-06-2024 12.56,2024-06-01 13:00:00,14.68,40.0
10-01-2023 14.55,10-01-2023 15.09,2023-01-10 15:28:27,14.99,20.0
21-02-2024 14.24,21-02-2024 14.42,2024-02-21 14:46:47,18.64,26.0
23-05-2023 12.59,23-05-2023 13.24,2023-05-23 13:29:12,25.09,23.0
31-08-2024 13.00,31-08-2024 13.01,2024-08-31 13:02:00,1.0,
08-10-2024 13.14,08-10-2024 13.30,2024-10-08 13:33:37,16.28,40.0
30-03-2023 15.45,30-03-2023 15.46,2023-03-30 15:47:00,1.0,25.0
15-04-2023 13.00,15-04-2023 13.01,2023-04-15 13:02:00,1.0,28.0
23-05-2023 10.20,23-05-2023 10.41,2023-05-23 10:55:42,21.29,21.0
2024/04/22 11:03:00,22-04-2024 11.25,2024-04-22 11:37:19,22.35,35.0
29-07-2023 12.31,29-07-2023 12.41,2023-07-29 12:45:56,10.67,40.0
22-11-2023 12.21,22-11-2023 12.45,2023-11-22 12:54:50,24.2,29.0
13-04-2024 09.34,13-04-2024 09.54,2024-04-13 10:06:28,20.76,46.0
01-10-2024 11.50,01-10-2024 12.08,2024-10-01 12:15:34,19.0,32.0
19-12-2023 12.02,19-12-2023 12.23,2023-12-19 12:27:24,21.63,31.0
14-02-2023 09.31,14-02-2023 10.05,2023-02-14 10:19:16,34.45,40.0
16-07-2024 13.18,16-07-2024 13.40,2024-07-16 13:56:21,22.24,27.0
11-05-2023 12.47,11-05-2023 12.52,2023-05-11 12:58:25,5.48,40.0
02-07-2024 14.51,02-07-2024 15.20,2024-07-02 15:31:45,29.34,71.0
2024/11/20 10:22:00,20-11-2024 10.53,2024-11-20 11:00:29,31.97,44.0
12-05-2023 11.29,12-05-2023 11.55,2023-05-12 12:10:26,26.55,28.0
09-02-2024 10.25,09-02-2024 10.44,2024-02-09 11:00:25,19.04,21.0
16-12-2023 11.49,16-12-2023 12.05,2023-12-16 12:14:11,16.75,28.0
01-01-2024 13.41,01-01-2024 13.49,2024-01-01 13:58:46,8.62,43.0
22-01-2024 10.25,22-01-2024 10.26,2024-01-22 10:27:00,1.0,32.0
29-06-2023 14.48,29-06-2023 15.12,2023-06-29 15:23:18,24.26,33.0
13-11-2024 12.04,13-11-2024 12.32,2024-11-13 12:40:47,28.22,31.0
13-02-2023 13.47,13-02-2023 14.13,2023-02-13 14:28:05,26.2,27.0
17-06-2023 13.00,17-06-2023 13.01,2023-06-17 13:02:00,1.0,43.0
2024/06/28 10:24:00,28-06-2024 10.53,2024-06-28 11:09:04,,36.0
04-10-2023 10.07,04-10-2023 10.24,2023-10-04 10:42:31,16.8,47.0
24-01-2024 13.34,24-01-2024 13.54,2024-01-24 14:04:12,20.36,28.0
25-01-2024 09.45,25-01-2024 11.53,2024-01-25 12:05:27,128.84,28.0
2024/02/05 11:55:00,05-02-2024 12.11,2024-02-05 12:24:22,16.76,38.0
22-11-2023 12.12,22-11-2023 12.34,2023-11-22 12:52:35,22.91,32.0
20-05-2023 10.12,20-05-2023 10.30,2023-05-20 10:33:39,18.33,18.0
15-11-2024 12.31,15-11-2024 12.52,2024-11-15 13:13:49,21.99,40.0
27-01-2023 09.58,27-01-2023 10.12,2023-01-27 10:24:27,14.55,16.0
04-06-2024 14.10,04-06-2024 14.20,2024-06-04 14:35:19,10.3,25.0
2023/11/01 13:46:00,01-11-2023 14.15,2023-11-01 14:28:54,29.81,54.0
17-08-2024 11.36,17-08-2024 11.53,2024-08-17 12:12:42,17.23,21.0
29-11-2024 15.45,29-11-2024 15.46,2024-11-29 15:47:00,1.0,25.0
09-03-2024 09.00,09-03-2024 09.26,2024-03-09 09:29:07,26.12,25.0
2023/11/11 09:26:00,11-11-2023 09.56,2023-11-11 09:57:24,30.13,47.0
2023/03/24 11:22:00,24-03-2023 11.39,2023-03-24 11:50:53,17.36,37.0
29-03-2023 10.02,29-03-2023 10.19,2023-03-29 10:28:35,17.98,45.0
29-12-2023 11.22,29-12-2023 11.35,2023-12-29 11:49:24,13.85,22.0
27-12-2023 15.45,27-12-2023 15.46,2023-12-27 15:47:00,1.0,25.0
26-01-2023 12.41,26-01-2023 13.11,2023-01-26 13:22:46,30.03,31.0
2023/09/22 09:35:00,22-09-2023 09.55,2023-09-22 10:07:43,20.26,31.0
28-08-2024 10.55,28-08-2024 11.24,2024-08-28 11:33:05,29.21,50.0
23-06-2023 09.15,23-06-2023 09.35,2023-06-23 09:46:22,19.42,25.0
03-06-2024 14.20,03-06-2024 14.36,2024-06-03 14:49:29,16.41,41.0
23-08-2024 15.45,23-08-2024 15.46,2024-08-23 15:47:00,1.0,50.0
2023/04/26 15:01:00,26-04-2023 15.24,2023-04-26 15:33:20,23.8,31.0
23-02-2023 13.47,23-02-2023 14.13,2023-02-23 14:47:58,26.46,36.0
01-08-2023 15.37,01-08-2023 15.44,2023-08-01 15:45:00,7.0,25.0
07-09-2024 12.01,07-09-2024 12.10,2024-09-07 12:21:37,9.97,32.0
2024/01/18 12:34:00,18-01-2024 12.52,2024-01-18 13:05:08,17.49,24.0
16-09-2024 09.31,16-09-2024 09.46,2024-09-16 09:58:17,15.94,20.0
2023/03/24 09:38:00,24-03-2023 09.55,2023-03-24 10:03:47,17.31,34.0
18-01-2024 14.20,18-01-2024 14.28,2024-01-18 14:38:22,8.62,17.0
06-06-2023 12.43,06-06-2023 13.03,2023-06-06 13:17:36,20.51,
09-10-2023 10.38,09-10-2023 10.55,2023-10-09 11:02:55,17.54,25.0
12-09-2024 12.10,12-09-2024 12.35,2024-09-12 12:45:51,25.68,32.0
13-12-2023 15.45,13-12-2023 15.46,2023-12-13 15:47:00,1.0,25.0
19-09-2024 10.20,19-09-2024 10.38,2024-09-19 10:50:11,18.47,20.0
01-12-2023 15.30,01-12-2023 15.38,2023-12-01 15:45:00,8.7,25.0
25-03-2023 10.13,25-03-2023 10.40,2023-03-25 10:52:31,27.99,30.0
29-06-2023 15.40,29-06-2023 15.44,2023-06-29 15:45:00,4.0,25.0
30-10-2024 14.01,30-10-2024 14.49,2024-10-30 15:01:47,48.99,71.0
01-04-2024 12.19,01-04-2024 12.29,2024-04-01 12:39:08,10.3,40.0
06-06-2024 12.58,06-06-2024 13.19,2024-06-06 13:36:13,21.4,41.0
2023/02/18 13:00:00,18-02-2023 13.01,2023-02-18 13:02:00,1.0,25.0
2024/08/19 10:01:00,19-08-2024 10.14,2024-08-19 10:26:35,13.09,22.0
27-09-2023 12.43,27-09-2023 13.07,2023-09-27 13:19:07,24.29,37.0
18-01-2024 11.39,18-01-2024 11.59,2024-01-18 12:07:26,20.61,24.0
17-11-2023 11.00,17-11-2023 11.14,2023-11-17 11:25:50,14.43,24.0
08-04-2023 13.00,08-04-2023 13.01,2023-04-08 13:02:00,1.0,26.0
2023/11/23 12:55:00,23-11-2023 13.09,2023-11-23 13:24:00,14.61,17.0
19-04-2024 13.05,19-04-2024 13.25,2024-04-19 13:34:11,20.16,33.0
28-03-2023 14.58,28-03-2023 15.11,2023-03-28 15:31:39,13.71,20.0
29-07-2023 10.46,29-07-2023 11.01,2023-07-29 11:15:05,15.43,32.0
17-10-2024 11.10,17-10-2024 11.34,2024-10-17 11:45:23,24.12,24.0
2024/03/16 09:10:00,16-03-2024 09.24,2024-03-16 09:35:09,14.7,18.0
19-10-2023 11.38,19-10-2023 12.01,2023-10-19 12:06:57,23.22,30.0
28-02-2024 12.31,28-02-2024 12.58,2024-02-28 13:07:32,27.96,43.0
18-10-2024 15.19,18-10-2024 15.44,2024-10-18 15:45:00,25.0,43.0
2024/10/21 13:48:00,21-10-2024 14.10,2024-10-21 14:22:48,22.81,15.0
13-07-2024 10.33,13-07-2024 10.43,2024-07-13 10:54:30,10.53,32.0
2023/02/20 12:04:00,20-02-2023 12.21,2023-02-20 12:33:38,17.96,40.0
2024/03/05 14:14:00,05-03-2024 14.35,2024-03-05 14:39:29,20.64,32.0
27-06-2024 14.00,27-06-2024 14.22,2024-06-27 14:32:01,22.55,44.0
2024/07/17 13:45:00,17-07-2024 14.08,2024-07-17 14:19:35,23.7,7.0
13-05-2024 12.20,13-05-2024 12.41,2024-05-13 12:55:49,21.78,30.0
27-03-2024 10.02,27-03-2024 10.12,2024-03-27 10:26:08,10.31,21.0
14-04-2023 09.30,14-04-2023 09.47,2023-04-14 10:01:31,17.63,23.0
04-05-2024 13.00,04-05-2024 13.01,2024-05-04 13:02:00,1.0,32.0
01-02-2024 10.56,01-02-2024 11.23,2024-02-01 11:33:10,27.94,30.0
21-04-2023 09.35,21-04-2023 09.47,2023-04-21 09:53:34,12.61,5.0
24-04-2024 10.32,24-04-2024 10.58,2024-04-24 11:14:10,26.84,29.0
17-01-2024 14.08,17-01-2024 14.23,2024-01-17 14:37:57,15.95,0.0
14-06-2024 14.40,14-06-2024 15.00,2024-06-14 15:14:03,200.0,29.0
24-03-2023 12.39,24-03-2023 12.42,2023-03-24 12:54:20,3.88,40.0
08-04-2023 12.32,08-04-2023 12.59,2023-04-08 13:00:00,27.11,36.0
2023/10/02 13:58:00,02-10-2023 14.08,2023-10-02 14:21:46,10.32,25.0
2024/02/08 13:12:00,08-02-2024 13.27,2024-02-08 13:32:33,15.67,
07-02-2024 13.59,07-02-2024 14.07,2024-02-07 14:17:09,8.98,171.0
15-07-2024 11.59,15-07-2024 12.24,2024-07-15 12:32:58,25.29,30.0
,21-06-2024 11.05,2024-06-21 11:10:52,33.11,44.0
27-07-2024 13.00,27-07-2024 13.01,2024-07-27 13:02:00,1.0,25.0
01-08-2023 10.23,01-08-2023 11.00,2023-08-01 11:11:43,37.75,50.0
22-04-2024 14.27,22-04-2024 14.41,2024-04-22 14:52:28,14.94,33.0
09-11-2024 13.00,09-11-2024 13.01,2024-11-09 13:02:00,1.0,8.0
21-06-2024 12.00,21-06-2024 12.20,2024-06-21 12:32:15,20.54,29.0
31-08-2024 13.00,31-08-2024 13.01,2024-08-31 13:02:00,1.0,17.0
14-04-2023 12.19,14-04-2023 12.36,2023-04-14 12:50:18,17.5,40.0
16-03-2024 12.51,16-03-2024 12.59,2024-03-16 13:00:00,8.0,33.0
2024/06/07 09:52:00,07-06-2024 10.03,2024-06-07 10:20:22,11.43,24.0
25-01-2024 13.00,25-01-2024 13.15,2024-01-25 13:27:15,15.53,27.0
07-03-2023 10.48,07-03-2023 11.07,2023-03-07 11:16:12,,16.0
25-10-2023 11.02,25-10-2023 11.37,2023-10-25 11:49:10,35.16,30.0
08-08-2024 15.32,08-08-2024 15.44,2024-08-08 15:45:00,12.0,47.0
16-05-2024 12.48,16-05-2024 12.52,2024-05-16 12:57:16,4.34,40.0
01-10-2024 13.47,01-10-2024 14.22,2024-10-01 14:36:14,35.17,40.0
03-10-2023 13.54,03-10-2023 14.31,2023-10-03 14:38:24,37.58,46.0
24-07-2023 09.48,24-07-2023 09.54,2023-07-24 10:06:49,6.72,10.0
25-09-2024 14.28,25-09-2024 14.46,2024-09-25 14:50:47,18.25,31.0
20-02-2023 09.00,20-02-2023 09.33,2023-02-20 09:39:51,33.63,56.0
26-03-2024 09.37,26-03-2024 09.50,2024-03-26 10:04:59,,0.0
31-05-2023 11.59,31-05-2023 12.09,2023-05-31 12:23:05,10.8,32.0
2023/07/15 12:07:00,15-07-2023 12.28,2023-07-15 12:31:49,21.56,38.0
04-07-2023 09.18,04-07-2023 09.41,2023-07-04 10:00:33,23.49,44.0
07-10-2024 09.49,07-10-2024 10.10,2024-10-07 10:20:41,21.48,31.0
2023/11/08 12:49:00,08-11-2023 13.13,2023-11-08 13:22:46,24.2,36.0
07-11-2023 09.49,07-11-2023 10.12,2023-11-07 10:23:13,23.88,47.0
04-12-2023 11.29,04-12-2023 11.47,2023-12-04 11:55:01,18.91,32.0
24-04-2023 12.35,24-04-2023 12.42,2023-04-24 12:46:35,7.52,26.0
09-10-2023 10.45,09-10-2023 11.11,2023-10-09 11:22:16,26.67,32.0
13-08-2024 14.13,13-08-2024 14.33,2024-08-13 14:40:41,20.29,32.0
2024/10/17 09:17:00,17-10-2024 09.51,2024-10-17 10:05:30,,40.0
2023/09/26 10:24:00,26-09-2023 10.50,2023-09-26 11:00:20,26.47,30.0
05-10-2023 14.30,05-10-2023 14.45,2023-10-05 15:02:41,15.44,17.0
10-09-2024 11.07,10-09-2024 11.30,2024-09-10 11:43:52,23.86,25.0
30-12-2023 13.00,30-12-2023 13.01,2023-12-30 13:02:00,1.0,42.0
11-05-2023 10.19,11-05-2023 10.46,2023-05-11 10:58:23,27.85,41.0
19-03-2024 10.59,19-03-2024 11.24,2024-03-19 11:35:22,25.85,31.0
25-04-2024 12.47,25-04-2024 12.51,2024-04-25 12:57:04,4.77,40.0
16-11-2024 11.37,16-11-2024 11.56,2024-11-16 12:05:29,19.95,11.0
21-12-2023 15.36,21-12-2023 15.44,2023-12-21 15:45:00,8.34,25.0
19-01-2024 14.49,19-01-2024 15.05,2024-01-19 15:11:22,16.79,22.0
20-09-2023 09.25,20-09-2023 09.54,2023-09-20 10:12:03,29.09,56.0
02-03-2023 09.23,02-03-2023 09.41,2023-03-02 09:48:18,18.52,29.0
2024/04/25 12:12:00,25-04-2024 12.31,2024-04-25 12:40:58,19.09,15.0
20-03-2023 13.20,20-03-2023 13.33,2023-03-20 13:39:35,13.71,
12-06-2024 09.30,12-06-2024 09.56,2024-06-12 10:03:32,26.77,63.0
28-02-2024 10.44,28-02-2024 10.53,2024-02-28 10:58:57,9.22,32.0
29-01-2024 10.31,29-01-2024 10.32,2024-01-29 10:33:00,1.0,32.0
2024/08/09 14:43:00,09-08-2024 15.14,2024-08-09 15:18:09,30.53,58.0
2024/02/07 09:32:00,07-02-2024 09.57,2024-02-07 10:09:04,25.41,39.0
12-06-2023 12.34,12-06-2023 12.57,2023-06-12 13:05:03,23.21,43.0
21-03-2023 12.52,21-03-2023 13.19,2023-03-21 13:31:01,27.59,31.0
22-01-2024 10.23,22-01-2024 10.31,2024-01-22 10:40:18,8.63,32.0
20-09-2024 09.51,20-09-2024 10.03,2024-09-20 10:13:56,12.03,45.0
30-09-2024 12.26,30-09-2024 12.58,2024-09-30 13:10:54,32.9,40.0
13-01-2024 13.00,13-01-2024 13.01,2024-01-13 13:02:00,1.0,37.0
09-07-2024 14.18,09-07-2024 14.41,2024-07-09 14:45:02,23.19,20.0
30-01-2024 11.30,30-01-2024 11.50,2024-01-30 11:59:14,20.85,24.0
07-09-2023 15.15,07-09-2023 15.20,2023-09-07 15:29:29,5.93,32.0
28-06-2023 10.25,28-06-2023 10.53,2023-06-28 11:02:47,28.71,20.0
05-12-2023 10.43,05-12-2023 11.02,2023-12-05 11:15:20,19.88,29.0
19-11-2024 12.22,19-11-2024 12.29,2024-11-19 12:44:28,7.94,40.0
01-06-2024 10.22,01-06-2024 10.31,2024-06-01 10:42:43,9.31,32.0
16-06-2023 12.21,16-06-2023 12.39,2023-06-16 12:49:38,18.96,33.0
06-07-2024 13.00,06-07-2024 13.01,2024-07-06 13:02:00,1.0,26.0
02-08-2024 13.11,02-08-2024 13.37,2024-08-02 13:44:37,26.04,51.0
2024/02/02 14:46:00,02-02-2024 15.11,2024-02-02 15:21:49,25.73,47.0
2024/01/25 09:46:00,25-01-2024 10.08,2024-01-25 10:20:24,22.73,31.0
17-08-2023 10.06,17-08-2023 10.21,2023-08-17 10:39:24,15.11,47.0
04-07-2024 11.33,04-07-2024 11.59,2024-07-04 12:06:30,26.12,41.0
10-08-2023 13.57,10-08-2023 14.08,2023-08-10 14:24:54,11.78,17.0
27-09-2024 15.41,27-09-2024 15.44,2024-09-27 15:45:00,3.0,59.0
10-06-2023 13.00,10-06-2023 13.01,2023-06-10 13:02:00,1.0,31.0
19-08-2023 13.00,19-08-2023 13.01,2023-08-19 13:02:00,1.0,39.0
04-08-2023 12.16,04-08-2023 12.33,2023-08-04 12:38:32,17.95,32.0
13-07-2024 09.51,13-07-2024 10.22,2024-07-13 10:23:09,31.15,42.0
23-02-2024 10.27,23-02-2024 10.54,2024-02-23 11:04:03,27.66,30.0
12-07-2023 13.16,12-07-2023 13.33,2023-07-12 13:44:34,16.7,14.0
29-08-2024 09.07,29-08-2024 09.34,2024-08-29 09:45:53,27.4,44.0
20-10-2023 14.08,20-10-2023 14.26,2023-10-20 14:43:50,18.38,27.0
12-08-2023 11.08,12-08-2023 11.26,2023-08-12 11:35:44,18.27,
12-10-2023 09.58,12-10-2023 10.11,2023-10-12 10:21:35,13.41,16.0
05-10-2024 09.30,05-10-2024 09.40,2024-10-05 09:47:18,10.71,5.0
18-10-2024 09.28,18-10-2024 09.48,2024-10-18 09:59:18,20.32,47.0
22-10-2024 12.18,22-10-2024 12.45,2024-10-22 12:55:30,27.84,47.0
2023/06/28 15:15:00,28-06-2023 15.16,2023-06-28 15:30:14,1.27,7.0
30-12-2023 13.00,30-12-2023 13.01,2023-12-30 13:02:00,1.0,38.0
03-05-2024 13.17,03-05-2024 13.31,2024-05-03 13:35:21,14.52,162.0
24-10-2024 15.36,24-10-2024 15.44,2024-10-24 15:45:00,8.0,32.0
2023/12/02 09:12:00,02-12-2023 09.35,2023-12-02 09:50:39,23.45,44.0
17-02-2024 13.00,17-02-2024 13.01,2024-02-17 13:02:00,1.0,25.0
2024/05/25 12:14:00,25-05-2024 12.50,2024-05-25 12:52:05,36.17,44.0
16-03-2024 11.34,16-03-2024 11.55,2024-03-16 12:06:59,21.77,29.0
12-08-2023 13.00,12-08-2023 13.01,2023-08-12 13:02:00,1.0,32.0
21-02-2023 12.32,21-02-2023 12.53,2023-02-21 12:57:35,21.62,15.0
28-03-2024 14.29,28-03-2024 14.54,2024-03-28 15:08:37,25.67,31.0
02-11-2024 10.38,02-11-2024 10.49,2024-11-02 10:59:33,11.38,32.0
09-10-2023 10.23,09-10-2023 10.34,2023-10-09 10:39:19,11.2,11.0
28-02-2024 13.41,28-02-2024 13.51,2024-02-28 14:00:13,10.69,25.0
2023/09/15 11:03:00,15-09-2023 11.26,2023-09-15 11:39:56,23.66,
16-06-2023 10.57,16-06-2023 11.20,2023-06-16 11:29:06,23.36,31.0
30-08-2024 09.23,30-08-2024 09.55,2024-08-30 09:59:17,32.27,53.0
,04-06-2024 13.16,2024-06-04 13:18:28,43.64,19.0
25-08-2023 13.18,25-08-2023 13.44,2023-08-25 13:51:44,26.1,32.0
2023/07/10 11:38:00,10-07-2023 11.54,2023-07-10 12:12:40,16.41,21.0
2023/10/18 14:02:00,18-10-2023 14.26,2023-10-18 14:36:22,24.03,10.0
18-10-2023 15.20,18-10-2023 15.37,2023-10-18 15:45:00,17.23,23.0
2023/11/22 11:40:00,22-11-2023 11.56,2023-11-22 12:05:11,16.78,23.0
2024/10/07 13:10:00,07-10-2024 13.20,2024-10-07 13:24:51,10.43,37.0
2023/12/04 15:03:00,04-12-2023 15.36,2023-12-04 15:45:00,33.63,51.0
2023/11/22 12:31:00,22-11-2023 12.41,2023-11-22 12:47:49,10.5,40.0
19-01-2024 14.05,19-01-2024 14.16,2024-01-19 14:28:27,11.27,25.0
11-05-2023 9.10,11-05-2023 09.54,2023-05-11 10:07:22,44.78,44.0
29-09-2023 09.46,29-09-2023 10.00,2023-09-29 10:10:28,13.82,17.0
14-11-2023 10.56,14-11-2023 11.15,2023-11-14 11:21:47,19.54,171.0
,25-05-2023 13.57,2023-05-25 14:04:51,18.9,17.0
02-03-2024 12.54,02-03-2024 12.59,2024-03-02 13:00:00,4.2,27.0
19-06-2023 9.00,19-06-2023 09.26,2023-06-19 09:38:05,26.91,44.0
2024/01/04 11:09:00,04-01-2024 11.32,2024-01-04 11:48:41,23.36,31.0
,17-01-2023 10.19,2023-01-17 10:33:31,18.47,26.0
20-03-2024 13.03,20-03-2024 13.26,2024-03-20 13:31:58,23.06,29.0
2024/07/22 15:45:00,22-07-2024 15.46,2024-07-22 15:47:00,1.0,25.0
10-04-2024 14.06,10-04-2024 14.15,2024-04-10 14:27:38,9.15,25.0
25-12-2023 14.05,25-12-2023 14.37,2023-12-25 14:43:44,32.14,37.0
06-09-2024 10.08,06-09-2024 10.23,2024-09-06 10:40:55,14.51,0.0
20-08-2024 12.34,20-08-2024 12.43,2024-08-20 12:55:06,9.8,31.0
20-08-2024 15.33,20-08-2024 15.44,2024-08-20 15:45:00,11.0,25.0
12-05-2023 10.47,12-05-2023 11.01,2023-05-12 11:16:57,14.32,16.0
13-11-2023 10.34,13-11-2023 11.03,2023-11-13 11:12:52,29.57,33.0
31-05-2024 13.13,31-05-2024 13.39,2024-05-31 13:50:03,26.07,19.0
06-05-2023 11.25,06-05-2023 11.49,2023-05-06 11:59:11,24.51,46.0
2024/05/01 12:21:00,01-05-2024 12.45,2024-05-01 13:04:32,24.97,41.0
23-12-2023 13.00,23-12-2023 13.01,2023-12-23 13:02:00,1.0,45.0
02-02-2024 10.17,02-02-2024 10.58,2024-02-02 11:11:03,41.31,44.0
12-06-2024 10.11,12-06-2024 10.20,2024-06-12 10:27:45,9.24,24.0
,24-11-2023 11.13,2023-11-24 11:24:49,31.42,166.0
2023/11/20 10:10:00,20-11-2023 10.27,2023-11-20 10:34:54,17.92,32.0
16-10-2023 14.57,16-10-2023 15.32,2023-10-16 15:43:38,35.94,220.0
18-09-2024 09.54,18-09-2024 10.36,2024-09-18 10:43:51,42.08,44.0
08-05-2023 14.26,08-05-2023 14.40,2023-05-08 14:43:44,14.96,26.0
09-11-2023 10.34,09-11-2023 10.49,2023-11-09 10:54:22,15.44,37.0
12-06-2023 10.17,12-06-2023 10.22,2023-06-12 10:32:05,5.58,32.0
29-10-2024 13.08,29-10-2024 13.22,2024-10-29 13:34:14,14.34,37.0
07-06-2024 13.30,07-06-2024 13.47,2024-06-07 13:58:06,17.48,34.0
04-05-2024 09.54,04-05-2024 10.24,2024-05-04 10:33:59,30.67,37.0
26-08-2023 10.06,26-08-2023 10.27,2023-08-26 10:42:28,21.42,32.0
2023/01/20 12:38:00,20-01-2023 13.04,2023-01-20 13:14:21,26.64,31.0
09-12-2023 13.00,09-12-2023 13.01,2023-12-09 13:02:00,1.0,27.0
30-06-2023 12.19,30-06-2023 12.38,2023-06-30 12:43:11,19.3,32.0
19-04-2023 09.53,19-04-2023 10.03,2023-04-19 10:16:43,10.14,10.0
27-03-2024 11.25,27-03-2024 11.30,2024-03-27 11:36:23,5.4,1.0
03-02-2023 10.43,03-02-2023 11.41,2023-02-03 11:56:34,58.96,32.0
03-01-2024 15.45,03-01-2024 15.46,2024-01-03 15:47:00,1.0,25.0
01-02-2023 14.25,01-02-2023 14.38,2023-02-01 14:48:01,13.19,17.0
27-02-2023 10.18,27-02-2023 10.19,2023-02-27 10:25:56,1.0,32.0
17-05-2023 10.57,17-05-2023 11.15,2023-05-17 11:17:12,18.83,24.0
31-10-2024 10.04,31-10-2024 10.25,2024-10-31 10:43:10,21.73,23.0
2024/09/05 11:13:00,05-09-2024 11.29,2024-09-05 11:36:59,16.19,23.0
11-01-2023 11.18,11-01-2023 11.30,2023-01-11 11:38:19,12.83,43.0
20-02-2024 12.43,20-02-2024 12.59,2024-02-20 13:08:57,15.41,24.0
27-01-2023 14.37,27-01-2023 14.57,2023-01-27 15:10:50,20.54,36.0
07-05-2024 12.11,07-05-2024 12.34,2024-05-07 12:43:18,23.37,23.0
2023/02/10 11:19:00,10-02-2023 11.49,2023-02-10 12:01:43,29.91,70.0
08-05-2024 14.09,08-05-2024 14.24,2024-05-08 14:42:09,15.73,25.0
02-10-2023 15.00,02-10-2023 15.26,2023-10-02 15:39:06,26.29,48.0
30-09-2023 13.00,30-09-2023 13.01,2023-09-30 13:02:00,,35.0
06-05-2024 12.04,06-05-2024 12.22,2024-05-06 12:31:23,18.77,28.0
2023/12/20 11:00:00,20-12-2023 11.21,2023-12-20 11:34:50,,25.0
11-05-2024 12.18,11-05-2024 12.25,2024-05-11 12:35:00,7.93,32.0
14-02-2024 15.35,14-02-2024 15.44,2024-02-14 15:45:00,9.0,51.0
09-06-2023 12.21,09-06-2023 12.56,2023-06-09 13:14:31,35.2,
12-10-2024 12.23,12-10-2024 12.38,2024-10-12 12:48:39,15.33,33.0
13-07-2024 13.00,13-07-2024 13.01,2024-07-13 13:02:00,1.0,35.0
27-09-2024 11.22,27-09-2024 11.42,2024-09-27 11:51:52,20.98,24.0
25-10-2023 10.29,25-10-2023 10.59,2023-10-25 11:04:22,30.89,45.0
03-04-2024 9.44,03-04-2024 10.12,2024-04-03 10:22:09,28.98,38.0
21-07-2023 09.20,21-07-2023 09.38,2023-07-21 09:48:03,18.19,34.0
13-03-2024 10.58,13-03-2024 11.23,2024-03-13 11:27:58,24.6,29.0
2023/06/12 15:28:00,12-06-2023 15.44,2023-06-12 15:45:00,16.0,28.0
27-03-2024 14.20,27-03-2024 14.23,2024-03-27 14:31:55,,17.0
21-06-2024 11.10,21-06-2024 11.21,2024-06-21 11:30:46,11.06,125.0
11-01-2024 09.55,11-01-2024 10.14,2024-01-11 10:33:09,18.45,47.0
2023/10/25 14:37:00,25-10-2023 15.06,2023-10-25 15:11:16,28.97,58.0
22-03-2024 10.00,22-03-2024 10.36,2024-03-22 10:50:42,36.44,57.0
06-03-2023 10.30,06-03-2023 10.48,2023-03-06 10:58:18,18.44,20.0
18-04-2023 14.17,18-04-2023 14.27,2023-04-18 14:42:19,10.63,18.0
17-05-2023 11.43,17-05-2023 12.07,2023-05-17 12:16:36,24.81,28.0
28-10-2023 13.00,28-10-2023 13.01,2023-10-28 13:02:00,1.0,25.0
25-09-2024 15.43,25-09-2024 15.44,2024-09-25 15:45:00,1.0,25.0
08-02-2024 11.48,08-02-2024 12.10,2024-02-08 12:16:00,22.2,24.0
2023/12/28 14:28:00,28-12-2023 14.44,2023-12-28 14:54:41,16.45,133.0
12-11-2024 13.15,12-11-2024 13.39,2024-11-12 13:44:38,24.7,29.0
03-03-2023 14.28,03-03-2023 14.42,2023-03-03 14:50:32,14.36,133.0
13-04-2023 10.35,13-04-2023 10.46,2023-04-13 10:55:54,11.84,32.0
2024/08/30 12:45:00,30-08-2024 13.09,2024-08-30 13:29:42,24.39,40.0
2023/02/09 09:45:00,09-02-2023 10.06,2023-02-09 10:18:19,21.91,20.0
09-05-2023 10.04,09-05-2023 10.32,2023-05-09 10:48:07,28.12,24.0
10-04-2024 11.08,10-04-2024 11.18,2024-04-10 11:28:51,10.48,32.0
16-01-2023 15.11,16-01-2023 15.39,2023-01-16 15:45:00,28.69,43.0
2023/07/25 10:54:00,25-07-2023 11.06,2023-07-25 11:14:28,12.34,24.0
28-10-2024 10.04,28-10-2024 10.26,2024-10-28 10:37:37,22.48,28.0
22-09-2023 10.30,22-09-2023 10.31,2023-09-22 10:36:59,1.0,32.0
27-12-2023 14.41,27-12-2023 15.00,2023-12-27 15:13:24,19.25,27.0
2023/09/08 13:43:00,08-09-2023 13.58,2023-09-08 14:13:51,15.86,27.0
2023/07/08 13:00:00,08-07-2023 13.01,2023-07-08 13:02:00,1.0,25.0
2024/07/17 14:05:00,17-07-2024 14.24,2024-07-17 14:33:06,19.31,32.0
14-08-2024 14.31,14-08-2024 14.53,2024-08-14 15:04:03,22.57,36.0
04-07-2024 14.00,04-07-2024 14.14,2024-07-04 14:27:33,14.22,0.0
2024/07/23 11:56:00,23-07-2024 12.18,2024-07-23 12:32:19,21.33,10.0
17-03-2023 13.17,17-03-2023 13.44,2023-03-17 13:47:04,27.0,33.0
11-01-2024 14.07,11-01-2024 14.34,2024-01-11 14:50:15,27.83,600.0
2024/09/25 11:07:00,25-09-2024 11.25,2024-09-25 11:37:06,18.81,15.0
09-12-2023 13.00,09-12-2023 13.01,2023-12-09 13:02:00,1.0,23.0
02-03-2024 12.57,02-03-2024 12.59,2024-03-02 13:00:00,2.0,9.0
20-06-2023 10.03,20-06-2023 10.32,2023-06-20 10:43:31,29.39,32.0
03-10-2024 09.43,03-10-2024 09.59,2024-10-03 10:10:01,16.39,40.0
23-05-2024 10.31,23-05-2024 10.59,2024-05-23 11:10:33,28.36,51.0
11-10-2023 14.44,11-10-2023 15.01,2023-10-11 15:07:58,17.49,23.0
23-10-2023 14.15,23-10-2023 14.20,2023-10-23 14:27:56,5.32,17.0
2024/07/18 13:15:00,18-07-2024 13.35,2024-07-18 13:44:04,20.7,32.0
16-08-2023 10.37,16-08-2023 11.07,2023-08-16 11:19:46,30.76,50.0
07-11-2024 12.17,07-11-2024 12.48,2024-11-07 13:00:10,31.18,40.0
05-01-2023 11.59,05-01-2023 12.20,2023-01-05 12:31:26,21.05,30.0
10-10-2024 10.46,10-10-2024 11.10,2024-10-10 11:17:50,24.85,29.0
27-01-2024 10.21,27-01-2024 10.38,2024-01-27 10:50:10,17.76,29.0
24-04-2023 13.00,24-04-2023 13.17,2023-04-24 13:20:33,17.38,143.0
23-09-2024 13.27,23-09-2024 13.53,2024-09-23 14:04:31,26.52,26.0
21-11-2023 11.00,21-11-2023 11.19,2023-11-21 11:26:10,19.18,32.0
01-03-2023 15.38,01-03-2023 15.44,2023-03-01 15:45:00,6.0,13.0
2023/01/18 12:33:00,18-01-2023 12.46,2023-01-18 12:56:45,13.54,40.0
12-06-2023 11.33,12-06-2023 11.49,2023-06-12 12:08:22,16.81,31.0
20-03-2024 12.41,20-03-2024 12.52,2024-03-20 13:01:18,11.44,31.0
2023/05/03 13:55:00,03-05-2023 14.12,2023-05-03 14:20:52,17.17,32.0
20-09-2024 12.18,20-09-2024 12.40,2024-09-20 12:50:47,21.61,38.0
20-04-2023 13.51,20-04-2023 14.13,2023-04-20 14:16:32,22.93,38.0
30-11-2024 11.16,30-11-2024 11.35,2024-11-30 11:42:29,19.0,39.0
15-09-2023 13.27,15-09-2023 13.46,2023-09-15 14:01:48,19.81,26.0
18-11-2023 13.00,18-11-2023 13.01,2023-11-18 13:02:00,1.0,34.0
21-07-2023 14.34,21-07-2023 14.53,2023-07-21 15:12:56,19.18,14.0
27-03-2023 09.13,27-03-2023 09.42,2023-03-27 09:56:49,29.89,38.0
23-01-2023 12.30,23-01-2023 13.04,2023-01-23 13:15:23,34.56,54.0
,23-08-2023 10.27,2023-08-23 10:44:35,35.86,37.0
30-03-2024 13.00,30-03-2024 13.01,2024-03-30 13:02:00,1.0,25.0
25-03-2024 12.38,25-03-2024 12.57,2024-03-25 13:09:32,19.82,26.0
05-01-2024 10.23,05-01-2024 10.37,2024-01-05 10:50:09,14.77,32.0
30-05-2023 14.28,30-05-2023 14.46,2023-05-30 14:51:44,18.11,31.0
25-03-2023 10.33,25-03-2023 10.50,2023-03-25 10:55:49,17.44,21.0
10-07-2023 13.05,10-07-2023 13.22,2023-07-10 13:34:56,17.2,33.0
11-03-2024 10.58,11-03-2024 11.20,2024-03-11 11:31:13,22.49,17.0
09-03-2024 12.32,09-03-2024 12.50,2024-03-09 13:00:00,18.32,22.0
2024/10/29 12:21:00,29-10-2024 12.36,2024-10-29 12:53:57,15.65,40.0
08-02-2023 09.22,08-02-2023 09.54,2023-02-08 10:05:34,32.91,52.0
24-01-2023 12.11,24-01-2023 12.34,2023-01-24 12:40:24,23.88,45.0
23-08-2023 09.40,23-08-2023 09.56,2023-08-23 10:08:29,16.46,34.0
09-07-2024 12.34,09-07-2024 12.40,2024-07-09 12:48:44,6.02,40.0
08-11-2023 9.14,08-11-2023 09.43,2023-11-08 09:55:04,29.44,
18-12-2023 10.56,18-12-2023 11.23,2023-12-18 11:31:46,27.26,41.0
13-02-2024 10.36,13-02-2024 10.59,2024-02-13 11:12:47,23.46,40.0
2024/10/12 09:57:00,12-10-2024 10.15,2024-10-12 10:28:31,,34.0
10-02-2024 09.00,10-02-2024 09.14,2024-02-10 09:32:12,14.3,27.0
06-05-2023 12.17,06-05-2023 12.41,2023-05-06 12:56:17,24.31,32.0
07-02-2024 10.43,07-02-2024 10.57,2024-02-07 11:06:16,14.29,42.0
10-11-2023 14.12,10-11-2023 14.32,2023-11-10 14:44:48,20.52,26.0
23-12-2023 13.00,23-12-2023 13.01,2023-12-23 13:02:00,1.0,17.0
10-04-2024 11.54,10-04-2024 12.17,2024-04-10 12:31:42,23.08,33.0
2023/04/18 09:40:00,18-04-2023 09.53,2023-04-18 10:05:52,14.0,15.0
22-04-2024 09.47,22-04-2024 10.00,2024-04-22 10:13:58,13.45,27.0
2023/10/02 12:31:00,02-10-2023 12.44,2023-10-02 12:49:39,13.37,40.0
2024/05/31 13:50:00,31-05-2024 14.09,2024-05-31 14:13:19,19.37,30.0
2024/01/20 13:00:00,20-01-2024 13.01,2024-01-20 13:02:00,1.0,37.0
30-01-2023 10.42,30-01-2023 11.03,2023-01-30 11:16:28,21.34,0.0
23-06-2023 09.54,23-06-2023 10.11,2023-06-23 10:15:29,17.09,31.0
23-11-2023 10.53,23-11-2023 11.19,2023-11-23 11:21:05,26.63,
22-01-2024 09.10,22-01-2024 09.30,2024-01-22 09:48:26,20.73,44.0
15-07-2024 12.48,15-07-2024 12.59,2024-07-15 13:13:16,11.13,40.0
23-02-2023 10.45,23-02-2023 11.12,2023-02-23 11:15:59,27.09,19.0
23-04-2024 10.21,23-04-2024 10.31,2024-04-23 10:40:08,10.57,32.0
2024/08/20 10:27:00,20-08-2024 10.56,2024-08-20 11:01:39,29.74,45.0
02-08-2024 15.06,02-08-2024 15.32,2024-08-02 15:43:58,26.88,48.0
2024/07/31 13:38:00,31-07-2024 14.04,2024-07-31 14:15:37,26.07,33.0
02-02-2023 10.27,02-02-2023 11.56,2023-02-02 12:07:30,89.82,33.0
02-03-2024 10.45,02-03-2024 11.00,2024-03-02 11:12:36,15.64,32.0
2023/08/15 10:30:00,15-08-2023 10.54,2023-08-15 11:04:10,24.77,37.0
2023/04/29 13:00:00,29-04-2023 13.01,2023-04-29 13:02:00,1.0,23.0
19-08-2024 11.06,19-08-2024 11.33,2024-08-19 11:43:58,27.09,39.0
2024/09/11 13:55:00,11-09-2024 14.28,2024-09-11 14:48:49,33.04,30.0
14-08-2024 15.45,14-08-2024 15.46,2024-08-14 15:47:00,1.0,16.0
2024/06/25 13:34:00,25-06-2024 13.55,2024-06-25 14:07:24,21.32,43.0
10-08-2023 14.00,10-08-2023 14.20,2023-08-10 14:30:16,20.92,10.0
24-05-2024 10.56,24-05-2024 11.17,2024-05-24 11:26:44,21.09,29.0
07-04-2023 10.48,07-04-2023 11.09,2023-04-07 11:21:47,21.09,36.0
19-08-2024 12.53,19-08-2024 13.05,2024-08-19 13:18:10,12.09,0.0
03-03-2023 11.51,03-03-2023 12.16,2023-03-03 12:25:51,25.42,28.0
31-01-2023 14.43,31-01-2023 14.57,2023-01-31 15:07:01,14.37,27.0
13-09-2024 11.14,13-09-2024 11.30,2024-09-13 11:37:48,16.48,14.0
2023/01/12 09:04:00,12-01-2023 09.34,2023-01-12 09:51:53,30.58,40.0
08-01-2024 14.59,08-01-2024 15.26,2024-01-08 15:34:07,26.46,30.0
04-01-2024 14.47,04-01-2024 15.12,2024-01-04 15:25:07,25.49,33.0
29-09-2023 11.23,29-09-2023 11.43,2023-09-29 11:57:39,20.77,
01-05-2024 12.20,01-05-2024 12.46,2024-05-01 12:47:39,26.66,36.0
29-05-2023 11.32,29-05-2023 11.55,2023-05-29 12:03:58,23.72,30.0
28-04-2023 12.41,28-04-2023 13.12,2023-04-28 13:24:40,31.96,45.0
13-12-2023 12.29,13-12-2023 12.46,2023-12-13 13:02:05,17.07,40.0
01-04-2023 13.00,01-04-2023 13.01,2023-04-01 13:02:00,1.0,48.0
15-06-2024 9.00,15-06-2024 09.28,2024-06-15 09:37:48,28.4,28.0
02-09-2024 10.16,02-09-2024 10.43,2024-09-02 10:54:52,27.77,20.0
2024/08/05 14:46:00,05-08-2024 15.21,2024-08-05 15:32:44,35.78,52.0
08-04-2024 11.01,08-04-2024 11.20,2024-04-08 11:25:45,18.6,30.0
07-09-2024 10.33,07-09-2024 10.41,2024-09-07 10:49:11,8.95,0.0
10-08-2024 12.00,10-08-2024 12.20,2024-08-10 12:30:59,20.94,28.0
11-12-2023 10.32,11-12-2023 10.54,2023-12-11 11:04:31,22.31,40.0
28-02-2024 11.47,28-02-2024 12.03,2024-02-28 12:13:09,16.76,20.0
24-10-2024 12.39,24-10-2024 13.02,2024-10-24 13:15:49,23.03,11.0
2024/01/29 12:15:00,29-01-2024 12.39,2024-01-29 12:41:17,24.11,31.0
30-11-2023 10.08,30-11-2023 10.29,2023-11-30 10:33:23,21.83,18.0
06-05-2024 11.34,06-05-2024 11.48,2024-05-06 11:58:49,14.79,31.0
02-12-2023 12.38,02-12-2023 12.59,2023-12-02 13:00:00,21.0,57.0
27-09-2023 09.04,27-09-2023 09.21,2023-09-27 09:32:05,17.33,28.0
10-02-2024 10.46,10-02-2024 11.12,2024-02-10 11:23:13,26.27,32.0
22-07-2023 12.40,22-07-2023 12.59,2023-07-22 13:00:00,19.0,35.0
2023/06/27 14:35:00,27-06-2023 14.59,2023-06-27 15:09:23,24.16,39.0
30-09-2023 10.49,30-09-2023 11.17,2023-09-30 11:27:05,28.24,52.0
25-11-2023 13.00,25-11-2023 13.01,2023-11-25 13:02:00,1.0,220.0
06-09-2024 14.37,06-09-2024 14.58,2024-09-06 15:10:05,21.68,157.0
01-02-2023 14.54,01-02-2023 15.21,2023-02-01 15:32:21,,29.0
2024/03/12 11:26:00,12-03-2024 11.49,2024-03-12 11:59:52,23.97,30.0
2023/03/31 10:14:00,31-03-2023 10.25,2023-03-31 10:32:23,11.22,0.0
2024/03/23 09:59:00,23-03-2024 10.04,2024-03-23 10:10:55,5.59,10.0
28-05-2024 10.53,28-05-2024 11.16,2024-05-28 11:28:39,23.88,50.0
16-10-2023 10.41,16-10-2023 11.00,2023-10-16 11:17:41,19.75,32.0
13-02-2023 12.02,13-02-2023 12.29,2023-02-13 12:35:25,27.43,32.0
21-09-2024 13.00,21-09-2024 13.01,2024-09-21 13:02:00,1.0,48.0
29-02-2024 13.38,29-02-2024 13.58,2024-02-29 14:11:55,20.97,20.0
12-09-2023 11.15,12-09-2023 11.31,2023-09-12 11:41:17,16.19,37.0
12-11-2024 11.15,12-11-2024 11.38,2024-11-12 11:48:03,23.5,30.0
2023/12/04 14:03:00,04-12-2023 14.24,2023-12-04 14:37:54,21.96,43.0
24-05-2024 09.12,24-05-2024 09.37,2024-05-24 09:48:59,25.3,28.0
2024/04/15 11:57:00,15-04-2024 12.12,2024-04-15 12:25:22,15.19,20.0
26-08-2024 14.22,26-08-2024 14.28,2024-08-26 14:33:43,6.44,17.0
22-06-2024 10.36,22-06-2024 10.43,2024-06-22 10:52:55,7.95,15.0
04-03-2024 13.35,04-03-2024 13.50,2024-03-04 13:52:26,15.59,33.0
24-02-2024 12.41,24-02-2024 12.53,2024-02-24 13:00:00,12.53,31.0
05-07-2024 13.46,05-07-2024 14.12,2024-07-05 14:28:01,26.52,54.0
09-02-2023 15.45,09-02-2023 15.46,2023-02-09 15:47:00,1.0,25.0
26-07-2023 13.19,26-07-2023 13.35,2023-07-26 13:42:56,,27.0
2023/05/09 12:24:00,09-05-2023 13.01,2023-05-09 13:17:26,37.55,45.0
18-04-2023 11.13,18-04-2023 11.25,2023-04-18 11:36:22,12.7,14.0
14-09-2023 12.27,14-09-2023 12.48,2023-09-14 12:57:47,21.91,30.0
25-05-2024 11.25,25-05-2024 11.46,2024-05-25 12:01:22,21.71,35.0
24-05-2023 12.54,24-05-2023 13.16,2023-05-24 13:20:27,22.68,15.0
26-07-2024 10.16,26-07-2024 10.29,2024-07-26 10:43:38,13.21,21.0
,03-01-2024 09.35,2024-01-03 09:44:06,19.1,26.0
25-08-2023 14.38,25-08-2023 14.58,2023-08-25 15:07:50,20.64,36.0
17-01-2023 11.22,17-01-2023 11.27,2023-01-17 11:32:51,5.76,1.0
13-02-2023 13.02,13-02-2023 13.20,2023-02-13 13:22:43,18.55,143.0
09-03-2023 13.22,09-03-2023 13.44,2023-03-09 13:57:49,22.69,26.0
28-06-2024 12.01,28-06-2024 12.24,2024-06-28 12:29:44,23.37,36.0
2023/09/21 13:03:00,21-09-2023 13.19,2023-09-21 13:23:00,16.13,143.0
01-11-2023 09.22,01-11-2023 09.44,2023-11-01 09:57:11,22.1,35.0
24-05-2024 09.54,24-05-2024 10.15,2024-05-24 10:26:08,20.75,30.0
27-05-2023 09.36,27-05-2023 10.00,2023-05-27 10:09:19,24.08,47.0
12-05-2023 11.21,12-05-2023 11.25,2023-05-12 11:31:59,4.65,1.0
21-08-2024 12.21,21-08-2024 12.33,2024-08-21 12:37:47,,28.0
07-10-2023 09.10,07-10-2023 09.27,2023-10-07 09:34:54,17.04,26.0
10-04-2024 09.01,10-04-2024 09.16,2024-04-10 09:23:17,,32.0
20-11-2023 10.56,20-11-2023 11.23,2023-11-20 11:35:32,27.39,50.0
01-12-2023 10.30,01-12-2023 10.39,2023-12-01 10:46:57,9.0,32.0
2024/07/15 10:13:00,15-07-2024 10.27,2024-07-15 10:38:26,14.82,23.0
10-06-2023 13.00,10-06-2023 13.01,2023-06-10 13:02:00,1.0,17.0
21-10-2024 12.36,21-10-2024 13.10,2024-10-21 13:20:25,33.65,36.0
2023/03/15 12:03:00,15-03-2023 12.21,2023-03-15 12:33:40,17.67,10.0
2023/12/29 12:09:00,29-12-2023 12.38,2023-12-29 12:49:42,29.25,41.0
27-04-2024 12.04,27-04-2024 12.43,2024-04-27 12:55:50,39.08,45.0
2024/05/14 11:56:00,14-05-2024 12.12,2024-05-14 12:20:09,16.79,29.0
03-04-2024 15.09,03-04-2024 15.29,2024-04-03 15:39:36,20.35,34.0
05-05-2023 13.56,05-05-2023 14.21,2023-05-05 14:31:35,25.26,38.0
2023/04/21 14:49:00,21-04-2023 15.26,2023-04-21 15:34:16,37.0,32.0
10-01-2023 9.45,10-01-2023 09.58,2023-01-10 10:11:18,13.9,20.0
12-10-2024 10.45,12-10-2024 10.55,2024-10-12 10:59:30,10.25,32.0
08-11-2024 15.35,08-11-2024 15.44,2024-11-08 15:45:00,9.0,25.0
20-03-2024 09.32,20-03-2024 09.54,2024-03-20 10:03:33,22.16,
05-09-2023 11.11,05-09-2023 11.38,2023-09-05 11:48:35,27.66,32.0
2023/06/05 14:42:00,05-06-2023 15.06,2023-06-05 15:18:11,24.7,29.0
27-05-2024 14.24,27-05-2024 14.34,2024-05-27 14:43:37,10.18,17.0
07-04-2023 12.19,07-04-2023 12.47,2023-04-07 12:58:50,28.1,31.0
05-09-2023 09.22,05-09-2023 09.39,2023-09-05 09:53:07,16.69,40.0
28-09-2024 12.12,28-09-2024 12.32,2024-09-28 12:44:37,20.63,31.0
18-07-2024 12.30,18-07-2024 12.56,2024-07-18 13:07:19,26.89,28.0
2024/05/16 13:46:00,16-05-2024 13.53,2024-05-16 14:01:00,7.71,171.0
18-11-2023 13.00,18-11-2023 13.01,2023-11-18 13:02:00,1.0,37.0
09-10-2023 12.29,09-10-2023 12.54,2023-10-09 13:07:10,25.99,0.0
11-07-2024 10.57,11-07-2024 11.11,2024-07-11 11:16:57,14.58,10.0
23-11-2024 11.52,23-11-2024 12.16,2024-11-23 12:31:40,24.81,32.0
28-05-2024 12.39,28-05-2024 13.00,2024-05-28 13:07:38,21.83,43.0
24-04-2024 11.14,24-04-2024 11.41,2024-04-24 11:48:10,27.99,33.0
09-09-2023 10.51,09-09-2023 11.06,2023-09-09 11:23:05,15.58,40.0
13-03-2023 11.39,13-03-2023 12.05,2023-03-13 12:21:24,26.43,56.0
2024/08/14 14:01:00,14-08-2024 14.31,2024-08-14 14:43:40,30.54,62.0
28-10-2024 14.56,28-10-2024 15.18,2024-10-28 15:27:24,22.7,37.0
05-12-2023 15.25,05-12-2023 15.44,2023-12-05 15:45:00,19.0,41.0
10-10-2024 09.45,10-10-2024 10.04,2024-10-10 10:15:43,19.26,31.0
28-02-2024 09.46,28-02-2024 10.05,2024-02-28 10:12:18,19.05,33.0
2024/06/10 12:06:00,10-06-2024 12.31,2024-06-10 12:47:53,25.01,30.0
26-06-2024 14.45,26-06-2024 15.07,2024-06-26 15:19:24,22.55,29.0
05-10-2023 12.19,05-10-2023 12.41,2023-10-05 12:50:45,22.88,47.0
08-11-2023 10.45,08-11-2023 11.05,2023-11-08 11:15:45,20.19,40.0
2024/01/27 10:51:00,27-01-2024 11.07,2024-01-27 11:15:31,16.89,9.0
10-06-2024 15.45,10-06-2024 15.46,2024-06-10 15:47:00,1.0,25.0
13-10-2023 14.16,13-10-2023 14.38,2023-10-13 14:51:02,22.78,41.0
29-08-2024 13.21,29-08-2024 13.47,2024-08-29 13:58:30,26.92,35.0
20-09-2024 11.08,20-09-2024 11.30,2024-09-20 11:39:10,,24.0
2024/09/13 14:05:00,13-09-2024 14.18,2024-09-13 14:27:15,13.78,38.0
27-07-2024 12.19,27-07-2024 12.43,2024-07-27 12:54:01,24.33,29.0
25-10-2024 12.03,25-10-2024 12.27,2024-10-25 12:39:56,24.35,32.0
04-07-2023 14.00,04-07-2023 14.46,2023-07-04 14:54:51,46.23,71.0
,31-08-2024 13.01,2024-08-31 13:02:00,1.0,36.0
2024/10/28 12:21:00,28-10-2024 12.47,2024-10-28 12:57:18,26.57,41.0
05-09-2023 12.59,05-09-2023 13.19,2023-09-05 13:30:43,20.6,15.0
28-01-2023 09.33,28-01-2023 09.46,2023-01-28 10:00:37,13.68,0.0
2024/08/09 11:13:00,09-08-2024 11.38,2024-08-09 11:53:27,24.96,34.0
,20-11-2023 14.04,2023-11-20 14:17:57,12.57,25.0
02-01-2024 10.46,02-01-2024 10.50,2024-01-02 10:57:01,4.39,32.0
2023/04/19 12:11:00,19-04-2023 12.45,2023-04-19 13:03:59,34.59,62.0
20-05-2024 14.33,20-05-2024 14.59,2024-05-20 15:12:58,26.83,28.0
16-09-2023 10.26,16-09-2023 10.37,2023-09-16 10:44:45,11.0,32.0
29-08-2024 10.45,29-08-2024 10.54,2024-08-29 11:02:57,9.81,32.0
07-06-2024 11.24,07-06-2024 11.46,2024-06-07 12:01:13,22.33,20.0
06-11-2023 14.02,06-11-2023 14.19,2023-11-06 14:33:51,17.07,20.0
22-05-2024 9.31,22-05-2024 09.56,2024-05-22 10:09:12,25.07,37.0
2023/03/22 09:34:00,22-03-2023 09.43,2023-03-22 09:54:11,9.52,15.0
21-11-2023 15.19,21-11-2023 15.41,2023-11-21 15:45:00,22.28,25.0
08-01-2024 15.31,08-01-2024 15.33,2024-01-08 15:43:41,2.89,25.0
,01-10-2024 10.56,2024-10-01 11:05:01,23.05,34.0
21-03-2023 12.23,21-03-2023 12.50,2023-03-21 13:08:59,27.97,41.0
,19-08-2024 12.26,2024-08-19 12:38:39,29.43,15.0
10-06-2023 13.00,10-06-2023 13.01,2023-06-10 13:02:00,1.0,41.0
12-02-2024 11.11,12-02-2024 11.39,2024-02-12 11:42:40,28.65,33.0
03-04-2023 13.57,03-04-2023 14.09,2023-04-03 14:21:54,12.8,0.0
11-06-2024 13.34,11-06-2024 14.01,2024-06-11 14:21:32,27.12,52.0
09-10-2024 09.27,09-10-2024 09.43,2024-10-09 09:55:23,16.82,12.0
25-06-2024 11.05,25-06-2024 11.11,2024-06-25 11:19:02,6.6,10.0
06-10-2023 11.09,06-10-2023 11.35,2023-10-06 11:41:46,26.76,33.0
2024/04/19 13:24:00,19-04-2024 14.00,2024-04-19 14:10:02,36.55,46.0
18-01-2024 14.13,18-01-2024 14.25,2024-01-18 14:32:50,12.77,17.0
29-11-2023 12.15,29-11-2023 12.41,2023-11-29 12:52:26,26.86,31.0
02-02-2023 13.13,02-02-2023 13.35,2023-02-02 13:41:22,22.48,32.0
13-10-2023 10.59,13-10-2023 11.16,2023-10-13 11:25:39,17.57,30.0
04-10-2023 11.58,04-10-2023 12.10,2023-10-04 12:23:33,,13.0
2023/10/10 14:27:00,10-10-2023 14.46,2023-10-10 14:59:23,19.53,20.0
2024/11/18 13:03:00,18-11-2024 13.31,2024-11-18 13:53:32,28.64,40.0
07-10-2024 15.29,07-10-2024 15.44,2024-10-07 15:45:00,15.0,38.0
15-08-2024 12.42,15-08-2024 13.03,2024-08-15 13:13:18,20.22,27.0
28-06-2023 10.05,28-06-2023 11.28,2023-06-28 11:39:25,83.08,33.0
15-08-2023 12.30,15-08-2023 12.39,2023-08-15 12:49:49,9.7,
,23-11-2024 10.07,2024-11-23 10:19:52,14.48,10.0
21-12-2023 09.00,21-12-2023 09.26,2023-12-21 09:31:58,26.16,38.0
08-06-2024 13.00,08-06-2024 13.01,2024-06-08 13:02:00,1.0,30.0
10-10-2024 09.57,10-10-2024 10.23,2024-10-10 10:35:43,25.61,24.0
13-11-2024 12.10,13-11-2024 12.32,2024-11-13 12:42:40,22.4,29.0
31-01-2024 12.11,31-01-2024 12.29,2024-01-31 12:41:44,18.56,30.0
26-03-2024 12.50,26-03-2024 13.14,2024-03-26 13:33:48,24.69,40.0
05-11-2024 12.57,05-11-2024 13.21,2024-11-05 13:34:57,24.21,36.0
05-01-2024 11.43,05-01-2024 11.55,2024-01-05 12:05:35,12.5,47.0
26-11-2024 10.19,26-11-2024 10.47,2024-11-26 11:10:16,28.83,24.0
2024/08/31 09:35:00,31-08-2024 09.49,2024-08-31 09:58:15,14.31,169.0
16-03-2024 10.48,16-03-2024 11.08,2024-03-16 11:18:26,20.26,24.0
16-06-2023 09.38,16-06-2023 09.56,2023-06-16 10:13:59,18.3,45.0
30-12-2023 10.32,30-12-2023 10.39,2023-12-30 10:51:06,7.49,32.0
30-09-2023 13.00,30-09-2023 13.01,2023-09-30 13:02:00,1.0,25.0
20-02-2023 15.43,20-02-2023 15.44,2023-02-20 15:45:00,1.0,25.0
26-10-2023 12.18,26-10-2023 12.22,2023-10-26 12:32:17,,40.0
13-04-2023 11.08,13-04-2023 11.30,2023-04-13 11:43:27,22.31,24.0
19-09-2024 12.36,19-09-2024 12.55,2024-09-19 13:04:21,19.42,33.0
17-03-2023 11.53,17-03-2023 12.21,2023-03-17 12:35:23,28.46,39.0
01-07-2024 11.56,01-07-2024 12.21,2024-07-01 12:27:26,25.4,41.0
27-03-2024 12.15,27-03-2024 12.33,2024-03-27 12:45:15,18.1,18.0
20-08-2024 11.57,20-08-2024 12.22,2024-08-20 12:33:23,24.61,
10-08-2023 11.37,10-08-2023 12.09,2023-08-10 12:15:13,32.6,48.0
23-04-2024 12.38,23-04-2024 12.45,2024-04-23 12:54:29,7.23,40.0
11-08-2023 14.49,11-08-2023 15.06,2023-08-11 15:19:09,17.17,23.0
,27-07-2024 13.01,2024-07-27 13:02:00,1.0,32.0
27-08-2024 10.15,27-08-2024 10.35,2024-08-27 10:42:59,19.9,45.0
15-01-2024 14.40,15-01-2024 15.08,2024-01-15 15:23:03,900.0,18.0
26-01-2023 11.10,26-01-2023 11.30,2023-01-26 11:38:49,20.25,40.0
29-01-2024 11.19,29-01-2024 11.41,2024-01-29 11:50:35,22.72,10.0
,16-09-2024 15.39,2024-09-16 15:45:00,25.05,31.0
10-10-2024 9.45,10-10-2024 10.03,2024-10-10 10:11:48,18.69,31.0
25-09-2024 13.31,25-09-2024 13.54,2024-09-25 14:06:36,23.83,28.0
08-02-2024 12.45,08-02-2024 14.39,2024-02-08 14:49:41,114.17,46.0
07-11-2024 15.02,07-11-2024 15.37,2024-11-07 15:45:00,35.66,220.0
28-10-2024 9.21,28-10-2024 09.55,2024-10-28 10:06:05,34.07,45.0
29-08-2024 12.03,29-08-2024 12.37,2024-08-29 12:41:51,34.69,44.0
03-08-2023 10.51,03-08-2023 11.08,2023-08-03 11:24:23,17.08,40.0
06-04-2024 13.00,06-04-2024 13.01,2024-04-06 13:02:00,1.0,17.0
30-08-2024 09.00,30-08-2024 09.12,2024-08-30 09:27:16,12.64,12.0
25-03-2023 13.00,25-03-2023 13.01,2023-03-25 13:02:00,1.0,28.0
19-07-2023 12.38,19-07-2023 13.01,2023-07-19 13:09:18,23.72,37.0
17-01-2023 15.45,17-01-2023 15.46,2023-01-17 15:47:00,1.0,25.0
29-07-2024 10.37,29-07-2024 11.04,2024-07-29 11:11:59,26.43,40.0
2024/11/04 15:41:00,04-11-2024 15.44,2024-11-04 15:45:00,3.0,51.0
11-05-2023 14.43,11-05-2023 15.10,2023-05-11 15:29:13,27.59,33.0
09-11-2024 11.42,09-11-2024 12.09,2024-11-09 12:11:07,27.62,32.0
27-04-2024 13.00,27-04-2024 13.01,2024-04-27 13:02:00,1.0,47.0
27-01-2023 11.26,27-01-2023 11.55,2023-01-27 12:08:36,29.64,39.0
22-07-2024 12.02,22-07-2024 12.20,2024-07-22 12:35:22,18.8,
2024/05/25 13:00:00,25-05-2024 13.01,2024-05-25 13:02:00,1.0,35.0
31-03-2023 12.41,31-03-2023 12.52,2023-03-31 13:01:00,11.43,40.0
06-06-2023 14.03,06-06-2023 14.28,2023-06-06 14:38:20,25.3,7.0
15-06-2024 12.35,15-06-2024 12.59,2024-06-15 13:00:00,24.0,37.0
22-04-2024 10.36,22-04-2024 11.02,2024-04-22 11:15:18,26.18,
28-12-2023 14.53,28-12-2023 15.11,2023-12-28 15:21:22,18.58,23.0
11-04-2023 12.47,11-04-2023 13.09,2023-04-11 13:20:01,22.66,20.0
19-08-2023 12.13,19-08-2023 12.40,2023-08-19 12:49:23,27.29,43.0
18-03-2023 12.00,18-03-2023 12.29,2023-03-18 12:46:35,29.55,30.0
19-07-2023 12.36,19-07-2023 12.55,2023-07-19 13:06:57,18.73,24.0
11-05-2023 12.00,11-05-2023 12.19,2023-05-11 12:30:02,19.69,41.0
2023/02/17 11:50:00,17-02-2023 12.14,2023-02-17 12:24:37,24.51,22.0
07-03-2024 12.25,07-03-2024 12.54,2024-03-07 13:04:55,29.33,28.0
2023/09/08 11:34:00,08-09-2023 11.58,2023-09-08 11:59:19,24.32,30.0
03-03-2023 15.11,03-03-2023 15.32,2023-03-03 15:45:00,21.84,23.0
,04-12-2023 14.33,2023-12-04 14:46:31,22.73,30.0
2024/04/20 10:28:00,20-04-2024 10.41,2024-04-20 10:52:29,13.59,15.0
16-08-2024 11.13,16-08-2024 11.29,2024-08-16 11:39:52,16.2,32.0
20-04-2023 11.49,20-04-2023 12.14,2023-04-20 12:24:44,25.12,32.0
09-11-2024 13.00,09-11-2024 13.01,2024-11-09 13:02:00,1.0,34.0
2024/11/11 12:37:00,11-11-2024 12.39,2024-11-11 12:51:33,2.18,40.0
09-08-2024 14.25,09-08-2024 14.45,2024-08-09 14:52:16,20.15,26.0
23-12-2023 10.13,23-12-2023 10.36,2023-12-23 10:42:41,23.18,37.0
03-10-2023 9.30,03-10-2023 09.52,2023-10-03 10:00:43,22.47,36.0
08-08-2024 15.45,08-08-2024 15.46,2024-08-08 15:47:00,1.0,
2024/03/16 13:00:00,16-03-2024 13.01,2024-03-16 13:02:00,1.0,39.0
05-12-2023 09.29,05-12-2023 09.42,2023-12-05 09:49:02,13.09,18.0
17-09-2024 10.40,17-09-2024 11.04,2024-09-17 11:14:07,24.18,34.0
25-03-2024 14.25,25-03-2024 14.44,2024-03-25 14:48:52,19.26,20.0
19-04-2024 13.41,19-04-2024 14.01,2024-04-19 14:10:33,20.59,25.0
30-08-2024 12.03,30-08-2024 12.32,2024-08-30 12:48:04,28.25,24.0
01-03-2024 14.26,01-03-2024 14.55,2024-03-01 15:05:05,29.49,31.0
09-05-2023 11.55,09-05-2023 12.08,2023-05-09 12:22:03,13.73,32.0
16-07-2024 10.44,16-07-2024 10.56,2024-07-16 11:09:54,12.44,32.0
2024/07/08 12:26:00,08-07-2024 13.07,2024-07-08 13:22:37,41.28,62.0
17-03-2023 13.41,17-03-2023 13.57,2023-03-17 14:05:24,16.54,17.0
02-02-2024 12.44,02-02-2024 13.00,2024-02-02 13:11:07,16.14,40.0
04-08-2023 09.25,04-08-2023 09.36,2023-08-04 09:45:06,11.95,18.0
2024/01/11 13:31:00,11-01-2024 14.02,2024-01-11 14:15:05,31.23,40.0
05-10-2024 13.00,05-10-2024 13.01,2024-10-05 13:02:00,1.0,32.0
27-05-2024 10.27,27-05-2024 10.44,2024-05-27 11:02:42,17.2,21.0
11-10-2024 12.50,11-10-2024 13.17,2024-10-11 13:30:40,27.09,36.0
2023/12/08 10:05:00,08-12-2023 10.21,2023-12-08 10:30:50,16.53,45.0
2024/08/22 13:22:00,22-08-2024 13.45,2024-08-22 13:56:29,23.12,35.0
30-11-2024 13.00,30-11-2024 13.01,2024-11-30 13:02:00,1.0,
2024/05/07 13:32:00,07-05-2024 14.06,2024-05-07 14:16:59,34.98,54.0
11-11-2023 13.00,11-11-2023 13.01,2023-11-11 13:02:00,1.0,54.0
10-02-2023 14.58,10-02-2023 15.37,2023-02-10 15:45:00,39.2,52.0
27-01-2023 13.02,27-01-2023 13.31,2023-01-27 13:41:31,29.51,32.0
23-07-2024 09.05,23-07-2024 09.40,2024-07-23 09:43:55,35.06,52.0
07-03-2023 10.40,07-03-2023 10.48,2023-03-07 11:00:06,8.13,32.0
2023/01/06 12:51:00,06-01-2023 13.16,2023-01-06 13:27:19,25.7,32.0
2024/03/07 11:35:00,07-03-2024 11.55,2024-03-07 12:06:18,20.62,23.0
02-02-2023 09.12,02-02-2023 09.41,2023-02-02 09:42:42,29.71,55.0
26-09-2023 10.19,26-09-2023 11.00,2023-09-26 11:14:09,41.41,44.0
26-07-2023 14.31,26-07-2023 15.06,2023-07-26 15:14:33,35.02,55.0
21-10-2023 13.00,21-10-2023 13.01,2023-10-21 13:02:00,1.0,17.0
2024/10/22 11:26:00,22-10-2024 11.50,2024-10-22 12:03:39,24.3,24.0
,13-12-2023 12.19,2023-12-13 12:31:41,25.96,30.0
02-11-2023 13.57,02-11-2023 14.29,2023-11-02 14:40:44,32.45,36.0
07-02-2023 09.33,07-02-2023 09.50,2023-02-07 10:11:22,17.82,21.0
04-10-2024 13.00,04-10-2024 13.14,2024-10-04 13:16:09,14.42,12.0
2023/07/13 13:21:00,13-07-2023 13.31,2023-07-13 13:44:30,10.9,23.0
2023/01/07 13:00:00,07-01-2023 13.01,2023-01-07 13:02:00,1.0,49.0
,11-03-2024 10.01,2024-03-11 10:02:46,27.19,47.0
28-11-2023 12.24,28-11-2023 12.42,2023-11-28 12:43:15,18.21,32.0
20-01-2024 09.00,20-01-2024 09.16,2024-01-20 09:22:18,16.59,32.0
02-11-2023 15.29,02-11-2023 15.44,2023-11-02 15:45:00,400.0,0.0
25-03-2024 10.04,25-03-2024 10.22,2024-03-25 10:31:11,18.97,19.0
01-05-2023 12.36,01-05-2023 12.58,2023-05-01 13:03:31,22.61,33.0
2023/10/14 13:00:00,14-10-2023 13.01,2023-10-14 13:02:00,1.0,146.0
2023/12/14 13:47:00,14-12-2023 14.02,2023-12-14 14:12:03,15.98,12.0
2023/12/16 10:17:00,16-12-2023 10.23,2023-12-16 10:34:25,6.15,32.0
03-06-2023 13.00,03-06-2023 13.01,2023-06-03 13:02:00,1.0,43.0
10-08-2024 13.00,10-08-2024 13.01,2024-08-10 13:02:00,1.0,28.0
2024/08/06 13:42:00,06-08-2024 14.01,2024-08-06 14:10:36,19.25,37.0
20-01-2023 11.01,20-01-2023 11.10,2023-01-20 11:28:31,9.52,14.0
06-11-2024 11.12,06-11-2024 11.31,2024-11-06 11:41:28,19.82,32.0
2023/06/05 12:58:00,05-06-2023 13.21,2023-06-05 13:25:28,23.63,143.0
08-07-2023 10.06,08-07-2023 10.27,2023-07-08 10:37:29,21.74,40.0
2024/11/08 10:04:00,08-11-2024 10.23,2024-11-08 10:37:49,19.61,28.0
14-10-2023 10.43,14-10-2023 10.51,2023-10-14 11:02:38,8.86,32.0
,05-06-2024 12.46,2024-06-05 13:01:05,4.42,3.0
2024/09/30 14:46:00,30-09-2024 15.08,2024-09-30 15:24:01,22.34,57.0
25-10-2023 10.53,25-10-2023 11.12,2023-10-25 11:24:40,19.99,50.0
27-02-2024 13.25,27-02-2024 13.44,2024-02-27 13:56:05,19.62,38.0
2023/04/19 12:31:00,19-04-2023 12.38,2023-04-19 12:50:53,7.79,13.0
27-04-2024 12.41,27-04-2024 12.45,2024-04-27 12:51:12,4.39,40.0
07-12-2023 11.15,07-12-2023 11.36,2023-12-07 11:45:59,21.42,20.0
09-09-2023 10.08,09-09-2023 10.25,2023-09-09 10:35:28,17.63,38.0
20-02-2023 12.04,20-02-2023 12.27,2023-02-20 12:45:05,23.07,30.0
2023/11/06 09:48:00,06-11-2023 10.01,2023-11-06 10:09:58,13.69,15.0
20-01-2024 13.00,20-01-2024 13.01,2024-01-20 13:02:00,1.0,15.0
25-01-2023 15.45,25-01-2023 15.46,2023-01-25 15:47:00,1.0,25.0
02-11-2024 13.00,02-11-2024 13.01,2024-11-02 13:02:00,1.0,201.0
2023/04/26 10:25:00,26-04-2023 10.40,2023-04-26 10:50:47,15.42,32.0
2024/02/13 15:42:00,13-02-2024 15.44,2024-02-13 15:45:00,2.0,25.0
2024/03/09 09:40:00,09-03-2024 10.04,2024-03-09 10:13:05,24.06,31.0
05-01-2023 11.07,05-01-2023 11.27,2023-01-05 11:38:04,20.18,34.0
08-04-2024 14.58,08-04-2024 15.22,2024-04-08 15:32:15,24.2,45.0
11-05-2024 13.00,11-05-2024 13.01,2024-05-11 13:02:00,1.0,25.0
06-11-2023 12.42,06-11-2023 13.11,2023-11-06 13:22:48,29.24,41.0
13-06-2024 11.13,13-06-2024 11.27,2024-06-13 11:44:33,14.98,0.0
21-03-2024 10.21,21-03-2024 10.41,2024-03-21 10:51:22,20.47,32.0
30-08-2023 10.04,30-08-2023 10.44,2023-08-30 10:56:48,40.6,44.0
11-04-2024 12.33,11-04-2024 13.01,2024-04-11 13:09:55,27.4,26.0
29-11-2024 12.58,29-11-2024 12.59,2024-11-29 13:12:50,1.0,3.0
22-03-2024 09.41,22-03-2024 09.52,2024-03-22 10:03:00,11.55,10.0
18-02-2023 10.40,18-02-2023 11.11,2023-02-18 11:19:49,31.45,49.0
2024/03/04 15:00:00,04-03-2024 15.21,2024-03-04 15:32:12,21.86,44.0
12-06-2024 15.18,12-06-2024 15.39,2024-06-12 15:43:17,21.69,44.0
2023/01/17 11:33:00,17-01-2023 12.01,2023-01-17 12:02:32,28.14,48.0
02-03-2023 09.10,02-03-2023 09.49,2023-03-02 09:59:51,39.97,44.0
26-05-2023 14.30,26-05-2023 14.58,2023-05-26 15:03:00,28.3,35.0
18-10-2024 11.14,18-10-2024 11.35,2024-10-18 11:38:18,21.25,29.0
17-05-2023 09.37,17-05-2023 09.54,2023-05-17 10:04:41,17.92,33.0
02-05-2024 11.38,02-05-2024 11.53,2024-05-02 12:03:06,15.94,29.0
10-08-2024 13.00,10-08-2024 13.01,2024-08-10 13:02:00,1.0,41.0
2023/05/29 11:00:00,29-05-2023 11.33,2023-05-29 11:44:00,33.47,51.0
2024/03/11 12:16:00,11-03-2024 12.39,2024-03-11 12:54:34,23.58,32.0
13-08-2024 12.29,13-08-2024 13.00,2024-08-13 13:25:42,31.3,
14-08-2023 15.44,14-08-2023 15.44,2023-08-14 15:45:00,0.0,43.0
12-07-2024 12.50,12-07-2024 13.07,2024-07-12 13:21:04,17.42,17.0
05-10-2023 10.39,05-10-2023 10.49,2023-10-05 11:03:25,10.76,16.0
30-03-2023 15.21,30-03-2023 15.44,2023-03-30 15:45:00,23.0,27.0
18-02-2023 13.00,18-02-2023 13.01,2023-02-18 13:02:00,1.0,25.0
15-07-2024 10.33,15-07-2024 10.41,2024-07-15 10:47:19,8.28,32.0
10-09-2024 12.35,10-09-2024 12.42,2024-09-10 13:00:31,7.49,29.0
2023/04/15 13:00:00,15-04-2023 13.01,2023-04-15 13:02:00,1.0,27.0
2024/10/28 13:51:00,28-10-2024 14.05,2024-10-28 14:18:44,14.15,25.0
15-08-2023 11.29,15-08-2023 11.50,2023-08-15 12:03:50,21.6,16.0
2024/10/25 10:30:00,25-10-2024 10.36,2024-10-25 10:46:31,6.97,32.0
16-07-2024 13.55,16-07-2024 13.56,2024-07-16 14:02:53,1.72,25.0
09-05-2024 15.21,09-05-2024 15.38,2024-05-09 15:45:00,17.11,180.0
2024/05/24 12:26:00,24-05-2024 12.58,2024-05-24 13:14:19,32.61,38.0
2023/12/14 14:36:00,14-12-2023 14.50,2023-12-14 15:09:12,14.49,36.0
2024/07/05 10:52:00,05-07-2024 11.18,2024-07-05 11:30:27,26.89,215.0
13-11-2023 10.10,13-11-2023 10.23,2023-11-13 10:28:17,13.4,
2024/02/22 12:26:00,22-02-2024 12.51,2024-02-22 12:58:42,25.57,0.0
30-08-2024 13.51,30-08-2024 14.18,2024-08-30 14:28:53,27.71,25.0
02-08-2023 11.11,02-08-2023 11.36,2023-08-02 11:41:50,25.55,38.0
10-04-2024 12.18,10-04-2024 12.38,2024-04-10 12:50:37,19.95,38.0
26-12-2023 15.03,26-12-2023 15.22,2023-12-26 15:31:58,19.98,23.0
11-01-2023 13.49,11-01-2023 14.05,2023-01-11 14:19:30,16.53,27.0
04-10-2023 09.58,04-10-2023 10.14,2023-10-04 10:25:43,16.75,
2023/11/20 15:20:00,20-11-2023 15.42,2023-11-20 15:45:00,22.9,23.0
10-01-2023 14.26,10-01-2023 14.52,2023-01-10 15:07:07,26.23,71.0
22-10-2024 09.13,22-10-2024 09.22,2024-10-22 09:25:47,9.33,23.0
26-07-2024 09.20,26-07-2024 09.41,2024-07-26 09:50:29,21.35,31.0
12-05-2023 13.29,12-05-2023 13.46,2023-05-12 13:55:06,17.77,35.0
04-03-2023 12.18,04-03-2023 12.29,2023-03-04 12:42:08,,
26-06-2023 14.54,26-06-2023 15.17,2023-06-26 15:26:37,23.39,39.0
30-05-2024 14.18,30-05-2024 14.26,2024-05-30 14:40:11,8.57,17.0
31-10-2024 9.20,31-10-2024 09.41,2024-10-31 09:51:20,21.9,
12-04-2024 10.16,12-04-2024 11.02,2024-04-12 11:10:37,46.63,22.0
2024/03/09 11:49:00,09-03-2024 12.19,2024-03-09 12:36:20,30.61,14.0
10-01-2023 12.25,10-01-2023 12.44,2023-01-10 12:55:49,19.87,33.0
06-06-2023 15.21,06-06-2023 15.44,2023-06-06 15:45:00,,48.0
07-09-2023 11.30,07-09-2023 12.03,2023-09-07 12:18:40,33.68,56.0
14-12-2023 11.39,14-12-2023 12.00,2023-12-14 12:12:44,21.32,33.0
31-01-2023 14.06,31-01-2023 14.50,2023-01-31 15:00:49,44.52,71.0
13-04-2023 13.56,13-04-2023 14.16,2023-04-13 14:25:41,20.63,17.0
05-08-2024 12.19,05-08-2024 12.48,2024-08-05 13:02:42,29.24,38.0
27-04-2023 15.45,27-04-2023 15.46,2023-04-27 15:47:00,1.0,25.0
03-03-2023 10.36,03-03-2023 10.39,2023-03-03 10:42:42,,32.0
26-04-2023 13.19,26-04-2023 13.33,2023-04-26 13:38:45,14.69,162.0
22-04-2023 10.44,22-04-2023 11.06,2023-04-22 11:17:28,22.34,33.0
08-08-2023 10.16,08-08-2023 10.49,2023-08-08 11:04:24,33.98,39.0
05-01-2023 10.20,05-01-2023 10.41,2023-01-05 10:51:59,21.51,30.0
2023/04/10 12:02:00,10-04-2023 12.24,2023-04-10 12:27:40,22.38,38.0
23-10-2024 13.44,23-10-2024 14.11,2024-10-23 14:32:13,27.8,
16-05-2023 11.23,16-05-2023 11.54,2023-05-16 12:00:08,31.43,57.0
08-08-2023 10.31,08-08-2023 10.58,2023-08-08 11:08:19,26.43,22.0
17-07-2023 13.04,17-07-2023 13.16,2023-07-17 13:25:29,12.01,23.0
14-10-2024 15.21,14-10-2024 15.28,2024-10-14 15:45:00,7.58,21.0
18-04-2023 15.19,18-04-2023 15.42,2023-04-18 15:45:00,23.0,25.0
22-03-2024 12.41,22-03-2024 12.44,2024-03-22 12:57:50,3.56,3.0
08-08-2023 15.45,08-08-2023 15.46,2023-08-08 15:47:00,1.0,25.0
19-02-2024 13.25,19-02-2024 13.51,2024-02-19 14:01:23,26.8,38.0
15-02-2024 09.37,15-02-2024 10.03,2024-02-15 10:08:44,26.27,51.0
09-05-2023 14.17,09-05-2023 14.35,2023-05-09 14:48:09,18.83,20.0
17-02-2023 15.45,17-02-2023 15.46,2023-02-17 15:47:00,1.0,35.0
26-07-2023 12.26,26-07-2023 12.52,2023-07-26 13:01:27,26.35,28.0
08-07-2023 11.53,08-07-2023 12.08,2023-07-08 12:16:35,15.05,26.0
2024/05/16 12:26:00,16-05-2024 12.55,2024-05-16 13:06:38,29.62,23.0
15-12-2023 14.34,15-12-2023 15.03,2023-12-15 15:17:44,29.07,51.0
03-02-2024 13.00,03-02-2024 13.01,2024-02-03 13:02:00,1.0,25.0
27-04-2024 11.11,27-04-2024 11.39,2024-04-27 11:58:32,28.09,45.0
16-07-2024 11.30,16-07-2024 11.41,2024-07-16 11:52:22,11.4,13.0
01-03-2023 13.01,01-03-2023 13.23,2023-03-01 13:33:17,22.7,34.0
25-12-2023 13.04,25-12-2023 13.19,2023-12-25 13:38:49,15.96,30.0
18-06-2024 14.42,18-06-2024 14.51,2024-06-18 15:10:24,9.17,15.0
01-10-2024 09.28,01-10-2024 09.58,2024-10-01 10:13:47,30.77,40.0
2024/06/12 09:00:00,12-06-2024 09.19,2024-06-12 09:32:19,19.11,24.0
2023/04/07 15:34:00,07-04-2023 15.44,2023-04-07 15:45:00,10.58,21.0
09-09-2023 13.00,09-09-2023 13.01,2023-09-09 13:02:00,1.0,26.0
26-05-2023 09.41,26-05-2023 11.50,2023-05-26 12:04:50,129.97,28.0
09-11-2024 12.50,09-11-2024 12.59,2024-11-09 13:00:00,9.0,23.0
2023/10/16 11:51:00,16-10-2023 12.05,2023-10-16 12:14:47,14.05,
2024/08/17 11:39:00,17-08-2024 11.56,2024-08-17 12:04:55,17.65,26.0
08-10-2024 09.51,08-10-2024 10.10,2024-10-08 10:23:26,19.16,30.0
29-10-2024 13.04,29-10-2024 13.29,2024-10-29 13:31:42,25.69,53.0
,09-09-2023 10.05,2023-09-09 10:07:02,24.98,43.0
16-07-2024 09.38,16-07-2024 09.49,2024-07-16 10:01:08,11.08,10.0
2023/03/15 09:46:00,15-03-2023 09.47,2023-03-15 09:52:45,1.05,10.0
21-09-2024 13.00,21-09-2024 13.01,2024-09-21 13:02:00,1.0,25.0
27-07-2023 11.48,27-07-2023 12.02,2023-07-27 12:07:26,14.33,27.0
09-02-2023 14.03,09-02-2023 14.17,2023-02-09 14:31:39,,25.0
25-04-2023 11.41,25-04-2023 12.04,2023-04-25 12:18:19,23.67,32.0
14-02-2023 14.10,14-02-2023 14.16,2023-02-14 14:20:29,6.25,17.0
13-07-2024 13.00,13-07-2024 13.01,2024-07-13 13:02:00,1.0,32.0
30-04-2024 13.46,30-04-2024 14.03,2024-04-30 14:08:31,17.62,33.0
21-09-2024 12.43,21-09-2024 12.59,2024-09-21 13:00:00,16.0,40.0
27-04-2024 11.27,27-04-2024 11.43,2024-04-27 11:53:36,16.62,29.0
25-06-2024 09.39,25-06-2024 10.01,2024-06-25 10:17:03,22.78,31.0
2024/10/12 11:22:00,12-10-2024 11.45,2024-10-12 12:01:12,23.75,28.0
02-03-2024 11.46,02-03-2024 12.16,2024-03-02 12:26:29,30.63,35.0
10-02-2024 10.26,10-02-2024 10.51,2024-02-10 10:56:17,25.28,62.0
18-04-2023 09.33,18-04-2023 10.01,2023-04-18 10:06:29,28.36,53.0
15-04-2024 13.51,15-04-2024 14.00,2024-04-15 14:10:06,9.46,25.0
30-11-2024 13.00,30-11-2024 13.01,2024-11-30 13:02:00,1.0,25.0
04-11-2023 11.39,04-11-2023 12.11,2023-11-04 12:15:05,32.85,53.0
28-05-2024 09.42,28-05-2024 10.01,2024-05-28 10:15:20,19.71,22.0
16-03-2024 12.44,16-03-2024 12.54,2024-03-16 12:58:20,10.98,19.0
02-02-2024 10.56,02-02-2024 11.19,2024-02-02 11:34:56,23.08,31.0
07-10-2023 09.14,07-10-2023 09.34,2023-10-07 09:50:53,20.01,24.0
,26-02-2024 13.04,2024-02-26 13:11:56,14.6,32.0
14-10-2023 13.00,14-10-2023 13.01,2023-10-14 13:02:00,1.0,25.0
15-03-2023 11.13,15-03-2023 11.41,2023-03-15 11:46:10,28.25,41.0
06-12-2023 10.27,06-12-2023 10.28,2023-12-06 10:30:34,1.0,32.0
03-04-2024 10.27,03-04-2024 10.34,2024-04-03 10:38:58,7.07,32.0
,06-07-2024 10.55,2024-07-06 11:08:07,17.59,42.0
16-07-2024 14.40,16-07-2024 15.00,2024-07-16 15:11:48,20.81,26.0
07-09-2023 11.48,07-09-2023 12.04,2023-09-07 12:08:28,16.23,27.0
2024/09/13 10:52:00,13-09-2024 11.14,2024-09-13 11:27:02,22.46,25.0
25-07-2023 10.04,25-07-2023 10.05,2023-07-25 10:11:47,1.0,10.0
03-06-2023 12.41,03-06-2023 12.45,2023-06-03 12:55:10,4.34,40.0
12-03-2024 15.05,12-03-2024 15.36,2024-03-12 15:45:00,31.22,43.0
15-09-2023 09.48,15-09-2023 10.07,2023-09-15 10:21:06,19.61,38.0
2023/05/24 11:51:00,24-05-2023 12.25,2023-05-24 12:31:11,34.1,48.0
03-04-2024 12.00,03-04-2024 12.14,2024-04-03 12:19:42,14.82,27.0
2023/07/20 09:51:00,20-07-2023 10.05,2023-07-20 10:19:30,14.2,10.0
05-09-2023 13.39,05-09-2023 13.51,2023-09-05 14:02:01,12.45,32.0
13-04-2024 13.00,13-04-2024 13.01,2024-04-13 13:02:00,1.0,33.0
2023/08/30 15:45:00,30-08-2023 15.46,2023-08-30 15:47:00,1.0,25.0
29-03-2023 10.35,29-03-2023 10.52,2023-03-29 11:09:02,17.41,32.0
16-05-2023 10.22,16-05-2023 10.32,2023-05-16 10:40:00,10.76,32.0
28-11-2023 09.10,28-11-2023 09.35,2023-11-28 09:46:43,25.75,21.0
2023/02/25 11:53:00,25-02-2023 12.08,2023-02-25 12:20:22,15.24,19.0
23-01-2024 15.30,23-01-2024 15.44,2024-01-23 15:45:00,14.0,32.0
26-11-2024 15.45,26-11-2024 15.46,2024-11-26 15:47:00,1.0,25.0
2023/09/11 14:11:00,11-09-2023 14.34,2023-09-11 14:47:31,23.75,31.0
31-05-2023 14.30,31-05-2023 14.56,2023-05-31 14:59:16,26.6,47.0
05-10-2024 12.27,05-10-2024 12.31,2024-10-05 12:36:49,4.33,40.0
30-05-2023 14.44,30-05-2023 15.04,2023-05-30 15:15:08,20.01,41.0
27-10-2023 13.08,27-10-2023 13.28,2023-10-27 13:39:26,20.94,30.0
2023/04/15 12:17:00,15-04-2023 12.26,2023-04-15 12:36:10,9.89,32.0
15-04-2024 12.06,15-04-2024 12.12,2024-04-15 12:23:07,6.87,32.0
11-01-2024 13.08,11-01-2024 13.27,2024-01-11 13:41:01,19.15,42.0
02-05-2023 09.47,02-05-2023 10.15,2023-05-02 10:24:28,28.33,47.0
03-02-2023 09.17,03-02-2023 09.41,2023-02-03 09:48:20,24.9,38.0
2023/02/22 11:07:00,22-02-2023 11.29,2023-02-22 11:42:28,22.36,26.0
20-06-2024 14.37,20-06-2024 14.50,2024-06-20 15:05:33,12.86,0.0
24-09-2024 11.57,24-09-2024 12.36,2024-09-24 12:44:19,39.49,57.0
13-03-2024 12.25,13-03-2024 12.35,2024-03-13 12:43:49,10.58,40.0
17-06-2024 13.37,17-06-2024 14.05,2024-06-17 14:10:54,27.62,38.0
,16-10-2023 14.35,2023-10-16 14:45:05,38.42,47.0
,26-07-2024 09.48,2024-07-26 09:59:20,13.42,36.0
15-01-2024 10.38,15-01-2024 10.47,2024-01-15 10:57:23,9.95,32.0
13-03-2023 11.43,13-03-2023 12.08,2023-03-13 12:23:40,,22.0
07-10-2024 9.00,07-10-2024 09.23,2024-10-07 09:36:55,23.97,21.0
2023/12/23 13:00:00,23-12-2023 13.01,2023-12-23 13:02:00,1.0,26.0
05-01-2024 12.47,05-01-2024 13.07,2024-01-05 13:19:46,20.44,29.0
08-04-2024 10.08,08-04-2024 10.26,2024-04-08 10:44:31,18.68,32.0
26-06-2023 10.46,26-06-2023 10.47,2023-06-26 10:48:41,1.0,32.0
29-02-2024 12.17,29-02-2024 12.47,2024-02-29 13:05:18,30.5,54.0
22-07-2023 12.05,22-07-2023 12.20,2023-07-22 12:26:24,15.83,23.0
28-01-2023 09.00,28-01-2023 09.18,2023-01-28 09:25:13,18.36,38.0
23-11-2023 11.43,23-11-2023 12.03,2023-11-23 12:12:42,20.38,31.0
2024/08/24 12:10:00,24-08-2024 12.28,2024-08-24 12:39:29,18.47,15.0
2023/05/20 13:00:00,20-05-2023 13.01,2023-05-20 13:02:00,1.0,25.0
2024/11/07 15:15:00,07-11-2024 15.24,2024-11-07 15:32:10,9.35,12.0
01-08-2023 11.39,01-08-2023 11.57,2023-08-01 12:07:17,18.39,31.0
2023/01/30 12:01:00,30-01-2023 12.31,2023-01-30 12:54:58,30.83,26.0
20-03-2024 14.08,20-03-2024 14.15,2024-03-20 14:30:55,7.56,25.0
05-11-2024 12.55,05-11-2024 13.09,2024-11-05 13:22:35,14.45,22.0
28-06-2024 12.55,28-06-2024 13.16,2024-06-28 13:26:28,21.23,29.0
28-04-2023 10.21,28-04-2023 10.29,2023-04-28 10:36:13,8.24,32.0
24-05-2024 13.53,24-05-2024 14.07,2024-05-24 14:26:18,14.37,28.0
01-04-2024 09.46,01-04-2024 09.55,2024-04-01 09:59:22,9.47,18.0
29-05-2023 10.57,29-05-2023 11.26,2023-05-29 11:33:19,29.32,56.0
23-02-2023 11.19,23-02-2023 11.41,2023-02-23 11:50:27,22.13,600.0
2023/07/11 09:41:00,11-07-2023 10.12,2023-07-11 10:17:17,31.36,29.0
16-03-2024 10.41,16-03-2024 11.00,2024-03-16 11:20:48,19.98,32.0
15-09-2023 09.17,15-09-2023 09.19,2023-09-15 09:24:03,2.43,13.0
29-06-2024 13.00,29-06-2024 13.01,2024-06-29 13:02:00,1.0,21.0
2023/04/24 12:08:00,24-04-2023 12.22,2023-04-24 12:33:33,14.92,20.0
24-01-2024 11.10,24-01-2024 11.31,2024-01-24 11:44:39,21.92,34.0
19-01-2023 12.48,19-01-2023 13.09,2023-01-19 13:25:50,21.83,41.0
04-10-2024 13.55,04-10-2024 14.14,2024-10-04 14:25:04,19.71,44.0
19-04-2024 14.26,19-04-2024 14.47,2024-04-19 14:55:43,21.72,22.0
01-02-2024 10.25,01-02-2024 10.41,2024-02-01 10:51:07,16.55,19.0
26-01-2024 10.16,26-01-2024 10.31,2024-01-26 10:35:33,15.14,18.0
01-07-2024 13.54,01-07-2024 14.06,2024-07-01 14:17:22,12.52,25.0
04-06-2024 12.24,04-06-2024 12.43,2024-06-04 12:56:03,19.51,33.0
14-03-2023 09.35,14-03-2023 09.54,2023-03-14 10:09:46,19.23,45.0
23-08-2023 12.37,23-08-2023 12.48,2023-08-23 12:57:22,11.45,40.0
10-08-2024 13.00,10-08-2024 13.01,2024-08-10 13:02:00,1.0,27.0
,18-02-2023 13.01,2023-02-18 13:02:00,1.0,54.0
17-04-2024 12.13,17-04-2024 12.45,2024-04-17 13:00:54,32.1,38.0
23-03-2023 10.34,23-03-2023 10.51,2023-03-23 11:03:37,17.83,18.0
12-06-2024 14.10,12-06-2024 14.34,2024-06-12 14:42:46,24.3,32.0
29-11-2024 15.37,29-11-2024 15.44,2024-11-29 15:45:00,7.0,43.0
26-08-2024 14.31,26-08-2024 14.57,2024-08-26 15:05:34,26.17,45.0
27-06-2024 11.02,27-06-2024 11.31,2024-06-27 11:44:38,29.38,30.0
16-10-2024 10.10,16-10-2024 10.25,2024-10-16 10:43:58,15.03,
02-03-2024 09.05,02-03-2024 09.32,2024-03-02 09:40:19,27.23,33.0
24-06-2024 11.59,24-06-2024 12.20,2024-06-24 12:26:59,21.75,36.0
28-12-2023 13.44,28-12-2023 14.03,2023-12-28 14:14:44,19.97,15.0
26-02-2024 12.26,26-02-2024 12.46,2024-02-26 12:50:02,20.18,36.0
13-09-2023 9.23,13-09-2023 09.40,2023-09-13 09:50:04,17.68,40.0
28-10-2023 13.00,28-10-2023 13.01,2023-10-28 13:02:00,1.0,29.0
13-08-2024 09.30,13-08-2024 09.53,2024-08-13 10:12:06,23.4,40.0
30-07-2024 14.21,30-07-2024 14.28,2024-07-30 14:33:48,7.15,17.0
21-06-2024 10.59,21-06-2024 11.29,2024-06-21 11:41:34,30.23,19.0
05-08-2024 13.07,05-08-2024 13.25,2024-08-05 13:39:32,18.77,42.0
04-03-2024 11.31,04-03-2024 12.00,2024-03-04 12:10:11,,25.0
2023/08/28 10:53:00,28-08-2023 11.02,2023-08-28 11:10:48,9.78,19.0
2024/08/07 09:19:00,07-08-2024 09.47,2024-08-07 10:05:45,28.41,
27-09-2024 12.12,27-09-2024 12.37,2024-09-27 12:55:02,25.78,30.0
26-01-2024 12.24,26-01-2024 12.45,2024-01-26 13:05:40,21.37,40.0
11-03-2023 13.00,11-03-2023 13.01,2023-03-11 13:02:00,1.0,25.0
23-11-2024 13.00,23-11-2024 13.01,2024-11-23 13:02:00,1.0,25.0
26-07-2023 13.42,26-07-2023 14.13,2023-07-26 14:24:08,31.56,37.0
28-07-2023 12.27,28-07-2023 12.50,2023-07-28 13:00:29,23.22,37.0
17-02-2024 10.33,17-02-2024 11.01,2024-02-17 11:16:18,28.95,40.0
2023/10/31 10:38:00,31-10-2023 11.01,2023-10-31 11:29:32,23.73,40.0
15-03-2024 15.26,15-03-2024 15.44,2024-03-15 15:45:00,18.0,43.0
13-05-2023 10.31,13-05-2023 11.00,2023-05-13 11:12:34,29.11,20.0
05-06-2024 09.17,05-06-2024 09.36,2024-06-05 09:59:14,19.33,30.0
13-09-2023 13.03,13-09-2023 13.38,2023-09-13 13:41:04,35.91,53.0
09-06-2023 14.09,09-06-2023 14.22,2023-06-09 14:36:08,13.22,25.0
2024/02/21 09:48:00,21-02-2024 10.17,2024-02-21 10:20:54,29.48,63.0
10-10-2023 10.59,10-10-2023 11.34,2023-10-10 11:46:14,35.61,42.0
04-02-2023 12.37,04-02-2023 12.54,2023-02-04 13:00:00,17.22,16.0
13-08-2024 10.39,13-08-2024 10.48,2024-08-13 10:53:54,9.46,24.0
2024/08/22 10:58:00,22-08-2024 11.29,2024-08-22 11:41:08,31.51,39.0
2024/10/16 14:02:00,16-10-2024 14.10,2024-10-16 14:24:49,8.38,25.0
20-08-2024 13.08,20-08-2024 13.22,2024-08-20 13:35:02,14.39,200.0
21-08-2023 10.01,21-08-2023 10.21,2023-08-21 10:35:49,20.47,30.0
,13-06-2023 15.08,2023-06-13 15:14:36,26.86,58.0
10-01-2023 15.15,10-01-2023 15.28,2023-01-10 15:44:48,13.79,21.0
,16-10-2024 12.09,2024-10-16 12:25:59,26.03,36.0
2024/01/25 12:36:00,25-01-2024 13.01,2024-01-25 13:12:48,25.49,35.0
2023/03/30 11:49:00,30-03-2023 12.07,2023-03-30 12:19:09,18.84,25.0
2023/12/15 15:11:00,15-12-2023 15.19,2023-12-15 15:29:00,8.68,27.0
02-03-2023 12.36,02-03-2023 12.45,2023-03-02 12:55:46,9.02,40.0
04-03-2024 14.30,04-03-2024 14.57,2024-03-04 15:08:32,27.8,47.0
21-04-2023 10.02,21-04-2023 10.31,2023-04-21 10:39:34,29.97,47.0
22-08-2024 11.42,22-08-2024 12.06,2024-08-22 12:15:01,24.78,30.0
17-08-2024 11.24,17-08-2024 11.38,2024-08-17 11:51:08,14.25,194.0
19-07-2024 09.37,19-07-2024 09.57,2024-07-19 10:08:48,20.96,37.0
17-05-2023 14.48,17-05-2023 14.56,2023-05-17 15:09:54,8.27,32.0
2023/03/21 12:19:00,21-03-2023 12.30,2023-03-21 12:33:56,11.88,19.0
29-03-2023 9.17,29-03-2023 09.35,2023-03-29 09:46:29,18.4,26.0
2024/02/24 12:12:00,24-02-2024 12.32,2024-02-24 12:36:21,20.46,23.0
07-05-2024 12.19,07-05-2024 12.34,2024-05-07 12:45:06,15.09,40.0
11-05-2023 10.16,11-05-2023 10.24,2023-05-11 10:33:15,8.09,32.0
13-01-2024 11.20,13-01-2024 11.41,2024-01-13 12:01:41,21.0,34.0
11-12-2023 10.00,11-12-2023 10.29,2023-12-11 10:40:11,29.98,26.0
06-09-2024 12.03,06-09-2024 12.25,2024-09-06 12:26:05,22.09,52.0
29-11-2023 11.24,29-11-2023 11.49,2023-11-29 12:02:13,24.74,70.0
12-04-2024 12.59,12-04-2024 13.29,2024-04-12 13:42:51,30.38,45.0
2023/01/27 11:31:00,27-01-2023 11.48,2023-01-27 12:01:38,17.23,31.0
19-01-2024 12.17,19-01-2024 12.39,2024-01-19 12:50:13,22.22,30.0
2023/02/21 11:07:00,21-02-2023 11.24,2023-02-21 11:38:52,17.93,33.0
2023/09/12 14:53:00,12-09-2023 15.15,2023-09-12 15:28:58,22.94,33.0
2024/09/24 11:52:00,24-09-2024 12.07,2024-09-24 12:17:53,15.09,25.0
27-05-2023 11.59,27-05-2023 12.18,2023-05-27 12:30:27,19.01,38.0
2024/06/17 12:34:00,17-06-2024 12.49,2024-06-17 12:54:32,14.51,43.0
2024/07/26 12:21:00,26-07-2024 12.48,2024-07-26 12:56:13,27.56,28.0
2023/10/14 13:00:00,14-10-2023 13.01,2023-10-14 13:02:00,,25.0
08-05-2024 11.13,08-05-2024 11.42,2024-05-08 11:49:38,29.6,56.0
04-01-2024 11.40,04-01-2024 12.05,2024-01-04 12:19:01,25.44,32.0
,03-04-2024 11.15,2024-04-03 11:25:37,12.95,24.0
2023/02/13 10:07:00,13-02-2023 10.29,2023-02-13 10:38:29,22.21,28.0
01-09-2023 13.32,01-09-2023 13.54,2023-09-01 14:13:02,22.88,43.0
11-01-2024 12.45,11-01-2024 13.17,2024-01-11 13:33:10,32.38,51.0
06-01-2023 14.58,06-01-2023 15.27,2023-01-06 15:37:53,29.57,46.0
20-11-2024 14.04,20-11-2024 14.24,2024-11-20 14:34:48,19.98,46.0
18-05-2023 11.56,18-05-2023 12.26,2023-05-18 12:46:34,30.15,26.0
2023/01/25 10:40:00,25-01-2023 10.59,2023-01-25 11:09:46,19.0,20.0
2024/01/22 09:36:00,22-01-2024 09.52,2024-01-22 10:01:26,16.63,15.0
2023/08/30 11:01:00,30-08-2023 11.27,2023-08-30 11:38:30,26.32,39.0
13-06-2024 09.47,13-06-2024 10.17,2024-06-13 10:18:14,30.01,42.0
17-02-2024 13.00,17-02-2024 13.01,2024-02-17 13:02:00,1.0,25.0
15-11-2024 10.59,15-11-2024 11.20,2024-11-15 11:24:48,21.42,19.0
05-09-2023 13.47,05-09-2023 14.09,2023-09-05 14:19:20,22.71,39.0
18-10-2024 13.22,18-10-2024 13.48,2024-10-18 13:52:39,26.49,37.0
26-08-2023 13.00,26-08-2023 13.01,2023-08-26 13:02:00,1.0,25.0
2023/04/26 14:12:00,26-04-2023 14.36,2023-04-26 14:47:08,24.96,22.0
14-02-2023 12.03,14-02-2023 12.22,2023-02-14 12:29:23,,32.0
28-12-2023 14.10,28-12-2023 14.29,2023-12-28 14:40:42,19.09,38.0
09-08-2024 11.15,09-08-2024 11.50,2024-08-09 12:01:24,35.04,36.0
21-09-2023 12.32,21-09-2023 12.59,2023-09-21 13:08:11,27.88,23.0
22-01-2024 13.30,22-01-2024 13.52,2024-01-22 14:06:23,22.17,26.0
10-06-2023 12.37,10-06-2023 12.56,2023-06-10 13:00:00,,37.0
28-12-2023 11.20,28-12-2023 11.35,2023-12-28 11:54:20,15.44,31.0
07-08-2024 14.12,07-08-2024 14.35,2024-08-07 14:47:57,23.36,28.0
2024/05/30 13:10:00,30-05-2024 13.35,2024-05-30 13:43:04,25.38,45.0
09-10-2024 15.45,09-10-2024 15.46,2024-10-09 15:47:00,1.0,25.0
20-08-2024 12.14,20-08-2024 12.29,2024-08-20 12:34:31,15.11,21.0
23-02-2024 11.02,23-02-2024 11.24,2024-02-23 11:38:10,22.01,49.0
08-05-2023 10.55,08-05-2023 11.18,2023-05-08 11:33:17,23.89,31.0
09-02-2024 12.44,09-02-2024 13.01,2024-02-09 13:11:19,17.64,0.0
2024/03/12 10:58:00,12-03-2024 11.25,2024-03-12 11:37:34,27.77,37.0
2023/11/07 14:09:00,07-11-2023 14.27,2023-11-07 14:37:15,18.17,41.0
01-07-2024 14.37,01-07-2024 15.00,2024-07-01 15:09:54,23.73,37.0
11-03-2024 13.42,11-03-2024 13.51,2024-03-11 13:59:57,9.2,43.0
27-01-2023 15.45,27-01-2023 15.46,2023-01-27 15:47:00,1.0,25.0
17-10-2024 12.16,17-10-2024 12.30,2024-10-17 12:33:49,14.76,25.0
07-11-2023 10.54,07-11-2023 11.14,2023-11-07 11:28:10,20.3,29.0
2023/09/11 10:44:00,11-09-2023 11.06,2023-09-11 11:13:44,22.16,29.0
28-03-2023 15.32,28-03-2023 15.44,2023-03-28 15:45:00,12.0,38.0
21-10-2023 12.36,21-10-2023 12.42,2023-10-21 12:43:19,6.33,19.0
04-08-2023 14.53,04-08-2023 15.07,2023-08-04 15:16:57,14.45,42.0
05-05-2023 13.17,05-05-2023 13.36,2023-05-05 13:45:24,19.57,200.0
2024/02/29 10:25:00,29-02-2024 10.55,2024-02-29 11:10:07,30.04,31.0
29-06-2023 15.20,29-06-2023 15.38,2023-06-29 15:45:00,18.57,22.0
18-09-2024 15.26,18-09-2024 15.44,2024-09-18 15:45:00,18.0,40.0
16-09-2023 12.43,16-09-2023 12.57,2023-09-16 13:00:00,14.38,29.0
2024/06/22 13:00:00,22-06-2024 13.01,2024-06-22 13:02:00,1.0,29.0
09-09-2023 13.00,09-09-2023 13.01,2023-09-09 13:02:00,1.0,23.0
27-02-2024 11.22,27-02-2024 11.55,2024-02-27 12:17:06,33.81,45.0
10-05-2023 11.47,10-05-2023 12.13,2023-05-10 12:29:47,26.64,22.0
07-08-2024 09.48,07-08-2024 10.03,2024-08-07 10:18:23,15.26,15.0
2023/12/19 12:18:00,19-12-2023 12.30,2023-12-19 12:38:09,12.73,40.0
20-03-2024 13.24,20-03-2024 14.03,2024-03-20 14:12:46,39.11,46.0
23-11-2024 13.00,23-11-2024 13.01,2024-11-23 13:02:00,1.0,
01-02-2023 10.12,01-02-2023 10.26,2023-02-01 10:36:50,14.01,19.0
20-11-2024 11.09,20-11-2024 11.31,2024-11-20 11:43:45,22.57,17.0
26-10-2023 13.30,26-10-2023 13.50,2023-10-26 13:51:14,20.25,20.0
2023/10/19 10:16:00,19-10-2023 10.22,2023-10-19 10:33:28,6.62,5.0
19-01-2023 11.49,19-01-2023 12.07,2023-01-19 12:17:02,18.67,25.0
29-02-2024 09.31,29-02-2024 09.47,2024-02-29 09:56:39,16.24,20.0
29-11-2024 13.45,29-11-2024 14.07,2024-11-29 14:28:24,22.88,36.0
10-09-2024 13.51,10-09-2024 14.05,2024-09-10 14:15:14,14.64,32.0
06-09-2023 13.59,06-09-2023 14.20,2023-09-06 14:33:24,21.35,
20-03-2024 12.57,20-03-2024 13.20,2024-03-20 13:29:17,23.96,29.0
04-08-2023 15.27,04-08-2023 15.44,2023-08-04 15:45:00,17.0,39.0
20-06-2023 11.52,20-06-2023 12.16,2023-06-20 12:28:31,24.37,24.0
2024/08/01 12:21:00,01-08-2024 12.36,2024-08-01 12:41:05,15.44,32.0
15-07-2023 09.04,15-07-2023 09.31,2023-07-15 09:44:44,27.31,35.0
24-10-2024 09.49,24-10-2024 09.59,2024-10-24 10:12:30,10.8,10.0
11-04-2024 13.50,11-04-2024 13.57,2024-04-11 14:04:42,7.47,43.0
22-05-2024 13.56,22-05-2024 14.16,2024-05-22 14:31:00,20.17,25.0
20-02-2023 13.35,20-02-2023 13.54,2023-02-20 14:05:49,19.45,36.0
17-09-2024 09.50,17-09-2024 10.05,2024-09-17 10:21:41,15.81,10.0
02-10-2024 11.05,02-10-2024 11.29,2024-10-02 11:38:55,24.16,34.0
2024/11/28 12:43:00,28-11-2024 13.09,2024-11-28 13:29:16,26.93,40.0
2024/05/14 12:34:00,14-05-2024 13.00,2024-05-14 13:09:52,26.75,
22-09-2023 11.03,22-09-2023 11.21,2023-09-22 11:33:19,18.44,42.0
2024/09/24 13:59:00,24-09-2024 14.17,2024-09-24 14:22:15,18.58,36.0
2023/08/14 10:31:00,14-08-2023 10.37,2023-08-14 10:49:41,6.06,32.0
29-05-2023 11.52,29-05-2023 12.13,2023-05-29 12:26:35,21.53,56.0
11-03-2024 09.18,11-03-2024 09.28,2024-03-11 09:43:14,10.46,27.0
02-03-2024 09.53,02-03-2024 10.11,2024-03-02 10:21:17,18.03,26.0
24-09-2024 13.42,24-09-2024 13.51,2024-09-24 14:01:26,9.3,25.0
06-04-2024 10.46,06-04-2024 10.58,2024-04-06 11:07:44,12.19,24.0
07-11-2024 10.20,07-11-2024 10.50,2024-11-07 10:57:27,30.67,45.0
2024/08/20 15:09:00,20-08-2024 15.33,2024-08-20 15:42:39,24.02,32.0
09-01-2023 13.42,09-01-2023 14.08,2023-01-09 14:11:39,26.22,37.0
27-07-2023 15.26,27-07-2023 15.44,2023-07-27 15:45:00,18.0,40.0
22-10-2024 15.45,22-10-2024 15.46,2024-10-22 15:47:00,1.0,25.0
28-02-2024 11.19,28-02-2024 11.34,2024-02-28 11:45:42,15.25,39.0
2024/09/20 14:57:00,20-09-2024 15.22,2024-09-20 15:43:38,25.45,32.0
25-04-2023 09.44,25-04-2023 10.03,2023-04-25 10:17:25,19.99,31.0
18-11-2024 15.45,18-11-2024 15.46,2024-11-18 15:47:00,1.0,25.0
22-06-2024 10.02,22-06-2024 10.23,2024-06-22 10:29:17,21.38,40.0
18-07-2024 13.07,18-07-2024 13.18,2024-07-18 13:29:52,11.78,27.0
28-09-2024 13.00,28-09-2024 13.01,2024-09-28 13:02:00,1.0,47.0
06-12-2023 10.31,06-12-2023 10.55,2023-12-06 11:04:32,24.34,29.0
04-10-2024 13.34,04-10-2024 13.58,2024-10-04 14:03:37,24.81,48.0
30-05-2024 10.41,30-05-2024 11.04,2024-05-30 11:15:24,23.56,40.0
30-04-2024 12.36,30-04-2024 12.37,2024-04-30 12:48:41,1.03,3.0
09-08-2023 11.54,09-08-2023 12.19,2023-08-09 12:28:37,25.03,29.0
21-10-2024 12.19,21-10-2024 12.42,2024-10-21 12:44:57,23.41,31.0
07-01-2023 10.19,07-01-2023 10.24,2023-01-07 10:28:10,5.47,32.0
01-01-2024 13.21,01-01-2024 13.39,2024-01-01 13:55:13,18.02,42.0
16-08-2023 14.10,16-08-2023 14.32,2023-08-16 14:39:51,22.11,44.0
27-11-2024 11.02,27-11-2024 11.29,2024-11-27 11:35:00,26.71,30.0
04-04-2023 13.05,04-04-2023 13.20,2023-04-04 13:33:43,16.0,9.0
16-12-2023 10.08,16-12-2023 10.27,2023-12-16 10:48:50,19.49,0.0
2023/07/15 10:10:00,15-07-2023 10.36,2023-07-15 10:45:42,26.67,30.0
10-11-2023 09.03,10-11-2023 09.22,2023-11-10 09:33:13,19.01,39.0
21-03-2023 14.24,21-03-2023 14.35,2023-03-21 14:40:39,11.7,29.0
12-12-2023 15.23,12-12-2023 15.43,2023-12-12 15:45:00,20.02,28.0
23-05-2023 12.21,23-05-2023 12.47,2023-05-23 13:01:16,26.62,44.0
29-03-2024 12.26,29-03-2024 12.44,2024-03-29 12:55:34,18.53,35.0
02-03-2023 15.36,02-03-2023 15.44,2023-03-02 15:45:00,8.0,57.0
24-05-2023 12.27,24-05-2023 13.00,2023-05-24 13:13:50,33.86,54.0
20-10-2023 15.35,20-10-2023 15.44,2023-10-20 15:45:00,,57.0
08-08-2023 10.43,08-08-2023 11.01,2023-08-08 11:12:47,18.13,24.0
26-08-2024 10.02,26-08-2024 10.16,2024-08-26 10:30:36,14.48,10.0
28-03-2023 13.45,28-03-2023 14.02,2023-03-28 14:09:36,17.06,32.0
2023/09/16 11:52:00,16-09-2023 12.08,2023-09-16 12:18:54,16.56,47.0
23-05-2024 12.26,23-05-2024 12.58,2024-05-23 13:15:48,32.38,62.0
2023/04/17 15:04:00,17-04-2023 15.29,2023-04-17 15:37:57,25.74,23.0
10-05-2024 14.46,10-05-2024 14.55,2024-05-10 15:09:09,9.32,19.0
23-03-2024 10.39,23-03-2024 10.45,2024-03-23 10:54:50,6.69,32.0
08-03-2024 14.15,08-03-2024 14.52,2024-03-08 15:01:21,37.27,46.0
06-06-2024 11.47,06-06-2024 12.04,2024-06-06 12:10:26,17.8,28.0
24-07-2023 12.03,24-07-2023 12.21,2023-07-24 12:38:57,18.95,33.0
17-03-2023 14.09,17-03-2023 14.43,2023-03-17 15:02:21,33.73,34.0
16-08-2023 13.38,16-08-2023 13.53,2023-08-16 14:01:25,15.25,12.0
25-07-2024 12.20,25-07-2024 12.38,2024-07-25 12:51:11,18.39,18.0
2023/07/13 12:56:00,13-07-2023 13.23,2023-07-13 13:36:56,27.45,57.0
20-05-2023 12.27,20-05-2023 12.57,2023-05-20 13:00:00,30.31,33.0
10-08-2024 09.00,10-08-2024 09.24,2024-08-10 09:36:11,24.13,34.0
05-06-2024 15.25,05-06-2024 15.44,2024-06-05 15:45:00,19.0,47.0
07-04-2023 10.58,07-04-2023 11.27,2023-04-07 11:38:40,29.9,19.0
2023/01/18 12:12:00,18-01-2023 12.37,2023-01-18 12:52:47,25.4,44.0
04-04-2024 12.18,04-04-2024 12.35,2024-04-04 12:41:05,17.38,33.0
03-06-2024 12.09,03-06-2024 12.28,2024-06-03 12:41:33,19.57,16.0
12-07-2023 13.09,12-07-2023 13.29,2023-07-12 13:35:54,20.41,25.0
29-05-2023 13.58,29-05-2023 14.20,2023-05-29 14:29:26,22.14,44.0
12-09-2024 15.45,12-09-2024 15.46,2024-09-12 15:47:00,1.0,25.0
2023/08/29 11:29:00,29-08-2023 11.52,2023-08-29 12:08:08,23.16,1000.0
11-04-2023 11.52,11-04-2023 12.09,2023-04-11 12:23:04,17.52,33.0
20-08-2024 12.46,20-08-2024 12.52,2024-08-20 12:56:57,6.04,40.0
21-04-2023 11.31,21-04-2023 11.35,2023-04-21 11:42:05,4.79,1.0
22-03-2024 10.25,22-03-2024 10.26,2024-03-22 10:31:35,1.99,32.0
2024/06/20 13:57:00,20-06-2024 14.23,2024-06-20 14:29:01,26.4,49.0
31-01-2023 13.07,31-01-2023 13.26,2023-01-31 13:41:18,19.15,42.0
28-04-2023 09.00,28-04-2023 09.33,2023-04-28 09:42:58,33.46,46.0
13-08-2024 14.50,13-08-2024 15.08,2024-08-13 15:21:42,18.7,23.0
21-08-2024 10.35,21-08-2024 11.03,2024-08-21 11:15:04,27.88,22.0
29-07-2023 13.00,29-07-2023 13.01,2023-07-29 13:02:00,1.0,44.0
03-02-2023 09.27,03-02-2023 09.46,2023-02-03 10:07:04,19.96,21.0
2024/01/24 12:57:00,24-01-2024 13.16,2024-01-24 13:26:00,19.23,29.0
21-09-2023 10.29,21-09-2023 10.40,2023-09-21 10:52:34,11.74,32.0
19-06-2023 12.48,19-06-2023 13.08,2023-06-19 13:23:54,20.78,31.0
01-04-2024 9.57,01-04-2024 10.18,2024-04-01 10:34:05,21.63,33.0
18-05-2023 11.59,18-05-2023 12.25,2023-05-18 12:42:06,26.26,36.0
04-10-2024 12.01,04-10-2024 12.21,2024-10-04 12:29:58,20.84,31.0
18-11-2023 12.10,18-11-2023 12.35,2023-11-18 12:46:39,25.01,28.0
01-09-2023 15.34,01-09-2023 15.44,2023-09-01 15:45:00,10.0,25.0
2023/10/19 09:06:00,19-10-2023 09.33,2023-10-19 09:50:26,27.07,38.0
13-05-2024 11.42,13-05-2024 12.07,2024-05-13 12:10:38,25.51,32.0
23-09-2023 13.00,23-09-2023 13.01,2023-09-23 13:02:00,1.0,14.0
23-05-2023 10.23,23-05-2023 10.42,2023-05-23 10:52:33,19.51,19.0
28-07-2023 10.20,28-07-2023 10.28,2023-07-28 10:34:04,8.64,32.0
06-08-2024 14.33,06-08-2024 15.01,2024-08-06 15:18:31,28.91,53.0
16-10-2023 14.48,16-10-2023 15.10,2023-10-16 15:20:35,22.81,34.0
15-02-2023 09.49,15-02-2023 10.01,2023-02-15 10:21:37,12.7,19.0
16-09-2023 12.11,16-09-2023 12.37,2023-09-16 12:49:20,26.65,22.0
2024/01/15 14:44:00,15-01-2024 14.56,2024-01-15 15:16:52,12.92,15.0
04-07-2023 13.30,04-07-2023 13.55,2023-07-04 14:12:00,25.13,43.0
05-09-2024 13.51,05-09-2024 14.12,2024-09-05 14:21:25,21.3,38.0
01-07-2024 13.51,01-07-2024 14.14,2024-07-01 14:23:12,23.69,51.0
02-09-2024 12.33,02-09-2024 12.40,2024-09-02 12:49:17,7.57,40.0
20-05-2023 12.45,20-05-2023 12.59,2023-05-20 13:00:00,14.0,41.0
16-08-2024 10.20,16-08-2024 10.32,2024-08-16 10:44:44,12.13,32.0
26-06-2023 13.56,26-06-2023 14.13,2023-06-26 14:18:14,17.32,8.0
02-08-2024 11.55,02-08-2024 12.20,2024-08-02 12:28:29,25.45,32.0
28-08-2024 09.21,28-08-2024 09.45,2024-08-28 09:58:42,24.16,21.0
2023/12/18 10:10:00,18-12-2023 10.37,2023-12-18 10:53:16,27.04,24.0
28-09-2024 10.50,28-09-2024 11.09,2024-09-28 11:22:47,19.95,16.0
30-08-2023 12.31,30-08-2023 12.48,2023-08-30 13:03:12,17.67,32.0
31-05-2023 12.31,31-05-2023 12.55,2023-05-31 13:08:14,24.82,37.0
14-08-2023 14.30,14-08-2023 14.55,2023-08-14 15:00:13,25.95,47.0
27-12-2023 09.56,27-12-2023 10.10,2023-12-27 10:19:38,14.28,26.0
27-11-2023 12.14,27-11-2023 12.32,2023-11-27 12:41:05,18.4,25.0
10-07-2023 10.45,10-07-2023 11.02,2023-07-10 11:14:21,17.04,24.0
04-01-2024 09.23,04-01-2024 09.49,2024-01-04 10:02:39,26.77,31.0
28-09-2023 11.27,28-09-2023 12.01,2023-09-28 12:14:00,34.66,35.0
21-04-2023 09.08,21-04-2023 09.29,2023-04-21 09:42:10,21.01,26.0
23-12-2023 13.00,23-12-2023 13.01,2023-12-23 13:02:00,1.0,44.0
10-06-2023 12.31,10-06-2023 12.54,2023-06-10 12:58:13,22.92,15.0
21-11-2023 10.25,21-11-2023 10.37,2023-11-21 10:50:19,12.17,32.0
16-03-2023 10.25,16-03-2023 10.57,2023-03-16 11:09:43,32.54,49.0
13-07-2024 13.00,13-07-2024 13.01,2024-07-13 13:02:00,1.0,0.0
09-03-2024 09.06,09-03-2024 09.27,2024-03-09 09:38:23,21.19,32.0
25-04-2023 10.04,25-04-2023 10.33,2023-04-25 10:44:30,29.36,38.0
23-03-2023 11.09,23-03-2023 11.34,2023-03-23 11:40:10,25.17,38.0
08-05-2024 09.28,08-05-2024 09.51,2024-05-08 10:05:52,23.76,
04-02-2023 13.00,04-02-2023 13.01,2023-02-04 13:02:00,1.0,17.0
2024/05/24 09:06:00,24-05-2024 09.26,2024-05-24 09:37:38,20.66,31.0
01-08-2024 15.45,01-08-2024 15.46,2024-08-01 15:47:00,1.0,25.0
2024/08/30 12:10:00,30-08-2024 12.35,2024-08-30 12:45:14,,39.0
08-09-2023 11.50,08-09-2023 12.10,2023-09-08 12:27:02,20.38,34.0
19-08-2024 13.53,19-08-2024 14.25,2024-08-19 14:34:09,32.52,38.0
22-06-2023 11.59,22-06-2023 12.24,2023-06-22 12:35:49,25.86,47.0
08-04-2024 13.44,08-04-2024 13.54,2024-04-08 14:06:23,10.26,25.0
02-04-2024 12.33,02-04-2024 12.39,2024-04-02 12:51:09,,40.0
2024/01/04 12:46:00,04-01-2024 13.01,2024-01-04 13:16:24,15.81,29.0
17-01-2023 15.35,17-01-2023 15.44,2023-01-17 15:45:00,9.0,25.0
24-04-2024 13.03,24-04-2024 13.17,2024-04-24 13:28:14,14.92,33.0
11-12-2023 09.48,11-12-2023 10.10,2023-12-11 10:17:13,22.57,46.0
06-02-2023 14.14,06-02-2023 14.25,2023-02-06 14:38:32,11.78,0.0
18-08-2023 9.40,18-08-2023 09.55,2023-08-18 10:01:45,15.24,34.0
23-03-2024 13.00,23-03-2024 13.01,2024-03-23 13:02:00,1.0,26.0
12-01-2023 09.01,12-01-2023 09.27,2023-01-12 09:43:36,26.61,43.0
2023/06/03 10:12:00,03-06-2023 10.40,2023-06-03 11:03:11,28.82,153.0
2024/09/24 09:17:00,24-09-2024 09.43,2024-09-24 09:52:05,26.57,39.0
15-11-2023 09.16,15-11-2023 09.32,2023-11-15 09:45:34,16.15,36.0
12-10-2023 11.29,12-10-2023 11.52,2023-10-12 12:10:26,23.18,29.0
2024/05/22 15:32:00,22-05-2024 15.44,2024-05-22 15:45:00,12.0,48.0
05-03-2024 14.45,05-03-2024 14.53,2024-03-05 15:06:35,8.83,32.0
24-06-2024 12.56,24-06-2024 13.08,2024-06-24 13:17:45,12.55,17.0
20-01-2023 10.43,20-01-2023 11.02,2023-01-20 11:16:23,19.9,29.0
2023/10/06 09:18:00,06-10-2023 09.49,2023-10-06 09:51:59,31.95,56.0
2023/03/21 15:19:00,21-03-2023 15.35,2023-03-21 15:45:00,16.28,37.0
05-08-2024 10.31,05-08-2024 10.37,2024-08-05 10:48:39,6.65,32.0
25-12-2023 10.15,25-12-2023 10.53,2023-12-25 11:04:09,38.22,57.0
16-10-2024 14.17,16-10-2024 14.33,2024-10-16 14:50:53,16.67,17.0
07-08-2023 12.38,07-08-2023 12.53,2023-08-07 13:07:38,15.27,29.0
2023/02/23 10:44:00,23-02-2023 11.04,2023-02-23 11:15:40,20.67,55.0
07-09-2024 13.00,07-09-2024 13.01,2024-09-07 13:02:00,1.0,47.0
24-02-2024 13.00,24-02-2024 13.01,2024-02-24 13:02:00,1.0,7.0
28-04-2023 13.56,28-04-2023 14.12,2023-04-28 14:22:00,16.83,12.0
08-07-2023 09.49,08-07-2023 10.03,2023-07-08 10:10:35,14.68,24.0
2024/06/11 11:13:00,11-06-2024 11.36,2024-06-11 11:45:16,23.6,51.0
28-09-2024 09.04,28-09-2024 09.48,2024-09-28 09:59:27,44.96,44.0
2024/01/04 11:02:00,04-01-2024 11.24,2024-01-04 11:36:24,22.74,32.0
24-01-2024 14.40,24-01-2024 15.06,2024-01-24 15:25:12,26.09,33.0
08-08-2023 15.19,08-08-2023 15.35,2023-08-08 15:42:03,16.67,37.0
12-12-2023 10.46,12-12-2023 11.19,2023-12-12 11:33:23,33.28,37.0
02-05-2024 15.45,02-05-2024 15.46,2024-05-02 15:47:00,1.0,13.0
07-10-2024 10.04,07-10-2024 10.29,2024-10-07 10:39:31,25.85,47.0
04-09-2023 15.04,04-09-2023 15.29,2023-09-04 15:40:24,25.4,33.0
07-04-2023 12.40,07-04-2023 12.54,2023-04-07 13:05:20,14.49,40.0
19-09-2023 11.54,19-09-2023 12.03,2023-09-19 12:12:22,9.75,32.0
04-10-2023 10.29,04-10-2023 12.00,2023-10-04 12:07:54,91.29,33.0
29-05-2023 14.25,29-05-2023 14.49,2023-05-29 15:04:59,24.13,57.0
,20-05-2024 11.30,2024-05-20 11:41:37,20.91,49.0
16-03-2023 14.10,16-03-2023 14.24,2023-03-16 14:41:57,14.55,25.0
04-04-2024 09.34,04-04-2024 09.49,2024-04-04 10:03:42,15.3,
18-12-2023 14.45,18-12-2023 15.05,2023-12-18 15:15:38,20.56,54.0
30-03-2024 12.48,30-03-2024 12.59,2024-03-30 13:00:00,11.0,54.0
21-10-2024 15.00,21-10-2024 15.23,2024-10-21 15:33:31,23.3,36.0
23-02-2023 15.45,23-02-2023 15.46,2023-02-23 15:47:00,1.0,25.0
2024/05/30 09:00:00,30-05-2024 09.17,2024-05-30 09:28:40,17.47,12.0
08-07-2024 09.57,08-07-2024 10.21,2024-07-08 10:23:12,24.56,53.0
08-03-2024 14.34,08-03-2024 14.46,2024-03-08 15:04:40,11.67,0.0
2024/11/27 15:15:00,27-11-2024 15.44,2024-11-27 15:45:00,29.0,46.0
19-07-2023 10.35,19-07-2023 10.45,2023-07-19 10:55:00,10.69,18.0
2024/06/15 09:04:00,15-06-2024 09.31,2024-06-15 09:37:53,27.12,37.0
01-08-2024 10.17,01-08-2024 10.37,2024-08-01 10:57:59,20.38,32.0
,20-07-2024 09.37,2024-07-20 09:47:58,29.92,46.0
2023/09/20 10:47:00,20-09-2023 11.10,2023-09-20 11:21:47,22.52,22.0
2023/08/22 13:51:00,22-08-2023 14.25,2023-08-22 14:34:56,34.49,75.0
2024/05/29 13:40:00,29-05-2024 14.03,2024-05-29 14:15:21,23.58,29.0
09-04-2024 12.22,09-04-2024 12.28,2024-04-09 12:36:47,6.27,40.0
30-10-2023 9.36,30-10-2023 09.57,2023-10-30 10:08:54,21.15,37.0
2024/01/31 14:08:00,31-01-2024 14.22,2024-01-31 14:38:26,14.22,25.0
03-03-2023 09.35,03-03-2023 10.00,2023-03-03 10:10:09,25.23,63.0
30-07-2024 09.54,30-07-2024 10.11,2024-07-30 10:20:51,17.1,29.0
2023/11/15 09:46:00,15-11-2023 10.06,2023-11-15 10:20:22,,38.0
15-11-2023 11.52,15-11-2023 12.14,2023-11-15 12:18:26,22.06,28.0
11-03-2023 10.23,11-03-2023 10.59,2023-03-11 11:11:30,36.27,33.0
14-01-2023 11.08,14-01-2023 11.27,2023-01-14 11:34:14,19.33,48.0
28-09-2023 12.45,28-09-2023 13.07,2023-09-28 13:28:41,22.58,40.0
22-11-2023 12.37,22-11-2023 12.45,2023-11-22 12:53:53,8.87,40.0
05-06-2023 14.13,05-06-2023 14.31,2023-06-05 14:42:57,18.52,38.0
24-04-2024 14.27,24-04-2024 14.46,2024-04-24 14:57:02,19.96,54.0
2023/06/26 13:00:00,26-06-2023 13.13,2023-06-26 13:22:14,13.56,13.0
21-09-2024 13.00,21-09-2024 13.01,2024-09-21 13:02:00,1.0,57.0
28-05-2024 10.39,28-05-2024 10.40,2024-05-28 10:43:40,1.5,32.0
11-11-2023 11.40,11-11-2023 12.00,2023-11-11 12:16:55,19.32,26.0
2023/10/09 11:43:00,09-10-2023 12.09,2023-10-09 12:20:44,26.51,35.0
2023/06/02 09:00:00,02-06-2023 09.24,2023-06-02 09:36:21,24.51,28.0
14-04-2023 09.00,14-04-2023 09.16,2023-04-14 09:26:52,16.58,26.0
26-07-2023 09.15,26-07-2023 09.42,2023-07-26 09:51:59,27.73,33.0
,29-04-2024 10.21,2024-04-29 10:36:39,18.03,28.0
19-07-2023 12.56,19-07-2023 13.22,2023-07-19 13:26:19,26.03,23.0
,27-09-2024 09.23,2024-09-27 09:33:19,19.27,43.0
13-03-2024 10.36,13-03-2024 10.48,2024-03-13 11:00:11,12.17,32.0
12-04-2023 12.07,12-04-2023 12.20,2023-04-12 12:27:20,13.56,33.0
24-03-2023 09.48,24-03-2023 10.11,2023-03-24 10:29:39,23.16,10.0
08-07-2024 11.05,08-07-2024 11.15,2024-07-08 11:34:46,10.48,0.0
03-06-2023 09.09,03-06-2023 09.43,2023-06-03 09:52:37,34.22,45.0
17-02-2023 10.49,17-02-2023 11.09,2023-02-17 11:18:00,19.98,32.0
2023/11/10 10:29:00,10-11-2023 10.30,2023-11-10 10:31:50,1.0,32.0
12-02-2024 13.19,12-02-2024 13.27,2024-02-12 13:39:19,8.47,23.0
22-02-2024 12.35,22-02-2024 13.08,2024-02-22 13:17:35,32.9,36.0
09-04-2024 10.18,09-04-2024 10.29,2024-04-09 10:39:42,11.44,32.0
2023/04/07 11:21:00,07-04-2023 11.45,2023-04-07 11:55:47,24.18,34.0
28-03-2024 11.57,28-03-2024 12.20,2024-03-28 12:35:58,23.1,32.0
26-08-2023 13.00,26-08-2023 13.01,2023-08-26 13:02:00,1.0,26.0
07-11-2023 14.09,07-11-2023 14.23,2023-11-07 14:41:28,14.47,17.0
11-03-2024 15.45,11-03-2024 15.46,2024-03-11 15:47:00,1.0,28.0
2023/03/11 10:31:00,11-03-2023 10.56,2023-03-11 10:59:35,25.53,37.0
09-10-2023 11.55,09-10-2023 12.13,2023-10-09 12:30:05,17.3,10.0
,20-07-2024 12.25,2024-07-20 12:34:33,23.04,31.0
30-06-2023 09.17,30-06-2023 09.54,2023-06-30 10:00:19,37.35,42.0
17-10-2023 13.25,17-10-2023 13.46,2023-10-17 13:56:47,21.64,17.0
28-11-2024 14.24,28-11-2024 14.46,2024-11-28 15:02:38,22.31,21.0
23-07-2024 14.51,23-07-2024 15.19,2024-07-23 15:26:39,,49.0
25-01-2024 10.46,25-01-2024 10.58,2024-01-25 11:01:04,12.52,37.0
31-10-2023 12.29,31-10-2023 12.42,2023-10-31 12:53:34,13.2,40.0
08-07-2023 10.53,08-07-2023 11.17,2023-07-08 11:25:58,24.44,48.0
2023/11/27 13:58:00,27-11-2023 14.20,2023-11-27 14:24:18,22.58,30.0
2024/12/02 10:21:00,02-12-2024 10.34,2024-12-02 10:49:32,13.05,26.0
2023/06/13 10:13:00,13-06-2023 11.00,2023-06-13 11:10:52,47.13,22.0
11-07-2024 12.20,11-07-2024 12.43,2024-07-11 13:04:39,23.13,40.0
09-10-2023 14.08,09-10-2023 14.09,2023-10-09 14:11:51,1.0,
29-11-2024 10.36,29-11-2024 10.58,2024-11-29 11:07:52,22.2,1000.0
2024/06/27 12:19:00,27-06-2024 12.41,2024-06-27 12:57:06,22.4,32.0
05-12-2023 14.08,05-12-2023 14.22,2023-12-05 14:31:12,14.0,0.0
10-02-2023 11.55,10-02-2023 12.15,2023-02-10 12:25:02,20.76,36.0
04-09-2024 11.24,04-09-2024 11.46,2024-09-04 11:56:13,22.22,25.0
07-01-2023 13.00,07-01-2023 13.01,2023-01-07 13:02:00,1.0,25.0
2024/01/16 14:06:00,16-01-2024 14.20,2024-01-16 14:33:58,14.19,17.0
22-07-2024 12.32,22-07-2024 12.56,2024-07-22 13:11:24,24.45,44.0
16-04-2024 12.42,16-04-2024 13.11,2024-04-16 13:29:58,29.09,40.0
31-10-2024 12.32,31-10-2024 12.54,2024-10-31 13:11:28,,44.0
27-12-2023 10.32,27-12-2023 10.55,2023-12-27 10:59:07,23.18,27.0
08-12-2023 15.32,08-12-2023 15.44,2023-12-08 15:45:00,12.0,38.0
2024/04/06 13:00:00,06-04-2024 13.01,2024-04-06 13:02:00,1.0,
23-06-2023 11.00,23-06-2023 11.23,2023-06-23 11:38:38,23.58,47.0
17-08-2023 10.31,17-08-2023 10.50,2023-08-17 11:00:02,19.83,21.0
24-02-2024 13.00,24-02-2024 13.01,2024-02-24 13:02:00,1.0,28.0
16-04-2024 09.44,16-04-2024 09.57,2024-04-16 10:07:21,13.84,45.0
07-02-2023 10.23,07-02-2023 10.28,2023-02-07 10:37:10,5.99,32.0
25-11-2023 13.00,25-11-2023 13.01,2023-11-25 13:02:00,1.0,20.0
2024/08/01 13:59:00,01-08-2024 14.10,2024-08-01 14:19:31,11.65,29.0
23-03-2024 13.00,23-03-2024 13.01,2024-03-23 13:02:00,1.0,27.0
05-09-2023 14.24,05-09-2023 14.57,2023-09-05 15:12:06,33.69,42.0
24-02-2024 11.27,24-02-2024 11.56,2024-02-24 12:06:26,,42.0
02-12-2024 13.14,02-12-2024 13.40,2024-12-02 13:51:26,26.21,19.0
03-03-2023 12.42,03-03-2023 12.47,2023-03-03 12:53:08,5.85,40.0
2024/06/28 10:52:00,28-06-2024 11.14,2024-06-28 11:16:46,21.92,29.0
07-05-2024 13.49,07-05-2024 13.50,2024-05-07 13:59:49,1.0,25.0
2023/12/18 10:50:00,18-12-2023 11.09,2023-12-18 11:15:43,19.12,9.0
08-03-2023 10.52,08-03-2023 11.08,2023-03-08 11:16:16,16.15,25.0
28-10-2024 09.17,28-10-2024 09.37,2024-10-28 09:42:46,20.32,26.0
,18-10-2023 10.00,2023-10-18 10:10:55,28.87,26.0
17-01-2024 15.45,17-01-2024 15.46,2024-01-17 15:47:00,1.0,25.0
14-08-2023 09.55,14-08-2023 10.04,2023-08-14 10:19:11,9.87,10.0
2024/01/17 09:16:00,17-01-2024 09.39,2024-01-17 09:43:43,23.6,20.0
28-12-2023 09.07,28-12-2023 09.18,2023-12-28 09:30:53,10.68,32.0
20-08-2024 14.42,20-08-2024 14.51,2024-08-20 15:01:40,9.75,27.0
26-02-2024 12.31,26-02-2024 12.53,2024-02-26 13:06:33,22.93,31.0
2024/11/14 09:12:00,14-11-2024 09.42,2024-11-14 09:54:18,30.31,44.0
09-07-2024 11.49,09-07-2024 12.16,2024-07-09 12:21:57,27.67,36.0
11-10-2023 10.27,11-10-2023 10.52,2023-10-11 11:03:16,25.75,34.0
14-10-2023 13.00,14-10-2023 13.01,2023-10-14 13:02:00,1.0,22.0
2024/07/19 14:02:00,19-07-2024 14.14,2024-07-19 14:27:10,12.4,19.0
30-08-2024 09.33,30-08-2024 10.02,2024-08-30 10:05:23,29.99,47.0
30-06-2023 14.15,30-06-2023 14.45,2023-06-30 14:57:55,30.79,48.0
2023/07/21 09:41:00,21-07-2023 09.56,2023-07-21 10:06:22,15.93,26.0
30-01-2024 12.16,30-01-2024 12.40,2024-01-30 12:58:38,24.66,
02-06-2023 13.49,02-06-2023 14.06,2023-06-02 14:14:47,17.79,44.0
10-01-2024 12.19,10-01-2024 12.27,2024-01-10 12:38:20,7.41,31.0
19-09-2023 12.39,19-09-2023 13.01,2023-09-19 13:13:01,22.29,32.0
11-07-2023 13.23,11-07-2023 13.55,2023-07-11 13:56:56,32.94,44.0
27-03-2024 09.37,27-03-2024 09.51,2024-03-27 10:02:43,14.08,10.0
,11-04-2024 11.44,2024-04-11 11:58:49,15.1,22.0
08-09-2023 12.46,08-09-2023 12.55,2023-09-08 13:07:11,9.7,40.0
16-10-2023 9.36,16-10-2023 10.10,2023-10-16 10:16:36,34.08,29.0
22-04-2023 13.00,22-04-2023 13.01,2023-04-22 13:02:00,1.0,44.0
11-03-2023 13.00,11-03-2023 13.01,2023-03-11 13:02:00,1.0,53.0
2023/02/25 13:00:00,25-02-2023 13.01,2023-02-25 13:02:00,1.0,36.0
27-06-2023 09.00,27-06-2023 09.30,2023-06-27 09:40:58,30.83,46.0
28-10-2023 10.54,28-10-2023 11.22,2023-10-28 11:38:19,28.05,50.0
09-05-2023 11.36,09-05-2023 11.58,2023-05-09 12:10:57,22.12,56.0
11-02-2023 13.00,11-02-2023 13.01,2023-02-11 13:02:00,1.0,25.0
21-09-2023 12.12,21-09-2023 12.27,2023-09-21 12:39:36,15.11,11.0
17-02-2023 9.04,17-02-2023 09.22,2023-02-17 09:36:14,18.87,28.0
2023/01/18 10:57:00,18-01-2023 11.15,2023-01-18 11:26:08,18.16,22.0
25-09-2023 13.42,25-09-2023 13.58,2023-09-25 14:13:28,16.86,27.0
15-04-2023 11.06,15-04-2023 11.25,2023-04-15 11:36:04,19.1,26.0
,22-10-2024 15.27,2024-10-22 15:45:00,17.62,20.0
07-10-2024 15.45,07-10-2024 15.46,2024-10-07 15:47:00,1.0,24.0
04-07-2023 13.50,04-07-2023 13.58,2023-07-04 14:07:16,8.72,25.0
28-07-2023 15.21,28-07-2023 15.38,2023-07-28 15:39:56,17.83,8.0
11-04-2024 14.19,11-04-2024 14.35,2024-04-11 14:47:09,16.64,41.0
2023/12/16 12:36:00,16-12-2023 12.54,2023-12-16 13:00:00,18.55,27.0
20-01-2023 15.41,20-01-2023 15.44,2023-01-20 15:45:00,3.0,27.0
08-03-2023 15.31,08-03-2023 15.44,2023-03-08 15:45:00,13.0,50.0
09-08-2024 14.24,09-08-2024 14.47,2024-08-09 14:57:48,23.62,27.0
14-06-2023 14.53,14-06-2023 15.08,2023-06-14 15:31:23,15.57,15.0
2023/08/04 12:54:00,04-08-2023 13.20,2023-08-04 13:33:27,26.03,39.0
20-11-2024 11.53,20-11-2024 12.19,2024-11-20 12:30:12,26.1,38.0
30-09-2024 14.29,30-09-2024 14.45,2024-09-30 14:57:05,16.24,45.0
25-12-2023 13.44,25-12-2023 13.56,2023-12-25 14:10:33,12.85,25.0
21-09-2023 09.05,21-09-2023 09.24,2023-09-21 09:34:36,19.78,26.0
14-02-2024 13.39,14-02-2024 14.06,2024-02-14 14:20:04,27.41,26.0
22-10-2024 14.13,22-10-2024 14.24,2024-10-22 14:30:32,11.55,14.0
28-01-2023 10.44,28-01-2023 10.52,2023-01-28 11:00:38,8.22,32.0
15-04-2023 09.35,15-04-2023 09.49,2023-04-15 10:01:12,14.67,10.0
19-12-2023 10.25,19-12-2023 10.48,2023-12-19 11:01:28,22.74,32.0
24-11-2023 12.29,24-11-2023 12.38,2023-11-24 12:46:19,9.32,40.0
03-06-2024 14.52,03-06-2024 15.11,2024-06-03 15:17:20,19.77,22.0
12-04-2024 14.32,12-04-2024 14.51,2024-04-12 15:03:34,19.83,28.0
16-06-2023 11.42,16-06-2023 12.08,2023-06-16 12:12:05,26.38,38.0
04-03-2023 12.55,04-03-2023 12.59,2023-03-04 13:00:00,4.0,32.0
2023/01/07 13:00:00,07-01-2023 13.01,2023-01-07 13:02:00,1.0,27.0
,18-01-2024 10.42,2024-01-18 10:49:59,21.5,20.0
13-04-2023 15.29,13-04-2023 15.42,2023-04-13 15:45:00,13.92,37.0
13-04-2024 13.00,13-04-2024 13.01,2024-04-13 13:02:00,1.0,34.0
05-02-2024 13.41,05-02-2024 14.04,2024-02-05 14:08:53,23.32,37.0
10-04-2023 10.18,10-04-2023 10.46,2023-04-10 10:58:35,28.9,33.0
2024/07/23 13:37:00,23-07-2024 13.55,2024-07-23 14:06:21,18.18,25.0
05-11-2024 14.46,05-11-2024 15.22,2024-11-05 15:23:29,36.09,47.0
04-07-2023 15.17,04-07-2023 15.23,2023-07-04 15:41:07,6.72,21.0
2023/06/19 10:06:00,19-06-2023 10.27,2023-06-19 10:35:44,21.3,40.0
2024/04/24 14:36:00,24-04-2024 14.59,2024-04-24 15:18:54,23.2,33.0
2023/12/01 10:42:00,01-12-2023 11.05,2023-12-01 11:18:58,23.01,25.0
18-01-2024 11.20,18-01-2024 11.44,2024-01-18 11:54:16,24.65,30.0
28-03-2024 09.01,28-03-2024 09.23,2024-03-28 09:29:55,22.81,29.0
16-10-2023 11.42,16-10-2023 12.11,2023-10-16 12:16:10,29.38,48.0
21-11-2024 12.21,21-11-2024 12.38,2024-11-21 12:41:13,17.11,32.0
20-01-2023 09.37,20-01-2023 10.08,2023-01-20 10:18:11,31.56,39.0
02-08-2024 11.40,02-08-2024 12.16,2024-08-02 12:23:22,36.53,48.0
18-10-2024 09.30,18-10-2024 09.55,2024-10-18 10:12:09,25.25,43.0
10-05-2024 14.35,10-05-2024 14.47,2024-05-10 14:57:34,,14.0
24-06-2023 11.04,24-06-2023 11.19,2023-06-24 11:28:50,15.19,42.0
11-04-2023 13.45,11-04-2023 14.01,2023-04-11 14:13:17,16.74,30.0
15-06-2024 13.00,15-06-2024 13.01,2024-06-15 13:02:00,1.0,25.0
30-01-2024 15.39,30-01-2024 15.44,2024-01-30 15:45:00,5.0,25.0
23-01-2023 15.04,23-01-2023 15.16,2023-01-23 15:28:59,12.5,8.0
31-01-2023 12.38,31-01-2023 12.47,2023-01-31 12:59:23,9.09,40.0
30-03-2023 14.46,30-03-2023 15.06,2023-03-30 15:15:29,20.9,26.0
16-10-2023 10.08,16-10-2023 10.26,2023-10-16 10:44:22,18.79,39.0
03-03-2023 10.24,03-03-2023 10.36,2023-03-03 10:45:26,12.98,9.0
29-10-2024 11.59,29-10-2024 12.09,2024-10-29 12:24:38,10.22,6.0
16-05-2024 9.53,16-05-2024 10.13,2024-05-16 10:24:02,20.27,31.0
02-10-2023 12.43,02-10-2023 13.08,2023-10-02 13:20:23,25.8,32.0
15-01-2024 11.20,15-01-2024 11.31,2024-01-15 11:37:18,11.73,1.0
2024/01/30 10:29:00,30-01-2024 10.36,2024-01-30 10:44:18,,1000.0
16-08-2024 09.33,16-08-2024 09.53,2024-08-16 10:04:11,20.3,39.0
29-06-2024 13.00,29-06-2024 13.01,2024-06-29 13:02:00,1.0,27.0
2024/08/02 14:56:00,02-08-2024 15.00,2024-08-02 15:10:27,4.41,32.0
2023/07/15 09:04:00,15-07-2023 09.27,2023-07-15 09:33:37,23.22,33.0
11-07-2024 09.10,11-07-2024 09.25,2024-07-11 09:35:02,14.66,25.0
23-11-2023 09.27,23-11-2023 09.50,2023-11-23 10:01:47,23.78,36.0
2023/09/23 11:32:00,23-09-2023 12.09,2023-09-23 12:15:24,37.77,57.0
01-03-2024 15.16,01-03-2024 15.44,2024-03-01 15:45:00,28.65,34.0
07-12-2023 09.05,07-12-2023 09.23,2023-12-07 09:34:09,18.39,26.0
13-12-2023 15.45,13-12-2023 15.46,2023-12-13 15:47:00,1.0,25.0
04-09-2024 14.10,04-09-2024 14.13,2024-09-04 14:16:31,3.36,25.0
15-09-2023 09.13,15-09-2023 09.28,2023-09-15 09:45:32,,27.0
01-09-2023 11.16,01-09-2023 11.34,2023-09-01 11:46:15,18.41,11.0
06-12-2023 12.30,06-12-2023 12.34,2023-12-06 12:40:12,4.18,32.0
12-04-2024 10.31,12-04-2024 11.55,2024-04-12 12:03:45,84.34,33.0
04-06-2024 11.59,04-06-2024 12.26,2024-06-04 12:38:56,27.53,41.0
2023/05/23 15:32:00,23-05-2023 15.44,2023-05-23 15:45:00,12.0,32.0
03-08-2024 13.00,03-08-2024 13.01,2024-08-03 13:02:00,1.0,38.0
2023/05/11 10:50:00,11-05-2023 11.06,2023-05-11 11:15:40,15.48,49.0
2024/02/13 09:34:00,13-02-2024 09.57,2024-02-13 10:06:21,23.5,36.0
15-08-2024 10.33,15-08-2024 10.57,2024-08-15 11:09:27,23.71,22.0
07-03-2023 14.38,07-03-2023 15.09,2023-03-07 15:32:42,31.42,51.0
09-02-2023 09.53,09-02-2023 10.11,2023-02-09 10:25:13,18.07,23.0
2023/03/06 11:45:00,06-03-2023 12.06,2023-03-06 12:09:28,21.25,24.0
29-04-2023 13.00,29-04-2023 13.01,2023-04-29 13:02:00,1.0,31.0
19-06-2024 13.27,19-06-2024 13.32,2024-06-19 13:41:50,5.08,23.0
2023/04/11 13:32:00,11-04-2023 13.47,2023-04-11 13:50:24,15.93,33.0
22-07-2024 09.59,22-07-2024 10.25,2024-07-22 10:40:43,26.59,30.0
2023/05/13 12:05:00,13-05-2023 12.23,2023-05-13 12:24:54,18.92,28.0
08-11-2023 11.30,08-11-2023 11.45,2023-11-08 11:55:18,14.08,25.0
11-07-2024 11.19,11-07-2024 11.47,2024-07-11 11:57:57,28.3,42.0
19-04-2023 11.32,19-04-2023 13.01,2023-04-19 13:11:42,89.99,30.0
05-08-2023 09.40,05-08-2023 09.57,2023-08-05 10:10:26,17.93,34.0
07-08-2024 10.36,07-08-2024 11.00,2024-08-07 11:09:41,24.39,29.0
2023/07/26 12:26:00,26-07-2023 12.48,2023-07-26 13:01:03,22.1,35.0
16-05-2024 14.27,16-05-2024 14.42,2024-05-16 14:59:37,15.65,17.0
01-11-2024 12.58,01-11-2024 13.09,2024-11-01 13:22:01,,29.0
2023/03/21 14:07:00,21-03-2023 14.27,2023-03-21 14:41:50,20.29,21.0
18-05-2024 11.58,18-05-2024 12.15,2024-05-18 12:28:21,17.21,7.0
23-03-2023 12.29,23-03-2023 12.32,2023-03-23 12:38:34,3.25,40.0
2023/08/08 12:25:00,08-08-2023 12.28,2023-08-08 12:33:50,3.77,40.0
17-01-2023 13.20,17-01-2023 13.33,2023-01-17 13:41:47,13.94,37.0
09-09-2023 09.34,09-09-2023 09.49,2023-09-09 09:54:35,15.11,
01-10-2024 09.50,01-10-2024 10.04,2024-10-01 10:15:30,14.57,26.0
15-06-2024 13.00,15-06-2024 13.01,2024-06-15 13:02:00,1.0,20.0
18-07-2023 11.30,18-07-2023 11.58,2023-07-18 12:09:43,28.13,70.0
23-04-2024 09.07,23-04-2024 09.30,2024-04-23 09:38:50,23.47,32.0
06-11-2023 15.33,06-11-2023 15.44,2023-11-06 15:45:00,11.0,27.0
01-11-2023 12.07,01-11-2023 12.32,2023-11-01 12:46:57,25.64,32.0
19-04-2023 09.35,19-04-2023 09.53,2023-04-19 09:59:10,18.22,169.0
11-05-2024 12.13,11-05-2024 12.33,2024-05-11 12:46:09,20.33,25.0
07-03-2023 09.19,07-03-2023 09.54,2023-03-07 10:01:57,35.29,53.0
20-12-2023 09.27,20-12-2023 09.46,2023-12-20 09:56:07,19.48,31.0
17-09-2024 09.23,17-09-2024 09.39,2024-09-17 09:46:42,16.7,18.0
2024/07/29 09:41:00,29-07-2024 09.57,2024-07-29 10:05:26,,31.0
13-05-2024 13.44,13-05-2024 14.00,2024-05-13 14:15:45,16.36,32.0
28-02-2024 12.40,28-02-2024 12.58,2024-02-28 13:09:46,18.27,32.0
23-11-2024 13.00,23-11-2024 13.01,2024-11-23 13:02:00,1.0,24.0
29-05-2024 10.31,29-05-2024 10.35,2024-05-29 10:42:25,4.65,32.0
2023/08/26 12:15:00,26-08-2023 12.51,2023-08-26 12:59:27,36.83,57.0
15-07-2024 13.08,15-07-2024 13.35,2024-07-15 13:36:49,27.78,21.0
14-06-2024 15.43,14-06-2024 15.44,2024-06-14 15:45:00,1.0,37.0
31-03-2023 10.57,31-03-2023 11.16,2023-03-31 11:28:51,19.9,37.0
09-08-2024 12.18,09-08-2024 12.43,2024-08-09 12:54:30,25.42,35.0
04-10-2024 10.28,04-10-2024 10.50,2024-10-04 11:04:06,22.01,25.0
2024/06/22 12:58:00,22-06-2024 12.59,2024-06-22 13:00:00,1.0,12.0
31-03-2023 14.42,31-03-2023 15.09,2023-03-31 15:18:50,27.36,39.0
22-05-2024 13.53,22-05-2024 14.23,2024-05-22 14:29:36,30.28,38.0
11-07-2023 09.25,11-07-2023 10.05,2023-07-11 10:16:21,40.41,44.0
28-05-2024 15.23,28-05-2024 15.44,2024-05-28 15:45:00,21.0,36.0
21-02-2023 13.34,21-02-2023 15.12,2023-02-21 15:25:53,98.26,22.0
09-11-2023 12.32,09-11-2023 12.49,2023-11-09 13:06:48,17.65,16.0
20-03-2023 14.30,20-03-2023 14.56,2023-03-20 15:06:36,26.33,39.0
09-09-2023 10.00,09-09-2023 10.23,2023-09-09 10:37:34,23.3,33.0
2023/08/02 10:09:00,02-08-2023 10.10,2023-08-02 10:21:57,1.0,22.0
12-08-2023 10.51,12-08-2023 11.06,2023-08-12 11:16:06,15.49,9.0
2024/01/26 14:09:00,26-01-2024 14.24,2024-01-26 14:34:11,15.81,45.0
10-07-2024 14.29,10-07-2024 14.52,2024-07-10 14:59:15,23.0,23.0
07-10-2023 09.09,07-10-2023 09.16,2023-10-07 09:19:48,7.17,
2023/07/18 12:15:00,18-07-2023 12.45,2023-07-18 13:03:29,29.86,24.0
07-06-2024 10.31,07-06-2024 10.52,2024-06-07 11:02:09,21.73,47.0
17-08-2023 11.23,17-08-2023 11.43,2023-08-17 11:53:52,20.71,3.0
22-01-2024 9.48,22-01-2024 10.16,2024-01-22 10:18:53,28.61,63.0
09-04-2024 11.08,09-04-2024 11.25,2024-04-09 11:36:25,17.39,24.0
2024/10/10 11:50:00,10-10-2024 12.24,2024-10-10 12:39:18,34.83,54.0
15-07-2023 09.23,15-07-2023 09.50,2023-07-15 10:02:36,27.59,36.0
2023/07/24 10:36:00,24-07-2023 10.57,2023-07-24 11:11:05,21.35,37.0
18-01-2024 11.18,18-01-2024 12.52,2024-01-18 13:05:33,94.56,30.0
26-04-2023 12.45,26-04-2023 13.01,2023-04-26 13:14:53,16.46,22.0
07-01-2023 10.31,07-01-2023 10.45,2023-01-07 10:57:03,14.2,32.0
2023/11/04 13:00:00,04-11-2023 13.01,2023-11-04 13:02:00,1.0,16.0
11-10-2023 10.55,11-10-2023 11.25,2023-10-11 11:36:38,30.99,34.0
2023/07/27 13:26:00,27-07-2023 13.57,2023-07-27 14:10:28,31.95,33.0
21-06-2024 15.45,21-06-2024 15.46,2024-06-21 15:47:00,1.0,25.0
31-07-2024 13.03,31-07-2024 13.20,2024-07-31 13:30:12,17.5,15.0
03-04-2023 13.33,03-04-2023 14.01,2023-04-03 14:17:18,28.14,36.0
02-06-2023 09.19,02-06-2023 09.47,2023-06-02 09:54:37,28.75,36.0
2023/01/21 09:19:00,21-01-2023 10.03,2023-01-21 10:15:15,44.15,44.0
24-06-2024 15.35,24-06-2024 15.44,2024-06-24 15:45:00,9.0,41.0
05-06-2023 12.28,05-06-2023 12.39,2023-06-05 12:44:36,11.37,25.0
10-01-2024 10.41,10-01-2024 10.59,2024-01-10 11:13:35,18.96,40.0
19-07-2024 10.44,19-07-2024 11.06,2024-07-19 11:20:47,22.87,29.0
22-07-2023 13.00,22-07-2023 13.01,2023-07-22 13:02:00,1.0,24.0
2024/02/21 14:09:00,21-02-2024 14.30,2024-02-21 14:36:35,21.62,15.0
08-04-2024 14.26,08-04-2024 14.52,2024-04-08 15:01:48,26.82,36.0
07-01-2023 13.00,07-01-2023 13.01,2023-01-07 13:02:00,1.0,7.0
23-01-2023 10.43,23-01-2023 10.52,2023-01-23 11:05:32,9.98,32.0
21-12-2023 13.49,21-12-2023 13.56,2023-12-21 14:09:23,7.35,221.0
21-02-2024 13.56,21-02-2024 14.15,2024-02-21 14:28:08,19.91,27.0
23-03-2024 11.49,23-03-2024 12.11,2024-03-23 12:20:46,22.11,47.0
01-03-2024 10.14,01-03-2024 10.35,2024-03-01 10:51:43,21.17,33.0
08-10-2024 11.15,08-10-2024 11.35,2024-10-08 11:47:45,20.69,26.0
2024/09/19 11:36:00,19-09-2024 12.01,2024-09-19 12:18:04,25.9,
2024/03/07 12:18:00,07-03-2024 12.28,2024-03-07 12:36:02,,40.0
2024/11/22 11:10:00,22-11-2024 11.24,2024-11-22 11:32:52,14.43,194.0
29-06-2023 10.01,29-06-2023 10.24,2023-06-29 10:34:26,22.51,30.0
25-12-2023 15.23,25-12-2023 15.44,2023-12-25 15:45:00,21.0,16.0
11-11-2024 10.46,11-11-2024 11.22,2024-11-11 11:30:20,36.33,49.0
25-11-2023 13.00,25-11-2023 13.01,2023-11-25 13:02:00,1.0,25.0
14-12-2023 13.40,14-12-2023 14.03,2023-12-14 14:15:00,23.23,37.0
,22-06-2024 11.35,2024-06-22 11:46:20,9.45,32.0
28-06-2024 11.37,28-06-2024 12.01,2024-06-28 12:10:09,24.43,38.0
2023/06/14 13:22:00,14-06-2023 13.46,2023-06-14 13:56:55,24.45,28.0
2024/11/04 09:21:00,04-11-2024 09.46,2024-11-04 10:03:28,25.51,44.0
09-08-2024 11.54,09-08-2024 12.13,2024-08-09 12:22:17,19.75,24.0
17-01-2023 11.06,17-01-2023 11.23,2023-01-17 11:27:09,17.73,24.0
23-12-2023 13.00,23-12-2023 13.01,2023-12-23 13:02:00,1.0,20.0
10-10-2024 14.51,10-10-2024 15.19,2024-10-10 15:31:02,28.37,46.0
2023/05/02 11:42:00,02-05-2023 12.12,2023-05-02 12:20:50,30.96,35.0
2024/03/15 14:01:00,15-03-2024 14.22,2024-03-15 14:37:04,21.53,41.0
22-06-2024 13.00,22-06-2024 13.01,2024-06-22 13:02:00,1.0,23.0
06-06-2023 13.02,06-06-2023 13.27,2023-06-06 13:39:33,25.58,32.0
13-02-2024 12.48,13-02-2024 13.06,2024-02-13 13:10:44,18.2,32.0
06-05-2024 11.29,06-05-2024 11.44,2024-05-06 11:54:58,15.82,29.0
22-08-2024 12.15,22-08-2024 12.49,2024-08-22 13:02:05,34.39,57.0
14-02-2023 11.15,14-02-2023 11.41,2023-02-14 11:52:07,26.05,55.0
21-02-2023 09.43,21-02-2023 09.54,2023-02-21 10:01:22,11.42,18.0
09-04-2024 10.14,09-04-2024 10.38,2024-04-09 10:42:50,24.49,37.0
08-06-2023 13.03,08-06-2023 13.12,2023-06-08 13:18:19,9.61,37.0
22-07-2024 13.12,22-07-2024 13.32,2024-07-22 13:39:12,20.63,48.0
16-04-2024 11.02,16-04-2024 11.20,2024-04-16 11:30:05,18.66,37.0
2024/03/29 10:00:00,29-03-2024 10.28,2024-03-29 10:41:58,28.55,23.0
09-09-2023 11.59,09-09-2023 12.18,2023-09-09 12:24:49,19.49,32.0
02-02-2023 10.42,02-02-2023 10.51,2023-02-02 11:03:33,9.27,32.0
14-12-2023 13.58,14-12-2023 14.28,2023-12-14 14:40:45,29.18,30.0
30-08-2023 12.22,30-08-2023 12.28,2023-08-30 12:39:47,6.14,40.0
15-04-2024 10.45,15-04-2024 11.01,2024-04-15 11:17:08,16.76,21.0
27-05-2024 09.12,27-05-2024 09.23,2024-05-27 09:28:44,11.53,5.0
20-04-2023 14.43,20-04-2023 14.53,2023-04-20 15:14:22,,15.0
2023/09/18 12:49:00,18-09-2023 13.20,2023-09-18 13:32:03,31.52,36.0
09-09-2023 13.00,09-09-2023 13.01,2023-09-09 13:02:00,1.0,25.0
02-09-2023 10.20,02-09-2023 10.50,2023-09-02 10:56:15,30.11,48.0
2024/10/03 10:14:00,03-10-2024 10.23,2024-10-03 10:31:35,9.94,12.0
24-05-2024 14.47,24-05-2024 15.20,2024-05-24 15:31:26,33.75,220.0
24-10-2024 09.54,24-10-2024 10.05,2024-10-24 10:16:39,10.74,17.0
2024/11/14 12:07:00,14-11-2024 12.44,2024-11-14 12:46:22,37.04,44.0
07-03-2024 10.00,07-03-2024 10.12,2024-03-07 10:20:54,12.7,15.0
21-06-2024 12.22,21-06-2024 12.28,2024-06-21 12:37:43,6.05,40.0
24-08-2023 10.13,24-08-2023 10.24,2023-08-24 10:33:29,10.67,5.0
09-10-2023 11.47,09-10-2023 12.07,2023-10-09 12:18:56,20.7,25.0
2024/08/03 10:40:00,03-08-2024 10.50,2024-08-03 10:59:47,10.18,32.0
18-09-2023 15.45,18-09-2023 15.46,2023-09-18 15:47:00,1.0,25.0
30-08-2023 09.26,30-08-2023 09.38,2023-08-30 09:50:29,12.2,20.0
01-05-2024 09.58,01-05-2024 10.19,2024-05-01 10:27:35,21.14,37.0
05-08-2023 13.00,05-08-2023 13.01,2023-08-05 13:02:00,1.0,36.0
07-05-2024 14.49,07-05-2024 15.20,2024-05-07 15:26:27,31.45,49.0
28-09-2024 13.00,28-09-2024 13.01,2024-09-28 13:02:00,1.0,34.0
2023/09/13 11:03:00,13-09-2023 11.32,2023-09-13 11:44:21,29.35,28.0
11-07-2023 13.04,11-07-2023 13.36,2023-07-11 13:48:09,31.35,49.0
20-07-2024 9.09,20-07-2024 09.24,2024-07-20 09:35:21,14.37,20.0
07-02-2023 12.57,07-02-2023 13.03,2023-02-07 13:13:11,6.35,13.0
23-10-2024 09.59,23-10-2024 10.17,2024-10-23 10:33:00,18.27,28.0
04-11-2023 12.33,04-11-2023 12.56,2023-11-04 13:00:00,24.0,44.0
13-08-2024 11.31,13-08-2024 11.39,2024-08-13 11:51:56,8.39,19.0
30-11-2024 12.10,30-11-2024 12.21,2024-11-30 12:32:05,11.39,
19-10-2023 11.33,19-10-2023 12.08,2023-10-19 12:28:56,35.69,45.0
2024/01/12 10:25:00,12-01-2024 10.38,2024-01-12 10:51:14,13.55,32.0
27-04-2024 13.00,27-04-2024 13.01,2024-04-27 13:02:00,1.0,17.0
12-04-2024 11.23,12-04-2024 11.43,2024-04-12 11:53:55,,37.0
21-10-2024 10.41,21-10-2024 11.03,2024-10-21 11:12:31,22.79,22.0
27-04-2023 13.41,27-04-2023 14.03,2023-04-27 14:14:07,22.36,29.0
20-02-2023 09.06,20-02-2023 09.27,2023-02-20 09:37:05,21.79,28.0
21-11-2023 10.21,21-11-2023 10.24,2023-11-21 10:30:35,3.87,32.0
2024/03/02 09:33:00,02-03-2024 09.48,2024-03-02 09:53:42,15.4,18.0
19-12-2023 12.33,19-12-2023 12.49,2023-12-19 12:59:07,16.12,26.0
07-05-2024 14.42,07-05-2024 15.12,2024-05-07 15:21:37,30.77,44.0
2023/03/29 15:33:00,29-03-2023 15.34,2023-03-29 15:36:30,1.0,25.0
03-01-2024 14.50,03-01-2024 15.09,2024-01-03 15:18:52,19.33,28.0
27-09-2024 10.24,27-09-2024 10.48,2024-09-27 11:00:39,23.46,24.0
14-08-2024 10.04,14-08-2024 11.30,2024-08-14 11:41:09,86.47,33.0
27-01-2024 12.02,27-01-2024 12.27,2024-01-27 12:44:09,25.8,14.0
17-08-2023 11.15,17-08-2023 11.45,2023-08-17 12:01:05,30.24,34.0
2023/11/29 11:54:00,29-11-2023 12.19,2023-11-29 12:33:46,25.99,32.0
24-04-2023 11.09,24-04-2023 11.29,2023-04-24 11:38:26,20.63,32.0
22-09-2023 12.05,22-09-2023 12.26,2023-09-22 12:39:47,21.96,47.0
09-02-2024 11.19,09-02-2024 11.39,2024-02-09 11:52:53,20.75,17.0
2023/08/30 14:48:00,30-08-2023 15.02,2023-08-30 15:13:47,14.95,15.0
18-07-2023 13.21,18-07-2023 14.31,2023-07-18 14:39:00,69.6,20.0
2024/08/14 10:33:00,14-08-2024 10.53,2024-08-14 11:05:29,20.1,55.0
27-09-2023 12.18,27-09-2023 12.47,2023-09-27 12:57:14,29.31,48.0
08-07-2023 11.33,08-07-2023 11.52,2023-07-08 12:00:53,19.3,194.0
2023/06/16 10:03:00,16-06-2023 10.06,2023-06-16 10:15:12,3.29,10.0
23-07-2024 15.19,23-07-2024 15.44,2024-07-23 15:45:00,25.0,46.0
02-04-2024 13.56,02-04-2024 14.08,2024-04-02 14:22:20,12.93,25.0
2024/04/03 12:22:00,03-04-2024 12.45,2024-04-03 12:56:57,23.14,59.0
14-11-2023 13.47,14-11-2023 14.00,2023-11-14 14:16:19,13.18,25.0
30-01-2024 09.28,30-01-2024 09.53,2024-01-30 09:58:49,25.02,29.0
04-10-2023 13.52,04-10-2023 14.14,2023-10-04 14:25:38,22.5,17.0
08-04-2023 12.41,08-04-2023 12.59,2023-04-08 13:00:00,18.0,23.0
15-11-2024 14.51,15-11-2024 15.12,2024-11-15 15:21:37,21.49,41.0
11-03-2024 12.00,11-03-2024 12.18,2024-03-11 12:27:59,18.94,24.0
15-12-2023 10.40,15-12-2023 11.07,2023-12-15 11:16:39,27.56,39.0
2024/05/27 10:52:00,27-05-2024 11.18,2024-05-27 11:27:48,26.12,34.0
15-02-2023 09.28,15-02-2023 09.46,2023-02-15 09:55:59,18.01,34.0
20-01-2024 11.48,20-01-2024 12.23,2024-01-20 12:31:37,,57.0
27-09-2023 09.24,27-09-2023 09.49,2023-09-27 09:55:56,25.94,191.0
2024/10/07 15:27:00,07-10-2024 15.44,2024-10-07 15:45:00,17.0,39.0
22-03-2023 10.41,22-03-2023 11.12,2023-03-22 11:27:29,31.16,50.0
2023/12/08 10:47:00,08-12-2023 11.06,2023-12-08 11:14:03,19.08,36.0
29-05-2023 11.53,29-05-2023 12.00,2023-05-29 12:10:05,7.74,29.0
26-10-2024 10.50,26-10-2024 11.23,2024-10-26 11:29:59,33.01,205.0
2024/10/30 13:17:00,30-10-2024 13.29,2024-10-30 13:40:43,12.2,18.0
2023/08/16 11:51:00,16-08-2023 12.15,2023-08-16 12:24:28,24.19,60.0
25-06-2024 11.39,25-06-2024 12.17,2024-06-25 12:24:02,38.08,57.0
03-04-2024 10.09,03-04-2024 10.41,2024-04-03 10:50:30,32.4,20.0
29-03-2024 09.37,29-03-2024 09.44,2024-03-29 09:57:11,7.03,10.0
06-04-2023 14.08,06-04-2023 14.09,2023-04-06 14:12:02,1.92,25.0
2023/09/18 12:43:00,18-09-2023 13.03,2023-09-18 13:14:36,20.59,29.0
2023/03/22 15:36:00,22-03-2023 15.37,2023-03-22 15:38:53,1.05,25.0
02-10-2024 10.13,02-10-2024 10.31,2024-10-02 10:41:08,18.88,21.0
02-09-2023 11.36,02-09-2023 11.52,2023-09-02 12:11:06,16.4,33.0
22-05-2023 15.01,22-05-2023 15.25,2023-05-22 15:34:40,24.79,46.0
12-06-2023 10.35,12-06-2023 10.57,2023-06-12 11:09:10,21.27,22.0
01-02-2023 9.00,01-02-2023 09.16,2023-02-01 09:39:48,16.67,27.0
10-08-2024 13.00,10-08-2024 13.01,2024-08-10 13:02:00,1.0,25.0
13-03-2023 11.46,13-03-2023 12.07,2023-03-13 12:13:27,21.99,
01-11-2023 12.20,01-11-2023 12.49,2023-11-01 13:03:55,29.03,38.0
2023/09/27 14:07:00,27-09-2023 14.21,2023-09-27 14:33:57,,17.0
21-12-2023 09.52,21-12-2023 10.15,2023-12-21 10:30:16,23.8,28.0
17-01-2023 13.54,17-01-2023 14.28,2023-01-17 14:52:11,34.58,30.0
17-08-2023 12.20,17-08-2023 12.43,2023-08-17 13:00:56,23.43,41.0
28-08-2024 12.02,28-08-2024 12.32,2024-08-28 12:47:38,30.7,32.0
15-01-2024 09.39,15-01-2024 10.07,2024-01-15 10:17:20,28.26,26.0
08-08-2024 09.48,08-08-2024 10.02,2024-08-08 10:21:27,14.38,28.0
04-09-2023 14.59,04-09-2023 15.19,2023-09-04 15:32:28,,31.0
08-07-2024 12.07,08-07-2024 12.29,2024-07-08 12:38:23,22.57,59.0
2023/05/26 11:15:00,26-05-2023 11.34,2023-05-26 11:44:46,19.97,20.0
30-06-2023 13.58,30-06-2023 14.17,2023-06-30 14:30:25,19.19,15.0
09-01-2024 13.54,09-01-2024 14.18,2024-01-09 14:26:57,24.05,7.0
04-12-2023 09.08,04-12-2023 09.24,2023-12-04 09:43:46,16.73,27.0
2023/11/14 12:14:00,14-11-2023 12.39,2023-11-14 12:51:24,25.84,20.0
28-10-2023 13.00,28-10-2023 13.01,2023-10-28 13:02:00,1.0,31.0
2023/02/17 10:48:00,17-02-2023 11.08,2023-02-17 11:13:54,20.67,171.0
07-03-2023 15.13,07-03-2023 15.36,2023-03-07 15:45:00,23.16,48.0
25-07-2024 12.14,25-07-2024 12.37,2024-07-25 12:45:19,23.72,47.0
31-01-2024 13.38,31-01-2024 14.02,2024-01-31 14:06:34,24.19,38.0
12-10-2024 09.54,12-10-2024 10.24,2024-10-12 10:33:03,30.37,38.0
16-08-2023 12.43,16-08-2023 13.04,2023-08-16 13:12:52,21.56,0.0
02-06-2023 12.03,02-06-2023 12.24,2023-06-02 12:34:32,21.03,30.0
24-03-2023 09.22,24-03-2023 09.40,2023-03-24 09:53:22,17.88,40.0
13-12-2023 09.58,13-12-2023 10.14,2023-12-13 10:34:16,16.51,19.0
12-09-2023 12.37,12-09-2023 12.43,2023-09-12 12:54:30,6.73,40.0
14-09-2024 09.28,14-09-2024 09.46,2024-09-14 10:01:17,18.13,40.0
11-01-2023 12.31,11-01-2023 12.58,2023-01-11 13:08:28,27.18,37.0
03-01-2024 11.52,03-01-2024 12.05,2024-01-03 12:14:18,13.64,32.0
2023/02/21 15:24:00,21-02-2023 15.44,2023-02-21 15:45:00,20.0,44.0
18-06-2024 15.13,18-06-2024 15.39,2024-06-18 15:44:29,26.85,27.0
2023/06/30 14:03:00,30-06-2023 14.32,2023-06-30 14:41:53,29.48,62.0
24-04-2023 14.22,24-04-2023 14.54,2023-04-24 15:08:14,32.22,51.0
12-03-2024 12.32,12-03-2024 12.47,2024-03-12 13:00:18,15.7,26.0
2023/10/28 13:00:00,28-10-2023 13.01,2023-10-28 13:02:00,1.0,
06-03-2023 12.01,06-03-2023 12.28,2023-03-06 12:39:02,400.0,22.0
01-08-2023 10.15,01-08-2023 10.34,2023-08-01 10:45:51,19.52,21.0
29-01-2024 13.18,29-01-2024 13.38,2024-01-29 13:50:52,20.84,28.0
22-04-2023 12.48,22-04-2023 12.59,2023-04-22 13:00:00,,40.0
02-02-2024 10.38,02-02-2024 10.45,2024-02-02 10:52:53,7.88,32.0
01-08-2023 14.39,01-08-2023 15.01,2023-08-01 15:10:29,22.42,47.0
27-05-2024 15.33,27-05-2024 15.44,2024-05-27 15:45:00,11.0,8.0
03-05-2023 09.00,03-05-2023 09.40,2023-05-03 09:52:06,40.63,45.0
12-08-2023 12.19,12-08-2023 12.39,2023-08-12 12:59:15,21.0,40.0
18-03-2023 12.58,18-03-2023 12.59,2023-03-18 13:00:00,1.0,3.0
08-02-2023 10.12,08-02-2023 10.40,2023-02-08 10:54:04,27.85,
23-08-2023 10.40,23-08-2023 11.05,2023-08-23 11:16:51,25.98,31.0
08-10-2024 11.59,08-10-2024 12.27,2024-10-08 12:42:01,28.34,23.0
08-06-2024 13.00,08-06-2024 13.01,2024-06-08 13:02:00,1.0,36.0
02-07-2024 12.50,02-07-2024 13.11,2024-07-02 13:17:17,21.35,37.0
23-06-2023 14.31,23-06-2023 14.57,2023-06-23 15:10:43,26.22,47.0
11-03-2023 10.33,11-03-2023 10.37,2023-03-11 10:41:54,4.64,32.0
2023/02/11 11:48:00,11-02-2023 12.05,2023-02-11 12:22:47,17.19,10.0
01-01-2024 13.41,01-01-2024 14.10,2024-01-01 14:27:43,29.57,43.0
19-10-2023 11.47,19-10-2023 12.11,2023-10-19 12:32:13,23.63,26.0
08-07-2024 15.00,08-07-2024 15.21,2024-07-08 15:27:17,21.0,
2023/12/08 13:52:00,08-12-2023 14.28,2023-12-08 14:36:37,36.44,75.0
15-03-2023 11.50,15-03-2023 12.20,2023-03-15 12:33:17,30.75,22.0
28-05-2024 15.45,28-05-2024 15.46,2024-05-28 15:47:00,1.0,28.0
19-07-2024 10.44,19-07-2024 11.05,2024-07-19 11:14:02,21.04,40.0
11-10-2024 14.29,11-10-2024 14.56,2024-10-11 15:08:47,27.6,71.0
2023/06/16 10:36:00,16-06-2023 11.06,2023-06-16 11:15:51,30.22,800.0
09-10-2024 11.37,09-10-2024 11.57,2024-10-09 12:03:44,20.31,30.0
09-06-2023 09.02,09-06-2023 09.16,2023-06-09 09:27:09,13.71,25.0
02-02-2023 15.45,02-02-2023 15.46,2023-02-02 15:47:00,1.0,0.0
2024/11/08 11:05:00,08-11-2024 11.24,2024-11-08 11:31:39,19.7,25.0
06-03-2023 12.19,06-03-2023 12.35,2023-03-06 12:47:55,15.83,38.0
2023/04/14 09:34:00,14-04-2023 09.54,2023-04-14 10:01:13,20.4,34.0
15-07-2024 14.36,15-07-2024 15.00,2024-07-15 15:07:53,24.74,27.0
20-04-2024 09.10,20-04-2024 09.32,2024-04-20 09:42:40,23.0,31.0
12-04-2024 12.38,12-04-2024 13.01,2024-04-12 13:11:46,23.65,31.0
06-07-2023 12.54,06-07-2023 13.11,2023-07-06 13:22:00,17.42,
2024/03/06 09:24:00,06-03-2024 09.56,2024-03-06 10:04:01,32.94,52.0
08-03-2024 12.04,08-03-2024 12.25,2024-03-08 12:36:57,21.93,24.0
23-10-2023 09.00,23-10-2023 09.15,2023-10-23 09:36:23,15.63,27.0
25-03-2024 12.39,25-03-2024 13.09,2024-03-25 13:20:13,30.28,31.0
21-08-2023 12.50,21-08-2023 13.02,2023-08-21 13:16:46,12.22,26.0
21-02-2024 10.03,21-02-2024 10.24,2024-02-21 10:38:29,21.52,30.0
07-04-2023 12.55,07-04-2023 13.18,2023-04-07 13:30:13,23.88,20.0
19-06-2024 10.30,19-06-2024 10.43,2024-06-19 10:56:39,13.66,32.0
05-04-2023 12.21,05-04-2023 12.43,2023-04-05 12:56:15,22.71,46.0
26-07-2024 12.34,26-07-2024 12.57,2024-07-26 13:05:46,23.79,33.0
03-01-2024 10.32,03-01-2024 10.58,2024-01-03 11:14:43,26.42,40.0
07-05-2024 09.00,07-05-2024 09.21,2024-05-07 09:30:28,21.11,26.0
24-11-2023 10.42,24-11-2023 11.04,2023-11-24 11:14:44,22.42,29.0
12-12-2023 13.38,12-12-2023 14.00,2023-12-12 14:11:21,22.58,37.0
06-04-2023 9.16,06-04-2023 09.42,2023-04-06 09:54:11,26.4,26.0
10-02-2024 11.17,10-02-2024 11.25,2024-02-10 11:45:06,8.52,14.0
2023/06/20 15:40:00,20-06-2023 15.44,2023-06-20 15:45:00,4.0,13.0
06-01-2024 13.00,06-01-2024 13.01,2024-01-06 13:02:00,1.0,38.0
18-09-2024 10.43,18-09-2024 11.03,2024-09-18 11:13:49,20.75,41.0
25-05-2024 11.53,25-05-2024 12.15,2024-05-25 12:24:17,22.78,32.0
13-07-2023 12.26,13-07-2023 12.50,2023-07-13 13:01:56,24.25,29.0
12-07-2024 11.25,12-07-2024 11.39,2024-07-12 11:51:29,14.6,19.0
21-07-2023 12.33,21-07-2023 13.04,2023-07-21 13:15:19,,33.0
17-06-2023 9.55,17-06-2023 10.17,2023-06-17 10:30:50,22.29,38.0
25-09-2023 14.16,25-09-2023 14.50,2023-09-25 14:59:16,34.16,62.0
20-10-2023 09.44,20-10-2023 10.08,2023-10-20 10:24:27,24.68,30.0
01-12-2023 10.01,01-12-2023 10.22,2023-12-01 10:33:38,21.02,31.0
24-02-2023 11.00,24-02-2023 11.20,2023-02-24 11:32:07,20.96,24.0
20-09-2024 11.34,20-09-2024 11.56,2024-09-20 12:01:21,22.36,40.0
31-08-2023 13.20,31-08-2023 13.30,2023-08-31 13:39:03,10.27,20.0
08-11-2024 10.31,08-11-2024 10.37,2024-11-08 10:43:22,6.29,32.0
2023/05/10 11:38:00,10-05-2023 11.58,2023-05-10 12:12:27,20.94,34.0
04-09-2024 12.18,04-09-2024 12.54,2024-09-04 13:08:01,36.96,45.0
24-01-2024 11.36,24-01-2024 12.04,2024-01-24 12:20:38,27.8,36.0
2024/07/06 13:00:00,06-07-2024 13.01,2024-07-06 13:02:00,1.0,51.0
02-10-2024 15.11,02-10-2024 15.40,2024-10-02 15:45:00,29.14,36.0
23-10-2023 11.31,23-10-2023 11.40,2023-10-23 11:50:17,9.73,32.0
27-01-2024 13.00,27-01-2024 13.01,2024-01-27 13:02:00,1.0,17.0
11-05-2023 11.18,11-05-2023 11.38,2023-05-11 11:50:15,20.69,50.0
30-05-2023 10.05,30-05-2023 10.19,2023-05-30 10:23:32,14.46,18.0
25-01-2023 13.45,25-01-2023 14.10,2023-01-25 14:24:42,25.36,52.0
18-03-2023 13.00,18-03-2023 13.01,2023-03-18 13:02:00,1.0,0.0
28-02-2023 12.18,28-02-2023 12.37,2023-02-28 12:46:45,19.94,18.0
02-02-2024 13.02,02-02-2024 13.25,2024-02-02 13:37:12,22.37,27.0
04-04-2024 10.34,04-04-2024 10.40,2024-04-04 10:48:54,6.08,32.0
,08-11-2023 10.06,2023-11-08 10:13:47,31.99,53.0
18-03-2024 12.42,18-03-2024 13.15,2024-03-18 13:28:00,33.88,45.0
2024/01/06 10:29:00,06-01-2024 10.38,2024-01-06 10:46:12,9.12,32.0
13-01-2024 13.00,13-01-2024 13.01,2024-01-13 13:02:00,1.0,32.0
2023/06/27 11:41:00,27-06-2023 11.51,2023-06-27 12:00:04,10.74,29.0
23-10-2023 12.05,23-10-2023 12.28,2023-10-23 12:33:50,23.86,36.0
30-08-2024 12.44,30-08-2024 12.53,2024-08-30 13:03:29,9.39,40.0
21-02-2024 11.41,21-02-2024 11.57,2024-02-21 11:58:56,16.94,30.0
02-06-2023 11.17,02-06-2023 11.24,2023-06-02 11:34:17,7.43,32.0
06-12-2023 09.01,06-12-2023 09.05,2023-12-06 09:14:14,4.92,13.0
2023/01/30 13:41:00,30-01-2023 13.55,2023-01-30 14:12:06,14.18,25.0
20-06-2023 09.50,20-06-2023 09.58,2023-06-20 10:07:10,8.75,24.0
15-12-2023 10.50,15-12-2023 11.07,2023-12-15 11:32:05,17.77,40.0
26-11-2024 12.05,26-11-2024 12.23,2024-11-26 12:34:01,18.63,34.0
29-08-2023 11.14,29-08-2023 11.42,2023-08-29 11:49:54,28.16,30.0
31-07-2023 14.11,31-07-2023 14.35,2023-07-31 15:12:34,24.89,36.0
2023/09/26 14:45:00,26-09-2023 15.01,2023-09-26 15:11:04,16.32,42.0
08-07-2023 10.41,08-07-2023 11.47,2023-07-08 12:01:01,66.17,32.0
12-07-2023 13.00,12-07-2023 13.28,2023-07-12 13:31:34,28.49,53.0
30-01-2024 09.13,30-01-2024 09.31,2024-01-30 09:41:48,18.69,26.0
24-10-2023 10.39,24-10-2023 10.43,2023-10-24 10:49:59,4.33,32.0
2024/04/27 12:28:00,27-04-2024 12.43,2024-04-27 12:44:37,15.62,5.0
2023/11/11 10:54:00,11-11-2023 11.21,2023-11-11 11:35:37,27.32,50.0
21-06-2023 12.59,21-06-2023 13.17,2023-06-21 13:27:46,18.05,32.0
2024/11/22 09:30:00,22-11-2024 09.49,2024-11-22 10:02:55,19.01,23.0
01-04-2023 11.06,01-04-2023 11.26,2023-04-01 11:30:54,19.85,30.0
29-07-2024 10.08,29-07-2024 10.26,2024-07-29 10:43:50,17.46,47.0
19-04-2024 12.39,19-04-2024 12.46,2024-04-19 12:52:47,7.3,40.0
06-07-2023 10.43,06-07-2023 11.10,2023-07-06 11:19:11,27.6,41.0
,19-03-2024 13.21,2024-03-19 13:34:51,26.73,36.0
02-09-2024 10.40,02-09-2024 10.46,2024-09-02 10:52:25,6.32,32.0
05-08-2023 11.45,05-08-2023 12.12,2023-08-05 12:27:49,27.11,14.0
28-10-2023 09.05,28-10-2023 09.31,2023-10-28 09:34:37,26.97,56.0
2023/08/01 13:31:00,01-08-2023 13.57,2023-08-01 14:16:18,26.16,36.0
2024/06/20 10:07:00,20-06-2024 10.26,2024-06-20 10:45:44,18.6,47.0
30-09-2023 09.03,30-09-2023 09.29,2023-09-30 09:38:41,26.32,44.0
05-09-2023 9.53,05-09-2023 10.06,2023-09-05 10:18:13,13.09,
09-05-2023 09.06,09-05-2023 09.27,2023-05-09 09:34:05,21.15,
18-05-2024 10.15,18-05-2024 10.44,2024-05-18 11:03:42,29.93,153.0
10-04-2024 12.20,10-04-2024 12.32,2024-04-10 12:46:34,12.05,40.0
13-05-2023 11.48,13-05-2023 12.07,2023-05-13 12:16:49,19.46,23.0
16-11-2024 10.21,16-11-2024 10.51,2024-11-16 11:03:12,30.56,
13-03-2024 13.48,13-03-2024 14.04,2024-03-13 14:20:33,16.66,25.0
23-05-2023 13.10,23-05-2023 13.25,2023-05-23 13:35:33,15.94,23.0
31-01-2023 13.13,31-01-2023 14.26,2023-01-31 14:35:30,73.31,20.0
2024/11/23 10:36:00,23-11-2024 10.51,2024-11-23 10:55:36,15.74,22.0
26-01-2024 13.52,26-01-2024 14.22,2024-01-26 14:32:14,30.26,46.0
26-09-2023 09.26,26-09-2023 09.55,2023-09-26 10:12:38,29.93,43.0
08-06-2023 11.52,08-06-2023 12.18,2023-06-08 12:25:34,26.17,47.0
26-11-2024 12.59,26-11-2024 13.26,2024-11-26 13:39:32,26.63,49.0
15-08-2024 15.37,15-08-2024 15.44,2024-08-15 15:45:00,7.0,25.0
08-08-2024 10.22,08-08-2024 10.25,2024-08-08 10:38:06,3.67,32.0
13-12-2023 12.22,13-12-2023 12.44,2023-12-13 12:48:58,22.43,40.0
03-11-2023 11.44,03-11-2023 12.04,2023-11-03 12:10:06,20.04,28.0
23-01-2024 15.24,23-01-2024 15.38,2024-01-23 15:45:00,14.5,21.0
19-09-2024 11.35,19-09-2024 11.59,2024-09-19 12:09:30,24.01,34.0
30-04-2024 13.42,30-04-2024 13.57,2024-04-30 14:09:37,15.85,25.0
11-05-2024 13.00,11-05-2024 13.01,2024-05-11 13:02:00,1.0,33.0
29-10-2024 09.36,29-10-2024 09.43,2024-10-29 09:55:44,7.85,10.0
10-05-2023 10.37,10-05-2023 11.02,2023-05-10 11:05:12,25.83,37.0
28-10-2023 10.48,28-10-2023 11.23,2023-10-28 11:34:38,35.48,33.0
22-02-2024 13.43,22-02-2024 14.01,2024-02-22 14:09:42,18.93,28.0
11-07-2023 09.34,11-07-2023 10.00,2023-07-11 10:02:02,26.4,53.0
01-07-2023 12.22,01-07-2023 12.34,2023-07-01 12:38:45,12.39,40.0
09-06-2023 10.52,09-06-2023 11.12,2023-06-09 11:30:19,20.33,16.0
30-07-2024 14.44,30-07-2024 14.51,2024-07-30 15:00:29,,32.0
27-07-2024 13.00,27-07-2024 13.01,2024-07-27 13:02:00,1.0,25.0
2023/10/25 12:20:00,25-10-2023 12.31,2023-10-25 12:43:43,11.4,40.0
2023/12/29 09:58:00,29-12-2023 10.09,2023-12-29 10:22:57,11.82,10.0
2024/02/09 12:34:00,09-02-2024 12.56,2024-02-09 13:09:18,22.62,46.0
06-06-2023 13.44,06-06-2023 14.09,2023-06-06 14:21:38,25.36,26.0
10-09-2024 12.59,10-09-2024 13.15,2024-09-10 13:26:05,16.53,0.0
05-06-2024 15.34,05-06-2024 15.44,2024-06-05 15:45:00,10.0,25.0
17-05-2024 13.53,17-05-2024 14.11,2024-05-17 14:22:58,18.31,32.0
18-11-2024 09.15,18-11-2024 09.46,2024-11-18 10:00:05,31.4,49.0
04-10-2024 10.37,04-10-2024 10.54,2024-10-04 11:00:12,17.86,22.0
23-01-2024 13.39,23-01-2024 13.55,2024-01-23 14:06:11,16.46,28.0
15-12-2023 13.40,15-12-2023 13.55,2023-12-15 14:07:48,15.68,25.0
12-06-2023 12.22,12-06-2023 12.45,2023-06-12 12:56:52,23.07,38.0
29-05-2024 14.41,29-05-2024 15.04,2024-05-29 15:15:26,23.38,157.0
2023/08/16 10:12:00,16-08-2023 10.29,2023-08-16 10:39:10,17.78,26.0
09-04-2024 10.02,09-04-2024 10.17,2024-04-09 10:24:15,15.07,15.0
03-02-2023 12.08,03-02-2023 12.45,2023-02-03 12:46:17,37.14,44.0
2024/11/11 14:58:00,11-11-2024 15.03,2024-11-11 15:13:16,5.15,32.0
25-05-2024 10.20,25-05-2024 10.30,2024-05-25 10:41:26,10.49,32.0
20-07-2024 13.00,20-07-2024 13.01,2024-07-20 13:02:00,1.0,71.0
18-09-2023 11.14,18-09-2023 11.33,2023-09-18 11:50:40,19.39,31.0
02-05-2023 10.37,02-05-2023 11.05,2023-05-02 11:16:22,28.31,39.0
23-02-2024 12.07,23-02-2024 12.46,2024-02-23 12:55:34,39.6,57.0
2023/02/18 09:03:00,18-02-2023 09.09,2023-02-18 09:19:47,5.5,32.0
15-07-2023 13.00,15-07-2023 13.01,2023-07-15 13:02:00,1.0,4.0
2023/01/14 12:36:00,14-01-2023 12.59,2023-01-14 13:00:00,23.0,33.0
2024/10/10 10:01:00,10-10-2024 11.29,2024-10-10 11:42:42,88.88,33.0
01-07-2023 10.52,01-07-2023 11.14,2023-07-01 11:25:58,22.67,32.0
28-11-2023 10.01,28-11-2023 10.20,2023-11-28 10:27:37,19.42,21.0
17-04-2023 14.38,17-04-2023 15.05,2023-04-17 15:17:56,27.77,48.0
13-02-2024 15.45,13-02-2024 15.46,2024-02-13 15:47:00,1.0,50.0
04-04-2024 14.03,04-04-2024 14.26,2024-04-04 14:36:37,23.11,29.0
27-01-2024 13.00,27-01-2024 13.01,2024-01-27 13:02:00,1.0,38.0
2023/09/20 12:34:00,20-09-2023 12.40,2023-09-20 12:47:30,6.9,40.0
14-12-2023 14.10,14-12-2023 14.45,2023-12-14 14:51:42,35.9,35.0
11-03-2024 09.52,11-03-2024 10.05,2024-03-11 10:12:35,13.73,15.0
18-01-2023 13.57,18-01-2023 14.25,2023-01-18 14:42:02,28.65,32.0
13-01-2024 10.39,13-01-2024 10.53,2024-01-13 10:57:08,14.55,27.0
10-01-2024 9.17,10-01-2024 09.38,2024-01-10 09:51:16,21.68,35.0
08-11-2023 11.58,08-11-2023 12.15,2023-11-08 12:26:37,17.04,20.0
07-01-2023 13.00,07-01-2023 13.01,2023-01-07 13:02:00,1.0,45.0
03-05-2023 14.25,03-05-2023 14.41,2023-05-03 14:53:31,16.68,30.0
12-04-2023 12.32,12-04-2023 13.05,2023-04-12 13:13:23,33.28,33.0
24-06-2024 12.10,24-06-2024 12.23,2024-06-24 12:41:42,13.95,6.0
18-08-2023 12.20,18-08-2023 12.48,2023-08-18 13:06:09,27.61,24.0
,28-01-2023 13.01,2023-01-28 13:02:00,1.0,25.0
2024/03/01 09:12:00,01-03-2024 09.28,2024-03-01 09:35:12,16.82,26.0
29-01-2024 13.59,29-01-2024 14.08,2024-01-29 14:20:50,9.17,25.0
2024/02/05 09:36:00,05-02-2024 10.08,2024-02-05 10:16:48,32.06,53.0
19-07-2023 10.13,19-07-2023 10.33,2023-07-19 10:53:38,20.12,24.0
01-08-2024 13.16,01-08-2024 13.38,2024-08-01 13:45:09,22.79,29.0
05-03-2024 12.19,05-03-2024 12.42,2024-03-05 12:55:08,23.5,59.0
08-11-2023 14.07,08-11-2023 14.31,2023-11-08 14:34:08,24.6,26.0
23-09-2023 13.00,23-09-2023 13.01,2023-09-23 13:02:00,1.0,34.0
13-03-2023 11.21,13-03-2023 11.52,2023-03-13 12:02:44,31.8,50.0
2024/01/25 14:54:00,25-01-2024 15.09,2024-01-25 15:28:42,15.4,15.0
20-11-2024 15.17,20-11-2024 15.44,2024-11-20 15:45:00,27.0,39.0
17-11-2023 09.15,17-11-2023 09.31,2023-11-17 09:44:15,16.24,36.0
26-12-2023 12.02,26-12-2023 12.22,2023-12-26 12:34:33,20.26,15.0
20-10-2023 10.26,20-10-2023 10.40,2023-10-20 10:53:08,14.03,32.0
12-11-2024 09.54,12-11-2024 10.16,2024-11-12 10:25:35,22.75,29.0
12-07-2024 13.14,12-07-2024 13.37,2024-07-12 13:45:18,23.28,24.0
22-08-2024 09.09,22-08-2024 09.27,2024-08-22 09:38:20,18.28,37.0
29-05-2023 12.11,29-05-2023 12.29,2023-05-29 12:40:07,18.89,39.0
22-08-2024 10.44,22-08-2024 11.02,2024-08-22 11:11:47,18.35,9.0
29-05-2024 9.25,29-05-2024 09.42,2024-05-29 09:51:03,17.46,23.0
02-12-2024 15.30,02-12-2024 15.44,2024-12-02 15:45:00,14.0,30.0
12-08-2023 13.00,12-08-2023 13.01,2023-08-12 13:02:00,1.0,29.0
2023/09/30 13:00:00,30-09-2023 13.01,2023-09-30 13:02:00,1.0,25.0
18-01-2023 09.31,18-01-2023 09.57,2023-01-18 10:08:44,26.12,63.0
2024/04/11 15:38:00,11-04-2024 15.44,2024-04-11 15:45:00,6.0,43.0
12-10-2024 09.30,12-10-2024 09.47,2024-10-12 09:59:24,17.33,36.0
06-09-2023 09.10,06-09-2023 09.40,2023-09-06 09:53:15,30.77,40.0
20-05-2024 14.27,20-05-2024 14.44,2024-05-20 15:01:28,17.84,17.0
16-02-2023 12.14,16-02-2023 12.39,2023-02-16 12:52:10,25.92,37.0
23-08-2023 09.39,23-08-2023 09.49,2023-08-23 10:02:15,10.38,10.0
23-08-2023 14.35,23-08-2023 14.56,2023-08-23 15:07:36,21.47,37.0
18-03-2024 10.26,18-03-2024 10.48,2024-03-18 11:06:35,22.12,32.0
2023/11/20 13:28:00,20-11-2023 13.48,2023-11-20 14:00:58,20.38,25.0
11-08-2023 09.12,11-08-2023 09.31,2023-08-11 09:56:45,19.22,30.0
13-11-2024 11.47,13-11-2024 12.10,2024-11-13 12:19:55,23.81,41.0
13-04-2023 13.26,13-04-2023 13.48,2023-04-13 13:58:01,22.48,17.0
13-07-2024 13.00,13-07-2024 13.01,2024-07-13 13:02:00,1.0,40.0
19-07-2023 14.05,19-07-2023 14.50,2023-07-19 14:59:58,45.44,71.0
08-05-2023 12.22,08-05-2023 12.45,2023-05-08 12:55:55,23.82,36.0
21-02-2024 13.31,21-02-2024 13.41,2024-02-21 13:52:08,10.22,18.0
15-02-2023 09.33,15-02-2023 09.47,2023-02-15 09:59:45,14.21,34.0
29-06-2024 10.09,29-06-2024 10.38,2024-06-29 10:49:22,29.99,38.0
,12-08-2023 12.59,2023-08-12 13:00:00,15.0,40.0
23-08-2023 15.45,23-08-2023 15.46,2023-08-23 15:47:00,1.0,40.0
02-03-2023 10.30,02-03-2023 10.52,2023-03-02 11:02:47,22.7,30.0
17-02-2023 10.01,17-02-2023 10.27,2023-02-17 10:46:11,26.44,
05-08-2023 09.18,05-08-2023 09.51,2023-08-05 09:58:38,33.39,45.0
2023/10/27 11:20:00,27-10-2023 11.22,2023-10-27 11:25:07,2.39,2.0
25-07-2023 10.56,25-07-2023 11.15,2023-07-25 11:25:25,19.37,33.0
11-05-2024 11.21,11-05-2024 11.43,2024-05-11 11:57:00,22.08,20.0
2023/03/31 15:43:00,31-03-2023 15.44,2023-03-31 15:45:00,1.0,35.0
22-06-2023 13.45,22-06-2023 14.11,2023-06-22 14:25:36,26.83,38.0
27-03-2023 9.50,27-03-2023 10.13,2023-03-27 10:22:31,23.79,38.0
26-03-2024 13.23,26-03-2024 13.40,2024-03-26 13:45:19,17.44,33.0
2023/02/18 12:24:00,18-02-2023 12.38,2023-02-18 12:53:30,14.37,40.0
2023/04/11 14:45:00,11-04-2023 15.17,2023-04-11 15:18:06,32.0,47.0
,25-11-2024 10.31,2024-11-25 10:40:05,17.15,26.0
28-03-2023 15.09,28-03-2023 15.35,2023-03-28 15:45:00,26.49,41.0
02-07-2024 12.55,02-07-2024 13.07,2024-07-02 13:22:00,12.63,29.0
06-04-2023 12.25,06-04-2023 12.48,2023-04-06 13:07:44,23.95,40.0
03-06-2023 11.08,03-06-2023 11.35,2023-06-03 11:45:16,27.66,38.0
09-02-2023 14.26,09-02-2023 14.50,2023-02-09 15:05:52,24.07,43.0
19-08-2023 13.00,19-08-2023 13.01,2023-08-19 13:02:00,1.0,20.0
13-11-2023 10.39,13-11-2023 10.53,2023-11-13 10:55:16,14.05,24.0
07-09-2023 12.47,07-09-2023 13.14,2023-09-07 13:24:45,27.27,32.0
25-08-2023 12.05,25-08-2023 12.26,2023-08-25 12:35:52,21.01,30.0
11-02-2023 13.00,11-02-2023 13.01,2023-02-11 13:02:00,1.0,19.0
2023/04/03 11:54:00,03-04-2023 12.17,2023-04-03 12:23:16,23.15,32.0
18-05-2024 13.00,18-05-2024 13.01,2024-05-18 13:02:00,1.0,25.0
21-11-2024 12.43,21-11-2024 12.52,2024-11-21 13:03:41,9.5,40.0
2023/01/07 12:38:00,07-01-2023 12.59,2023-01-07 13:00:00,21.0,46.0
24-04-2023 13.47,24-04-2023 14.05,2023-04-24 14:16:48,18.51,26.0
18-11-2023 09.51,18-11-2023 10.18,2023-11-18 10:28:35,27.5,26.0
2024/02/06 12:40:00,06-02-2024 13.03,2024-02-06 13:07:00,23.01,
22-02-2024 11.49,22-02-2024 12.11,2024-02-22 12:27:02,22.34,34.0
25-06-2024 13.34,25-06-2024 14.02,2024-06-25 14:13:01,28.67,33.0
2023/01/12 15:35:00,12-01-2023 15.44,2023-01-12 15:45:00,9.0,58.0
01-07-2024 12.13,01-07-2024 12.39,2024-07-01 12:52:27,26.16,400.0
15-08-2024 15.38,15-08-2024 15.44,2024-08-15 15:45:00,6.0,59.0
2024/06/13 10:04:00,13-06-2024 10.14,2024-06-13 10:28:09,10.27,21.0
06-06-2024 10.10,06-06-2024 10.31,2024-06-06 10:47:04,21.83,23.0
2023/03/01 14:16:00,01-03-2023 14.24,2023-03-01 14:32:33,8.95,17.0
05-07-2023 15.04,05-07-2023 15.27,2023-07-05 15:39:10,23.86,33.0
16-10-2023 11.38,16-10-2023 11.48,2023-10-16 11:59:06,9.31,13.0
19-07-2024 11.40,19-07-2024 12.05,2024-07-19 12:16:51,25.39,29.0
24-05-2024 10.20,24-05-2024 10.59,2024-05-24 11:08:50,39.16,44.0
2024/08/23 10:29:00,23-08-2024 10.31,2024-08-23 10:37:27,2.72,32.0
19-06-2024 14.09,19-06-2024 14.32,2024-06-19 14:33:37,23.62,36.0
27-06-2024 14.52,27-06-2024 15.14,2024-06-27 15:29:01,22.17,26.0
11-09-2024 13.05,11-09-2024 13.36,2024-09-11 13:42:20,,36.0
2023/02/07 09:39:00,07-02-2023 09.48,2023-02-07 10:00:16,9.99,10.0
13-09-2023 10.28,13-09-2023 10.43,2023-09-13 10:59:38,15.49,32.0
28-01-2023 13.00,28-01-2023 13.01,2023-01-28 13:02:00,1.0,23.0
31-10-2024 14.39,31-10-2024 14.57,2024-10-31 15:12:43,17.76,28.0
16-11-2024 10.39,16-11-2024 10.47,2024-11-16 10:57:32,8.06,32.0
2024/11/05 13:21:00,05-11-2024 13.51,2024-11-05 14:00:18,30.17,33.0
2023/08/07 10:30:00,07-08-2023 10.50,2023-08-07 11:02:43,20.05,20.0
,02-12-2024 12.36,2024-12-02 12:46:56,35.64,45.0
13-09-2023 09.14,13-09-2023 09.34,2023-09-13 09:46:12,20.14,34.0
30-10-2024 11.54,30-10-2024 12.11,2024-10-30 12:23:48,17.26,25.0
17-02-2024 12.43,17-02-2024 12.50,2024-02-17 12:58:39,7.32,40.0
14-11-2024 10.37,14-11-2024 11.09,2024-11-14 11:24:50,32.41,50.0
25-07-2024 10.59,25-07-2024 11.14,2024-07-25 11:26:02,15.82,37.0
28-02-2024 10.05,28-02-2024 10.23,2024-02-28 10:43:25,18.57,0.0
23-05-2023 12.21,23-05-2023 12.41,2023-05-23 12:50:51,20.66,33.0
2024/08/17 13:00:00,17-08-2024 13.01,2024-08-17 13:02:00,1.0,17.0
24-07-2023 09.09,24-07-2023 09.31,2023-07-24 09:43:06,22.18,39.0
28-03-2024 14.58,28-03-2024 15.12,2024-03-28 15:27:20,13.6,0.0
11-02-2023 13.00,11-02-2023 13.01,2023-02-11 13:02:00,1.0,17.0
02-05-2023 12.57,02-05-2023 13.11,2023-05-02 13:21:15,14.45,33.0
,08-01-2024 10.22,2024-01-08 10:32:54,23.4,45.0
16-02-2023 15.02,16-02-2023 15.33,2023-02-16 15:34:49,31.01,42.0
05-09-2023 11.26,05-09-2023 11.58,2023-09-05 12:10:16,32.48,39.0
24-01-2023 14.30,24-01-2023 14.57,2023-01-24 15:07:13,27.28,44.0
20-09-2024 15.33,20-09-2024 15.44,2024-09-20 15:45:00,11.0,25.0
2024/04/12 14:16:00,12-04-2024 14.25,2024-04-12 14:34:41,9.59,17.0
2023/11/27 09:13:00,27-11-2023 09.45,2023-11-27 09:53:22,32.03,191.0
16-08-2023 10.40,16-08-2023 11.02,2023-08-16 11:13:28,22.98,31.0
25-02-2023 12.31,25-02-2023 12.59,2023-02-25 13:00:00,28.0,44.0
25-01-2024 15.23,25-01-2024 15.38,2024-01-25 15:45:00,15.86,22.0
05-04-2023 12.13,05-04-2023 12.33,2023-04-05 12:50:55,20.02,16.0
2024/06/14 10:59:00,14-06-2024 11.20,2024-06-14 11:28:20,21.44,125.0
2024/11/15 13:44:00,15-11-2024 14.13,2024-11-15 14:26:39,29.64,26.0
08-04-2023 11.36,08-04-2023 12.10,2023-04-08 12:28:39,34.69,45.0
26-04-2024 10.13,26-04-2024 10.42,2024-04-26 10:57:35,29.48,38.0
27-01-2023 15.03,27-01-2023 15.29,2023-01-27 15:40:56,26.27,39.0
03-08-2023 14.22,03-08-2023 14.32,2023-08-03 14:43:36,10.11,17.0
2023/07/12 09:42:00,12-07-2023 10.02,2023-07-12 10:14:15,20.39,34.0
21-09-2024 10.06,21-09-2024 10.25,2024-09-21 10:35:07,19.58,21.0
02-12-2024 14.29,02-12-2024 14.58,2024-12-02 15:08:46,29.01,39.0
13-03-2023 14.38,13-03-2023 14.53,2023-03-13 15:09:26,15.23,25.0
03-10-2023 14.52,03-10-2023 15.14,2023-10-03 15:26:21,21.83,41.0
14-09-2024 12.14,14-09-2024 12.32,2024-09-14 12:39:46,18.37,23.0
2023/02/25 09:00:00,25-02-2023 09.24,2023-02-25 09:33:59,24.62,28.0
19-09-2024 13.09,19-09-2024 13.27,2024-09-19 13:37:16,18.98,45.0
27-12-2023 11.39,27-12-2023 11.56,2023-12-27 12:05:01,17.2,29.0
09-03-2023 12.40,09-03-2023 13.04,2023-03-09 13:13:09,24.42,36.0
21-06-2024 09.11,21-06-2024 09.28,2024-06-21 09:33:59,17.37,6.0
16-08-2023 11.05,16-08-2023 11.29,2023-08-16 11:45:30,23.67,34.0
05-07-2023 10.10,05-07-2023 10.49,2023-07-05 11:02:50,39.15,36.0
09-10-2023 13.52,09-10-2023 14.15,2023-10-09 14:26:15,23.13,36.0
09-05-2024 14.29,09-05-2024 15.44,2024-05-09 15:45:00,75.0,48.0
,02-03-2024 11.40,2024-03-02 11:52:29,86.45,33.0
2023/05/17 09:22:00,17-05-2023 09.38,2023-05-17 09:51:40,16.3,36.0
26-09-2024 15.07,26-09-2024 15.32,2024-09-26 15:42:30,25.87,36.0
2024/02/28 09:39:00,28-02-2024 09.47,2024-02-28 09:56:48,8.22,15.0
11-08-2023 15.12,11-08-2023 15.44,2023-08-11 15:45:00,32.0,41.0
10-11-2023 12.44,10-11-2023 12.57,2023-11-10 12:59:49,13.56,32.0
27-11-2024 12.56,27-11-2024 13.20,2024-11-27 13:21:34,24.15,21.0
03-11-2023 13.57,03-11-2023 14.05,2023-11-03 14:20:14,8.92,20.0
18-05-2023 15.18,18-05-2023 15.44,2023-05-18 15:45:00,26.0,27.0
06-01-2024 09.25,06-01-2024 09.47,2024-01-06 10:01:37,22.94,35.0
16-07-2024 12.43,16-07-2024 12.55,2024-07-16 13:08:19,12.39,40.0
22-10-2024 11.52,22-10-2024 12.07,2024-10-22 12:16:27,15.14,29.0
16-09-2023 13.00,16-09-2023 13.01,2023-09-16 13:02:00,1.0,44.0
2024/02/14 13:19:00,14-02-2024 13.35,2024-02-14 13:45:41,15.78,14.0
06-07-2023 13.06,06-07-2023 13.37,2023-07-06 13:51:33,31.45,36.0
2023/01/12 10:18:00,12-01-2023 10.43,2023-01-12 10:51:35,25.35,40.0
2023/09/11 12:34:00,11-09-2023 12.40,2023-09-11 12:47:23,6.43,40.0
2023/08/17 11:17:00,17-08-2023 11.38,2023-08-17 12:00:31,21.77,34.0
08-11-2023 14.13,08-11-2023 14.29,2023-11-08 14:45:26,16.13,17.0
03-05-2023 11.35,03-05-2023 11.53,2023-05-03 12:03:07,18.02,38.0
26-07-2024 10.42,26-07-2024 10.49,2024-07-26 11:01:52,7.5,32.0
29-07-2023 9.55,29-07-2023 10.24,2023-07-29 10:35:41,29.32,38.0
23-10-2024 13.06,23-10-2024 13.23,2024-10-23 13:34:28,17.17,45.0
06-04-2023 14.44,06-04-2023 14.58,2023-04-06 15:09:16,14.85,27.0
17-02-2023 12.38,17-02-2023 12.40,2023-02-17 12:54:47,2.4,40.0
01-08-2024 14.12,01-08-2024 14.25,2024-08-01 14:39:57,13.64,18.0
31-01-2023 11.21,31-01-2023 11.47,2023-01-31 11:58:01,26.83,32.0
21-02-2024 10.55,21-02-2024 11.22,2024-02-21 11:36:51,27.65,37.0
2024/09/03 10:15:00,03-09-2024 10.37,2024-09-03 10:41:38,22.46,22.0
31-03-2023 10.37,31-03-2023 11.02,2023-03-31 11:11:46,25.13,58.0
08-09-2023 12.12,08-09-2023 12.41,2023-09-08 12:56:23,29.88,43.0
29-09-2023 09.36,29-09-2023 09.52,2023-09-29 09:57:44,16.25,169.0
28-05-2024 14.27,28-05-2024 14.47,2024-05-28 14:53:12,20.59,23.0
11-12-2023 11.59,11-12-2023 12.29,2023-12-11 12:48:58,30.73,22.0
11-08-2023 12.19,11-08-2023 12.43,2023-08-11 12:54:10,24.66,59.0
,13-01-2024 09.52,2024-01-13 10:05:04,8.41,17.0
27-09-2023 10.24,27-09-2023 10.38,2023-09-27 10:47:28,14.5,18.0
09-04-2024 14.32,09-04-2024 14.52,2024-04-09 14:59:54,20.18,37.0
13-08-2024 15.34,13-08-2024 15.44,2024-08-13 15:45:00,9.67,38.0
28-03-2024 12.38,28-03-2024 12.55,2024-03-28 13:06:53,17.52,11.0
,27-08-2024 14.11,2024-08-27 14:23:19,7.88,17.0
12-06-2024 14.33,12-06-2024 14.49,2024-06-12 14:59:48,16.87,42.0
05-02-2024 10.09,05-02-2024 10.50,2024-02-05 11:00:29,41.45,57.0
04-06-2024 13.46,04-06-2024 14.09,2024-06-04 14:17:47,23.31,25.0
19-05-2023 15.33,19-05-2023 15.38,2023-05-19 15:45:00,5.13,
23-05-2024 11.44,23-05-2024 12.12,2024-05-23 12:21:16,28.26,25.0
01-07-2023 09.51,01-07-2023 10.22,2023-07-01 10:34:47,31.26,46.0
26-09-2023 09.57,26-09-2023 10.14,2023-09-26 10:31:41,16.95,47.0
2024/02/16 11:59:00,16-02-2024 12.27,2024-02-16 12:40:06,28.41,56.0
13-10-2023 11.44,13-10-2023 12.10,2023-10-13 12:25:51,26.17,14.0
12-04-2024 12.37,12-04-2024 13.03,2024-04-12 13:28:25,26.06,40.0
01-03-2024 12.31,01-03-2024 12.55,2024-03-01 13:08:01,24.98,39.0
2023/05/04 11:07:00,04-05-2023 11.33,2023-05-04 11:41:34,26.85,38.0
2024/10/23 12:32:00,23-10-2024 13.15,2024-10-23 13:27:05,43.45,57.0
19-12-2023 15.45,19-12-2023 15.46,2023-12-19 15:47:00,1.0,28.0
01-05-2023 11.04,01-05-2023 11.31,2023-05-01 11:34:33,27.41,33.0
24-09-2024 09.53,24-09-2024 10.18,2024-09-24 10:34:22,25.41,30.0
07-01-2023 13.00,07-01-2023 13.01,2023-01-07 13:02:00,1.0,37.0
07-08-2023 14.27,07-08-2023 14.48,2023-08-07 15:00:36,22.0,27.0
11-10-2023 13.57,11-10-2023 14.15,2023-10-11 14:22:06,18.48,20.0
2023/01/06 11:18:00,06-01-2023 11.42,2023-01-06 11:52:47,24.67,34.0
2023/09/23 11:27:00,23-09-2023 11.49,2023-09-23 12:00:02,22.52,32.0
20-03-2023 13.23,20-03-2023 13.39,2023-03-20 13:50:29,16.12,17.0
2023/03/14 15:16:00,14-03-2023 15.43,2023-03-14 15:45:00,27.72,44.0
25-08-2023 11.54,25-08-2023 12.19,2023-08-25 12:32:39,25.64,45.0
27-03-2023 10.55,27-03-2023 11.24,2023-03-27 11:30:38,29.79,205.0
2024/09/20 12:34:00,20-09-2024 12.45,2024-09-20 12:58:19,11.61,40.0
29-05-2023 10.50,29-05-2023 11.03,2023-05-29 11:18:23,13.07,33.0
26-10-2024 13.00,26-10-2024 13.01,2024-10-26 13:02:00,1.0,40.0
18-09-2023 15.04,18-09-2023 15.10,2023-09-18 15:25:11,6.71,7.0
06-11-2023 14.33,06-11-2023 14.51,2023-11-06 15:00:21,18.57,27.0
,29-04-2024 11.11,2024-04-29 11:23:30,13.01,33.0
20-12-2023 11.40,20-12-2023 12.01,2023-12-20 12:02:52,21.87,30.0
07-02-2024 14.06,07-02-2024 14.29,2024-02-07 14:41:22,23.11,15.0
28-03-2024 12.03,28-03-2024 12.33,2024-03-28 12:54:22,,26.0
02-09-2024 14.59,02-09-2024 15.19,2024-09-02 15:30:55,20.72,8.0
18-09-2023 10.09,18-09-2023 10.26,2023-09-18 10:38:51,17.08,26.0
12-06-2024 14.54,12-06-2024 15.16,2024-06-12 15:26:40,22.42,52.0
24-08-2024 10.11,24-08-2024 10.25,2024-08-24 10:43:10,14.77,
21-01-2023 11.01,21-01-2023 11.15,2023-01-21 11:25:51,14.62,37.0
19-01-2023 11.36,19-01-2023 12.05,2023-01-19 12:17:43,29.45,59.0
27-06-2024 12.29,27-06-2024 12.33,2024-06-27 12:41:00,4.79,40.0
25-03-2023 13.00,25-03-2023 13.01,2023-03-25 13:02:00,1.0,31.0
2023/04/26 15:41:00,26-04-2023 15.44,2023-04-26 15:45:00,3.0,25.0
08-04-2024 10.25,08-04-2024 10.52,2024-04-08 11:05:18,27.39,29.0
30-07-2024 12.16,30-07-2024 12.22,2024-07-30 12:31:53,6.7,17.0
13-05-2024 15.45,13-05-2024 15.46,2024-05-13 15:47:00,1.0,0.0
03-02-2023 11.42,03-02-2023 12.10,2023-02-03 12:24:11,28.78,35.0
25-04-2024 13.20,25-04-2024 14.31,2024-04-25 14:40:26,70.89,20.0
28-04-2023 13.40,28-04-2023 13.57,2023-04-28 14:09:39,17.13,32.0
29-05-2023 9.10,29-05-2023 09.37,2023-05-29 09:43:46,27.78,55.0
2024/03/13 14:41:00,13-03-2024 15.02,2024-03-13 15:11:00,21.4,36.0
14-04-2023 12.55,14-04-2023 13.30,2023-04-14 13:36:05,35.32,36.0
2024/03/14 15:43:00,14-03-2024 15.44,2024-03-14 15:45:00,1.0,51.0
23-09-2023 10.16,23-09-2023 10.18,2023-09-23 10:26:52,2.93,32.0
2023/08/24 11:55:00,24-08-2023 12.20,2023-08-24 12:27:55,25.04,41.0
2024/09/21 13:00:00,21-09-2024 13.01,2024-09-21 13:02:00,1.0,27.0
15-07-2023 11.52,15-07-2023 12.19,2023-07-15 12:35:15,27.07,36.0
25-05-2023 09.54,25-05-2023 10.06,2023-05-25 10:09:19,12.01,24.0
06-06-2023 10.26,06-06-2023 10.52,2023-06-06 10:54:07,26.31,62.0
13-01-2024 10.29,13-01-2024 10.49,2024-01-13 10:59:35,200.0,47.0
10-02-2024 12.36,10-02-2024 12.55,2024-02-10 13:00:00,19.49,16.0
27-06-2024 15.17,27-06-2024 15.27,2024-06-27 15:43:28,,4.0
2023/07/15 10:26:00,15-07-2023 11.00,2023-07-15 11:13:21,34.54,36.0
27-05-2024 15.45,27-05-2024 15.46,2024-05-27 15:47:00,1.0,50.0
24-01-2024 9.09,24-01-2024 09.30,2024-01-24 09:45:35,21.69,
30-06-2023 12.47,30-06-2023 13.08,2023-06-30 13:34:04,21.88,40.0
28-12-2023 10.22,28-12-2023 10.42,2023-12-28 10:51:51,20.07,28.0
11-01-2024 10.41,11-01-2024 11.40,2024-01-11 11:55:42,59.26,32.0
18-08-2023 13.04,18-08-2023 13.30,2023-08-18 13:42:40,26.38,36.0
16-11-2023 09.57,16-11-2023 10.18,2023-11-16 10:29:59,21.75,23.0
22-07-2024 10.49,22-07-2024 11.18,2024-07-22 11:23:34,29.34,45.0
13-10-2023 09.40,13-10-2023 10.04,2023-10-13 10:11:10,24.96,31.0
02-11-2023 13.05,02-11-2023 13.20,2023-11-02 13:32:53,15.45,32.0
03-11-2023 15.10,03-11-2023 15.23,2023-11-03 15:32:02,13.02,8.0
15-04-2023 12.17,15-04-2023 12.23,2023-04-15 12:33:14,6.07,17.0
2023/08/01 09:39:00,01-08-2023 09.47,2023-08-01 09:57:28,8.83,10.0
2024/05/29 09:16:00,29-05-2024 09.42,2024-05-29 09:50:20,26.14,21.0
07-08-2023 12.53,07-08-2023 13.16,2023-08-07 13:28:09,23.49,45.0
09-11-2024 12.51,09-11-2024 12.59,2024-11-09 13:00:00,8.0,13.0
18-10-2024 09.24,18-10-2024 09.46,2024-10-18 09:59:00,22.67,35.0
15-07-2024 09.10,15-07-2024 09.36,2024-07-15 09:46:05,26.49,37.0
01-08-2024 14.20,01-08-2024 14.31,2024-08-01 14:41:07,11.72,20.0
18-11-2024 14.57,18-11-2024 15.08,2024-11-18 15:15:59,11.46,19.0
28-05-2024 12.35,28-05-2024 12.47,2024-05-28 13:00:13,12.13,40.0
22-11-2024 15.42,22-11-2024 15.44,2024-11-22 15:45:00,,15.0
25-10-2024 10.07,25-10-2024 10.26,2024-10-25 10:27:52,19.88,34.0
03-06-2023 11.29,03-06-2023 11.41,2023-06-03 11:48:32,12.17,23.0
09-03-2023 11.39,09-03-2023 11.58,2023-03-09 12:12:26,19.78,21.0
26-01-2024 14.32,26-01-2024 14.45,2024-01-26 14:57:04,13.95,38.0
31-10-2023 13.35,31-10-2023 14.03,2023-10-31 14:11:59,28.46,25.0
27-04-2024 13.00,27-04-2024 13.01,2024-04-27 13:02:00,1.0,17.0
10-01-2024 11.44,10-01-2024 12.00,2024-01-10 12:09:39,16.25,28.0
12-06-2024 11.56,12-06-2024 12.23,2024-06-12 12:36:43,27.04,56.0
2023/01/18 12:35:00,18-01-2023 13.07,2023-01-18 13:21:51,32.58,44.0
02-12-2023 13.00,02-12-2023 13.01,2023-12-02 13:02:00,1.0,17.0
2023/09/08 11:21:00,08-09-2023 11.48,2023-09-08 11:54:10,27.69,38.0
27-09-2023 12.47,27-09-2023 13.19,2023-09-27 13:31:09,32.75,44.0
30-09-2024 11.09,30-09-2024 11.30,2024-09-30 11:47:48,21.37,40.0
04-01-2024 09.24,04-01-2024 09.45,2024-01-04 09:53:24,20.45,40.0
12-04-2024 10.09,12-04-2024 10.28,2024-04-12 10:37:00,19.67,23.0
27-02-2023 14.05,27-02-2023 14.17,2023-02-27 14:29:33,12.87,25.0
2024/07/08 12:43:00,08-07-2024 13.10,2024-07-08 13:20:05,26.5,26.0
23-03-2023 10.13,23-03-2023 10.22,2023-03-23 10:30:51,9.12,5.0
24-02-2023 11.46,24-02-2023 12.11,2023-02-24 12:17:37,25.66,29.0
14-04-2023 12.04,14-04-2023 12.34,2023-04-14 12:43:56,30.53,31.0
22-07-2024 11.56,22-07-2024 12.18,2024-07-22 12:25:02,22.72,28.0
04-11-2023 13.00,04-11-2023 13.01,2023-11-04 13:02:00,1.0,25.0
15-08-2024 10.17,15-08-2024 10.22,2024-08-15 10:32:57,5.38,5.0
,03-08-2024 10.58,2024-08-03 11:24:14,21.65,40.0
21-05-2024 11.59,21-05-2024 12.14,2024-05-21 12:25:09,15.29,25.0
20-02-2024 15.41,20-02-2024 15.42,2024-02-20 15:43:00,1.0,25.0
27-01-2023 13.48,27-01-2023 14.16,2023-01-27 14:26:15,28.34,49.0
18-12-2023 09.40,18-12-2023 09.41,2023-12-18 09:48:38,1.0,10.0
2023/07/17 10:18:00,17-07-2023 10.24,2023-07-17 10:37:57,,32.0
08-07-2024 13.04,08-07-2024 13.26,2024-07-08 13:37:25,21.64,27.0
03-10-2023 13.20,03-10-2023 13.49,2023-10-03 14:00:16,29.68,35.0
15-09-2023 13.56,15-09-2023 14.12,2023-09-15 14:25:31,16.7,29.0
28-08-2024 10.26,28-08-2024 10.50,2024-08-28 11:01:28,24.6,30.0
30-01-2024 11.39,30-01-2024 11.55,2024-01-30 12:09:18,16.24,32.0
28-02-2023 11.54,28-02-2023 12.17,2023-02-28 12:34:39,23.16,33.0
01-04-2024 09.56,01-04-2024 10.08,2024-04-01 10:22:45,11.81,17.0
03-07-2024 10.34,03-07-2024 11.05,2024-07-03 11:13:58,31.5,33.0
08-03-2024 11.02,08-03-2024 11.21,2024-03-08 11:32:23,19.41,24.0
01-04-2024 12.00,01-04-2024 12.24,2024-04-01 12:33:56,24.09,23.0
28-04-2023 10.35,28-04-2023 10.45,2023-04-28 10:53:52,10.19,32.0
02-01-2024 12.43,02-01-2024 13.02,2024-01-02 13:19:11,19.52,
08-02-2023 09.20,08-02-2023 09.41,2023-02-08 09:52:34,,26.0
29-07-2023 13.00,29-07-2023 13.01,2023-07-29 13:02:00,1.0,27.0
2023/03/27 14:05:00,27-03-2023 14.48,2023-03-27 15:00:21,43.65,71.0
19-11-2024 12.38,19-11-2024 12.48,2024-11-19 13:00:49,11.0,40.0
14-07-2023 12.35,14-07-2023 12.37,2023-07-14 12:41:42,2.59,40.0
23-01-2024 12.33,23-01-2024 12.36,2024-01-23 12:47:03,3.46,40.0
15-08-2023 14.28,15-08-2023 14.44,2023-08-15 14:58:31,16.87,54.0
20-03-2023 12.48,20-03-2023 13.09,2023-03-20 13:19:51,21.1,19.0
15-03-2024 10.36,15-03-2024 10.50,2024-03-15 10:58:59,14.2,19.0
13-05-2024 11.37,13-05-2024 11.44,2024-05-13 12:10:47,7.91,19.0
06-02-2024 15.23,06-02-2024 15.44,2024-02-06 15:45:00,21.26,20.0
19-07-2024 14.04,19-07-2024 14.14,2024-07-19 14:25:51,10.84,17.0
2023/06/12 11:28:00,12-06-2023 11.58,2023-06-12 12:16:47,30.31,45.0
17-04-2024 10.31,17-04-2024 10.52,2024-04-17 11:04:12,21.16,47.0
20-11-2024 09.24,20-11-2024 09.49,2024-11-20 10:13:08,25.75,30.0
18-03-2023 12.46,18-03-2023 12.52,2023-03-18 13:00:00,6.19,32.0
2024/05/16 09:18:00,16-05-2024 09.45,2024-05-16 09:46:40,27.62,47.0
13-03-2023 12.20,13-03-2023 12.38,2023-03-13 12:48:37,18.43,28.0
2023/11/02 09:49:00,02-11-2023 10.22,2023-11-02 10:32:29,33.1,52.0
2024/09/23 12:26:00,23-09-2024 12.44,2024-09-23 12:46:33,18.92,32.0
07-10-2024 13.53,07-10-2024 14.02,2024-10-07 14:14:39,9.25,25.0
02-10-2023 13.48,02-10-2023 14.04,2023-10-02 14:16:01,16.18,26.0
08-04-2024 12.23,08-04-2024 12.43,2024-04-08 12:55:11,20.54,18.0
03-01-2024 15.04,03-01-2024 15.34,2024-01-03 15:40:52,30.08,49.0
08-10-2024 13.03,08-10-2024 13.27,2024-10-08 13:39:01,24.02,41.0
2023/03/02 12:03:00,02-03-2023 12.29,2023-03-02 12:46:55,27.0,22.0
18-01-2023 10.56,18-01-2023 11.15,2023-01-18 11:24:47,19.84,42.0
06-05-2023 13.00,06-05-2023 13.01,2023-05-06 13:02:00,1.0,36.0
10-10-2023 09.27,10-10-2023 09.43,2023-10-10 09:53:45,16.63,34.0
27-06-2024 14.07,27-06-2024 14.28,2024-06-27 14:30:59,21.29,38.0
2024/01/30 11:57:00,30-01-2024 12.16,2024-01-30 12:27:00,19.02,32.0
10-03-2023 13.30,10-03-2023 13.43,2023-03-10 13:53:35,13.72,18.0
17-07-2024 12.17,17-07-2024 12.42,2024-07-17 12:47:00,25.26,52.0
2024/03/21 14:16:00,21-03-2024 14.24,2024-03-21 14:36:43,8.07,221.0
2024/02/01 13:01:00,01-02-2024 13.28,2024-02-01 13:43:24,27.6,36.0
15-01-2024 13.22,15-01-2024 13.50,2024-01-15 14:04:09,28.84,57.0
27-09-2023 13.34,27-09-2023 14.03,2023-09-27 14:13:02,29.25,36.0
03-01-2024 10.31,03-01-2024 10.59,2024-01-03 11:13:03,27.96,40.0
03-03-2023 10.30,03-03-2023 10.36,2023-03-03 10:41:55,6.65,
14-03-2024 11.54,14-03-2024 12.30,2024-03-14 12:36:20,36.35,48.0
25-10-2024 12.42,25-10-2024 13.03,2024-10-25 13:13:06,21.5,45.0
2024/06/11 15:39:00,11-06-2024 15.44,2024-06-11 15:45:00,5.0,48.0
10-10-2023 11.25,10-10-2023 11.40,2023-10-10 11:49:01,15.52,125.0
2024/01/02 12:25:00,02-01-2024 12.34,2024-01-02 12:45:21,9.24,40.0
2023/06/12 09:05:00,12-06-2023 09.29,2023-06-12 09:37:26,24.99,38.0
08-07-2023 13.00,08-07-2023 13.01,2023-07-08 13:02:00,1.0,43.0
19-11-2024 09.43,19-11-2024 10.05,2024-11-19 10:25:08,22.35,26.0
30-12-2023 12.43,30-12-2023 12.52,2023-12-30 12:58:43,9.1,40.0
19-05-2023 10.50,19-05-2023 11.08,2023-05-19 11:21:08,18.8,55.0
20-11-2024 13.42,20-11-2024 14.06,2024-11-20 14:25:37,24.65,43.0
25-01-2023 15.27,25-01-2023 15.44,2023-01-25 15:45:00,17.0,57.0
24-01-2024 13.52,24-01-2024 14.08,2024-01-24 14:21:49,16.95,27.0
27-08-2024 12.32,27-08-2024 13.00,2024-08-27 13:10:49,27.53,26.0
13-07-2023 12.08,13-07-2023 12.30,2023-07-13 12:43:00,22.74,47.0
26-02-2024 12.20,26-02-2024 12.31,2024-02-26 12:42:48,11.03,31.0
01-07-2023 13.00,01-07-2023 13.01,2023-07-01 13:02:00,,15.0
09-07-2024 11.45,09-07-2024 12.12,2024-07-09 12:25:34,27.73,32.0
2023/03/28 14:35:00,28-03-2023 14.52,2023-03-28 15:01:55,17.79,14.0
2024/11/22 13:45:00,22-11-2024 14.10,2024-11-22 14:20:18,25.83,51.0
22-11-2023 10.45,22-11-2023 10.54,2023-11-22 11:04:32,9.49,18.0
07-10-2024 10.44,07-10-2024 10.55,2024-10-07 11:05:54,11.63,14.0
20-09-2024 14.57,20-09-2024 15.25,2024-09-20 15:38:29,28.36,29.0
06-01-2024 13.00,06-01-2024 13.01,2024-01-06 13:02:00,1.0,28.0
02-03-2024 12.56,02-03-2024 12.59,2024-03-02 13:00:00,3.0,30.0
07-05-2024 13.34,07-05-2024 13.55,2024-05-07 14:05:24,21.9,17.0
2023/01/11 10:18:00,11-01-2023 11.46,2023-01-11 11:57:56,88.02,33.0
20-03-2023 12.50,20-03-2023 13.27,2023-03-20 13:37:47,37.79,49.0
08-06-2023 13.17,08-06-2023 13.26,2023-06-08 13:33:09,9.98,20.0
2024/05/27 09:55:00,27-05-2024 10.31,2024-05-27 10:41:26,36.31,57.0
11-09-2023 11.57,11-09-2023 12.16,2023-09-11 12:25:08,19.88,60.0
02-05-2024 09.12,02-05-2024 09.45,2024-05-02 09:57:43,33.83,45.0
2023/12/28 11:56:00,28-12-2023 12.11,2023-12-28 12:15:58,15.05,27.0
21-08-2023 10.30,21-08-2023 11.09,2023-08-21 11:19:18,39.29,33.0
16-04-2024 12.09,16-04-2024 12.29,2024-04-16 12:38:41,20.44,28.0
16-07-2024 12.38,16-07-2024 12.59,2024-07-16 13:11:37,21.78,34.0
2024/09/27 11:51:00,27-09-2024 12.08,2024-09-27 12:14:43,17.75,28.0
12-06-2023 09.05,12-06-2023 09.28,2023-06-12 09:34:30,23.65,20.0
24-10-2024 14.38,24-10-2024 14.51,2024-10-24 15:01:03,13.78,30.0
21-11-2024 12.30,21-11-2024 12.34,2024-11-21 12:39:45,4.97,40.0
20-10-2023 13.04,20-10-2023 13.20,2023-10-20 13:28:12,16.52,32.0
20-12-2023 10.40,20-12-2023 10.52,2023-12-20 11:05:01,12.99,24.0
27-02-2024 11.14,27-02-2024 11.35,2024-02-27 11:51:29,21.42,40.0
03-02-2024 12.57,03-02-2024 12.59,2024-02-03 13:00:00,2.0,3.0
08-09-2023 13.28,08-09-2023 13.50,2023-09-08 13:55:17,22.97,48.0
26-04-2024 09.24,26-04-2024 09.53,2024-04-26 09:55:26,29.87,55.0
13-03-2023 11.36,13-03-2023 12.10,2023-03-13 12:17:41,34.45,57.0
04-03-2024 14.49,04-03-2024 15.08,2024-03-04 15:20:52,19.6,26.0
22-06-2024 13.00,22-06-2024 13.01,2024-06-22 13:02:00,1.0,35.0
20-03-2023 14.18,20-03-2023 14.36,2023-03-20 14:45:04,18.6,45.0
2024/08/13 09:52:00,13-08-2024 10.17,2024-08-13 10:20:18,25.19,42.0
2023/04/28 09:00:00,28-04-2023 09.28,2023-04-28 09:42:16,28.84,40.0
18-02-2023 13.00,18-02-2023 13.01,2023-02-18 13:02:00,1.0,43.0
09-12-2023 09.27,09-12-2023 09.44,2023-12-09 09:56:32,17.06,20.0
10-08-2023 14.05,10-08-2023 14.32,2023-08-10 14:45:54,26.21,30.0
07-08-2024 14.43,07-08-2024 15.01,2024-08-07 15:13:03,18.98,26.0
16-12-2023 11.59,16-12-2023 12.21,2023-12-16 12:33:45,22.34,33.0
2023/05/30 14:11:00,30-05-2023 14.38,2023-05-30 14:50:46,27.66,48.0
08-04-2024 12.35,08-04-2024 12.40,2024-04-08 12:46:30,5.39,40.0
30-04-2024 13.57,30-04-2024 14.15,2024-04-30 14:35:03,18.65,17.0
2024/09/23 11:32:00,23-09-2024 12.03,2024-09-23 12:15:15,31.8,50.0
16-05-2024 11.03,16-05-2024 11.23,2024-05-16 11:34:50,20.56,3.0
28-08-2024 09.55,28-08-2024 10.21,2024-08-28 10:41:38,26.61,26.0
20-07-2023 12.25,20-07-2023 12.48,2023-07-20 13:06:19,23.83,41.0
16-08-2023 13.55,16-08-2023 14.17,2023-08-16 14:18:45,,27.0
2024/06/13 12:10:00,13-06-2024 12.17,2024-06-13 12:18:48,7.14,25.0
28-11-2023 12.49,28-11-2023 13.18,2023-11-28 13:26:09,29.14,32.0
10-01-2024 12.29,10-01-2024 12.33,2024-01-10 12:40:25,4.38,32.0
10-05-2023 09.17,,2023-05-10 10:03:53,27.68,24.0
2023/04/26 13:50:00,26-04-2023 14.11,2023-04-26 14:22:48,21.24,28.0
12-08-2024 10.30,12-08-2024 11.00,2024-08-12 11:07:32,30.82,45.0
21-05-2024 14.26,21-05-2024 14.40,2024-05-21 14:49:39,14.64,45.0
14-01-2023 11.54,14-01-2023 12.15,2023-01-14 12:22:19,21.39,
2023/10/11 14:25:00,11-10-2023 14.41,2023-10-11 14:48:32,16.93,37.0
30-10-2023 12.30,30-10-2023 12.46,2023-10-30 12:53:46,16.91,33.0
11-03-2024 12.07,11-03-2024 12.39,2024-03-11 13:00:48,32.2,26.0
2023/05/08 12:05:00,08-05-2023 12.28,2023-05-08 12:37:02,23.54,48.0
14-02-2023 14.05,14-02-2023 14.46,2023-02-14 14:56:55,41.61,47.0
08-09-2023 14.02,08-09-2023 14.23,2023-09-08 14:35:20,21.15,43.0
04-09-2024 14.00,04-09-2024 14.29,2024-09-04 14:34:25,29.26,49.0
23-12-2023 13.00,23-12-2023 13.01,2023-12-23 13:02:00,1.0,47.0
25-10-2024 12.19,25-10-2024 12.44,2024-10-25 13:00:24,25.72,44.0
13-05-2023 11.29,13-05-2023 11.51,2023-05-13 12:08:27,22.21,16.0
07-10-2024 11.52,07-10-2024 12.18,2024-10-07 12:29:39,26.18,41.0
13-06-2024 12.38,13-06-2024 12.39,2024-06-13 12:51:21,1.73,40.0
29-05-2023 12.47,29-05-2023 13.06,2023-05-29 13:17:45,19.92,19.0
2023/03/22 11:30:00,22-03-2023 11.51,2023-03-22 12:01:22,21.72,20.0
10-07-2023 13.38,10-07-2023 13.57,2023-07-10 14:10:25,19.94,17.0
19-08-2024 13.44,19-08-2024 14.16,2024-08-19 14:34:50,32.44,54.0
21-10-2024 12.04,21-10-2024 12.25,2024-10-21 12:34:43,21.1,29.0
15-03-2023 14.02,15-03-2023 14.22,2023-03-15 14:26:18,20.36,8.0
24-09-2024 11.19,24-09-2024 11.42,2024-09-24 11:45:48,22.65,29.0
11-06-2024 13.08,11-06-2024 13.35,2024-06-11 13:45:11,27.18,36.0
05-12-2023 09.36,05-12-2023 09.37,2023-12-05 09:40:01,1.41,10.0
26-02-2024 12.15,26-02-2024 12.33,2024-02-26 12:42:39,18.55,33.0
09-11-2024 11.50,09-11-2024 12.12,2024-11-09 12:21:57,22.33,25.0
2023/03/18 11:16:00,18-03-2023 11.38,2023-03-18 11:48:04,22.16,26.0
2024/08/22 11:32:00,22-08-2024 11.39,2024-08-22 11:50:45,7.79,13.0
14-07-2023 10.34,14-07-2023 10.45,2023-07-14 10:54:41,11.09,32.0
05-01-2023 13.03,05-01-2023 13.23,2023-01-05 13:37:10,20.1,42.0
20-11-2024 11.58,20-11-2024 12.22,2024-11-20 12:31:24,24.02,31.0
25-01-2023 9.14,25-01-2023 09.47,2023-01-25 09:55:12,33.39,52.0
2024/01/31 10:37:00,31-01-2024 10.52,2024-01-31 10:54:34,15.02,24.0
2023/05/24 15:24:00,24-05-2023 15.44,2023-05-24 15:45:00,20.0,43.0
20-07-2024 13.00,20-07-2024 13.01,2024-07-20 13:02:00,1.0,
2023/02/28 09:27:00,28-02-2023 09.43,2023-02-28 09:55:00,16.11,37.0
24-04-2023 10.38,24-04-2023 10.48,2023-04-24 10:57:40,10.18,32.0
2023/03/01 15:08:00,01-03-2023 15.38,2023-03-01 15:45:00,30.86,46.0
22-05-2023 13.46,22-05-2023 14.24,2023-05-22 14:33:10,37.66,201.0
09-03-2024 10.19,09-03-2024 10.52,2024-03-09 11:05:29,33.21,39.0
16-02-2024 15.30,16-02-2024 15.44,2024-02-16 15:45:00,14.0,27.0
2023/06/06 14:09:00,06-06-2023 14.15,2023-06-06 14:29:50,6.88,25.0
30-05-2023 11.49,30-05-2023 12.08,2023-05-30 12:15:38,19.85,28.0
01-12-2023 09.01,01-12-2023 09.24,2023-12-01 09:43:37,23.21,27.0
12-06-2024 12.05,12-06-2024 12.29,2024-06-12 12:30:07,24.13,29.0
21-03-2024 11.50,21-03-2024 12.17,2024-03-21 12:21:47,27.31,48.0
2024/01/03 12:35:00,03-01-2024 12.36,2024-01-03 12:47:44,1.98,40.0
26-01-2024 15.33,26-01-2024 15.40,2024-01-26 15:45:00,,21.0
27-11-2023 15.32,27-11-2023 15.44,2023-11-27 15:45:00,12.0,51.0
01-04-2023 11.21,01-04-2023 11.39,2023-04-01 11:47:09,19.0,25.0
25-05-2024 13.00,25-05-2024 13.01,2024-05-25 13:02:00,1.0,17.0
15-04-2024 13.43,15-04-2024 14.05,2024-04-15 14:06:57,22.96,37.0
24-07-2024 12.32,24-07-2024 12.49,2024-07-24 13:01:00,,11.0
22-07-2023 12.33,22-07-2023 12.48,2023-07-22 13:00:00,15.5,40.0
30-08-2024 10.15,30-08-2024 10.42,2024-08-30 10:48:44,27.65,37.0
26-06-2023 14.32,26-06-2023 14.46,2023-06-26 14:55:59,14.15,28.0
02-11-2024 10.51,02-11-2024 11.02,2024-11-02 11:10:04,11.66,15.0
14-12-2023 10.41,14-12-2023 11.06,2023-12-14 11:17:16,25.26,40.0
2023/05/06 11:29:00,06-05-2023 12.00,2023-05-06 12:06:15,31.04,30.0
2024/02/12 12:17:00,12-02-2024 12.27,2024-02-12 12:34:35,10.29,25.0
25-06-2024 10.10,25-06-2024 10.36,2024-06-25 10:46:29,26.57,26.0
17-08-2024 12.47,17-08-2024 12.59,2024-08-17 13:00:00,12.0,31.0
2024/01/03 10:46:00,03-01-2024 11.05,2024-01-03 11:13:57,19.77,39.0
30-10-2024 9.16,30-10-2024 09.50,2024-10-30 10:05:12,34.1,49.0
21-10-2024 09.34,21-10-2024 10.05,2024-10-21 10:06:40,31.67,63.0
30-03-2024 13.00,30-03-2024 13.01,2024-03-30 13:02:00,1.0,23.0
14-10-2024 10.46,14-10-2024 10.57,2024-10-14 11:10:14,11.34,32.0
02-06-2023 11.24,02-06-2023 11.56,2023-06-02 12:03:14,32.94,42.0
05-01-2024 10.11,05-01-2024 10.40,2024-01-05 10:51:21,29.54,51.0
05-05-2023 11.40,05-05-2023 12.05,2023-05-05 12:22:07,25.11,47.0
2023/09/28 09:24:00,28-09-2023 09.38,2023-09-28 09:45:31,14.9,169.0
13-05-2023 12.21,13-05-2023 12.51,2023-05-13 13:00:00,30.83,33.0
04-09-2024 14.23,04-09-2024 14.41,2024-09-04 14:53:06,18.11,43.0
31-01-2023 09.19,31-01-2023 09.52,2023-01-31 10:05:36,33.48,40.0
07-03-2023 13.09,07-03-2023 13.34,2023-03-07 13:52:26,25.1,36.0
27-07-2024 13.00,27-07-2024 13.01,2024-07-27 13:02:00,1.0,25.0
08-05-2023 15.11,08-05-2023 15.20,2023-05-08 15:33:36,9.71,27.0
08-07-2024 12.26,08-07-2024 12.52,2024-07-08 13:08:29,26.52,41.0
01-08-2024 12.29,01-08-2024 12.40,2024-08-01 12:45:35,11.98,5.0
2024/07/23 10:32:00,23-07-2024 11.02,2024-07-23 11:11:44,30.15,39.0
05-11-2024 09.45,05-11-2024 09.55,2024-11-05 10:09:34,10.08,24.0
2024/03/11 11:39:00,11-03-2024 11.58,2024-03-11 12:16:23,19.46,33.0
28-06-2024 10.43,28-06-2024 10.56,2024-06-28 11:11:18,13.37,16.0
17-07-2023 13.46,17-07-2023 13.58,2023-07-17 14:10:52,12.75,25.0
27-01-2023 09.35,27-01-2023 09.49,2023-01-27 10:01:34,14.67,
13-12-2023 15.16,13-12-2023 15.44,2023-12-13 15:45:00,28.0,49.0
26-07-2024 14.02,26-07-2024 14.16,2024-07-26 14:25:44,14.08,10.0
22-06-2024 13.00,22-06-2024 13.01,2024-06-22 13:02:00,1.0,21.0
15-01-2024 12.54,15-01-2024 13.10,2024-01-15 13:22:21,16.77,22.0
19-07-2023 12.43,19-07-2023 12.44,2023-07-19 12:48:56,1.0,40.0
2024/11/27 14:18:00,27-11-2024 14.36,2024-11-27 14:51:27,18.85,32.0
15-11-2023 10.50,15-11-2023 10.57,2023-11-15 11:16:02,7.76,14.0
08-01-2024 12.58,08-01-2024 13.22,2024-01-08 13:31:47,24.15,29.0
2023/04/12 13:50:00,12-04-2023 14.14,2023-04-12 14:22:25,24.99,17.0
2024/03/12 10:26:00,12-03-2024 10.35,2024-03-12 10:49:03,9.73,32.0
12-04-2023 13.41,12-04-2023 13.56,2023-04-12 14:06:41,15.49,17.0
02-03-2024 11.20,02-03-2024 11.38,2024-03-02 11:47:37,18.9,30.0
02-08-2024 12.17,02-08-2024 12.30,2024-08-02 12:42:58,13.98,20.0
16-09-2024 14.16,16-09-2024 14.37,2024-09-16 14:48:03,21.38,31.0
05-06-2024 09.20,05-06-2024 09.48,2024-06-05 10:00:36,28.9,63.0
16-09-2024 13.48,16-09-2024 14.10,2024-09-16 14:14:18,22.61,27.0
06-02-2024 11.46,06-02-2024 12.21,2024-02-06 12:35:26,35.43,56.0
15-03-2023 11.13,15-03-2023 11.31,2023-03-15 11:45:58,,47.0
2023/12/21 11:18:00,21-12-2023 11.30,2023-12-21 11:41:29,12.69,13.0
2023/04/10 12:10:00,10-04-2023 12.32,2023-04-10 12:42:45,22.08,15.0
2024/07/03 12:24:00,03-07-2024 12.48,2024-07-03 12:57:44,24.43,0.0
28-09-2024 10.15,28-09-2024 10.37,2024-09-28 10:50:00,22.69,37.0
31-10-2023 13.46,31-10-2023 14.05,2023-10-31 14:24:10,19.33,36.0
09-01-2024 15.40,09-01-2024 15.44,2024-01-09 15:45:00,4.0,25.0
29-07-2024 15.45,29-07-2024 15.46,2024-07-29 15:47:00,1.0,25.0
18-04-2023 10.10,18-04-2023 10.30,2023-04-18 10:49:55,20.22,47.0
14-10-2024 13.42,14-10-2024 14.09,2024-10-14 14:21:27,27.84,38.0
20-01-2024 11.12,20-01-2024 11.32,2024-01-20 11:40:39,20.69,25.0
01-04-2024 12.46,01-04-2024 12.53,2024-04-01 13:03:08,7.65,40.0
27-03-2024 12.11,27-03-2024 12.28,2024-03-27 12:45:47,17.03,20.0
20-05-2023 13.00,20-05-2023 13.01,2023-05-20 13:02:00,1.0,30.0
19-10-2023 09.01,19-10-2023 09.30,2023-10-19 09:40:25,29.46,46.0
06-08-2024 12.18,06-08-2024 12.39,2024-08-06 12:40:51,21.31,36.0
2024/04/12 14:53:00,12-04-2024 15.20,2024-04-12 15:30:47,27.37,48.0
01-01-2024 10.29,01-01-2024 10.51,2024-01-01 11:04:18,22.05,29.0
10-02-2024 11.47,10-02-2024 12.12,2024-02-10 12:26:03,25.06,23.0
2024/04/23 11:36:00,23-04-2024 11.43,2024-04-23 11:55:51,7.78,13.0
25-05-2023 09.19,25-05-2023 09.52,2023-05-25 09:58:52,33.66,43.0
04-08-2023 11.35,04-08-2023 11.49,2023-08-04 12:07:13,14.93,31.0
22-06-2024 10.25,22-06-2024 10.40,2024-06-22 10:48:24,15.01,32.0
15-08-2023 10.11,15-08-2023 10.26,2023-08-15 10:37:31,15.62,19.0
17-05-2023 14.21,17-05-2023 14.38,2023-05-17 14:56:40,17.71,27.0
2024/01/27 12:26:00,27-01-2024 12.50,2024-01-27 13:00:00,24.96,44.0
2024/06/17 11:05:00,17-06-2024 11.16,2024-06-17 11:24:02,11.06,32.0
27-07-2024 13.00,27-07-2024 13.01,2024-07-27 13:02:00,1.0,28.0
24-11-2023 09.00,24-11-2023 09.28,2023-11-24 09:40:52,28.35,28.0
07-06-2023 12.53,07-06-2023 13.23,2023-06-07 13:32:02,30.88,57.0
22-06-2023 10.04,22-06-2023 10.21,2023-06-22 10:29:35,17.25,19.0
18-04-2024 13.02,18-04-2024 13.21,2024-04-18 13:30:00,19.63,0.0
27-04-2023 14.06,27-04-2023 14.21,2023-04-27 14:39:21,15.4,25.0
2024/03/20 14:34:00,20-03-2024 14.55,2024-03-20 15:09:00,21.1,15.0
13-06-2023 14.57,13-06-2023 15.19,2023-06-13 15:29:42,22.61,157.0
04-05-2024 13.00,04-05-2024 13.01,2024-05-04 13:02:00,1.0,30.0
22-08-2023 14.09,22-08-2023 14.32,2023-08-22 14:42:26,23.49,44.0
17-07-2023 13.27,17-07-2023 13.51,2023-07-17 14:03:04,24.79,39.0
31-05-2024 11.09,31-05-2024 11.23,2024-05-31 11:33:20,14.69,24.0
29-03-2024 11.45,29-03-2024 12.04,2024-03-29 12:13:57,19.61,23.0
01-02-2023 10.03,01-02-2023 10.28,2023-02-01 10:45:22,25.07,32.0
2024/04/16 11:28:00,16-04-2024 11.50,2024-04-16 11:54:14,21.45,30.0
20-08-2024 12.18,20-08-2024 12.23,2024-08-20 12:36:07,4.22,31.0
2023/02/22 13:00:00,22-02-2023 13.15,2023-02-22 13:27:40,,32.0
23-09-2024 14.06,23-09-2024 14.45,2024-09-23 15:04:17,39.61,54.0
02-10-2023 13.55,02-10-2023 14.03,2023-10-02 14:14:35,8.03,25.0
15-02-2023 12.02,15-02-2023 12.21,2023-02-15 12:33:31,19.95,45.0
04-09-2024 13.31,04-09-2024 13.51,2024-09-04 14:04:29,20.72,43.0
21-07-2023 14.27,21-07-2023 14.59,2023-07-21 15:15:25,32.09,53.0
26-12-2023 10.19,26-12-2023 10.35,2023-12-26 10:45:17,16.34,19.0
05-09-2023 10.00,05-09-2023 10.21,2023-09-05 10:35:39,21.74,30.0
18-10-2024 09.07,18-10-2024 09.33,2024-10-18 09:41:02,,32.0
2023/03/06 13:18:00,06-03-2023 13.41,2023-03-06 13:56:20,23.56,27.0
2023/09/14 09:00:00,14-09-2023 09.19,2023-09-14 09:33:59,,24.0
07-10-2024 11.13,07-10-2024 11.49,2024-10-07 12:01:11,36.19,36.0
20-11-2023 09.54,20-11-2023 10.23,2023-11-20 10:35:38,29.94,26.0
2023/09/08 13:40:00,08-09-2023 14.14,2023-09-08 14:28:13,34.86,75.0
23-11-2024 13.00,23-11-2024 13.01,2024-11-23 13:02:00,1.0,26.0
05-04-2024 15.45,05-04-2024 15.46,2024-04-05 15:47:00,1.0,25.0
27-05-2024 12.56,27-05-2024 13.24,2024-05-27 13:34:39,28.2,35.0
09-03-2024 13.00,09-03-2024 13.01,2024-03-09 13:02:00,1.0,32.0
07-12-2023 15.45,07-12-2023 15.46,2023-12-07 15:47:00,1.0,50.0
15-09-2023 09.00,15-09-2023 09.15,2023-09-15 09:23:55,15.47,26.0
21-06-2023 11.25,21-06-2023 11.42,2023-06-21 11:56:10,17.79,31.0
18-09-2024 14.21,18-09-2024 14.31,2024-09-18 14:44:48,10.57,17.0
21-04-2023 14.15,21-04-2023 14.32,2023-04-21 14:46:10,17.14,17.0
02-05-2024 13.56,02-05-2024 14.23,2024-05-02 14:33:26,26.26,30.0
08-12-2023 13.52,08-12-2023 13.57,2023-12-08 14:00:20,5.78,25.0
2024/06/22 10:29:00,22-06-2024 10.59,2024-06-22 11:11:01,30.73,32.0
2023/07/05 14:03:00,05-07-2023 14.12,2023-07-05 14:24:44,,17.0
22-04-2024 10.59,22-04-2024 11.16,2024-04-22 11:17:05,17.08,27.0
22-04-2024 10.41,22-04-2024 11.40,2024-04-22 11:56:49,59.47,32.0
04-12-2023 10.39,04-12-2023 10.53,2023-12-04 11:03:38,14.93,32.0
18-07-2024 13.25,18-07-2024 13.39,2024-07-18 13:49:19,14.94,20.0
13-07-2024 10.25,13-07-2024 10.34,2024-07-13 10:46:06,9.34,32.0
17-07-2024 13.53,17-07-2024 14.05,2024-07-17 14:14:44,12.42,171.0
09-12-2023 10.38,09-12-2023 11.01,2023-12-09 11:12:56,24.0,34.0
22-12-2023 15.41,22-12-2023 15.44,2023-12-22 15:45:00,3.0,25.0
2024/10/02 15:17:00,02-10-2024 15.39,2024-10-02 15:45:00,22.12,44.0
29-06-2024 13.00,29-06-2024 13.01,2024-06-29 13:02:00,1.0,27.0
16-12-2023 10.51,16-12-2023 11.14,2023-12-16 11:22:24,23.37,25.0
19-03-2024 09.07,19-03-2024 09.32,2024-03-19 09:42:18,25.03,63.0
05-01-2024 13.54,05-01-2024 14.30,2024-01-05 14:39:39,35.77,201.0
21-08-2024 13.14,21-08-2024 13.32,2024-08-21 13:41:19,18.61,20.0
24-05-2023 15.40,24-05-2023 15.44,2023-05-24 15:45:00,4.0,43.0
02-10-2024 10.33,02-10-2024 10.34,2024-10-02 10:35:45,1.0,32.0
11-06-2024 15.27,11-06-2024 15.44,2024-06-11 15:45:00,17.0,36.0
02-12-2023 09.49,02-12-2023 10.04,2023-12-02 10:17:33,15.04,24.0
27-05-2024 13.45,27-05-2024 14.02,2024-05-27 14:04:33,17.47,30.0
27-07-2024 11.58,27-07-2024 12.14,2024-07-27 12:25:22,16.91,38.0
12-09-2024 12.12,12-09-2024 12.31,2024-09-12 12:48:23,19.47,16.0
28-08-2024 12.50,28-08-2024 13.11,2024-08-28 13:18:48,21.14,29.0
12-03-2024 10.36,12-03-2024 11.00,2024-03-12 11:02:18,23.97,29.0
08-07-2024 11.34,08-07-2024 11.54,2024-07-08 12:02:38,20.94,11.0
25-11-2024 12.58,25-11-2024 13.18,2024-11-25 13:30:47,19.71,27.0
27-09-2024 15.25,27-09-2024 15.44,2024-09-27 15:45:00,19.0,58.0
20-07-2023 09.48,20-07-2023 09.56,2023-07-20 10:01:03,8.93,24.0
2024/02/21 10:13:00,21-02-2024 10.56,2024-02-21 11:05:20,43.22,44.0
05-04-2024 10.07,05-04-2024 10.26,2024-04-05 10:42:02,19.67,32.0
2023/08/18 09:51:00,18-08-2023 10.26,2023-08-18 10:27:24,35.0,
17-05-2024 14.19,17-05-2024 14.36,2024-05-17 14:53:09,17.66,25.0
13-06-2023 10.14,13-06-2023 10.27,2023-06-13 10:44:31,12.84,0.0
2024/02/09 13:28:00,09-02-2024 13.46,2024-02-09 13:56:18,18.45,200.0
22-04-2023 13.00,22-04-2023 13.01,2023-04-22 13:02:00,1.0,25.0
20-04-2024 12.57,20-04-2024 12.59,2024-04-20 13:00:00,1.2,
2023/10/31 15:45:00,31-10-2023 15.46,2023-10-31 15:47:00,1.0,43.0
11-11-2024 11.23,11-11-2024 11.46,2024-11-11 11:58:12,23.12,10.0
28-10-2024 11.42,28-10-2024 12.03,2024-10-28 12:17:47,21.8,
05-01-2024 14.42,05-01-2024 15.18,2024-01-05 15:28:46,36.7,55.0
09-09-2024 11.02,09-09-2024 11.18,2024-09-09 11:29:35,17.0,24.0
13-06-2023 11.57,13-06-2023 12.15,2023-06-13 12:32:35,18.66,33.0
09-08-2024 11.21,09-08-2024 11.36,2024-08-09 11:46:05,15.87,23.0
,06-11-2023 11.17,2023-11-06 11:26:42,16.73,125.0
2024/07/08 10:43:00,08-07-2024 11.13,2024-07-08 11:23:04,30.24,30.0
08-07-2023 13.00,08-07-2023 13.01,2023-07-08 13:02:00,1.0,0.0
31-01-2023 12.10,31-01-2023 12.23,2023-01-31 12:34:36,13.98,20.0
16-11-2024 13.00,16-11-2024 13.01,2024-11-16 13:02:00,1.0,43.0
07-03-2023 09.00,07-03-2023 09.15,2023-03-07 09:33:48,15.13,27.0
2023/12/26 09:07:00,26-12-2023 09.27,2023-12-26 09:34:07,20.2,32.0
18-05-2023 09.19,18-05-2023 09.35,2023-05-18 09:42:14,,32.0
01-08-2024 10.31,01-08-2024 11.06,2024-08-01 11:18:46,35.54,38.0
2024/04/03 12:23:00,03-04-2024 12.43,2024-04-03 12:55:33,20.07,28.0
2023/09/21 11:20:00,21-09-2023 11.31,2023-09-21 11:40:53,11.84,20.0
2023/02/17 12:02:00,17-02-2023 12.35,2023-02-17 12:45:47,33.62,35.0
10-01-2024 09.56,10-01-2024 10.19,2024-01-10 10:35:23,23.46,31.0
13-07-2024 13.00,13-07-2024 13.01,2024-07-13 13:02:00,1.0,27.0
20-12-2023 13.57,20-12-2023 14.17,2023-12-20 14:19:57,20.82,36.0
05-01-2023 14.41,05-01-2023 15.02,2023-01-05 15:14:32,21.17,28.0
2023/05/02 09:53:00,02-05-2023 10.09,2023-05-02 10:19:17,16.15,32.0
14-11-2024 12.54,14-11-2024 13.17,2024-11-14 13:27:57,23.02,37.0
28-06-2023 10.47,28-06-2023 11.08,2023-06-28 11:19:01,21.6,24.0
2023/09/08 12:58:00,08-09-2023 13.11,2023-09-08 13:28:30,13.58,29.0
2023/06/07 09:35:00,07-06-2023 10.00,2023-06-07 10:07:10,24.56,39.0
28-07-2023 10.35,28-07-2023 10.47,2023-07-28 10:58:19,12.31,32.0
2023/06/02 14:31:00,02-06-2023 14.52,2023-06-02 15:03:35,21.84,28.0
27-05-2023 13.00,27-05-2023 13.01,2023-05-27 13:02:00,1.0,49.0
14-01-2023 13.00,14-01-2023 13.01,2023-01-14 13:02:00,1.0,32.0
12-05-2023 14.22,12-05-2023 14.35,2023-05-12 14:51:27,13.62,18.0
2023/01/27 14:01:00,27-01-2023 14.29,2023-01-27 14:34:00,28.09,37.0
2024/07/08 15:45:00,08-07-2024 15.46,2024-07-08 15:47:00,1.0,25.0
20-04-2024 10.11,20-04-2024 10.31,2024-04-20 10:40:54,20.44,16.0
06-06-2024 09.54,06-06-2024 10.09,2024-06-06 10:17:21,15.13,16.0
10-07-2023 09.12,10-07-2023 09.34,2023-07-10 09:40:13,22.36,
15-11-2024 10.46,15-11-2024 10.56,2024-11-15 10:58:57,10.87,32.0
2023/01/24 14:14:00,24-01-2023 15.00,2023-01-24 15:12:25,46.74,71.0
12-01-2024 14.46,12-01-2024 15.17,2024-01-12 15:32:25,,
24-06-2024 12.30,24-06-2024 12.54,2024-06-24 13:08:21,24.95,28.0
08-03-2024 14.34,08-03-2024 14.54,2024-03-08 15:05:58,20.7,36.0
06-05-2024 14.27,06-05-2024 14.57,2024-05-06 15:08:24,30.5,62.0
30-09-2023 13.00,30-09-2023 13.01,2023-09-30 13:02:00,1.0,200.0
2023/09/08 13:46:00,08-09-2023 14.09,2023-09-08 14:20:22,23.17,27.0
23-03-2024 11.51,23-03-2024 12.18,2024-03-23 12:30:48,27.36,32.0
18-11-2024 15.00,18-11-2024 15.23,2024-11-18 15:35:02,23.48,45.0
06-11-2023 12.47,06-11-2023 12.58,2023-11-06 13:10:44,11.75,40.0
2023/01/05 14:27:00,05-01-2023 14.51,2023-01-05 15:03:34,24.38,27.0
2024/02/24 09:13:00,24-02-2024 09.26,2024-02-24 09:39:38,13.04,23.0
2023/11/21 14:08:00,21-11-2023 14.23,2023-11-21 14:39:13,15.11,17.0
26-04-2023 13.42,26-04-2023 14.08,2023-04-26 14:17:25,,44.0
2024/08/06 11:38:00,06-08-2024 12.00,2024-08-06 12:09:21,22.45,31.0
12-09-2023 14.44,12-09-2023 15.02,2023-09-12 15:11:18,18.26,37.0
14-09-2023 12.30,14-09-2023 12.52,2023-09-14 13:02:39,22.44,30.0
21-06-2023 13.57,21-06-2023 14.26,2023-06-21 14:32:37,29.68,37.0
06-12-2023 13.06,06-12-2023 13.15,2023-12-06 13:27:20,9.71,23.0
2024/05/30 15:45:00,30-05-2024 15.46,2024-05-30 15:47:00,1.0,13.0
2023/10/13 11:10:00,13-10-2023 11.26,2023-10-13 11:36:27,16.82,42.0
26-05-2023 12.03,26-05-2023 12.26,2023-05-26 12:33:46,23.63,32.0
16-07-2024 11.37,16-07-2024 12.06,2024-07-16 12:10:42,29.32,46.0
2024/09/11 10:28:00,11-09-2024 10.58,2024-09-11 11:01:14,30.2,35.0
2024/07/10 11:57:00,10-07-2024 12.20,2024-07-10 12:32:27,23.75,24.0
20-04-2024 13.00,20-04-2024 13.01,2024-04-20 13:02:00,1.0,0.0
06-05-2024 10.08,06-05-2024 10.20,2024-05-06 10:28:39,12.1,24.0
17-06-2024 09.27,17-06-2024 09.54,2024-06-17 10:00:20,27.59,54.0
2023/08/29 13:09:00,29-08-2023 13.23,2023-08-29 13:35:10,14.72,34.0
08-04-2024 9.57,08-04-2024 10.16,2024-04-08 10:27:32,19.21,32.0
03-03-2023 12.02,03-03-2023 12.36,2023-03-03 12:47:15,34.63,57.0
03-05-2024 11.01,03-05-2024 11.27,2024-05-03 11:37:14,26.48,51.0
11-03-2023 13.00,11-03-2023 13.01,2023-03-11 13:02:00,1.0,35.0
25-07-2024 09.00,25-07-2024 09.26,2024-07-25 09:46:18,26.32,32.0
2023/03/06 15:38:00,06-03-2023 15.41,2023-03-06 15:45:00,3.68,25.0
06-04-2023 10.13,06-04-2023 10.36,2023-04-06 10:43:28,23.47,28.0
14-02-2023 10.34,14-02-2023 10.42,2023-02-14 10:53:13,8.13,32.0
28-10-2023 10.37,28-10-2023 10.56,2023-10-28 11:07:07,19.69,18.0
2023/05/11 10:40:00,11-05-2023 10.52,2023-05-11 11:07:59,12.96,32.0
23-03-2024 13.00,23-03-2024 13.01,2024-03-23 13:02:00,1.0,47.0
16-06-2023 14.29,16-06-2023 14.44,2023-06-16 14:54:48,15.41,133.0
25-03-2023 09.11,25-03-2023 09.28,2023-03-25 09:45:15,17.31,24.0
19-04-2024 09.54,19-04-2024 10.13,2024-04-19 10:15:35,19.62,26.0
28-04-2023 11.28,28-04-2023 11.48,2023-04-28 11:58:38,20.89,32.0
28-01-2023 13.00,28-01-2023 13.01,2023-01-28 13:02:00,1.0,180.0
2023/05/10 10:27:00,10-05-2023 10.39,2023-05-10 10:50:59,12.07,32.0
2023/06/06 11:22:00,06-06-2023 11.44,2023-06-06 12:05:45,21.92,34.0
09-08-2023 13.30,09-08-2023 13.43,2023-08-09 13:52:45,1200.0,12.0
2023/05/19 11:49:00,19-05-2023 12.05,2023-05-19 12:21:46,16.36,29.0
12-11-2024 13.39,12-11-2024 14.02,2024-11-12 14:12:29,23.63,38.0
13-12-2023 10.29,13-12-2023 10.48,2023-12-13 11:09:12,19.25,32.0
2023/01/09 12:47:00,09-01-2023 13.23,2023-01-09 13:35:38,35.54,36.0
30-10-2024 10.15,30-10-2024 10.45,2024-10-30 10:52:04,30.92,
13-04-2024 09.56,13-04-2024 10.10,2024-04-13 10:26:12,14.18,24.0
,25-04-2023 14.11,2023-04-25 14:15:15,5.14,25.0
24-08-2024 10.50,24-08-2024 11.10,2024-08-24 11:19:51,20.71,37.0
17-01-2023 13.16,17-01-2023 13.29,2023-01-17 13:37:18,13.52,17.0
2023/07/13 09:55:00,13-07-2023 10.05,2023-07-13 10:14:31,10.56,15.0
02-09-2024 12.47,02-09-2024 13.06,2024-09-02 13:14:36,19.61,0.0
05-07-2024 13.34,05-07-2024 13.52,2024-07-05 14:06:09,18.98,30.0
08-11-2023 09.32,08-11-2023 09.33,2023-11-08 09:45:27,1.97,10.0
2023/11/11 09:00:00,11-11-2023 09.24,2023-11-11 09:30:42,24.19,38.0
12-08-2024 15.00,12-08-2024 15.16,2024-08-12 15:26:10,16.93,12.0
04-05-2023 13.57,04-05-2023 14.15,2023-05-04 14:32:37,18.32,17.0
03-02-2023 13.06,03-02-2023 13.28,2023-02-03 13:37:46,22.79,32.0
29-04-2023 09.34,29-04-2023 09.59,2023-04-29 10:06:22,25.75,51.0
05-06-2023 15.23,05-06-2023 15.44,2023-06-05 15:45:00,21.0,47.0
08-12-2023 12.44,08-12-2023 13.04,2023-12-08 13:16:37,,32.0
19-03-2024 12.55,19-03-2024 13.22,2024-03-19 13:35:33,27.34,57.0
08-10-2024 13.44,08-10-2024 14.07,2024-10-08 14:19:19,23.18,26.0
2024/05/02 11:53:00,02-05-2024 12.11,2024-05-02 12:23:54,18.08,47.0
16-08-2024 12.21,16-08-2024 12.39,2024-08-16 12:52:19,17.32,38.0
30-05-2024 11.29,30-05-2024 11.44,2024-05-30 11:54:23,15.38,29.0
25-11-2023 13.00,25-11-2023 13.01,2023-11-25 13:02:00,1.0,17.0
07-12-2023 12.13,07-12-2023 12.24,2023-12-07 12:35:52,11.69,29.0
02-02-2024 10.14,02-02-2024 10.36,2024-02-02 10:44:08,22.56,21.0
25-04-2023 13.08,25-04-2023 13.28,2023-04-25 13:38:10,20.49,24.0
05-06-2024 10.56,05-06-2024 11.09,2024-06-05 11:22:16,13.46,33.0
14-10-2023 11.45,14-10-2023 12.16,2023-10-14 12:22:34,31.46,36.0
18-03-2024 12.24,18-03-2024 12.50,2024-03-18 13:09:55,26.13,41.0
22-02-2023 09.07,22-02-2023 09.28,2023-02-22 09:51:51,21.35,27.0
2024/06/18 13:25:00,18-06-2024 13.48,2024-06-18 14:00:46,23.17,43.0
13-04-2023 13.57,13-04-2023 14.33,2023-04-13 14:44:53,36.99,47.0
2023/03/28 10:14:00,28-03-2023 10.39,2023-03-28 10:53:48,25.82,23.0
14-10-2024 15.07,14-10-2024 15.34,2024-10-14 15:36:53,27.2,34.0
19-06-2024 14.37,19-06-2024 14.50,2024-06-19 15:06:15,13.87,29.0
02-09-2024 10.19,02-09-2024 10.55,2024-09-02 11:05:31,36.31,25.0
01-06-2024 09.29,01-06-2024 10.01,2024-06-01 10:05:30,,53.0
29-03-2024 09.59,29-03-2024 10.20,2024-03-29 10:33:16,21.65,28.0
29-07-2023 13.00,29-07-2023 13.01,2023-07-29 13:02:00,1.0,54.0
2023/03/29 15:30:00,29-03-2023 15.44,2023-03-29 15:45:00,14.0,43.0
14-01-2023 11.41,14-01-2023 12.02,2023-01-14 12:13:32,21.46,
2024/05/09 11:34:00,09-05-2024 12.04,2024-05-09 12:17:42,30.63,36.0
27-11-2023 12.16,27-11-2023 12.37,2023-11-27 12:42:08,20.54,43.0
18-03-2023 11.32,18-03-2023 11.53,2023-03-18 12:03:00,21.85,30.0
27-09-2023 14.33,27-09-2023 14.54,2023-09-27 15:06:10,21.06,28.0
08-08-2023 15.32,08-08-2023 15.43,2023-08-08 15:45:00,11.21,21.0
2023/12/02 13:00:00,02-12-2023 13.01,2023-12-02 13:02:00,1.0,25.0
2023/04/22 10:07:00,22-04-2023 10.30,2023-04-22 10:40:40,23.0,30.0
2023/05/03 10:33:00,03-05-2023 10.52,2023-05-03 11:04:01,19.98,22.0
2023/10/18 11:12:00,18-10-2023 11.44,2023-10-18 11:59:41,31.28,34.0
25-09-2023 13.21,25-09-2023 13.46,2023-09-25 13:58:03,25.92,26.0
18-10-2024 14.27,18-10-2024 14.52,2024-10-18 15:07:24,25.9,32.0
2024/09/17 14:08:00,17-09-2024 14.20,2024-09-17 14:26:55,12.27,17.0
26-06-2024 12.58,26-06-2024 13.14,2024-06-26 13:24:06,16.69,27.0
2024/02/24 10:21:00,24-02-2024 10.28,2024-02-24 10:40:36,7.6,32.0
15-08-2023 09.55,15-08-2023 10.24,2023-08-15 10:31:19,29.56,52.0
05-04-2023 14.11,05-04-2023 14.30,2023-04-05 14:46:24,19.24,17.0
09-01-2023 15.01,09-01-2023 15.25,2023-01-09 15:38:02,24.91,43.0
04-05-2024 12.59,04-05-2024 12.59,2024-05-04 13:00:00,0.0,41.0
18-08-2023 11.03,18-08-2023 11.35,2023-08-18 11:46:56,32.97,52.0
03-03-2023 13.56,03-03-2023 14.07,2023-03-03 14:20:25,11.09,25.0
22-07-2023 13.00,22-07-2023 13.01,2023-07-22 13:02:00,1.0,6.0
13-09-2023 12.50,13-09-2023 13.10,2023-09-13 13:12:20,20.77,20.0
11-05-2024 09.22,11-05-2024 09.53,2024-05-11 09:58:07,31.43,52.0
16-08-2024 13.30,16-08-2024 14.38,2024-08-16 14:50:29,68.13,20.0
04-04-2024 12.31,04-04-2024 12.49,2024-04-04 13:03:06,18.0,40.0
2024/05/16 15:45:00,16-05-2024 15.46,2024-05-16 15:47:00,1.0,25.0
10-04-2023 10.40,10-04-2023 11.01,2023-04-10 11:04:40,21.79,27.0
21-10-2024 10.01,21-10-2024 10.21,2024-10-21 10:34:46,20.73,23.0
02-11-2023 13.01,02-11-2023 13.27,2023-11-02 13:37:14,26.23,32.0
14-05-2024 14.01,14-05-2024 14.18,2024-05-14 14:29:12,17.8,31.0
23-09-2024 10.18,23-09-2024 11.02,2024-09-23 11:10:20,44.83,22.0
03-05-2023 14.31,03-05-2023 14.51,2023-05-03 14:58:20,20.39,37.0
13-04-2023 10.44,13-04-2023 10.45,2023-04-13 10:47:47,1.0,32.0
26-03-2024 12.57,26-03-2024 13.41,2024-03-26 13:43:10,44.57,19.0
24-06-2023 10.41,24-06-2023 11.07,2023-06-24 11:20:33,26.65,29.0
12-05-2023 11.32,12-05-2023 11.57,2023-05-12 12:05:12,25.58,24.0
12-06-2024 11.43,12-06-2024 12.03,2024-06-12 12:12:13,19.79,38.0
26-10-2023 11.16,26-10-2023 11.38,2023-10-26 11:46:43,22.81,29.0
19-06-2024 13.55,19-06-2024 14.09,2024-06-19 14:23:37,14.41,25.0
17-06-2023 13.00,17-06-2023 13.01,2023-06-17 13:02:00,1.0,36.0
23-07-2024 12.37,23-07-2024 12.49,2024-07-23 12:57:21,12.67,40.0
29-10-2024 10.45,29-10-2024 11.09,2024-10-29 11:19:18,24.01,42.0
04-10-2024 14.35,04-10-2024 15.08,2024-10-04 15:15:51,32.47,32.0
20-06-2024 14.15,20-06-2024 14.30,2024-06-20 14:42:45,15.54,38.0
14-09-2023 10.35,14-09-2023 10.41,2023-09-14 10:48:24,6.65,19.0
2024/11/20 11:16:00,20-11-2024 11.41,2024-11-20 11:54:53,25.03,26.0
17-11-2023 9.11,17-11-2023 09.32,2023-11-17 09:56:00,21.06,30.0
19-03-2024 10.58,19-03-2024 11.16,2024-03-19 11:26:54,18.65,37.0
16-12-2023 12.21,16-12-2023 12.32,2023-12-16 12:47:36,11.17,40.0
2024/04/19 11:32:00,19-04-2024 11.55,2024-04-19 12:07:38,23.81,39.0
13-08-2024 13.16,13-08-2024 13.38,2024-08-13 13:51:08,22.03,32.0
26-04-2023 09.04,26-04-2023 09.34,2023-04-26 09:43:05,30.54,36.0
2023/03/17 15:40:00,17-03-2023 15.44,2023-03-17 15:45:00,4.0,43.0
25-06-2024 09.20,25-06-2024 09.56,2024-06-25 10:04:31,36.02,52.0
02-08-2023 10.02,02-08-2023 10.26,2023-08-02 10:35:29,24.03,28.0
18-09-2023 13.15,18-09-2023 13.29,2023-09-18 13:31:46,14.8,12.0
23-10-2023 13.50,23-10-2023 14.05,2023-10-23 14:22:24,15.18,25.0
21-11-2024 15.00,21-11-2024 15.15,2024-11-21 15:27:04,15.17,34.0
20-02-2024 10.18,20-02-2024 10.32,2024-02-20 10:47:29,14.52,26.0
24-07-2024 10.02,24-07-2024 10.19,2024-07-24 10:31:14,17.21,23.0
11-07-2024 10.39,11-07-2024 11.11,2024-07-11 11:21:35,32.35,19.0
16-08-2023 14.15,16-08-2023 14.28,2023-08-16 14:44:16,13.4,18.0
2023/12/06 09:00:00,06-12-2023 09.26,2023-12-06 09:37:00,26.8,191.0
19-10-2024 13.00,19-10-2024 13.01,2024-10-19 13:02:00,1.0,47.0
12-04-2023 10.33,12-04-2023 11.02,2023-04-12 11:14:00,29.61,50.0
13-07-2023 12.51,13-07-2023 13.10,2023-07-13 13:20:24,19.23,36.0
21-03-2024 11.33,21-03-2024 11.52,2024-03-21 12:02:39,19.32,26.0
23-01-2024 09.12,23-01-2024 09.30,2024-01-23 09:41:19,18.09,20.0
14-12-2023 12.47,14-12-2023 13.03,2023-12-14 13:15:20,16.59,40.0
31-07-2024 11.08,31-07-2024 11.42,2024-07-31 11:52:41,34.32,42.0
2023/08/30 12:07:00,30-08-2023 12.19,2023-08-30 12:30:14,12.97,29.0
2023/05/24 11:00:00,24-05-2023 11.15,2023-05-24 11:25:46,15.37,24.0
02-02-2024 12.26,02-02-2024 12.52,2024-02-02 13:01:21,26.92,59.0
15-05-2023 14.46,15-05-2023 15.14,2023-05-15 15:25:42,28.52,29.0
22-12-2023 14.40,22-12-2023 15.02,2023-12-22 15:13:35,22.4,31.0
13-01-2023 12.24,13-01-2023 12.37,2023-01-13 12:50:37,13.51,40.0
29-11-2024 15.30,29-11-2024 15.44,2024-11-29 15:45:00,13.37,41.0
2024/06/01 12:49:00,01-06-2024 12.59,2024-06-01 13:00:00,10.0,30.0
2024/05/21 09:57:00,21-05-2024 10.21,2024-05-21 10:27:35,24.02,52.0
22-09-2023 10.54,22-09-2023 11.15,2023-09-22 11:29:05,21.66,24.0
2023/11/21 11:44:00,21-11-2023 12.05,2023-11-21 12:16:02,21.46,
2024/07/05 13:51:00,05-07-2024 14.00,2024-07-05 14:12:03,9.23,25.0
28-06-2024 09.20,28-06-2024 09.53,2024-06-28 09:55:24,33.17,54.0
2023/06/22 10:01:00,22-06-2023 10.11,2023-06-22 10:21:46,10.9,10.0
11-10-2023 12.39,11-10-2023 13.00,2023-10-11 13:12:15,21.79,34.0
11-02-2023 11.29,11-02-2023 11.38,2023-02-11 11:51:04,9.24,19.0
30-01-2023 09.43,30-01-2023 10.08,2023-01-30 10:10:40,25.59,47.0
04-08-2023 14.40,04-08-2023 15.03,2023-08-04 15:22:37,23.42,28.0
12-07-2024 15.30,12-07-2024 15.44,2024-07-12 15:45:00,14.0,25.0
2024/07/09 13:08:00,09-07-2024 13.40,2024-07-09 13:44:57,32.83,36.0
30-03-2024 12.00,30-03-2024 12.37,2024-03-30 12:43:08,37.72,
29-04-2024 12.10,29-04-2024 12.35,2024-04-29 12:52:15,25.7,14.0
24-04-2023 11.29,24-04-2023 11.57,2023-04-24 12:09:34,27.78,45.0
16-08-2024 09.07,16-08-2024 09.13,2024-08-16 09:20:23,6.34,13.0
12-11-2024 15.16,12-11-2024 15.43,2024-11-12 15:45:00,27.67,27.0
18-04-2024 10.20,18-04-2024 10.23,2024-04-18 10:24:44,3.75,32.0
2023/12/01 10:47:00,01-12-2023 10.59,2023-12-01 11:13:41,12.26,33.0
19-11-2024 11.23,19-11-2024 11.49,2024-11-19 12:03:58,26.0,70.0
03-02-2024 10.45,03-02-2024 10.53,2024-02-03 10:59:47,8.16,32.0
14-09-2023 09.21,14-09-2023 09.39,2023-09-14 09:54:43,18.53,33.0
27-11-2024 10.19,27-11-2024 10.48,2024-11-27 11:01:22,29.06,40.0
2024/05/16 10:13:00,16-05-2024 10.30,2024-05-16 10:41:42,17.33,21.0
22-08-2023 13.56,22-08-2023 14.03,2023-08-22 14:08:15,7.41,32.0
08-06-2023 11.40,08-06-2023 12.01,2023-06-08 12:09:44,21.31,38.0
31-08-2023 13.26,31-08-2023 13.52,2023-08-31 14:03:39,26.01,39.0
2024/01/25 10:47:00,25-01-2024 11.08,2024-01-25 11:25:03,21.61,29.0
20-09-2023 10.15,20-09-2023 10.20,2023-09-20 10:27:29,5.28,12.0
25-10-2023 13.54,25-10-2023 14.13,2023-10-25 14:22:26,19.48,23.0
23-01-2024 12.05,23-01-2024 12.30,2024-01-23 12:42:10,25.92,22.0
29-12-2023 13.43,29-12-2023 14.03,2023-12-29 14:10:58,20.91,26.0
29-11-2023 11.19,29-11-2023 11.50,2023-11-29 12:03:04,31.05,36.0
28-06-2023 09.19,28-06-2023 09.25,2023-06-28 09:31:35,6.84,1000.0
05-07-2023 12.19,05-07-2023 12.37,2023-07-05 12:47:31,,11.0
2023/11/27 14:37:00,27-11-2023 15.06,2023-11-27 15:15:17,29.25,31.0
29-04-2024 15.16,29-04-2024 15.43,2024-04-29 15:45:00,27.55,36.0
2023/08/01 11:40:00,01-08-2023 12.12,2023-08-01 12:21:48,32.94,59.0
25-03-2024 13.35,25-03-2024 13.45,2024-03-25 13:54:49,10.79,18.0
05-01-2023 09.43,05-01-2023 10.08,2023-01-05 10:27:19,25.03,26.0
06-02-2024 14.10,06-02-2024 14.18,2024-02-06 14:29:35,8.82,17.0
23-01-2024 13.32,23-01-2024 13.44,2024-01-23 13:55:32,12.89,18.0
28-06-2024 10.55,28-06-2024 11.20,2024-06-28 11:28:31,25.75,56.0
18-03-2024 13.57,18-03-2024 14.21,2024-03-18 14:35:13,24.3,27.0
16-09-2024 09.21,16-09-2024 09.36,2024-09-16 09:42:41,15.36,169.0
17-01-2023 12.26,17-01-2023 12.49,2023-01-17 13:14:04,23.07,40.0
09-10-2023 15.18,09-10-2023 15.44,2023-10-09 15:45:00,26.0,34.0
2023/03/03 13:59:00,03-03-2023 14.21,2023-03-03 14:30:17,22.47,17.0
19-07-2024 09.00,19-07-2024 09.27,2024-07-19 09:30:34,27.2,25.0
13-08-2024 12.54,13-08-2024 13.15,2024-08-13 13:22:08,21.23,24.0
01-06-2023 15.25,01-06-2023 15.44,2023-06-01 15:45:00,19.0,44.0
2023/08/26 11:27:00,26-08-2023 11.45,2023-08-26 11:51:43,18.44,40.0
23-02-2024 13.44,23-02-2024 14.01,2024-02-23 14:07:17,17.03,29.0
08-09-2023 15.27,08-09-2023 15.44,2023-09-08 15:45:00,16.67,38.0
03-02-2024 13.00,03-02-2024 13.01,2024-02-03 13:02:00,1.0,52.0
08-05-2024 10.27,08-05-2024 10.57,2024-05-08 10:59:54,30.52,35.0
05-08-2023 10.56,05-08-2023 11.27,2023-08-05 11:36:39,31.6,41.0
26-04-2023 09.30,26-04-2023 09.41,2023-04-26 09:50:13,,
2024/02/01 11:06:00,01-02-2024 11.19,2024-02-01 11:29:18,13.37,38.0
15-07-2023 10.10,15-07-2023 10.32,2023-07-15 10:38:09,22.35,31.0
11-04-2024 12.37,11-04-2024 12.49,2024-04-11 13:02:11,12.95,40.0
23-10-2024 09.18,23-10-2024 09.30,2024-10-23 09:39:48,12.73,20.0
27-10-2023 12.03,27-10-2023 12.20,2023-10-27 12:29:52,17.48,
23-03-2023 12.33,23-03-2023 12.50,2023-03-23 13:04:06,17.76,31.0
19-07-2024 10.33,19-07-2024 10.44,2024-07-19 10:59:32,11.33,32.0
14-02-2023 11.52,14-02-2023 12.15,2023-02-14 12:31:24,23.4,32.0
11-08-2023 15.45,11-08-2023 15.46,2023-08-11 15:47:00,1.0,35.0
08-07-2023 11.16,08-07-2023 11.38,2023-07-08 11:54:11,22.72,47.0
2023/07/28 12:31:00,28-07-2023 12.54,2023-07-28 13:03:19,23.65,36.0
04-11-2023 10.50,04-11-2023 11.14,2023-11-04 11:27:29,24.42,29.0
29-02-2024 12.36,29-02-2024 12.45,2024-02-29 12:46:57,9.65,19.0
13-11-2024 15.45,13-11-2024 15.46,2024-11-13 15:47:00,1.0,50.0
20-01-2023 09.17,20-01-2023 09.42,2023-01-20 09:52:22,25.4,33.0
25-05-2024 09.00,25-05-2024 09.21,2024-05-25 09:30:49,21.38,43.0
2024/11/01 11:40:00,01-11-2024 11.50,2024-11-01 11:58:16,10.52,29.0
31-07-2023 12.29,31-07-2023 12.51,2023-07-31 12:58:18,21.84,43.0
17-03-2023 9.19,17-03-2023 09.42,2023-03-17 09:59:46,23.15,33.0
12-11-2024 10.19,12-11-2024 10.40,2024-11-12 10:49:43,21.41,19.0
2023/02/20 13:16:00,20-02-2023 13.53,2023-02-20 14:01:59,37.76,36.0
30-08-2024 14.33,30-08-2024 15.07,2024-08-30 15:11:28,34.1,47.0
,16-11-2024 10.42,2024-11-16 10:52:47,24.99,21.0
2024/01/03 13:06:00,03-01-2024 13.21,2024-01-03 13:24:11,15.69,40.0
23-03-2024 12.54,23-03-2024 12.59,2024-03-23 13:00:00,5.0,24.0
20-09-2024 13.53,20-09-2024 14.17,2024-09-20 14:29:40,24.84,25.0
29-11-2024 09.02,29-11-2024 09.20,2024-11-29 09:31:29,17.6,20.0
28-10-2023 12.02,28-10-2023 12.19,2023-10-28 12:30:02,17.5,36.0
,26-11-2024 11.44,2024-11-26 11:54:27,17.03,20.0
18-06-2024 13.27,18-06-2024 13.46,2024-06-18 13:59:01,,27.0
23-03-2023 13.37,23-03-2023 15.15,2023-03-23 15:23:40,98.19,22.0
13-06-2023 15.40,13-06-2023 15.44,2023-06-13 15:45:00,4.0,0.0
31-08-2023 14.54,31-08-2023 15.15,2023-08-31 15:29:28,21.2,28.0
24-01-2024 14.16,24-01-2024 14.36,2024-01-24 14:46:36,20.44,38.0
2024/09/27 10:42:00,27-09-2024 11.04,2024-09-27 11:14:50,22.66,22.0
25-04-2024 12.46,25-04-2024 12.57,2024-04-25 13:05:34,11.03,40.0
14-03-2024 14.03,14-03-2024 14.49,2024-03-14 15:00:36,46.54,71.0
31-05-2023 11.22,31-05-2023 11.42,2023-05-31 11:53:44,20.81,34.0
24-04-2023 15.45,24-04-2023 15.46,2023-04-24 15:47:00,1.0,25.0
07-09-2024 09.00,07-09-2024 09.22,2024-09-07 09:35:01,22.33,32.0
20-03-2024 15.13,20-03-2024 15.43,2024-03-20 15:45:00,30.37,46.0
11-12-2023 11.04,11-12-2023 11.24,2023-12-11 11:40:02,20.17,47.0
23-05-2023 10.50,23-05-2023 11.24,2023-05-23 11:32:18,34.46,205.0
31-01-2023 9.16,31-01-2023 09.39,2023-01-31 09:46:44,23.7,29.0
30-06-2023 12.24,30-06-2023 12.37,2023-06-30 12:50:47,13.13,40.0
2023/10/31 12:45:00,31-10-2023 13.27,2023-10-31 13:30:43,42.73,19.0
02-07-2024 12.51,02-07-2024 13.19,2024-07-02 13:28:19,28.77,22.0
29-07-2023 10.06,29-07-2023 10.20,2023-07-29 10:35:23,14.19,24.0
27-09-2023 11.06,27-09-2023 11.19,2023-09-27 11:33:30,13.67,16.0
31-07-2024 13.30,31-07-2024 13.52,2024-07-31 14:06:48,22.51,
18-09-2024 11.41,18-09-2024 12.02,2024-09-18 12:13:11,21.71,26.0
16-03-2023 11.35,16-03-2023 11.57,2023-03-16 12:08:27,22.7,40.0
2023/07/10 12:46:00,10-07-2023 13.29,2023-07-10 13:34:21,43.71,19.0
04-01-2024 12.40,04-01-2024 12.59,2024-01-04 13:18:38,19.15,40.0
24-05-2023 12.44,24-05-2023 13.01,2023-05-24 13:11:50,17.93,0.0
03-07-2023 12.53,03-07-2023 13.19,2023-07-03 13:34:29,25.53,27.0
05-10-2023 11.46,05-10-2023 12.01,2023-10-05 12:12:08,15.8,30.0
09-08-2023 12.32,09-08-2023 12.49,2023-08-09 12:54:46,17.18,32.0
29-08-2024 14.25,29-08-2024 14.47,2024-08-29 14:48:11,22.2,26.0
08-07-2024 09.16,08-07-2024 09.36,2024-07-08 09:52:40,20.52,24.0
14-04-2023 09.27,14-04-2023 09.46,2023-04-14 09:57:59,19.23,36.0
27-03-2023 14.36,27-03-2023 14.51,2023-03-27 15:01:21,15.08,38.0
18-05-2024 13.00,18-05-2024 13.01,2024-05-18 13:02:00,1.0,40.0
15-08-2024 11.59,15-08-2024 12.03,2024-08-15 12:15:52,4.59,11.0
04-02-2023 12.38,04-02-2023 12.54,2023-02-04 13:00:00,16.3,22.0
01-03-2024 10.26,01-03-2024 10.42,2024-03-01 11:02:58,16.24,32.0
23-01-2024 15.45,23-01-2024 15.46,2024-01-23 15:47:00,1.0,35.0
06-05-2024 12.27,06-05-2024 12.54,2024-05-06 12:58:29,27.7,43.0
17-10-2023 09.22,17-10-2023 09.49,2023-10-17 10:00:14,27.01,39.0
12-10-2023 12.37,12-10-2023 13.02,2023-10-12 13:09:42,25.01,29.0
11-03-2024 12.25,11-03-2024 12.47,2024-03-11 12:58:42,22.01,31.0
06-03-2023 14.26,06-03-2023 14.56,2023-03-06 15:08:10,30.1,48.0
2023/05/17 09:59:00,17-05-2023 10.04,2023-05-17 10:11:29,5.38,10.0
2024/03/09 13:00:00,09-03-2024 13.01,2024-03-09 13:02:00,1.0,38.0
29-09-2023 09.30,29-09-2023 09.49,2023-09-29 09:58:49,19.53,39.0
23-06-2023 11.00,23-06-2023 11.12,2023-06-23 11:28:50,12.84,33.0
25-03-2024 15.28,25-03-2024 15.44,2024-03-25 15:45:00,16.89,24.0
03-10-2023 13.04,03-10-2023 13.22,2023-10-03 13:33:01,18.53,32.0
23-05-2023 12.04,23-05-2023 12.25,2023-05-23 12:42:32,21.61,32.0
06-09-2024 14.03,06-09-2024 14.17,2024-09-06 14:29:43,14.33,25.0
11-04-2023 12.24,11-04-2023 12.41,2023-04-11 12:51:03,18.0,28.0
19-05-2023 15.40,19-05-2023 15.44,2023-05-19 15:45:00,4.48,15.0
12-01-2023 13.35,12-01-2023 13.54,2023-01-12 14:02:33,19.72,28.0
15-06-2024 10.41,15-06-2024 10.53,2024-06-15 11:05:54,600.0,32.0
03-05-2024 10.42,03-05-2024 10.58,2024-05-03 11:08:28,16.15,24.0
2023/07/07 09:15:00,07-07-2023 09.39,2023-07-07 09:45:45,24.09,29.0
06-07-2024 09.56,06-07-2024 10.13,2024-07-06 10:28:45,17.59,26.0
16-10-2024 09.03,16-10-2024 09.31,2024-10-16 09:42:30,28.63,40.0
05-09-2023 12.39,05-09-2023 12.58,2023-09-05 13:08:59,19.42,35.0
25-03-2023 10.40,25-03-2023 10.47,2023-03-25 10:56:44,7.59,32.0
24-02-2023 10.26,24-02-2023 11.15,2023-02-24 11:26:39,49.18,22.0
15-10-2024 15.39,15-10-2024 15.44,2024-10-15 15:45:00,4.37,41.0
2024/03/22 09:52:00,22-03-2024 10.07,2024-03-22 10:20:54,15.77,10.0
08-07-2023 13.00,08-07-2023 13.01,2023-07-08 13:02:00,1.0,15.0
16-08-2024 09.42,16-08-2024 10.08,2024-08-16 10:17:17,26.05,38.0
16-05-2023 14.33,16-05-2023 14.50,2023-05-16 15:05:57,17.0,15.0
2024/05/27 15:44:00,27-05-2024 15.44,2024-05-27 15:45:00,0.0,51.0
07-06-2023 09.34,07-06-2023 09.46,2023-06-07 10:01:01,12.39,23.0
2023/02/25 12:26:00,25-02-2023 12.38,2023-02-25 12:51:06,12.71,40.0
11-07-2024 10.36,11-07-2024 10.39,2024-07-11 10:41:27,3.07,32.0
25-09-2023 09.19,25-09-2023 09.44,2023-09-25 09:57:00,25.68,56.0
2024/03/02 11:58:00,02-03-2024 12.22,2024-03-02 12:42:13,24.65,22.0
,26-01-2024 14.31,2024-01-26 14:49:58,15.52,17.0
04-11-2024 10.40,04-11-2024 10.58,2024-11-04 11:01:21,18.05,37.0
06-05-2023 13.00,06-05-2023 13.01,2023-05-06 13:02:00,,157.0
2023/12/11 10:57:00,11-12-2023 11.19,2023-12-11 11:32:08,22.25,26.0
30-05-2024 12.04,30-05-2024 12.32,2024-05-30 12:35:05,28.5,53.0
10-06-2023 13.00,10-06-2023 13.01,2023-06-10 13:02:00,1.0,25.0
2023/01/09 13:08:00,09-01-2023 13.19,2023-01-09 13:24:51,11.31,20.0
2024/08/23 13:06:00,23-08-2024 13.25,2024-08-23 13:35:05,19.19,34.0
2024/09/04 09:54:00,04-09-2024 10.11,2024-09-04 10:21:57,17.45,32.0
2024/03/30 13:00:00,30-03-2024 13.01,2024-03-30 13:02:00,1.0,45.0
04-07-2024 13.48,04-07-2024 14.28,2024-07-04 14:38:15,40.16,47.0
2023/04/27 11:08:00,27-04-2023 11.18,2023-04-27 11:39:24,10.05,19.0
29-02-2024 09.14,29-02-2024 09.40,2024-02-29 09:56:07,26.6,40.0
14-01-2023 09.40,14-01-2023 09.54,2023-01-14 10:09:42,14.55,22.0
,19-09-2023 12.29,2023-09-19 12:39:46,11.01,40.0
06-12-2023 10.08,06-12-2023 10.21,2023-12-06 10:32:26,13.55,16.0
2023/07/01 12:20:00,01-07-2023 12.21,2023-07-01 12:27:13,1.0,40.0
14-12-2023 10.12,14-12-2023 10.41,2023-12-14 10:48:35,29.9,48.0
,12-02-2024 11.02,2024-02-12 11:13:07,27.87,20.0
2023/04/24 11:03:00,24-04-2023 11.25,2023-04-24 11:32:30,22.09,48.0
05-08-2023 09.52,05-08-2023 10.10,2023-08-05 10:18:19,18.35,31.0
13-05-2023 09.48,13-05-2023 10.11,2023-05-13 10:22:42,23.2,26.0
20-05-2023 13.00,20-05-2023 13.01,2023-05-20 13:02:00,1.0,28.0
30-08-2023 14.15,30-08-2023 14.41,2023-08-30 14:57:30,26.18,32.0
12-06-2024 13.58,12-06-2024 14.31,2024-06-12 14:37:11,33.28,37.0
02-03-2024 12.24,02-03-2024 12.33,2024-03-02 12:45:41,9.39,40.0
16-10-2024 11.11,16-10-2024 11.30,2024-10-16 11:52:35,19.48,34.0
14-09-2023 15.42,14-09-2023 15.44,2023-09-14 15:45:00,2.0,24.0
13-05-2023 13.00,13-05-2023 13.01,2023-05-13 13:02:00,1.0,48.0
25-01-2023 12.07,25-01-2023 12.38,2023-01-25 12:55:02,31.29,22.0
08-05-2023 09.20,08-05-2023 09.46,2023-05-08 09:49:57,,47.0
25-04-2023 10.02,25-04-2023 10.31,2023-04-25 10:39:06,29.74,51.0
28-02-2023 11.00,28-02-2023 11.25,2023-02-28 11:46:38,25.36,34.0
03-02-2024 11.50,03-02-2024 12.16,2024-02-03 12:28:03,26.41,48.0
22-12-2023 10.44,22-12-2023 11.01,2023-12-22 11:16:55,17.24,25.0
22-04-2023 12.05,22-04-2023 12.35,2023-04-22 12:48:12,30.18,41.0
31-07-2023 11.24,31-07-2023 11.49,2023-07-31 11:52:57,24.92,
24-03-2023 15.32,24-03-2023 15.44,2023-03-24 15:45:00,,21.0
23-12-2023 13.00,23-12-2023 13.01,2023-12-23 13:02:00,1.0,36.0
20-05-2023 13.00,20-05-2023 13.01,2023-05-20 13:02:00,1.0,7.0
31-07-2024 11.11,31-07-2024 11.33,2024-07-31 11:52:34,22.0,34.0
2023/08/15 12:06:00,15-08-2023 12.32,2023-08-15 12:41:45,26.06,33.0
13-06-2024 12.48,13-06-2024 12.58,2024-06-13 13:06:52,10.22,
06-06-2023 09.03,06-06-2023 09.28,2023-06-06 09:45:00,25.96,43.0
2023/07/26 15:24:00,26-07-2023 15.44,2023-07-26 15:45:00,20.0,48.0
07-08-2023 11.53,07-08-2023 12.00,2023-08-07 12:14:50,7.39,11.0
11-10-2023 11.52,11-10-2023 12.15,2023-10-11 12:31:40,23.56,32.0
2024/11/21 14:32:00,21-11-2024 14.56,2024-11-21 15:13:49,,26.0
06-01-2023 10.16,06-01-2023 10.43,2023-01-06 10:56:05,27.6,29.0
2023/02/21 14:24:00,21-02-2023 14.53,2023-02-21 14:56:54,29.37,35.0
23-06-2023 12.06,23-06-2023 12.15,2023-06-23 12:24:05,9.62,25.0
17-05-2023 12.25,17-05-2023 12.36,2023-05-17 12:49:20,11.33,22.0
19-09-2023 10.15,19-09-2023 10.44,2023-09-19 10:52:59,29.15,31.0
22-06-2024 11.47,22-06-2024 11.58,2024-06-22 12:10:28,11.93,32.0
2024/03/06 13:15:00,06-03-2024 13.43,2024-03-06 13:54:38,28.44,22.0
06-06-2024 11.11,06-06-2024 11.21,2024-06-06 11:34:18,10.61,13.0
,12-09-2023 12.38,2023-09-12 12:47:37,17.35,38.0
10-08-2023 13.27,10-08-2023 13.53,2023-08-10 14:00:20,25.59,38.0
07-09-2023 14.22,07-09-2023 14.48,2023-09-07 14:58:16,26.42,44.0
30-04-2024 14.03,30-04-2024 15.36,2024-04-30 15:45:00,93.48,47.0
02-01-2024 12.52,02-01-2024 13.13,2024-01-02 13:26:45,21.97,32.0
2024/08/02 14:15:00,02-08-2024 14.17,2024-08-02 14:25:19,2.31,17.0
12-11-2024 12.49,12-11-2024 13.16,2024-11-12 13:23:29,27.6,20.0
2024/01/23 11:25:00,23-01-2024 11.42,2024-01-23 11:56:59,17.64,194.0
07-11-2024 15.14,07-11-2024 15.34,2024-11-07 15:43:23,20.15,23.0
15-02-2024 13.38,15-02-2024 13.54,2024-02-15 14:06:04,16.61,17.0
10-06-2024 12.26,10-06-2024 12.45,2024-06-10 12:55:43,19.39,31.0
02-03-2024 12.45,02-03-2024 12.59,2024-03-02 13:00:00,14.0,20.0
14-03-2024 10.44,14-03-2024 11.06,2024-03-14 11:17:02,,33.0
06-09-2023 15.15,06-09-2023 15.43,2023-09-06 15:45:00,28.4,36.0
20-02-2024 12.03,20-02-2024 12.22,2024-02-20 12:35:16,19.52,29.0
2023/09/26 13:38:00,26-09-2023 13.55,2023-09-26 14:03:39,17.35,35.0
2023/12/22 10:14:00,22-12-2023 10.30,2023-12-22 10:35:08,16.23,18.0
2024/07/11 09:54:00,11-07-2024 10.14,2024-07-11 10:24:11,20.56,32.0
2024/05/03 12:41:00,03-05-2024 13.09,2024-05-03 13:30:24,28.44,40.0
17-07-2023 12.33,17-07-2023 12.45,2023-07-17 13:00:29,12.97,40.0
01-04-2023 13.00,01-04-2023 13.01,2023-04-01 13:02:00,1.0,37.0
2023/07/19 11:55:00,19-07-2023 12.15,2023-07-19 12:25:13,20.03,40.0
2024/03/16 10:59:00,16-03-2024 11.24,2024-03-16 11:35:38,25.85,166.0
2023/06/02 13:56:00,02-06-2023 14.05,2023-06-02 14:21:31,9.92,25.0
21-09-2024 12.10,21-09-2024 12.33,2024-09-21 12:37:11,23.19,32.0
22-05-2023 13.08,22-05-2023 13.31,2023-05-22 13:42:59,23.82,29.0
2024/10/10 12:36:00,10-10-2024 12.55,2024-10-10 13:02:23,19.04,43.0
2023/10/03 12:43:00,03-10-2023 13.16,2023-10-03 13:27:48,33.61,36.0
03-05-2023 09.07,03-05-2023 09.22,2023-05-03 09:35:31,15.42,12.0
2023/09/07 11:11:00,07-09-2023 11.31,2023-09-07 11:47:31,19.78,31.0
12-04-2023 09.23,12-04-2023 09.49,2023-04-12 10:05:56,26.93,40.0
2024/08/14 10:23:00,14-08-2024 10.53,2024-08-14 11:08:03,30.23,50.0
24-04-2023 14.48,24-04-2023 14.59,2023-04-24 15:04:21,11.62,26.0
2024/09/07 13:00:00,07-09-2024 13.01,2024-09-07 13:02:00,1.0,
20-05-2023 09.05,20-05-2023 09.26,2023-05-20 09:30:00,21.47,25.0
11-11-2023 10.10,11-11-2023 10.15,2023-11-11 10:27:59,5.26,10.0
16-08-2024 14.27,16-08-2024 14.36,2024-08-16 14:46:44,9.24,16.0
16-05-2024 10.04,16-05-2024 10.29,2024-05-16 10:40:13,25.23,38.0
30-03-2023 09.44,30-03-2023 09.58,2023-03-30 10:08:50,14.57,10.0
2024/01/19 13:45:00,19-01-2024 14.00,2024-01-19 14:03:05,15.65,20.0
29-11-2024 10.14,29-11-2024 10.27,2024-11-29 10:36:33,13.24,15.0
2024/03/11 11:39:00,11-03-2024 12.02,2024-03-11 12:12:06,23.16,32.0
02-10-2024 13.03,02-10-2024 13.26,2024-10-02 13:36:17,23.12,19.0
31-05-2023 10.35,31-05-2023 10.59,2023-05-31 11:20:07,24.66,153.0
23-09-2024 9.38,23-09-2024 10.13,2024-09-23 10:17:58,35.52,63.0
27-11-2023 11.40,27-11-2023 11.53,2023-11-27 12:00:59,13.21,29.0
01-03-2024 09.49,01-03-2024 10.04,2024-03-01 10:15:00,15.79,22.0
2023/02/01 14:55:00,01-02-2023 15.24,2023-02-01 15:45:00,29.63,51.0
2024/07/16 12:39:00,16-07-2024 12.55,2024-07-16 13:12:04,16.53,40.0
29-07-2023 13.00,29-07-2023 13.01,2023-07-29 13:02:00,1.0,48.0
2024/04/04 13:56:00,04-04-2024 14.10,2024-04-04 14:17:01,14.9,43.0
18-10-2023 12.22,18-10-2023 12.46,2023-10-18 12:57:56,24.92,46.0
20-09-2024 11.59,20-09-2024 12.38,2024-09-20 12:50:30,39.03,45.0
17-06-2023 09.49,17-06-2023 10.13,2023-06-17 10:21:19,24.21,52.0
04-03-2024 09.52,04-03-2024 09.57,2024-03-04 10:08:10,5.09,22.0
02-02-2024 11.42,02-02-2024 11.57,2024-02-02 12:03:08,15.39,27.0
19-10-2023 11.23,19-10-2023 11.55,2023-10-19 12:10:09,32.76,35.0
02-07-2024 9.27,02-07-2024 09.39,2024-07-02 09:45:06,12.14,6.0
18-04-2023 13.16,18-04-2023 13.33,2023-04-18 13:46:42,17.91,33.0
10-05-2024 11.36,10-05-2024 12.06,2024-05-10 12:26:08,30.13,45.0
21-10-2024 14.07,21-10-2024 14.31,2024-10-21 14:34:54,24.23,27.0
11-11-2024 14.44,11-11-2024 15.05,2024-11-11 15:17:10,21.25,27.0
2023/12/30 12:29:00,30-12-2023 12.35,2023-12-30 12:50:11,6.79,40.0
11-12-2023 13.06,11-12-2023 13.43,2023-12-11 13:53:48,37.63,49.0
18-01-2024 15.04,18-01-2024 15.16,2024-01-18 15:26:30,12.17,27.0
03-08-2023 12.09,03-08-2023 12.23,2023-08-03 12:41:11,14.28,6.0
31-05-2024 11.16,31-05-2024 11.53,2024-05-31 12:07:00,37.09,56.0
11-07-2023 13.53,11-07-2023 14.09,2023-07-11 14:24:03,16.79,0.0
2023/04/15 13:00:00,15-04-2023 13.01,2023-04-15 13:02:00,1.0,33.0
03-01-2024 11.54,03-01-2024 12.08,2024-01-03 12:20:43,14.11,32.0
22-08-2024 09.59,22-08-2024 10.12,2024-08-22 10:22:29,13.16,15.0
15-07-2023 13.00,15-07-2023 13.01,2023-07-15 13:02:00,1.0,32.0
28-07-2023 09.01,28-07-2023 09.25,2023-07-28 09:34:34,24.84,28.0
13-04-2024 10.46,13-04-2024 10.51,2024-04-13 10:58:25,5.61,32.0
07-02-2023 11.25,07-02-2023 11.43,2023-02-07 11:51:11,18.42,47.0
2023/08/01 09:53:00,01-08-2023 10.12,2023-08-01 10:31:35,18.46,10.0
09-12-2023 13.00,09-12-2023 13.01,2023-12-09 13:02:00,1.0,51.0
01-06-2023 14.19,01-06-2023 14.23,2023-06-01 14:30:53,,16.0
24-02-2024 12.13,24-02-2024 12.35,2024-02-24 12:45:58,22.09,25.0
2023/09/30 09:26:00,30-09-2023 09.37,2023-09-30 09:43:00,11.3,6.0
01-03-2023 10.16,01-03-2023 10.43,2023-03-01 10:52:30,27.05,31.0
04-03-2023 11.56,04-03-2023 12.27,2023-03-04 12:38:22,31.38,25.0
2024/05/15 13:37:00,15-05-2024 13.50,2024-05-15 14:00:57,13.65,12.0
17-06-2024 09.30,17-06-2024 10.02,2024-06-17 10:12:26,32.82,52.0
2024/05/07 10:22:00,07-05-2024 11.25,2024-05-07 11:38:36,63.33,32.0
19-08-2024 10.04,19-08-2024 10.19,2024-08-19 10:32:28,15.86,10.0
08-08-2024 12.34,08-08-2024 12.53,2024-08-08 13:06:15,19.11,46.0
2024/04/10 10:26:00,10-04-2024 10.47,2024-04-10 10:51:16,21.59,34.0
06-04-2023 14.02,06-04-2023 14.04,2023-04-06 14:06:03,2.42,25.0
01-04-2023 12.42,01-04-2023 12.45,2023-04-01 12:56:48,3.53,40.0
08-11-2023 09.48,08-11-2023 10.05,2023-11-08 10:07:47,17.51,26.0
13-08-2024 13.01,13-08-2024 13.08,2024-08-13 13:19:23,7.58,6.0
2024/09/03 13:46:00,03-09-2024 14.00,2024-09-03 14:15:54,14.19,25.0
15-02-2023 15.12,15-02-2023 15.44,2023-02-15 15:45:00,32.0,52.0
2024/03/02 09:39:00,02-03-2024 09.56,2024-03-02 10:07:42,17.85,23.0
13-08-2024 15.20,13-08-2024 15.39,2024-08-13 15:45:00,19.23,43.0
17-02-2023 10.11,17-02-2023 10.22,2023-02-17 10:26:05,11.85,21.0
14-08-2024 13.48,14-08-2024 14.17,2024-08-14 14:28:59,29.11,54.0
01-03-2024 14.23,01-03-2024 14.46,2024-03-01 15:04:37,23.01,27.0
2023/03/28 15:45:00,28-03-2023 15.46,2023-03-28 15:47:00,1.0,25.0
25-06-2024 11.15,25-06-2024 12.50,2024-06-25 13:03:01,95.12,30.0
27-07-2023 13.35,27-07-2023 13.51,2023-07-27 13:52:27,16.46,33.0
12-10-2024 09.51,12-10-2024 10.15,2024-10-12 10:26:40,24.74,36.0
09-09-2024 11.42,09-09-2024 12.04,2024-09-09 12:13:24,22.77,23.0
2023/02/23 15:45:00,23-02-2023 15.46,2023-02-23 15:47:00,1.0,25.0
03-08-2023 14.39,03-08-2023 15.10,2023-08-03 15:21:28,31.51,39.0
25-05-2024 10.19,25-05-2024 10.33,2024-05-25 10:51:36,14.87,32.0
13-11-2023 09.02,13-11-2023 09.22,2023-11-13 09:42:41,20.0,27.0
27-05-2024 14.52,27-05-2024 15.15,2024-05-27 15:27:00,23.8,36.0
2024/03/16 13:00:00,16-03-2024 13.01,2024-03-16 13:02:00,1.0,36.0
04-08-2023 13.32,04-08-2023 14.09,2023-08-04 14:21:07,37.34,201.0
,01-12-2023 09.25,2023-12-01 09:34:28,25.98,32.0
29-04-2023 12.02,29-04-2023 12.33,2023-04-29 12:41:59,31.25,48.0
11-03-2024 12.24,11-03-2024 12.47,2024-03-11 12:54:54,23.58,28.0
29-08-2024 09.15,29-08-2024 09.37,2024-08-29 09:44:23,22.83,20.0
2023/07/31 12:28:00,31-07-2023 12.51,2023-07-31 13:02:18,23.26,
17-09-2024 11.12,17-09-2024 11.43,2024-09-17 11:50:59,32.0,64.0
21-05-2024 15.25,21-05-2024 15.44,2024-05-21 15:45:00,19.0,43.0
02-05-2023 09.53,02-05-2023 10.25,2023-05-02 10:39:11,32.03,37.0
2024/05/06 10:21:00,06-05-2024 10.45,2024-05-06 10:56:44,24.66,30.0
