arrival_time,start_time,finish_time,wait_time,queue_length
01-05-2023 20.34,01-05-2023 20.58,2023-05-01 21:22:26,23.55,24.0
13-10-2023 17.47,13-10-2023 18.02,2023-10-13 18:07:08,14.86,9.0
23-09-2023 19.17,23-09-2023 19.35,2023-09-23 19:37:48,17.95,24.0
29-10-2023 23.04,29-10-2023 23.42,29-10-2023 23:53:07.045146,38.24,64.0
30-03-2023 19.51,30-03-2023 19.51,2023-03-30 20:00:39.400000000,9.49,12.0
20-08-2023 00.39,20-08-2023 01.06,2023-08-20 01:11:13,,34.0
12-05-2023 05.20,12-05-2023 05.46,12-05-2023 05:52:23.641056,26.34,25.0
30-03-2023 5.34,30-03-2023 5.39,2023-03-30 05:51:18.000000000,12.0,50.0
05-08-2023 05.59,05-08-2023 06.26,2023-08-05 06:37:30,27.26,35.0
15-10-2023 14.15,15-10-2023 14.42,2023-10-15 15:00:50,27.15,195.0
30-03-2023 16.45,30-03-2023 16.45,2023-03-30 16:51:30.200000000,6.37,27.0
13-03-2024 20.45,2024-03-13 21:10,2024-03-13 21:15:46,24.73,44.0
14-07-2023 22.17,14-07-2023 22.31,2023-07-14 22:47:33,14.2,38.0
12-03-2024 13.04,12-03-2024 13.28,2024-03-12 13:40:12,24.27,29.0
10-11-2023 02.57,2023-11-10 03:02,2023-11-10 03:09:53,,0.0
01-07-2023 22.23,01-07-2023 22.45,2023-07-01 22:52:28,22.37,30.0
29-10-2023 04.51,29-10-2023 05.05,2023-10-29 05:07:14,13.35,19.0
27-09-2023 21.55,27-09-2023 22.13,2023-09-27 22:25:39,17.75,26.0
29-09-2023 11.38,29-09-2023 11.59,2023-09-29 12:08:34,21.13,11.0
25-01-2024 18.50,25-01-2024 19.22,2024-01-25 19:24:54,32.14,49.0
17-01-2024 00.16,17-01-2024 00.43,2024-01-17 00:59:19,27.35,30.0
08-03-2024 08.11,08-03-2024 08.39,2024-03-08 08:48:46,27.99,38.0
25-10-2023 23.45,2023-10-26 00:05,2023-10-26 00:16:37,20.51,24.0
14-05-2023 04.32,14-05-2023 04.55,2023-05-14 05:05:19,23.29,23.0
25-05-2023 01.25,25-05-2023 01.04,2023-05-25 01:27:07,20.66,19.0
10-08-2023 19.39,10-08-2023 20.08,2023-08-10 20:28:13,29.23,36.0
10-06-2023 04.58,10-06-2023 05.23,2023-06-10 05:25:56,24.82,31.0
07-11-2023 04.44,07-11-2023 04.55,2023-11-07 05:08:49,11.31,19.0
2023/10/30 16:19:43,30-10-2023 16.48,2023-10-30 17:01:32,28.6,23.0
03-05-2023 17.12,03-05-2023 17.41,2023-05-03 17:44:12,28.97,37.0
10-09-2023 16.12,10-09-2023 16.31,2023-09-10 16:38:18,73.22,29.0
05-08-2023 04.52,05-08-2023 05.14,2023-08-05 05:25:30,21.82,27.0
30-03-2023 19.51,30-03-2023 19.52,2023-03-30 20:01:13.600000000,9.06,12.0
31-08-2023 18.33,31-08-2023 19.02,2023-08-31 19:13:52,29.17,40.0
2024/02/09 16:19:26,09-02-2024 16.47,2024-02-09 16:58:20,28.43,37.0
19-12-2023 02.32,19-12-2023 02.58,2023-12-19 03:05:11,25.25,30.0
24-11-2023 06.30,24-11-2023 06.45,2023-11-24 06:55:03,14.96,14.0
21-10-2023 09.10,2023-10-21 09:43,2023-10-21 09:48:17,33.16,52.0
22-09-2023 06.26,2023-09-22 06:43,2023-09-22 06:57:26,16.94,29.0
29-04-2023 12.10,29-04-2023 12.34,2023-04-29 12:44:06,24.5,47.0
30-03-2023 8.42,30-03-2023 8.42,2023-03-30 08:42:24.200000000,-0.38,47.0
30-03-2023 18.31,30-03-2023 18.33,2023-03-30 18:44:40.800000000,11.28,30.0
14-04-2023 11.07,14-04-2023 11.26,2023-04-14 11:34:41,19.16,32.0
12-05-2023 06.05,12-05-2023 06.21,12-05-2023 06:23:01.909477,15.18,15.0
14-08-2023 09.04,14-08-2023 09.30,2023-08-14 09:40:38,26.04,50.0
06-06-2023 14.12,06-06-2023 14.30,2023-06-06 14:43:30,17.93,41.0
26-06-2023 05.27,26-06-2023 05.51,2023-06-26 06:00:04,24.57,35.0
06-11-2023 06.55,06-11-2023 07.22,2023-11-06 07:40:35,27.17,44.0
08-05-2023 07.58,08-05-2023 08.37,2023-05-08 08:54:21,38.71,47.0
01-12-2023 11.50,01-12-2023 12.13,2023-12-01 12:26:37,22.73,24.0
,10-03-2024 06.35,2024-03-10 06:50:41,16.66,28.0
19-11-2023 04.07,19-11-2023 04.21,2023-11-19 04:30:35,13.82,23.0
02-03-2024 06.39,02-03-2024 06.59,2024-03-02 07:15:17,19.39,15.0
24-01-2024 10.14,24-01-2024 10.39,2024-01-24 10:50:20,24.71,34.0
28-07-2023 21.55,28-07-2023 22.28,2023-07-28 22:40:50,32.83,50.0
30-03-2023 9.49,30-03-2023 9.57,2023-03-30 10:08:35.199999999,11.52,10.0
30-03-2023 5.34,30-03-2023 5.37,2023-03-30 05:51:26.400000000,14.14,50.0
30-03-2023 11.32,30-03-2023 11.32,2023-03-30 11:36:58.400000000,4.49,2.0
26-03-2024 14.04,26-03-2024 14.30,2024-03-26 14:49:21,25.82,40.0
09-07-2023 12.26,09-07-2023 12.50,2023-07-09 13:02:12,24.08,35.0
24-02-2024 00.37,24-02-2024 01.01,2024-02-24 01:12:25,23.98,46.0
05-10-2023 12.35,05-10-2023 12.48,2023-10-05 12:52:33,13.64,14.0
17-02-2024 20.44,17-02-2024 21.12,2024-02-17 21:18:37,27.97,44.0
01-11-2023 10.28,01-11-2023 10.49,2023-11-01 10:59:21,21.76,37.0
30-03-2023 0.10,30-03-2023 0.19,2023-03-30 00:30:52.600000000,11.81,28.0
2023/04/13 10:42:50,13-04-2023 11.05,2023-04-13 11:16:05,22.96,22.0
03-08-2023 14.44,03-08-2023 15.06,2023-08-03 15:12:24,21.25,28.0
30-03-2023 16.45,30-03-2023 16.54,2023-03-30 17:13:50.000000000,19.7,27.0
29-08-2023 02.29,29-08-2023 02.52,2023-08-29 03:05:47,22.83,43.0
30-03-2023 12.33,30-03-2023 12.42,2023-03-30 12:52:08.800000000,10.03,40.0
11-01-2024 04.25,2024-01-11 04:43,2024-01-11 04:47:18,18.82,25.0
28-02-2024 12.00,28-02-2024 12.07,2024-02-28 12:21:02,7.1,11.0
03-05-2023 10.06,03-05-2023 10.23,2023-05-03 10:26:53,16.57,38.0
27-08-2023 14.17,27-08-2023 14.41,2023-08-27 14:51:32,24.01,39.0
28-06-2023 15.13,28-06-2023 15.42,2023-06-28 15:44:46,29.27,34.0
16-05-2023 20.13,16-05-2023 20.37,2023-05-16 20:39:15,23.3,37.0
18-03-2024 18.50,18-03-2024 19.02,2024-03-18 19:04:44,12.51,30.0
30-03-2023 17.34,30-03-2023 17.43,2023-03-30 17:54:59.599999999,11.11,16.0
02-08-2023 01.46,02-08-2023 02.02,2023-08-02 02:15:56,15.99,47.0
20-06-2023 15.24,20-06-2023 15.55,2023-06-20 16:09:13,30.74,48.0
05-02-2024 06.07,05-02-2024 06.44,2024-02-05 06:55:35,36.76,66.0
30-03-2023 12.33,30-03-2023 12.43,2023-03-30 12:55:49.000000000,12.7,40.0
26-12-2023 08.52,26-12-2023 09.08,26-12-2023 09:11:58.648420,15.72,18.0
,28-06-2023 01.31,2023-06-28 01:34:36,26.39,36.0
05-09-2023 06.18,05-09-2023 06.38,2023-09-05 06:47:14,20.48,37.0
2023/04/04 02:14:54,04-04-2023 02.31,2023-04-04 02:35:02,16.64,25.0
2023/09/14 12:53:48,14-09-2023 13.16,14-09-2023 13:29:04.460998,22.56,27.0
28-12-2023 12.29,28-12-2023 12.53,2023-12-28 12:58:29,23.27,40.0
02-07-2023 16.51,02-07-2023 17.20,2023-07-02 17:26:06,28.71,43.0
21-07-2023 14.28,21-07-2023 14.46,2023-07-21 15:01:04,17.67,15.0
23-03-2024 09.41,23-03-2024 09.51,2024-03-23 09:56:49,9.55,18.0
07-11-2023 04.01,07-11-2023 04.29,2023-11-07 04:31:50,28.28,
20-04-2023 07.52,20-04-2023 08.07,2023-04-20 08:20:21,68.73,26.0
,20-02-2024 13.14,2024-02-20 13:30:50,42.38,63.0
24-05-2023 14.32,24-05-2023 14.57,2023-05-24 15:12:51,24.27,57.0
04-05-2023 04.33,04-05-2023 05.01,2023-05-04 05:15:43,28.05,44.0
13-07-2023 23.16,2023-07-13 23:32,2023-07-13 23:49:29,16.11,9.0
11-07-2023 16.27,11-07-2023 16.49,2023-07-11 17:05:35,22.26,25.0
08-06-2023 10.20,08-06-2023 10.43,2023-06-08 10:55:32,23.54,30.0
01-03-2024 21.10,01-03-2024 21.39,2024-03-01 21:49:34,28.76,20.0
04-06-2023 17.34,04-06-2023 17.57,2023-06-04 18:05:32,23.53,19.0
06-02-2024 17.39,06-02-2024 17.51,2024-02-06 18:03:26,12.4,
14-12-2023 13.08,14-12-2023 13.37,2023-12-14 13:46:59,29.42,35.0
05-07-2023 02.35,05-07-2023 03.08,2023-07-05 03:19:53,32.4,23.0
25-12-2023 09.42,25-12-2023 10.01,2023-12-25 10:04:24,19.24,26.0
2023/04/12 02:38:27,12-04-2023 02.59,2023-04-12 03:04:59,21.28,43.0
09-09-2023 14.51,09-09-2023 15.01,2023-09-09 15:13:09,10.39,29.0
26-04-2023 07.15,26-04-2023 07.36,2023-04-26 07:46:17,21.01,38.0
23-05-2023 22.08,23-05-2023 22.42,2023-05-23 22:53:54,33.67,33.0
10-03-2024 18.10,10-03-2024 18.30,2024-03-10 18:48:59,19.48,32.0
23-04-2023 05.25,23-04-2023 05.33,2023-04-23 05:44:05,8.65,18.0
19-02-2024 12.05,19-02-2024 12.24,2024-02-19 12:30:13,19.58,32.0
06-12-2023 00.21,06-12-2023 00.06,2023-12-06 00:35:02,15.06,16.0
29-12-2023 01.30,29-12-2023 01.44,2023-12-29 01:54:46,13.76,34.0
15-05-2023 20.00,15-05-2023 20.22,2023-05-15 20:33:16,21.12,188.0
2023/04/28 17:36:10,28-04-2023 17.51,2023-04-28 17:54:57,15.36,25.0
06-07-2023 23.20,06-07-2023 23.47,2023-07-06 23:50:24,27.02,42.0
12-12-2023 06.51,12-12-2023 07.09,2023-12-12 07:22:52,17.56,34.0
15-11-2023 10.13,2023-11-15 10:46,15-11-2023 11:00:07.873454,32.31,36.0
15-05-2023 11.06,15-05-2023 11.28,2023-05-15 11:43:23,22.44,47.0
30-03-2023 19.51,30-03-2023 20.00,2023-03-30 20:17:22.000000000,17.2,12.0
04-02-2024 05.08,04-02-2024 05.30,2024-02-04 05:51:38,22.21,9.0
20-08-2023 08.31,20-08-2023 09.02,2023-08-20 09:18:18,30.97,41.0
19-04-2023 03.48,19-04-2023 04.07,2023-04-19 04:16:15,19.62,46.0
11-04-2023 17.21,11-04-2023 17.54,2023-04-11 18:11:20,,36.0
18-06-2023 07.47,18-06-2023 08.15,2023-06-18 08:23:07,28.21,42.0
31-12-2023 06.46,31-12-2023 07.17,2023-12-31 07:30:19,30.75,49.0
19-02-2024 05.21,19-02-2024 05.34,2024-02-19 05:53:20,12.66,20.0
2023/10/01 03:39:52,01-10-2023 04.10,2023-10-01 04:26:32,30.22,30.0
19-01-2024 20.19,19-01-2024 20.44,2024-01-19 20:46:53,25.74,17.0
05-07-2023 10.52,2023-07-05 11:22,2023-07-05 11:38:26,29.97,40.0
30-03-2023 1.58,30-03-2023 2.06,2023-03-30 02:19:40.600000000,13.06,27.0
01-03-2024 16.13,01-03-2024 16.28,2024-03-01 16:38:55,15.31,36.0
2024-01-02 04:06,02-01-2024 03.55,2024-01-02 04:14:25,11.06,16.0
2023/05/11 21:30:18,11-05-2023 21.51,2023-05-11 21:59:49,21.23,23.0
13-02-2024 19.56,13-02-2024 20.19,2024-02-13 20:28:48,23.72,37.0
06-10-2023 18.25,2023-10-06 18:50,2023-10-06 18:54:49,125.72,49.0
01-05-2023 06.34,2023-05-01 06:45,2023-05-01 06:47:20,11.1,14.0
30-03-2023 0.10,30-03-2023 0.18,2023-03-30 00:22:35.800000000,4.53,28.0
14-05-2023 05.09,14-05-2023 05.28,2023-05-14 05:43:33,19.63,20.0
21-03-2024 10.20,21-03-2024 10.39,2024-03-21 10:59:11,,0.0
13-08-2023 09.56,13-08-2023 10.20,2023-08-13 10:32:20,24.44,38.0
16-10-2023 15.18,16-10-2023 15.45,2023-10-16 15:53:23,26.85,31.0
30-03-2023 12.33,30-03-2023 12.37,2023-03-30 12:44:00.400000000,6.89,40.0
30-03-2023 12.33,30-03-2023 12.43,2023-03-30 12:51:53.799999999,8.78,40.0
23-04-2023 10.53,23-04-2023 11.23,2023-04-23 11:45:32,29.73,49.0
28-06-2023 20.42,28-06-2023 21.06,2023-06-28 21:12:30,23.66,31.0
24-02-2024 15.34,24-02-2024 15.52,2024-02-24 16:01:12,18.06,25.0
30-03-2023 5.34,30-03-2023 5.38,2023-03-30 05:51:33.600000000,13.26,168.0
24-03-2024 16.35,24-03-2024 16.55,2024-03-24 17:09:45,67.84,32.0
01-08-2023 03.47,01-08-2023 04.15,2023-08-01 04:22:04,28.3,25.0
21-11-2023 12.11,21-11-2023 12.25,2023-11-21 12:38:31,14.19,7.0
07-02-2024 04.03,07-02-2024 04.25,2024-02-07 04:33:48,21.97,15.0
31-10-2023 06.43,31-10-2023 07.00,2023-10-31 07:13:46,16.63,18.0
30-03-2023 18.31,30-03-2023 18.31,2023-03-30 18:41:58.800000000,10.58,30.0
01-05-2023 12.10,01-05-2023 12.28,2023-05-01 12:36:30,18.4,38.0
02-08-2023 20.53,02-08-2023 21.16,2023-08-02 21:20:49,23.58,28.0
30-03-2023 10.31,30-03-2023 10.37,2023-03-30 10:51:24.199999999,14.02,32.0
30-03-2023 18.31,30-03-2023 18.31,2023-03-30 18:34:27.000000000,3.05,30.0
02-06-2023 09.02,2023-06-02 09:18,2023-06-02 09:30:13,16.38,12.0
28-08-2023 03.02,28-08-2023 03.22,2023-08-28 03:24:14,20.12,51.0
11-07-2023 11.48,11-07-2023 12.10,11-07-2023 12:24:54.071632,21.77,34.0
30-03-2023 5.34,30-03-2023 5.42,2023-03-30 05:53:54.000000000,11.6,50.0
29-12-2023 11.15,29-12-2023 11.36,2023-12-29 11:43:09,21.38,25.0
15-11-2023 18.57,15-11-2023 19.04,15-11-2023 19:16:27.698406,6.28,10.0
27-06-2023 13.29,27-06-2023 13.48,2023-06-27 13:57:43,19.07,17.0
20-01-2024 13.44,20-01-2024 14.13,2024-01-20 14:22:02,29.6,33.0
2023/10/04 17:15:26,04-10-2023 17.37,2023-10-04 17:46:15,22.54,22.0
30-03-2023 0.10,30-03-2023 0.17,2023-03-30 00:26:48.400000000,9.74,28.0
08-04-2023 19.25,08-04-2023 19.57,2023-04-08 20:10:55,31.83,34.0
07-07-2023 14.12,07-07-2023 14.43,2023-07-07 14:53:16,30.94,62.0
01-01-2024 06.38,01-01-2024 06.54,2024-01-01 06:59:42,16.34,25.0
21-08-2023 14.35,21-08-2023 15.02,2023-08-21 15:20:04,27.81,33.0
12-04-2023 03.44,12-04-2023 04.09,2023-04-12 04:16:26,24.39,30.0
17-12-2023 14.39,17-12-2023 14.52,2023-12-17 15:06:00,12.81,20.0
13-04-2023 15.53,13-04-2023 16.12,2023-04-13 16:31:41,18.65,26.0
08-09-2023 16.47,08-09-2023 17.13,2023-09-08 17:18:53,26.65,39.0
25-03-2024 11.23,25-03-2024 11.32,2024-03-25 11:54:32,9.64,19.0
22-03-2024 08.47,22-03-2024 09.20,2024-03-22 09:38:38,32.98,32.0
,08-12-2023 12.35,2023-12-08 12:47:59,18.65,34.0
05-05-2023 07.52,05-05-2023 08.13,2023-05-05 08:27:08,20.84,35.0
16-03-2024 01.53,2024-03-16 02:12,2024-03-16 02:26:49,18.77,25.0
10-05-2023 18.42,10-05-2023 19.11,2023-05-10 19:28:05,29.02,43.0
07-12-2023 23.40,08-12-2023 00.05,2023-12-08 00:14:46,24.12,31.0
13-04-2023 10.23,13-04-2023 10.54,2023-04-13 11:02:37,31.28,44.0
23-03-2024 18.12,23-03-2024 18.43,23-03-2024 18:55:09.871847,31.47,42.0
12-08-2023 12.20,12-08-2023 12.48,2023-08-12 12:51:05,27.67,28.0
,21-03-2024 13.31,2024-03-21 13:41:18,18.71,9.0
09-02-2024 15.23,09-02-2024 15.52,2024-02-09 16:00:30,29.24,39.0
18-02-2024 18.21,18-02-2024 18.35,18-02-2024 18:48:28.834182,13.93,33.0
30-03-2023 8.42,30-03-2023 8.46,2023-03-30 08:52:12.799999999,5.43,47.0
06-09-2023 04.44,06-09-2023 05.06,2023-09-06 05:14:33,21.76,39.0
06-03-2024 06.27,06-03-2024 06.42,2024-03-06 06:53:16,14.66,23.0
05-04-2023 10.56,05-04-2023 11.16,2023-04-05 11:24:35,19.87,36.0
29-01-2024 23.52,30-01-2024 00.25,2024-01-30 00:40:34,32.61,63.0
25-05-2023 13.50,25-05-2023 14.06,2023-05-25 14:22:47,16.32,28.0
07-05-2023 20.07,07-05-2023 20.22,2023-05-07 20:41:15,14.85,25.0
22-06-2023 05.30,22-06-2023 05.53,2023-06-22 06:05:27,23.46,33.0
30-11-2023 10.44,2023-11-30 11:09,2023-11-30 11:11:47,25.55,19.0
2023/10/05 21:22:55,05-10-2023 21.49,2023-10-05 22:07:33,,36.0
2023/12/14 16:06:45,14-12-2023 16.23,2023-12-14 16:25:35,16.83,34.0
2023/05/12 10:11:51,12-05-2023 10.34,2023-05-12 10:45:43,23.06,24.0
09-06-2023 19.37,2023-06-09 19:50,2023-06-09 20:06:43,12.8,4.0
07-08-2023 01.30,07-08-2023 01.54,2023-08-07 02:02:47,24.42,26.0
28-09-2023 05.06,28-09-2023 05.26,2023-09-28 05:42:03,20.04,30.0
25-03-2024 11.58,25-03-2024 12.21,2024-03-25 12:32:38,23.6,41.0
2024/03/11 07:40:34,11-03-2024 07.52,2024-03-11 08:06:41,11.71,18.0
21-01-2024 18.15,21-01-2024 18.24,2024-01-21 18:35:38,9.01,14.0
02-08-2023 13.55,02-08-2023 14.22,2023-08-02 14:32:30,26.15,51.0
26-04-2023 09.19,26-04-2023 09.53,2023-04-26 09:57:54,34.42,42.0
08-04-2023 01.37,2023-04-08 01:48,2023-04-08 01:59:17,11.54,15.0
12-04-2023 04.03,12-04-2023 04.30,2023-04-12 04:44:27,27.75,45.0
2023/04/17 21:58:46,2023-04-17 22:11,2023-04-17 22:27:43,12.59,9.0
30-03-2023 3.02,30-03-2023 3.03,2023-03-30 03:06:45.600000000,3.51,45.0
30-07-2023 23.01,30-07-2023 23.31,2023-07-30 23:46:45,29.69,38.0
30-03-2023 21.09,30-03-2023 21.18,2023-03-30 21:27:10.800000000,8.33,44.0
17-09-2023 12.58,2023-09-17 13:15,2023-09-17 13:25:22,16.97,33.0
12-09-2023 08.46,2023-09-12 09:04,2023-09-12 09:25:15,18.4,22.0
05-12-2023 22.57,05-12-2023 23.30,2023-12-05 23:44:19,32.98,46.0
2023/11/12 07:05:42,12-11-2023 07.27,2023-11-12 07:38:46,21.79,37.0
14-10-2023 21.03,14-10-2023 21.30,2023-10-14 21:37:07,27.56,39.0
,23-10-2023 00.27,2023-10-23 00:44:32,24.71,35.0
23-01-2024 02.33,23-01-2024 03.01,2024-01-23 03:14:30,28.13,29.0
2023/08/23 00:44:58,23-08-2023 01.11,2023-08-23 01:19:42,26.99,43.0
08-07-2023 10.52,08-07-2023 10.30,2023-07-08 10:58:06,22.57,33.0
30-03-2023 1.58,30-03-2023 2.07,2023-03-30 02:20:21.400000000,12.74,27.0
04-05-2023 19.20,04-05-2023 19.31,2023-05-04 19:40:09,10.48,0.0
21-06-2023 08.23,2023-06-21 08:46,2023-06-21 08:57:57,23.18,35.0
2023/09/17 09:28:32,17-09-2023 09.52,2023-09-17 10:10:42,23.61,47.0
30-03-2023 3.02,30-03-2023 3.11,2023-03-30 03:24:03.000000000,12.8,45.0
30-11-2023 01.39,30-11-2023 01.57,2023-11-30 02:00:59,17.38,18.0
05-03-2024 03.59,05-03-2024 04.30,2024-03-05 04:45:27,31.4,35.0
05-12-2023 09.57,05-12-2023 10.24,2023-12-05 10:38:35,26.97,38.0
30-03-2023 6.51,30-03-2023 6.56,2023-03-30 07:04:50.200000000,8.17,24.0
07-06-2023 14.56,07-06-2023 15.06,2023-06-07 15:24:58,10.44,27.0
30-08-2023 08.47,30-08-2023 09.14,2023-08-30 09:28:24,27.12,48.0
11-06-2023 23.37,2023-06-11 23:49,2023-06-12 00:04:16,12.12,24.0
17-08-2023 03.35,17-08-2023 03.47,2023-08-17 03:55:08,12.53,28.0
10-09-2023 11.12,10-09-2023 11.44,2023-09-10 11:56:24,31.78,56.0
08-01-2024 02.48,2024-01-08 03:01,2024-01-08 03:15:30,12.96,17.0
02-09-2023 08.53,02-09-2023 09.09,2023-09-02 09:24:25,16.64,
20-05-2023 00.42,20-05-2023 01.12,2023-05-20 01:16:32,30.35,47.0
2023/10/03 15:13:43,03-10-2023 15.40,2023-10-03 15:50:19,26.87,38.0
26-02-2024 08.50,26-02-2024 09.16,2024-02-26 09:24:50,26.45,33.0
01-05-2023 06.27,01-05-2023 06.46,2023-05-01 06:56:12,,27.0
30-03-2023 5.34,30-03-2023 5.34,2023-03-30 05:37:11.400000000,2.89,50.0
23-02-2024 03.38,23-02-2024 03.55,2024-02-23 04:16:08,17.46,21.0
01-12-2023 01.44,01-12-2023 02.10,2023-12-01 02:24:22,25.27,31.0
26-03-2024 20.17,26-03-2024 20.45,2024-03-26 20:47:52,27.91,50.0
24-10-2023 11.35,2023-10-24 12:07,2023-10-24 12:16:48,31.83,42.0
24-09-2023 22.17,2023-09-24 22:33,2023-09-24 22:35:58,15.63,26.0
20-04-2023 11.40,2023-04-20 11:58,2023-04-20 12:04:23,17.9,15.0
01-08-2023 22.26,01-08-2023 22.52,2023-08-01 23:04:26,25.74,39.0
06-06-2023 08.22,06-06-2023 09.03,2023-06-06 09:11:34,40.76,48.0
14-07-2023 14.36,14-07-2023 15.06,2023-07-14 15:22:00,98.13,48.0
11-03-2024 22.13,11-03-2024 22.33,2024-03-11 22:51:28,20.0,42.0
18-11-2023 03.26,18-11-2023 03.55,2023-11-18 04:07:59,28.91,28.0
01-07-2023 03.03,01-07-2023 03.18,2023-07-01 03:37:50,15.39,18.0
22-06-2023 17.11,22-06-2023 17.33,2023-06-22 17:44:46,22.41,39.0
14-05-2023 14.29,14-05-2023 14.56,2023-05-14 15:04:46,26.43,53.0
23-05-2023 18.30,23-05-2023 18.59,2023-05-23 19:09:31,28.3,56.0
30-03-2023 5.34,30-03-2023 5.43,2023-03-30 05:51:55.800000000,8.63,50.0
30-03-2023 12.33,30-03-2023 12.38,2023-03-30 12:58:21.399999999,20.24,40.0
,30-03-2023 6.53,2023-03-30 07:02:49.600000000,9.16,214.0
2023/09/26 04:44:02,26-09-2023 05.02,2023-09-26 05:12:16,18.26,23.0
14-12-2023 18.42,14-12-2023 19.03,2023-12-14 19:18:16,21.04,26.0
30-03-2023 1.58,30-03-2023 2.06,2023-03-30 02:24:08.800000000,17.53,27.0
30-12-2023 05.59,2023-12-30 06:16,2023-12-30 06:30:57,16.29,37.0
02-08-2023 02.06,02-08-2023 02.41,2023-08-02 02:43:44,34.84,59.0
2024/01/13 16:44:19,13-01-2024 17.04,2024-01-13 17:20:47,20.58,29.0
02-07-2023 09.07,02-07-2023 09.24,2023-07-02 09:36:51,17.11,26.0
30-03-2023 21.09,30-03-2023 21.18,2023-03-30 21:23:42.600000000,4.86,44.0
17-09-2023 22.58,17-09-2023 23.23,2023-09-17 23:37:34,25.66,49.0
11-11-2023 08.21,2023-11-11 08:51,2023-11-11 09:02:43,29.94,46.0
16-12-2023 17.35,2023-12-16 17:50,2023-12-16 17:55:28,15.38,9.0
11-10-2023 16.07,11-10-2023 16.41,2023-10-11 17:12:43,34.54,50.0
30-03-2023 12.33,30-03-2023 12.40,2023-03-30 12:50:04.600000000,9.96,40.0
08-05-2023 23.16,08-05-2023 23.42,2023-05-09 00:03:05,25.74,25.0
,08-04-2023 16.57,08-04-2023 17:10:35.351494,21.97,9.0
30-03-2023 08.50,30-03-2023 09.23,2023-03-30 09:43:07,32.96,55.0
30-03-2023 5.34,30-03-2023 5.41,2023-03-30 05:55:29.400000000,14.19,50.0
2023/05/18 08:42:20,18-05-2023 09.01,2023-05-18 09:06:38,19.59,26.0
19-12-2023 21.26,19-12-2023 21.43,2023-12-19 22:00:00,17.01,37.0
,06-06-2023 20.27,2023-06-06 20:38:24,30.43,50.0
01-09-2023 03.52,01-09-2023 04.23,2023-09-01 04:25:13,30.14,44.0
24-03-2024 05.48,24-03-2024 06.14,2024-03-24 06:24:16,26.22,41.0
2023/05/17 02:20:20,17-05-2023 02.40,2023-05-17 02:51:07,20.22,27.0
05-06-2023 21.18,05-06-2023 21.40,2023-06-05 21:47:59,21.93,17.0
24-03-2024 03.03,24-03-2024 03.32,2024-03-24 03:45:58,29.42,47.0
05-05-2023 14.41,05-05-2023 15.10,2023-05-05 15:21:48,,31.0
13-01-2024 16.49,2024-01-13 17:14,13-01-2024 17:23:48.246585,25.42,38.0
01-01-2024 09.07,01-01-2024 09.29,2024-01-01 09:44:55,22.1,44.0
24-10-2023 22.30,24-10-2023 22.36,2023-10-24 22:47:37,5.76,3.0
22-08-2023 21.19,22-08-2023 21.43,2023-08-22 21:47:04,23.85,33.0
23-11-2023 05.11,23-11-2023 05.30,2023-11-23 05:39:25,19.35,180.0
07-12-2023 13.42,07-12-2023 14.04,2023-12-07 14:12:05,21.7,37.0
17-11-2023 09.23,17-11-2023 09.35,2023-11-17 09:40:43,11.94,5.0
25-09-2023 18.08,25-09-2023 18.38,2023-09-25 18:40:06,29.61,42.0
04-06-2023 04.32,04-06-2023 04.57,04-06-2023 05:11:06.916152,24.56,29.0
25-04-2023 05.40,25-04-2023 05.55,2023-04-25 06:08:37,15.19,19.0
18-10-2023 15.42,18-10-2023 15.54,2023-10-18 16:07:54,12.28,0.0
30-03-2023 0.10,30-03-2023 0.13,2023-03-30 00:25:48.400000000,12.74,28.0
22-11-2023 23.04,22-11-2023 23.18,2023-11-22 23:37:06,13.33,29.0
08-03-2024 14.51,08-03-2024 15.17,2024-03-08 15:24:43,25.3,45.0
30-03-2023 21.09,30-03-2023 21.15,2023-03-30 21:25:13.800000000,52.06,44.0
21-10-2023 19.36,21-10-2023 20.02,2023-10-21 20:06:53,26.69,59.0
19-08-2023 10.59,19-08-2023 11.26,2023-08-19 11:34:32,27.53,56.0
03-02-2024 10.50,03-02-2024 11.16,2024-02-03 11:25:41,25.6,31.0
29-08-2023 04.07,2023-08-29 04:21,2023-08-29 04:38:19,14.42,16.0
31-03-2023 11.16,31-03-2023 11.34,31-03-2023 11:43:32.756597,18.0,20.0
13-09-2023 01.55,13-09-2023 02.24,2023-09-13 02:36:28,29.07,51.0
30-03-2023 20.49,30-03-2023 20.54,2023-03-30 21:09:51.200000000,14.92,22.0
18-09-2023 13.45,18-09-2023 14.17,2023-09-18 14:31:47,31.86,40.0
13-05-2023 15.25,13-05-2023 15.47,2023-05-13 15:57:14,21.91,18.0
30-03-2023 12.33,30-03-2023 12.39,2023-03-30 12:46:31.600000000,7.41,40.0
31-01-2024 00.22,31-01-2024 00.39,2024-01-31 00:47:38,17.14,32.0
17-04-2023 21.14,17-04-2023 21.41,2023-04-17 21:47:13,26.98,41.0
30-03-2023 2.36,30-03-2023 2.36,2023-03-30 02:41:40.800000000,5.53,
14-06-2023 10.44,14-06-2023 11.05,2023-06-14 11:31:36,20.33,40.0
24-12-2023 07.47,24-12-2023 08.14,2023-12-24 08:20:12,26.53,53.0
,20-07-2023 07.38,2023-07-20 07:43:33,19.27,27.0
05-04-2023 12.25,05-04-2023 12.43,2023-04-05 12:58:48,18.61,11.0
28-11-2023 18.31,28-11-2023 18.57,28-11-2023 19:11:04.571190,26.34,27.0
13-07-2023 04.24,13-07-2023 04.34,2023-07-13 04:38:39,10.3,6.0
2023/11/01 21:59:43,01-11-2023 22.33,2023-11-01 22:41:42,34.21,40.0
21-10-2023 12.08,2023-10-21 12:30,2023-10-21 12:33:08,22.31,31.0
26-07-2023 12.02,26-07-2023 12.35,2023-07-26 12:50:22,33.19,54.0
14-06-2023 16.31,2023-06-14 16:54,2023-06-14 17:03:22,23.03,28.0
20-12-2023 08.38,20-12-2023 08.58,2023-12-20 09:09:23,20.23,
16-10-2023 06.01,16-10-2023 06.21,2023-10-16 06:29:56,19.98,20.0
30-03-2023 2.36,30-03-2023 2.41,2023-03-30 02:48:39.000000000,7.5,17.0
11-09-2023 18.46,11-09-2023 19.05,2023-09-11 19:25:12,19.36,18.0
21-11-2023 04.30,21-11-2023 04.53,2023-11-21 05:07:26,22.09,38.0
17-08-2023 08.25,17-08-2023 08.50,2023-08-17 09:00:34,24.54,34.0
30-03-2023 12.33,30-03-2023 12.43,2023-03-30 12:53:44.199999999,10.62,40.0
12-09-2023 15.31,12-09-2023 16.00,2023-09-12 16:11:17,28.85,32.0
11-05-2023 01.11,11-05-2023 01.34,2023-05-11 01:39:34,22.44,42.0
19-01-2024 15.14,19-01-2024 15.31,2024-01-19 15:44:21,16.84,26.0
26-01-2024 17.57,26-01-2024 18.24,2024-01-26 18:35:28,26.56,41.0
16-03-2024 16.55,16-03-2024 17.20,2024-03-16 17:32:34,24.94,30.0
30-06-2023 11.48,30-06-2023 12.18,2023-06-30 12:23:46,30.19,36.0
22-02-2024 13.30,22-02-2024 13.58,2024-02-22 14:00:51,28.18,33.0
30-03-2023 8.42,30-03-2023 8.44,2023-03-30 08:46:10.399999999,5.77,47.0
19-05-2023 10.50,19-05-2023 11.13,2023-05-19 11:22:41,22.91,27.0
21-08-2023 04.25,21-08-2023 04.51,2023-08-21 05:03:40,26.15,37.0
28-08-2023 00.32,28-08-2023 00.50,28-08-2023 01:00:57.909668,17.88,39.0
12-10-2023 04.44,12-10-2023 05.07,2023-10-12 05:24:23,23.91,44.0
30-03-2023 16.45,30-03-2023 16.53,2023-03-30 17:07:20.600000000,14.21,27.0
19-05-2023 22.10,2023-05-19 22:24,2023-05-19 22:31:36,13.66,38.0
16-09-2023 22.39,16-09-2023 23.04,2023-09-16 23:16:27,25.06,43.0
30-03-2023 7.14,30-03-2023 7.16,2023-03-30 07:21:24.800000000,5.08,3.0
26-01-2024 00.32,26-01-2024 01.08,2024-01-26 01:20:36,35.2,56.0
05-07-2023 10.30,05-07-2023 10.49,2023-07-05 10:54:26,18.85,42.0
19-05-2023 14.07,19-05-2023 14.28,2023-05-19 14:34:34,20.1,8.0
21-09-2023 18.54,2023-09-21 19:10,2023-09-21 19:23:57,15.72,12.0
21-08-2023 06.25,21-08-2023 06.36,2023-08-21 06:39:36,11.35,27.0
23-10-2023 12.50,23-10-2023 13.23,2023-10-23 13:36:11,33.02,33.0
30-05-2023 07.51,30-05-2023 08.03,2023-05-30 08:07:36,12.59,15.0
05-11-2023 12.22,2023-11-05 12:36,2023-11-05 12:47:51,,22.0
02-12-2023 08.07,02-12-2023 08.32,2023-12-02 08:42:11,25.09,24.0
10-11-2023 10.52,10-11-2023 11.20,2023-11-10 11:41:06,28.31,50.0
25-10-2023 11.03,25-10-2023 11.26,2023-10-25 11:42:09,23.02,31.0
30-03-2023 3.02,30-03-2023 3.02,2023-03-30 03:19:08.999999999,16.9,45.0
30-03-2023 5.34,30-03-2023 5.38,2023-03-30 05:50:42.000000000,12.4,50.0
23-03-2024 09.04,23-03-2024 09.35,2024-03-23 09:43:46,30.93,46.0
15-02-2024 05.54,15-02-2024 06.24,2024-02-15 06:40:49,29.71,35.0
03-02-2024 14.54,03-02-2024 15.15,2024-02-03 15:32:44,,27.0
09-05-2023 17.47,09-05-2023 18.08,2023-05-09 18:14:33,21.45,42.0
17-12-2023 07.53,17-12-2023 08.12,2023-12-17 08:15:03,19.1,34.0
16-02-2024 13.03,16-02-2024 13.22,2024-02-16 13:32:21,19.39,30.0
25-06-2023 23.04,25-06-2023 23.26,2023-06-25 23:31:54,22.57,33.0
21-07-2023 23.09,21-07-2023 23.29,2023-07-21 23:42:17,19.31,36.0
29-07-2023 05.54,29-07-2023 06.18,2023-07-29 06:26:34,23.43,38.0
11-12-2023 21.15,11-12-2023 21.37,2023-12-11 21:49:31,21.59,43.0
04-04-2023 18.37,04-04-2023 18.59,2023-04-04 19:08:12,21.83,40.0
30-03-2023 20.49,30-03-2023 20.52,2023-03-30 21:04:13.400000000,11.29,22.0
27-06-2023 12.38,27-06-2023 13.03,2023-06-27 13:12:20,113.93,46.0
24-03-2024 14.30,24-03-2024 14.53,2024-03-24 15:10:34,22.5,27.0
16-06-2023 07.31,16-06-2023 07.40,2023-06-16 07:43:27,9.1,16.0
03-10-2023 20.19,03-10-2023 20.44,2023-10-03 20:59:00,25.48,26.0
11-09-2023 07.18,11-09-2023 07.45,2023-09-11 07:49:08,26.49,42.0
28-10-2023 08.05,28-10-2023 08.29,2023-10-28 08:46:17,23.88,31.0
30-12-2023 21.39,30-12-2023 22.05,2023-12-30 22:15:24,25.72,19.0
10-07-2023 03.26,10-07-2023 03.47,2023-07-10 03:55:33,21.01,30.0
13-11-2023 07.21,13-11-2023 07.47,2023-11-13 07:51:38,25.73,37.0
28-03-2024 08.38,28-03-2024 08.57,2024-03-28 09:07:57,18.19,12.0
30-03-2023 5.34,30-03-2023 5.40,2023-03-30 05:54:07.800000000,13.83,50.0
2024/02/07 13:39:39,07-02-2024 14.15,2024-02-07 14:22:09,36.08,201.0
23-01-2024 04.22,23-01-2024 04.34,2024-01-23 04:54:01,12.4,32.0
22-03-2024 22.54,22-03-2024 23.03,2024-03-22 23:11:00,9.3,16.0
29-12-2023 05.45,29-12-2023 06.17,2023-12-29 06:33:39,31.62,34.0
30-03-2023 18.31,30-03-2023 18.37,2023-03-30 18:43:46.800000000,6.38,30.0
,12-04-2023 06.40,2023-04-12 06:50:09,27.96,40.0
30-03-2023 8.42,30-03-2023 8.50,2023-03-30 09:00:28.400000000,9.69,47.0
29-04-2023 23.11,2023-04-29 23:35,2023-04-29 23:51:04,24.78,35.0
23-07-2023 23.24,23-07-2023 23.50,2023-07-24 00:04:53,25.28,27.0
30-03-2023 8.42,30-03-2023 8.42,2023-03-30 09:01:57.800000000,19.18,47.0
12-05-2023 16.29,12-05-2023 17.01,12-05-2023 17:07:52.675308,31.47,54.0
13-02-2024 14.39,2024-02-13 15:00,2024-02-13 15:10:01,21.09,37.0
23-03-2024 09.19,2024-03-23 09:35,23-03-2024 09:52:11.821182,15.82,27.0
21-01-2024 02.59,21-01-2024 03.22,2024-01-21 03:32:21,23.64,42.0
30-03-2023 23.52,31-03-2023 00.18,2023-03-31 00:34:29,25.7,38.0
12-08-2023 14.53,12-08-2023 15.05,2023-08-12 15:11:06,12.47,19.0
07-12-2023 20.50,2023-12-07 21:09,2023-12-07 21:19:20,18.94,30.0
30-03-2023 15.45,30-03-2023 15.54,2023-03-30 16:06:53.800000000,12.08,25.0
12-02-2024 09.12,12-02-2024 09.37,2024-02-12 09:43:06,25.4,28.0
17-05-2023 09.14,17-05-2023 09.34,17-05-2023 09:44:00.037955,20.02,31.0
02-01-2024 21.28,02-01-2024 21.52,2024-01-02 22:03:52,24.11,40.0
2024/01/16 06:24:44,2024-01-16 06:43,2024-01-16 06:52:08,18.64,20.0
30-03-2023 15.45,30-03-2023 15.49,2023-03-30 16:03:41.199999999,13.87,25.0
31-12-2023 04.24,31-12-2023 04.46,2023-12-31 05:06:42,21.72,23.0
18-10-2023 01.31,18-10-2023 01.37,2023-10-18 01:45:47,5.84,4.0
04-01-2024 03.31,04-01-2024 03.50,2024-01-04 04:09:40,18.29,26.0
2023/08/24 04:50:35,24-08-2023 05.01,2023-08-24 05:06:59,11.25,9.0
04-05-2023 09.41,04-05-2023 10.11,2023-05-04 10:19:11,29.73,52.0
20-03-2024 11.44,20-03-2024 12.07,2024-03-20 12:19:49,23.03,56.0
25-02-2024 01.59,25-02-2024 02.36,2024-02-25 02:39:24,37.29,54.0
30-03-2023 15.45,30-03-2023 15.45,2023-03-30 15:52:15.400000000,6.44,25.0
06-01-2024 15.20,06-01-2024 15.45,2024-01-06 15:58:34,24.11,46.0
17-10-2023 19.33,17-10-2023 19.45,2023-10-17 19:53:38,12.14,14.0
18-03-2024 13.16,18-03-2024 13.32,2024-03-18 13:43:18,16.41,37.0
08-01-2024 02.36,08-01-2024 02.55,2024-01-08 02:57:39,19.39,5.0
13-04-2023 02.41,13-04-2023 03.02,2023-04-13 03:20:28,20.81,37.0
17-07-2023 23.10,17-07-2023 23.26,2023-07-17 23:28:53,16.65,17.0
31-01-2024 08.42,31-01-2024 08.58,2024-01-31 09:14:01,16.57,32.0
27-07-2023 15.45,27-07-2023 16.02,2023-07-27 16:24:59,16.3,13.0
27-02-2024 08.25,27-02-2024 08.47,2024-02-27 08:50:42,21.49,37.0
10-08-2023 07.11,10-08-2023 07.32,2023-08-10 07:44:53,20.93,31.0
16-11-2023 15.31,16-11-2023 15.54,2023-11-16 15:58:42,23.01,38.0
30-03-2023 6.51,30-03-2023 6.55,2023-03-30 06:54:34.600000000,-1.09,24.0
14-04-2023 11.09,14-04-2023 11.35,2023-04-14 11:47:20,26.32,30.0
28-03-2024 16.19,28-03-2024 16.46,2024-03-28 16:52:12,27.39,51.0
2024/03/21 01:14:14,21-03-2024 01.39,2024-03-21 01:53:00,25.42,39.0
06-05-2023 18.54,06-05-2023 19.26,2023-05-06 19:35:08,31.68,45.0
21-09-2023 03.12,21-09-2023 03.40,2023-09-21 03:47:09,27.98,53.0
03-05-2023 12.28,03-05-2023 12.52,2023-05-03 13:06:02,24.62,37.0
28-06-2023 18.33,28-06-2023 18.54,2023-06-28 19:06:50,20.73,19.0
25-09-2023 21.25,25-09-2023 21.49,2023-09-25 21:54:23,23.63,44.0
23-08-2023 12.02,2023-08-23 12:21,2023-08-23 12:31:38,19.03,26.0
22-09-2023 19.22,22-09-2023 19.34,2023-09-22 19:43:55,12.6,15.0
19-04-2023 22.02,19-04-2023 22.20,2023-04-19 22:22:21,18.35,23.0
29-08-2023 05.32,29-08-2023 05.50,2023-08-29 06:04:35,17.46,9.0
15-09-2023 17.20,15-09-2023 17.43,2023-09-15 17:50:06,23.38,54.0
30-03-2023 2.36,30-03-2023 2.44,2023-03-30 02:54:02.400000000,9.89,17.0
05-10-2023 15.25,05-10-2023 15.41,2023-10-05 15:45:03,16.31,22.0
16-12-2023 22.41,16-12-2023 22.54,2023-12-16 23:04:04,13.77,33.0
10-06-2023 08.26,10-06-2023 08.38,2023-06-10 08:49:37,12.53,36.0
15-09-2023 05.31,15-09-2023 05.48,2023-09-15 06:08:23,17.01,20.0
20-10-2023 03.07,20-10-2023 03.35,2023-10-20 03:44:31,27.74,34.0
04-07-2023 15.02,04-07-2023 15.29,2023-07-04 15:41:32,26.55,48.0
24-06-2023 10.03,24-06-2023 10.24,2023-06-24 10:38:09,20.92,23.0
16-04-2023 07.15,16-04-2023 07.39,2023-04-16 07:44:32,24.38,36.0
30-03-2023 5.34,30-03-2023 5.44,2023-03-30 05:59:41.400000000,15.39,50.0
11-09-2023 16.18,11-09-2023 16.49,2023-09-11 17:00:16,30.86,34.0
30-01-2024 06.25,30-01-2024 07.00,2024-01-30 07:22:45,35.84,48.0
03-09-2023 11.23,03-09-2023 11.37,2023-09-03 11:52:17,14.08,37.0
31-12-2023 10.32,31-12-2023 11.03,31-12-2023 11:16:50.965654,31.1,44.0
20-08-2023 08.18,2023-08-20 08:29,2023-08-20 08:51:03,11.35,20.0
06-07-2023 19.51,06-07-2023 20.09,2023-07-06 20:20:54,18.3,
19-07-2023 23.30,2023-07-19 23:39,2023-07-19 23:44:17,9.39,28.0
28-03-2024 13.09,28-03-2024 13.28,2024-03-28 13:42:34,18.75,42.0
13-08-2023 09.24,13-08-2023 09.48,2023-08-13 09:57:57,23.54,34.0
27-12-2023 16.33,27-12-2023 16.50,2023-12-27 17:11:15,17.37,35.0
,18-02-2024 19.13,2024-02-18 19:22:06,23.8,45.0
19-06-2023 04.06,19-06-2023 04.33,2023-06-19 04:35:59,27.41,34.0
30-03-2023 3.02,30-03-2023 3.10,2023-03-30 03:13:55.200000000,3.67,45.0
30-03-2023 12.33,30-03-2023 12.43,2023-03-30 13:07:39.399999999,24.54,40.0
09-09-2023 02.28,09-09-2023 02.47,2023-09-09 03:05:40,18.58,8.0
2023/12/28 01:16:05,28-12-2023 01.32,2023-12-28 01:40:17,15.98,16.0
05-12-2023 02.38,05-12-2023 03.06,2023-12-05 03:18:36,28.15,42.0
10-12-2023 10.12,2023-12-10 10:45,2023-12-10 10:55:15,33.46,32.0
20-06-2023 19.53,20-06-2023 20.17,2023-06-20 20:26:52,23.7,27.0
12-05-2023 10.49,12-05-2023 11.18,2023-05-12 11:32:12,29.64,19.0
30-03-2023 21.09,30-03-2023 21.15,2023-03-30 21:29:37.199999999,13.77,44.0
07-06-2023 04.06,07-06-2023 04.22,2023-06-07 04:37:25,15.78,22.0
30-03-2023 5.34,30-03-2023 5.35,2023-03-30 05:47:33.000000000,12.25,50.0
30-03-2023 5.34,30-03-2023 5.34,2023-03-30 05:46:29.400000000,12.19,50.0
15-11-2023 00.17,15-11-2023 00.40,15-11-2023 00:45:36.205373,22.73,28.0
31-01-2024 09.26,31-01-2024 10.01,2024-01-31 10:07:05,34.86,43.0
20-11-2023 22.52,2023-11-20 23:10,2023-11-20 23:18:11,18.57,28.0
13-11-2023 20.16,13-11-2023 20.43,2023-11-13 20:49:02,27.61,44.0
03-06-2023 04.44,03-06-2023 05.13,2023-06-03 05:21:26,29.19,62.0
06-04-2023 08.37,06-04-2023 08.50,2023-04-06 08:56:26,12.2,31.0
09-09-2023 14.32,09-09-2023 15.01,2023-09-09 15:09:20,28.65,37.0
29-07-2023 23.08,29-07-2023 23.24,2023-07-29 23:36:35,15.68,25.0
10-03-2024 23.59,11-03-2024 00.20,2024-03-11 00:31:34,20.75,27.0
09-02-2024 17.33,09-02-2024 17.59,2024-02-09 18:13:55,25.52,39.0
30-03-2023 0.10,30-03-2023 0.12,2023-03-30 00:25:37.600000000,13.56,28.0
30-03-2023 21.09,30-03-2023 21.09,2023-03-30 21:17:12.000000000,7.35,44.0
,27-11-2023 12.22,2023-11-27 12:32:45,32.39,47.0
20-08-2023 07.06,20-08-2023 07.30,2023-08-20 07:40:53,24.52,35.0
2023/05/31 18:32:21,31-05-2023 18.56,2023-05-31 19:10:28,24.24,29.0
08-09-2023 01.06,2023-09-08 01:39,2023-09-08 01:52:15,32.98,42.0
09-10-2023 06.57,09-10-2023 07.23,2023-10-09 07:34:07,25.81,39.0
30-10-2023 10.50,30-10-2023 11.11,2023-10-30 11:24:53,21.53,25.0
28-11-2023 14.33,28-11-2023 15.07,2023-11-28 15:22:18,33.35,42.0
20-05-2023 16.55,20-05-2023 17.15,2023-05-20 17:28:44,19.81,42.0
02-04-2023 03.39,02-04-2023 04.06,2023-04-02 04:15:04,27.52,31.0
29-09-2023 16.00,29-09-2023 16.22,2023-09-29 16:36:26,21.58,39.0
23-04-2023 03.01,23-04-2023 03.12,23-04-2023 03:14:23.085459,11.15,24.0
16-04-2023 07.09,16-04-2023 07.37,2023-04-16 07:49:23,27.8,57.0
30-03-2023 12.33,30-03-2023 12.39,2023-03-30 12:45:09.400000000,6.04,40.0
14-11-2023 03.16,14-11-2023 03.36,2023-11-14 03:40:05,19.52,35.0
02-03-2024 15.39,2024-03-02 16:01,2024-03-02 16:14:53,22.39,20.0
20-06-2023 13.34,20-06-2023 13.51,20-06-2023 13:57:13.744623,16.74,27.0
14-05-2023 05.02,14-05-2023 05.18,2023-05-14 05:28:32,75.81,30.0
03-01-2024 21.59,03-01-2024 22.27,2024-01-03 22:41:13,27.61,44.0
25-10-2023 08.15,25-10-2023 08.48,2023-10-25 08:57:10,33.48,44.0
27-04-2023 12.48,27-04-2023 13.07,2023-04-27 13:09:52,18.67,143.0
11-02-2024 15.32,11-02-2024 15.47,2024-02-11 16:01:21,15.32,14.0
06-09-2023 15.00,06-09-2023 15.40,2023-09-06 15:55:02,40.6,52.0
20-02-2024 02.11,20-02-2024 02.28,2024-02-20 02:36:03,17.04,32.0
07-02-2024 21.59,07-02-2024 22.34,2024-02-07 22:48:54,35.59,51.0
30-03-2023 6.51,30-03-2023 6.57,2023-03-30 07:10:26.199999999,12.77,24.0
30-03-2023 8.42,30-03-2023 8.50,2023-03-30 09:04:26.000000000,13.65,47.0
30-03-2023 16.45,30-03-2023 16.49,2023-03-30 16:57:41.000000000,8.55,27.0
30-03-2023 22.00,30-03-2023 22.02,2023-03-30 22:16:59.800000000,14.83,12.0
30-03-2023 12.33,30-03-2023 12.36,2023-03-30 12:48:37.600000000,,40.0
31-10-2023 15.05,31-10-2023 15.11,2023-10-31 15:21:13,5.78,
30-03-2023 5.34,30-03-2023 5.35,2023-03-30 05:44:57.600000000,9.66,50.0
16-07-2023 04.17,16-07-2023 04.37,2023-07-16 04:44:52,19.25,30.0
2023/04/10 08:27:50,10-04-2023 08.53,2023-04-10 09:13:06,25.35,45.0
27-10-2023 08.00,27-10-2023 08.23,2023-10-27 08:36:09,22.69,14.0
20-06-2023 00.26,20-06-2023 00.48,2023-06-20 01:01:21,21.33,20.0
2023/08/31 13:59:10,31-08-2023 14.13,2023-08-31 14:26:19,13.98,0.0
29-01-2024 04.32,29-01-2024 04.57,2024-01-29 05:08:00,25.19,45.0
30-03-2023 8.42,30-03-2023 8.48,2023-03-30 09:00:05.000000000,11.3,47.0
02-07-2023 11.34,02-07-2023 12.10,2023-07-02 12:23:35,36.71,34.0
30-03-2023 3.02,30-03-2023 3.02,2023-03-30 03:16:33.000000000,14.3,185.0
20-05-2023 05.32,20-05-2023 05.53,2023-05-20 05:59:46,20.59,26.0
15-11-2023 01.26,15-11-2023 01.52,2023-11-15 01:57:06,25.81,47.0
21-12-2023 20.55,21-12-2023 21.17,2023-12-21 21:27:44,22.6,37.0
11-03-2024 14.11,11-03-2024 14.54,2024-03-11 15:07:33,43.5,71.0
24-02-2024 13.16,24-02-2024 13.49,2024-02-24 14:10:14,32.72,44.0
20-11-2023 21.40,20-11-2023 22.07,2023-11-20 22:15:48,26.67,56.0
29-10-2023 06.00,29-10-2023 06.12,2023-10-29 06:30:24,12.53,16.0
22-06-2023 22.05,22-06-2023 22.30,2023-06-22 22:42:36,24.52,33.0
30-03-2023 6.51,30-03-2023 6.52,2023-03-30 07:05:47.199999999,13.12,24.0
24-03-2024 05.20,24-03-2024 05.37,2024-03-24 05:48:17,17.42,20.0
30-03-2023 17.34,30-03-2023 17.36,2023-03-30 17:46:44.599999999,9.86,16.0
12-12-2023 09.04,12-12-2023 09.25,2023-12-12 09:45:12,21.54,27.0
07-11-2023 19.20,07-11-2023 19.53,2023-11-07 20:06:59,33.84,49.0
30-06-2023 16.15,30-06-2023 16.30,2023-06-30 16:50:45,14.98,29.0
21-02-2024 12.57,21-02-2024 13.16,2024-02-21 13:25:58,18.53,0.0
2023/09/04 10:19:07,04-09-2023 10.40,2023-09-04 10:55:59,21.87,30.0
30-03-2023 6.51,30-03-2023 6.51,2023-03-30 07:04:53.800000000,13.23,24.0
20-08-2023 10.12,20-08-2023 10.39,2023-08-20 10:50:58,26.93,29.0
2023/05/01 22:04:23,01-05-2023 22.27,2023-05-01 22:38:30,22.63,25.0
30-03-2023 10.31,30-03-2023 10.36,2023-03-30 10:38:43.399999999,2.34,32.0
30-03-2023 14.12,30-03-2023 14.17,2023-03-30 14:27:05.000000000,9.55,17.0
12-03-2024 23.08,12-03-2024 23.29,2024-03-12 23:39:08,,25.0
30-03-2023 10.31,30-03-2023 10.41,2023-03-30 10:53:36.200000000,12.22,32.0
05-12-2023 08.02,05-12-2023 08.27,2023-12-05 08:32:34,24.96,24.0
28-11-2023 23.43,29-11-2023 00.00,2023-11-29 00:06:33,16.45,24.0
29-05-2023 06.15,29-05-2023 06.52,2023-05-29 06:59:40,37.51,55.0
07-04-2023 18.08,2023-04-07 18:16,2023-04-07 18:33:01,8.17,12.0
07-10-2023 01.21,07-10-2023 01.46,2023-10-07 01:54:31,25.41,26.0
30-03-2023 14.12,30-03-2023 14.16,2023-03-30 14:25:21.200000000,8.82,17.0
2023/09/18 11:45:25,18-09-2023 12.11,2023-09-18 12:27:45,26.17,36.0
30-03-2023 8.42,30-03-2023 8.44,2023-03-30 08:56:34.400000000,11.79,
21-09-2023 14.48,21-09-2023 15.17,2023-09-21 15:38:54,29.11,51.0
29-07-2023 07.47,29-07-2023 08.10,2023-07-29 08:19:10,23.06,35.0
2023/09/01 11:40:20,01-09-2023 12.07,2023-09-01 12:21:00,26.9,45.0
08-08-2023 23.13,08-08-2023 23.35,2023-08-08 23:37:14,21.88,36.0
30-03-2023 18.31,30-03-2023 18.41,2023-03-30 18:56:00.599999999,14.61,30.0
13-04-2023 01.47,2023-04-13 02:07,2023-04-13 02:18:54,19.85,34.0
30-03-2023 22.00,30-03-2023 22.00,2023-03-30 22:10:19.600000000,10.16,12.0
31-10-2023 18.35,2023-10-31 18:47,2023-10-31 19:04:39,12.47,20.0
16-05-2023 10.16,16-05-2023 10.32,2023-05-16 10:42:53,88.61,33.0
10-05-2023 13.59,10-05-2023 14.18,2023-05-10 14:26:10,18.59,15.0
04-10-2023 00.04,04-10-2023 00.31,2023-10-04 00:33:54,27.88,35.0
22-02-2024 17.19,22-02-2024 17.41,2024-02-22 17:48:29,22.51,29.0
10-01-2024 04.42,10-01-2024 05.08,10-01-2024 05:13:35.284684,25.78,58.0
03-11-2023 19.08,03-11-2023 19.43,03-11-2023 19:53:20.656833,35.08,53.0
05-03-2024 17.57,2024-03-05 18:14,2024-03-05 18:31:08,16.13,32.0
18-03-2024 11.18,18-03-2024 11.45,2024-03-18 11:47:44,26.85,33.0
24-01-2024 02.00,24-01-2024 02.27,2024-01-24 02:40:25,27.31,36.0
20-05-2023 20.59,20-05-2023 21.28,2023-05-20 21:38:24,28.86,50.0
04-03-2024 16.38,04-03-2024 16.57,2024-03-04 17:15:30,18.41,17.0
30-03-2023 6.51,30-03-2023 7.00,2023-03-30 07:08:17.800000000,7.63,24.0
15-08-2023 02.09,15-08-2023 02.36,2023-08-15 02:53:56,27.2,49.0
23-11-2023 12.17,23-11-2023 12.46,2023-11-23 12:55:45,,48.0
30-03-2023 12.33,30-03-2023 12.35,2023-03-30 12:45:08.199999999,10.02,40.0
01-03-2024 00.41,01-03-2024 01.15,2024-03-01 01:22:06,34.19,56.0
20-10-2023 02.49,20-10-2023 03.14,2023-10-20 03:21:00,24.88,29.0
03-05-2023 05.55,03-05-2023 06.10,2023-05-03 06:24:10,14.72,34.0
01-08-2023 16.02,2023-08-01 16:20,2023-08-01 16:30:29,17.61,42.0
30-03-2023 3.02,30-03-2023 3.02,2023-03-30 03:20:34.200000000,18.32,45.0
26-04-2023 01.01,26-04-2023 01.28,2023-04-26 01:38:18,26.66,30.0
18-11-2023 18.24,18-11-2023 18.43,2023-11-18 18:55:38,18.18,28.0
17-10-2023 22.11,17-10-2023 22.30,2023-10-17 22:36:52,19.52,34.0
08-05-2023 12.25,08-05-2023 12.47,2023-05-08 13:03:50,21.15,31.0
,26-05-2023 08.04,2023-05-26 08:15:28,22.11,27.0
13-02-2024 18.08,13-02-2024 18.37,2024-02-13 18:52:18,28.88,58.0
04-12-2023 03.34,04-12-2023 04.08,2023-12-04 04:20:07,33.57,41.0
27-01-2024 23.49,28-01-2024 00.22,2024-01-28 00:30:59,32.95,45.0
24-04-2023 10.13,24-04-2023 10.38,24-04-2023 10:57:16.223917,25.4,24.0
16-11-2023 12.03,16-11-2023 12.20,2023-11-16 12:28:46,16.45,29.0
31-12-2023 15.27,2023-12-31 15:42,2023-12-31 15:53:32,14.8,33.0
13-06-2023 19.04,2023-06-13 19:34,2023-06-13 19:48:44,30.08,46.0
2023/11/10 08:07:38,10-11-2023 08.37,2023-11-10 08:42:33,30.02,42.0
2023/04/27 00:24:46,27-04-2023 00.41,2023-04-27 00:48:11,16.62,35.0
26-03-2024 11.42,26-03-2024 12.05,2024-03-26 12:13:34,22.56,60.0
09-11-2023 11.46,09-11-2023 12.07,2023-11-09 12:23:11,20.37,30.0
04-07-2023 03.58,04-07-2023 04.31,2023-07-04 04:38:27,32.29,39.0
30-03-2023 18.31,30-03-2023 18.34,2023-03-30 18:47:57.600000000,13.56,30.0
19-02-2024 20.47,19-02-2024 21.05,2024-02-19 21:16:49,18.39,26.0
15-08-2023 16.57,15-08-2023 17.18,2023-08-15 17:36:08,21.3,30.0
10-12-2023 14.29,10-12-2023 14.51,2023-12-10 15:13:14,22.65,15.0
15-03-2024 01.49,15-03-2024 02.06,15-03-2024 02:18:10.912249,17.11,30.0
09-10-2023 23.21,09-10-2023 23.36,2023-10-09 23:49:30,15.7,15.0
06-11-2023 15.20,06-11-2023 15.45,2023-11-06 15:50:49,25.06,50.0
22-12-2023 19.50,22-12-2023 20.07,2023-12-22 20:19:24,17.09,44.0
04-12-2023 18.41,04-12-2023 19.12,2023-12-04 19:23:39,31.08,34.0
30-03-2023 10.31,30-03-2023 10.31,2023-03-30 10:44:31.400000000,13.14,32.0
18-06-2023 08.44,18-06-2023 09.22,2023-06-18 09:34:20,37.21,43.0
30-03-2023 21.09,30-03-2023 21.13,2023-03-30 21:19:10.800000000,5.33,44.0
17-11-2023 17.26,17-11-2023 17.58,2023-11-17 18:13:30,32.1,41.0
02-06-2023 00.12,02-06-2023 00.30,2023-06-02 00:35:28,18.66,31.0
03-08-2023 01.43,03-08-2023 02.09,2023-08-03 02:14:50,25.65,45.0
15-05-2023 10.39,15-05-2023 10.58,2023-05-15 11:05:54,18.16,9.0
2024/03/26 04:15:07,26-03-2024 04.30,2024-03-26 04:43:03,14.91,25.0
15-08-2023 09.18,15-08-2023 09.46,2023-08-15 10:04:17,27.95,40.0
26-08-2023 01.04,26-08-2023 01.13,2023-08-26 01:15:56,9.33,33.0
,08-10-2023 00.50,2023-10-08 01:18:39,23.38,27.0
29-11-2023 11.44,29-11-2023 12.02,2023-11-29 12:18:30,17.91,29.0
16-07-2023 03.45,2023-07-16 04:06,2023-07-16 04:16:17,21.51,31.0
13-04-2023 14.03,13-04-2023 14.22,2023-04-13 14:31:27,18.92,35.0
14-05-2023 10.00,2023-05-14 10:33,2023-05-14 10:53:38,33.13,48.0
12-06-2023 14.21,12-06-2023 14.38,2023-06-12 14:40:18,16.94,14.0
30-03-2023 17.34,30-03-2023 17.34,2023-03-30 17:43:35.600000000,8.71,16.0
2023/10/01 13:20:11,01-10-2023 13.39,2023-10-01 13:50:34,18.82,20.0
30-03-2023 20.49,30-03-2023 20.50,2023-03-30 21:03:21.800000000,12.43,22.0
30-03-2023 13.55,30-03-2023 13.58,2023-03-30 14:07:15.400000000,8.49,146.0
03-02-2024 21.15,03-02-2024 21.35,2024-02-03 21:52:01,,35.0
21-10-2023 01.42,21-10-2023 01.59,2023-10-21 02:02:14,17.13,18.0
,11-02-2024 11.55,2024-02-11 12:10:45,22.98,21.0
02-02-2024 19.35,02-02-2024 20.05,2024-02-02 20:21:02,30.08,36.0
12-01-2024 21.16,12-01-2024 21.48,2024-01-12 22:00:09,31.94,44.0
27-02-2024 15.45,27-02-2024 16.14,2024-02-27 16:30:29,28.91,50.0
09-07-2023 12.06,09-07-2023 12.20,2023-07-09 12:31:41,13.96,34.0
07-01-2024 17.41,07-01-2024 17.53,2024-01-07 18:03:32,11.86,22.0
23-01-2024 18.08,23-01-2024 18.36,2024-01-23 18:41:46,119.56,25.0
26-08-2023 16.11,26-08-2023 16.39,2023-08-26 16:53:20,27.55,43.0
2023/09/23 09:55:22,23-09-2023 10.05,2023-09-23 10:16:52,9.87,17.0
23-06-2023 21.00,23-06-2023 21.27,2023-06-23 21:42:33,26.4,19.0
29-05-2023 02.07,29-05-2023 02.24,2023-05-29 02:29:42,16.77,13.0
30-11-2023 03.29,30-11-2023 03.54,2023-11-30 04:11:31,24.54,46.0
10-04-2023 12.49,10-04-2023 13.15,2023-04-10 13:22:44,26.55,36.0
28-11-2023 02.47,28-11-2023 03.16,2023-11-28 03:28:55,29.36,35.0
2024/03/27 22:11:24,27-03-2024 22.23,2024-03-27 22:30:47,11.61,9.0
,18-11-2023 08.23,2023-11-18 08:36:29,,37.0
2023/07/12 22:25:49,12-07-2023 22.52,2023-07-12 23:04:45,26.88,52.0
,28-03-2024 16.06,2024-03-28 16:27:05,20.69,6.0
01-08-2023 00.05,01-08-2023 00.20,2023-08-01 00:33:48,15.23,15.0
30-03-2023 14.12,30-03-2023 14.19,2023-03-30 14:39:29.000000000,19.95,17.0
18-03-2024 19.30,18-03-2024 19.58,2024-03-18 20:10:06,,50.0
26-06-2023 02.35,26-06-2023 02.52,2023-06-26 02:54:00,16.85,22.0
28-08-2023 18.38,28-08-2023 18.57,2023-08-28 19:06:57,18.82,35.0
22-11-2023 04.39,22-11-2023 05.00,2023-11-22 05:19:46,21.69,11.0
21-09-2023 03.46,2023-09-21 04:12,2023-09-21 04:21:26,25.97,31.0
07-11-2023 15.58,07-11-2023 16.19,2023-11-07 16:29:05,20.29,30.0
24-07-2023 23.21,24-07-2023 23.39,2023-07-24 23:47:03,18.31,33.0
10-10-2023 21.10,10-10-2023 21.24,2023-10-10 21:35:12,13.36,32.0
26-01-2024 16.08,26-01-2024 16.44,2024-01-26 16:55:03,35.41,48.0
19-05-2023 16.30,19-05-2023 16.43,2023-05-19 17:03:17,12.81,19.0
22-08-2023 02.29,22-08-2023 02.46,2023-08-22 03:03:39,17.51,14.0
19-09-2023 18.43,19-09-2023 19.13,2023-09-19 19:22:04,29.7,37.0
30-03-2023 13.55,30-03-2023 14.05,2023-03-30 14:14:08.199999999,8.37,171.0
12-06-2023 08.29,12-06-2023 08.49,2023-06-12 08:54:41,20.2,16.0
19-10-2023 12.35,19-10-2023 12.52,2023-10-19 12:54:46,16.89,32.0
30-12-2023 16.51,30-12-2023 17.07,2023-12-30 17:17:20,15.71,26.0
30-11-2023 14.21,30-11-2023 14.40,2023-11-30 14:46:00,18.35,32.0
03-03-2024 23.46,2024-03-03 23:54,2024-03-04 00:04:00,7.76,31.0
26-09-2023 21.03,26-09-2023 21.26,2023-09-26 21:33:23,23.35,22.0
02-01-2024 11.20,02-01-2024 11.11,2024-01-02 11:22:59,9.16,
23-07-2023 18.25,2023-07-23 18:50,2023-07-23 18:57:30,25.01,20.0
21-06-2023 06.08,21-06-2023 06.22,2023-06-21 06:39:23,13.75,14.0
16-01-2024 17.54,16-01-2024 18.16,2024-01-16 18:32:10,21.58,33.0
06-10-2023 02.52,06-10-2023 03.14,2023-10-06 03:29:53,22.03,40.0
14-08-2023 12.21,14-08-2023 12.48,2023-08-14 12:59:12,26.76,37.0
04-12-2023 07.40,04-12-2023 07.56,2023-12-04 08:09:33,16.1,16.0
2024/03/10 08:09:43,10-03-2024 08.35,2024-03-10 08:37:50,26.12,31.0
01-01-2024 22.18,01-01-2024 22.41,2024-01-01 22:50:05,22.38,23.0
27-06-2023 05.46,27-06-2023 06.09,2023-06-27 06:32:33,23.42,25.0
20-08-2023 05.19,20-08-2023 05.47,2023-08-20 06:01:12,27.85,45.0
18-07-2023 05.03,18-07-2023 05.32,2023-07-18 05:44:00,29.39,50.0
11-05-2023 05.44,2023-05-11 06:15,2023-05-11 06:32:49,31.75,58.0
30-03-2023 18.31,30-03-2023 18.39,2023-03-30 18:43:45.600000000,4.36,30.0
15-05-2023 04.51,15-05-2023 05.19,2023-05-15 05:34:46,27.23,38.0
26-09-2023 08.50,26-09-2023 09.12,2023-09-26 09:21:31,21.43,28.0
10-11-2023 01.55,10-11-2023 02.07,2023-11-10 02:15:14,12.38,27.0
18-10-2023 00.13,18-10-2023 00.39,2023-10-18 00:49:34,26.15,46.0
30-03-2023 0.10,30-03-2023 0.14,2023-03-30 00:22:28.000000000,8.4,28.0
10-04-2023 16.52,2023-04-10 17:19,2023-04-10 17:27:57,27.21,29.0
02-01-2024 12.12,02-01-2024 12.33,2024-01-02 12:49:49,20.64,15.0
06-08-2023 16.25,06-08-2023 16.50,2023-08-06 17:03:53,24.85,48.0
27-05-2023 20.45,27-05-2023 21.08,2023-05-27 21:11:42,23.67,32.0
11-11-2023 08.04,11-11-2023 08.08,2023-11-11 08:10:38,4.11,2.0
30-03-2023 14.12,30-03-2023 14.17,2023-03-30 14:23:08.600000000,5.61,17.0
21-03-2024 10.10,21-03-2024 10.21,2024-03-21 10:33:54,11.39,21.0
30-10-2023 23.59,31-10-2023 00.15,2023-10-31 00:19:28,16.37,0.0
16-10-2023 20.15,16-10-2023 20.31,2023-10-16 20:33:58,16.0,24.0
12-02-2024 09.54,12-02-2024 09.57,2024-02-12 10:09:30,3.71,22.0
05-12-2023 16.58,05-12-2023 17.24,2023-12-05 17:33:03,26.64,30.0
19-08-2023 21.38,19-08-2023 21.56,2023-08-19 22:05:14,18.64,28.0
11-11-2023 23.59,12-11-2023 00.14,2023-11-12 00:24:07,14.95,20.0
15-05-2023 18.26,15-05-2023 18.54,2023-05-15 19:00:03,27.47,32.0
02-01-2024 13.24,02-01-2024 13.47,02-01-2024 13:55:29.147672,22.75,35.0
21-11-2023 07.29,21-11-2023 07.43,2023-11-21 07:48:18,14.66,13.0
12-04-2023 07.17,12-04-2023 07.38,2023-04-12 07:44:27,20.68,29.0
06-04-2023 17.25,2023-04-06 17:40,2023-04-06 17:59:02,15.42,23.0
,25-05-2023 16.15,2023-05-25 16:27:59,25.19,27.0
04-07-2023 02.49,04-07-2023 03.02,2023-07-04 03:18:20,12.99,29.0
01-05-2023 00.56,01-05-2023 01.19,2023-05-01 01:34:30,23.43,53.0
30-03-2023 20.49,30-03-2023 20.57,2023-03-30 21:06:48.199999999,8.87,22.0
01-08-2023 00.15,01-08-2023 00.37,2023-08-01 00:46:54,22.17,29.0
04-02-2024 20.38,04-02-2024 21.07,2024-02-04 21:09:14,28.39,55.0
08-09-2023 19.24,08-09-2023 19.38,2023-09-08 19:42:18,14.0,12.0
28-01-2024 19.52,28-01-2024 20.06,2024-01-28 20:20:38,14.66,30.0
20-12-2023 20.43,20-12-2023 20.54,2023-12-20 21:14:18,10.6,15.0
07-06-2023 02.59,07-06-2023 03.28,2023-06-07 03:39:20,29.27,50.0
26-09-2023 01.23,26-09-2023 01.43,2023-09-26 01:49:28,19.93,31.0
11-08-2023 09.52,11-08-2023 10.08,2023-08-11 10:12:17,15.96,26.0
22-12-2023 22.09,22-12-2023 22.42,2023-12-22 22:56:19,33.76,54.0
30-03-2023 21.09,30-03-2023 21.12,2023-03-30 21:15:07.199999999,11.87,44.0
30-03-2023 15.45,30-03-2023 15.50,2023-03-30 15:48:12.400000000,-2.61,25.0
13-11-2023 12.02,13-11-2023 12.19,2023-11-13 12:24:59,17.32,21.0
02-12-2023 11.32,02-12-2023 11.58,2023-12-02 12:17:43,26.1,42.0
05-09-2023 13.24,05-09-2023 13.40,2023-09-05 13:44:40,15.94,20.0
11-05-2023 02.25,11-05-2023 02.53,11-05-2023 03:10:38.116756,28.28,52.0
,27-01-2024 18.03,27-01-2024 18:06:40.757506,30.93,31.0
28-07-2023 13.45,28-07-2023 14.03,2023-07-28 14:06:04,18.49,20.0
18-07-2023 00.26,18-07-2023 00.50,2023-07-18 01:07:23,24.21,43.0
30-12-2023 23.32,30-12-2023 23.51,2023-12-30 23:59:26,19.16,40.0
13-01-2024 02.17,2024-01-13 02:43,2024-01-13 02:50:48,26.12,23.0
22-07-2023 19.54,22-07-2023 20.13,2023-07-22 20:27:57,19.49,39.0
10-12-2023 00.11,10-12-2023 00.38,2023-12-10 00:47:05,26.3,46.0
23-08-2023 18.06,23-08-2023 18.35,2023-08-23 18:52:43,29.25,33.0
13-04-2023 16.09,13-04-2023 16.28,2023-04-13 16:46:42,18.71,33.0
25-10-2023 20.02,25-10-2023 20.26,2023-10-25 20:34:22,23.79,19.0
30-03-2023 17.34,30-03-2023 17.38,2023-03-30 17:39:58.400000000,1.09,16.0
19-04-2023 17.53,19-04-2023 18.15,2023-04-19 18:27:34,21.92,18.0
09-12-2023 20.18,09-12-2023 20.49,2023-12-09 20:57:40,30.92,51.0
13-05-2023 01.06,13-05-2023 01.21,2023-05-13 01:38:23,14.77,16.0
25-05-2023 04.53,25-05-2023 05.10,2023-05-25 05:16:25,16.93,21.0
2023/10/15 00:09:41,15-10-2023 00.24,2023-10-15 00:35:21,14.36,35.0
,04-09-2023 01.17,2023-09-04 01:22:00,16.99,31.0
20-01-2024 07.07,20-01-2024 07.33,2024-01-20 07:44:23,26.77,40.0
19-04-2023 04.20,19-04-2023 04.37,19-04-2023 04:55:00.735904,17.13,16.0
06-06-2023 13.48,06-06-2023 14.10,2023-06-06 14:16:21,21.57,54.0
13-07-2023 05.02,13-07-2023 05.15,2023-07-13 05:29:25,12.91,24.0
11-03-2024 19.46,11-03-2024 20.06,2024-03-11 20:24:02,20.01,31.0
2023/07/20 21:11:39,20-07-2023 21.24,2023-07-20 21:26:21,12.7,5.0
25-07-2023 17.11,25-07-2023 17.34,2023-07-25 17:46:26,22.51,44.0
19-09-2023 10.58,19-09-2023 11.21,2023-09-19 11:29:12,22.63,48.0
21-09-2023 20.24,21-09-2023 20.50,2023-09-21 20:57:03,25.65,38.0
14-02-2024 14.02,14-02-2024 14.33,2024-02-14 14:55:57,31.37,30.0
12-07-2023 17.20,12-07-2023 17.43,2023-07-12 17:47:57,23.2,45.0
06-06-2023 11.29,06-06-2023 11.54,2023-06-06 12:02:15,25.01,30.0
30-12-2023 08.22,30-12-2023 08.33,2023-12-30 08:44:01,11.77,22.0
29-05-2023 22.50,29-05-2023 23.16,2023-05-29 23:26:58,25.55,36.0
27-02-2024 02.11,27-02-2024 02.28,2024-02-27 02:41:43,17.07,17.0
15-01-2024 02.25,15-01-2024 02.54,2024-01-15 03:04:08,29.6,41.0
17-06-2023 10.35,17-06-2023 10.57,2023-06-17 11:09:59,21.45,55.0
02-06-2023 19.07,02-06-2023 19.34,2023-06-02 19:49:18,26.64,43.0
23-11-2023 13.10,23-11-2023 13.24,2023-11-23 13:26:03,13.52,12.0
2023/10/15 16:01:43,15-10-2023 16.22,2023-10-15 16:33:20,21.06,35.0
01-11-2023 03.39,01-11-2023 04.05,2023-11-01 04:16:13,26.82,33.0
30-03-2023 13.55,30-03-2023 13.57,2023-03-30 14:10:25.000000000,12.65,25.0
14-11-2023 23.04,14-11-2023 23.21,2023-11-14 23:28:58,17.56,31.0
09-10-2023 18.24,2023-10-09 18:44,09-10-2023 18:57:55.472448,19.6,27.0
29-12-2023 01.29,29-12-2023 02.00,2023-12-29 02:05:25,30.47,60.0
16-02-2024 14.24,16-02-2024 14.37,2024-02-16 14:44:29,12.64,14.0
30-03-2023 8.42,30-03-2023 8.49,2023-03-30 09:06:46.399999999,16.99,47.0
17-09-2023 14.57,17-09-2023 15.18,2023-09-17 15:22:13,20.48,31.0
03-04-2023 12.45,03-04-2023 12.54,2023-04-03 13:03:06,8.36,13.0
13-07-2023 19.06,13-07-2023 19.22,2023-07-13 19:38:44,15.97,13.0
20-06-2023 11.18,20-06-2023 11.45,2023-06-20 11:53:45,27.37,55.0
01-06-2023 03.35,01-06-2023 03.46,2023-06-01 03:50:29,11.06,5.0
30-03-2023 04.42,30-03-2023 04.53,2023-03-30 04:55:50,11.19,12.0
03-02-2024 17.51,03-02-2024 18.20,2024-02-03 18:35:31,29.49,36.0
18-12-2023 01.27,2023-12-18 01:45,2023-12-18 01:54:37,17.4,15.0
03-06-2023 10.33,03-06-2023 10.50,2023-06-03 11:03:22,17.58,20.0
30-03-2023 21.09,30-03-2023 21.12,2023-03-30 21:14:43.200000000,1.87,44.0
21-10-2023 14.49,21-10-2023 15.23,2023-10-21 15:32:50,34.06,40.0
30-03-2023 1.58,30-03-2023 2.06,2023-03-30 02:13:08.800000000,6.53,27.0
02-03-2024 16.06,2024-03-02 16:14,2024-03-02 16:28:45,7.63,18.0
29-09-2023 14.24,29-09-2023 14.42,2023-09-29 14:46:30,18.26,20.0
09-05-2023 10.20,09-05-2023 10.49,2023-05-09 10:57:53,28.87,20.0
18-07-2023 19.33,18-07-2023 19.56,2023-07-18 20:07:29,23.46,15.0
02-09-2023 23.11,02-09-2023 23.31,2023-09-02 23:47:10,19.62,42.0
08-02-2024 18.26,08-02-2024 18.48,2024-02-08 19:02:11,21.74,37.0
03-07-2023 03.55,03-07-2023 04.21,2023-07-03 04:23:41,25.79,51.0
2024/01/05 18:59:44,05-01-2024 19.23,2024-01-05 19:37:12,23.58,40.0
05-03-2024 15.54,05-03-2024 16.23,2024-03-05 16:44:38,29.25,15.0
25-03-2024 19.28,25-03-2024 19.58,2024-03-25 20:03:36,30.81,51.0
03-12-2023 16.59,03-12-2023 17.19,2023-12-03 17:26:30,20.43,28.0
14-04-2023 16.28,14-04-2023 16.48,2023-04-14 16:57:54,20.46,27.0
2024/01/06 11:52:34,06-01-2024 12.18,2024-01-06 12:27:01,25.66,30.0
14-11-2023 13.45,14-11-2023 14.06,2023-11-14 14:18:50,21.21,27.0
04-03-2024 13.27,04-03-2024 13.45,2024-03-04 13:53:53,18.79,28.0
15-09-2023 17.41,15-09-2023 18.09,2023-09-15 18:21:16,27.89,24.0
02-04-2023 22.08,02-04-2023 22.27,2023-04-02 22:41:20,18.92,24.0
08-10-2023 14.15,08-10-2023 14.40,2023-10-08 14:49:57,24.96,37.0
04-03-2024 02.41,04-03-2024 03.07,2024-03-04 03:19:30,26.26,36.0
26-11-2023 23.23,26-11-2023 23.48,2023-11-27 00:02:58,25.66,42.0
12-03-2024 19.25,12-03-2024 19.49,2024-03-12 20:00:46,23.87,30.0
15-09-2023 12.19,15-09-2023 12.31,2023-09-15 12:37:18,12.36,25.0
21-12-2023 19.59,21-12-2023 20.24,2023-12-21 20:36:27,25.07,27.0
30-03-2023 8.42,30-03-2023 8.44,2023-03-30 09:03:32.000000000,18.75,47.0
30-10-2023 17.43,30-10-2023 17.58,2023-10-30 18:10:57,14.3,17.0
09-06-2023 08.02,09-06-2023 08.37,2023-06-09 08:46:17,35.1,53.0
12-11-2023 14.25,12-11-2023 14.51,2023-11-12 14:58:39,25.44,37.0
30-03-2023 16.45,30-03-2023 16.50,2023-03-30 16:59:33.200000000,9.42,27.0
30-03-2023 6.51,30-03-2023 6.51,2023-03-30 07:04:35.800000000,12.93,24.0
08-03-2024 13.08,08-03-2024 13.40,2024-03-08 13:46:51,32.14,57.0
28-03-2024 03.43,28-03-2024 03.57,2024-03-28 04:09:26,13.55,21.0
05-06-2023 07.54,05-06-2023 08.14,2023-06-05 08:19:55,19.33,26.0
26-06-2023 04.55,26-06-2023 05.20,2023-06-26 05:28:06,24.61,39.0
21-01-2024 12.12,21-01-2024 12.36,2024-01-21 12:48:59,24.2,29.0
08-02-2024 22.34,08-02-2024 22.53,2024-02-08 23:05:01,,52.0
12-05-2023 12.30,12-05-2023 12.53,2023-05-12 13:05:46,23.19,33.0
2024/02/07 00:14:09,07-02-2024 00.37,2024-02-07 00:51:41,23.5,57.0
03-05-2023 07.47,03-05-2023 08.03,2023-05-03 08:15:50,15.63,5.0
05-03-2024 11.30,05-03-2024 11.52,2024-03-05 12:03:38,21.85,33.0
22-06-2023 21.19,22-06-2023 21.46,2023-06-22 21:52:58,26.27,
06-07-2023 16.21,06-07-2023 16.45,2023-07-06 16:47:23,24.18,21.0
30-12-2023 00.28,30-12-2023 00.49,2023-12-30 01:03:10,20.94,28.0
06-11-2023 09.23,06-11-2023 09.47,2023-11-06 09:57:59,23.76,37.0
31-12-2023 20.47,31-12-2023 21.04,2023-12-31 21:19:18,17.13,22.0
29-06-2023 00.48,29-06-2023 01.10,2023-06-29 01:13:54,22.17,36.0
24-02-2024 02.23,24-02-2024 02.42,2024-02-24 02:47:10,19.1,24.0
23-04-2023 12.27,23-04-2023 12.57,2023-04-23 13:08:46,30.23,58.0
20-02-2024 21.56,2024-02-20 22:16,2024-02-20 22:30:58,20.54,36.0
,21-04-2023 09.39,2023-04-21 09:53:02,28.57,26.0
30-03-2023 1.58,30-03-2023 2.08,2023-03-30 02:22:04.600000000,13.46,27.0
03-05-2023 09.09,03-05-2023 09.29,2023-05-03 09:38:25,20.28,28.0
08-04-2023 22.16,08-04-2023 22.37,08-04-2023 22:39:54.310208,20.16,34.0
13-07-2023 03.34,2023-07-13 03:48,2023-07-13 04:03:00,14.12,16.0
27-12-2023 00.49,27-12-2023 01.04,2023-12-27 01:15:00,15.05,28.0
27-09-2023 06.17,27-09-2023 06.33,2023-09-27 06:45:52,15.34,24.0
04-09-2023 04.31,04-09-2023 05.15,2023-09-04 05:27:45,44.13,73.0
07-10-2023 13.30,07-10-2023 13.58,2023-10-07 14:21:46,27.6,26.0
21-06-2023 08.02,21-06-2023 08.24,2023-06-21 08:38:08,21.28,30.0
21-07-2023 06.56,21-07-2023 07.20,21-07-2023 07:29:04.892003,23.53,
30-03-2023 9.49,30-03-2023 9.52,2023-03-30 10:04:28.000000000,12.4,10.0
15-01-2024 09.43,15-01-2024 10.06,2024-01-15 10:17:25,129.57,28.0
2023/09/23 11:12:33,23-09-2023 11.35,2023-09-23 11:38:09,23.28,29.0
10-03-2024 11.37,10-03-2024 11.50,2024-03-10 11:57:49,13.12,23.0
2024/02/08 09:27:32,08-02-2024 09.50,2024-02-08 10:07:17,23.13,39.0
20-05-2023 00.32,20-05-2023 00.49,2023-05-20 00:59:31,55.4,45.0
01-12-2023 17.08,01-12-2023 17.35,2023-12-01 17:48:47,27.31,45.0
31-01-2024 01.06,31-01-2024 01.39,2024-01-31 01:55:42,32.38,47.0
17-03-2024 04.16,17-03-2024 04.44,2024-03-17 05:01:05,27.28,36.0
30-03-2023 12.33,30-03-2023 12.37,2023-03-30 12:41:50.200000000,4.72,40.0
03-02-2024 03.48,03-02-2024 04.12,2024-02-03 04:25:17,23.98,32.0
27-09-2023 18.37,27-09-2023 18.49,2023-09-27 19:11:33,11.76,0.0
2023/07/04 13:50:14,04-07-2023 14.21,04-07-2023 14:25:12.761459,31.68,47.0
09-10-2023 17.42,09-10-2023 18.03,2023-10-09 18:17:17,21.5,23.0
27-06-2023 23.17,27-06-2023 23.36,2023-06-27 23:49:36,19.0,50.0
17-07-2023 23.43,18-07-2023 00.07,2023-07-18 00:27:05,23.35,16.0
04-05-2023 21.25,04-05-2023 21.44,2023-05-04 21:56:43,19.57,25.0
25-09-2023 10.16,25-09-2023 10.37,2023-09-25 10:46:15,20.84,21.0
18-11-2023 07.40,18-11-2023 08.00,2023-11-18 08:10:42,20.13,27.0
16-06-2023 05.39,16-06-2023 06.02,2023-06-16 06:13:39,22.12,23.0
18-12-2023 11.27,18-12-2023 11.59,18-12-2023 12:12:16.514676,32.66,36.0
28-11-2023 23.22,28-11-2023 23.34,2023-11-28 23:48:00,11.86,14.0
20-07-2023 01.56,20-07-2023 02.21,2023-07-20 02:35:06,25.4,
21-10-2023 09.08,21-10-2023 09.23,2023-10-21 09:36:38,15.65,23.0
24-03-2024 11.57,24-03-2024 12.31,2024-03-24 12:45:01,34.13,38.0
2024/02/22 08:20:33,22-02-2024 08.51,2024-02-22 09:05:23,30.82,36.0
30-03-2023 13.55,30-03-2023 13.55,2023-03-30 13:57:17.800000000,1.53,25.0
21-04-2023 03.17,21-04-2023 03.35,2023-04-21 03:48:09,18.45,35.0
30-03-2023 21.09,30-03-2023 21.18,2023-03-30 21:29:05.400000000,10.24,44.0
10-08-2023 20.20,10-08-2023 20.50,2023-08-10 20:57:29,29.56,35.0
30-03-2023 3.02,30-03-2023 3.11,2023-03-30 03:20:06.000000000,8.85,45.0
05-02-2024 18.15,05-02-2024 18.28,2024-02-05 18:40:10,12.35,0.0
28-01-2024 23.15,28-01-2024 23.33,2024-01-28 23:41:19,17.91,24.0
13-04-2023 18.03,13-04-2023 18.27,2023-04-13 18:49:56,23.66,24.0
2023/10/26 23:35:50,27-10-2023 00.04,2023-10-27 00:21:12,28.19,35.0
13-11-2023 17.31,13-11-2023 17.54,2023-11-13 18:08:00,23.19,40.0
14-06-2023 17.27,2023-06-14 17:53,2023-06-14 18:06:03,25.89,44.0
19-01-2024 18.25,19-01-2024 18.32,2024-01-19 18:45:43,7.91,46.0
03-12-2023 00.27,03-12-2023 00.52,2023-12-03 00:57:28,24.6,33.0
2024/02/05 14:18:54,05-02-2024 14.36,2024-02-05 14:54:47,17.56,46.0
30-04-2023 23.58,01-05-2023 00.32,01-05-2023 00:40:21.185996,,
30-03-2023 20.49,30-03-2023 20.58,2023-03-30 21:08:56.600000000,10.01,22.0
06-07-2023 05.44,06-07-2023 06.07,2023-07-06 06:19:23,22.46,35.0
30-03-2023 14.12,30-03-2023 14.22,2023-03-30 14:39:19.400000000,16.79,17.0
17-08-2023 16.00,17-08-2023 16.17,2023-08-17 16:29:03,17.78,20.0
23-12-2023 20.32,23-12-2023 20.55,2023-12-23 21:07:32,22.38,43.0
12-12-2023 11.54,12-12-2023 12.05,2023-12-12 12:15:39,11.55,25.0
01-03-2024 11.49,01-03-2024 12.09,2024-03-01 12:20:11,19.47,38.0
30-03-2023 20.49,30-03-2023 20.49,2023-03-30 21:10:51.800000000,20.93,22.0
31-05-2023 12.40,31-05-2023 12.58,2023-05-31 13:11:28,17.33,22.0
01-09-2023 10.53,2023-09-01 11:09,2023-09-01 11:21:03,15.46,38.0
02-02-2024 09.43,02-02-2024 10.02,2024-02-02 10:11:24,19.07,31.0
30-03-2023 07.23,30-03-2023 07.44,2023-03-30 08:04:43,20.76,38.0
10-04-2023 17.47,10-04-2023 18.02,2023-04-10 18:14:06,15.23,32.0
01-07-2023 16.38,01-07-2023 16.57,2023-07-01 17:02:47,19.14,
14-10-2023 04.20,14-10-2023 04.53,2023-10-14 05:12:22,33.28,35.0
,24-10-2023 18.53,2023-10-24 19:04:46,25.77,14.0
17-01-2024 17.54,17-01-2024 18.15,2024-01-17 18:32:11,21.48,40.0
22-03-2024 19.08,22-03-2024 19.37,2024-03-22 19:52:13,29.82,50.0
15-03-2024 13.53,15-03-2024 14.20,2024-03-15 14:24:54,26.34,37.0
05-09-2023 20.12,05-09-2023 20.30,2023-09-05 20:40:55,18.15,37.0
25-06-2023 18.42,25-06-2023 19.08,2023-06-25 19:14:13,25.77,34.0
22-04-2023 08.33,22-04-2023 08.58,2023-04-22 09:12:17,24.8,32.0
2023/12/29 07:13:34,29-12-2023 07.22,2023-12-29 07:27:31,9.05,9.0
29-04-2023 06.41,29-04-2023 07.10,2023-04-29 07:14:22,28.83,35.0
30-03-2023 3.02,30-03-2023 3.03,2023-03-30 03:00:29.400000000,-2.76,45.0
30-03-2023 0.10,30-03-2023 0.20,2023-03-30 00:20:24.400000000,0.34,28.0
27-09-2023 09.09,27-09-2023 09.30,2023-09-27 09:36:50,20.88,29.0
26-04-2023 17.28,26-04-2023 17.50,2023-04-26 17:52:19,21.86,33.0
22-10-2023 18.00,22-10-2023 18.30,2023-10-22 18:35:08,29.39,45.0
30-03-2023 6.51,30-03-2023 7.01,2023-03-30 07:16:01.599999999,14.36,24.0
25-04-2023 05.19,25-04-2023 05.41,2023-04-25 05:50:01,22.13,37.0
07-03-2024 07.46,07-03-2024 08.14,2024-03-07 08:28:00,28.13,40.0
2023/12/15 11:11:07,15-12-2023 11.33,2023-12-15 11:53:35,22.02,34.0
,25-06-2023 01.29,2023-06-25 01:34:53,21.61,45.0
30-03-2023 8.42,30-03-2023 8.45,2023-03-30 08:55:02.000000000,9.25,47.0
24-01-2024 10.35,24-01-2024 11.04,2024-01-24 11:09:37,29.31,45.0
02-08-2023 14.50,02-08-2023 15.13,2023-08-02 15:21:03,23.07,43.0
12-06-2023 23.23,12-06-2023 23.51,2023-06-12 23:54:42,28.22,45.0
06-12-2023 09.38,06-12-2023 09.57,2023-12-06 10:06:10,19.5,20.0
31-05-2023 06.33,31-05-2023 07.01,2023-05-31 07:23:36,27.95,42.0
10-01-2024 22.05,10-01-2024 22.26,2024-01-10 22:33:57,20.88,18.0
18-02-2024 23.59,19-02-2024 00.21,2024-02-19 00:24:22,22.39,40.0
21-01-2024 20.49,21-01-2024 21.08,2024-01-21 21:17:55,19.11,49.0
15-01-2024 02.21,15-01-2024 02.44,2024-01-15 02:58:22,22.48,22.0
28-03-2024 22.06,28-03-2024 22.33,2024-03-28 22:42:47,26.47,
12-04-2023 12.01,12-04-2023 12.25,12-04-2023 12:33:44.204019,23.23,32.0
28-07-2023 09.05,28-07-2023 09.31,2023-07-28 09:38:41,25.89,32.0
16-10-2023 10.40,16-10-2023 11.00,2023-10-16 11:14:13,19.72,25.0
22-06-2023 23.57,23-06-2023 00.07,2023-06-23 00:09:43,10.57,31.0
21-08-2023 01.07,21-08-2023 01.34,21-08-2023 01:36:49.475390,27.36,46.0
16-12-2023 13.46,16-12-2023 14.01,2023-12-16 14:17:38,14.14,23.0
11-02-2024 07.48,11-02-2024 07.59,2024-02-11 08:05:37,11.86,28.0
16-11-2023 07.59,16-11-2023 08.25,2023-11-16 08:37:05,26.19,37.0
06-12-2023 21.40,06-12-2023 22.02,06-12-2023 22:08:08.479691,21.68,20.0
27-05-2023 12.43,27-05-2023 12.50,27-05-2023 12:54:41.551544,7.12,26.0
12-02-2024 21.23,12-02-2024 21.37,2024-02-12 21:48:06,13.96,32.0
20-05-2023 00.47,20-05-2023 01.12,2023-05-20 01:25:16,25.41,19.0
18-10-2023 10.19,18-10-2023 10.39,2023-10-18 10:54:14,19.57,
06-02-2024 12.51,06-02-2024 13.18,2024-02-06 13:37:36,26.93,
24-05-2023 14.25,24-05-2023 14.56,2023-05-24 15:11:00,31.37,51.0
14-07-2023 17.02,2023-07-14 17:26,2023-07-14 17:36:20,24.01,41.0
30-03-2023 5.34,30-03-2023 5.38,2023-03-30 05:48:39.599999999,10.36,50.0
01-06-2023 18.01,01-06-2023 18.19,2023-06-01 18:27:55,17.85,24.0
16-11-2023 00.31,16-11-2023 00.53,2023-11-16 00:58:53,22.4,36.0
06-02-2024 17.55,06-02-2024 18.19,2024-02-06 18:21:39,24.32,25.0
08-07-2023 07.38,08-07-2023 08.00,2023-07-08 08:21:14,22.51,40.0
04-11-2023 07.13,04-11-2023 07.33,2023-11-04 07:49:25,20.11,27.0
11-11-2023 23.40,11-11-2023 23.58,2023-11-12 00:09:45,18.21,12.0
18-12-2023 12.04,18-12-2023 12.28,2023-12-18 12:43:36,,
07-05-2023 10.24,07-05-2023 10.36,2023-05-07 10:38:44,12.59,2.0
16-03-2024 00.04,2024-03-16 00:19,2024-03-16 00:28:33,14.92,17.0
11-01-2024 05.20,11-01-2024 05.35,2024-01-11 05:49:41,15.08,17.0
22-03-2024 11.45,22-03-2024 12.16,2024-03-22 12:30:28,31.65,39.0
30-03-2023 12.33,30-03-2023 12.40,2023-03-30 12:46:10.599999999,6.06,40.0
11-06-2023 02.32,11-06-2023 02.54,2023-06-11 03:00:57,22.21,27.0
30-03-2023 3.02,30-03-2023 3.03,2023-03-30 03:13:21.599999999,10.11,45.0
17-10-2023 21.21,17-10-2023 21.51,2023-10-17 22:06:02,30.24,35.0
,15-01-2024 07.54,2024-01-15 07:59:37,24.72,43.0
03-05-2023 00.45,03-05-2023 01.07,2023-05-03 01:11:22,22.14,28.0
30-03-2023 8.42,30-03-2023 8.49,2023-03-30 09:06:03.800000000,16.28,47.0
30-12-2023 00.51,30-12-2023 01.05,2023-12-30 01:16:00,13.56,31.0
03-05-2023 10.35,03-05-2023 10.48,2023-05-03 11:00:23,13.02,14.0
04-02-2024 17.04,04-02-2024 17.20,2024-02-04 17:25:10,16.17,16.0
09-03-2024 02.00,09-03-2024 02.24,2024-03-09 02:34:46,23.33,49.0
29-02-2024 20.27,29-02-2024 20.48,2024-02-29 21:00:00,21.33,17.0
18-10-2023 18.00,18-10-2023 18.22,2023-10-18 18:32:22,22.02,26.0
06-09-2023 00.25,06-09-2023 00.48,2023-09-06 01:09:05,22.59,38.0
30-03-2023 14.12,30-03-2023 14.12,2023-03-30 14:32:00.800000000,19.48,17.0
21-07-2023 06.36,21-07-2023 06.55,2023-07-21 07:05:43,19.47,30.0
27-03-2024 01.45,27-03-2024 02.10,2024-03-27 02:24:52,25.02,17.0
30-03-2023 12.33,30-03-2023 12.35,2023-03-30 12:45:49.600000000,10.71,40.0
28-08-2023 14.01,28-08-2023 14.30,2023-08-28 14:37:13,28.72,49.0
15-08-2023 23.22,15-08-2023 23.50,2023-08-16 00:05:34,27.59,34.0
2023/10/18 14:03:23,2023-10-18 14:35,2023-10-18 14:54:59,,34.0
06-05-2023 12.40,06-05-2023 13.07,2023-05-06 13:15:21,27.02,31.0
30-03-2023 18.31,30-03-2023 18.37,2023-03-30 18:49:27.000000000,12.05,30.0
2023/05/22 19:37:04,22-05-2023 19.53,2023-05-22 20:01:03,16.27,28.0
14-03-2024 06.58,14-03-2024 07.11,2024-03-14 07:24:24,13.23,15.0
27-06-2023 09.05,2023-06-27 09:37,2023-06-27 09:39:19,31.66,56.0
24-01-2024 10.44,24-01-2024 11.03,2024-01-24 11:05:43,19.26,27.0
22-04-2023 17.06,22-04-2023 17.19,2023-04-22 17:21:53,13.87,14.0
20-06-2023 08.21,20-06-2023 08.41,2023-06-20 08:47:29,20.3,34.0
30-03-2023 1.58,30-03-2023 2.04,2023-03-30 02:16:49.000000000,12.2,27.0
10-07-2023 10.19,10-07-2023 10.40,2023-07-10 10:53:52,21.08,28.0
10-05-2023 14.58,10-05-2023 15.21,2023-05-10 15:32:49,23.44,37.0
14-04-2023 01.32,2023-04-14 01:46,2023-04-14 01:55:55,13.89,20.0
27-05-2023 13.10,2023-05-27 13:38,2023-05-27 13:56:06,27.94,25.0
05-12-2023 07.33,05-12-2023 07.16,2023-12-05 07:47:47,16.92,18.0
2023/07/11 09:24:35,11-07-2023 09.42,2023-07-11 09:56:45,18.15,37.0
30-03-2023 6.51,30-03-2023 6.58,2023-03-30 07:25:38.800000000,26.98,24.0
18-09-2023 10.59,18-09-2023 11.21,2023-09-18 11:40:41,21.84,29.0
21-09-2023 12.56,21-09-2023 13.17,2023-09-21 13:27:05,20.55,45.0
04-08-2023 08.11,04-08-2023 08.22,2023-08-04 08:27:47,11.3,18.0
21-02-2024 02.43,21-02-2024 03.08,2024-02-21 03:25:10,25.66,7.0
14-01-2024 04.36,14-01-2024 04.55,2024-01-14 05:04:57,19.11,38.0
12-09-2023 01.18,12-09-2023 01.47,2023-09-12 01:59:46,29.2,39.0
28-07-2023 12.43,28-07-2023 12.45,2023-07-28 12:59:01,1.27,3.0
03-10-2023 17.36,2023-10-03 17:38,2023-10-03 17:52:09,2.64,0.0
09-02-2024 21.56,09-02-2024 22.23,2024-02-09 22:36:07,26.76,41.0
30-03-2023 3.02,30-03-2023 3.10,2023-03-30 03:27:51.599999999,17.61,45.0
30-03-2023 18.31,30-03-2023 18.39,2023-03-30 18:56:14.400000000,16.84,30.0
20-06-2023 04.43,20-06-2023 05.02,2023-06-20 05:04:52,19.49,41.0
04-02-2024 11.27,04-02-2024 12.00,2024-02-04 12:15:09,32.77,52.0
30-10-2023 10.51,30-10-2023 11.06,2023-10-30 11:19:32,15.33,16.0
02-08-2023 19.13,02-08-2023 19.23,2023-08-02 19:36:04,10.25,24.0
30-03-2023 1.58,30-03-2023 2.00,2023-03-30 02:05:36.400000000,,27.0
03-02-2024 08.27,03-02-2024 08.35,2024-02-03 08:54:06,7.79,7.0
12-05-2023 09.49,12-05-2023 10.11,2023-05-12 10:23:54,22.43,47.0
21-08-2023 17.58,21-08-2023 18.15,2023-08-21 18:26:27,17.87,24.0
12-10-2023 22.25,12-10-2023 22.50,2023-10-12 23:12:02,25.36,37.0
30-03-2023 1.58,30-03-2023 1.59,2023-03-30 02:13:24.400000000,13.79,27.0
30-03-2023 16.45,30-03-2023 16.45,2023-03-30 17:03:15.200000000,18.12,27.0
15-05-2023 07.53,15-05-2023 07.58,2023-05-15 08:08:43,4.56,24.0
17-04-2023 13.28,17-04-2023 14.03,2023-04-17 14:12:01,34.98,46.0
30-03-2023 17.34,30-03-2023 17.37,2023-03-30 17:52:49.400000000,14.94,16.0
13-07-2023 14.36,13-07-2023 14.56,13-07-2023 15:06:24.817589,19.53,26.0
25-11-2023 13.02,2023-11-25 13:29,2023-11-25 13:43:46,27.45,40.0
22-10-2023 05.08,22-10-2023 05.19,2023-10-22 05:34:56,11.0,7.0
18-09-2023 05.03,18-09-2023 05.33,2023-09-18 05:40:16,30.16,28.0
2023/07/13 04:47:33,13-07-2023 05.10,2023-07-13 05:23:38,22.84,32.0
18-04-2023 17.40,18-04-2023 18.06,2023-04-18 18:08:27,25.51,39.0
05-03-2024 23.28,05-03-2024 23.51,2024-03-05 23:59:20,,10.0
01-11-2023 16.49,01-11-2023 17.10,2023-11-01 17:14:39,21.34,
28-01-2024 23.24,28-01-2024 23.45,2024-01-28 23:51:02,20.86,43.0
24-08-2023 03.40,24-08-2023 04.08,2023-08-24 04:18:25,28.22,39.0
26-07-2023 05.32,26-07-2023 05.52,2023-07-26 06:05:28,19.68,34.0
30-03-2023 6.51,30-03-2023 6.59,2023-03-30 06:59:13.600000000,-0.44,24.0
06-03-2024 22.34,06-03-2024 22.54,2024-03-06 23:06:47,20.01,20.0
30-03-2023 12.33,30-03-2023 12.38,2023-03-30 12:45:08.800000000,7.03,40.0
23-10-2023 07.16,23-10-2023 07.36,2023-10-23 07:44:23,20.05,25.0
,13-04-2023 03.37,2023-04-13 03:46:53,14.5,41.0
21-04-2023 11.44,2023-04-21 12:07,2023-04-21 12:12:43,23.45,24.0
23-01-2024 22.53,23-01-2024 23.12,2024-01-23 23:14:36,18.45,26.0
24-02-2024 06.47,2024-02-24 07:17,2024-02-24 07:25:51,30.13,39.0
30-03-2023 1.58,30-03-2023 2.01,2023-03-30 02:16:49.600000000,15.21,27.0
23-11-2023 03.28,23-11-2023 04.01,2023-11-23 04:10:51,32.54,
26-07-2023 18.10,26-07-2023 18.25,2023-07-26 18:36:37,60.08,9.0
18-06-2023 00.15,18-06-2023 00.41,2023-06-18 00:50:06,25.17,30.0
10-04-2023 00.48,2023-04-10 01:08,2023-04-10 01:10:14,19.89,16.0
14-01-2024 20.17,14-01-2024 20.50,2024-01-14 21:04:01,33.73,60.0
2023/09/20 22:09:24,20-09-2023 22.28,20-09-2023 22:35:21.810458,19.04,39.0
08-08-2023 06.50,08-08-2023 07.09,2023-08-08 07:13:51,18.9,31.0
21-10-2023 21.38,21-10-2023 21.57,2023-10-21 22:10:42,19.29,6.0
30-03-2023 10.31,30-03-2023 10.37,2023-03-30 10:48:41.000000000,11.3,32.0
30-08-2023 05.42,2023-08-30 06:19,2023-08-30 06:36:09,37.03,44.0
08-01-2024 11.20,08-01-2024 11.44,2024-01-08 11:59:12,23.7,34.0
,14-09-2023 14.35,2023-09-14 14:43:37,22.45,47.0
01-12-2023 06.58,01-12-2023 07.36,2023-12-01 07:47:25,38.21,40.0
24-09-2023 17.56,24-09-2023 18.14,2023-09-24 18:28:52,18.14,36.0
10-04-2023 21.40,10-04-2023 22.14,2023-04-10 22:27:48,33.61,58.0
01-02-2024 22.07,01-02-2024 22.45,2024-02-01 22:50:51,37.22,38.0
30-06-2023 19.30,30-06-2023 19.49,2023-06-30 19:56:09,18.3,19.0
08-11-2023 11.13,08-11-2023 11.25,2023-11-08 11:33:54,12.03,13.0
16-02-2024 14.24,16-02-2024 14.37,2024-02-16 14:53:09,12.57,29.0
,26-07-2023 06.19,2023-07-26 06:28:53,28.84,29.0
21-02-2024 14.36,21-02-2024 15.02,2024-02-21 15:14:58,26.4,71.0
30-03-2023 10.31,30-03-2023 10.32,2023-03-30 10:39:00.200000000,6.62,32.0
2023/09/12 02:59:56,12-09-2023 03.14,2023-09-12 03:25:33,15.02,2.0
30-03-2023 2.36,30-03-2023 2.38,2023-03-30 02:46:10.799999999,8.03,17.0
02-03-2024 08.04,02-03-2024 08.15,2024-03-02 08:24:57,11.16,18.0
06-01-2024 03.05,06-01-2024 03.24,2024-01-06 03:35:04,18.45,42.0
28-05-2023 10.55,28-05-2023 11.17,2023-05-28 11:26:51,22.66,43.0
24-12-2023 21.35,24-12-2023 22.00,2023-12-24 22:17:10,25.37,28.0
17-02-2024 02.56,17-02-2024 03.23,2024-02-17 03:30:06,26.53,26.0
20-08-2023 23.49,21-08-2023 00.14,2023-08-21 00:18:15,24.67,43.0
29-04-2023 19.53,29-04-2023 20.13,2023-04-29 20:23:00,19.82,35.0
25-06-2023 16.32,25-06-2023 16.45,2023-06-25 16:51:39,12.17,20.0
,12-11-2023 10.52,2023-11-12 11:00:24,,40.0
30-05-2023 17.47,30-05-2023 18.15,2023-05-30 18:29:18,28.51,44.0
30-03-2023 11.32,30-03-2023 11.32,2023-03-30 11:36:39.200000000,4.17,2.0
12-04-2023 15.00,12-04-2023 15.32,2023-04-12 15:44:43,32.67,220.0
21-12-2023 09.02,21-12-2023 09.15,2023-12-21 09:34:45,12.86,27.0
04-10-2023 09.05,04-10-2023 09.25,2023-10-04 09:36:59,20.18,26.0
16-01-2024 18.12,16-01-2024 18.41,2024-01-16 18:57:04,28.73,42.0
05-02-2024 03.24,05-02-2024 03.57,05-02-2024 04:24:27.452638,33.62,31.0
17-12-2023 13.20,17-12-2023 13.45,2023-12-17 13:59:27,25.18,28.0
04-09-2023 19.37,04-09-2023 19.57,2023-09-04 20:03:32,20.64,20.0
23-01-2024 21.44,23-01-2024 21.54,2024-01-23 21:56:09,,33.0
01-12-2023 18.05,01-12-2023 18.35,2023-12-01 18:45:42,29.52,30.0
29-11-2023 04.08,29-11-2023 04.19,2023-11-29 04:28:55,10.8,24.0
24-11-2023 14.39,24-11-2023 14.52,2023-11-24 14:58:59,13.0,29.0
20-05-2023 04.08,20-05-2023 04.23,2023-05-20 04:26:52,88.22,28.0
31-01-2024 08.01,31-01-2024 08.23,2024-01-31 08:39:18,21.5,37.0
2023/06/28 18:41:39,28-06-2023 19.10,2023-06-28 19:19:39,28.99,47.0
10-02-2024 05.04,10-02-2024 05.27,2024-02-10 05:39:44,22.38,29.0
2023-06-10 22:35,10-06-2023 22.22,2023-06-10 22:54:03,13.58,6.0
15-06-2023 15.11,15-06-2023 15.34,2023-06-15 15:41:46,22.24,23.0
2023/10/13 20:46:44,13-10-2023 21.03,2023-10-13 21:05:43,16.99,20.0
13-02-2024 06.51,13-02-2024 07.19,2024-02-13 07:31:18,27.32,50.0
12-01-2024 14.28,12-01-2024 14.44,2024-01-12 14:47:22,16.55,38.0
30-03-2023 20.49,30-03-2023 20.57,2023-03-30 21:07:11.600000000,9.26,22.0
22-03-2024 12.30,22-03-2024 12.54,2024-03-22 13:04:57,23.55,30.0
04-11-2023 21.20,04-11-2023 21.40,2023-11-04 21:45:57,20.35,26.0
20-07-2023 13.09,20-07-2023 13.38,2023-07-20 13:40:27,28.53,44.0
02-03-2024 01.31,2024-03-02 02:08,2024-03-02 02:26:43,36.77,48.0
24-03-2024 03.00,2024-03-24 03:20,24-03-2024 03:25:24.003566,19.93,24.0
08-07-2023 08.54,08-07-2023 09.11,2023-07-08 09:17:17,16.55,30.0
09-03-2024 07.20,09-03-2024 07.45,09-03-2024 07:54:48.264700,24.61,33.0
14-06-2023 23.57,15-06-2023 00.12,2023-06-15 00:33:05,14.94,13.0
04-12-2023 03.23,2023-12-04 03:35,2023-12-04 03:37:55,12.5,22.0
03-12-2023 16.36,03-12-2023 17.04,2023-12-03 17:19:10,27.32,47.0
13-10-2023 23.16,13-10-2023 23.36,2023-10-13 23:53:18,20.07,28.0
16-12-2023 16.07,16-12-2023 16.29,2023-12-16 16:48:03,21.7,32.0
31-08-2023 05.13,31-08-2023 05.22,2023-08-31 05:32:44,9.42,11.0
,2023-11-02 02:46,2023-11-02 02:51:30,29.18,40.0
13-09-2023 09.09,13-09-2023 09.34,2023-09-13 09:46:20,25.16,35.0
01-06-2023 22.44,01-06-2023 23.09,01-06-2023 23:24:03.725255,24.89,
02-02-2024 15.58,02-02-2024 16.14,2024-02-02 16:28:31,15.64,27.0
19-11-2023 04.14,2023-11-19 04:34,2023-11-19 04:41:34,20.3,35.0
10-09-2023 04.56,10-09-2023 05.20,2023-09-10 05:30:08,24.25,31.0
03-02-2024 23.06,03-02-2024 23.27,2024-02-03 23:35:31,21.83,22.0
,30-03-2023 9.49,2023-03-30 09:57:23.800000000,8.33,10.0
30-03-2023 10.31,30-03-2023 10.41,2023-03-30 10:47:42.800000000,6.33,32.0
15-04-2023 07.17,15-04-2023 07.55,2023-04-15 08:02:43,37.54,51.0
30-03-2023 2.36,30-03-2023 2.38,2023-03-30 02:44:37.200000000,6.47,17.0
09-03-2024 20.34,09-03-2024 20.51,2024-03-09 21:00:13,17.19,27.0
01-03-2024 04.30,01-03-2024 04.50,2024-03-01 04:52:34,20.07,18.0
28-06-2023 01.28,28-06-2023 01.45,2023-06-28 01:53:18,,37.0
2024/01/10 10:19:53,10-01-2024 10.33,2024-01-10 10:49:35,13.9,5.0
28-10-2023 14.22,28-10-2023 14.38,2023-10-28 14:51:24,15.12,22.0
2023/12/28 15:35:20,28-12-2023 16.05,2023-12-28 16:13:53,29.84,38.0
13-04-2023 05.37,13-04-2023 05.56,13-04-2023 05:59:23.517323,19.12,10.0
10-06-2023 20.09,10-06-2023 20.34,2023-06-10 20:49:35,25.31,42.0
13-04-2023 16.47,13-04-2023 17.08,2023-04-13 17:17:59,,28.0
30-03-2023 3.02,30-03-2023 3.02,2023-03-30 03:14:32.400000000,12.29,45.0
02-06-2023 01.12,02-06-2023 01.31,2023-06-02 01:43:49,18.97,12.0
30-06-2023 10.41,30-06-2023 11.04,2023-06-30 11:11:49,23.89,29.0
30-03-2023 21.09,30-03-2023 21.09,2023-03-30 21:17:24.599999999,7.56,44.0
31-01-2024 19.40,31-01-2024 20.06,2024-01-31 20:08:42,26.2,54.0
11-03-2024 19.49,11-03-2024 20.08,2024-03-11 20:19:12,18.77,29.0
10-09-2023 17.32,10-09-2023 18.08,2023-09-10 18:19:12,35.92,38.0
14-09-2023 22.17,14-09-2023 22.25,2023-09-14 22:29:42,8.31,24.0
08-04-2023 16.07,08-04-2023 16.32,2023-04-08 16:49:24,25.28,44.0
31-10-2023 09.13,31-10-2023 09.30,2023-10-31 09:44:26,16.58,12.0
16-09-2023 17.07,16-09-2023 16.48,16-09-2023 17:21:20.357574,19.44,40.0
20-08-2023 16.22,20-08-2023 16.48,2023-08-20 17:01:08,26.74,41.0
30-03-2023 14.12,30-03-2023 14.13,2023-03-30 14:27:32.600000000,14.01,17.0
07-01-2024 11.57,07-01-2024 12.12,2024-01-07 12:21:53,14.88,26.0
30-03-2023 12.33,30-03-2023 12.41,2023-03-30 12:57:34.000000000,16.45,40.0
08-06-2023 11.12,08-06-2023 11.31,2023-06-08 11:43:10,18.75,125.0
05-12-2023 04.30,2023-12-05 04:42,2023-12-05 04:47:47,12.18,11.0
01-03-2024 05.32,01-03-2024 06.04,2024-03-01 06:21:54,31.95,31.0
02-09-2023 03.48,2023-09-02 04:10,2023-09-02 04:14:13,21.77,45.0
18-03-2024 17.21,18-03-2024 17.51,2024-03-18 18:03:02,29.79,43.0
22-11-2023 20.47,22-11-2023 21.19,2023-11-22 21:32:54,32.51,37.0
25-06-2023 03.55,25-06-2023 04.29,2023-06-25 04:38:32,34.04,50.0
02-05-2023 20.42,02-05-2023 20.58,2023-05-02 21:08:27,16.2,17.0
24-12-2023 14.07,24-12-2023 14.33,2023-12-24 14:35:42,25.85,29.0
13-08-2023 07.00,13-08-2023 07.14,2023-08-13 07:27:11,14.01,27.0
06-01-2024 02.43,06-01-2024 03.04,2024-01-06 03:13:14,20.37,29.0
22-09-2023 11.43,22-09-2023 12.02,2023-09-22 12:18:45,18.77,21.0
22-08-2023 11.05,22-08-2023 11.10,2023-08-22 11:28:52,4.95,14.0
06-02-2024 21.30,06-02-2024 21.46,2024-02-06 22:08:04,15.66,13.0
25-06-2023 21.09,25-06-2023 21.40,2023-06-25 21:48:05,30.46,52.0
24-05-2023 02.51,24-05-2023 03.12,2023-05-24 03:17:41,20.18,24.0
30-03-2023 3.02,30-03-2023 3.02,2023-03-30 03:05:32.400000000,3.29,45.0
10-02-2024 19.47,10-02-2024 19.54,2024-02-10 20:12:22,7.37,0.0
21-01-2024 08.23,21-01-2024 08.45,2024-01-21 08:57:22,21.77,23.0
30-03-2023 2.36,30-03-2023 2.41,2023-03-30 02:44:05.400000000,2.94,17.0
30-03-2023 3.02,30-03-2023 3.08,2023-03-30 03:24:37.800000000,16.38,45.0
01-10-2023 03.32,01-10-2023 03.49,2023-10-01 03:56:48,17.26,29.0
30-03-2023 14.12,30-03-2023 14.18,2023-03-30 14:24:06.200000000,5.57,17.0
21-10-2023 11.44,21-10-2023 12.01,21-10-2023 12:07:05.507974,16.27,19.0
01-03-2024 13.29,01-03-2024 13.48,2024-03-01 13:55:09,19.55,17.0
2023/07/25 15:51:15,25-07-2023 16.07,2023-07-25 16:20:00,15.88,27.0
31-03-2023 17.42,31-03-2023 18.11,2023-03-31 18:22:49,29.11,43.0
10-07-2023 01.46,10-07-2023 01.59,2023-07-10 02:02:16,12.23,12.0
,30-06-2023 03.55,2023-06-30 04:04:15,24.83,43.0
2023/12/31 01:18:14,31-12-2023 01.39,2023-12-31 01:56:54,20.89,27.0
23-12-2023 18.37,23-12-2023 19.01,2023-12-23 19:20:05,24.02,39.0
21-06-2023 02.28,21-06-2023 02.39,2023-06-21 02:48:26,11.3,33.0
11-07-2023 09.55,11-07-2023 10.24,2023-07-11 10:38:40,28.95,26.0
2023/07/25 04:52:36,25-07-2023 05.16,2023-07-25 05:24:08,24.31,26.0
10-02-2024 08.36,10-02-2024 09.10,2024-02-10 09:15:59,33.49,46.0
09-11-2023 21.46,2023-11-09 22:19,2023-11-09 22:37:34,32.72,36.0
30-03-2023 5.34,30-03-2023 5.41,2023-03-30 05:52:10.800000000,10.88,50.0
01-01-2024 22.58,01-01-2024 23.22,2024-01-01 23:27:52,23.76,45.0
28-12-2023 05.09,28-12-2023 05.29,2023-12-28 05:37:46,20.75,18.0
10-02-2024 07.46,10-02-2024 08.05,2024-02-10 08:12:25,106.86,190.0
14-05-2023 05.15,14-05-2023 05.38,2023-05-14 05:40:44,22.58,28.0
14-04-2023 16.37,14-04-2023 16.59,2023-04-14 17:15:53,22.01,39.0
29-02-2024 21.09,29-02-2024 21.36,2024-02-29 21:58:26,27.11,29.0
30-03-2023 18.31,30-03-2023 18.36,2023-03-30 18:41:33.000000000,5.15,30.0
05-04-2023 17.40,05-04-2023 17.54,2023-04-05 18:04:43,13.7,34.0
14-12-2023 03.07,14-12-2023 03.27,2023-12-14 03:53:40,20.56,12.0
2023/10/06 12:42:44,06-10-2023 13.18,2023-10-06 13:27:00,35.47,36.0
23-01-2024 00.21,23-01-2024 00.40,2024-01-23 00:55:56,18.68,26.0
25-07-2023 08.47,25-07-2023 09.08,2023-07-25 09:15:37,20.75,25.0
30-03-2023 12.33,30-03-2023 12.40,2023-03-30 12:59:59.200000000,19.87,40.0
19-06-2023 14.49,19-06-2023 15.13,2023-06-19 15:35:40,24.28,
29-12-2023 09.45,29-12-2023 10.07,2023-12-29 10:18:36,21.72,38.0
03-06-2023 12.31,03-06-2023 12.55,2023-06-03 13:05:43,24.24,0.0
21-11-2023 20.38,21-11-2023 21.11,2023-11-21 21:25:00,33.16,47.0
06-11-2023 09.41,06-11-2023 10.05,2023-11-06 10:27:57,23.98,46.0
21-03-2024 18.45,21-03-2024 19.11,2024-03-21 19:20:15,25.53,38.0
2023/04/14 18:22:53,14-04-2023 18.56,2023-04-14 19:13:45,33.34,26.0
17-03-2024 14.26,17-03-2024 14.57,2024-03-17 14:59:03,30.84,50.0
05-04-2023 22.54,05-04-2023 23.13,2023-04-05 23:29:55,18.82,22.0
04-03-2024 05.27,04-03-2024 05.46,2024-03-04 05:49:14,19.63,27.0
22-04-2023 01.04,22-04-2023 01.26,2023-04-22 01:34:12,21.98,31.0
30-03-2023 0.10,30-03-2023 0.20,2023-03-30 00:31:56.199999999,11.87,28.0
09-08-2023 22.29,09-08-2023 22.54,2023-08-09 23:13:14,25.37,39.0
30-03-2023 18.31,30-03-2023 18.32,2023-03-30 18:46:47.400000000,14.39,30.0
09-02-2024 14.47,09-02-2024 15.03,2024-02-09 15:12:23,15.76,42.0
21-01-2024 19.27,2024-01-21 19:53,2024-01-21 20:09:01,25.96,42.0
14-01-2024 13.39,14-01-2024 14.02,14-01-2024 14:08:48.262174,23.35,25.0
17-02-2024 22.49,17-02-2024 23.09,2024-02-17 23:19:18,19.73,45.0
16-07-2023 01.24,16-07-2023 01.46,2023-07-16 01:57:02,21.31,33.0
20-01-2024 13.48,2024-01-20 14:18,2024-01-20 14:24:08,29.63,27.0
04-07-2023 14.02,04-07-2023 14.12,2023-07-04 14:35:38,9.64,221.0
30-08-2023 08.05,30-08-2023 08.18,2023-08-30 08:22:34,12.16,32.0
09-12-2023 20.18,09-12-2023 20.43,2023-12-09 21:01:34,24.68,28.0
14-12-2023 03.46,14-12-2023 04.03,2023-12-14 04:16:15,17.43,8.0
10-12-2023 11.29,10-12-2023 11.43,2023-12-10 11:53:31,14.77,5.0
28-01-2024 11.03,28-01-2024 11.31,2024-01-28 11:42:30,27.45,31.0
30-03-2023 7.14,30-03-2023 7.14,2023-03-30 07:22:55.400000000,8.59,3.0
2023/09/09 07:19:37,2023-09-09 07:39,2023-09-09 07:41:20,19.71,37.0
16-09-2023 06.47,16-09-2023 07.12,2023-09-16 07:18:23,25.06,35.0
30-04-2023 05.39,30-04-2023 06.03,2023-04-30 06:13:06,24.05,34.0
01-01-2024 03.59,01-01-2024 04.22,2024-01-01 04:32:00,22.59,42.0
31-07-2023 11.43,31-07-2023 11.57,2023-07-31 12:05:32,,29.0
19-09-2023 05.03,19-09-2023 05.22,2023-09-19 05:30:10,19.59,34.0
2023/07/31 13:02:43,31-07-2023 13.32,2023-07-31 13:43:58,30.2,49.0
,06-04-2023 17.55,2023-04-06 18:06:14,25.94,
19-01-2024 18.19,2024-01-19 18:46,2024-01-19 19:04:31,27.54,24.0
30-03-2023 8.42,30-03-2023 8.46,2023-03-30 08:47:54.800000000,1.13,47.0
28-06-2023 12.10,28-06-2023 12.28,28-06-2023 12:32:09.320057,17.4,23.0
21-06-2023 07.39,21-06-2023 07.56,2023-06-21 08:14:22,16.61,31.0
24-01-2024 07.33,24-01-2024 07.51,2024-01-24 08:01:15,17.92,17.0
27-08-2023 23.01,27-08-2023 23.28,2023-08-27 23:40:37,27.34,41.0
18-08-2023 00.31,18-08-2023 00.47,2023-08-18 01:02:27,16.46,24.0
30-03-2023 16.45,30-03-2023 16.45,2023-03-30 16:54:51.200000000,9.72,27.0
27-03-2024 09.13,27-03-2024 09.44,2024-03-27 10:00:04,30.47,56.0
20-05-2023 16.32,20-05-2023 16.58,2023-05-20 17:17:12,25.62,21.0
30-03-2023 10.31,30-03-2023 10.33,2023-03-30 10:44:06.200000000,10.72,32.0
30-03-2023 12.33,30-03-2023 12.37,2023-03-30 12:37:46.600000000,0.66,40.0
2023/09/14 07:23:51,14-09-2023 07.52,2023-09-14 08:05:48,29.08,26.0
10-11-2023 11.59,10-11-2023 12.14,2023-11-10 12:21:26,14.76,23.0
25-01-2024 20.45,25-01-2024 21.02,2024-01-25 21:05:29,16.87,33.0
20-06-2023 09.59,20-06-2023 10.05,2023-06-20 10:11:53,6.84,24.0
02-11-2023 06.01,02-11-2023 06.28,2023-11-02 06:40:39,26.88,47.0
02-12-2023 04.13,02-12-2023 04.25,2023-12-02 04:35:05,11.66,4.0
20-05-2023 04.44,20-05-2023 05.03,2023-05-20 05:16:27,18.31,43.0
04-05-2023 17.37,04-05-2023 18.07,2023-05-04 18:17:46,30.23,
2023/03/30 09:31:03,30-03-2023 10.00,2023-03-30 10:02:24,29.24,47.0
2024/03/18 07:35:15,18-03-2024 07.54,2024-03-18 07:56:33,19.3,28.0
02-09-2023 10.38,02-09-2023 11.00,2023-09-02 11:05:51,22.44,40.0
30-03-2023 18.31,30-03-2023 18.31,2023-03-30 18:46:37.800000000,15.23,30.0
31-03-2023 16.37,31-03-2023 17.02,2023-03-31 17:09:26,25.06,52.0
09-09-2023 14.45,2023-09-09 15:04,2023-09-09 15:06:13,18.95,21.0
13-09-2023 09.02,13-09-2023 09.27,2023-09-13 09:32:49,24.76,38.0
18-10-2023 01.11,18-10-2023 01.38,2023-10-18 01:54:40,27.8,52.0
18-07-2023 01.24,2023-07-18 01:57,2023-07-18 02:15:57,32.98,41.0
19-08-2023 16.58,19-08-2023 17.08,2023-08-19 17:15:11,9.87,2.0
24-10-2023 14.38,24-10-2023 14.52,2023-10-24 14:57:07,14.08,26.0
2023/09/12 05:03:04,12-09-2023 05.25,2023-09-12 05:36:43,,26.0
25-02-2024 06.37,25-02-2024 06.59,25-02-2024 07:15:11.323403,21.24,48.0
30-03-2023 16.45,30-03-2023 16.45,2023-03-30 16:59:50.600000000,14.71,27.0
12-04-2023 05.28,12-04-2023 05.44,2023-04-12 05:57:51,16.3,8.0
11-10-2023 19.48,11-10-2023 20.12,2023-10-11 20:14:41,24.63,31.0
19-04-2023 18.43,2023-04-19 18:55,2023-04-19 19:06:45,12.39,12.0
21-08-2023 12.21,21-08-2023 12.50,21-08-2023 13:04:58.089481,29.23,38.0
13-01-2024 16.24,13-01-2024 16.37,2024-01-13 16:50:08,12.6,20.0
15-05-2023 16.24,15-05-2023 16.54,2023-05-15 17:08:13,29.82,54.0
20-12-2023 16.24,20-12-2023 16.51,20-12-2023 17:01:59.376098,27.63,43.0
30-03-2023 17.34,30-03-2023 17.36,2023-03-30 17:48:13.400000000,11.34,16.0
,2023-07-03 21:57,2023-07-03 22:04:30,16.89,17.0
12-09-2023 01.02,12-09-2023 01.36,2023-09-12 01:42:41,33.83,46.0
29-02-2024 11.59,29-02-2024 12.23,2024-02-29 12:30:25,24.64,35.0
28-12-2023 18.01,28-12-2023 18.31,2023-12-28 18:45:21,29.69,39.0
26-03-2024 21.57,26-03-2024 22.27,2024-03-26 22:38:18,30.09,35.0
17-06-2023 12.25,17-06-2023 12.41,2023-06-17 12:50:29,16.48,31.0
02-06-2023 22.40,02-06-2023 22.58,2023-06-02 23:10:01,17.38,15.0
30-03-2023 3.02,30-03-2023 3.05,2023-03-30 03:10:53.400000000,5.64,45.0
27-06-2023 15.19,27-06-2023 15.28,2023-06-27 15:45:40,9.39,21.0
12-02-2024 03.09,12-02-2024 03.33,2024-02-12 03:46:27,23.95,24.0
22-11-2023 13.16,2023-11-22 13:32,2023-11-22 13:46:03,15.78,
08-09-2023 22.32,08-09-2023 22.59,2023-09-08 23:12:33,27.44,45.0
19-06-2023 22.02,19-06-2023 22.34,2023-06-19 22:44:14,31.77,46.0
12-02-2024 23.52,13-02-2024 00.16,2024-02-13 00:20:04,24.54,35.0
07-07-2023 23.35,08-07-2023 00.07,2023-07-08 00:16:56,32.52,51.0
11-09-2023 13.49,11-09-2023 14.10,2023-09-11 14:18:39,21.06,23.0
30-04-2023 08.31,30-04-2023 08.37,2023-04-30 08:49:26,6.12,10.0
09-05-2023 09.49,09-05-2023 10.08,2023-05-09 10:25:26,19.24,34.0
06-05-2023 17.16,06-05-2023 17.40,2023-05-06 17:56:29,24.1,36.0
03-03-2024 07.27,03-03-2024 07.50,03-03-2024 08:00:37.201624,22.93,22.0
16-09-2023 13.28,16-09-2023 13.48,2023-09-16 14:04:32,19.88,37.0
09-07-2023 12.05,09-07-2023 12.15,2023-07-09 12:19:27,40.7,15.0
05-10-2023 21.46,05-10-2023 21.58,2023-10-05 22:09:33,11.48,14.0
28-10-2023 19.03,28-10-2023 19.26,2023-10-28 19:42:51,22.84,34.0
23-04-2023 07.13,23-04-2023 07.34,2023-04-23 07:39:57,20.96,48.0
12-06-2023 14.41,12-06-2023 15.04,2023-06-12 15:17:54,22.88,36.0
01-06-2023 19.28,01-06-2023 19.45,2023-06-01 20:02:01,17.14,30.0
22-01-2024 01.18,22-01-2024 01.43,2024-01-22 01:55:36,24.65,42.0
28-12-2023 13.55,28-12-2023 14.15,2023-12-28 14:24:24,20.91,44.0
30-03-2023 15.45,30-03-2023 15.45,2023-03-30 15:59:17.800000000,13.48,25.0
14-06-2023 01.34,2023-06-14 01:56,2023-06-14 02:09:10,22.61,42.0
29-07-2023 02.17,29-07-2023 02.26,2023-07-29 02:30:03,9.17,23.0
29-08-2023 19.35,29-08-2023 20.03,2023-08-29 20:21:17,27.85,33.0
17-04-2023 10.51,17-04-2023 11.21,2023-04-17 11:35:24,30.11,50.0
14-03-2024 20.48,14-03-2024 21.20,2024-03-14 21:37:08,31.61,41.0
06-02-2024 00.29,06-02-2024 00.52,2024-02-06 01:03:12,22.21,22.0
12-01-2024 04.41,12-01-2024 04.53,2024-01-12 05:02:20,,22.0
24-09-2023 14.07,24-09-2023 14.29,2023-09-24 14:39:31,22.16,29.0
30-03-2023 22.00,30-03-2023 22.04,2023-03-30 22:16:50.800000000,12.68,12.0
11-11-2023 10.30,11-11-2023 10.59,2023-11-11 11:12:49,29.98,50.0
24-06-2023 18.03,24-06-2023 18.21,2023-06-24 18:39:29,18.31,16.0
19-08-2023 10.49,19-08-2023 11.09,2023-08-19 11:16:33,19.16,25.0
09-07-2023 07.09,09-07-2023 07.34,2023-07-09 07:36:54,24.94,35.0
29-10-2023 10.36,29-10-2023 11.01,2023-10-29 11:14:21,25.61,28.0
18-04-2023 11.17,18-04-2023 11.42,2023-04-18 11:54:15,25.14,51.0
04-10-2023 07.26,04-10-2023 07.54,2023-10-04 08:02:23,28.17,28.0
2023/12/27 14:02:37,27-12-2023 14.24,2023-12-27 14:31:42,21.6,32.0
27-03-2024 22.29,27-03-2024 22.50,2024-03-27 23:04:41,21.02,22.0
24-07-2023 11.46,24-07-2023 12.08,2023-07-24 12:17:41,22.28,28.0
2023/08/17 13:33:02,17-08-2023 14.00,2023-08-17 14:08:03,27.65,25.0
13-05-2023 19.31,13-05-2023 19.48,13-05-2023 20:00:33.443149,17.34,30.0
22-04-2023 05.51,22-04-2023 06.05,2023-04-22 06:11:42,13.49,29.0
2024/01/08 10:34:16,2024-01-08 10:55,2024-01-08 11:06:40,20.81,
21-01-2024 10.28,2024-01-21 10:43,2024-01-21 10:45:44,14.94,27.0
2024/03/09 04:26:35,09-03-2024 04.50,2024-03-09 05:00:41,24.34,28.0
11-03-2024 19.33,11-03-2024 20.00,2024-03-11 20:14:48,26.91,28.0
15-05-2023 19.02,15-05-2023 19.23,2023-05-15 19:34:31,20.87,20.0
09-06-2023 05.27,09-06-2023 05.55,2023-06-09 05:57:15,27.95,62.0
19-10-2023 06.54,19-10-2023 07.23,2023-10-19 07:36:36,28.98,27.0
30-05-2023 02.17,30-05-2023 02.38,2023-05-30 02:49:04,21.44,50.0
19-10-2023 00.23,19-10-2023 00.41,2023-10-19 00:55:24,17.74,14.0
17-09-2023 07.28,17-09-2023 07.55,2023-09-17 08:13:22,27.0,127.0
2023/04/22 10:38:10,22-04-2023 11.00,22-04-2023 11:05:56.785110,22.27,29.0
30-03-2023 13.55,30-03-2023 14.05,2023-03-30 14:11:39.400000000,5.89,25.0
19-08-2023 00.39,19-08-2023 00.58,2023-08-19 01:00:44,19.51,32.0
28-10-2023 16.27,28-10-2023 17.00,2023-10-28 17:16:28,32.19,46.0
19-08-2023 02.43,19-08-2023 03.03,2023-08-19 03:16:36,19.53,29.0
26-01-2024 02.12,26-01-2024 02.34,2024-01-26 02:47:09,21.66,53.0
2023/08/28 03:02:53,28-08-2023 03.28,2023-08-28 03:30:25,25.15,40.0
25-03-2024 00.36,25-03-2024 00.54,2024-03-25 01:18:44,18.27,23.0
02-02-2024 19.24,02-02-2024 19.54,2024-02-02 20:07:34,29.77,38.0
30-09-2023 10.23,30-09-2023 10.36,2023-09-30 10:40:08,12.57,21.0
28-07-2023 02.51,28-07-2023 03.06,2023-07-28 03:10:44,14.84,28.0
30-03-2023 6.51,30-03-2023 6.57,2023-03-30 07:15:21.400000000,17.69,24.0
06-07-2023 00.20,06-07-2023 00.54,2023-07-06 01:11:46,33.27,55.0
02-05-2023 01.38,02-05-2023 02.07,2023-05-02 02:17:43,28.92,51.0
2023/05/25 08:54:46,25-05-2023 09.22,2023-05-25 09:32:27,27.89,55.0
31-10-2023 02.42,31-10-2023 03.08,2023-10-31 03:10:56,26.3,35.0
27-01-2024 18.45,27-01-2024 19.00,2024-01-27 19:14:19,15.21,19.0
26-02-2024 02.23,26-02-2024 02.43,2024-02-26 02:51:25,20.29,10.0
30-03-2023 0.10,30-03-2023 0.17,2023-03-30 00:24:37.599999999,7.56,28.0
12-05-2023 01.53,12-05-2023 02.04,2023-05-12 02:08:08,10.63,8.0
,30-09-2023 01.37,2023-09-30 01:51:22,30.24,41.0
03-11-2023 20.49,03-11-2023 21.28,2023-11-03 21:44:30,38.41,35.0
30-03-2023 6.51,30-03-2023 6.59,2023-03-30 07:09:05.800000000,9.43,24.0
21-11-2023 13.28,21-11-2023 13.43,2023-11-21 13:52:56,15.08,28.0
30-03-2023 13.55,30-03-2023 13.57,2023-03-30 14:12:24.400000000,14.64,25.0
30-03-2023 13.55,30-03-2023 14.04,2023-03-30 14:12:14.800000000,7.48,25.0
07-03-2024 23.37,08-03-2024 00.11,2024-03-08 00:37:05,33.43,51.0
15-10-2023 07.36,15-10-2023 07.52,2023-10-15 08:02:15,16.41,35.0
05-01-2024 19.48,2024-01-05 20:11,2024-01-05 20:13:03,22.73,30.0
,30-03-2023 20.00,2023-03-30 20:14:59.800000000,14.83,12.0
19-01-2024 00.26,2024-01-19 00:53,2024-01-19 01:03:13,26.37,51.0
14-08-2023 10.02,14-08-2023 10.22,2023-08-14 10:37:47,20.61,28.0
21-05-2023 05.02,21-05-2023 05.27,2023-05-21 05:36:31,25.42,26.0
2023/11/11 23:03:53,11-11-2023 23.23,2023-11-11 23:27:16,19.54,42.0
19-06-2023 17.55,19-06-2023 18.11,2023-06-19 18:16:08,15.41,35.0
06-05-2023 03.48,06-05-2023 04.11,2023-05-06 04:25:10,22.75,40.0
12-01-2024 07.44,12-01-2024 08.08,2024-01-12 08:17:22,24.22,34.0
29-08-2023 01.40,29-08-2023 01.58,2023-08-29 02:08:12,18.59,11.0
04-03-2024 12.39,04-03-2024 13.00,2024-03-04 13:02:54,21.08,29.0
18-12-2023 17.04,18-12-2023 17.28,18-12-2023 17:32:43.825790,24.42,50.0
29-06-2023 02.12,29-06-2023 02.38,29-06-2023 02:53:23.803095,25.49,25.0
28-03-2024 13.54,28-03-2024 14.03,2024-03-28 14:17:43,8.91,20.0
24-02-2024 02.14,2024-02-24 02:32,2024-02-24 02:41:31,17.78,24.0
25-11-2023 21.38,2023-11-25 21:57,25-11-2023 22:09:47.197781,19.13,34.0
23-01-2024 05.42,23-01-2024 06.06,2024-01-23 06:12:45,23.81,31.0
2023/11/26 19:55:33,26-11-2023 20.14,2023-11-26 20:28:32,18.56,38.0
16-05-2023 05.23,16-05-2023 05.40,2023-05-16 05:42:06,17.01,6.0
2023/09/20 08:22:11,20-09-2023 08.39,20-09-2023 08:55:16.567183,17.37,47.0
14-12-2023 00.26,2023-12-14 00:45,2023-12-14 00:59:09,19.68,32.0
29-02-2024 01.11,29-02-2024 01.25,2024-02-29 01:27:14,13.14,12.0
01-11-2023 15.21,01-11-2023 15.49,2023-11-01 15:58:39,27.66,48.0
23-11-2023 07.45,23-11-2023 08.09,2023-11-23 08:12:17,23.24,239.0
11-11-2023 23.14,11-11-2023 23.53,2023-11-12 00:04:00,38.95,42.0
22-02-2024 06.59,2024-02-22 07:37,2024-02-22 07:53:30,37.89,64.0
14-12-2023 03.54,14-12-2023 04.19,2023-12-14 04:21:57,25.09,37.0
30-03-2023 2.36,30-03-2023 2.45,2023-03-30 03:01:06.600000000,15.96,17.0
25-07-2023 08.54,25-07-2023 09.13,2023-07-25 09:32:24,19.31,37.0
30-03-2023 8.42,30-03-2023 8.46,2023-03-30 08:58:37.400000000,11.84,187.0
05-12-2023 02.56,05-12-2023 03.23,2023-12-05 03:26:07,26.96,37.0
01-12-2023 06.51,2023-12-01 07:15,2023-12-01 07:32:45,24.13,58.0
06-04-2023 09.39,06-04-2023 10.09,2023-04-06 10:13:20,29.99,46.0
18-06-2023 21.01,2023-06-18 21:21,18-06-2023 21:31:56.917046,20.25,35.0
30-03-2023 3.02,30-03-2023 3.12,2023-03-30 03:15:01.799999999,2.78,45.0
15-01-2024 13.12,15-01-2024 13.37,2024-01-15 13:44:22,24.95,32.0
10-10-2023 01.05,10-10-2023 01.25,2023-10-10 01:35:34,19.84,30.0
30-07-2023 18.51,30-07-2023 19.18,2023-07-30 19:27:10,26.39,40.0
24-08-2023 13.37,24-08-2023 13.52,2023-08-24 14:03:53,14.63,17.0
10-04-2023 08.20,10-04-2023 08.44,2023-04-10 08:57:00,24.18,39.0
27-09-2023 18.02,27-09-2023 18.18,2023-09-27 18:25:16,15.58,12.0
22-03-2024 13.41,22-03-2024 14.10,2024-03-22 14:27:26,28.89,52.0
16-02-2024 08.33,16-02-2024 08.53,2024-02-16 08:56:16,20.68,31.0
04-07-2023 19.26,04-07-2023 19.39,04-07-2023 19:49:37.511174,13.69,12.0
22-08-2023 11.29,22-08-2023 12.00,2023-08-22 12:11:19,30.91,39.0
30-03-2023 16.45,30-03-2023 16.51,2023-03-30 16:56:32.000000000,5.4,27.0
04-10-2023 12.21,04-10-2023 12.42,2023-10-04 12:55:54,21.42,39.0
05-06-2023 06.43,05-06-2023 06.58,2023-06-05 07:04:28,14.84,19.0
24-10-2023 07.46,24-10-2023 08.05,2023-10-24 08:15:04,19.21,30.0
02-12-2023 11.12,02-12-2023 11.33,2023-12-02 11:44:52,21.65,17.0
30-08-2023 00.59,30-08-2023 01.15,2023-08-30 01:19:51,15.68,14.0
11-11-2023 03.35,11-11-2023 04.09,2023-11-11 04:14:30,34.13,45.0
07-10-2023 15.56,07-10-2023 16.19,2023-10-07 16:32:26,22.72,27.0
19-11-2023 15.07,2023-11-19 15:29,2023-11-19 15:51:02,22.18,27.0
16-06-2023 23.26,16-06-2023 23.50,2023-06-17 00:09:46,24.23,25.0
2023/07/09 04:25:20,09-07-2023 04.42,2023-07-09 04:52:14,17.63,25.0
25-02-2024 09.21,25-02-2024 09.49,2024-02-25 09:55:17,27.88,46.0
30-03-2023 10.31,30-03-2023 10.31,2023-03-30 10:43:34.400000000,12.19,32.0
20-08-2023 20.42,20-08-2023 21.05,2023-08-20 21:28:57,23.42,51.0
29-04-2023 20.19,29-04-2023 20.38,2023-04-29 20:55:32,18.69,28.0
22-01-2024 12.24,22-01-2024 12.53,2024-01-22 13:07:28,29.15,44.0
17-10-2023 20.33,17-10-2023 21.05,2023-10-17 21:10:36,31.73,48.0
08-12-2023 21.12,08-12-2023 21.30,2023-12-08 21:37:00,18.59,28.0
27-11-2023 16.15,27-11-2023 16.34,2023-11-27 16:44:11,18.96,13.0
07-03-2024 05.38,07-03-2024 06.03,2024-03-07 06:16:48,24.59,
01-07-2023 23.26,01-07-2023 23.51,2023-07-02 00:04:16,25.12,46.0
07-08-2023 13.27,07-08-2023 13.49,2023-08-07 14:00:37,21.12,43.0
30-03-2023 17.34,30-03-2023 17.37,2023-03-30 17:49:18.800000000,11.43,16.0
06-02-2024 08.03,06-02-2024 08.18,06-02-2024 08:26:21.787258,15.18,19.0
23-11-2023 01.56,23-11-2023 02.23,2023-11-23 02:40:44,27.03,42.0
21-12-2023 13.17,2023-12-21 13:30,2023-12-21 13:40:38,12.58,14.0
03-02-2024 16.04,03-02-2024 16.23,03-02-2024 16:37:10.464105,18.63,29.0
30-03-2023 20.49,30-03-2023 20.59,2023-03-30 21:02:36.800000000,2.68,22.0
23-01-2024 23.50,24-01-2024 00.21,2024-01-24 00:25:34,30.57,54.0
01-09-2023 01.12,01-09-2023 01.46,2023-09-01 01:56:59,33.67,37.0
30-03-2023 22.00,30-03-2023 22.06,2023-03-30 22:24:42.399999999,18.54,12.0
30-03-2023 22.00,30-03-2023 22.00,2023-03-30 22:05:35.799999999,5.43,12.0
30-01-2024 20.39,30-01-2024 21.03,2024-01-30 21:19:12,23.92,37.0
14-07-2023 08.12,14-07-2023 08.48,2023-07-14 08:52:23,35.63,54.0
26-01-2024 20.46,26-01-2024 21.13,2024-01-26 21:24:40,27.01,36.0
30-03-2023 8.42,30-03-2023 8.50,2023-03-30 08:56:25.400000000,5.64,47.0
08-09-2023 07.38,08-09-2023 07.54,2023-09-08 08:01:40,16.02,21.0
11-01-2024 05.46,11-01-2024 06.21,2024-01-11 06:37:26,35.3,55.0
03-02-2024 08.34,03-02-2024 08.51,2024-02-03 08:59:08,17.04,15.0
30-03-2023 8.42,30-03-2023 8.47,2023-03-30 08:58:27.800000000,10.68,47.0
06-10-2023 11.48,06-10-2023 12.17,2023-10-06 12:29:50,29.26,25.0
01-01-2024 14.32,01-01-2024 14.51,2024-01-01 14:56:37,18.19,31.0
2023/12/28 00:33:36,28-12-2023 00.43,2023-12-28 00:58:03,10.32,17.0
30-03-2023 22.00,30-03-2023 22.07,2023-03-30 22:18:54.400000000,11.74,12.0
07-05-2023 04.35,07-05-2023 04.48,2023-05-07 04:52:32,12.49,21.0
2023/11/23 14:50:44,2023-11-23 15:19,2023-11-23 15:23:50,28.4,58.0
11-08-2023 21.36,11-08-2023 22.01,2023-08-11 22:09:05,24.66,35.0
12-05-2023 06.02,2023-05-12 06:23,2023-05-12 06:33:41,21.58,35.0
07-09-2023 01.12,2023-09-07 01:23,2023-09-07 01:31:43,10.73,17.0
22-12-2023 14.29,22-12-2023 14.20,2023-12-22 14:31:04,8.85,16.0
30-03-2023 21.09,30-03-2023 21.10,2023-03-30 21:25:54.600000000,15.06,44.0
06-09-2023 08.11,06-09-2023 08.39,2023-09-06 08:53:04,27.93,33.0
11-11-2023 06.37,11-11-2023 06.50,2023-11-11 06:54:57,12.67,32.0
06-02-2024 12.42,06-02-2024 13.17,2024-02-06 13:27:59,34.53,44.0
2023/12/30 18:41:35,30-12-2023 19.01,2023-12-30 19:13:08,20.05,31.0
02-05-2023 20.58,02-05-2023 21.18,2023-05-02 21:23:10,20.51,
10-01-2024 03.06,2024-01-10 03:26,2024-01-10 03:41:50,19.97,14.0
07-04-2023 12.11,2023-04-07 12:38,2023-04-07 12:50:58,26.42,43.0
26-05-2023 12.45,2023-05-26 12:55,2023-05-26 12:58:22,44.12,19.0
30-03-2023 0.10,30-03-2023 0.10,2023-03-30 00:22:44.800000000,12.68,28.0
2023/09/19 11:50:37,2023-09-19 12:13,2023-09-19 12:20:54,22.97,38.0
18-06-2023 06.24,2023-06-18 06:44,2023-06-18 06:49:48,20.33,33.0
2023/12/20 21:40:04,20-12-2023 21.56,2023-12-20 21:58:16,16.2,
11-04-2023 06.35,11-04-2023 06.52,11-04-2023 07:05:12.487670,17.49,
01-02-2024 23.19,01-02-2024 23.30,2024-02-01 23:44:14,11.19,11.0
30-03-2023 9.49,30-03-2023 9.50,2023-03-30 09:56:55.000000000,,10.0
29-12-2023 21.05,29-12-2023 21.31,2023-12-29 21:55:25,25.97,41.0
10-09-2023 02.04,10-09-2023 02.24,2023-09-10 02:47:13,20.68,36.0
02-01-2024 08.27,02-01-2024 08.52,2024-01-02 09:04:10,24.94,35.0
25-04-2023 03.04,25-04-2023 03.35,2023-04-25 03:55:22,31.24,34.0
14-06-2023 06.39,14-06-2023 07.02,2023-06-14 07:09:45,23.6,35.0
01-07-2023 20.48,01-07-2023 21.14,2023-07-01 21:19:09,26.58,19.0
11-11-2023 04.27,11-11-2023 04.54,2023-11-11 04:57:30,26.83,40.0
08-01-2024 15.49,08-01-2024 16.08,2024-01-08 16:25:12,18.56,26.0
14-03-2024 06.13,14-03-2024 06.36,2024-03-14 06:44:11,22.52,41.0
05-08-2023 13.32,2023-08-05 13:56,2023-08-05 14:11:47,24.1,36.0
13-12-2023 23.53,14-12-2023 00.11,2023-12-14 00:21:22,17.83,31.0
05-06-2023 02.19,05-06-2023 02.44,2023-06-05 02:54:19,24.97,29.0
17-04-2023 18.35,17-04-2023 19.01,2023-04-17 19:09:26,25.39,36.0
09-01-2024 17.49,09-01-2024 18.06,2024-01-09 18:24:23,16.6,23.0
30-03-2023 10.31,30-03-2023 10.32,2023-03-30 10:38:25.400000000,6.04,32.0
30-10-2023 17.18,30-10-2023 17.37,2023-10-30 17:39:51,19.0,22.0
19-09-2023 17.09,2023-09-19 17:22,2023-09-19 17:33:10,12.69,23.0
31-10-2023 10.26,31-10-2023 10.48,2023-10-31 11:00:00,21.97,40.0
08-11-2023 19.00,2023-11-08 19:19,2023-11-08 19:35:40,19.38,52.0
27-06-2023 08.35,27-06-2023 08.57,2023-06-27 09:08:32,22.89,39.0
28-09-2023 17.57,28-09-2023 18.26,2023-09-28 18:36:02,29.11,50.0
24-11-2023 01.55,24-11-2023 02.09,2023-11-24 02:19:22,13.41,30.0
,06-10-2023 08.24,2023-10-06 08:34:01,23.47,43.0
05-06-2023 08.08,05-06-2023 08.32,2023-06-05 08:42:04,24.08,51.0
22-12-2023 17.19,22-12-2023 17.46,2023-12-22 18:02:57,26.37,40.0
09-01-2024 08.21,09-01-2024 08.48,2024-01-09 09:01:41,141.04,34.0
17-02-2024 03.33,17-02-2024 04.04,2024-02-17 04:11:56,30.87,49.0
30-03-2023 5.34,30-03-2023 5.42,2023-03-30 05:42:01.800000000,-0.27,50.0
27-10-2023 19.04,27-10-2023 19.30,2023-10-27 19:32:17,26.03,38.0
16-01-2024 13.08,16-01-2024 13.22,2024-01-16 13:27:04,14.14,37.0
24-12-2023 13.31,24-12-2023 13.49,2023-12-24 13:54:03,18.56,39.0
15-11-2023 08.17,15-11-2023 08.25,2023-11-15 08:36:20,8.0,17.0
01-05-2023 11.10,01-05-2023 11.28,2023-05-01 11:38:52,17.68,39.0
12-04-2023 04.57,12-04-2023 05.11,2023-04-12 05:21:47,14.09,16.0
13-09-2023 19.13,13-09-2023 19.28,2023-09-13 19:39:20,15.48,8.0
02-06-2023 08.28,02-06-2023 09.00,2023-06-02 09:10:17,31.33,48.0
21-10-2023 06.10,2023-10-21 06:27,2023-10-21 06:46:46,17.01,22.0
12-01-2024 08.49,12-01-2024 09.03,2024-01-12 09:10:53,13.94,13.0
25-05-2023 01.43,25-05-2023 02.03,2023-05-25 02:14:20,20.03,21.0
29-02-2024 10.07,2024-02-29 10:36,2024-02-29 10:48:03,28.7,37.0
30-09-2023 14.18,30-09-2023 14.45,2023-09-30 14:49:01,26.24,45.0
11-02-2024 01.42,11-02-2024 02.05,2024-02-11 02:11:53,23.12,195.0
03-09-2023 12.16,03-09-2023 12.39,2023-09-03 12:41:30,23.12,32.0
07-06-2023 12.14,07-06-2023 12.39,2023-06-07 12:52:54,24.99,29.0
11-06-2023 18.27,11-06-2023 18.55,11-06-2023 18:59:17.490004,27.8,41.0
31-07-2023 20.37,31-07-2023 20.52,2023-07-31 20:59:56,14.44,27.0
2023/10/22 22:32:30,2023-10-22 22:45,2023-10-22 22:50:34,13.03,178.0
04-02-2024 18.58,04-02-2024 19.32,2024-02-04 19:50:44,34.14,39.0
23-06-2023 17.21,23-06-2023 17.51,2023-06-23 17:59:23,29.33,50.0
05-05-2023 15.37,05-05-2023 16.08,2023-05-05 16:20:28,30.34,57.0
23-09-2023 15.17,23-09-2023 15.35,2023-09-23 15:54:42,17.78,21.0
05-10-2023 09.51,05-10-2023 10.16,2023-10-05 10:22:16,25.39,28.0
07-04-2023 07.07,07-04-2023 07.48,2023-04-07 07:56:20,41.13,46.0
04-11-2023 18.43,04-11-2023 19.13,2023-11-04 19:21:21,29.21,32.0
17-02-2024 17.33,17-02-2024 17.53,2024-02-17 18:00:59,20.28,
20-02-2024 21.51,20-02-2024 22.26,2024-02-20 22:36:55,34.71,53.0
10-10-2023 20.36,10-10-2023 21.01,2023-10-10 21:20:13,25.33,
14-12-2023 20.34,14-12-2023 20.50,2023-12-14 20:55:52,16.62,28.0
17-12-2023 04.55,17-12-2023 05.19,2023-12-17 05:40:19,24.77,39.0
30-03-2023 9.49,30-03-2023 9.50,2023-03-30 09:52:20.799999999,2.28,10.0
04-01-2024 12.22,04-01-2024 12.46,2024-01-04 13:00:37,24.19,59.0
,10-04-2023 07.10,2023-04-10 07:21:39,23.31,26.0
01-05-2023 00.29,01-05-2023 00.51,2023-05-01 00:58:23,21.66,39.0
05-09-2023 23.08,05-09-2023 23.33,2023-09-05 23:36:53,25.57,38.0
27-08-2023 05.34,27-08-2023 05.51,2023-08-27 06:05:41,17.47,24.0
30-03-2023 10.31,30-03-2023 10.31,2023-03-30 10:37:44.000000000,6.35,32.0
22-02-2024 10.57,22-02-2024 11.10,2024-02-22 11:20:01,12.71,24.0
19-07-2023 12.10,19-07-2023 12.33,2023-07-19 12:40:12,22.64,28.0
06-05-2023 16.55,06-05-2023 17.24,2023-05-06 17:39:16,28.36,38.0
31-07-2023 14.13,31-07-2023 14.35,2023-07-31 14:50:04,21.81,21.0
02-12-2023 20.39,02-12-2023 21.02,2023-12-02 21:09:16,22.84,39.0
31-10-2023 05.16,31-10-2023 05.35,2023-10-31 05:39:36,19.14,236.0
08-07-2023 09.26,08-07-2023 09.32,2023-07-08 09:44:39,6.15,10.0
09-06-2023 21.31,09-06-2023 21.57,2023-06-09 22:04:48,26.06,38.0
27-05-2023 20.54,27-05-2023 21.26,2023-05-27 21:40:01,32.4,38.0
30-03-2023 21.09,30-03-2023 21.19,2023-03-30 21:25:28.800000000,5.63,44.0
21-03-2024 23.36,21-03-2024 23.52,2024-03-22 00:01:10,16.1,12.0
30-05-2023 05.12,30-05-2023 05.44,2023-05-30 06:03:45,31.46,32.0
11-06-2023 21.14,11-06-2023 21.45,2023-06-11 21:56:28,31.28,51.0
30-03-2023 10.31,30-03-2023 10.31,2023-03-30 10:45:21.800000000,61.86,32.0
30-03-2023 20.23,30-03-2023 21.00,2023-03-30 21:19:19,180.73,43.0
23-11-2023 06.34,23-11-2023 07.01,2023-11-23 07:05:55,26.89,24.0
30-11-2023 00.09,30-11-2023 00.32,2023-11-30 00:42:28,23.64,47.0
11-01-2024 05.37,11-01-2024 05.53,2024-01-11 05:55:36,16.15,40.0
17-09-2023 02.29,17-09-2023 02.46,2023-09-17 02:55:55,16.48,19.0
17-07-2023 23.55,18-07-2023 00.13,2023-07-18 00:21:48,18.19,33.0
2023/06/19 05:06:40,2023-06-19 05:26,2023-06-19 05:28:55,20.25,41.0
20-07-2023 06.10,20-07-2023 06.30,2023-07-20 06:40:41,20.16,5.0
30-03-2023 8.42,30-03-2023 8.46,2023-03-30 09:01:08.000000000,14.35,47.0
24-12-2023 04.19,24-12-2023 04.50,2023-12-24 05:05:36,31.69,42.0
30-03-2023 20.49,30-03-2023 20.53,2023-03-30 21:12:48.200000000,18.87,224.0
11-11-2023 20.08,11-11-2023 20.26,2023-11-11 20:38:36,17.97,32.0
20-03-2024 05.01,20-03-2024 05.20,2024-03-20 05:32:04,18.46,39.0
30-03-2023 10.31,30-03-2023 10.31,2023-03-30 10:36:47.600000000,5.41,32.0
31-12-2023 16.25,31-12-2023 16.40,2023-12-31 16:51:42,14.69,11.0
30-03-2023 15.45,30-03-2023 15.49,2023-03-30 15:53:28.000000000,3.65,25.0
13-08-2023 09.01,13-08-2023 09.31,2023-08-13 09:42:05,30.22,49.0
13-07-2023 07.53,13-07-2023 08.11,2023-07-13 08:20:33,18.17,6.0
2024/03/01 08:51:46,01-03-2024 09.09,01-03-2024 09:17:34.718703,17.64,19.0
07-12-2023 22.12,2023-12-07 22:40,2023-12-07 22:44:59,27.97,44.0
2023/05/19 07:14:16,19-05-2023 07.34,2023-05-19 07:43:33,19.79,20.0
13-07-2023 06.09,13-07-2023 05.50,2023-07-13 06:11:57,19.73,46.0
29-01-2024 02.19,29-01-2024 02.44,2024-01-29 02:55:26,24.72,41.0
30-03-2023 22.00,30-03-2023 22.06,2023-03-30 22:12:17.800000000,6.13,12.0
10-12-2023 19.53,10-12-2023 20.06,2023-12-10 20:09:51,12.98,30.0
19-11-2023 18.18,19-11-2023 18.39,2023-11-19 18:42:13,20.16,29.0
30-05-2023 15.29,30-05-2023 15.45,2023-05-30 15:48:18,16.17,8.0
26-02-2024 14.58,26-02-2024 15.29,2024-02-26 15:32:52,30.89,42.0
12-09-2023 17.15,12-09-2023 17.42,2023-09-12 17:52:17,27.22,36.0
28-02-2024 11.34,28-02-2024 11.37,2024-02-28 11:43:33,3.72,1.0
14-06-2023 07.30,14-06-2023 07.51,2023-06-14 07:59:23,20.95,41.0
15-02-2024 05.34,15-02-2024 06.06,2024-02-15 06:16:22,31.59,41.0
19-11-2023 16.49,19-11-2023 17.17,2023-11-19 17:27:59,141.7,33.0
14-12-2023 17.24,14-12-2023 17.46,2023-12-14 18:05:45,21.1,
13-05-2023 12.36,13-05-2023 12.57,2023-05-13 13:05:31,20.64,30.0
30-03-2023 21.09,30-03-2023 21.18,2023-03-30 21:25:12.600000000,6.36,44.0
30-03-2023 0.10,30-03-2023 0.17,2023-03-30 00:30:07.600000000,13.06,28.0
19-05-2023 17.51,19-05-2023 18.10,2023-05-19 18:18:19,19.59,33.0
02-02-2024 21.13,02-02-2024 21.36,2024-02-02 21:42:39,23.07,36.0
18-01-2024 12.59,2024-01-18 13:24,2024-01-18 13:36:22,24.5,41.0
14-08-2023 22.01,14-08-2023 22.24,2023-08-14 22:37:49,22.75,26.0
24-07-2023 12.07,24-07-2023 12.18,2023-07-24 12:26:46,10.42,
31-07-2023 21.59,31-07-2023 22.20,2023-07-31 22:31:43,20.53,32.0
19-12-2023 00.27,19-12-2023 00.45,2023-12-19 00:58:47,18.19,29.0
30-03-2023 15.45,30-03-2023 15.48,2023-03-30 16:11:06.399999999,22.29,25.0
,24-03-2024 04.11,24-03-2024 04:25:33.816631,32.79,50.0
14-10-2023 22.13,14-10-2023 22.41,2023-10-14 22:53:58,28.22,32.0
03-09-2023 17.18,2023-09-03 17:28,03-09-2023 17:31:29.303887,9.91,19.0
2024/01/17 12:17:51,2024-01-17 12:47,2024-01-17 13:04:12,29.66,24.0
02-10-2023 14.02,02-10-2023 14.29,2023-10-02 14:38:19,93.3,47.0
15-02-2024 17.16,15-02-2024 17.27,2024-02-15 17:31:48,10.18,27.0
02-07-2023 00.51,02-07-2023 01.28,2023-07-02 01:41:14,37.14,51.0
12-12-2023 08.12,12-12-2023 08.28,2023-12-12 08:32:19,16.05,24.0
12-07-2023 09.56,2023-07-12 10:26,2023-07-12 10:28:55,30.47,42.0
30-10-2023 13.29,30-10-2023 13.54,2023-10-30 14:05:25,25.56,26.0
30-03-2023 2.36,30-03-2023 2.43,2023-03-30 02:48:47.400000000,5.64,17.0
21-11-2023 11.34,21-11-2023 12.11,2023-11-21 12:16:46,36.65,57.0
25-07-2023 13.35,25-07-2023 14.00,2023-07-25 14:17:44,24.5,43.0
18-11-2023 22.51,18-11-2023 23.11,2023-11-18 23:33:28,20.69,41.0
12-02-2024 13.53,12-02-2024 14.19,2024-02-12 14:39:45,26.55,38.0
13-11-2023 23.23,13-11-2023 23.44,2023-11-13 23:48:57,20.53,24.0
23-02-2024 14.54,23-02-2024 15.18,2024-02-23 15:29:07,24.29,29.0
2023/08/13 04:10:38,13-08-2023 04.28,2023-08-13 04:34:46,17.95,30.0
24-09-2023 08.09,2023-09-24 08:27,2023-09-24 08:39:56,17.56,29.0
02-07-2023 19.30,02-07-2023 19.50,02-07-2023 20:10:07.635499,20.26,29.0
18-07-2023 22.46,18-07-2023 23.13,2023-07-18 23:25:09,27.54,28.0
30-08-2023 09.18,30-08-2023 09.39,2023-08-30 10:01:56,20.57,30.0
15-05-2023 08.07,15-05-2023 08.31,2023-05-15 08:50:59,24.18,39.0
16-09-2023 15.19,16-09-2023 15.51,16-09-2023 15:59:25.196267,31.34,22.0
,03-04-2023 02.31,2023-04-03 02:36:16,21.59,14.0
16-05-2023 17.33,16-05-2023 17.41,2023-05-16 17:52:16,43.65,4.0
11-10-2023 10.34,11-10-2023 11.10,2023-10-11 11:18:06,35.6,33.0
12-12-2023 11.31,12-12-2023 12.05,2023-12-12 12:19:33,33.89,56.0
30-03-2023 15.45,30-03-2023 15.47,2023-03-30 16:00:38.800000000,12.83,25.0
27-09-2023 04.47,27-09-2023 05.22,2023-09-27 05:32:57,35.94,60.0
30-09-2023 16.30,30-09-2023 16.48,2023-09-30 16:56:30,18.19,23.0
30-03-2023 10.31,30-03-2023 10.32,2023-03-30 10:40:09.200000000,7.77,32.0
12-01-2024 10.41,2024-01-12 11:04,2024-01-12 11:14:27,22.68,29.0
30-03-2023 1.58,30-03-2023 1.58,2023-03-30 02:11:40.000000000,13.05,27.0
01-02-2024 03.59,01-02-2024 04.24,2024-02-01 04:34:44,24.62,34.0
08-07-2023 01.35,08-07-2023 01.56,2023-07-08 02:06:19,21.21,26.0
12-12-2023 18.51,12-12-2023 19.14,2023-12-12 19:18:41,84.31,18.0
10-06-2023 23.21,10-06-2023 23.51,2023-06-11 00:01:17,30.1,36.0
2023/08/12 08:21:26,2023-08-12 08:46,2023-08-12 08:52:35,24.94,37.0
19-04-2023 01.23,19-04-2023 01.42,2023-04-19 01:51:51,18.96,23.0
30-03-2023 13.55,30-03-2023 14.03,2023-03-30 14:17:57.400000000,14.19,25.0
13-08-2023 15.37,13-08-2023 16.10,2023-08-13 16:30:24,32.75,32.0
2023/06/16 01:19:28,16-06-2023 01.41,2023-06-16 01:48:39,21.81,40.0
15-08-2023 04.53,15-08-2023 05.14,2023-08-15 05:27:00,21.03,32.0
16-08-2023 01.12,16-08-2023 01.28,2023-08-16 01:36:09,16.53,15.0
24-02-2024 19.27,24-02-2024 19.56,2024-02-24 19:58:34,29.36,40.0
11-08-2023 08.39,11-08-2023 09.18,2023-08-11 09:25:44,38.64,58.0
07-05-2023 16.13,07-05-2023 16.31,2023-05-07 16:38:30,,33.0
03-08-2023 09.00,03-08-2023 09.25,2023-08-03 09:31:35,25.27,28.0
14-03-2024 15.15,14-03-2024 15.39,2024-03-14 15:45:37,24.7,44.0
30-09-2023 06.08,30-09-2023 06.27,2023-09-30 06:39:01,18.84,20.0
08-09-2023 09.49,2023-09-08 10:21,2023-09-08 10:25:17,32.48,29.0
23-08-2023 04.07,23-08-2023 04.38,2023-08-23 04:50:59,31.06,27.0
02-09-2023 22.35,02-09-2023 22.53,2023-09-02 22:59:31,18.37,48.0
09-10-2023 23.28,09-10-2023 23.51,2023-10-10 00:03:34,22.96,36.0
04-06-2023 06.05,2023-06-04 06:33,2023-06-04 06:52:08,27.79,45.0
02-05-2023 11.39,02-05-2023 11.58,2023-05-02 12:12:15,18.26,47.0
12-07-2023 02.42,12-07-2023 02.51,2023-07-12 02:55:15,9.54,15.0
14-10-2023 00.51,14-10-2023 01.08,2023-10-14 01:20:44,17.14,27.0
04-10-2023 22.52,04-10-2023 23.28,04-10-2023 23:45:57.634807,35.41,57.0
13-02-2024 21.57,13-02-2024 22.16,2024-02-13 22:32:28,18.8,22.0
19-11-2023 05.06,19-11-2023 05.34,2023-11-19 05:44:54,27.93,34.0
30-03-2023 21.09,30-03-2023 21.12,2023-03-30 21:25:58.800000000,13.13,44.0
30-03-2023 6.51,30-03-2023 6.52,2023-03-30 06:59:44.200000000,7.07,24.0
07-11-2023 16.17,07-11-2023 16.35,2023-11-07 16:51:57,17.39,23.0
30-03-2023 17.34,30-03-2023 17.34,2023-03-30 17:47:26.000000000,12.55,16.0
07-01-2024 04.05,2024-01-07 04:27,07-01-2024 04:34:03.495795,21.95,39.0
09-01-2024 12.58,09-01-2024 13.09,2024-01-09 13:17:19,10.64,32.0
29-08-2023 07.18,29-08-2023 07.48,2023-08-29 07:57:57,30.2,56.0
11-10-2023 17.16,11-10-2023 17.41,2023-10-11 18:01:26,24.84,48.0
20-11-2023 00.25,20-11-2023 00.55,2023-11-20 01:10:56,29.98,41.0
20-04-2023 17.16,2023-04-20 17:41,2023-04-20 17:48:39,25.04,43.0
01-01-2024 17.06,01-01-2024 17.45,2024-01-01 17:57:15,39.08,44.0
30-03-2023 12.33,30-03-2023 12.33,2023-03-30 12:49:45.999999999,16.65,40.0
2024/03/15 17:07:36,15-03-2024 17.40,2024-03-15 17:53:46,33.23,69.0
14-01-2024 02.10,14-01-2024 02.32,2024-01-14 02:34:20,21.45,29.0
16-09-2023 23.23,16-09-2023 23.43,2023-09-16 23:56:32,19.17,24.0
23-11-2023 16.22,23-11-2023 16.42,2023-11-23 16:50:10,19.35,47.0
18-05-2023 07.06,18-05-2023 07.25,2023-05-18 07:29:52,19.02,19.0
01-10-2023 07.25,01-10-2023 07.42,2023-10-01 07:48:55,17.5,16.0
16-05-2023 18.45,16-05-2023 19.17,2023-05-16 19:29:44,31.68,47.0
25-09-2023 10.40,25-09-2023 11.04,25-09-2023 11:14:06.054731,24.31,30.0
17-02-2024 06.14,17-02-2024 06.46,2024-02-17 07:03:42,31.36,61.0
09-01-2024 12.20,09-01-2024 12.42,2024-01-09 13:01:41,22.47,46.0
10-03-2024 22.30,10-03-2024 22.45,2024-03-10 23:00:36,15.07,22.0
30-03-2023 15.45,30-03-2023 15.53,2023-03-30 16:03:34.000000000,9.75,25.0
22-12-2023 07.16,22-12-2023 07.53,2023-12-22 08:08:06,36.38,44.0
30-03-2023 15.45,30-03-2023 15.45,2023-03-30 15:55:36.400000000,9.79,25.0
04-01-2024 18.43,04-01-2024 19.12,2024-01-04 19:24:06,28.67,49.0
25-04-2023 00.47,25-04-2023 01.11,2023-04-25 01:20:00,23.85,42.0
27-12-2023 08.17,27-12-2023 08.47,2023-12-27 09:06:19,29.42,53.0
06-06-2023 23.27,06-06-2023 23.54,07-06-2023 00:07:23.946976,27.33,20.0
2023/04/20 21:41:10,20-04-2023 21.58,2023-04-20 22:11:03,17.57,29.0
09-09-2023 14.47,09-09-2023 15.01,2023-09-09 15:18:28,13.58,18.0
26-09-2023 03.17,26-09-2023 03.29,2023-09-26 03:33:28,12.82,35.0
12-08-2023 01.13,12-08-2023 01.31,2023-08-12 01:39:40,17.25,33.0
24-01-2024 09.05,24-01-2024 09.30,2024-01-24 09:41:20,25.09,32.0
18-06-2023 14.21,18-06-2023 14.48,2023-06-18 15:05:06,,49.0
30-03-2023 5.34,30-03-2023 5.40,2023-03-30 05:48:33.599999999,8.26,135.0
25-04-2023 21.53,25-04-2023 22.13,2023-04-25 22:22:02,20.93,30.0
30-03-2023 20.49,30-03-2023 20.50,2023-03-30 21:01:18.199999999,10.37,22.0
2024/01/09 18:25:00,09-01-2024 18.49,09-01-2024 18:59:03.676127,24.92,32.0
06-06-2023 11.37,06-06-2023 11.59,2023-06-06 12:12:28,22.4,35.0
30-03-2023 8.42,30-03-2023 8.43,2023-03-30 08:47:57.799999999,4.18,47.0
11-11-2023 04.54,11-11-2023 05.11,11-11-2023 05:30:24.148998,17.42,
06-09-2023 13.16,06-09-2023 13.29,2023-09-06 13:45:15,12.42,23.0
28-11-2023 03.11,28-11-2023 03.33,2023-11-28 03:38:08,21.18,25.0
23-11-2023 18.06,23-11-2023 18.26,23-11-2023 18:34:32.296644,20.14,37.0
18-01-2024 17.16,18-01-2024 17.38,2024-01-18 17:50:29,22.2,44.0
09-02-2024 12.35,09-02-2024 12.55,2024-02-09 13:04:20,19.42,19.0
09-01-2024 18.53,09-01-2024 19.18,2024-01-09 19:36:46,24.96,25.0
15-09-2023 21.56,15-09-2023 22.27,2023-09-15 22:33:37,30.86,37.0
27-04-2023 22.58,27-04-2023 23.23,2023-04-27 23:35:19,24.41,39.0
07-12-2023 13.01,07-12-2023 13.18,2023-12-07 13:30:17,17.04,33.0
09-06-2023 02.56,09-06-2023 03.26,2023-06-09 03:37:41,30.27,39.0
30-03-2023 7.14,30-03-2023 7.24,2023-03-30 07:37:00.200000000,12.67,3.0
18-11-2023 05.55,18-11-2023 06.31,2023-11-18 06:44:04,35.79,43.0
12-02-2024 10.02,12-02-2024 10.18,2024-02-12 10:32:49,16.38,27.0
10-08-2023 17.45,10-08-2023 18.04,2023-08-10 18:22:15,19.08,15.0
13-11-2023 01.04,13-11-2023 01.23,2023-11-13 01:33:55,19.42,19.0
18-03-2024 12.24,18-03-2024 12.44,2024-03-18 12:56:53,19.36,26.0
22-06-2023 22.54,22-06-2023 23.14,22-06-2023 23:22:02.449330,20.45,33.0
24-02-2024 03.12,2024-02-24 03:36,2024-02-24 03:40:54,23.18,20.0
20-02-2024 09.51,20-02-2024 10.07,2024-02-20 10:17:08,16.18,45.0
14-04-2023 21.00,14-04-2023 21.25,2023-04-14 21:42:38,24.64,20.0
19-04-2023 22.08,19-04-2023 22.30,2023-04-19 22:45:06,22.27,40.0
06-08-2023 09.48,06-08-2023 10.11,2023-08-06 10:24:29,22.69,32.0
07-12-2023 02.14,07-12-2023 02.29,2023-12-07 02:36:48,15.36,34.0
26-02-2024 03.10,26-02-2024 03.34,2024-02-26 03:52:41,24.53,41.0
28-05-2023 04.51,28-05-2023 05.18,2023-05-28 05:20:02,26.26,46.0
03-12-2023 00.49,03-12-2023 01.14,2023-12-03 01:36:09,25.45,33.0
14-01-2024 05.22,14-01-2024 05.54,2024-01-14 06:08:24,32.23,48.0
2023/08/26 02:52:39,26-08-2023 03.15,2023-08-26 03:20:51,23.16,36.0
11-03-2024 11.27,11-03-2024 11.03,2024-03-11 11:43:04,23.85,37.0
2023/09/15 14:45:37,15-09-2023 14.57,2023-09-15 15:13:35,12.35,0.0
30-03-2023 5.34,30-03-2023 5.37,2023-03-30 05:46:03.000000000,8.75,50.0
21-05-2023 06.34,21-05-2023 06.54,2023-05-21 07:05:11,19.95,36.0
25-01-2024 22.55,25-01-2024 23.21,2024-01-25 23:29:45,26.25,33.0
,14-01-2024 11.37,2024-01-14 11:49:50,17.51,20.0
2023/11/08 22:34:15,08-11-2023 22.50,2023-11-08 23:08:55,16.08,42.0
23-10-2023 14.20,23-10-2023 14.27,2023-10-23 14:40:56,7.1,12.0
04-06-2023 06.18,04-06-2023 06.39,2023-06-04 06:53:53,21.39,28.0
07-04-2023 10.52,07-04-2023 11.12,2023-04-07 11:20:46,19.62,0.0
29-08-2023 19.10,29-08-2023 19.34,2023-08-29 19:46:52,24.02,31.0
23-05-2023 11.24,23-05-2023 11.47,2023-05-23 11:55:27,23.86,30.0
30-03-2023 22.00,30-03-2023 22.06,2023-03-30 22:05:45.400000001,-0.41,12.0
25-07-2023 01.47,25-07-2023 02.12,2023-07-25 02:26:25,24.82,38.0
29-06-2023 07.39,29-06-2023 07.51,2023-06-29 08:11:29,11.53,16.0
25-07-2023 09.14,25-07-2023 09.32,2023-07-25 09:40:38,17.65,18.0
29-02-2024 11.35,29-02-2024 11.56,2024-02-29 12:13:41,20.52,47.0
01-10-2023 18.25,01-10-2023 18.45,2023-10-01 18:58:36,20.12,36.0
09-03-2024 02.55,09-03-2024 03.13,2024-03-09 03:21:46,18.19,24.0
11-05-2023 07.26,2023-05-11 07:47,2023-05-11 07:49:58,21.53,14.0
03-08-2023 23.46,04-08-2023 00.21,2023-08-04 00:35:47,34.65,47.0
29-07-2023 22.49,29-07-2023 23.04,2023-07-29 23:17:19,15.16,34.0
15-11-2023 19.35,15-11-2023 20.06,2023-11-15 20:21:45,31.12,53.0
01-04-2023 16.39,01-04-2023 17.11,2023-04-01 17:22:08,31.9,40.0
10-11-2023 23.38,10-11-2023 23.59,2023-11-11 00:05:33,20.49,37.0
02-03-2024 16.12,02-03-2024 16.31,2024-03-02 16:40:52,19.45,44.0
27-11-2023 11.33,2023-11-27 11:52,2023-11-27 12:02:35,19.12,23.0
2024/01/02 07:56:53,02-01-2024 08.13,2024-01-02 08:23:12,16.73,27.0
08-10-2023 06.42,08-10-2023 07.02,2023-10-08 07:16:47,20.5,37.0
07-03-2024 14.32,07-03-2024 14.55,2024-03-07 15:06:26,22.91,54.0
05-10-2023 09.21,05-10-2023 09.42,2023-10-05 09:55:07,20.27,26.0
26-11-2023 14.33,26-11-2023 15.00,2023-11-26 15:09:52,26.82,42.0
02-12-2023 20.51,02-12-2023 21.14,2023-12-02 21:23:22,22.92,35.0
31-03-2023 18.43,31-03-2023 19.06,2023-03-31 19:16:30,23.27,24.0
09-07-2023 16.45,09-07-2023 17.01,09-07-2023 17:09:42.190635,16.62,33.0
01-11-2023 22.11,01-11-2023 22.47,2023-11-01 22:59:58,36.37,51.0
03-02-2024 04.19,03-02-2024 04.46,2024-02-03 04:53:07,27.38,30.0
25-03-2024 11.00,25-03-2024 11.12,2024-03-25 11:31:03,12.17,0.0
28-05-2023 18.37,28-05-2023 18.57,2023-05-28 19:06:46,19.62,230.0
24-10-2023 01.13,24-10-2023 01.44,2023-10-24 01:58:47,,55.0
30-03-2023 1.58,30-03-2023 2.08,2023-03-30 02:15:40.599999999,7.06,27.0
15-11-2023 13.13,15-11-2023 13.42,2023-11-15 13:44:07,28.16,53.0
11-06-2023 13.36,11-06-2023 14.05,2023-06-11 14:11:53,28.38,53.0
12-05-2023 17.01,2023-05-12 17:25,2023-05-12 17:38:20,23.81,33.0
27-11-2023 19.26,27-11-2023 19.50,2023-11-27 20:04:37,23.72,35.0
30-03-2023 22.00,30-03-2023 22.00,2023-03-30 22:01:59.200000000,1.82,12.0
23-04-2023 14.21,23-04-2023 14.40,2023-04-23 14:59:49,19.05,46.0
03-11-2023 18.45,03-11-2023 19.19,2023-11-03 19:30:55,34.01,30.0
21-09-2023 10.18,21-09-2023 10.48,2023-09-21 10:52:10,30.37,48.0
29-08-2023 18.52,29-08-2023 19.07,2023-08-29 19:24:08,14.25,32.0
18-01-2024 20.47,2024-01-18 21:19,2024-01-18 21:38:17,32.39,47.0
30-06-2023 08.45,30-06-2023 09.07,2023-06-30 09:18:22,22.82,43.0
29-08-2023 18.58,29-08-2023 19.22,2023-08-29 19:38:15,23.41,40.0
2024/03/01 05:18:26,01-03-2024 05.41,2024-03-01 05:59:19,22.96,21.0
26-01-2024 07.10,26-01-2024 07.24,2024-01-26 07:35:25,13.24,5.0
20-05-2023 11.33,20-05-2023 11.56,2023-05-20 12:11:39,22.18,16.0
10-08-2023 02.44,2023-08-10 03:21,2023-08-10 03:30:58,36.69,48.0
12-11-2023 06.56,12-11-2023 07.10,2023-11-12 07:19:01,13.6,25.0
03-06-2023 01.15,03-06-2023 01.44,2023-06-03 01:57:59,29.26,32.0
02-10-2023 15.12,02-10-2023 15.26,2023-10-02 15:35:41,13.96,8.0
24-07-2023 01.46,24-07-2023 02.04,24-07-2023 02:11:24.509089,17.9,31.0
26-02-2024 07.23,26-02-2024 07.46,2024-02-26 07:55:41,22.84,34.0
06-10-2023 02.07,06-10-2023 02.23,2023-10-06 02:36:31,16.57,21.0
24-11-2023 22.24,24-11-2023 22.47,2023-11-24 23:02:01,22.96,25.0
25-01-2024 18.42,25-01-2024 18.57,2024-01-25 19:03:50,14.72,0.0
23-11-2023 10.07,23-11-2023 10.29,2023-11-23 10:43:21,21.74,30.0
12-06-2023 22.14,12-06-2023 22.32,2023-06-12 22:40:58,17.64,27.0
26-03-2024 00.24,26-03-2024 00.51,2024-03-26 01:11:52,27.68,34.0
13-12-2023 18.31,13-12-2023 19.01,2023-12-13 19:09:23,29.96,29.0
27-12-2023 18.15,27-12-2023 18.42,2023-12-27 18:54:48,27.29,56.0
2023/04/25 07:24:17,25-04-2023 07.57,2023-04-25 08:06:01,33.37,56.0
06-10-2023 12.10,06-10-2023 12.28,2023-10-06 12:45:18,18.41,28.0
07-03-2024 01.26,07-03-2024 01.58,2024-03-07 02:05:49,31.56,49.0
2024/03/14 07:47:29,14-03-2024 08.10,2024-03-14 08:19:08,22.69,139.0
12-06-2023 00.36,12-06-2023 00.56,2023-06-12 01:09:18,19.35,28.0
10-02-2024 10.36,10-02-2024 10.47,2024-02-10 10:53:00,11.4,15.0
03-10-2023 23.02,03-10-2023 23.14,2023-10-03 23:27:00,12.57,0.0
22-01-2024 12.14,22-01-2024 12.37,2024-01-22 12:47:08,23.72,30.0
25-07-2023 15.41,25-07-2023 16.07,2023-07-25 16:18:24,26.1,35.0
06-03-2024 05.14,06-03-2024 05.30,2024-03-06 05:32:45,16.46,27.0
06-06-2023 17.52,06-06-2023 18.21,06-06-2023 18:27:18.226377,29.9,53.0
04-02-2024 03.02,04-02-2024 03.25,2024-02-04 03:36:07,22.91,33.0
,31-07-2023 15.36,2023-07-31 15:52:21,27.71,34.0
2023/06/10 02:06:33,10-06-2023 02.31,2023-06-10 02:39:48,24.56,17.0
05-03-2024 23.28,05-03-2024 23.54,2024-03-06 00:10:03,26.8,31.0
20-11-2023 08.46,20-11-2023 09.02,2023-11-20 09:10:56,15.92,37.0
19-03-2024 16.16,19-03-2024 16.46,2024-03-19 17:03:55,29.54,20.0
17-05-2023 21.48,17-05-2023 22.05,2023-05-17 22:13:51,16.98,33.0
2024/01/01 09:28:35,01-01-2024 09.45,2024-01-01 09:57:31,17.04,40.0
23-10-2023 09.18,23-10-2023 09.59,2023-10-23 10:08:44,41.2,44.0
03-09-2023 06.43,03-09-2023 07.03,2023-09-03 07:10:54,20.61,21.0
29-12-2023 03.00,29-12-2023 03.34,2023-12-29 03:41:17,34.54,40.0
29-10-2023 09.36,29-10-2023 10.00,2023-10-29 10:08:25,24.48,39.0
16-01-2024 11.58,2024-01-16 12:20,2024-01-16 12:27:17,21.91,28.0
15-02-2024 00.01,15-02-2024 00.28,2024-02-15 00:45:08,26.96,40.0
08-12-2023 06.22,08-12-2023 06.40,2023-12-08 06:51:06,17.88,24.0
2024/01/28 16:12:20,28-01-2024 16.37,2024-01-28 16:56:05,25.26,42.0
12-10-2023 17.17,12-10-2023 17.37,2023-10-12 17:39:22,19.58,21.0
18-11-2023 10.44,18-11-2023 11.07,2023-11-18 11:16:48,22.85,37.0
06-01-2024 15.13,06-01-2024 15.48,2024-01-06 15:53:40,34.88,49.0
2024/02/09 04:44:32,09-02-2024 04.53,2024-02-09 05:09:21,8.74,28.0
30-09-2023 03.51,30-09-2023 04.11,2023-09-30 04:24:36,19.64,23.0
28-05-2023 09.47,28-05-2023 10.05,2023-05-28 10:16:51,17.69,25.0
28-04-2023 09.44,28-04-2023 10.07,2023-04-28 10:26:15,22.92,26.0
29-01-2024 06.11,29-01-2024 06.31,2024-01-29 06:38:15,20.05,12.0
22-09-2023 03.30,2023-09-22 04:06,2023-09-22 04:15:47,36.61,42.0
18-10-2023 14.20,18-10-2023 14.42,2023-10-18 14:59:58,22.39,27.0
22-08-2023 17.07,22-08-2023 17.31,2023-08-22 17:39:08,24.36,17.0
30-03-2023 8.42,30-03-2023 8.50,2023-03-30 08:59:22.400000000,8.59,47.0
28-11-2023 09.37,28-11-2023 10.01,2023-11-28 10:07:07,23.83,51.0
07-08-2023 22.08,07-08-2023 22.26,2023-08-07 22:32:14,17.81,33.0
04-08-2023 14.20,2023-08-04 14:39,2023-08-04 14:46:26,18.42,37.0
30-03-2023 2.36,30-03-2023 2.39,2023-03-30 02:46:37.800000000,7.48,
19-02-2024 21.55,19-02-2024 22.10,2024-02-19 22:15:43,14.42,14.0
16-04-2023 07.08,16-04-2023 07.45,2023-04-16 07:49:32,,48.0
12-03-2024 07.33,12-03-2024 07.55,2024-03-12 08:06:09,21.9,21.0
27-06-2023 22.12,27-06-2023 22.39,2023-06-27 22:47:28,26.56,44.0
16-12-2023 21.16,16-12-2023 21.40,2023-12-16 21:49:20,24.09,19.0
19-09-2023 08.05,19-09-2023 08.24,2023-09-19 08:41:59,19.53,33.0
21-06-2023 19.57,21-06-2023 20.16,2023-06-21 20:24:29,19.65,39.0
15-10-2023 15.46,15-10-2023 16.00,2023-10-15 16:08:05,14.02,39.0
11-07-2023 19.29,11-07-2023 19.48,2023-07-11 20:04:01,19.47,26.0
04-04-2023 08.47,04-04-2023 09.14,2023-04-04 09:27:45,26.72,137.0
20-03-2024 03.36,20-03-2024 04.00,2024-03-20 04:10:16,24.02,36.0
26-12-2023 04.01,2023-12-26 04:27,2023-12-26 04:40:56,25.5,35.0
04-11-2023 12.11,04-11-2023 12.48,2023-11-04 12:58:12,36.74,57.0
20-08-2023 10.07,20-08-2023 10.27,2023-08-20 10:40:03,19.37,32.0
10-10-2023 03.29,10-10-2023 03.51,2023-10-10 04:02:48,22.24,29.0
04-11-2023 21.16,04-11-2023 21.34,2023-11-04 21:39:36,17.34,40.0
16-11-2023 14.44,16-11-2023 15.00,2023-11-16 15:18:50,16.35,14.0
31-08-2023 14.46,31-08-2023 15.00,2023-08-31 15:12:57,13.68,15.0
18-03-2024 07.28,18-03-2024 07.47,2024-03-18 07:52:56,18.18,19.0
20-10-2023 16.34,20-10-2023 17.10,2023-10-20 17:24:02,35.6,46.0
21-06-2023 04.17,21-06-2023 04.51,2023-06-21 05:08:51,34.08,46.0
05-01-2024 17.34,05-01-2024 17.55,2024-01-05 18:10:06,21.07,30.0
17-10-2023 20.23,17-10-2023 20.59,2023-10-17 21:08:14,36.58,43.0
2024/02/05 15:31:38,05-02-2024 15.53,2024-02-05 16:04:01,21.76,41.0
30-03-2023 6.51,30-03-2023 6.53,2023-03-30 07:06:17.199999999,12.62,24.0
02-05-2023 23.48,03-05-2023 00.20,2023-05-03 00:25:39,31.85,33.0
05-03-2024 16.45,05-03-2024 17.18,2024-03-05 17:25:50,33.55,47.0
11-05-2023 16.37,11-05-2023 16.55,2023-05-11 17:09:06,17.68,24.0
19-03-2024 20.50,19-03-2024 21.08,2024-03-19 21:24:32,18.11,46.0
02-01-2024 15.38,02-01-2024 16.02,2024-01-02 16:13:29,23.29,35.0
06-11-2023 23.22,06-11-2023 23.43,2023-11-06 23:46:43,20.84,18.0
06-01-2024 16.03,06-01-2024 16.35,2024-01-06 16:46:36,31.73,64.0
2023/12/10 23:17:56,10-12-2023 23.36,2023-12-10 23:47:55,18.99,45.0
17-04-2023 01.25,17-04-2023 01.38,2023-04-17 01:48:48,12.47,33.0
2023/10/26 04:21:50,26-10-2023 04.44,2023-10-26 04:58:03,22.74,38.0
28-07-2023 00.19,28-07-2023 00.41,2023-07-28 00:54:05,22.23,39.0
30-03-2023 8.42,30-03-2023 8.49,2023-03-30 08:56:23.600000000,6.61,47.0
17-08-2023 14.14,17-08-2023 14.44,2023-08-17 14:57:12,30.29,48.0
30-03-2023 21.09,30-03-2023 21.14,2023-03-30 21:26:04.800000000,11.23,44.0
13-02-2024 12.44,13-02-2024 13.06,2024-02-13 13:16:46,22.07,32.0
25-05-2023 06.52,25-05-2023 07.20,2023-05-25 07:29:05,27.3,38.0
03-05-2023 08.14,03-05-2023 08.27,2023-05-03 08:43:44,13.67,23.0
02-10-2023 02.16,02-10-2023 02.43,2023-10-02 03:04:22,26.78,38.0
16-05-2023 03.24,16-05-2023 03.39,2023-05-16 03:44:41,14.99,33.0
22-09-2023 01.08,2023-09-22 01:31,2023-09-22 01:42:03,22.73,18.0
21-11-2023 22.42,21-11-2023 23.01,2023-11-21 23:05:23,18.44,23.0
28-02-2024 07.40,28-02-2024 08.02,2024-02-28 08:17:04,22.4,17.0
2024/01/17 15:59:22,17-01-2024 16.29,2024-01-17 16:43:18,29.84,44.0
06-11-2023 07.54,06-11-2023 08.23,06-11-2023 08:32:34.778968,,49.0
06-07-2023 21.25,06-07-2023 21.44,2023-07-06 21:56:32,18.63,16.0
13-07-2023 12.32,13-07-2023 12.41,2023-07-13 12:43:07,8.8,19.0
01-12-2023 23.38,02-12-2023 00.06,2023-12-02 00:13:29,27.62,43.0
16-09-2023 08.38,16-09-2023 09.01,2023-09-16 09:03:24,,37.0
15-04-2023 05.05,15-04-2023 05.29,2023-04-15 05:42:04,24.02,18.0
03-04-2023 13.24,03-04-2023 13.43,2023-04-03 14:00:58,19.18,25.0
27-07-2023 01.21,27-07-2023 01.38,2023-07-27 01:47:34,17.73,34.0
30-12-2023 03.11,30-12-2023 03.41,2023-12-30 04:01:25,29.5,50.0
2024/03/10 01:56:25,10-03-2024 02.23,2024-03-10 02:27:16,26.64,38.0
08-11-2023 00.25,08-11-2023 00.51,2023-11-08 01:08:45,26.41,45.0
30-03-2023 8.42,30-03-2023 8.49,2023-03-30 08:56:06.200000000,6.32,47.0
2023/04/03 00:40:21,2023-04-03 00:48,2023-04-03 01:08:09,8.57,0.0
20-03-2024 02.37,20-03-2024 03.07,2024-03-20 03:23:33,29.98,33.0
30-03-2023 12.33,30-03-2023 12.34,2023-03-30 12:46:39.400000000,12.54,40.0
27-01-2024 22.25,27-01-2024 22.42,2024-01-27 23:03:42,17.07,17.0
30-03-2023 8.42,30-03-2023 8.43,2023-03-30 08:59:27.800000000,15.68,47.0
27-08-2023 07.54,27-08-2023 08.15,2023-08-27 08:19:45,20.15,42.0
06-07-2023 18.03,06-07-2023 18.32,2023-07-06 18:39:56,29.09,52.0
21-10-2023 07.54,21-10-2023 08.23,2023-10-21 08:30:28,28.78,46.0
30-07-2023 21.24,30-07-2023 21.46,2023-07-30 21:55:37,22.7,21.0
02-09-2023 04.35,02-09-2023 05.03,2023-09-02 05:14:54,27.1,27.0
30-03-2023 3.02,30-03-2023 3.09,2023-03-30 03:18:42.600000000,9.46,45.0
07-04-2023 16.16,07-04-2023 16.25,2023-04-07 16:36:14,8.64,23.0
21-07-2023 12.11,21-07-2023 12.42,2023-07-21 13:02:57,30.87,26.0
31-12-2023 16.33,31-12-2023 17.08,2023-12-31 17:19:46,34.56,52.0
11-02-2024 14.24,11-02-2024 14.44,2024-02-11 14:56:15,19.98,157.0
30-03-2023 8.42,30-03-2023 8.51,2023-03-30 09:07:50.000000000,16.05,47.0
30-09-2023 03.58,30-09-2023 04.38,2023-09-30 04:45:16,39.58,38.0
2023/05/28 15:28:40,28-05-2023 15.41,2023-05-28 15:52:18,12.65,27.0
23-01-2024 04.58,23-01-2024 05.22,2024-01-23 05:34:11,24.28,38.0
17-05-2023 22.50,17-05-2023 23.15,2023-05-17 23:25:24,24.94,14.0
30-03-2023 19.51,30-03-2023 19.57,2023-03-30 20:10:29.800000000,13.33,12.0
2024-03-07 03:10,,2024-03-07 03:14:08,26.13,44.0
30-11-2023 18.31,30-11-2023 18.57,30-11-2023 19:13:31.883863,26.09,50.0
07-05-2023 01.23,07-05-2023 01.47,07-05-2023 01:56:13.487675,23.62,34.0
15-08-2023 07.02,15-08-2023 07.29,2023-08-15 07:47:51,26.54,23.0
03-06-2023 23.09,03-06-2023 23.34,2023-06-03 23:43:44,25.06,33.0
14-12-2023 05.54,14-12-2023 06.10,2023-12-14 06:16:19,15.25,21.0
20-04-2023 05.11,20-04-2023 05.35,2023-04-20 05:37:08,23.32,47.0
13-04-2023 15.23,13-04-2023 15.48,2023-04-13 15:53:48,,25.0
20-02-2024 20.50,20-02-2024 21.11,2024-02-20 21:29:22,20.93,32.0
27-02-2024 06.05,2024-02-27 06:43,2024-02-27 06:56:26,37.51,72.0
27-12-2023 00.09,27-12-2023 00.37,2023-12-27 00:43:01,27.94,27.0
08-02-2024 21.20,08-02-2024 21.36,2024-02-08 21:55:21,15.64,20.0
14-05-2023 05.51,14-05-2023 06.16,2023-05-14 06:33:49,24.18,21.0
09-10-2023 02.33,09-10-2023 02.59,2023-10-09 03:07:42,26.3,29.0
21-08-2023 05.15,21-08-2023 05.53,21-08-2023 06:17:25.792485,38.38,39.0
,09-09-2023 05.04,2023-09-09 05:12:56,5.72,0.0
30-03-2023 14.12,30-03-2023 14.16,2023-03-30 14:31:50.600000000,15.31,17.0
30-03-2023 5.34,30-03-2023 5.37,2023-03-30 05:38:31.200000000,1.22,50.0
03-02-2024 23.49,04-02-2024 00.16,2024-02-04 00:24:32,27.2,24.0
09-11-2023 01.18,09-11-2023 01.43,2023-11-09 01:53:34,24.88,25.0
09-09-2023 14.27,09-09-2023 14.48,2023-09-09 14:50:56,21.18,36.0
05-05-2023 11.34,05-05-2023 12.04,2023-05-05 12:10:26,30.1,30.0
22-09-2023 17.52,22-09-2023 18.20,2023-09-22 18:28:12,28.15,46.0
14-03-2024 01.50,14-03-2024 02.21,2024-03-14 02:37:49,31.11,33.0
18-03-2024 09.07,18-03-2024 09.35,2024-03-18 09:49:07,28.32,40.0
23-07-2023 10.12,23-07-2023 10.34,2023-07-23 10:43:22,22.52,31.0
21-09-2023 05.40,21-09-2023 06.07,2023-09-21 06:09:52,27.47,32.0
30-03-2023 0.10,30-03-2023 0.17,2023-03-30 00:29:49.600000000,12.76,28.0
10-03-2024 16.51,10-03-2024 17.25,2024-03-10 17:35:34,33.16,37.0
02-07-2023 02.34,02-07-2023 02.58,2023-07-02 03:04:25,24.86,29.0
24-06-2023 03.30,24-06-2023 03.54,2023-06-24 04:01:44,24.34,32.0
03-03-2024 03.37,03-03-2024 04.18,2024-03-03 04:26:41,40.5,
07-04-2023 07.55,07-04-2023 08.17,2023-04-07 08:26:17,21.78,22.0
2024/01/26 19:25:20,26-01-2024 19.48,2024-01-26 19:58:54,23.14,31.0
31-05-2023 04.47,31-05-2023 05.09,2023-05-31 05:19:18,,29.0
30-03-2023 16.45,30-03-2023 16.49,2023-03-30 16:59:53.000000000,10.75,27.0
06-12-2023 10.54,06-12-2023 11.24,2023-12-06 11:41:21,30.38,39.0
09-12-2023 19.54,09-12-2023 20.09,2023-12-09 20:19:44,14.31,27.0
30-03-2023 18.31,30-03-2023 18.37,2023-03-30 18:50:07.200000000,12.72,30.0
29-01-2024 15.38,29-01-2024 16.08,2024-01-29 16:18:29,30.11,43.0
30-03-2023 3.02,30-03-2023 3.04,2023-03-30 03:06:34.200000000,2.32,45.0
15-09-2023 19.25,15-09-2023 19.45,2023-09-15 19:59:57,20.28,24.0
19-07-2023 14.58,19-07-2023 15.12,2023-07-19 15:31:19,13.95,20.0
31-10-2023 08.26,31-10-2023 08.44,2023-10-31 08:48:25,17.83,32.0
02-05-2023 02.42,02-05-2023 03.10,2023-05-02 03:17:52,27.3,39.0
30-03-2023 10.31,30-03-2023 10.35,2023-03-30 10:47:15.199999999,11.87,32.0
05-09-2023 23.49,06-09-2023 00.10,2023-09-06 00:26:18,21.77,46.0
30-03-2023 18.31,30-03-2023 18.32,2023-03-30 18:31:24.000000000,-1.0,30.0
30-03-2023 8.42,30-03-2023 8.43,2023-03-30 09:00:47.600000000,17.01,47.0
30-03-2023 21.09,30-03-2023 21.17,2023-03-30 21:25:57.000000000,8.1,44.0
03-09-2023 03.22,03-09-2023 03.44,2023-09-03 03:57:58,108.32,35.0
01-01-2024 18.42,01-01-2024 18.58,2024-01-01 19:18:13,15.77,19.0
14-09-2023 22.17,14-09-2023 22.26,2023-09-14 22:36:32,9.49,13.0
15-04-2023 03.08,15-04-2023 03.30,2023-04-15 03:37:33,22.24,40.0
19-11-2023 12.19,19-11-2023 12.35,2023-11-19 12:48:05,16.01,31.0
30-03-2023 21.09,30-03-2023 21.19,2023-03-30 21:22:20.400000000,2.49,44.0
01-10-2023 04.03,01-10-2023 04.26,2023-10-01 04:40:14,23.9,
01-04-2023 10.59,01-04-2023 11.29,2023-04-01 11:46:03,29.86,52.0
2024/02/28 00:37:12,28-02-2024 00.57,2024-02-28 01:02:33,20.64,20.0
19-09-2023 15.20,19-09-2023 15.38,2023-09-19 15:52:16,17.8,20.0
01-07-2023 10.11,01-07-2023 10.32,2023-07-01 10:41:14,20.96,40.0
18-05-2023 07.12,18-05-2023 07.32,18-05-2023 07:40:31.298962,19.38,28.0
20-01-2024 11.53,20-01-2024 12.21,2024-01-20 12:25:49,27.79,29.0
27-05-2023 18.55,27-05-2023 19.22,2023-05-27 19:30:35,27.04,58.0
05-07-2023 01.11,05-07-2023 01.32,2023-07-05 01:40:53,21.48,62.0
20-01-2024 17.25,20-01-2024 17.13,2024-01-20 17:32:00,12.39,29.0
15-01-2024 00.11,15-01-2024 00.39,2024-01-15 00:53:00,28.16,
08-02-2024 06.01,08-02-2024 06.22,2024-02-08 06:34:32,21.28,32.0
2023/11/04 02:33:38,04-11-2023 03.02,2023-11-04 03:17:21,28.56,20.0
04-10-2023 00.44,04-10-2023 01.12,2023-10-04 01:20:52,28.42,46.0
24-11-2023 09.36,24-11-2023 10.01,2023-11-24 10:03:55,25.16,43.0
24-02-2024 15.20,24-02-2024 15.46,2024-02-24 16:00:29,26.78,150.0
2023/04/13 08:36:16,13-04-2023 09.01,2023-04-13 09:11:36,25.46,51.0
25-12-2023 17.36,2023-12-25 18:07,2023-12-25 18:16:46,31.41,39.0
09-09-2023 07.15,09-09-2023 07.28,2023-09-09 07:34:08,13.15,15.0
15-06-2023 08.53,15-06-2023 09.17,15-06-2023 09:29:11.474991,24.48,13.0
08-01-2024 19.36,08-01-2024 19.55,2024-01-08 20:02:36,19.19,134.0
22-12-2023 01.13,22-12-2023 01.34,2023-12-22 01:48:17,21.28,27.0
22-08-2023 02.57,22-08-2023 03.15,2023-08-22 03:25:23,18.65,31.0
22-05-2023 05.39,22-05-2023 06.03,2023-05-22 06:17:37,23.59,28.0
14-08-2023 23.20,14-08-2023 23.49,15-08-2023 00:05:32.374356,28.8,32.0
2023/08/13 11:43:19,13-08-2023 12.14,2023-08-13 12:23:51,31.27,59.0
06-08-2023 15.24,06-08-2023 15.42,2023-08-06 15:57:14,18.14,20.0
28-05-2023 10.47,28-05-2023 11.02,2023-05-28 11:21:06,15.45,14.0
30-03-2023 5.34,30-03-2023 5.38,2023-03-30 05:46:16.800000000,7.98,50.0
09-11-2023 09.15,09-11-2023 09.30,2023-11-09 09:42:55,14.48,20.0
10-10-2023 10.48,10-10-2023 11.17,2023-10-10 11:31:16,29.15,37.0
17-03-2024 23.33,17-03-2024 23.51,2024-03-18 00:00:03,17.62,36.0
2023/09/26 07:31:34,26-09-2023 07.47,2023-09-26 07:52:08,15.51,24.0
09-05-2023 10.57,09-05-2023 11.12,2023-05-09 11:19:45,15.5,15.0
29-08-2023 16.16,29-08-2023 16.39,2023-08-29 16:59:24,23.24,33.0
19-04-2023 13.15,19-04-2023 13.30,2023-04-19 13:42:19,15.1,34.0
05-05-2023 11.44,05-05-2023 12.09,2023-05-05 12:11:29,24.8,
12-05-2023 00.28,12-05-2023 00.48,2023-05-12 01:04:56,19.9,34.0
30-03-2023 16.45,30-03-2023 16.53,2023-03-30 17:04:33.200000000,11.42,27.0
2023/05/07 15:49:40,07-05-2023 16.25,2023-05-07 16:43:58,35.87,27.0
12-09-2023 14.41,12-09-2023 15.03,2023-09-12 15:11:56,22.45,41.0
04-04-2023 22.34,04-04-2023 22.46,2023-04-04 22:58:36,11.52,16.0
11-03-2024 05.22,11-03-2024 05.55,2024-03-11 06:01:58,32.71,48.0
31-03-2023 13.53,31-03-2023 14.16,2023-03-31 14:18:47,23.67,38.0
2023/09/14 13:41:29,14-09-2023 14.05,14-09-2023 14:13:04.427517,24.44,38.0
27-08-2023 12.00,27-08-2023 12.16,2023-08-27 12:20:24,16.11,28.0
23-11-2023 05.42,23-11-2023 06.05,2023-11-23 06:18:19,22.89,39.0
11-04-2023 20.18,11-04-2023 20.45,11-04-2023 20:55:50.385358,26.94,37.0
2023/09/06 04:14:41,06-09-2023 04.32,2023-09-06 04:37:24,17.76,28.0
22-02-2024 22.58,22-02-2024 23.16,22-02-2024 23:21:22.577397,18.46,25.0
08-08-2023 21.08,08-08-2023 21.30,08-08-2023 21:48:20.351826,21.48,40.0
30-03-2023 10.31,30-03-2023 10.33,2023-03-30 10:44:15.800000000,10.88,32.0
26-11-2023 22.51,26-11-2023 23.14,2023-11-26 23:17:01,23.56,30.0
30-03-2023 21.09,30-03-2023 21.09,2023-03-30 21:26:28.800000000,16.63,44.0
30-03-2023 21.09,30-03-2023 21.16,2023-03-30 21:23:32.400000000,6.69,44.0
22-06-2023 21.19,22-06-2023 21.44,2023-06-22 21:57:00,24.65,34.0
18-10-2023 05.02,18-10-2023 05.32,2023-10-18 05:42:09,29.56,46.0
24-10-2023 17.30,24-10-2023 17.53,2023-10-24 18:11:18,22.95,38.0
17-06-2023 01.52,2023-06-17 02:06,2023-06-17 02:17:26,13.61,16.0
05-06-2023 22.44,05-06-2023 23.10,2023-06-05 23:22:48,25.95,30.0
30-03-2023 13.55,30-03-2023 14.03,2023-03-30 14:15:31.000000000,11.75,25.0
27-01-2024 05.07,27-01-2024 05.37,27-01-2024 05:50:12.379274,29.38,24.0
16-04-2023 20.18,16-04-2023 20.48,2023-04-16 20:55:25,29.56,50.0
10-06-2023 07.40,10-06-2023 08.08,2023-06-10 08:23:08,27.73,23.0
12-06-2023 03.45,12-06-2023 04.06,2023-06-12 04:12:15,21.21,25.0
16-06-2023 19.40,2023-06-16 19:57,2023-06-16 20:07:15,17.02,
2023/06/28 16:12:24,28-06-2023 16.41,2023-06-28 16:54:41,29.53,32.0
01-04-2023 00.06,01-04-2023 00.29,2023-04-01 00:44:07,22.7,31.0
09-12-2023 03.55,09-12-2023 04.16,2023-12-09 04:23:53,20.24,
30-10-2023 11.50,30-10-2023 12.11,30-10-2023 12:19:23.812060,21.03,31.0
30-03-2023 14.12,30-03-2023 14.19,2023-03-30 14:29:26.000000000,9.9,17.0
24-08-2023 01.23,2023-08-24 01:50,24-08-2023 02:02:17.387697,26.82,41.0
30-03-2023 4.45,30-03-2023 4.46,2023-03-30 04:58:27.600000000,12.41,3.0
2023/04/09 07:22:11,2023-04-09 07:34,2023-04-09 07:38:34,12.08,25.0
25-05-2023 17.26,25-05-2023 17.54,2023-05-25 18:08:03,27.64,46.0
28-02-2024 12.45,28-02-2024 12.57,2024-02-28 13:06:03,11.93,31.0
2023/05/19 14:46:48,19-05-2023 15.21,2023-05-19 15:29:12,34.72,32.0
30-04-2023 15.45,30-04-2023 16.05,2023-04-30 16:13:49,20.07,32.0
09-01-2024 04.18,09-01-2024 04.37,09-01-2024 04:56:30.445376,19.2,27.0
09-10-2023 22.17,09-10-2023 22.43,2023-10-09 22:51:43,26.21,42.0
18-05-2023 19.38,18-05-2023 19.53,2023-05-18 20:01:25,14.64,15.0
13-04-2023 03.37,13-04-2023 03.52,2023-04-13 04:07:28,14.65,21.0
03-11-2023 14.09,03-11-2023 14.30,2023-11-03 14:36:27,20.17,31.0
20-05-2023 13.51,20-05-2023 14.05,2023-05-20 14:26:29,13.62,17.0
27-05-2023 05.19,27-05-2023 05.43,2023-05-27 05:49:37,23.63,156.0
27-03-2024 02.44,27-03-2024 03.21,2024-03-27 03:23:19,36.62,57.0
10-06-2023 22.12,10-06-2023 22.42,2023-06-10 22:59:09,30.29,45.0
06-05-2023 14.28,2023-05-06 15:02,06-05-2023 15:09:39.926835,33.98,38.0
22-12-2023 23.42,23-12-2023 00.03,2023-12-23 00:21:37,20.11,26.0
15-06-2023 10.34,15-06-2023 11.04,2023-06-15 11:06:20,29.66,35.0
02-11-2023 06.13,2023-11-02 06:39,2023-11-02 06:48:50,25.67,33.0
16-09-2023 21.52,16-09-2023 22.11,2023-09-16 22:17:14,19.12,3.0
30-03-2023 17.34,30-03-2023 17.40,2023-03-30 17:45:43.400000000,4.84,16.0
22-03-2024 00.09,22-03-2024 00.22,22-03-2024 00:35:27.711302,,26.0
30-03-2023 14.12,30-03-2023 14.15,2023-03-30 14:26:48.199999999,11.27,17.0
12-10-2023 21.38,12-10-2023 21.56,2023-10-12 22:11:33,18.4,33.0
30-03-2023 8.42,30-03-2023 8.44,2023-03-30 08:54:27.200000000,9.67,47.0
12-12-2023 03.13,2023-12-12 03:49,2023-12-12 04:02:53,36.18,32.0
17-09-2023 05.46,17-09-2023 06.10,2023-09-17 06:21:13,23.74,24.0
30-03-2023 16.45,30-03-2023 16.50,2023-03-30 17:05:38.600000000,15.51,27.0
30-03-2023 3.02,30-03-2023 3.07,2023-03-30 03:17:52.199999999,10.62,45.0
2023/10/24 12:09:52,2023-10-24 12:18,2023-10-24 12:30:18,8.85,31.0
07-10-2023 12.15,07-10-2023 12.46,2023-10-07 12:58:49,31.02,40.0
29-09-2023 23.45,30-09-2023 00.10,2023-09-30 00:19:40,24.7,35.0
22-02-2024 11.24,2024-02-22 11:55,2024-02-22 12:04:51,30.79,50.0
30-03-2023 3.02,30-03-2023 3.08,2023-03-30 03:22:54.000000000,14.65,45.0
13-06-2023 16.34,13-06-2023 17.00,2023-06-13 17:10:57,25.11,45.0
03-12-2023 21.34,03-12-2023 21.48,2023-12-03 21:54:58,14.41,20.0
23-07-2023 22.49,23-07-2023 23.12,2023-07-23 23:29:42,22.59,31.0
11-08-2023 16.30,11-08-2023 17.00,2023-08-11 17:09:37,29.64,34.0
09-01-2024 17.09,09-01-2024 17.35,2024-01-09 17:46:34,25.96,25.0
15-08-2023 19.01,15-08-2023 19.26,2023-08-15 19:44:36,25.13,44.0
14-11-2023 09.37,14-11-2023 10.10,2023-11-14 10:12:11,32.88,63.0
06-10-2023 03.54,06-10-2023 04.22,2023-10-06 04:38:09,27.61,54.0
30-03-2023 17.34,30-03-2023 17.34,2023-03-30 17:51:12.200000000,,16.0
30-03-2023 15.45,30-03-2023 15.55,2023-03-30 16:04:31.600000000,8.71,25.0
27-06-2023 02.09,27-06-2023 02.30,2023-06-27 02:45:25,21.15,36.0
30-03-2023 3.02,30-03-2023 3.04,2023-03-30 03:16:40.800000000,12.43,45.0
02-03-2024 05.48,2024-03-02 06:05,2024-03-02 06:15:12,17.71,30.0
22-02-2024 14.21,22-02-2024 14.35,2024-02-22 14:51:35,13.93,36.0
06-10-2023 12.59,06-10-2023 13.21,2023-10-06 13:30:20,21.97,19.0
01-12-2023 07.31,01-12-2023 07.52,2023-12-01 08:00:46,21.08,32.0
26-09-2023 21.40,26-09-2023 22.04,2023-09-26 22:13:27,24.33,40.0
20-10-2023 10.16,20-10-2023 10.43,2023-10-20 10:56:20,27.05,31.0
13-12-2023 07.27,13-12-2023 07.44,2023-12-13 07:55:14,17.75,31.0
10-08-2023 17.15,10-08-2023 17.49,10-08-2023 17:59:35.033764,33.52,44.0
12-10-2023 04.07,12-10-2023 04.15,2023-10-12 04:23:07,8.15,28.0
24-12-2023 07.16,24-12-2023 07.33,2023-12-24 07:43:15,17.34,22.0
17-12-2023 21.15,17-12-2023 21.38,2023-12-17 21:47:08,23.34,52.0
27-08-2023 02.18,27-08-2023 02.46,2023-08-27 03:01:31,28.58,50.0
29-10-2023 19.31,29-10-2023 19.46,2023-10-29 19:59:02,14.99,20.0
03-09-2023 08.23,03-09-2023 08.48,2023-09-03 09:03:55,24.98,28.0
06-03-2024 07.31,2024-03-06 07:46,2024-03-06 07:49:07,15.2,19.0
2023/09/27 10:06:47,27-09-2023 10.26,2023-09-27 10:36:37,20.06,30.0
30-03-2023 20.49,30-03-2023 20.59,2023-03-30 21:05:38.000000000,5.7,22.0
30-03-2023 18.31,30-03-2023 18.36,2023-03-30 18:58:00.600000000,21.61,30.0
23-08-2023 11.36,23-08-2023 12.04,2023-08-23 12:11:16,28.07,46.0
27-03-2024 13.15,27-03-2024 13.44,2024-03-27 13:58:33,28.41,36.0
29-06-2023 21.09,29-06-2023 21.46,2023-06-29 21:56:54,37.46,53.0
19-09-2023 09.21,19-09-2023 09.53,2023-09-19 09:55:02,31.24,54.0
16-12-2023 14.54,16-12-2023 15.21,2023-12-16 15:23:07,26.4,42.0
08-06-2023 10.54,08-06-2023 11.23,2023-06-08 11:40:12,29.2,166.0
18-07-2023 14.08,18-07-2023 14.26,2023-07-18 14:38:05,18.47,41.0
19-05-2023 03.51,2023-05-19 04:33,2023-05-19 04:40:46,42.06,58.0
20-08-2023 20.32,20-08-2023 20.54,2023-08-20 21:04:07,21.91,32.0
23-04-2023 05.48,23-04-2023 06.03,2023-04-23 06:05:44,14.81,26.0
19-02-2024 02.45,19-02-2024 02.54,2024-02-19 03:05:38,9.13,17.0
27-03-2024 02.49,27-03-2024 03.11,2024-03-27 03:29:17,22.38,33.0
30-03-2023 05.47,30-03-2023 06.04,2023-03-30 06:07:10,16.91,31.0
31-03-2023 15.35,2023-03-31 15:56,2023-03-31 16:11:33,21.44,180.0
30-03-2023 21.09,30-03-2023 21.13,2023-03-30 21:28:34.800000000,14.73,44.0
22-03-2024 04.08,22-03-2024 04.22,2024-03-22 04:30:48,13.17,15.0
21-10-2023 16.37,21-10-2023 17.00,2023-10-21 17:18:47,22.24,13.0
20-10-2023 15.01,2023-10-20 15:21,2023-10-20 15:28:17,,22.0
17-11-2023 17.37,17-11-2023 18.08,2023-11-17 18:21:01,31.0,53.0
02-12-2023 08.27,02-12-2023 08.52,2023-12-02 09:13:06,24.87,43.0
27-07-2023 16.03,27-07-2023 16.28,2023-07-27 16:44:44,24.89,
15-09-2023 14.05,15-09-2023 14.31,2023-09-15 14:48:40,26.87,32.0
30-03-2023 16.45,30-03-2023 16.46,2023-03-30 16:48:47.000000000,2.65,27.0
30-03-2023 5.34,30-03-2023 5.40,2023-03-30 05:49:10.800000000,8.88,50.0
25-07-2023 02.41,25-07-2023 02.59,2023-07-25 03:05:49,17.64,16.0
06-11-2023 07.20,06-11-2023 07.47,2023-11-06 07:58:59,26.54,45.0
01-11-2023 23.24,01-11-2023 23.48,02-11-2023 00:04:13.472608,23.78,50.0
25-08-2023 21.54,25-08-2023 22.19,2023-08-25 22:25:48,24.48,35.0
2023/07/15 14:13:19,15-07-2023 14.30,2023-07-15 14:38:09,16.79,
02-06-2023 16.44,02-06-2023 17.02,2023-06-02 17:18:47,17.53,
15-11-2023 18.15,15-11-2023 18.46,2023-11-15 19:01:38,30.93,36.0
2023/05/05 04:46:54,05-05-2023 05.14,05-05-2023 05:30:27.472799,27.19,41.0
27-04-2023 13.42,27-04-2023 14.12,2023-04-27 14:24:25,29.97,36.0
30-03-2023 16.45,30-03-2023 16.52,2023-03-30 17:05:27.200000000,13.32,27.0
19-06-2023 00.28,19-06-2023 00.51,2023-06-19 00:53:51,23.76,35.0
19-05-2023 11.33,19-05-2023 11.47,2023-05-19 11:56:46,13.64,29.0
15-07-2023 16.32,15-07-2023 16.57,2023-07-15 17:10:51,25.31,46.0
23-07-2023 22.39,23-07-2023 23.07,2023-07-23 23:19:19,27.96,25.0
26-12-2023 20.21,26-12-2023 20.47,2023-12-26 20:49:25,25.55,32.0
25-05-2023 01.00,25-05-2023 01.13,2023-05-25 01:15:57,12.68,16.0
25-08-2023 16.39,25-08-2023 16.53,2023-08-25 17:01:50,14.13,17.0
31-03-2023 23.43,31-03-2023 23.57,2023-04-01 00:07:39,13.92,19.0
30-03-2023 18.35,30-03-2023 18.31,2023-03-30 18:55:15.600000000,19.86,30.0
15-03-2024 02.17,15-03-2024 02.43,2024-03-15 02:54:13,26.02,30.0
01-07-2023 03.36,01-07-2023 03.48,2023-07-01 03:57:39,,3.0
05-03-2024 14.25,05-03-2024 14.41,2024-03-05 14:56:44,15.68,30.0
02-07-2023 01.30,02-07-2023 01.52,2023-07-02 01:54:30,22.18,42.0
05-03-2024 11.35,05-03-2024 11.43,2024-03-05 11:49:57,8.26,13.0
25-08-2023 08.06,25-08-2023 08.38,2023-08-25 08:54:03,31.19,19.0
20-04-2023 20.13,20-04-2023 20.26,2023-04-20 20:42:19,12.8,42.0
25-06-2023 00.00,25-06-2023 00.23,2023-06-25 00:31:03,23.13,37.0
27-06-2023 18.57,27-06-2023 19.15,2023-06-27 19:27:55,18.37,37.0
27-10-2023 09.32,27-10-2023 10.05,2023-10-27 10:19:42,32.25,40.0
02-03-2024 17.11,02-03-2024 17.34,2024-03-02 17:44:27,23.38,39.0
28-07-2023 17.14,28-07-2023 17.30,2023-07-28 17:40:02,16.63,20.0
16-04-2023 07.04,16-04-2023 07.40,2023-04-16 07:48:14,35.98,54.0
17-03-2024 20.37,17-03-2024 20.51,2024-03-17 21:07:18,14.1,27.0
05-03-2024 12.04,05-03-2024 12.26,2024-03-05 12:38:11,21.21,24.0
28-08-2023 22.37,28-08-2023 22.50,2023-08-28 23:12:04,13.2,
30-03-2023 21.09,30-03-2023 21.15,2023-03-30 21:29:53.400000000,14.04,44.0
30-03-2023 3.02,30-03-2023 3.12,2023-03-30 03:12:39.000000000,,45.0
04-01-2024 04.52,04-01-2024 05.34,2024-01-04 05:37:47,41.41,50.0
18-03-2024 17.10,18-03-2024 17.31,2024-03-18 17:33:46,21.69,41.0
08-03-2024 23.39,09-03-2024 00.01,2024-03-09 00:10:01,21.53,45.0
06-06-2023 03.19,06-06-2023 03.43,2023-06-06 03:49:18,23.61,29.0
30-09-2023 12.22,30-09-2023 12.40,2023-09-30 12:56:33,18.16,16.0
27-07-2023 18.19,27-07-2023 18.39,2023-07-27 18:45:03,19.71,29.0
24-10-2023 22.53,24-10-2023 23.13,2023-10-24 23:22:51,19.97,26.0
08-09-2023 10.30,2023-09-08 10:49,2023-09-08 11:04:23,18.96,21.0
30-03-2023 8.42,30-03-2023 8.44,2023-03-30 08:53:34.400000000,8.79,47.0
2023/07/27 02:00:52,27-07-2023 02.32,2023-07-27 02:42:51,31.42,59.0
2024/01/04 13:20:39,04-01-2024 13.35,2024-01-04 13:50:08,14.51,14.0
04-07-2023 15.52,04-07-2023 16.09,2023-07-04 16:24:20,17.26,38.0
13-07-2023 01.22,13-07-2023 01.50,2023-07-13 02:00:38,28.21,21.0
30-03-2023 5.34,30-03-2023 5.37,2023-03-30 05:48:51.000000000,11.55,50.0
16-06-2023 22.41,16-06-2023 23.03,2023-06-16 23:10:02,22.12,42.0
28-08-2023 04.21,28-08-2023 04.22,2023-08-28 04:30:51,0.5,14.0
30-06-2023 22.01,30-06-2023 22.24,2023-06-30 22:37:33,23.09,28.0
28-07-2023 00.16,28-07-2023 00.41,2023-07-28 00:47:55,24.62,49.0
08-08-2023 02.47,08-08-2023 03.12,2023-08-08 03:22:59,25.09,32.0
07-02-2024 23.24,07-02-2024 23.43,2024-02-07 23:59:37,19.81,19.0
08-05-2023 05.00,08-05-2023 05.20,2023-05-08 05:34:16,19.89,132.0
08-04-2023 01.13,08-04-2023 01.42,2023-04-08 01:54:57,29.4,29.0
21-02-2024 21.50,21-02-2024 22.19,2024-02-21 22:34:02,28.83,52.0
27-07-2023 13.10,27-07-2023 13.46,27-07-2023 13:52:01.565985,36.28,36.0
16-05-2023 01.07,16-05-2023 01.31,2023-05-16 01:41:28,23.57,39.0
2023-11-03 05:46,03-11-2023 05.23,2023-11-03 05:57:22,23.66,15.0
12-07-2023 16.02,12-07-2023 16.34,2023-07-12 16:43:57,32.34,44.0
07-06-2023 06.32,07-06-2023 06.33,2023-06-07 06:44:46,1.46,
27-12-2023 07.43,27-12-2023 08.03,2023-12-27 08:12:27,19.72,25.0
26-06-2023 22.04,26-06-2023 22.22,2023-06-26 22:36:52,18.35,31.0
12-08-2023 05.23,12-08-2023 05.44,2023-08-12 05:56:07,21.15,36.0
30-03-2023 1.58,30-03-2023 1.58,2023-03-30 02:17:03.400000000,18.44,27.0
06-01-2024 12.01,06-01-2024 12.27,2024-01-06 12:36:24,26.32,22.0
2023/12/24 04:47:57,24-12-2023 05.04,2023-12-24 05:23:26,17.01,28.0
13-09-2023 07.32,13-09-2023 08.00,2023-09-13 08:10:04,27.87,29.0
30-03-2023 8.42,30-03-2023 8.48,2023-03-30 08:46:56.600000000,-1.84,47.0
05-02-2024 06.16,05-02-2024 06.33,2024-02-05 06:39:36,17.55,23.0
27-08-2023 12.34,27-08-2023 12.58,2023-08-27 13:08:17,24.71,35.0
25-05-2023 07.41,25-05-2023 08.00,25-05-2023 08:19:24.518935,19.15,28.0
20-06-2023 18.02,20-06-2023 18.27,2023-06-20 18:35:06,24.38,53.0
05-03-2024 10.06,05-03-2024 10.24,2024-03-05 10:35:03,17.62,29.0
30-03-2023 10.31,30-03-2023 10.41,2023-03-30 10:51:06.800000000,9.73,32.0
06-06-2023 19.41,06-06-2023 20.18,2023-06-06 20:31:30,36.77,53.0
26-03-2024 02.27,26-03-2024 02.51,2024-03-26 03:00:44,23.97,46.0
07-02-2024 04.46,07-02-2024 05.08,2024-02-07 05:21:33,,36.0
18-02-2024 22.00,18-02-2024 22.08,2024-02-18 22:13:28,7.99,12.0
03-12-2023 11.13,03-12-2023 11.30,2023-12-03 11:44:07,17.26,
2023/11/03 01:20:33,03-11-2023 01.50,2023-11-03 01:54:13,29.97,21.0
16-01-2024 05.16,16-01-2024 05.35,2024-01-16 05:47:22,19.18,37.0
30-03-2023 13.55,30-03-2023 13.57,2023-03-30 14:02:13.600000000,4.46,25.0
28-11-2023 15.22,28-11-2023 15.52,2023-11-28 15:54:42,29.85,39.0
25-07-2023 02.48,25-07-2023 03.08,2023-07-25 03:14:46,19.3,11.0
08-08-2023 09.10,08-08-2023 09.16,08-08-2023 09:21:59.326806,5.42,13.0
30-03-2023 20.49,30-03-2023 20.49,2023-03-30 20:56:26.000000000,6.5,22.0
2024/03/08 00:30:25,08-03-2024 00.49,2024-03-08 01:00:17,18.89,32.0
25-07-2023 00.28,25-07-2023 00.55,2023-07-25 01:01:06,26.89,43.0
16-10-2023 13.43,16-10-2023 14.03,2023-10-16 14:16:39,19.25,25.0
22-08-2023 12.17,22-08-2023 12.42,2023-08-22 12:50:52,25.13,41.0
04-11-2023 13.49,04-11-2023 14.11,2023-11-04 14:26:11,21.98,32.0
21-11-2023 12.19,21-11-2023 12.47,2023-11-21 12:54:16,28.03,43.0
,18-06-2023 03.53,2023-06-18 04:08:25,12.16,9.0
21-11-2023 22.17,21-11-2023 22.41,2023-11-21 22:50:57,24.17,29.0
14-07-2023 19.17,14-07-2023 19.29,14-07-2023 19:36:15.761795,11.8,23.0
24-04-2023 01.17,24-04-2023 01.48,2023-04-24 01:56:46,31.5,31.0
01-12-2023 05.38,01-12-2023 05.56,2023-12-01 06:07:19,18.14,40.0
14-04-2023 12.55,2023-04-14 13:22,2023-04-14 13:26:14,26.79,23.0
26-05-2023 20.53,2023-05-26 21:19,2023-05-26 21:34:25,26.03,23.0
03-12-2023 10.57,03-12-2023 11.24,2023-12-03 11:38:57,26.69,29.0
30-03-2023 13.55,30-03-2023 13.57,2023-03-30 14:07:27.400000000,9.69,25.0
06-07-2023 18.42,06-07-2023 18.58,06-07-2023 19:09:38.266129,15.71,17.0
31-03-2023 11.14,31-03-2023 11.44,2023-03-31 11:56:31,30.75,28.0
18-08-2023 06.26,2023-08-18 06:48,2023-08-18 06:51:52,22.53,35.0
24-10-2023 00.47,24-10-2023 01.21,2023-10-24 01:32:21,34.42,46.0
09-08-2023 01.38,2023-08-09 01:54,2023-08-09 01:57:11,15.34,32.0
08-08-2023 16.52,08-08-2023 17.04,08-08-2023 17:11:12.594725,12.71,14.0
04-02-2024 11.58,04-02-2024 12.13,2024-02-04 12:19:04,15.07,28.0
18-11-2023 10.08,18-11-2023 10.35,2023-11-18 10:46:25,27.15,41.0
23-09-2023 18.41,23-09-2023 18.52,2023-09-23 19:02:00,11.66,14.0
31-07-2023 17.52,31-07-2023 18.14,2023-07-31 18:20:34,22.45,210.0
17-04-2023 21.29,17-04-2023 21.56,2023-04-17 22:03:19,26.63,24.0
23-11-2023 04.14,23-11-2023 04.46,2023-11-23 05:01:15,32.51,54.0
16-11-2023 23.40,17-11-2023 00.11,2023-11-17 00:20:56,30.72,38.0
30-03-2023 3.02,30-03-2023 3.02,2023-03-30 03:13:24.600000000,11.16,45.0
31-05-2023 20.22,31-05-2023 20.46,2023-05-31 20:54:45,23.15,27.0
05-01-2024 21.58,05-01-2024 22.30,2024-01-05 22:39:02,31.37,36.0
28-03-2024 02.58,2024-03-28 03:25,2024-03-28 03:36:38,27.27,36.0
09-10-2023 14.49,09-10-2023 15.10,2023-10-09 15:21:03,20.66,157.0
03-11-2023 10.49,03-11-2023 11.12,2023-11-03 11:30:33,23.05,32.0
10-04-2023 07.40,10-04-2023 07.53,2023-04-10 08:12:45,12.42,18.0
30-03-2023 2.36,30-03-2023 2.42,2023-03-30 02:50:25.799999999,8.28,17.0
2024/03/20 00:42:30,20-03-2024 01.01,2024-03-20 01:03:40,19.16,206.0
2024/03/03 01:35:37,03-03-2024 01.52,2024-03-03 02:04:03,17.13,27.0
28-12-2023 20.29,2023-12-28 20:59,2023-12-28 21:19:17,29.42,27.0
24-08-2023 05.33,24-08-2023 06.00,2023-08-24 06:21:09,27.36,42.0
,29-11-2023 00.32,2023-11-29 00:39:02,21.55,36.0
17-02-2024 14.27,17-02-2024 14.51,2024-02-17 15:01:46,24.02,32.0
2024/03/18 00:46:11,18-03-2024 01.09,18-03-2024 01:17:33.857972,23.67,29.0
06-10-2023 01.15,06-10-2023 01.34,2023-10-06 01:42:03,18.79,45.0
18-11-2023 22.21,18-11-2023 22.44,2023-11-18 22:46:48,23.74,38.0
27-02-2024 08.33,27-02-2024 08.50,2024-02-27 09:00:22,16.71,13.0
,14-02-2024 08.42,2024-02-14 08:47:07,24.21,43.0
30-03-2023 3.02,30-03-2023 3.02,2023-03-30 03:06:43.800000000,4.48,45.0
10-11-2023 20.06,10-11-2023 20.42,2023-11-10 20:51:49,35.66,41.0
28-08-2023 05.54,28-08-2023 06.17,2023-08-28 06:19:23,23.04,38.0
08-04-2023 16.59,08-04-2023 17.13,2023-04-08 17:30:57,13.94,23.0
23-07-2023 07.42,23-07-2023 07.56,2023-07-23 08:05:58,14.43,39.0
2024/01/14 18:08:06,14-01-2024 18.19,2024-01-14 18:34:35,11.28,7.0
14-12-2023 02.55,14-12-2023 03.13,2023-12-14 03:23:01,17.36,33.0
01-03-2024 12.33,01-03-2024 12.55,2024-03-01 13:08:29,22.59,37.0
2023/11/29 15:08:49,29-11-2023 15.30,2023-11-29 15:37:31,21.92,30.0
11-06-2023 17.30,11-06-2023 18.02,2023-06-11 18:15:18,32.51,43.0
17-03-2024 07.01,17-03-2024 07.28,2024-03-17 07:43:53,26.54,38.0
23-03-2024 15.57,23-03-2024 16.22,2024-03-23 16:36:26,24.7,27.0
27-12-2023 00.00,27-12-2023 00.20,2023-12-27 00:24:35,19.96,24.0
2024/02/01 19:11:34,01-02-2024 19.29,2024-02-01 19:35:54,17.52,
29-12-2023 05.39,29-12-2023 06.16,2023-12-29 06:33:29,36.62,43.0
31-05-2023 04.21,31-05-2023 04.51,2023-05-31 04:59:45,30.17,39.0
01-03-2024 00.23,01-03-2024 00.45,2024-03-01 00:58:42,22.9,31.0
25-02-2024 03.12,25-02-2024 03.35,2024-02-25 03:37:46,,31.0
22-09-2023 11.21,22-09-2023 11.47,2023-09-22 12:00:00,26.25,39.0
30-03-2023 18.31,30-03-2023 18.35,2023-03-30 18:42:41.400000000,7.29,30.0
25-03-2024 00.58,2024-03-25 01:28,2024-03-25 01:43:30,30.28,52.0
17-07-2023 14.32,17-07-2023 15.06,2023-07-17 15:08:45,33.73,47.0
28-09-2023 21.19,28-09-2023 21.35,2023-09-28 21:42:05,50.47,33.0
01-08-2023 14.43,01-08-2023 14.57,2023-08-01 14:59:05,14.04,133.0
01-06-2023 17.06,01-06-2023 17.32,2023-06-01 17:34:23,25.67,39.0
20-08-2023 20.14,20-08-2023 20.37,2023-08-20 20:50:48,23.18,16.0
16-06-2023 07.55,2023-06-16 08:22,2023-06-16 08:38:16,26.83,37.0
2023/07/19 16:20:48,19-07-2023 16.54,2023-07-19 17:09:41,34.06,49.0
13-10-2023 10.04,13-10-2023 10.21,2023-10-13 10:25:06,16.76,18.0
30-03-2023 20.49,30-03-2023 20.58,2023-03-30 21:08:18.800000000,9.38,22.0
25-11-2023 21.43,25-11-2023 21.59,2023-11-25 22:12:49,15.83,17.0
10-06-2023 15.01,10-06-2023 15.19,2023-06-10 15:27:39,17.9,25.0
05-10-2023 19.59,05-10-2023 20.30,2023-10-05 20:46:13,30.81,39.0
15-04-2023 11.52,15-04-2023 12.25,2023-04-15 12:34:48,32.74,35.0
24-10-2023 11.59,2023-10-24 12:15,2023-10-24 12:32:22,16.14,20.0
23-05-2023 23.25,23-05-2023 23.54,2023-05-24 00:05:03,29.11,220.0
30-03-2023 1.58,30-03-2023 1.59,2023-03-30 02:07:57.400000000,8.34,27.0
19-11-2023 12.41,19-11-2023 13.05,2023-11-19 13:13:24,23.79,33.0
26-09-2023 08.09,26-09-2023 08.34,2023-09-26 08:43:21,24.63,34.0
08-01-2024 12.23,08-01-2024 13.08,2024-01-08 13:22:38,45.58,57.0
19-04-2023 06.56,2023-04-19 07:26,2023-04-19 07:34:30,30.44,36.0
04-01-2024 13.31,04-01-2024 13.50,2024-01-04 13:58:32,97.65,22.0
2024/03/11 20:13:44,11-03-2024 20.33,2024-03-11 20:47:55,19.9,45.0
01-04-2023 17.55,01-04-2023 18.24,01-04-2023 18:31:55.569313,28.56,43.0
17-06-2023 21.21,17-06-2023 21.56,2023-06-17 22:16:06,35.46,56.0
10-08-2023 05.58,10-08-2023 06.24,10-08-2023 06:26:53.803322,26.06,42.0
11-07-2023 12.30,11-07-2023 12.58,2023-07-11 13:21:06,28.09,23.0
05-10-2023 07.59,05-10-2023 08.31,2023-10-05 08:34:16,32.01,32.0
01-05-2023 18.12,01-05-2023 18.26,2023-05-01 18:38:02,13.38,25.0
2024/02/13 11:22:00,13-02-2024 11.38,2024-02-13 11:55:35,16.96,31.0
17-11-2023 23.33,17-11-2023 23.52,2023-11-18 00:06:37,18.72,39.0
28-09-2023 22.45,28-09-2023 23.03,2023-09-28 23:07:24,18.28,18.0
05-04-2023 15.15,05-04-2023 15.42,2023-04-05 15:54:01,27.78,36.0
01-06-2023 03.00,01-06-2023 03.28,2023-06-01 03:35:25,27.82,47.0
03-10-2023 19.54,03-10-2023 20.17,2023-10-03 20:27:15,22.76,127.0
08-05-2023 21.28,08-05-2023 21.52,2023-05-08 22:02:28,23.39,33.0
23-05-2023 12.41,23-05-2023 13.02,2023-05-23 13:15:55,20.97,31.0
17-01-2024 13.45,17-01-2024 14.03,2024-01-17 14:16:50,18.01,27.0
02-06-2023 07.08,02-06-2023 07.29,02-06-2023 07:36:50.292950,125.61,23.0
11-03-2024 20.26,11-03-2024 20.50,2024-03-11 20:58:02,24.15,47.0
30-07-2023 18.01,30-07-2023 18.22,2023-07-30 18:33:36,20.83,38.0
30-03-2023 1.58,30-03-2023 1.58,2023-03-30 02:07:43.000000000,9.1,27.0
06-06-2023 03.35,06-06-2023 03.58,2023-06-06 04:07:38,22.99,40.0
09-11-2023 06.11,09-11-2023 06.41,2023-11-09 06:56:56,30.53,49.0
13-07-2023 15.34,13-07-2023 15.48,2023-07-13 15:54:48,13.91,37.0
01-03-2024 00.17,01-03-2024 00.30,2024-03-01 00:37:41,12.19,40.0
27-06-2023 19.42,27-06-2023 20.00,27-06-2023 20:02:49.658849,18.22,37.0
30-03-2023 13.55,30-03-2023 13.57,2023-03-30 14:09:03.400000000,11.29,25.0
28-04-2023 00.38,28-04-2023 01.06,2023-04-28 01:12:43,28.69,53.0
15-05-2023 22.36,15-05-2023 23.00,2023-05-15 23:08:17,24.75,42.0
09-05-2023 19.55,2023-05-09 20:16,2023-05-09 20:30:41,20.56,30.0
16-09-2023 16.41,16-09-2023 17.10,2023-09-16 17:28:47,28.91,60.0
19-08-2023 07.35,19-08-2023 07.52,2023-08-19 08:06:07,17.06,17.0
31-08-2023 07.53,31-08-2023 08.08,2023-08-31 08:29:43,14.68,24.0
17-02-2024 03.17,17-02-2024 03.44,2024-02-17 03:46:12,26.29,32.0
13-04-2023 22.51,13-04-2023 23.22,2023-04-13 23:38:36,31.23,62.0
14-07-2023 13.09,14-07-2023 13.33,2023-07-14 13:44:23,24.03,36.0
15-02-2024 08.21,15-02-2024 08.46,2024-02-15 08:52:22,24.58,24.0
18-02-2024 20.16,2024-02-18 20:36,2024-02-18 20:52:08,20.56,21.0
05-10-2023 23.22,2023-10-05 23:35,2023-10-05 23:49:27,13.46,29.0
29-05-2023 09.50,29-05-2023 10.11,2023-05-29 10:25:12,21.25,31.0
18-01-2024 06.23,18-01-2024 06.56,2024-01-18 07:09:44,32.91,53.0
08-04-2023 01.56,08-04-2023 02.08,2023-04-08 02:24:27,11.93,22.0
30-03-2023 19.51,30-03-2023 19.57,2023-03-30 20:13:29.200000000,16.32,12.0
30-03-2023 5.34,30-03-2023 5.37,2023-03-30 05:46:46.800000000,9.48,50.0
16-11-2023 09.47,16-11-2023 10.05,2023-11-16 10:22:15,18.57,26.0
30-03-2023 12.33,30-03-2023 12.37,2023-03-30 12:43:26.800000000,6.33,40.0
06-08-2023 11.33,06-08-2023 11.47,2023-08-06 11:49:10,13.55,234.0
2023/05/08 15:17:24,08-05-2023 16.00,2023-05-08 16:12:03,43.07,60.0
23-08-2023 23.03,23-08-2023 23.23,2023-08-23 23:45:14,20.26,14.0
25-09-2023 07.59,2023-09-25 08:22,2023-09-25 08:30:58,23.0,22.0
08-03-2024 00.32,08-03-2024 00.57,2024-03-08 01:06:14,25.1,38.0
03-01-2024 12.02,03-01-2024 12.25,2024-01-03 12:30:00,22.95,45.0
06-06-2023 21.17,06-06-2023 21.35,2023-06-06 21:47:51,18.0,38.0
30-03-2023 16.45,30-03-2023 16.48,2023-03-30 16:57:35.600000000,9.46,27.0
17-08-2023 16.23,17-08-2023 16.43,2023-08-17 16:53:04,91.99,41.0
06-07-2023 20.00,06-07-2023 20.24,2023-07-06 20:35:00,23.23,48.0
23-12-2023 05.49,23-12-2023 06.07,2023-12-23 06:22:15,18.04,22.0
2023/07/11 07:04:02,11-07-2023 07.23,2023-07-11 07:28:36,19.8,35.0
17-02-2024 00.57,17-02-2024 01.13,2024-02-17 01:20:29,15.58,24.0
21-07-2023 00.00,21-07-2023 00.18,2023-07-21 00:23:32,17.54,19.0
08-04-2023 04.57,08-04-2023 05.20,2023-04-08 05:28:35,22.84,25.0
30-03-2023 12.33,30-03-2023 12.36,2023-03-30 12:46:46.600000000,10.66,40.0
11-11-2023 04.51,11-11-2023 05.14,2023-11-11 05:27:11,22.63,32.0
28-07-2023 16.13,28-07-2023 16.32,2023-07-28 16:38:49,18.83,31.0
08-01-2024 06.01,08-01-2024 06.21,2024-01-08 06:28:52,19.83,27.0
03-08-2023 11.26,03-08-2023 11.49,2023-08-03 12:00:59,23.21,32.0
18-07-2023 03.37,18-07-2023 04.01,2023-07-18 04:11:33,23.67,21.0
04-05-2023 02.47,04-05-2023 03.15,2023-05-04 03:34:13,27.63,24.0
23-01-2024 06.21,23-01-2024 06.51,2024-01-23 07:03:36,30.3,25.0
17-10-2023 13.06,17-10-2023 13.19,2023-10-17 13:27:37,13.2,17.0
07-11-2023 05.19,07-11-2023 05.43,2023-11-07 05:45:42,24.33,29.0
28-02-2024 05.43,28-02-2024 06.03,2024-02-28 06:17:06,20.46,29.0
11-06-2023 16.31,11-06-2023 16.54,2023-06-11 17:04:37,23.45,40.0
30-05-2023 23.36,30-05-2023 23.55,2023-05-31 00:15:42,18.29,36.0
2024/01/03 03:26:06,03-01-2024 03.38,2024-01-03 03:55:52,12.75,26.0
03-08-2023 07.41,03-08-2023 07.50,2023-08-03 07:54:33,8.93,0.0
27-06-2023 08.18,27-06-2023 08.48,2023-06-27 08:55:42,30.03,37.0
30-03-2023 12.33,30-03-2023 12.34,2023-03-30 12:49:01.000000000,14.9,40.0
26-08-2023 08.13,26-08-2023 08.35,2023-08-26 08:46:36,21.88,28.0
2024/03/07 16:02:49,07-03-2024 16.30,2024-03-07 16:44:10,27.24,13.0
02-01-2024 20.08,02-01-2024 20.28,2024-01-02 20:38:09,20.06,29.0
12-12-2023 17.35,12-12-2023 17.58,2023-12-12 18:12:01,23.42,29.0
05-05-2023 22.37,05-05-2023 22.56,2023-05-05 23:06:49,18.87,10.0
24-07-2023 23.40,24-07-2023 23.57,2023-07-25 00:05:01,16.93,19.0
15-07-2023 07.15,15-07-2023 07.26,2023-07-15 07:36:29,10.71,19.0
25-01-2024 00.13,25-01-2024 00.37,2024-01-25 00:50:15,24.3,141.0
29-06-2023 04.38,29-06-2023 04.55,2023-06-29 05:04:38,16.76,37.0
09-04-2023 21.31,09-04-2023 21.56,2023-04-09 22:01:26,25.72,32.0
16-09-2023 11.27,16-09-2023 11.48,2023-09-16 12:00:19,21.39,31.0
2024/02/05 10:23:53,05-02-2024 10.50,2024-02-05 10:59:25,26.92,40.0
03-02-2024 16.04,2024-02-03 16:28,2024-02-03 16:39:24,23.8,37.0
30-03-2023 0.10,30-03-2023 0.12,2023-03-30 00:31:58.600000000,19.91,28.0
24-09-2023 19.01,24-09-2023 19.26,2023-09-24 19:44:34,25.35,47.0
19-08-2023 09.06,19-08-2023 09.27,2023-08-19 09:42:27,,33.0
30-03-2023 20.49,30-03-2023 20.59,2023-03-30 21:12:42.800000000,12.78,22.0
15-03-2024 20.55,15-03-2024 21.26,2024-03-15 21:37:56,30.73,50.0
02-05-2023 00.08,02-05-2023 00.42,2023-05-02 00:51:07,33.85,47.0
21-05-2023 18.11,21-05-2023 18.40,2023-05-21 18:47:29,28.39,36.0
18-06-2023 22.35,18-06-2023 23.00,2023-06-18 23:16:37,25.49,39.0
2024/02/07 03:17:20,07-02-2024 03.45,2024-02-07 03:53:30,27.67,48.0
11-04-2023 00.41,11-04-2023 00.58,2023-04-11 01:06:45,,20.0
26-01-2024 15.31,26-01-2024 16.07,2024-01-26 16:22:57,35.86,58.0
09-11-2023 23.01,09-11-2023 23.38,09-11-2023 23:51:11.931781,36.56,53.0
27-08-2023 11.33,27-08-2023 11.55,27-08-2023 12:03:17.766143,22.19,27.0
18-08-2023 13.39,18-08-2023 14.03,2023-08-18 14:13:16,23.82,36.0
10-04-2023 10.12,10-04-2023 10.21,2023-04-10 10:30:09,8.74,
12-01-2024 15.01,12-01-2024 15.23,2024-01-12 15:39:25,21.95,27.0
20-03-2024 16.22,20-03-2024 16.47,2024-03-20 16:52:37,25.34,44.0
03-07-2023 00.49,03-07-2023 01.17,2023-07-03 01:29:31,28.22,56.0
27-04-2023 06.30,27-04-2023 06.58,2023-04-27 07:01:35,27.77,34.0
23-05-2023 11.01,23-05-2023 11.36,2023-05-23 11:43:22,34.8,43.0
30-03-2023 13.55,30-03-2023 14.05,2023-03-30 14:10:41.799999999,4.93,25.0
30-03-2023 17.04,30-03-2023 17.29,2023-03-30 17:38:27,25.74,52.0
25-06-2023 01.53,25-06-2023 02.20,2023-06-25 02:33:19,27.33,27.0
02-12-2023 14.10,02-12-2023 14.41,2023-12-02 14:47:37,30.98,54.0
16-04-2023 08.02,16-04-2023 08.21,2023-04-16 08:30:30,19.21,34.0
01-08-2023 14.38,01-08-2023 15.06,2023-08-01 15:16:40,28.06,48.0
01-03-2024 14.50,01-03-2024 15.09,2024-03-01 15:17:39,19.3,23.0
07-05-2023 07.47,07-05-2023 08.04,2023-05-07 08:12:25,16.89,12.0
18-10-2023 07.42,18-10-2023 08.09,2023-10-18 08:20:04,27.3,22.0
06-01-2024 09.57,06-01-2024 10.13,2024-01-06 10:25:07,16.33,19.0
30-03-2023 3.02,30-03-2023 3.09,2023-03-30 03:30:25.200000000,21.17,45.0
25-09-2023 01.53,25-09-2023 02.12,2023-09-25 02:24:55,18.97,25.0
04-09-2023 01.13,04-09-2023 01.42,2023-09-04 01:55:24,28.57,29.0
02-11-2023 00.34,02-11-2023 00.43,2023-11-02 01:05:00,8.69,0.0
02-06-2023 11.46,02-06-2023 12.01,02-06-2023 12:05:34.647450,14.97,27.0
02-05-2023 11.38,02-05-2023 11.57,2023-05-02 12:15:40,19.14,25.0
30-03-2023 5.34,30-03-2023 5.39,2023-03-30 05:43:20.400000000,4.04,50.0
15-05-2023 00.09,15-05-2023 00.30,2023-05-15 00:39:49,20.83,27.0
16-04-2023 06.04,16-04-2023 06.31,2023-04-16 06:38:24,26.94,55.0
2023/09/15 08:07:33,15-09-2023 08.42,2023-09-15 08:46:34,34.58,38.0
11-06-2023 21.13,11-06-2023 21.44,2023-06-11 21:56:14,30.55,47.0
01-04-2023 17.43,01-04-2023 18.10,2023-04-01 18:21:52,27.33,39.0
2023/12/13 11:02:45,13-12-2023 11.28,2023-12-13 11:42:40,25.81,34.0
30-03-2023 12.33,30-03-2023 12.42,2023-03-30 12:47:44.200000000,5.62,40.0
30-07-2023 16.39,30-07-2023 16.57,2023-07-30 17:07:24,17.82,46.0
06-09-2023 12.53,06-09-2023 13.12,06-09-2023 13:23:13.883689,19.22,34.0
02-08-2023 01.21,02-08-2023 01.45,2023-08-02 01:47:09,23.35,32.0
03-03-2024 14.20,03-03-2024 14.42,2024-03-03 14:50:33,22.26,19.0
17-01-2024 11.13,17-01-2024 11.32,2024-01-17 11:40:32,19.67,30.0
07-09-2023 09.23,07-09-2023 09.53,2023-09-07 10:07:44,29.93,46.0
02-12-2023 05.12,02-12-2023 05.28,2023-12-02 05:33:23,16.14,5.0
02-08-2023 11.59,02-08-2023 12.19,2023-08-02 12:32:30,19.46,25.0
09-11-2023 08.07,09-11-2023 08.27,2023-11-09 08:33:43,20.26,38.0
06-09-2023 06.06,06-09-2023 06.38,2023-09-06 06:48:27,31.62,51.0
10-08-2023 08.52,10-08-2023 09.08,2023-08-10 09:19:27,15.88,23.0
21-08-2023 16.56,21-08-2023 17.16,2023-08-21 17:27:12,19.25,22.0
30-03-2023 10.31,30-03-2023 10.35,2023-03-30 10:41:16.400000000,5.89,32.0
30-03-2023 20.49,30-03-2023 20.54,2023-03-30 21:07:36.800000000,12.68,22.0
14-01-2024 08.58,14-01-2024 09.27,2024-01-14 09:46:55,29.92,48.0
25-08-2023 21.44,25-08-2023 22.02,2023-08-25 22:07:51,18.61,29.0
29-05-2023 00.07,29-05-2023 00.22,2023-05-29 00:33:51,14.74,33.0
10-01-2024 10.13,10-01-2024 10.43,2024-01-10 10:45:19,30.33,31.0
22-05-2023 10.56,22-05-2023 11.19,2023-05-22 11:33:23,22.59,29.0
03-03-2024 17.11,03-03-2024 17.28,2024-03-03 17:48:27,16.39,35.0
08-08-2023 15.31,08-08-2023 15.42,2023-08-08 15:56:53,10.99,4.0
16-03-2024 01.21,16-03-2024 01.35,2024-03-16 01:47:01,14.67,39.0
30-03-2023 10.31,30-03-2023 10.40,2023-03-30 10:50:53.000000000,10.5,32.0
24-04-2023 05.49,24-04-2023 06.11,2023-04-24 06:28:37,21.9,53.0
28-07-2023 17.24,28-07-2023 17.46,2023-07-28 17:53:07,21.72,34.0
07-05-2023 20.24,07-05-2023 20.53,2023-05-07 20:57:43,29.55,46.0
01-01-2024 09.38,01-01-2024 09.57,2024-01-01 10:13:37,19.67,45.0
03-12-2023 00.09,03-12-2023 00.37,2023-12-03 00:43:51,27.92,36.0
02-08-2023 11.04,02-08-2023 11.26,2023-08-02 11:35:20,22.81,50.0
10-03-2024 08.18,10-03-2024 08.46,2024-03-10 08:52:26,28.47,48.0
10-05-2023 19.27,10-05-2023 19.46,2023-05-10 19:49:46,19.73,19.0
12-11-2023 21.34,12-11-2023 21.55,2023-11-12 22:03:41,,27.0
30-04-2023 09.22,2023-04-30 09:46,2023-04-30 09:50:16,24.06,42.0
30-10-2023 17.23,30-10-2023 17.51,2023-10-30 18:08:46,27.53,19.0
2023/10/19 02:59:05,19-10-2023 03.27,2023-10-19 03:44:34,28.53,28.0
28-07-2023 04.30,28-07-2023 04.54,2023-07-28 04:59:23,23.87,37.0
10-09-2023 02.56,10-09-2023 03.27,2023-09-10 03:39:27,30.17,59.0
26-08-2023 15.36,26-08-2023 16.00,2023-08-26 16:13:07,23.33,30.0
17-06-2023 01.46,17-06-2023 02.07,2023-06-17 02:12:10,20.32,9.0
30-06-2023 23.35,30-06-2023 23.36,2023-06-30 23:39:35,1.0,5.0
05-01-2024 08.08,05-01-2024 08.40,2024-01-05 09:06:54,31.67,41.0
11-10-2023 06.15,11-10-2023 05.52,2023-10-11 06:21:53,23.32,34.0
03-09-2023 10.35,03-09-2023 10.51,2023-09-03 11:03:54,16.21,28.0
22-04-2023 02.55,2023-04-22 03:16,2023-04-22 03:36:59,21.04,36.0
20-06-2023 22.46,2023-06-20 22:51,2023-06-20 22:55:30,5.12,11.0
29-01-2024 15.38,29-01-2024 15.56,2024-01-29 16:00:16,17.45,28.0
28-12-2023 07.50,28-12-2023 08.13,2023-12-28 08:28:53,22.81,46.0
05-10-2023 17.12,05-10-2023 17.33,2023-10-05 17:44:11,21.38,33.0
02-09-2023 15.04,2023-09-02 15:26,2023-09-02 15:33:38,22.49,48.0
14-03-2024 04.19,14-03-2024 04.49,2024-03-14 04:59:28,29.67,55.0
18-05-2023 02.50,18-05-2023 03.16,2023-05-18 03:33:09,25.84,27.0
24-07-2023 22.50,2023-07-24 23:14,2023-07-24 23:24:50,23.24,36.0
07-04-2023 11.38,07-04-2023 11.53,2023-04-07 12:09:03,15.33,31.0
26-05-2023 12.04,26-05-2023 12.21,2023-05-26 12:32:59,17.09,20.0
30-03-2023 10.31,30-03-2023 10.35,2023-03-30 10:44:29.599999999,9.11,32.0
05-09-2023 09.48,05-09-2023 10.10,2023-09-05 10:19:46,21.72,35.0
18-11-2023 01.08,18-11-2023 01.24,2023-11-18 01:35:03,15.91,11.0
30-03-2023 12.33,30-03-2023 12.40,2023-03-30 12:49:16.000000000,9.15,40.0
30-03-2023 18.31,30-03-2023 18.32,2023-03-30 18:38:27.000000000,6.05,30.0
16-05-2023 20.40,16-05-2023 21.07,2023-05-16 21:09:03,,22.0
22-02-2024 02.32,22-02-2024 03.01,2024-02-22 03:06:14,28.81,68.0
22-03-2024 05.07,22-03-2024 05.30,2024-03-22 05:46:47,23.61,19.0
30-05-2023 13.29,30-05-2023 13.49,2023-05-30 13:58:56,19.28,200.0
28-07-2023 11.10,28-07-2023 11.29,2023-07-28 11:39:49,18.25,37.0
11-08-2023 18.59,11-08-2023 19.10,2023-08-11 19:20:03,10.75,16.0
28-02-2024 11.22,28-02-2024 11.49,2024-02-28 12:02:27,92.16,30.0
28-09-2023 05.51,28-09-2023 06.28,28-09-2023 06:42:51.017966,36.31,46.0
30-09-2023 03.48,30-09-2023 04.08,2023-09-30 04:21:24,19.71,45.0
05-09-2023 12.11,05-09-2023 12.39,2023-09-05 12:54:11,27.86,31.0
13-11-2023 11.50,13-11-2023 12.14,2023-11-13 12:28:41,24.4,32.0
2023/09/05 16:59:06,05-09-2023 17.24,2023-09-05 17:35:06,25.29,54.0
30-03-2023 21.09,30-03-2023 21.12,2023-03-30 21:34:46.800000000,21.93,44.0
11-07-2023 23.04,11-07-2023 23.25,2023-07-11 23:34:07,20.63,29.0
02-05-2023 16.20,02-05-2023 16.35,2023-05-02 16:40:54,15.16,27.0
30-03-2023 15.45,30-03-2023 15.51,2023-03-30 16:10:25.600000000,67.05,25.0
14-09-2023 06.21,14-09-2023 06.45,2023-09-14 06:55:03,24.13,22.0
21-09-2023 22.45,21-09-2023 23.06,2023-09-21 23:20:58,20.69,34.0
2023/12/01 01:40:14,01-12-2023 02.02,2023-12-01 02:18:05,22.18,33.0
19-03-2024 16.47,19-03-2024 17.16,2024-03-19 17:30:51,29.14,36.0
30-05-2023 22.51,30-05-2023 23.26,2023-05-30 23:35:20,34.27,56.0
30-03-2023 15.45,30-03-2023 15.55,2023-03-30 16:03:16.600000000,7.46,25.0
06-08-2023 15.52,06-08-2023 16.04,2023-08-06 16:06:22,11.89,18.0
25-09-2023 12.26,2023-09-25 12:43,2023-09-25 12:47:35,17.0,25.0
29-04-2023 23.31,29-04-2023 23.53,2023-04-30 00:11:59,22.32,44.0
,21-12-2023 08.38,2023-12-21 08:42:18,25.77,24.0
25-03-2024 16.12,25-03-2024 16.35,2024-03-25 16:47:29,23.4,47.0
26-11-2023 05.22,26-11-2023 05.41,2023-11-26 05:58:36,,32.0
19-10-2023 07.30,19-10-2023 07.50,2023-10-19 07:57:40,20.36,25.0
20-07-2023 16.48,20-07-2023 17.19,2023-07-20 17:29:53,31.13,37.0
16-06-2023 15.54,16-06-2023 16.09,2023-06-16 16:25:13,15.12,31.0
30-03-2023 21.09,30-03-2023 21.19,2023-03-30 21:30:55.200000000,11.07,
13-08-2023 23.36,14-08-2023 00.21,2023-08-14 00:32:41,45.21,56.0
15-07-2023 04.02,15-07-2023 04.29,2023-07-15 04:39:30,26.29,43.0
19-09-2023 20.10,19-09-2023 20.34,2023-09-19 20:52:38,23.75,145.0
30-03-2023 6.51,30-03-2023 6.52,2023-03-30 07:02:08.800000000,9.48,24.0
2023/10/29 18:03:20,29-10-2023 18.34,2023-10-29 18:50:02,30.67,38.0
22-11-2023 17.51,22-11-2023 18.28,2023-11-22 18:31:12,37.24,57.0
17-08-2023 20.50,17-08-2023 21.09,2023-08-17 21:30:37,19.32,26.0
31-08-2023 07.19,31-08-2023 07.41,2023-08-31 07:54:57,22.74,20.0
04-11-2023 15.42,04-11-2023 16.05,2023-11-04 16:19:46,22.61,30.0
11-09-2023 03.37,11-09-2023 04.01,2023-09-11 04:16:51,24.08,227.0
06-11-2023 23.22,06-11-2023 23.44,2023-11-07 00:02:36,22.25,42.0
22-02-2024 10.32,22-02-2024 11.04,2024-02-22 11:11:16,32.12,36.0
31-05-2023 10.09,31-05-2023 10.31,2023-05-31 10:39:20,21.67,28.0
13-07-2023 05.55,13-07-2023 06.13,2023-07-13 06:17:41,18.47,15.0
04-05-2023 01.57,04-05-2023 02.26,04-05-2023 02:36:43.725420,28.86,28.0
21-12-2023 09.20,21-12-2023 09.45,2023-12-21 09:50:08,24.51,20.0
11-09-2023 19.59,11-09-2023 20.21,2023-09-11 20:31:23,21.93,35.0
20-10-2023 13.02,2023-10-20 13:26,2023-10-20 13:28:23,23.58,21.0
2024/01/29 22:14:34,29-01-2024 22.49,2024-01-29 23:05:33,142.95,52.0
30-03-2023 16.45,30-03-2023 16.55,2023-03-30 16:59:29.600000000,4.36,27.0
10-06-2023 11.45,10-06-2023 12.04,2023-06-10 12:14:00,18.43,26.0
03-09-2023 10.52,03-09-2023 11.11,2023-09-03 11:19:41,19.14,25.0
14-10-2023 09.11,14-10-2023 09.21,2023-10-14 09:26:58,9.85,13.0
30-03-2023 5.34,30-03-2023 5.34,2023-03-30 05:47:49.800000000,13.53,50.0
19-05-2023 02.08,19-05-2023 02.33,2023-05-19 02:44:53,25.04,23.0
21-04-2023 14.17,21-04-2023 14.37,2023-04-21 14:48:59,20.26,43.0
16-01-2024 07.54,16-01-2024 08.09,2024-01-16 08:19:16,15.04,42.0
30-03-2023 13.55,30-03-2023 13.58,2023-03-30 14:10:35.800000000,11.83,25.0
18-05-2023 22.43,18-05-2023 22.58,2023-05-18 23:11:17,15.51,11.0
28-06-2023 04.28,28-06-2023 04.48,2023-06-28 04:58:40,20.02,
17-02-2024 19.40,17-02-2024 20.18,2024-02-17 20:35:01,37.09,61.0
30-03-2023 18.31,30-03-2023 18.34,2023-03-30 18:48:10.199999999,13.77,30.0
27-11-2023 02.48,27-11-2023 03.13,2023-11-27 03:25:12,25.09,25.0
2023/05/24 22:56:14,24-05-2023 23.13,24-05-2023 23:19:32.966335,17.03,14.0
11-08-2023 07.00,11-08-2023 07.25,2023-08-11 07:34:11,24.79,31.0
09-02-2024 09.42,09-02-2024 10.05,2024-02-09 10:15:38,23.31,47.0
30-03-2023 12.33,30-03-2023 12.43,2023-03-30 12:48:21.400000000,,40.0
30-03-2023 22.00,30-03-2023 22.06,2023-03-30 22:23:00.400000000,16.84,12.0
03-01-2024 03.55,03-01-2024 04.20,2024-01-03 04:40:05,25.64,42.0
2023/06/13 10:14:38,13-06-2023 10.28,2023-06-13 10:45:24,14.19,0.0
,30-03-2023 12.39,2023-03-30 12:46:11.800000000,7.08,40.0
06-10-2023 13.58,06-10-2023 14.17,2023-10-06 14:22:11,18.98,26.0
31-10-2023 16.35,31-10-2023 16.55,2023-10-31 16:57:27,20.12,15.0
23-10-2023 15.09,23-10-2023 15.10,2023-10-23 15:22:04,1.94,7.0
19-05-2023 23.16,19-05-2023 23.32,2023-05-19 23:44:04,16.76,22.0
17-07-2023 11.30,17-07-2023 11.53,2023-07-17 12:08:18,23.27,42.0
03-07-2023 19.19,03-07-2023 19.35,2023-07-03 19:49:30,15.84,24.0
2023/06/21 23:52:13,22-06-2023 00.15,2023-06-22 00:26:25,23.68,42.0
13-01-2024 01.51,13-01-2024 02.17,2024-01-13 02:27:02,25.93,52.0
09-12-2023 12.17,09-12-2023 12.35,2023-12-09 12:46:10,18.82,18.0
03-09-2023 09.02,2023-09-03 09:11,2023-09-03 09:27:18,8.45,12.0
24-04-2023 14.22,24-04-2023 14.35,2023-04-24 14:50:36,13.23,18.0
27-11-2023 23.33,27-11-2023 23.44,2023-11-27 23:55:28,10.74,28.0
30-03-2023 0.10,30-03-2023 0.10,2023-03-30 00:25:58.600000000,15.91,28.0
11-08-2023 03.34,11-08-2023 03.59,2023-08-11 04:04:25,25.71,39.0
13-08-2023 14.01,13-08-2023 14.30,2023-08-13 14:33:48,,42.0
30-03-2023 21.09,30-03-2023 21.10,2023-03-30 21:21:51.000000000,11.0,44.0
09-05-2023 05.15,09-05-2023 05.27,2023-05-09 05:41:16,12.55,16.0
30-03-2023 16.45,30-03-2023 16.55,2023-03-30 17:05:21.800000000,10.23,27.0
25-07-2023 23.58,26-07-2023 00.33,2023-07-26 00:47:22,34.75,57.0
06-08-2023 03.58,06-08-2023 04.15,2023-08-06 04:37:54,17.78,21.0
30-03-2023 8.42,30-03-2023 8.48,2023-03-30 09:03:36.800000000,14.83,47.0
25-01-2024 18.11,25-01-2024 18.37,2024-01-25 18:52:01,25.92,49.0
,30-03-2023 18.34,2023-03-30 18:36:13.200000000,1.82,30.0
2023/12/09 21:26:09,09-12-2023 21.43,2023-12-09 21:56:36,17.27,23.0
18-07-2023 16.13,18-07-2023 16.46,2023-07-18 17:03:16,33.45,38.0
19-03-2024 17.34,19-03-2024 17.57,2024-03-19 18:02:48,23.28,25.0
2023/11/16 23:30:30,2023-11-16 23:49,2023-11-17 00:06:50,19.02,32.0
2023/05/21 04:54:41,21-05-2023 05.31,2023-05-21 05:40:43,36.81,64.0
07-02-2024 02.42,07-02-2024 03.09,2024-02-07 03:18:26,27.07,27.0
11-01-2024 03.13,11-01-2024 03.28,2024-01-11 03:41:19,15.26,27.0
25-05-2023 01.03,25-05-2023 01.18,2023-05-25 01:34:16,15.03,23.0
11-11-2023 15.26,11-11-2023 15.42,2023-11-11 15:53:29,16.04,29.0
02-10-2023 23.24,02-10-2023 23.53,2023-10-03 00:07:36,28.13,43.0
30-03-2023 22.00,30-03-2023 22.10,2023-03-30 22:17:46.000000000,7.6,12.0
28-10-2023 01.38,28-10-2023 01.56,2023-10-28 02:04:57,18.43,36.0
11-01-2024 13.13,11-01-2024 13.32,2024-01-11 13:38:06,18.94,15.0
2023/12/16 17:15:26,16-12-2023 17.28,2023-12-16 17:35:02,13.53,32.0
06-10-2023 15.05,06-10-2023 15.36,2023-10-06 15:49:49,31.82,39.0
20-04-2023 06.53,20-04-2023 07.17,2023-04-20 07:26:18,23.63,40.0
31-07-2023 00.10,31-07-2023 00.40,2023-07-31 00:56:21,29.85,49.0
30-03-2023 12.33,30-03-2023 12.33,2023-03-30 12:37:31.000000000,4.4,40.0
09-12-2023 12.21,09-12-2023 12.27,2023-12-09 12:33:22,5.9,17.0
13-02-2024 14.12,13-02-2024 14.34,2024-02-13 14:36:37,22.4,26.0
2023/05/09 09:16:50,09-05-2023 09.33,2023-05-09 09:48:44,16.72,20.0
30-03-2023 17.34,30-03-2023 17.40,2023-03-30 17:58:08.000000000,17.25,16.0
02-01-2024 02.49,02-01-2024 03.11,2024-01-02 03:13:55,21.96,
30-03-2023 3.02,30-03-2023 3.05,2023-03-30 03:17:49.800000000,12.58,45.0
30-03-2023 5.34,30-03-2023 5.37,2023-03-30 05:38:38.400000000,1.34,50.0
03-09-2023 21.00,03-09-2023 21.28,2023-09-03 21:35:03,27.94,40.0
20-07-2023 14.16,20-07-2023 14.40,2023-07-20 14:53:08,23.86,28.0
08-04-2023 13.41,08-04-2023 14.06,2023-04-08 14:18:50,24.58,36.0
23-01-2024 11.47,23-01-2024 12.12,23-01-2024 12:26:15.536832,24.47,23.0
10-09-2023 15.42,10-09-2023 16.16,2023-09-10 16:22:00,33.36,46.0
21-01-2024 06.57,21-01-2024 07.31,2024-01-21 07:34:15,33.96,54.0
20-03-2024 10.32,20-03-2024 10.49,2024-03-20 11:00:44,16.96,20.0
15-04-2023 11.22,15-04-2023 11.37,2023-04-15 11:45:47,14.74,23.0
02-07-2023 23.23,02-07-2023 23.45,2023-07-02 23:48:27,22.89,27.0
21-03-2024 16.46,21-03-2024 17.21,2024-03-21 17:28:25,34.92,134.0
30-03-2023 0.10,30-03-2023 0.16,2023-03-30 00:25:53.200000000,9.82,28.0
14-12-2023 06.54,14-12-2023 07.27,2023-12-14 07:40:51,32.43,236.0
21-05-2023 07.54,21-05-2023 08.16,2023-05-21 08:30:15,22.01,18.0
29-01-2024 16.27,29-01-2024 16.55,2024-01-29 16:57:19,27.89,43.0
07-10-2023 15.59,07-10-2023 16.20,2023-10-07 16:26:11,21.86,40.0
07-09-2023 07.13,07-09-2023 07.37,2023-09-07 07:53:31,24.51,40.0
31-01-2024 12.04,31-01-2024 12.41,2024-01-31 12:43:12,36.86,44.0
2023/09/04 08:04:15,04-09-2023 08.28,2023-09-04 08:30:50,23.83,20.0
2024/01/14 08:58:12,14-01-2024 09.20,2024-01-14 09:31:36,22.28,31.0
17-03-2024 03.33,17-03-2024 03.58,2024-03-17 04:08:57,25.18,26.0
24-07-2023 04.42,24-07-2023 05.07,2023-07-24 05:12:36,,14.0
27-06-2023 02.38,2023-06-27 03:00,2023-06-27 03:07:57,21.09,24.0
07-09-2023 13.50,07-09-2023 14.14,2023-09-07 14:24:47,24.54,25.0
02-12-2023 12.16,02-12-2023 12.35,2023-12-02 12:54:15,19.07,33.0
21-12-2023 05.48,21-12-2023 06.12,2023-12-21 06:19:51,24.51,8.0
30-03-2023 8.42,30-03-2023 8.51,2023-03-30 09:05:08.599999999,13.36,47.0
02-03-2024 13.36,02-03-2024 13.58,2024-03-02 14:05:09,21.7,31.0
23-01-2024 03.13,23-01-2024 03.36,2024-01-23 03:49:54,22.64,36.0
16-01-2024 23.51,17-01-2024 00.15,2024-01-17 00:34:36,23.32,37.0
21-06-2023 05.09,21-06-2023 05.37,2023-06-21 05:43:50,27.63,36.0
13-12-2023 03.49,13-12-2023 04.16,2023-12-13 04:30:56,26.72,25.0
2024/01/17 10:10:46,17-01-2024 10.28,2024-01-17 10:46:19,17.45,47.0
30-09-2023 20.52,30-09-2023 21.17,30-09-2023 21:20:28.238894,24.64,31.0
24-07-2023 11.58,24-07-2023 12.25,2023-07-24 12:41:47,26.46,14.0
09-06-2023 04.37,09-06-2023 05.00,2023-06-09 05:11:41,23.49,16.0
13-04-2023 05.01,13-04-2023 05.30,2023-04-13 05:54:53,28.86,30.0
05-01-2024 23.19,05-01-2024 23.33,2024-01-05 23:50:29,13.96,9.0
09-05-2023 17.05,09-05-2023 17.25,2023-05-09 17:32:28,19.95,34.0
05-11-2023 06.09,05-11-2023 06.23,2023-11-05 06:25:12,13.31,21.0
10-03-2024 08.01,10-03-2024 08.24,2024-03-10 08:26:12,22.28,44.0
30-03-2023 10.31,30-03-2023 10.39,2023-03-30 10:54:21.200000000,14.97,32.0
30-03-2023 2.36,30-03-2023 2.39,2023-03-30 02:53:52.200000000,14.72,17.0
27-03-2024 08.26,27-03-2024 08.39,27-03-2024 08:52:26.166160,13.32,13.0
30-03-2023 15.45,30-03-2023 15.48,2023-03-30 15:53:22.000000000,4.55,25.0
18-02-2024 23.54,19-02-2024 00.15,2024-02-19 00:20:50,20.71,26.0
01-06-2023 03.09,01-06-2023 03.25,01-06-2023 03:35:54.953345,15.89,21.0
26-01-2024 11.07,26-01-2024 11.39,2024-01-26 11:46:17,31.69,64.0
19-12-2023 06.30,19-12-2023 07.03,2023-12-19 07:15:47,33.14,43.0
24-03-2024 09.01,24-03-2024 09.24,2024-03-24 09:37:42,22.49,23.0
21-11-2023 17.52,21-11-2023 18.19,2023-11-21 18:26:52,26.64,225.0
02-10-2023 17.10,02-10-2023 17.35,2023-10-02 17:55:42,25.18,35.0
27-12-2023 04.02,27-12-2023 04.30,2023-12-27 04:42:17,27.67,37.0
06-01-2024 16.04,06-01-2024 16.33,2024-01-06 16:53:55,29.97,27.0
14-12-2023 08.26,14-12-2023 08.52,2023-12-14 09:01:08,26.8,46.0
30-11-2023 06.45,30-11-2023 07.11,2023-11-30 07:13:51,,34.0
17-07-2023 06.45,17-07-2023 07.14,2023-07-17 07:21:45,28.69,34.0
20-08-2023 02.27,20-08-2023 02.49,2023-08-20 03:03:18,22.47,28.0
23-12-2023 20.06,23-12-2023 20.37,2023-12-23 20:48:13,31.26,40.0
30-03-2023 21.09,30-03-2023 21.10,2023-03-30 21:13:16.200000000,2.42,44.0
30-03-2023 15.45,30-03-2023 15.48,2023-03-30 16:04:30.400000000,15.69,25.0
10-07-2023 12.49,10-07-2023 13.07,2023-07-10 13:11:17,18.43,
10-12-2023 12.00,10-12-2023 12.30,2023-12-10 12:38:17,30.52,57.0
21-07-2023 09.29,21-07-2023 10.02,21-07-2023 10:06:33.159355,32.68,53.0
24-05-2023 21.19,24-05-2023 21.44,2023-05-24 21:58:49,24.6,41.0
30-03-2023 13.55,30-03-2023 14.04,2023-03-30 14:10:32.200000000,5.77,
09-04-2023 08.27,09-04-2023 08.55,2023-04-09 09:07:23,27.67,135.0
29-09-2023 13.21,29-09-2023 13.34,29-09-2023 13:43:39.184340,13.36,18.0
03-09-2023 13.41,03-09-2023 13.59,2023-09-03 14:11:40,17.93,26.0
18-02-2024 23.07,18-02-2024 23.38,2024-02-18 23:55:58,31.51,33.0
11-12-2023 05.42,11-12-2023 05.58,2023-12-11 06:11:09,16.19,29.0
26-12-2023 20.16,26-12-2023 20.46,2023-12-26 21:04:29,29.92,36.0
30-03-2023 21.09,30-03-2023 21.09,2023-03-30 21:20:18.600000000,10.46,44.0
23-01-2024 21.29,23-01-2024 21.49,2024-01-23 21:55:41,19.91,126.0
07-05-2023 10.13,07-05-2023 10.26,2023-05-07 10:47:36,13.06,23.0
19-12-2023 13.33,19-12-2023 13.53,2023-12-19 14:05:39,19.57,26.0
2023/11/04 07:31:43,04-11-2023 07.53,2023-11-04 08:09:02,22.08,18.0
24-09-2023 10.54,24-09-2023 11.08,2023-09-24 11:16:03,13.53,12.0
05-02-2024 15.04,05-02-2024 15.33,2024-02-05 15:41:10,29.12,46.0
16-07-2023 03.21,16-07-2023 03.40,2023-07-16 03:57:21,19.48,37.0
21-04-2023 02.23,21-04-2023 03.05,2023-04-21 03:13:23,41.28,48.0
03-03-2024 08.02,03-03-2024 08.16,2024-03-03 08:21:35,13.23,207.0
29-08-2023 23.36,30-08-2023 00.01,2023-08-30 00:19:34,24.98,46.0
16-03-2024 16.21,16-03-2024 16.39,2024-03-16 16:43:10,18.48,43.0
,12-12-2023 03.18,2023-12-12 03:38:04,37.24,51.0
12-12-2023 06.33,12-12-2023 07.00,2023-12-12 07:08:56,27.57,23.0
21-05-2023 14.58,21-05-2023 15.11,2023-05-21 15:24:34,12.3,32.0
25-11-2023 15.45,25-11-2023 16.07,2023-11-25 16:11:33,22.05,42.0
30-06-2023 10.03,2023-06-30 10:18,2023-06-30 10:25:08,14.22,15.0
03-06-2023 03.18,03-06-2023 03.45,2023-06-03 03:52:20,26.49,32.0
06-07-2023 12.29,06-07-2023 12.59,2023-07-06 13:11:28,30.78,33.0
2023/05/30 01:38:16,30-05-2023 01.54,2023-05-30 02:01:18,16.45,10.0
30-03-2023 3.02,30-03-2023 3.08,2023-03-30 03:25:52.800000000,17.63,45.0
2024/02/02 02:47:04,02-02-2024 03.13,2024-02-02 03:20:47,26.56,51.0
03-01-2024 05.46,03-01-2024 06.20,2024-01-03 06:37:34,33.46,39.0
,30-03-2023 0.20,2023-03-30 00:32:24.400000000,12.34,28.0
09-03-2024 20.12,09-03-2024 20.29,2024-03-09 20:32:30,17.52,41.0
16-05-2023 02.28,16-05-2023 02.43,2023-05-16 03:01:15,14.83,30.0
20-02-2024 10.10,20-02-2024 10.26,2024-02-20 10:39:28,15.64,26.0
21-05-2023 12.48,2023-05-21 13:07,2023-05-21 13:12:00,18.93,21.0
18-01-2024 03.07,2024-01-18 03:24,18-01-2024 03:33:40.297036,16.91,8.0
29-05-2023 13.30,29-05-2023 13.51,2023-05-29 14:03:03,20.64,
21-01-2024 11.57,21-01-2024 12.31,2024-01-21 12:48:16,33.83,54.0
17-01-2024 14.38,17-01-2024 14.58,2024-01-17 15:06:50,20.28,26.0
19-12-2023 21.18,19-12-2023 21.39,2023-12-19 21:51:21,83.17,31.0
2024/02/07 04:11:27,2024-02-07 04:31,2024-02-07 04:44:52,19.55,16.0
20-09-2023 03.24,20-09-2023 03.55,2023-09-20 04:06:43,30.55,47.0
30-03-2023 21.09,30-03-2023 21.13,2023-03-30 21:19:25.800000000,,44.0
26-03-2024 05.22,26-03-2024 05.40,2024-03-26 05:50:05,17.83,24.0
05-05-2023 02.44,2023-05-05 03:17,2023-05-05 03:34:40,32.35,31.0
22-10-2023 09.38,2023-10-22 10:04,2023-10-22 10:14:04,25.65,25.0
25-07-2023 13.11,25-07-2023 13.35,2023-07-25 13:40:26,24.37,51.0
11-06-2023 11.58,11-06-2023 12.29,2023-06-11 12:32:50,31.09,37.0
28-04-2023 15.04,28-04-2023 15.18,2023-04-28 15:27:09,14.23,12.0
09-03-2024 07.21,09-03-2024 07.52,2024-03-09 08:06:11,30.52,22.0
18-01-2024 02.44,18-01-2024 03.11,2024-01-18 03:24:47,27.82,25.0
2023/07/05 13:42:42,05-07-2023 14.03,2023-07-05 14:17:02,20.4,
,03-03-2024 07.44,2024-03-03 08:09:26,31.12,60.0
08-10-2023 22.11,08-10-2023 22.34,2023-10-08 22:49:25,23.04,26.0
11-03-2024 04.37,11-03-2024 04.52,2024-03-11 04:59:23,,35.0
25-02-2024 23.05,25-02-2024 23.23,2024-02-25 23:39:15,17.88,34.0
13-09-2023 22.05,13-09-2023 22.22,2023-09-13 22:35:16,16.7,30.0
30-11-2023 08.59,30-11-2023 09.34,2023-11-30 09:44:14,34.99,50.0
06-09-2023 23.41,07-09-2023 00.02,2023-09-07 00:24:13,20.92,31.0
28-07-2023 09.45,28-07-2023 10.08,2023-07-28 10:16:43,23.5,36.0
24-10-2023 16.30,24-10-2023 17.00,2023-10-24 17:15:10,29.82,28.0
06-12-2023 10.56,06-12-2023 11.22,2023-12-06 11:36:38,25.67,41.0
14-01-2024 06.24,14-01-2024 06.51,2024-01-14 06:57:04,27.23,53.0
12-02-2024 07.37,12-02-2024 07.55,2024-02-12 08:00:17,18.59,31.0
30-03-2023 0.10,30-03-2023 0.11,2023-03-30 00:24:20.199999999,13.27,28.0
18-12-2023 04.28,18-12-2023 04.58,2023-12-18 05:15:21,29.72,31.0
23-11-2023 04.49,23-11-2023 04.53,2023-11-23 05:07:18,3.17,19.0
2023/08/06 12:13:53,06-08-2023 12.31,2023-08-06 12:37:48,17.78,38.0
15-01-2024 17.33,15-01-2024 17.59,2024-01-15 18:09:30,26.1,32.0
2023/10/04 13:21:33,04-10-2023 13.40,2023-10-04 13:42:47,71.42,20.0
25-12-2023 01.05,25-12-2023 01.21,2023-12-25 01:36:16,16.59,29.0
08-10-2023 12.41,08-10-2023 13.02,2023-10-08 13:09:18,20.78,29.0
08-04-2023 03.31,08-04-2023 03.55,2023-04-08 04:02:17,24.11,165.0
20-10-2023 22.48,20-10-2023 23.21,2023-10-20 23:30:10,32.85,54.0
30-03-2023 20.49,30-03-2023 20.59,2023-03-30 21:08:18.199999999,8.37,22.0
23-12-2023 07.28,23-12-2023 07.51,2023-12-23 07:53:24,23.13,46.0
21-08-2023 21.21,21-08-2023 21.48,2023-08-21 21:52:22,26.78,21.0
30-03-2023 10.31,30-03-2023 10.34,2023-03-30 10:53:14.600000000,18.86,32.0
19-04-2023 21.31,19-04-2023 21.48,2023-04-19 21:53:17,,29.0
13-12-2023 11.37,13-12-2023 11.59,2023-12-13 12:08:56,21.97,24.0
2023/08/02 07:24:31,2023-08-02 07:41,2023-08-02 07:52:55,16.8,32.0
08-10-2023 23.12,08-10-2023 23.47,09-10-2023 00:01:42.184690,35.39,37.0
2024/03/02 06:37:40,02-03-2024 07.02,02-03-2024 07:16:23.884389,25.32,17.0
16-02-2024 23.17,16-02-2024 23.39,2024-02-16 23:53:04,22.09,35.0
29-01-2024 20.52,29-01-2024 21.14,2024-01-29 21:20:55,22.49,42.0
2023/09/04 15:17:57,04-09-2023 15.45,2023-09-04 16:03:14,27.68,42.0
11-08-2023 10.51,11-08-2023 11.13,2023-08-11 11:16:05,21.84,41.0
09-06-2023 01.12,09-06-2023 01.33,2023-06-09 01:40:34,21.06,16.0
13-01-2024 11.01,13-01-2024 11.23,2024-01-13 11:35:35,21.62,26.0
2024/02/23 15:52:12,23-02-2024 16.21,2024-02-23 16:33:32,29.68,46.0
04-11-2023 06.35,04-11-2023 06.56,2023-11-04 07:14:50,20.28,26.0
08-11-2023 05.17,08-11-2023 05.35,2023-11-08 05:44:04,18.32,29.0
2023/06/02 12:41:46,02-06-2023 13.09,2023-06-02 13:17:11,27.47,26.0
28-09-2023 14.00,28-09-2023 14.34,2023-09-28 14:43:02,34.09,46.0
30-03-2023 18.31,30-03-2023 18.40,2023-03-30 18:53:51.600000000,13.46,30.0
24-03-2024 03.45,24-03-2024 04.10,2024-03-24 04:20:12,24.37,
03-11-2023 11.16,03-11-2023 11.31,2023-11-03 11:33:30,14.94,14.0
20-01-2024 10.21,20-01-2024 10.42,2024-01-20 10:45:05,20.92,22.0
02-12-2023 10.56,02-12-2023 11.20,2023-12-02 11:31:19,23.5,42.0
2023/12/26 18:41:07,26-12-2023 19.11,2023-12-26 19:13:06,29.99,67.0
28-03-2024 19.06,2024-03-28 19:24,2024-03-28 19:29:44,18.52,23.0
09-05-2023 00.45,09-05-2023 01.11,2023-05-09 01:24:46,26.54,40.0
14-03-2024 02.50,14-03-2024 03.07,2024-03-14 03:18:48,16.81,21.0
19-08-2023 21.45,19-08-2023 22.08,2023-08-19 22:12:20,22.88,24.0
30-03-2023 12.33,30-03-2023 12.36,2023-03-30 12:40:23.200000000,4.27,40.0
17-04-2023 07.15,17-04-2023 07.06,17-04-2023 07:29:13.051359,9.46,7.0
08-02-2024 10.00,08-02-2024 10.16,2024-02-08 10:30:26,16.46,22.0
2023/05/25 07:44:33,25-05-2023 08.01,2023-05-25 08:07:10,17.26,36.0
07-03-2024 11.59,07-03-2024 12.11,2024-03-07 12:22:51,11.73,29.0
26-09-2023 10.21,26-09-2023 10.47,2023-09-26 11:00:04,25.83,29.0
05-10-2023 04.30,05-10-2023 04.57,2023-10-05 05:08:02,26.6,45.0
25-09-2023 09.49,25-09-2023 10.14,2023-09-25 10:16:11,24.87,53.0
02-04-2023 16.53,02-04-2023 17.08,2023-04-02 17:18:03,14.74,34.0
30-03-2023 17.36,30-03-2023 17.34,2023-03-30 17:51:18.800000000,14.43,16.0
04-04-2023 00.51,2023-04-04 01:23,2023-04-04 01:26:12,31.8,63.0
11-01-2024 10.04,11-01-2024 10.21,2024-01-11 10:31:11,17.15,26.0
2023/08/18 13:51:19,18-08-2023 14.08,2023-08-18 14:19:12,17.07,19.0
03-02-2024 23.22,03-02-2024 23.44,2024-02-03 23:54:22,22.02,23.0
30-03-2023 22.00,30-03-2023 22.10,2023-03-30 22:13:56.200000000,3.77,12.0
06-03-2024 00.25,06-03-2024 00.55,2024-03-06 01:15:48,30.38,38.0
05-08-2023 18.12,2023-08-05 18:38,2023-08-05 18:54:35,25.84,37.0
09-11-2023 12.45,09-11-2023 13.03,2023-11-09 13:15:49,18.58,36.0
17-07-2023 07.00,17-07-2023 07.25,2023-07-17 07:29:09,24.82,52.0
04-08-2023 00.45,04-08-2023 01.12,2023-08-04 01:21:59,26.97,38.0
12-10-2023 19.16,12-10-2023 19.42,2023-10-12 19:59:22,25.53,28.0
13-08-2023 01.14,13-08-2023 01.02,2023-08-13 01:26:17,12.19,37.0
18-04-2023 06.45,18-04-2023 06.57,2023-04-18 07:16:51,12.05,12.0
22-03-2024 01.46,2024-03-22 02:19,2024-03-22 02:28:43,32.99,47.0
05-01-2024 04.49,05-01-2024 05.12,2024-01-05 05:21:03,22.31,
19-12-2023 01.25,19-12-2023 01.43,2023-12-19 01:48:05,18.27,18.0
29-08-2023 02.09,29-08-2023 02.30,2023-08-29 02:39:15,20.68,24.0
16-05-2023 19.02,16-05-2023 19.22,2023-05-16 19:31:47,19.92,21.0
10-04-2023 17.47,10-04-2023 18.16,2023-04-10 18:36:14,28.69,21.0
11-02-2024 14.52,11-02-2024 15.23,2024-02-11 15:30:21,30.65,45.0
04-11-2023 17.39,04-11-2023 18.07,2023-11-04 18:21:37,,32.0
17-04-2023 09.29,17-04-2023 09.46,2023-04-17 09:58:45,16.44,36.0
14-04-2023 00.01,14-04-2023 00.23,2023-04-14 00:39:07,22.72,45.0
29-01-2024 09.08,29-01-2024 09.27,2024-01-29 09:36:13,19.08,26.0
,19-11-2023 23.41,2023-11-19 23:49:28,21.32,20.0
30-12-2023 17.13,30-12-2023 17.33,2023-12-30 17:38:08,20.55,32.0
20-09-2023 14.59,20-09-2023 15.25,2023-09-20 15:33:23,,32.0
27-05-2023 14.55,27-05-2023 15.08,2023-05-27 15:19:09,13.71,11.0
17-12-2023 17.27,17-12-2023 17.49,2023-12-17 18:03:42,21.67,25.0
20-01-2024 19.26,20-01-2024 19.48,2024-01-20 20:00:43,21.5,17.0
,14-02-2024 16.04,2024-02-14 16:18:11,18.07,39.0
02-12-2023 08.53,02-12-2023 09.18,2023-12-02 09:43:02,25.34,21.0
30-03-2023 05.08,30-03-2023 05.29,2023-03-30 05:44:35,20.71,11.0
11-04-2023 19.33,2023-04-11 20:00,11-04-2023 20:11:41.976671,27.1,25.0
16-08-2023 17.20,16-08-2023 17.56,2023-08-16 17:58:57,36.13,52.0
08-10-2023 23.14,08-10-2023 23.28,2023-10-08 23:33:32,13.25,
30-10-2023 07.22,30-10-2023 07.39,2023-10-30 07:46:45,16.71,34.0
15-07-2023 19.47,15-07-2023 20.07,2023-07-15 20:27:59,20.47,31.0
02-05-2023 00.25,02-05-2023 00.52,2023-05-02 00:54:40,27.02,46.0
17-01-2024 14.22,17-01-2024 14.44,2024-01-17 14:50:24,22.42,45.0
13-02-2024 20.48,13-02-2024 21.07,2024-02-13 21:09:27,18.91,29.0
08-05-2023 15.23,08-05-2023 15.43,2023-05-08 15:53:16,20.26,23.0
30-03-2023 18.31,30-03-2023 18.32,2023-03-30 18:45:27.600000000,13.06,30.0
24-10-2023 22.39,24-10-2023 23.02,2023-10-24 23:15:21,22.9,39.0
13-06-2023 07.07,13-06-2023 07.32,2023-06-13 07:50:12,,26.0
08-02-2024 21.33,08-02-2024 21.53,2024-02-08 22:12:51,19.65,37.0
11-01-2024 11.27,11-01-2024 11.51,2024-01-11 11:54:39,24.14,29.0
15-10-2023 05.21,15-10-2023 05.50,2023-10-15 06:05:39,28.69,45.0
30-03-2023 1.58,30-03-2023 2.00,2023-03-30 02:07:01.000000000,6.4,27.0
09-04-2023 14.12,09-04-2023 14.41,2023-04-09 14:48:14,29.66,43.0
17-04-2023 20.41,17-04-2023 21.05,2023-04-17 21:18:44,23.78,37.0
09-10-2023 07.41,09-10-2023 08.05,2023-10-09 08:12:57,24.1,43.0
15-08-2023 08.40,15-08-2023 09.11,2023-08-15 09:25:19,31.86,28.0
21-04-2023 15.50,21-04-2023 16.09,2023-04-21 16:18:36,19.42,32.0
30-03-2023 1.58,30-03-2023 1.58,2023-03-30 02:06:31.600000000,7.91,27.0
27-05-2023 12.30,27-05-2023 12.54,2023-05-27 13:11:46,24.98,41.0
2024/01/20 10:57:21,20-01-2024 11.08,2024-01-20 11:13:43,11.6,10.0
30-03-2023 5.34,30-03-2023 5.34,2023-03-30 05:49:43.800000000,15.43,
03-08-2023 11.19,03-08-2023 11.39,2023-08-03 11:49:59,20.8,32.0
27-02-2024 14.17,27-02-2024 14.56,2024-02-27 15:15:43,39.14,54.0
30-12-2023 23.23,30-12-2023 23.43,2023-12-30 23:51:40,20.45,
16-01-2024 15.57,16-01-2024 16.11,2024-01-16 16:31:49,14.94,24.0
04-02-2024 14.08,04-02-2024 14.40,2024-02-04 14:52:31,31.67,29.0
09-07-2023 23.18,09-07-2023 23.44,2023-07-09 23:51:04,25.13,34.0
20-08-2023 13.29,2023-08-20 13:56,2023-08-20 14:12:16,26.57,53.0
27-06-2023 03.24,27-06-2023 03.46,2023-06-27 03:54:00,21.86,45.0
22-07-2023 02.16,22-07-2023 02.38,2023-07-22 02:50:47,21.41,42.0
17-04-2023 10.43,17-04-2023 10.58,2023-04-17 11:04:38,15.69,22.0
19-01-2024 06.44,19-01-2024 07.12,2024-01-19 07:29:00,27.81,49.0
15-11-2023 13.57,15-11-2023 13.32,2023-11-15 14:08:45,24.81,36.0
21-10-2023 13.14,21-10-2023 13.36,2023-10-21 13:52:37,22.2,32.0
05-03-2024 21.23,05-03-2024 21.41,2024-03-05 21:48:51,18.32,35.0
08-12-2023 14.35,08-12-2023 14.53,2023-12-08 15:08:33,17.45,33.0
2023/07/17 20:28:37,17-07-2023 20.43,2023-07-17 20:45:37,14.9,5.0
30-03-2023 5.34,30-03-2023 5.35,2023-03-30 05:42:15.600000000,6.96,50.0
30-03-2023 0.10,30-03-2023 0.16,2023-03-30 00:25:48.400000000,,28.0
19-06-2023 00.29,2023-06-19 00:51,2023-06-19 01:03:15,22.19,54.0
28-02-2024 09.48,2024-02-28 10:18,2024-02-28 10:20:59,30.05,47.0
06-05-2023 02.48,06-05-2023 03.06,2023-05-06 03:20:30,18.07,20.0
24-01-2024 17.38,24-01-2024 18.01,2024-01-24 18:14:25,22.89,33.0
07-09-2023 15.32,07-09-2023 16.06,2023-09-07 16:18:40,33.34,35.0
27-09-2023 15.59,27-09-2023 16.34,2023-09-27 16:44:14,34.5,40.0
01-08-2023 23.15,01-08-2023 23.37,2023-08-01 23:42:32,21.99,28.0
22-07-2023 21.22,22-07-2023 21.32,2023-07-22 21:56:51,10.17,37.0
2023/07/18 21:25:30,18-07-2023 21.44,2023-07-18 21:46:17,,21.0
23-07-2023 17.26,23-07-2023 17.52,2023-07-23 18:16:35,25.46,51.0
2023/05/24 19:22:12,24-05-2023 19.51,2023-05-24 19:55:01,29.76,22.0
27-08-2023 21.37,2023-08-27 22:02,2023-08-27 22:12:01,25.29,38.0
30-08-2023 05.18,30-08-2023 05.43,2023-08-30 05:57:31,24.94,45.0
30-03-2023 1.58,30-03-2023 2.07,2023-03-30 02:16:05.200000000,8.47,27.0
13-06-2023 13.21,13-06-2023 13.45,2023-06-13 13:50:19,23.74,48.0
29-01-2024 18.33,29-01-2024 19.09,2024-01-29 19:22:22,35.19,35.0
13-03-2024 13.33,13-03-2024 13.57,2024-03-13 14:00:54,,37.0
25-04-2023 00.16,25-04-2023 00.44,2023-04-25 00:56:53,28.85,32.0
16-07-2023 08.44,16-07-2023 08.50,2023-07-16 09:04:03,6.82,24.0
20-06-2023 05.46,20-06-2023 06.19,2023-06-20 06:26:42,33.29,48.0
05-08-2023 22.58,05-08-2023 23.23,2023-08-05 23:29:42,24.38,22.0
29-02-2024 03.52,29-02-2024 04.15,2024-02-29 04:28:25,22.97,39.0
28-07-2023 22.09,28-07-2023 22.36,2023-07-28 22:52:03,27.24,34.0
30-06-2023 14.16,30-06-2023 14.36,2023-06-30 14:47:25,20.5,20.0
14-06-2023 03.53,14-06-2023 04.10,2023-06-14 04:25:02,16.49,19.0
13-11-2023 13.19,13-11-2023 13.35,2023-11-13 13:44:53,16.3,27.0
08-01-2024 00.46,08-01-2024 01.08,2024-01-08 01:19:47,22.16,40.0
30-08-2023 01.14,30-08-2023 01.35,2023-08-30 01:45:47,21.12,29.0
28-10-2023 02.44,28-10-2023 03.12,2023-10-28 03:24:33,27.42,35.0
04-04-2023 22.20,04-04-2023 22.44,2023-04-04 22:53:54,23.79,33.0
15-02-2024 11.53,15-02-2024 12.17,2024-02-15 12:21:34,23.86,38.0
2023/04/18 04:43:56,18-04-2023 05.04,2023-04-18 05:20:55,20.99,38.0
10-08-2023 04.51,10-08-2023 05.13,2023-08-10 05:20:39,21.52,43.0
15-04-2023 10.03,15-04-2023 10.13,2023-04-15 10:26:47,9.99,10.0
2023/04/02 09:16:56,02-04-2023 09.34,2023-04-02 09:52:05,17.74,25.0
21-09-2023 18.01,21-09-2023 18.21,2023-09-21 18:31:40,20.06,38.0
05-11-2023 03.23,2023-11-05 03:32,2023-11-05 03:35:20,9.82,10.0
01-11-2023 14.50,01-11-2023 15.12,2023-11-01 15:22:43,22.35,31.0
12-07-2023 03.29,12-07-2023 04.00,2023-07-12 04:12:09,30.05,52.0
22-07-2023 13.27,22-07-2023 13.40,22-07-2023 13:46:42.570012,12.69,47.0
26-02-2024 09.23,26-02-2024 09.46,2024-02-26 09:58:12,23.25,31.0
2023/06/08 04:50:15,08-06-2023 05.11,2023-06-08 05:31:37,21.33,16.0
09-01-2024 00.18,09-01-2024 00.44,2024-01-09 01:03:49,25.86,43.0
09-05-2023 08.55,2023-05-09 09:21,2023-05-09 09:34:30,25.84,38.0
07-05-2023 14.32,07-05-2023 14.49,2023-05-07 14:58:08,17.47,34.0
30-03-2023 16.45,30-03-2023 16.53,2023-03-30 16:50:12.200000000,-2.93,27.0
2023/07/10 00:28:33,10-07-2023 00.57,2023-07-10 00:59:29,28.93,53.0
15-01-2024 08.07,2024-01-15 08:23,2024-01-15 08:39:15,16.52,33.0
,18-09-2023 20.25,2023-09-18 20:32:07,29.19,24.0
30-03-2023 17.34,30-03-2023 17.43,2023-03-30 17:51:59.599999999,8.11,16.0
30-03-2023 12.33,30-03-2023 12.38,2023-03-30 12:52:29.199999999,14.37,40.0
12-10-2023 12.04,12-10-2023 12.31,2023-10-12 12:40:35,27.49,47.0
30-03-2023 5.34,30-03-2023 5.34,2023-03-30 05:49:05.400000000,14.79,50.0
12-03-2024 21.30,12-03-2024 21.48,2024-03-12 22:06:03,,17.0
27-09-2023 15.33,27-09-2023 15.51,2023-09-27 16:09:40,18.35,24.0
11-04-2023 14.07,11-04-2023 14.27,2023-04-11 14:34:50,19.7,32.0
09-01-2024 10.31,09-01-2024 11.00,2024-01-09 11:13:58,29.05,39.0
21-04-2023 00.39,21-04-2023 01.05,2023-04-21 01:15:17,25.7,46.0
31-08-2023 15.23,31-08-2023 15.48,2023-08-31 16:02:14,25.7,30.0
,08-07-2023 02.54,2023-07-08 03:06:57,21.35,
30-03-2023 13.55,30-03-2023 13.56,2023-03-30 14:07:29.800000000,10.73,25.0
06-09-2023 07.39,06-09-2023 07.58,2023-09-06 08:14:50,18.18,29.0
30-03-2023 10.31,30-03-2023 10.37,2023-03-30 10:39:12.200000000,1.82,32.0
18-11-2023 06.02,18-11-2023 06.46,2023-11-18 07:00:45,43.92,
15-12-2023 05.03,15-12-2023 05.31,2023-12-15 05:46:38,28.93,31.0
2024/01/25 17:16:59,25-01-2024 17.35,2024-01-25 17:46:17,18.2,19.0
30-03-2023 10.31,30-03-2023 10.33,2023-03-30 10:44:02.000000000,10.65,32.0
,13-03-2024 21.26,2024-03-13 21:29:09,17.89,24.0
03-05-2023 11.41,03-05-2023 12.12,2023-05-03 12:31:43,30.76,59.0
30-03-2023 9.49,30-03-2023 9.49,2023-03-30 09:58:34.000000000,9.5,10.0
30-03-2023 12.33,30-03-2023 12.34,2023-03-30 12:41:15.400000000,7.14,40.0
30-03-2023 19.51,30-03-2023 19.51,2023-03-30 20:02:42.400000000,11.54,12.0
08-05-2023 04.13,08-05-2023 04.24,2023-05-08 04:35:23,11.23,13.0
15-07-2023 19.30,2023-07-15 20:03,2023-07-15 20:23:07,33.0,35.0
05-04-2023 00.33,05-04-2023 00.57,2023-04-05 01:12:10,24.36,41.0
28-06-2023 11.14,28-06-2023 11.27,2023-06-28 11:41:54,13.05,22.0
12-02-2024 03.20,12-02-2024 03.47,2024-02-12 03:59:32,27.02,17.0
04-08-2023 18.32,04-08-2023 19.05,2023-08-04 19:22:07,32.55,51.0
18-07-2023 06.18,18-07-2023 06.40,2023-07-18 06:50:21,21.24,38.0
07-08-2023 10.43,07-08-2023 10.54,2023-08-07 11:11:19,11.36,32.0
27-12-2023 04.16,27-12-2023 04.51,2023-12-27 05:02:11,34.46,32.0
30-03-2023 9.49,30-03-2023 9.58,2023-03-30 10:12:02.800000000,13.98,10.0
06-04-2023 22.27,06-04-2023 22.48,2023-04-06 23:02:01,20.68,37.0
30-03-2023 21.09,30-03-2023 21.10,2023-03-30 21:16:17.400000000,5.44,44.0
18-02-2024 11.15,18-02-2024 11.32,2024-02-18 11:45:44,16.46,40.0
30-03-2023 12.33,30-03-2023 12.37,2023-03-30 12:43:38.200000000,6.52,
24-06-2023 16.58,24-06-2023 17.28,2023-06-24 17:38:46,29.79,32.0
2024/02/01 05:48:05,01-02-2024 06.15,2024-02-01 06:22:12,27.69,46.0
04-12-2023 20.55,04-12-2023 21.22,2023-12-04 21:25:49,26.23,42.0
01-07-2023 22.52,01-07-2023 23.23,2023-07-01 23:34:01,30.32,48.0
30-03-2023 0.10,30-03-2023 0.10,2023-03-30 00:21:54.400000000,11.84,28.0
07-05-2023 00.32,2023-05-07 01:01,2023-05-07 01:17:31,29.26,29.0
03-03-2024 21.47,03-03-2024 22.00,2024-03-03 22:14:42,13.18,28.0
23-10-2023 06.11,23-10-2023 06.45,2023-10-23 06:59:39,33.65,54.0
10-11-2023 19.38,10-11-2023 20.06,2023-11-10 20:20:03,,22.0
25-11-2023 11.39,25-11-2023 11.52,2023-11-25 12:03:35,,19.0
30-03-2023 14.12,30-03-2023 14.16,2023-03-30 14:34:41.000000000,18.15,17.0
30-03-2023 6.51,30-03-2023 6.55,2023-03-30 07:07:08.800000000,11.48,24.0
04-05-2023 09.18,04-05-2023 09.39,2023-05-04 09:48:57,20.42,39.0
16-04-2023 18.45,16-04-2023 19.13,2023-04-16 19:29:45,27.26,35.0
07-11-2023 20.20,07-11-2023 20.46,07-11-2023 20:56:06.898885,26.28,37.0
17-04-2023 14.26,2023-04-17 14:48,2023-04-17 14:55:09,22.72,22.0
26-06-2023 22.41,26-06-2023 23.07,2023-06-26 23:18:49,25.44,50.0
06-03-2024 13.31,06-03-2024 13.51,2024-03-06 13:54:40,19.69,30.0
26-03-2024 09.09,26-03-2024 09.35,2024-03-26 09:45:41,25.89,21.0
23-03-2024 17.29,23-03-2024 17.48,2024-03-23 18:02:05,18.13,23.0
08-04-2023 07.33,08-04-2023 08.00,2023-04-08 08:12:18,26.98,35.0
12-12-2023 09.24,2023-12-12 09:47,2023-12-12 09:53:52,22.16,29.0
26-09-2023 20.48,2023-09-26 21:06,2023-09-26 21:19:57,17.91,25.0
30-03-2023 16.45,30-03-2023 16.53,2023-03-30 16:51:37.400000000,-1.51,27.0
26-05-2023 12.50,26-05-2023 13.09,2023-05-26 13:23:14,18.44,17.0
03-07-2023 22.55,03-07-2023 23.13,2023-07-03 23:17:21,18.53,34.0
29-01-2024 17.41,29-01-2024 18.01,2024-01-29 18:03:57,19.63,9.0
11-06-2023 01.46,11-06-2023 02.08,2023-06-11 02:14:53,21.87,39.0
12-02-2024 15.38,12-02-2024 16.06,2024-02-12 16:19:04,28.82,40.0
26-01-2024 21.07,26-01-2024 21.27,2024-01-26 21:29:26,19.77,31.0
11-07-2023 22.18,11-07-2023 22.40,2023-07-11 22:51:16,21.25,25.0
04-09-2023 14.56,04-09-2023 15.18,2023-09-04 15:20:19,21.97,33.0
2024/01/27 19:41:45,27-01-2024 19.54,2024-01-27 20:07:00,12.77,26.0
03-08-2023 05.49,03-08-2023 06.14,2023-08-03 06:24:50,25.15,37.0
30-03-2023 5.34,30-03-2023 5.40,2023-03-30 05:49:12.000000000,8.9,50.0
10-04-2023 06.07,10-04-2023 06.27,2023-04-10 06:37:56,19.45,24.0
30-03-2023 13.55,30-03-2023 13.57,2023-03-30 14:06:14.200000000,8.47,25.0
30-03-2023 15.45,30-03-2023 15.52,2023-03-30 16:08:41.800000000,15.88,25.0
06-09-2023 08.52,06-09-2023 09.13,2023-09-06 09:30:25,21.57,36.0
23-01-2024 05.41,2024-01-23 06:06,2024-01-23 06:21:18,24.89,43.0
30-03-2023 16.45,30-03-2023 16.48,2023-03-30 17:06:10.399999999,18.04,27.0
2024/01/25 14:29:02,25-01-2024 14.46,2024-01-25 15:01:02,17.56,17.0
27-08-2023 07.37,27-08-2023 07.58,2023-08-27 08:07:10,20.52,39.0
09-09-2023 06.18,09-09-2023 06.52,2023-09-09 07:05:38,34.65,45.0
30-03-2023 1.58,30-03-2023 2.01,2023-03-30 02:09:23.800000000,7.78,27.0
13-09-2023 06.32,13-09-2023 06.51,2023-09-13 06:54:01,18.8,28.0
27-07-2023 07.58,27-07-2023 08.18,2023-07-27 08:36:52,20.1,31.0
22-07-2023 00.41,2023-07-22 00:59,2023-07-22 01:15:04,18.25,13.0
04-06-2023 01.05,04-06-2023 01.27,2023-06-04 01:37:31,22.06,26.0
18-03-2024 03.07,18-03-2024 03.24,2024-03-18 03:28:49,16.34,41.0
29-04-2023 23.06,29-04-2023 23.30,2023-04-29 23:35:54,23.54,48.0
2023/08/20 14:51:02,20-08-2023 15.00,2023-08-20 15:12:45,9.65,10.0
01-11-2023 04.29,01-11-2023 04.58,2023-11-01 05:18:13,28.63,33.0
26-03-2024 15.25,26-03-2024 15.52,2024-03-26 16:11:19,27.17,43.0
12-02-2024 05.26,12-02-2024 05.45,2024-02-12 06:03:10,18.41,
09-09-2023 19.02,09-09-2023 19.15,2023-09-09 19:22:51,,18.0
09-12-2023 22.24,09-12-2023 22.50,2023-12-09 23:06:12,26.41,30.0
18-05-2023 04.04,18-05-2023 04.22,2023-05-18 04:35:09,18.46,14.0
30-03-2023 13.55,30-03-2023 13.58,2023-03-30 14:11:01.600000000,12.26,25.0
30-03-2023 8.42,30-03-2023 8.42,2023-03-30 08:49:26.000000000,6.65,47.0
28-02-2024 08.47,28-02-2024 09.10,2024-02-28 09:16:02,22.86,10.0
30-03-2023 0.10,30-03-2023 0.19,2023-03-30 00:25:33.400000000,6.49,28.0
11-10-2023 20.30,11-10-2023 20.47,2023-10-11 20:49:17,17.15,162.0
26-06-2023 02.04,26-06-2023 02.27,2023-06-26 02:29:49,23.01,25.0
04-12-2023 07.22,04-12-2023 07.45,2023-12-04 07:58:36,22.55,37.0
21-09-2023 17.00,21-09-2023 17.23,2023-09-21 17:39:37,23.05,
05-09-2023 04.43,05-09-2023 04.59,2023-09-05 05:07:23,16.05,30.0
25-03-2024 17.19,25-03-2024 17.39,2024-03-25 17:50:39,19.41,46.0
15-06-2023 07.17,15-06-2023 07.37,2023-06-15 07:53:37,19.85,24.0
12-07-2023 14.43,12-07-2023 15.08,2023-07-12 15:18:41,24.49,47.0
16-10-2023 03.02,16-10-2023 03.28,2023-10-16 03:39:50,25.83,34.0
30-03-2023 3.02,30-03-2023 3.10,2023-03-30 03:19:58.800000000,9.73,45.0
03-03-2024 16.10,03-03-2024 16.48,2024-03-03 17:00:34,37.84,61.0
30-03-2023 6.51,30-03-2023 7.00,2023-03-30 07:07:31.000000000,6.85,24.0
30-03-2023 3.02,30-03-2023 3.12,2023-03-30 03:19:13.800000000,6.98,45.0
20-04-2023 00.45,20-04-2023 01.00,2023-04-20 01:14:12,15.85,27.0
29-10-2023 22.29,29-10-2023 22.56,29-10-2023 23:01:04.417927,27.5,35.0
03-11-2023 04.42,03-11-2023 05.23,2023-11-03 05:41:01,41.17,61.0
17-07-2023 01.17,17-07-2023 01.27,2023-07-17 01:39:18,10.2,8.0
04-04-2023 18.36,04-04-2023 19.00,2023-04-04 19:19:17,24.38,31.0
26-04-2023 10.23,26-04-2023 10.59,2023-04-26 11:12:42,35.94,39.0
12-12-2023 22.49,2023-12-12 23:20,2023-12-12 23:24:15,31.56,36.0
18-07-2023 17.24,18-07-2023 17.44,2023-07-18 17:56:14,20.58,17.0
10-10-2023 16.23,10-10-2023 16.45,2023-10-10 16:53:44,22.5,27.0
27-05-2023 07.28,27-05-2023 07.43,2023-05-27 07:46:08,15.37,27.0
,26-08-2023 05.16,2023-08-26 05:30:41,53.58,10.0
15-05-2023 07.26,15-05-2023 07.41,2023-05-15 07:57:10,14.79,25.0
12-05-2023 07.46,12-05-2023 08.03,2023-05-12 08:20:46,16.46,30.0
28-03-2024 13.54,28-03-2024 14.23,2024-03-28 14:30:49,28.47,38.0
11-03-2024 13.52,11-03-2024 14.07,2024-03-11 14:14:57,15.45,
30-03-2023 5.34,30-03-2023 5.37,2023-03-30 05:43:57.600000000,,50.0
28-10-2023 16.07,28-10-2023 16.20,2023-10-28 16:29:27,12.97,5.0
30-03-2023 20.49,30-03-2023 20.56,2023-03-30 20:57:38.000000000,0.7,22.0
2024/02/12 11:44:46,12-02-2024 11.57,2024-02-12 12:01:27,12.7,13.0
10-08-2023 20.50,10-08-2023 21.19,2023-08-10 21:40:04,,29.0
27-10-2023 14.01,27-10-2023 14.21,2023-10-27 14:38:55,19.95,25.0
26-01-2024 10.14,2024-01-26 10:33,2024-01-26 10:35:17,19.03,34.0
13-01-2024 00.44,13-01-2024 01.11,2024-01-13 01:21:57,26.12,23.0
17-02-2024 22.52,17-02-2024 23.17,2024-02-17 23:35:17,,48.0
27-12-2023 22.48,27-12-2023 23.06,27-12-2023 23:13:28.924195,17.77,28.0
2023/12/08 03:16:27,08-12-2023 03.45,2023-12-08 03:50:21,157.11,62.0
30-03-2023 16.45,30-03-2023 16.47,2023-03-30 16:57:41.000000000,10.55,27.0
12-02-2024 05.19,12-02-2024 05.40,2024-02-12 05:50:58,20.95,30.0
11-04-2023 11.34,11-04-2023 12.05,2023-04-11 12:18:51,30.72,35.0
05-10-2023 12.04,05-10-2023 12.29,2023-10-05 12:36:56,24.83,48.0
19-02-2024 17.48,19-02-2024 17.58,2024-02-19 18:06:44,10.48,14.0
30-03-2023 3.02,30-03-2023 3.11,2023-03-30 03:25:03.600000000,13.81,45.0
03-02-2024 01.13,03-02-2024 01.41,2024-02-03 01:49:29,27.96,33.0
22-07-2023 20.56,22-07-2023 21.11,2023-07-22 21:23:37,14.78,27.0
24-11-2023 05.59,24-11-2023 06.22,2023-11-24 06:31:36,22.8,22.0
17-07-2023 04.30,17-07-2023 04.52,2023-07-17 05:03:14,21.84,32.0
30-03-2023 6.51,30-03-2023 6.51,2023-03-30 07:10:19.000000000,18.65,24.0
2024/01/16 05:13:19,16-01-2024 05.25,2024-01-16 05:34:23,11.79,3.0
26-06-2023 13.59,26-06-2023 14.15,2023-06-26 14:24:17,15.78,27.0
03-08-2023 21.47,03-08-2023 22.20,2023-08-03 22:25:48,33.18,50.0
24-07-2023 02.24,24-07-2023 02.47,2023-07-24 02:55:33,22.8,33.0
30-03-2023 5.34,30-03-2023 5.41,2023-03-30 05:53:32.400000000,12.24,50.0
30-03-2023 1.58,30-03-2023 1.58,2023-03-30 02:21:26.200000000,22.82,27.0
2023/10/19 22:09:12,19-10-2023 22.30,2023-10-19 22:40:56,21.65,23.0
24-12-2023 19.18,24-12-2023 19.29,2023-12-24 19:38:02,10.82,14.0
2023/10/28 02:15:44,28-10-2023 02.39,2023-10-28 02:55:45,23.83,29.0
06-10-2023 10.22,06-10-2023 10.45,2023-10-06 10:56:41,22.72,58.0
02-11-2023 10.37,02-11-2023 11.10,2023-11-02 11:19:42,33.63,49.0
2024/03/04 11:18:58,04-03-2024 11.32,2024-03-04 11:40:08,13.5,25.0
21-04-2023 05.02,21-04-2023 05.28,2023-04-21 05:36:55,26.7,40.0
02-12-2023 21.28,02-12-2023 21.48,2023-12-02 21:57:43,19.61,30.0
14-05-2023 22.14,14-05-2023 22.36,2023-05-14 22:38:22,22.21,30.0
14-08-2023 10.38,14-08-2023 10.55,2023-08-14 11:06:02,16.52,24.0
25-09-2023 02.45,25-09-2023 03.11,2023-09-25 03:19:09,25.69,36.0
31-10-2023 20.30,2023-10-31 20:53,2023-10-31 21:13:57,23.13,26.0
04-03-2024 03.59,04-03-2024 04.14,2024-03-04 04:24:43,,18.0
25-09-2023 07.34,25-09-2023 08.07,2023-09-25 08:25:11,32.91,42.0
02-04-2023 23.57,03-04-2023 00.19,2023-04-03 00:35:39,22.41,26.0
30-03-2023 18.31,30-03-2023 18.34,2023-03-30 18:46:36.000000000,12.2,30.0
03-11-2023 08.07,03-11-2023 08.30,2023-11-03 08:39:12,23.39,28.0
30-08-2023 23.10,30-08-2023 22.50,2023-08-30 23:21:08,20.52,39.0
07-11-2023 18.18,07-11-2023 18.32,07-11-2023 18:43:35.748418,14.59,
27-10-2023 04.47,27-10-2023 05.15,2023-10-27 05:23:04,28.26,31.0
20-05-2023 00.23,20-05-2023 00.43,2023-05-20 00:55:55,20.06,24.0
30-03-2023 5.34,30-03-2023 5.35,2023-03-30 05:41:54.000000000,6.6,50.0
14-07-2023 04.36,14-07-2023 04.54,2023-07-14 05:04:17,18.29,32.0
16-10-2023 08.25,2023-10-16 08:43,2023-10-16 08:51:34,18.15,36.0
19-02-2024 13.37,19-02-2024 13.58,2024-02-19 14:09:14,21.04,28.0
28-06-2023 06.08,28-06-2023 06.26,2023-06-28 06:39:15,18.11,32.0
01-07-2023 02.54,01-07-2023 03.15,2023-07-01 03:27:58,20.86,38.0
14-04-2023 23.53,15-04-2023 00.13,2023-04-15 00:27:10,20.08,18.0
14-01-2024 13.22,14-01-2024 13.51,2024-01-14 14:02:37,28.53,46.0
16-08-2023 22.14,16-08-2023 22.22,2023-08-16 22:31:39,7.52,12.0
05-08-2023 23.24,05-08-2023 23.42,2023-08-05 23:49:30,18.11,42.0
2024/01/26 14:58:26,26-01-2024 15.21,2024-01-26 15:32:27,23.07,41.0
31-03-2023 19.50,31-03-2023 20.17,2023-03-31 20:33:05,27.09,31.0
,10-06-2023 06.53,2023-06-10 06:57:54,24.83,37.0
2023/07/26 07:29:41,26-07-2023 07.48,2023-07-26 07:54:47,18.34,23.0
07-07-2023 17.17,07-07-2023 17.45,2023-07-07 17:54:37,28.59,55.0
07-07-2023 19.24,07-07-2023 19.52,2023-07-07 20:06:37,28.2,29.0
15-06-2023 18.42,15-06-2023 18.53,2023-06-15 18:57:15,11.18,206.0
01-09-2023 18.53,01-09-2023 19.09,2023-09-01 19:24:26,15.23,12.0
12-01-2024 16.08,12-01-2024 16.33,2024-01-12 16:42:55,24.66,31.0
09-11-2023 04.32,09-11-2023 04.49,2023-11-09 04:57:05,16.18,24.0
26-09-2023 12.51,26-09-2023 13.13,2023-09-26 13:21:02,21.47,43.0
02-11-2023 15.13,02-11-2023 15.36,2023-11-02 15:49:46,23.42,25.0
30-03-2023 18.31,30-03-2023 18.31,2023-03-30 18:41:57.600000000,10.56,
02-10-2023 23.49,03-10-2023 00.05,2023-10-03 00:20:37,16.83,17.0
24-01-2024 02.45,24-01-2024 03.00,2024-01-24 03:04:38,15.02,34.0
15-08-2023 01.12,15-08-2023 01.23,2023-08-15 01:39:55,11.47,18.0
09-05-2023 21.54,09-05-2023 22.18,2023-05-09 22:32:05,24.08,43.0
2023/06/15 11:42:51,2023-06-15 12:01,2023-06-15 12:20:07,18.87,26.0
01-10-2023 11.42,01-10-2023 12.07,2023-10-01 12:19:26,25.13,29.0
30-03-2023 8.42,30-03-2023 8.48,2023-03-30 08:52:24.200000000,3.62,47.0
02-01-2024 19.26,02-01-2024 19.57,2024-01-02 20:00:35,30.73,43.0
30-03-2023 21.09,30-03-2023 21.14,2023-03-30 21:24:12.000000000,9.35,44.0
07-09-2023 00.19,07-09-2023 00.00,2023-09-07 00:31:52,19.06,19.0
26-05-2023 01.16,26-05-2023 01.41,2023-05-26 01:52:35,24.87,19.0
15-04-2023 09.35,15-04-2023 09.53,2023-04-15 10:11:33,18.79,21.0
18-04-2023 11.22,18-04-2023 11.43,18-04-2023 11:48:38.978757,20.92,40.0
25-06-2023 22.41,2023-06-25 23:04,2023-06-25 23:06:05,22.8,40.0
25-06-2023 16.44,25-06-2023 17.04,2023-06-25 17:08:46,19.56,34.0
06-03-2024 00.44,06-03-2024 01.06,2024-03-06 01:18:52,21.93,23.0
26-07-2023 22.23,26-07-2023 22.48,2023-07-26 23:04:24,25.01,50.0
30-03-2023 10.58,30-03-2023 11.21,2023-03-30 11:33:50,23.71,35.0
22-06-2023 10.11,22-06-2023 10.33,2023-06-22 10:43:03,22.11,37.0
07-11-2023 23.16,07-11-2023 22.59,2023-11-07 23:21:15,17.46,0.0
10-06-2023 10.00,10-06-2023 10.19,2023-06-10 10:32:50,19.06,23.0
31-05-2023 00.50,31-05-2023 01.18,2023-05-31 01:25:57,28.02,49.0
07-12-2023 12.44,07-12-2023 13.09,2023-12-07 13:20:03,24.56,41.0
12-08-2023 06.52,12-08-2023 07.06,2023-08-12 07:17:03,14.63,15.0
09-01-2024 15.57,09-01-2024 16.17,2024-01-09 16:22:49,19.86,20.0
18-01-2024 04.38,18-01-2024 05.02,18-01-2024 05:15:23.994374,23.64,27.0
12-03-2024 17.01,12-03-2024 17.27,2024-03-12 17:38:21,26.32,40.0
29-02-2024 16.17,29-02-2024 16.51,2024-02-29 16:58:43,33.04,45.0
2023/07/09 08:48:01,2023-07-09 09:06,2023-07-09 09:19:29,18.75,228.0
19-09-2023 19.05,19-09-2023 19.21,2023-09-19 19:35:31,73.03,23.0
29-10-2023 14.03,29-10-2023 14.21,2023-10-29 14:37:28,17.8,18.0
16-05-2023 11.11,16-05-2023 11.29,2023-05-16 11:40:54,18.48,3.0
06-01-2024 11.05,06-01-2024 11.34,2024-01-06 11:43:42,29.13,30.0
29-07-2023 00.42,29-07-2023 01.09,2023-07-29 01:16:23,26.84,24.0
15-06-2023 02.27,15-06-2023 02.46,15-06-2023 02:56:06.385411,19.0,30.0
,14-09-2023 20.48,2023-09-14 20:57:21,15.41,
26-11-2023 12.19,26-11-2023 12.40,2023-11-26 12:58:57,,23.0
02-09-2023 14.26,02-09-2023 14.41,2023-09-02 14:57:50,15.43,37.0
25-04-2023 04.56,25-04-2023 05.22,2023-04-25 05:29:49,26.04,44.0
,18-09-2023 04.01,2023-09-18 04:11:06,17.11,22.0
28-09-2023 20.46,28-09-2023 21.10,2023-09-28 21:34:11,141.74,35.0
30-03-2023 21.09,30-03-2023 21.15,2023-03-30 21:25:03.000000000,9.2,44.0
30-03-2023 3.02,30-03-2023 3.10,2023-03-30 03:28:37.800000000,18.38,45.0
26-11-2023 01.48,26-11-2023 02.08,2023-11-26 02:15:35,19.98,14.0
2024/01/08 22:03:26,08-01-2024 22.27,2024-01-08 22:48:21,24.13,36.0
14-01-2024 07.12,14-01-2024 07.41,2024-01-14 07:53:15,29.66,46.0
16-09-2023 02.11,2023-09-16 02:37,2023-09-16 02:53:07,25.81,58.0
03-10-2023 02.07,03-10-2023 02.29,2023-10-03 02:33:12,21.44,24.0
18-09-2023 11.54,18-09-2023 12.17,2023-09-18 12:27:56,23.33,30.0
27-06-2023 18.02,27-06-2023 18.22,2023-06-27 18:32:34,19.84,23.0
16-12-2023 03.07,16-12-2023 03.26,2023-12-16 03:35:15,18.97,24.0
30-03-2023 13.55,30-03-2023 14.03,2023-03-30 14:17:02.199999999,13.27,25.0
02-09-2023 06.56,02-09-2023 07.07,2023-09-02 07:09:08,11.06,7.0
16-04-2023 22.26,2023-04-16 22:56,2023-04-16 23:08:46,29.79,38.0
20-09-2023 23.26,20-09-2023 23.46,2023-09-20 23:55:55,20.34,20.0
21-07-2023 06.41,21-07-2023 07.01,2023-07-21 07:16:32,19.62,39.0
21-01-2024 23.27,21-01-2024 23.47,2024-01-21 23:57:35,20.62,39.0
03-05-2023 16.47,03-05-2023 16.57,2023-05-03 17:10:00,9.3,7.0
16-10-2023 21.00,16-10-2023 21.21,2023-10-16 21:36:33,21.41,27.0
30-03-2023 6.51,30-03-2023 6.51,2023-03-30 06:55:07.000000000,3.45,24.0
30-03-2023 5.34,30-03-2023 5.36,2023-03-30 05:42:33.000000000,6.25,50.0
,14-05-2023 21.17,2023-05-14 21:37:41,,32.0
30-03-2023 18.31,30-03-2023 18.40,2023-03-30 18:50:31.800000000,10.13,30.0
22-12-2023 23.17,22-12-2023 23.51,2023-12-22 23:53:34,34.25,64.0
11-04-2023 00.05,11-04-2023 00.28,11-04-2023 00:41:10.060423,23.29,42.0
,15-06-2023 02.43,2023-06-15 02:54:21,29.81,57.0
25-07-2023 17.10,25-07-2023 17.39,2023-07-25 17:54:08,28.28,41.0
13-02-2024 23.54,14-02-2024 00.12,2024-02-14 00:16:55,17.66,32.0
24-05-2023 00.03,24-05-2023 00.25,2023-05-24 00:41:37,21.66,32.0
2023/04/05 00:37:48,05-04-2023 00.56,2023-04-05 00:58:56,19.13,31.0
22-04-2023 22.12,22-04-2023 22.24,2023-04-22 22:26:45,11.96,21.0
17-06-2023 03.17,17-06-2023 03.44,2023-06-17 03:52:34,27.94,38.0
07-01-2024 13.52,07-01-2024 14.26,2024-01-07 14:35:14,34.39,41.0
26-08-2023 19.38,26-08-2023 19.52,26-08-2023 20:09:48.446414,14.16,18.0
20-06-2023 05.20,20-06-2023 05.49,20-06-2023 06:04:23.607927,29.09,23.0
21-08-2023 13.41,21-08-2023 13.57,2023-08-21 14:05:08,15.85,12.0
30-03-2023 12.33,30-03-2023 12.43,2023-03-30 12:47:28.000000000,4.35,40.0
16-06-2023 13.07,16-06-2023 13.30,2023-06-16 13:38:01,22.63,24.0
20-11-2023 01.41,20-11-2023 01.54,2023-11-20 02:05:39,13.48,25.0
26-02-2024 01.13,26-02-2024 01.36,2024-02-26 01:47:22,23.69,50.0
12-10-2023 02.12,12-10-2023 02.32,2023-10-12 02:47:06,20.18,153.0
18-12-2023 22.38,18-12-2023 23.03,2023-12-18 23:10:48,,23.0
17-02-2024 20.41,17-02-2024 21.03,2024-02-17 21:09:46,21.83,17.0
30-03-2023 12.33,30-03-2023 12.38,2023-03-30 12:57:11.800000000,19.08,40.0
18-04-2023 11.47,18-04-2023 12.12,2023-04-18 12:18:44,25.42,41.0
16-06-2023 12.42,16-06-2023 13.01,2023-06-16 13:05:20,18.9,20.0
16-01-2024 07.48,16-01-2024 08.11,2024-01-16 08:22:06,23.03,54.0
11-07-2023 23.34,11-07-2023 23.47,2023-07-12 00:05:24,12.78,24.0
18-09-2023 05.50,18-09-2023 06.11,2023-09-18 06:27:48,21.49,45.0
08-05-2023 16.00,08-05-2023 16.25,2023-05-08 16:33:04,25.67,32.0
,17-01-2024 00.22,2024-01-17 00:38:15,22.74,41.0
03-08-2023 03.04,03-08-2023 03.30,2023-08-03 03:48:45,26.73,48.0
01-02-2024 17.20,01-02-2024 17.43,2024-02-01 17:47:02,22.35,35.0
14-05-2023 04.14,14-05-2023 04.41,2023-05-14 04:52:43,26.65,22.0
08-05-2023 20.16,08-05-2023 20.36,2023-05-08 20:48:26,20.7,27.0
30-03-2023 1.58,30-03-2023 2.05,2023-03-30 02:20:43.599999999,15.11,27.0
29-08-2023 04.19,29-08-2023 04.46,2023-08-29 05:01:58,26.95,38.0
28-11-2023 22.44,2023-11-28 23:04,2023-11-28 23:16:11,19.74,16.0
2024/02/16 02:11:36,16-02-2024 02.33,2024-02-16 02:48:55,21.71,40.0
09-07-2023 13.20,09-07-2023 13.43,2023-07-09 13:57:13,22.48,29.0
11-01-2024 10.21,11-01-2024 10.37,2024-01-11 10:52:10,16.11,13.0
20-05-2023 03.03,20-05-2023 03.24,2023-05-20 03:33:54,21.76,30.0
24-02-2024 23.50,2024-02-25 00:24,2024-02-25 00:35:15,34.08,41.0
03-02-2024 00.59,03-02-2024 01.23,2024-02-03 01:28:17,23.96,42.0
03-04-2023 13.21,03-04-2023 13.52,2023-04-03 14:09:01,30.16,54.0
16-12-2023 09.28,16-12-2023 09.41,2023-12-16 09:56:26,12.82,0.0
15-06-2023 07.01,15-06-2023 07.23,15-06-2023 07:40:47.697679,22.64,37.0
,19-12-2023 22.14,19-12-2023 22:29:39.917439,20.46,24.0
06-06-2023 01.45,06-06-2023 02.03,2023-06-06 02:05:14,117.52,31.0
13-05-2023 11.25,13-05-2023 11.54,2023-05-13 11:58:20,,41.0
09-07-2023 12.52,09-07-2023 13.16,2023-07-09 13:18:27,,37.0
13-01-2024 05.48,2024-01-13 06:16,2024-01-13 06:21:14,27.97,36.0
02-03-2024 08.14,02-03-2024 08.26,2024-03-02 08:33:17,12.31,34.0
30-03-2023 10.31,30-03-2023 10.38,2023-03-30 10:39:24.800000000,1.03,32.0
26-02-2024 20.03,26-02-2024 20.19,2024-02-26 20:28:31,15.77,29.0
30-03-2023 17.34,30-03-2023 17.41,2023-03-30 17:45:27.200000000,3.57,16.0
15-11-2023 06.57,15-11-2023 07.25,2023-11-15 07:35:17,28.29,34.0
08-07-2023 17.15,2023-07-08 17:34,2023-07-08 17:36:32,95.32,20.0
10-06-2023 03.43,10-06-2023 04.05,2023-06-10 04:13:49,21.56,32.0
22-06-2023 00.50,2023-06-22 01:12,2023-06-22 01:31:23,22.07,
13-05-2023 12.12,13-05-2023 12.36,2023-05-13 12:48:28,24.69,33.0
18-08-2023 15.30,18-08-2023 16.00,2023-08-18 16:06:22,29.89,27.0
05-08-2023 12.07,05-08-2023 12.31,2023-08-05 12:42:20,24.01,30.0
16-01-2024 08.36,16-01-2024 08.52,2024-01-16 09:06:54,15.52,27.0
21-01-2024 02.04,21-01-2024 02.27,2024-01-21 02:47:09,23.87,50.0
23-12-2023 04.21,23-12-2023 04.49,2023-12-23 04:54:58,27.88,32.0
15-01-2024 19.53,15-01-2024 20.10,2024-01-15 20:18:24,16.87,30.0
30-03-2023 12.33,30-03-2023 12.43,2023-03-30 12:54:04.000000000,10.95,40.0
22-05-2023 13.38,22-05-2023 14.10,2023-05-22 14:19:35,32.69,53.0
27-11-2023 05.29,27-11-2023 05.56,27-11-2023 06:04:31.541811,27.25,39.0
22-05-2023 14.41,22-05-2023 15.11,2023-05-22 15:26:37,30.13,53.0
,13-03-2024 20.13,2024-03-13 20:25:57,12.72,5.0
24-04-2023 03.05,24-04-2023 03.23,2023-04-24 03:36:39,18.22,26.0
30-03-2023 13.55,30-03-2023 13.59,2023-03-30 14:13:24.400000000,13.64,25.0
30-03-2023 5.34,30-03-2023 5.39,2023-03-30 05:57:41.400000000,18.39,50.0
12-12-2023 00.14,12-12-2023 00.41,2023-12-12 00:53:17,26.3,36.0
28-04-2023 05.23,28-04-2023 05.44,2023-04-28 06:00:40,20.33,33.0
07-10-2023 04.14,07-10-2023 04.29,2023-10-07 04:47:14,,35.0
11-07-2023 15.12,11-07-2023 15.34,2023-07-11 15:42:03,22.38,44.0
25-10-2023 12.53,25-10-2023 13.20,2023-10-25 13:33:20,27.31,41.0
2023/12/12 10:04:10,12-12-2023 10.27,2023-12-12 10:41:30,23.37,33.0
11-06-2023 05.05,11-06-2023 05.31,2023-06-11 05:40:00,25.89,30.0
28-07-2023 23.52,29-07-2023 00.22,2023-07-29 00:38:45,29.78,32.0
10-12-2023 09.36,2023-12-10 09:57,2023-12-10 10:08:15,21.64,23.0
23-12-2023 03.34,23-12-2023 03.26,2023-12-23 03:44:06,7.17,13.0
26-07-2023 04.53,26-07-2023 05.14,2023-07-26 05:20:03,20.84,22.0
30-03-2023 10.31,30-03-2023 10.33,2023-03-30 10:42:10.400000000,8.79,32.0
08-07-2023 14.43,08-07-2023 15.12,2023-07-08 15:20:48,28.42,34.0
01-09-2023 09.24,2023-09-01 09:48,2023-09-01 10:08:02,24.45,24.0
04-02-2024 00.57,04-02-2024 01.23,2024-02-04 01:35:23,26.35,45.0
21-10-2023 21.26,21-10-2023 21.43,2023-10-21 21:54:08,17.49,43.0
23-06-2023 14.41,23-06-2023 15.03,2023-06-23 15:10:16,21.55,23.0
03-03-2024 16.57,03-03-2024 17.34,2024-03-03 17:42:49,37.01,57.0
30-03-2023 0.10,30-03-2023 0.11,2023-03-30 00:19:27.400000000,8.39,28.0
23-10-2023 05.42,23-10-2023 06.10,2023-10-23 06:20:20,27.44,35.0
08-09-2023 12.41,08-09-2023 13.10,2023-09-08 13:16:49,29.37,39.0
28-08-2023 10.16,2023-08-28 10:28,2023-08-28 10:37:30,47.51,22.0
10-07-2023 10.07,10-07-2023 10.14,2023-07-10 10:22:50,7.18,5.0
27-07-2023 13.01,27-07-2023 13.17,2023-07-27 13:28:04,16.08,29.0
04-02-2024 01.15,04-02-2024 01.35,2024-02-04 01:42:00,20.18,28.0
16-08-2023 22.02,16-08-2023 22.33,2023-08-16 22:38:07,30.36,56.0
27-07-2023 16.46,27-07-2023 17.09,2023-07-27 17:11:27,22.37,27.0
17-06-2023 04.21,17-06-2023 04.39,2023-06-17 04:52:31,18.46,21.0
14-07-2023 18.11,14-07-2023 18.28,2023-07-14 18:39:05,16.99,21.0
03-08-2023 07.08,03-08-2023 07.20,2023-08-03 07:23:44,12.45,25.0
19-03-2024 06.42,19-03-2024 07.10,2024-03-19 07:26:05,28.02,44.0
30-03-2023 15.45,30-03-2023 15.53,2023-03-30 15:58:00.400000000,4.19,25.0
21-04-2023 20.17,21-04-2023 20.50,2023-04-21 21:09:39,33.44,65.0
27-09-2023 21.05,27-09-2023 21.25,2023-09-27 21:37:22,19.66,29.0
21-11-2023 16.34,21-11-2023 16.57,2023-11-21 17:07:16,23.53,49.0
17-04-2023 13.52,17-04-2023 14.24,2023-04-17 14:31:47,31.2,37.0
03-05-2023 03.48,03-05-2023 04.13,2023-05-03 04:20:16,,44.0
05-03-2024 16.38,05-03-2024 17.06,2024-03-05 17:22:09,27.56,37.0
10-09-2023 14.11,10-09-2023 14.34,2023-09-10 14:46:54,23.49,37.0
07-11-2023 18.42,07-11-2023 19.02,07-11-2023 19:15:41.233009,20.27,33.0
,30-03-2023 8.45,2023-03-30 08:54:27.200000000,8.67,47.0
27-11-2023 13.53,27-11-2023 14.04,2023-11-27 14:12:20,11.85,43.0
31-10-2023 10.16,31-10-2023 10.39,2023-10-31 10:55:53,23.07,32.0
06-11-2023 06.26,06-11-2023 07.05,2023-11-06 07:07:30,38.66,58.0
05-01-2024 02.09,2024-01-05 02:40,2024-01-05 02:55:03,30.84,52.0
19-03-2024 16.03,19-03-2024 16.27,19-03-2024 16:36:51.124322,24.11,37.0
22-05-2023 22.44,22-05-2023 23.05,2023-05-22 23:27:11,20.68,24.0
29-06-2023 09.57,29-06-2023 10.28,2023-06-29 10:43:28,30.47,37.0
01-01-2024 19.45,01-01-2024 20.11,2024-01-01 20:15:41,26.11,9.0
03-08-2023 04.46,2023-08-03 05:25,2023-08-03 05:45:39,39.54,46.0
25-12-2023 06.28,2023-12-25 06:47,2023-12-25 06:56:16,19.12,3.0
17-08-2023 09.59,17-08-2023 10.11,2023-08-17 10:16:46,11.74,24.0
2023/09/08 21:19:00,08-09-2023 21.47,2023-09-08 21:54:32,28.73,44.0
11-11-2023 07.38,11-11-2023 08.02,2023-11-11 08:14:53,24.2,37.0
25-04-2023 05.06,25-04-2023 05.28,2023-04-25 05:36:47,21.85,22.0
26-12-2023 22.17,26-12-2023 22.40,2023-12-26 22:50:12,22.7,27.0
26-08-2023 11.24,26-08-2023 11.45,2023-08-26 11:56:46,20.63,50.0
31-12-2023 03.08,31-12-2023 03.30,2023-12-31 03:35:01,22.87,24.0
09-06-2023 08.37,09-06-2023 08.55,2023-06-09 09:06:35,17.38,24.0
26-12-2023 10.06,26-12-2023 10.44,2023-12-26 10:58:29,38.13,34.0
29-12-2023 07.28,29-12-2023 07.59,2023-12-29 08:10:38,31.28,50.0
01-10-2023 03.09,01-10-2023 03.35,2023-10-01 03:44:57,26.11,140.0
10-05-2023 22.07,10-05-2023 22.30,2023-05-10 22:54:42,23.88,25.0
01-06-2023 04.45,2023-06-01 05:08,01-06-2023 05:21:02.294476,22.46,23.0
2023/06/06 19:12:05,06-06-2023 19.34,2023-06-06 19:53:48,22.7,47.0
18-12-2023 07.21,18-12-2023 07.37,2023-12-18 07:43:25,16.33,17.0
17-10-2023 13.54,17-10-2023 14.34,2023-10-17 14:45:31,39.9,47.0
14-11-2023 19.20,14-11-2023 19.36,2023-11-14 19:41:26,16.86,18.0
30-03-2023 5.34,30-03-2023 5.35,2023-03-30 05:37:37.200000000,2.32,50.0
20-08-2023 13.02,20-08-2023 13.20,2023-08-20 13:31:46,18.15,46.0
23-05-2023 17.39,23-05-2023 17.57,2023-05-23 18:11:59,18.01,32.0
14-07-2023 05.46,14-07-2023 06.03,14-07-2023 06:11:00.537339,17.74,32.0
24-07-2023 05.20,24-07-2023 05.29,2023-07-24 05:31:46,9.2,0.0
06-10-2023 14.07,06-10-2023 14.16,2023-10-06 14:33:09,,20.0
30-03-2023 14.12,30-03-2023 14.19,2023-03-30 14:30:53.599999999,11.36,17.0
21-04-2023 13.38,21-04-2023 13.55,2023-04-21 14:07:12,16.93,27.0
29-08-2023 11.35,29-08-2023 11.58,2023-08-29 12:00:14,22.36,30.0
25-05-2023 01.49,2023-05-25 02:15,2023-05-25 02:22:56,26.34,46.0
29-07-2023 22.58,29-07-2023 23.31,2023-07-29 23:39:42,32.87,51.0
30-09-2023 09.18,30-09-2023 09.41,30-09-2023 09:55:13.680492,22.84,35.0
06-11-2023 04.04,06-11-2023 04.31,06-11-2023 04:37:16.089610,27.47,55.0
18-01-2024 17.24,18-01-2024 17.44,2024-01-18 17:51:55,19.75,23.0
18-08-2023 00.48,18-08-2023 01.00,2023-08-18 01:05:52,12.7,25.0
09-06-2023 08.42,09-06-2023 09.01,2023-06-09 09:11:07,18.99,40.0
28-03-2024 03.48,28-03-2024 04.09,2024-03-28 04:12:53,21.01,31.0
2023/12/28 10:55:56,28-12-2023 11.16,2023-12-28 11:26:45,20.26,49.0
30-03-2023 14.12,30-03-2023 14.15,2023-03-30 14:23:40.400000000,8.14,17.0
27-04-2023 09.12,27-04-2023 09.40,2023-04-27 09:49:25,28.1,37.0
30-03-2023 13.55,30-03-2023 13.57,2023-03-30 14:14:53.200000000,17.12,25.0
16-10-2023 09.00,16-10-2023 09.31,2023-10-16 09:48:57,30.69,
27-07-2023 18.04,27-07-2023 18.20,2023-07-27 18:26:49,16.36,21.0
20-02-2024 02.32,20-02-2024 02.54,2024-02-20 03:04:41,22.47,35.0
14-02-2024 19.08,14-02-2024 19.32,2024-02-14 19:34:23,24.39,228.0
03-09-2023 10.30,03-09-2023 10.48,2023-09-03 11:00:01,17.31,22.0
09-07-2023 12.43,09-07-2023 13.12,2023-07-09 13:25:58,28.75,30.0
15-04-2023 16.10,2023-04-15 16:33,2023-04-15 16:38:29,23.81,51.0
08-03-2024 20.39,08-03-2024 21.17,2024-03-08 21:26:05,37.56,53.0
30-03-2023 0.10,30-03-2023 0.14,2023-03-30 00:21:20.800000000,7.28,28.0
28-01-2024 13.42,28-01-2024 14.03,2024-01-28 14:05:13,20.63,20.0
03-03-2024 10.59,03-03-2024 11.30,03-03-2024 11:40:23.268988,30.83,46.0
29-11-2023 14.10,29-11-2023 14.31,2023-11-29 14:41:46,20.55,29.0
15-05-2023 17.54,15-05-2023 18.14,2023-05-15 18:30:03,19.75,31.0
02-11-2023 13.29,02-11-2023 13.59,2023-11-02 14:13:59,29.69,33.0
02-11-2023 11.52,02-11-2023 12.19,02-11-2023 12:36:06.541957,,22.0
30-06-2023 23.58,01-07-2023 00.26,2023-07-01 00:33:18,28.6,32.0
11-08-2023 15.32,11-08-2023 15.57,2023-08-11 16:11:14,25.17,16.0
04-04-2023 03.53,04-04-2023 04.09,2023-04-04 04:22:03,15.71,31.0
30-03-2023 3.02,30-03-2023 3.03,2023-03-30 03:05:03.000000000,1.8,45.0
30-03-2023 5.34,30-03-2023 5.39,2023-03-30 05:43:21.599999999,,50.0
14-08-2023 12.22,14-08-2023 12.44,2023-08-14 12:49:51,22.31,33.0
06-09-2023 22.59,06-09-2023 23.24,06-09-2023 23:35:05.149330,24.76,37.0
20-10-2023 15.29,20-10-2023 15.52,2023-10-20 15:57:16,23.33,47.0
19-06-2023 09.57,19-06-2023 10.17,2023-06-19 10:25:26,19.61,40.0
16-02-2024 21.59,16-02-2024 22.11,2024-02-16 22:26:57,11.84,19.0
25-10-2023 19.35,25-10-2023 19.55,2023-10-25 20:06:59,,21.0
04-07-2023 04.51,04-07-2023 05.10,2023-07-04 05:21:24,18.95,18.0
21-10-2023 11.53,21-10-2023 12.10,2023-10-21 12:17:58,17.35,28.0
17-11-2023 23.00,17-11-2023 23.21,2023-11-17 23:23:21,21.06,39.0
05-05-2023 21.51,05-05-2023 22.14,2023-05-05 22:29:44,22.97,
15-08-2023 14.30,15-08-2023 14.59,2023-08-15 15:06:58,28.88,44.0
28-05-2023 13.36,28-05-2023 14.04,2023-05-28 14:10:40,28.27,39.0
09-11-2023 05.16,09-11-2023 05.41,2023-11-09 05:58:46,24.93,
24-08-2023 19.54,24-08-2023 19.58,2023-08-24 20:14:40,3.65,
09-09-2023 16.39,2023-09-09 16:56,2023-09-09 17:01:19,16.82,28.0
11-07-2023 11.19,11-07-2023 11.46,2023-07-11 12:00:19,26.82,25.0
23-06-2023 16.10,23-06-2023 16.24,2023-06-23 16:39:10,14.26,22.0
02-03-2024 13.06,02-03-2024 13.32,2024-03-02 13:40:45,26.39,40.0
07-02-2024 02.45,07-02-2024 03.07,2024-02-07 03:15:40,22.31,37.0
30-03-2023 21.09,30-03-2023 21.19,2023-03-30 21:33:13.800000000,13.38,44.0
29-05-2023 14.52,29-05-2023 15.16,2023-05-29 15:24:14,24.06,52.0
04-07-2023 04.12,04-07-2023 04.34,2023-07-04 04:48:58,21.56,12.0
13-07-2023 01.46,13-07-2023 01.59,2023-07-13 02:10:56,12.99,32.0
06-05-2023 04.45,06-05-2023 04.52,2023-05-06 05:01:54,,0.0
15-12-2023 03.51,2023-12-15 04:27,2023-12-15 04:36:35,36.08,47.0
17-11-2023 12.56,17-11-2023 13.23,2023-11-17 13:43:24,27.57,40.0
06-05-2023 00.44,06-05-2023 01.02,2023-05-06 01:12:43,18.63,30.0
10-10-2023 08.07,10-10-2023 08.30,2023-10-10 08:35:43,23.38,41.0
29-04-2023 17.01,29-04-2023 17.24,2023-04-29 17:28:01,23.61,11.0
07-04-2023 03.14,07-04-2023 03.40,2023-04-07 03:44:06,25.82,37.0
2023/06/05 16:03:14,05-06-2023 16.25,2023-06-05 16:31:09,22.27,25.0
30-03-2023 16.45,30-03-2023 16.50,2023-03-30 16:53:33.800000000,3.43,27.0
11-05-2023 17.59,11-05-2023 18.23,2023-05-11 18:33:18,23.99,36.0
24-05-2023 08.44,24-05-2023 09.12,2023-05-24 09:15:53,28.33,19.0
30-03-2023 19.51,30-03-2023 19.55,2023-03-30 19:59:34.000000000,4.4,12.0
01-10-2023 11.56,01-10-2023 12.19,2023-10-01 12:41:38,23.04,32.0
14-12-2023 10.26,14-12-2023 10.48,2023-12-14 10:57:42,21.81,47.0
03-05-2023 18.06,03-05-2023 18.24,2023-05-03 18:38:34,18.28,35.0
11-05-2023 09.11,11-05-2023 09.33,2023-05-11 09:41:57,21.44,43.0
26-08-2023 13.08,26-08-2023 13.24,26-08-2023 13:38:54.946948,15.95,22.0
13-02-2024 00.09,2024-02-13 00:30,2024-02-13 00:33:57,21.17,34.0
11-01-2024 11.09,11-01-2024 11.40,2024-01-11 11:48:51,30.81,42.0
2023/04/16 21:05:19,16-04-2023 21.19,2023-04-16 21:30:54,13.93,21.0
15-10-2023 18.21,15-10-2023 18.47,2023-10-15 19:02:33,25.33,25.0
29-09-2023 09.18,29-09-2023 09.49,2023-09-29 09:58:36,31.51,36.0
08-06-2023 07.15,08-06-2023 07.37,2023-06-08 07:47:54,22.15,40.0
30-04-2023 00.32,30-04-2023 00.52,2023-04-30 01:07:17,20.16,28.0
26-01-2024 23.08,26-01-2024 23.33,2024-01-26 23:38:44,25.42,35.0
14-10-2023 07.33,14-10-2023 07.54,2023-10-14 07:57:48,20.86,41.0
2023/04/20 03:46:04,20-04-2023 04.07,2023-04-20 04:22:16,21.26,32.0
22-05-2023 08.38,22-05-2023 09.00,2023-05-22 09:15:48,21.53,33.0
04-10-2023 06.11,04-10-2023 06.27,2023-10-04 06:32:01,16.39,20.0
14-03-2024 01.53,14-03-2024 02.17,2024-03-14 02:28:53,23.49,41.0
15-02-2024 13.04,15-02-2024 13.30,2024-02-15 13:39:12,,22.0
29-12-2023 11.21,29-12-2023 11.53,2023-12-29 12:14:42,32.03,
04-05-2023 14.39,04-05-2023 14.48,2023-05-04 14:57:01,9.26,
05-01-2024 03.00,05-01-2024 03.24,2024-01-05 03:31:27,24.69,31.0
2023/12/09 19:42:17,09-12-2023 19.54,2023-12-09 20:01:29,11.75,1.0
20-09-2023 23.51,21-09-2023 00.08,2023-09-21 00:21:38,17.13,20.0
02-06-2023 09.57,02-06-2023 10.13,2023-06-02 10:21:50,15.89,16.0
19-09-2023 01.34,19-09-2023 01.50,2023-09-19 01:59:17,75.5,22.0
06-07-2023 16.21,06-07-2023 16.50,2023-07-06 16:52:21,28.72,49.0
18-02-2024 23.18,18-02-2024 23.36,2024-02-18 23:47:11,18.54,36.0
02-01-2024 22.38,02-01-2024 23.01,2024-01-02 23:21:06,22.87,19.0
2024/01/08 23:21:10,08-01-2024 23.34,2024-01-08 23:49:53,13.53,12.0
16-04-2023 17.38,16-04-2023 18.00,2023-04-16 18:22:22,22.81,48.0
01-07-2023 23.11,01-07-2023 23.37,2023-07-01 23:53:37,26.44,33.0
25-05-2023 01.06,25-05-2023 01.14,2023-05-25 01:23:58,8.44,0.0
08-09-2023 21.35,08-09-2023 21.47,2023-09-08 21:51:21,11.66,10.0
13-01-2024 10.53,13-01-2024 11.13,2024-01-13 11:15:59,20.05,24.0
17-10-2023 14.36,17-10-2023 15.00,2023-10-17 15:12:32,24.54,18.0
20-10-2023 20.28,20-10-2023 20.52,2023-10-20 20:57:46,,136.0
09-10-2023 13.59,09-10-2023 14.21,2023-10-09 14:37:17,21.71,7.0
30-03-2023 5.34,30-03-2023 5.44,2023-03-30 05:54:24.000000000,10.1,50.0
08-11-2023 23.21,2023-11-08 23:35,2023-11-08 23:48:18,14.96,15.0
30-03-2023 3.02,30-03-2023 3.03,2023-03-30 03:22:00.600000000,18.76,45.0
22-05-2023 11.55,22-05-2023 12.12,2023-05-22 12:22:13,17.01,20.0
23-10-2023 05.37,23-10-2023 05.58,2023-10-23 06:12:17,21.19,33.0
21-11-2023 14.15,21-11-2023 14.45,2023-11-21 14:49:09,30.0,35.0
01-04-2023 14.14,01-04-2023 14.34,2023-04-01 14:43:50,20.24,51.0
18-10-2023 12.40,18-10-2023 13.16,2023-10-18 13:28:35,35.95,54.0
04-12-2023 09.30,04-12-2023 09.57,2023-12-04 10:12:49,26.88,39.0
25-05-2023 07.52,25-05-2023 08.16,2023-05-25 08:26:34,23.98,41.0
25-11-2023 10.50,25-11-2023 11.07,2023-11-25 11:14:46,17.13,171.0
18-03-2024 21.55,18-03-2024 22.12,2024-03-18 22:28:23,17.46,29.0
2023/08/05 09:04:46,05-08-2023 09.14,2023-08-05 09:28:26,9.71,32.0
14-10-2023 07.55,2023-10-14 08:24,2023-10-14 08:31:53,28.63,38.0
26-03-2024 11.35,26-03-2024 12.00,2024-03-26 12:15:36,25.62,28.0
15-08-2023 04.38,15-08-2023 04.52,2023-08-15 05:01:19,14.36,11.0
,28-06-2023 06.38,2023-06-28 06:44:52,24.57,35.0
06-02-2024 18.57,06-02-2024 19.13,2024-02-06 19:19:51,15.92,136.0
14-09-2023 04.30,14-09-2023 04.42,14-09-2023 04:53:41.346393,12.12,18.0
31-01-2024 14.29,31-01-2024 14.52,2024-01-31 15:06:05,22.69,
24-06-2023 05.52,2023-06-24 06:25,2023-06-24 06:27:22,33.13,47.0
06-04-2023 11.14,06-04-2023 11.36,2023-04-06 11:41:16,22.07,10.0
29-04-2023 20.13,29-04-2023 20.38,2023-04-29 20:49:11,25.14,16.0
30-03-2023 15.45,30-03-2023 15.46,2023-03-30 15:53:09.400000000,6.34,25.0
29-08-2023 10.30,29-08-2023 10.46,2023-08-29 10:56:33,15.8,18.0
30-03-2023 13.55,30-03-2023 13.58,2023-03-30 14:14:21.400000000,15.59,25.0
01-06-2023 03.51,01-06-2023 04.02,2023-06-01 04:14:40,10.72,26.0
20-01-2024 08.08,20-01-2024 08.36,2024-01-20 08:48:41,27.06,35.0
04-12-2023 03.38,04-12-2023 03.55,2023-12-04 04:04:04,17.22,25.0
06-04-2023 05.19,06-04-2023 05.46,2023-04-06 06:03:55,26.91,22.0
30-10-2023 01.25,30-10-2023 01.37,2023-10-30 01:49:22,11.77,35.0
30-01-2024 22.50,30-01-2024 23.09,2024-01-30 23:22:29,18.61,44.0
26-03-2024 15.36,26-03-2024 16.03,2024-03-26 16:14:59,27.19,25.0
14-05-2023 05.45,14-05-2023 06.07,2023-05-14 06:12:22,22.39,26.0
24-04-2023 15.24,24-04-2023 15.55,2023-04-24 16:11:29,31.24,41.0
17-05-2023 17.35,17-05-2023 18.00,2023-05-17 18:12:57,25.53,40.0
23-03-2024 09.07,23-03-2024 09.32,2024-03-23 09:36:19,24.72,25.0
01-01-2024 13.49,01-01-2024 13.27,2024-01-01 14:03:56,22.04,31.0
07-07-2023 19.56,07-07-2023 20.20,2023-07-07 20:37:55,23.64,30.0
11-09-2023 21.12,11-09-2023 21.31,2023-09-11 21:44:11,18.5,13.0
30-03-2023 12.33,30-03-2023 12.40,2023-03-30 12:51:38.800000000,11.53,40.0
11-12-2023 00.21,11-12-2023 00.42,2023-12-11 00:54:53,21.18,26.0
31-12-2023 03.31,31-12-2023 03.49,2023-12-31 03:57:07,18.24,29.0
30-11-2023 05.36,30-11-2023 05.57,2023-11-30 06:08:25,21.3,32.0
02-01-2024 05.29,02-01-2024 05.51,2024-01-02 06:07:51,22.53,30.0
11-04-2023 19.47,11-04-2023 20.14,2023-04-11 20:21:16,27.46,34.0
04-03-2024 12.22,04-03-2024 12.46,2024-03-04 12:49:43,23.68,35.0
,11-10-2023 03.35,2023-10-11 03:45:50,92.62,12.0
30-03-2023 10.31,30-03-2023 10.34,2023-03-30 10:45:29.000000000,11.1,32.0
27-09-2023 09.42,27-09-2023 10.08,2023-09-27 10:15:51,26.08,52.0
20-09-2023 10.58,20-09-2023 11.14,2023-09-20 11:19:32,,39.0
30-10-2023 11.55,2023-10-30 12:22,30-10-2023 12:36:02.650268,,
13-03-2024 23.57,14-03-2024 00.20,2024-03-14 00:26:50,22.91,45.0
26-12-2023 13.33,26-12-2023 13.53,2023-12-26 14:12:38,20.34,36.0
04-09-2023 16.39,04-09-2023 16.59,2023-09-04 17:04:13,20.26,45.0
25-01-2024 18.36,25-01-2024 19.02,2024-01-25 19:11:09,26.13,43.0
30-03-2023 5.34,30-03-2023 5.44,2023-03-30 05:55:49.800000000,11.53,50.0
15-09-2023 05.57,15-09-2023 06.09,2023-09-15 06:18:15,11.82,14.0
28-09-2023 00.14,28-09-2023 00.35,2023-09-28 00:41:57,20.13,30.0
2024/03/10 18:42:06,10-03-2024 19.14,2024-03-10 19:23:59,32.26,40.0
30-03-2023 12.33,30-03-2023 12.38,2023-03-30 12:49:13.000000000,11.1,40.0
16-08-2023 01.54,16-08-2023 02.06,2023-08-16 02:17:17,11.64,22.0
02-02-2024 11.13,02-02-2024 11.36,2024-02-02 11:51:09,23.7,24.0
19-10-2023 00.38,19-10-2023 00.55,2023-10-19 01:01:54,16.64,36.0
30-03-2023 23.54,30-03-2023 23.54,2023-03-31 00:00:42.400000000,5.74,2.0
06-06-2023 22.22,06-06-2023 22.39,06-06-2023 22:49:17.693523,17.28,21.0
30-03-2023 3.02,30-03-2023 3.03,2023-03-30 03:13:15.000000000,10.0,45.0
30-03-2023 21.09,30-03-2023 21.14,2023-03-30 21:17:53.400000000,3.04,44.0
30-03-2023 8.42,30-03-2023 8.49,2023-03-30 08:49:32.000000000,-0.25,47.0
12-04-2023 15.54,12-04-2023 16.24,2023-04-12 16:35:27,30.95,41.0
03-02-2024 08.39,03-02-2024 09.13,2024-02-03 09:28:06,34.58,55.0
28-04-2023 07.23,28-04-2023 07.39,2023-04-28 07:49:20,15.76,28.0
09-10-2023 23.19,09-10-2023 23.48,2023-10-10 00:01:02,28.55,31.0
14-08-2023 15.57,14-08-2023 16.22,2023-08-14 16:33:50,25.08,32.0
24-06-2023 12.49,24-06-2023 13.03,2023-06-24 13:18:04,13.46,29.0
09-12-2023 02.08,09-12-2023 02.31,2023-12-09 02:34:58,22.7,20.0
11-02-2024 17.44,11-02-2024 18.19,2024-02-11 18:35:17,34.31,57.0
31-08-2023 21.21,31-08-2023 21.35,2023-08-31 21:38:11,14.11,22.0
05-06-2023 19.28,05-06-2023 19.52,2023-06-05 19:59:55,23.5,17.0
14-08-2023 17.09,14-08-2023 17.32,2023-08-14 17:49:39,23.18,51.0
17-09-2023 11.37,17-09-2023 12.05,2023-09-17 12:18:33,28.12,41.0
19-02-2024 13.59,19-02-2024 14.22,19-02-2024 14:24:58.973457,23.64,27.0
2023/04/16 23:37:57,16-04-2023 23.56,2023-04-17 00:02:52,18.7,25.0
30-03-2023 6.51,30-03-2023 6.53,2023-03-30 07:04:30.400000000,10.84,24.0
14-03-2024 03.55,14-03-2024 04.21,2024-03-14 04:30:02,26.63,14.0
05-07-2023 00.39,05-07-2023 01.00,2023-07-05 01:13:03,21.3,52.0
16-12-2023 23.44,17-12-2023 00.05,2023-12-17 00:09:38,20.51,40.0
13-10-2023 06.44,2023-10-13 06:56,2023-10-13 07:13:37,12.37,20.0
01-12-2023 02.06,2023-12-01 02:24,2023-12-01 02:34:06,17.15,25.0
23-08-2023 00.42,23-08-2023 00.57,2023-08-23 01:06:20,15.64,36.0
10-08-2023 19.25,2023-08-10 19:51,2023-08-10 20:03:15,26.25,24.0
30-03-2023 4.45,30-03-2023 4.45,2023-03-30 04:53:34.799999999,8.53,3.0
01-05-2023 20.59,01-05-2023 21.24,2023-05-01 21:34:48,25.11,37.0
20-08-2023 06.19,20-08-2023 06.44,2023-08-20 06:54:52,24.56,6.0
30-03-2023 0.10,30-03-2023 0.14,2023-03-30 00:27:23.200000000,13.32,28.0
30-03-2023 3.02,30-03-2023 3.02,2023-03-30 03:13:09.600000000,10.91,45.0
08-06-2023 04.43,08-06-2023 04.53,2023-06-08 05:06:05,10.43,6.0
30-03-2023 18.31,30-03-2023 18.33,2023-03-30 18:40:14.400000000,6.84,30.0
25-01-2024 15.31,2024-01-25 15:39,2024-01-25 15:55:19,7.9,15.0
30-03-2023 0.10,30-03-2023 0.20,2023-03-30 00:35:37.600000000,15.56,28.0
30-08-2023 10.42,30-08-2023 10.57,2023-08-30 10:59:32,14.52,37.0
03-11-2023 20.36,03-11-2023 20.57,2023-11-03 21:10:15,21.14,46.0
09-01-2024 17.40,09-01-2024 18.10,2024-01-09 18:20:08,29.67,42.0
30-03-2023 8.42,30-03-2023 8.46,2023-03-30 08:48:51.199999999,2.07,47.0
2023/09/29 19:59:27,29-09-2023 20.27,2023-09-29 20:36:00,28.08,33.0
06-04-2023 23.24,06-04-2023 23.54,2023-04-06 23:59:43,29.97,47.0
30-03-2023 8.42,30-03-2023 8.49,2023-03-30 09:01:44.000000000,11.95,47.0
2024/03/24 07:55:08,2024-03-24 08:17,2024-03-24 08:19:40,22.54,29.0
20-04-2023 01.33,20-04-2023 01.59,2023-04-20 02:17:53,26.49,27.0
20-09-2023 07.07,20-09-2023 07.34,2023-09-20 07:51:59,27.64,32.0
2023/06/06 21:52:11,2023-06-06 22:17,2023-06-06 22:36:36,24.91,31.0
12-02-2024 10.06,12-02-2024 10.47,2024-02-12 10:52:27,41.26,44.0
18-07-2023 03.52,2023-07-18 04:09,2023-07-18 04:15:52,16.62,30.0
03-04-2023 07.36,03-04-2023 08.01,2023-04-03 08:06:10,24.25,46.0
27-10-2023 20.48,27-10-2023 21.09,2023-10-27 21:22:39,21.62,
07-10-2023 17.38,07-10-2023 18.15,2023-10-07 18:17:23,36.55,47.0
22-11-2023 13.07,22-11-2023 13.21,2023-11-22 13:23:11,13.56,40.0
10-10-2023 15.26,10-10-2023 15.53,2023-10-10 15:57:42,27.7,27.0
2024/03/11 22:14:49,11-03-2024 22.27,2024-03-11 22:35:34,12.59,3.0
2023/07/27 04:43:01,27-07-2023 04.58,2023-07-27 05:03:21,15.58,22.0
04-08-2023 09.26,04-08-2023 09.47,2023-08-04 09:55:58,20.84,40.0
12-05-2023 20.20,2023-05-12 20:49,2023-05-12 20:57:47,29.42,50.0
2023/05/03 01:13:11,03-05-2023 01.39,2023-05-03 01:49:07,26.37,35.0
22-10-2023 08.20,22-10-2023 08.53,2023-10-22 09:05:19,33.27,36.0
26-06-2023 12.18,26-06-2023 12.35,2023-06-26 12:41:54,16.72,33.0
08-05-2023 12.56,2023-05-08 13:30,2023-05-08 13:43:20,33.8,45.0
08-09-2023 19.45,08-09-2023 20.06,2023-09-08 20:18:14,21.0,27.0
2023/10/27 08:26:23,27-10-2023 08.52,2023-10-27 09:06:38,25.92,43.0
18-05-2023 07.27,18-05-2023 07.48,2023-05-18 07:55:41,20.73,14.0
14-01-2024 11.16,14-01-2024 11.29,2024-01-14 11:37:53,13.2,20.0
05-10-2023 00.46,05-10-2023 01.14,2023-10-05 01:28:41,27.81,40.0
17-10-2023 02.07,17-10-2023 02.25,2023-10-17 02:40:00,18.08,37.0
2023/09/10 16:48:45,10-09-2023 17.09,2023-09-10 17:17:19,20.91,39.0
24-09-2023 16.12,24-09-2023 16.39,2023-09-24 16:50:34,27.24,204.0
17-03-2024 23.21,17-03-2024 23.57,2024-03-18 00:06:20,35.53,43.0
22-01-2024 16.32,22-01-2024 16.42,22-01-2024 16:51:09.041982,10.19,16.0
17-06-2023 01.58,17-06-2023 02.19,2023-06-17 02:25:40,20.63,38.0
22-02-2024 22.22,22-02-2024 22.48,2024-02-22 23:06:12,26.51,39.0
03-12-2023 05.16,03-12-2023 05.34,2023-12-03 05:46:10,18.07,24.0
12-02-2024 20.16,12-02-2024 20.36,2024-02-12 20:53:25,20.51,19.0
16-10-2023 09.12,2023-10-16 09:40,2023-10-16 09:47:39,27.97,191.0
22-10-2023 07.38,2023-10-22 08:03,2023-10-22 08:19:55,24.99,62.0
12-03-2024 06.09,2024-03-12 06:24,2024-03-12 06:32:47,15.2,31.0
01-01-2024 09.53,01-01-2024 10.11,2024-01-01 10:23:55,17.53,22.0
30-03-2023 3.02,30-03-2023 3.05,2023-03-30 03:10:12.000000000,4.95,45.0
05-01-2024 03.03,05-01-2024 03.33,2024-01-05 03:44:20,30.33,23.0
16-03-2024 00.01,16-03-2024 00.30,2024-03-16 00:45:28,29.35,14.0
06-09-2023 15.20,2023-09-06 15:37,2023-09-06 15:42:48,17.37,25.0
17-10-2023 17.34,17-10-2023 18.09,2023-10-17 18:25:24,34.83,42.0
30-03-2023 8.42,30-03-2023 8.46,2023-03-30 08:59:45.800000000,12.98,47.0
30-03-2023 2.36,30-03-2023 2.45,2023-03-30 02:52:37.800000000,7.48,17.0
14-10-2023 14.27,14-10-2023 14.39,2023-10-14 14:53:41,11.52,17.0
26-11-2023 23.15,26-11-2023 23.42,2023-11-26 23:47:13,27.16,18.0
13-11-2023 19.09,13-11-2023 19.25,13-11-2023 19:30:56.776930,15.9,34.0
26-08-2023 18.45,26-08-2023 19.15,2023-08-26 19:28:18,29.8,51.0
10-11-2023 11.58,10-11-2023 12.16,2023-11-10 12:24:23,18.49,34.0
2023/11/19 10:17:52,19-11-2023 10.29,2023-11-19 10:38:10,11.36,26.0
30-03-2023 21.09,30-03-2023 21.11,2023-03-30 21:19:51.599999999,8.01,44.0
21-12-2023 06.32,21-12-2023 06.39,2023-12-21 06:41:33,6.94,7.0
30-03-2023 5.34,30-03-2023 5.39,2023-03-30 05:46:27.600000000,7.16,50.0
26-06-2023 01.53,26-06-2023 02.24,2023-06-26 02:36:15,31.01,37.0
29-01-2024 08.53,29-01-2024 09.27,2024-01-29 09:52:59,,30.0
24-02-2024 19.34,24-02-2024 19.49,2024-02-24 20:06:13,15.44,20.0
07-11-2023 10.46,2023-11-07 10:58,2023-11-07 11:11:38,12.65,33.0
15-10-2023 04.17,15-10-2023 04.44,2023-10-15 04:53:30,27.23,31.0
03-09-2023 19.25,03-09-2023 19.43,2023-09-03 19:53:52,18.47,48.0
24-09-2023 11.35,2023-09-24 12:01,2023-09-24 12:16:34,25.65,39.0
07-07-2023 12.01,07-07-2023 12.22,07-07-2023 12:29:34.643004,20.7,36.0
30-03-2023 20.49,30-03-2023 20.50,2023-03-30 20:59:22.999999999,8.45,22.0
29-10-2023 21.11,29-10-2023 21.24,2023-10-29 21:42:45,12.98,23.0
04-08-2023 00.55,04-08-2023 01.12,2023-08-04 01:27:00,17.55,23.0
26-02-2024 09.50,26-02-2024 10.06,2024-02-26 10:12:30,15.44,34.0
2023/05/21 01:05:27,21-05-2023 01.25,2023-05-21 01:35:09,89.97,25.0
25-05-2023 09.06,2023-05-25 09:31,2023-05-25 09:39:15,25.14,35.0
29-02-2024 19.21,29-02-2024 19.55,2024-02-29 20:09:25,33.95,39.0
30-03-2023 21.52,30-03-2023 22.01,2023-03-30 22:10:23,8.7,17.0
07-12-2023 13.04,07-12-2023 13.23,2023-12-07 13:26:16,18.35,33.0
08-03-2024 18.14,08-03-2024 18.46,2024-03-08 18:57:13,31.59,53.0
06-07-2023 19.28,2023-07-06 19:48,2023-07-06 19:52:51,19.82,29.0
22-06-2023 04.54,22-06-2023 05.05,2023-06-22 05:18:14,,9.0
24-07-2023 20.46,24-07-2023 21.07,2023-07-24 21:16:08,20.42,42.0
25-09-2023 15.25,25-09-2023 15.49,2023-09-25 15:59:16,24.19,43.0
03-01-2024 02.39,03-01-2024 03.00,2024-01-03 03:05:25,20.96,24.0
21-11-2023 23.26,21-11-2023 23.48,2023-11-21 23:59:28,21.17,31.0
2023/08/24 11:30:28,2023-08-24 11:58,2023-08-24 12:10:32,28.1,70.0
27-07-2023 20.36,27-07-2023 21.02,2023-07-27 21:16:52,25.96,40.0
04-02-2024 11.40,04-02-2024 12.10,2024-02-04 12:14:58,29.49,55.0
2024-01-22 16:06,22-01-2024 15.50,2024-01-22 16:13:16,16.22,24.0
27-02-2024 08.50,27-02-2024 09.01,2024-02-27 09:09:32,,22.0
15-01-2024 17.21,15-01-2024 17.45,2024-01-15 17:49:27,23.98,43.0
30-03-2023 14.12,30-03-2023 14.22,2023-03-30 14:28:22.400000000,5.84,17.0
04-04-2023 16.39,04-04-2023 16.54,2023-04-04 17:26:04,15.4,9.0
18-05-2023 21.20,18-05-2023 21.44,2023-05-18 21:55:40,24.51,39.0
14-09-2023 05.55,14-09-2023 06.32,2023-09-14 06:38:12,37.26,49.0
30-03-2023 0.10,30-03-2023 0.11,2023-03-30 00:20:01.000000000,8.95,28.0
30-03-2023 19.51,30-03-2023 19.57,2023-03-30 20:07:34.600000000,10.41,12.0
30-03-2023 21.09,30-03-2023 21.14,2023-03-30 21:31:15.600000000,16.41,44.0
12-08-2023 09.26,12-08-2023 09.45,2023-08-12 09:54:01,18.69,34.0
30-03-2023 2.36,30-03-2023 2.36,2023-03-30 02:47:44.400000000,11.59,17.0
19-10-2023 07.46,19-10-2023 07.54,2023-10-19 08:00:53,8.18,14.0
30-03-2023 12.33,30-03-2023 12.40,2023-03-30 12:59:03.400000000,18.94,202.0
17-12-2023 02.23,17-12-2023 02.57,2023-12-17 03:16:07,33.83,40.0
08-07-2023 22.56,08-07-2023 23.17,2023-07-08 23:31:09,20.83,
21-10-2023 04.46,2023-10-21 05:03,2023-10-21 05:14:16,16.51,34.0
06-01-2024 20.21,06-01-2024 20.42,2024-01-06 20:49:00,20.97,24.0
16-11-2023 16.17,2023-11-16 16:31,2023-11-16 16:33:24,13.4,16.0
17-11-2023 20.29,17-11-2023 20.58,2023-11-17 21:16:33,29.33,226.0
2023/10/03 03:41:58,2023-10-03 03:59,2023-10-03 04:08:44,17.79,38.0
13-12-2023 11.51,13-12-2023 12.22,2023-12-13 12:25:15,30.73,53.0
22-10-2023 12.19,22-10-2023 12.39,2023-10-22 12:54:06,20.24,32.0
30-03-2023 13.55,30-03-2023 13.58,2023-03-30 14:06:46.000000000,8.0,25.0
01-01-2024 18.06,01-01-2024 18.35,2024-01-01 18:50:09,28.47,34.0
30-03-2023 1.58,30-03-2023 2.05,2023-03-30 02:17:34.000000000,11.95,27.0
27-09-2023 03.39,27-09-2023 03.46,27-09-2023 03:50:05.035048,6.94,0.0
30-03-2023 3.02,30-03-2023 3.02,2023-03-30 03:13:52.800000000,,45.0
03-09-2023 16.00,03-09-2023 16.30,2023-09-03 16:32:21,29.73,51.0
25-01-2024 22.12,25-01-2024 22.30,2024-01-25 22:38:47,18.42,30.0
04-08-2023 03.03,2023-08-04 03:24,2023-08-04 03:26:03,20.25,31.0
23-03-2024 05.37,23-03-2024 05.52,2024-03-23 06:06:45,14.74,41.0
27-02-2024 20.02,27-02-2024 20.24,2024-02-27 20:41:35,21.38,37.0
28-11-2023 10.45,28-11-2023 11.00,2023-11-28 11:03:40,14.85,24.0
16-02-2024 06.56,16-02-2024 07.23,2024-02-16 07:39:06,27.11,34.0
06-06-2023 15.57,06-06-2023 16.24,2023-06-06 16:38:38,26.71,30.0
31-03-2023 10.16,31-03-2023 10.44,2023-03-31 10:52:04,27.8,51.0
08-06-2023 12.40,08-06-2023 13.14,08-06-2023 13:29:54.263159,34.42,51.0
20-03-2024 02.23,20-03-2024 02.41,2024-03-20 02:43:10,18.1,37.0
18-10-2023 22.27,2023-10-18 22:48,2023-10-18 22:53:35,21.46,34.0
09-02-2024 13.44,09-02-2024 14.04,2024-02-09 14:23:32,20.24,17.0
26-04-2023 23.31,26-04-2023 23.50,2023-04-27 00:01:23,19.28,38.0
2023/07/03 18:41:22,03-07-2023 19.11,2023-07-03 19:17:23,30.34,27.0
04-06-2023 00.42,04-06-2023 01.05,2023-06-04 01:16:21,22.65,27.0
30-03-2023 21.09,30-03-2023 21.13,2023-03-30 21:25:55.200000000,12.07,44.0
07-04-2023 22.21,07-04-2023 22.45,2023-04-07 23:01:25,23.91,35.0
25-03-2024 15.39,25-03-2024 16.12,2024-03-25 16:33:08,32.94,51.0
29-01-2024 14.03,29-01-2024 14.20,2024-01-29 14:28:30,17.37,23.0
23-03-2024 21.47,23-03-2024 22.19,2024-03-23 22:25:15,31.82,53.0
05-05-2023 10.57,2023-05-05 11:13,2023-05-05 11:16:24,15.97,28.0
08-05-2023 16.05,2023-05-08 16:29,2023-05-08 16:36:51,24.3,34.0
22-11-2023 04.49,22-11-2023 05.11,22-11-2023 05:24:53.779419,21.95,13.0
22-07-2023 00.29,22-07-2023 00.39,2023-07-22 00:51:13,9.32,3.0
,23-12-2023 08.12,2023-12-23 08:29:42,18.04,31.0
03-09-2023 19.20,03-09-2023 19.41,2023-09-03 19:45:03,21.04,30.0
26-07-2023 13.09,26-07-2023 13.26,2023-07-26 13:32:00,16.59,162.0
27-12-2023 13.32,27-12-2023 13.47,2023-12-27 13:49:37,15.43,33.0
2023/04/13 18:21:01,13-04-2023 18.35,2023-04-13 18:46:07,13.99,22.0
30-03-2023 2.36,30-03-2023 2.38,2023-03-30 02:43:47.400000000,5.64,120.0
13-12-2023 08.52,13-12-2023 09.10,2023-12-13 09:31:53,17.68,14.0
11-06-2023 20.52,11-06-2023 21.20,2023-06-11 21:28:43,28.62,48.0
30-03-2023 3.02,30-03-2023 3.05,2023-03-30 03:08:32.400000000,3.29,45.0
2023/09/10 00:34:24,10-09-2023 00.47,2023-09-10 00:54:04,12.8,7.0
2023/12/14 18:48:31,14-12-2023 19.05,2023-12-14 19:14:33,17.09,
22-10-2023 06.14,22-10-2023 06.47,2023-10-22 06:50:57,32.07,58.0
18-02-2024 18.19,18-02-2024 18.41,2024-02-18 18:50:01,22.18,33.0
30-03-2023 10.31,30-03-2023 10.31,2023-03-30 10:43:58.400000000,12.59,32.0
06-01-2024 17.52,06-01-2024 18.18,2024-01-06 18:26:34,25.78,22.0
31-03-2023 14.23,31-03-2023 14.39,2023-03-31 14:44:48,15.78,35.0
30-03-2023 14.12,30-03-2023 14.15,2023-03-30 14:27:56.600000000,12.41,17.0
05-03-2024 14.59,05-03-2024 15.16,2024-03-05 15:31:41,16.81,23.0
22-04-2023 12.48,22-04-2023 13.09,2023-04-22 13:21:35,20.99,11.0
28-04-2023 11.24,28-04-2023 11.54,2023-04-28 12:13:47,30.39,45.0
05-03-2024 12.45,05-03-2024 13.00,2024-03-05 13:04:44,15.26,27.0
2023/06/13 03:08:52,13-06-2023 03.35,2023-06-13 03:41:45,26.93,43.0
2023/05/28 23:01:34,28-05-2023 23.24,2023-05-28 23:44:44,22.89,43.0
06-12-2023 18.28,06-12-2023 18.54,2023-12-06 18:57:14,26.09,45.0
2024/02/12 07:51:36,2024-02-12 08:17,2024-02-12 08:24:35,26.38,45.0
07-01-2024 18.13,07-01-2024 18.31,2024-01-07 18:40:19,17.61,33.0
20-01-2024 09.10,20-01-2024 09.29,2024-01-20 09:36:41,18.61,32.0
,01-09-2023 03.32,2023-09-01 03:42:15,33.42,44.0
30-03-2023 1.58,30-03-2023 2.02,2023-03-30 02:14:51.400000000,12.24,27.0
15-08-2023 02.13,15-08-2023 02.33,2023-08-15 02:41:17,19.45,19.0
30-03-2023 8.42,30-03-2023 8.42,2023-03-30 08:49:24.800000000,6.63,47.0
23-03-2024 08.59,23-03-2024 09.26,2024-03-23 09:37:22,27.48,36.0
23-01-2024 12.14,2024-01-23 12:36,2024-01-23 12:48:01,21.86,29.0
30-08-2023 18.34,30-08-2023 18.55,2023-08-30 19:01:34,20.42,31.0
30-03-2023 2.38,30-03-2023 2.36,2023-03-30 02:59:18.600000000,21.16,17.0
19-05-2023 05.24,19-05-2023 05.09,2023-05-19 05:35:55,15.23,22.0
03-12-2023 08.38,03-12-2023 08.52,2023-12-03 08:58:26,13.9,21.0
2023/06/23 15:53:44,23-06-2023 16.17,2023-06-23 16:24:03,23.56,14.0
30-12-2023 10.12,30-12-2023 10.43,2023-12-30 10:50:26,31.74,45.0
30-11-2023 05.54,2023-11-30 06:20,2023-11-30 06:29:42,26.77,23.0
10-10-2023 16.38,10-10-2023 17.00,2023-10-10 17:06:05,21.91,27.0
10-11-2023 21.52,10-11-2023 22.09,2023-11-10 22:21:42,16.65,41.0
30-03-2023 5.34,30-03-2023 5.42,2023-03-30 05:47:35.400000000,5.29,50.0
,15-04-2023 09.37,2023-04-15 09:47:26,,30.0
16-09-2023 14.25,16-09-2023 14.50,2023-09-16 15:03:45,24.33,32.0
13-06-2023 22.13,13-06-2023 22.28,2023-06-13 22:31:31,,44.0
20-09-2023 04.26,20-09-2023 04.42,2023-09-20 04:47:04,16.12,44.0
10-02-2024 05.24,10-02-2024 05.54,2024-02-10 06:11:13,29.98,45.0
07-02-2024 05.31,07-02-2024 05.52,2024-02-07 06:09:21,20.42,40.0
09-06-2023 16.56,2023-06-09 17:14,2023-06-09 17:24:48,18.51,25.0
30-03-2023 21.09,30-03-2023 21.19,2023-03-30 21:29:56.400000000,10.09,44.0
17-11-2023 07.06,17-11-2023 07.33,2023-11-17 07:50:23,27.0,36.0
03-05-2023 08.28,03-05-2023 08.45,2023-05-03 09:05:42,17.11,39.0
08-02-2024 09.45,08-02-2024 09.57,2024-02-08 10:00:43,11.83,15.0
20-07-2023 23.46,21-07-2023 00.09,2023-07-21 00:22:44,23.57,22.0
30-03-2023 5.34,30-03-2023 5.39,2023-03-30 05:46:53.400000000,7.59,50.0
30-03-2023 9.49,30-03-2023 9.58,2023-03-30 10:05:26.800000000,7.38,10.0
23-10-2023 18.27,2023-10-23 18:50,2023-10-23 19:06:08,22.64,18.0
05-09-2023 19.39,05-09-2023 20.02,2023-09-05 20:12:21,23.42,34.0
30-03-2023 18.31,30-03-2023 18.38,2023-03-30 18:47:10.199999999,8.77,30.0
20-09-2023 04.43,20-09-2023 05.08,2023-09-20 05:22:53,24.46,39.0
07-02-2024 20.05,07-02-2024 20.25,2024-02-07 20:38:15,20.36,30.0
19-12-2023 16.46,19-12-2023 17.06,19-12-2023 17:13:20.779561,20.01,23.0
03-05-2023 03.57,03-05-2023 04.23,2023-05-03 04:28:21,26.23,41.0
06-03-2024 16.06,06-03-2024 16.25,06-03-2024 16:40:44.843142,19.66,20.0
11-11-2023 08.40,11-11-2023 09.06,2023-11-11 09:16:14,25.85,66.0
20-07-2023 06.59,20-07-2023 07.32,2023-07-20 07:52:28,33.35,56.0
30-06-2023 11.08,30-06-2023 11.34,2023-06-30 11:40:33,25.6,33.0
21-05-2023 12.42,21-05-2023 13.05,2023-05-21 13:29:05,22.63,37.0
14-02-2024 21.40,14-02-2024 21.55,2024-02-14 22:08:30,15.41,18.0
09-06-2023 05.59,09-06-2023 06.22,2023-06-09 06:34:19,22.96,38.0
30-03-2023 17.34,30-03-2023 17.43,2023-03-30 17:43:08.600000000,-0.74,16.0
17-02-2024 18.38,17-02-2024 19.00,2024-02-17 19:12:45,22.0,48.0
2023/04/22 07:12:20,22-04-2023 07.28,2023-04-22 07:32:24,15.83,37.0
31-05-2023 04.09,31-05-2023 04.20,2023-05-31 04:37:55,10.69,29.0
08-12-2023 08.00,08-12-2023 08.13,2023-12-08 08:24:33,13.27,14.0
03-04-2023 10.31,03-04-2023 10.59,2023-04-03 11:15:26,,
18-10-2023 21.39,18-10-2023 22.05,2023-10-18 22:19:10,26.77,44.0
09-04-2023 08.00,09-04-2023 08.21,2023-04-09 08:29:54,20.73,31.0
16-03-2024 16.06,16-03-2024 16.30,2024-03-16 16:51:22,23.92,54.0
10-09-2023 12.37,10-09-2023 13.01,2023-09-10 13:17:12,23.87,14.0
03-02-2024 10.43,03-02-2024 11.06,2024-02-03 11:21:08,23.13,40.0
10-09-2023 15.20,10-09-2023 15.40,2023-09-10 15:48:28,20.48,38.0
28-09-2023 18.39,28-09-2023 18.57,2023-09-28 19:05:06,18.21,31.0
08-06-2023 11.04,08-06-2023 11.27,2023-06-08 11:41:10,23.89,31.0
30-03-2023 15.45,30-03-2023 15.51,2023-03-30 15:53:13.000000000,1.4,25.0
30-03-2023 8.42,30-03-2023 8.52,2023-03-30 09:04:59.000000000,12.2,47.0
2023/12/26 02:09:12,26-12-2023 02.30,2023-12-26 02:34:11,21.51,38.0
08-08-2023 23.46,09-08-2023 00.12,2023-08-09 00:28:44,25.67,39.0
30-03-2023 10.31,30-03-2023 10.34,2023-03-30 10:46:30.199999999,12.12,32.0
2023/11/02 19:29:22,02-11-2023 19.54,2023-11-02 20:09:54,100.21,27.0
08-12-2023 09.54,08-12-2023 10.24,2023-12-08 10:36:07,29.96,
08-07-2023 19.44,08-07-2023 20.12,2023-07-08 20:18:20,27.52,23.0
30-03-2023 17.34,30-03-2023 17.42,2023-03-30 17:53:02.600000000,10.16,16.0
27-10-2023 10.07,27-10-2023 10.28,2023-10-27 10:44:54,21.08,39.0
30-03-2023 9.49,30-03-2023 9.50,2023-03-30 10:02:41.800000000,12.63,10.0
04-05-2023 16.47,04-05-2023 17.04,2023-05-04 17:10:10,16.63,29.0
02-08-2023 02.20,02-08-2023 02.40,2023-08-02 02:48:59,19.89,38.0
09-06-2023 01.06,09-06-2023 01.29,2023-06-09 01:32:52,22.6,30.0
23-08-2023 14.43,23-08-2023 15.06,2023-08-23 15:16:34,23.6,36.0
2023/09/13 03:20:51,13-09-2023 03.45,2023-09-13 03:56:44,24.99,42.0
09-10-2023 05.38,09-10-2023 06.08,2023-10-09 06:19:19,30.28,41.0
10-03-2024 06.18,10-03-2024 06.40,2024-03-10 06:46:37,22.71,
30-03-2023 20.49,30-03-2023 20.59,2023-03-30 21:15:10.400000000,15.24,22.0
27-02-2024 11.22,27-02-2024 11.47,27-02-2024 11:53:53.239842,24.94,38.0
30-03-2023 18.31,30-03-2023 18.35,2023-03-30 18:51:09.600000000,63.54,30.0
2023/07/15 14:23:11,15-07-2023 14.32,2023-07-15 14:48:42,8.9,20.0
10-07-2023 15.46,10-07-2023 16.12,2023-07-10 16:15:35,25.81,28.0
27-02-2024 03.02,27-02-2024 03.18,2024-02-27 03:22:36,16.18,16.0
30-03-2023 1.58,30-03-2023 2.05,2023-03-30 02:09:41.800000000,4.08,27.0
20-02-2024 07.44,20-02-2024 08.08,2024-02-20 08:14:04,23.73,43.0
20-01-2024 00.12,20-01-2024 00.32,2024-01-20 00:43:41,20.55,33.0
17-02-2024 10.00,17-02-2024 10.20,2024-02-17 10:27:45,19.58,31.0
23-08-2023 20.56,23-08-2023 21.14,2023-08-23 21:29:35,18.29,42.0
01-05-2023 09.28,01-05-2023 10.02,01-05-2023 10:09:57.682070,33.93,53.0
22-12-2023 08.06,22-12-2023 08.27,2023-12-22 08:40:11,20.57,29.0
30-03-2023 3.02,30-03-2023 3.06,2023-03-30 03:17:31.199999999,11.27,45.0
2023/06/04 22:02:01,2023-06-04 22:29,2023-06-04 22:35:33,27.76,34.0
18-04-2023 20.33,18-04-2023 21.04,2023-04-18 21:09:44,31.08,46.0
13-02-2024 23.48,14-02-2024 00.08,2024-02-14 00:24:12,19.68,33.0
2023/10/21 23:24:05,21-10-2023 23.34,2023-10-21 23:36:30,10.43,19.0
21-01-2024 17.58,21-01-2024 18.15,2024-01-21 18:32:08,17.85,10.0
13-03-2024 17.03,2024-03-13 17:22,2024-03-13 17:39:09,19.28,18.0
16-09-2023 23.29,2023-09-16 23:41,2023-09-16 23:54:47,11.45,10.0
20-04-2023 10.32,20-04-2023 10.59,2023-04-20 11:01:29,26.96,62.0
16-03-2024 09.12,16-03-2024 09.33,2024-03-16 09:40:43,20.79,31.0
28-03-2024 11.59,28-03-2024 12.13,2024-03-28 12:30:07,13.85,6.0
23-04-2023 15.42,23-04-2023 16.07,2023-04-23 16:22:42,25.18,31.0
24-06-2023 06.41,24-06-2023 07.18,2023-06-24 07:27:18,37.8,137.0
30-03-2023 19.51,30-03-2023 19.56,2023-03-30 20:10:28.600000000,14.31,12.0
30-03-2023 21.09,30-03-2023 21.13,2023-03-30 21:22:06.599999999,8.26,44.0
27-03-2024 04.26,27-03-2024 04.49,2024-03-27 04:57:36,22.92,44.0
30-03-2023 16.45,30-03-2023 16.46,2023-03-30 16:59:47.000000000,13.65,27.0
30-03-2023 15.45,30-03-2023 15.54,2023-03-30 15:58:28.600000000,3.66,25.0
01-03-2024 08.56,2024-03-01 09:16,2024-03-01 09:36:11,20.02,29.0
01-12-2023 21.22,01-12-2023 22.03,2023-12-01 22:21:35,41.18,49.0
10-03-2024 11.58,10-03-2024 12.25,2024-03-10 12:38:34,26.61,16.0
05-03-2024 14.58,05-03-2024 15.18,2024-03-05 15:27:02,19.64,34.0
19-11-2023 14.26,19-11-2023 14.52,2023-11-19 14:59:49,26.2,35.0
06-05-2023 17.58,06-05-2023 18.20,2023-05-06 18:31:43,21.96,29.0
09-08-2023 23.58,10-08-2023 00.22,2023-08-10 00:24:56,24.49,30.0
05-08-2023 12.44,05-08-2023 12.59,2023-08-05 13:01:56,15.43,26.0
23-04-2023 12.32,23-04-2023 13.00,2023-04-23 13:14:11,27.99,50.0
30-03-2023 2.36,30-03-2023 2.39,2023-03-30 02:57:00.599999999,79.77,17.0
24-03-2024 18.57,24-03-2024 19.16,2024-03-24 19:24:35,18.86,25.0
01-03-2024 13.46,01-03-2024 14.23,2024-03-01 14:29:17,36.82,75.0
03-07-2023 12.15,03-07-2023 12.45,2023-07-03 12:57:35,29.53,41.0
27-09-2023 06.01,27-09-2023 06.20,2023-09-27 06:32:37,19.6,19.0
25-05-2023 17.50,25-05-2023 18.09,2023-05-25 18:30:36,19.61,24.0
30-03-2023 8.42,30-03-2023 8.46,2023-03-30 08:52:48.200000000,6.02,47.0
07-12-2023 00.05,07-12-2023 00.28,2023-12-07 00:37:52,23.18,32.0
09-12-2023 07.28,09-12-2023 07.53,2023-12-09 08:12:26,24.76,
30-03-2023 15.45,30-03-2023 15.52,2023-03-30 16:07:46.000000000,14.95,25.0
26-10-2023 13.28,26-10-2023 13.59,2023-10-26 14:12:54,31.85,42.0
27-02-2024 00.46,27-02-2024 01.11,2024-02-27 01:27:37,24.86,41.0
2023/04/29 02:14:09,29-04-2023 02.47,2023-04-29 03:06:57,33.2,29.0
01-10-2023 13.15,01-10-2023 13.40,2023-10-01 13:56:37,24.51,42.0
28-08-2023 17.33,28-08-2023 17.56,2023-08-28 18:14:29,23.02,34.0
05-05-2023 16.44,05-05-2023 17.10,2023-05-05 17:24:00,26.33,19.0
28-04-2023 11.50,28-04-2023 12.12,2023-04-28 12:22:12,21.4,40.0
10-01-2024 10.41,10-01-2024 11.04,2024-01-10 11:19:35,22.6,22.0
27-04-2023 17.57,27-04-2023 18.18,2023-04-27 18:24:13,20.71,36.0
30-03-2023 0.10,30-03-2023 0.18,2023-03-30 00:22:31.000000000,4.45,126.0
05-11-2023 06.00,2023-11-05 06:22,2023-11-05 06:32:40,22.73,39.0
13-03-2024 22.49,13-03-2024 22.26,2024-03-13 22:57:58,23.27,58.0
09-02-2024 03.35,09-02-2024 04.05,2024-02-09 04:23:36,29.81,49.0
06-09-2023 05.16,06-09-2023 05.01,2023-09-06 05:28:32,14.37,29.0
30-03-2023 10.31,30-03-2023 10.35,2023-03-30 10:40:59.000000000,5.6,32.0
14-09-2023 17.17,14-09-2023 17.29,2023-09-14 17:44:26,74.74,24.0
11-06-2023 22.15,11-06-2023 22.48,2023-06-11 22:58:44,33.15,42.0
30-03-2023 15.45,30-03-2023 15.52,2023-03-30 16:07:22.600000000,14.56,
30-03-2023 08.51,30-03-2023 09.16,2023-03-30 09:20:24,25.11,25.0
16-06-2023 16.33,16-06-2023 16.52,2023-06-16 17:04:58,18.9,33.0
28-12-2023 14.49,28-12-2023 15.03,2023-12-28 15:11:33,14.07,17.0
02-07-2023 00.53,02-07-2023 01.19,2023-07-02 01:27:37,25.78,48.0
25-11-2023 03.02,25-11-2023 03.22,25-11-2023 03:39:04.436729,20.04,30.0
12-10-2023 01.47,12-10-2023 02.14,2023-10-12 02:21:19,26.4,55.0
25-08-2023 09.07,25-08-2023 09.39,2023-08-25 09:51:20,31.91,49.0
05-04-2023 12.37,05-04-2023 12.57,2023-04-05 13:05:16,19.47,35.0
17-05-2023 09.16,17-05-2023 09.42,17-05-2023 09:57:11.879814,25.97,43.0
05-09-2023 09.22,05-09-2023 09.56,2023-09-05 09:59:10,33.9,52.0
03-02-2024 00.50,03-02-2024 01.12,2024-02-03 01:23:33,22.54,46.0
01-08-2023 19.26,01-08-2023 19.44,2023-08-01 19:57:57,18.04,23.0
20-08-2023 23.20,20-08-2023 23.46,2023-08-21 00:01:16,26.57,44.0
16-04-2023 22.03,16-04-2023 22.17,2023-04-16 22:23:50,14.04,9.0
23-05-2023 23.24,23-05-2023 23.49,2023-05-23 23:51:38,24.86,32.0
12-12-2023 14.56,12-12-2023 15.24,2023-12-12 15:36:38,27.99,29.0
27-12-2023 23.47,28-12-2023 00.11,2023-12-28 00:22:41,122.94,52.0
28-12-2023 05.58,28-12-2023 06.18,2023-12-28 06:24:52,20.06,30.0
30-03-2023 1.58,30-03-2023 2.06,2023-03-30 02:30:37.600000000,24.01,227.0
05-07-2023 06.23,05-07-2023 06.57,2023-07-05 07:05:13,34.22,49.0
22-07-2023 21.05,22-07-2023 21.22,22-07-2023 21:24:52.180826,17.31,18.0
30-03-2023 21.09,30-03-2023 21.15,2023-03-30 21:29:37.199999999,13.77,44.0
02-10-2023 13.47,02-10-2023 14.07,2023-10-02 14:14:54,19.9,29.0
18-06-2023 07.18,18-06-2023 07.36,2023-06-18 07:41:11,18.34,30.0
31-05-2023 01.10,31-05-2023 01.27,2023-05-31 01:36:50,16.3,28.0
21-10-2023 02.46,21-10-2023 03.00,2023-10-21 03:21:48,14.18,13.0
30-03-2023 3.02,30-03-2023 3.12,2023-03-30 03:16:40.200000000,4.42,45.0
01-09-2023 04.03,01-09-2023 04.33,2023-09-01 04:47:48,29.28,42.0
05-04-2023 01.24,05-04-2023 01.41,2023-04-05 01:54:35,17.64,12.0
15-11-2023 06.15,15-11-2023 06.41,2023-11-15 06:51:37,26.48,56.0
19-09-2023 01.53,19-09-2023 02.11,2023-09-19 02:14:21,18.52,23.0
30-03-2023 15.45,30-03-2023 15.49,2023-03-30 16:03:56.800000000,14.13,25.0
07-07-2023 09.00,07-07-2023 09.10,2023-07-07 09:14:26,10.35,23.0
13-12-2023 17.47,13-12-2023 18.22,2023-12-13 18:35:27,34.21,54.0
08-10-2023 12.11,2023-10-08 12:34,2023-10-08 12:38:34,23.58,48.0
30-03-2023 14.12,30-03-2023 14.19,2023-03-30 14:32:25.400000000,12.89,17.0
29-01-2024 11.22,29-01-2024 11.38,2024-01-29 11:49:44,15.49,11.0
08-11-2023 13.08,08-11-2023 13.38,2023-11-08 13:50:45,30.35,57.0
07-06-2023 08.57,2023-06-07 09:26,2023-06-07 09:38:43,28.36,42.0
2023/04/27 12:23:46,27-04-2023 12.43,2023-04-27 12:49:31,20.15,43.0
19-07-2023 05.22,19-07-2023 05.39,2023-07-19 05:50:27,16.96,21.0
07-07-2023 17.01,07-07-2023 17.18,2023-07-07 17:28:58,17.72,28.0
30-03-2023 19.51,30-03-2023 19.53,2023-03-30 20:05:05.800000000,11.93,12.0
18-01-2024 08.13,18-01-2024 08.32,2024-01-18 08:42:12,19.77,35.0
28-05-2023 01.22,28-05-2023 01.54,2023-05-28 01:56:51,31.21,25.0
08-11-2023 00.09,08-11-2023 00.20,2023-11-08 00:35:00,110.43,15.0
31-12-2023 19.56,31-12-2023 20.14,2023-12-31 20:29:23,18.23,23.0
22-07-2023 16.09,22-07-2023 16.30,2023-07-22 16:51:33,20.31,30.0
07-02-2024 04.29,07-02-2024 04.56,2024-02-07 05:11:45,26.77,38.0
,16-07-2023 13.02,2023-07-16 13:16:35,15.62,10.0
13-01-2024 23.36,14-01-2024 00.09,14-01-2024 00:21:29.441805,32.79,47.0
11-07-2023 03.10,11-07-2023 03.24,2023-07-11 03:39:36,14.61,29.0
25-12-2023 22.52,25-12-2023 23.16,2023-12-25 23:33:19,24.0,32.0
24-04-2023 12.46,24-04-2023 13.10,2023-04-24 13:18:39,24.6,37.0
30-11-2023 20.08,30-11-2023 20.23,2023-11-30 20:28:41,14.42,28.0
23-05-2023 00.10,23-05-2023 00.43,2023-05-23 00:52:54,32.35,45.0
05-09-2023 20.57,05-09-2023 21.19,2023-09-05 21:28:40,22.39,32.0
19-11-2023 14.28,19-11-2023 14.48,19-11-2023 14:55:06.371662,20.0,34.0
11-07-2023 20.44,11-07-2023 21.11,11-07-2023 21:21:43.963583,26.32,41.0
30-11-2023 09.12,30-11-2023 09.32,2023-11-30 09:41:08,19.87,26.0
23-06-2023 19.37,23-06-2023 20.02,2023-06-23 20:13:56,25.85,36.0
15-11-2023 04.37,15-11-2023 04.57,2023-11-15 05:08:10,19.68,29.0
14-03-2024 11.44,14-03-2024 11.58,2024-03-14 12:10:30,14.12,32.0
2023/05/30 07:18:12,30-05-2023 07.31,2023-05-30 07:38:18,13.63,18.0
29-06-2023 13.38,29-06-2023 13.56,2023-06-29 14:06:55,18.34,32.0
30-03-2023 3.02,30-03-2023 3.02,2023-03-30 03:10:07.200000000,7.87,45.0
17-03-2024 23.44,18-03-2024 00.00,2024-03-18 00:16:58,15.75,31.0
24-06-2023 09.19,24-06-2023 09.49,2023-06-24 09:51:49,30.09,55.0
18-10-2023 08.42,18-10-2023 08.56,2023-10-18 09:05:13,13.88,0.0
28-05-2023 02.46,28-05-2023 03.06,2023-05-28 03:12:15,19.65,37.0
14-04-2023 12.05,14-04-2023 12.32,2023-04-14 12:48:54,26.56,30.0
2023/04/14 04:42:24,14-04-2023 05.12,2023-04-14 05:14:35,30.12,53.0
18-12-2023 21.04,2023-12-18 21:26,2023-12-18 21:32:16,22.52,25.0
2023/08/20 02:36:44,20-08-2023 03.06,20-08-2023 03:21:41.966138,30.0,36.0
30-03-2023 5.34,30-03-2023 5.36,2023-03-30 05:51:19.800000000,15.03,50.0
28-09-2023 01.48,28-09-2023 02.04,2023-09-28 02:09:59,16.13,195.0
22-07-2023 18.39,22-07-2023 19.09,2023-07-22 19:13:51,29.44,73.0
29-07-2023 18.50,2023-07-29 19:14,2023-07-29 19:16:04,24.07,38.0
21-05-2023 12.29,21-05-2023 12.52,2023-05-21 13:04:26,23.7,24.0
28-03-2024 18.49,28-03-2024 19.06,2024-03-28 19:17:10,17.53,15.0
30-09-2023 16.24,30-09-2023 16.44,2023-09-30 16:55:38,19.27,21.0
09-04-2023 23.26,09-04-2023 23.52,2023-04-10 00:10:37,26.23,26.0
04-02-2024 06.31,04-02-2024 06.55,2024-02-04 07:07:00,23.35,42.0
30-03-2023 21.09,30-03-2023 21.11,2023-03-30 21:15:36.000000000,3.75,158.0
19-07-2023 07.11,19-07-2023 07.39,2023-07-19 07:52:59,28.37,50.0
03-05-2023 18.00,03-05-2023 18.17,2023-05-03 18:28:04,17.43,20.0
17-06-2023 20.00,17-06-2023 20.20,2023-06-17 20:27:20,19.71,37.0
23-02-2024 17.39,23-02-2024 18.20,2024-02-23 18:28:32,40.86,72.0
12-05-2023 14.32,12-05-2023 15.10,2023-05-12 15:27:47,38.78,55.0
23-10-2023 03.00,23-10-2023 03.25,2023-10-23 03:33:00,24.84,45.0
29-01-2024 05.40,29-01-2024 06.13,2024-01-29 06:22:16,33.09,34.0
17-05-2023 05.23,17-05-2023 05.55,2023-05-17 06:01:47,31.96,61.0
11-05-2023 03.51,11-05-2023 04.23,2023-05-11 04:40:00,31.49,44.0
30-03-2023 18.31,30-03-2023 18.40,2023-03-30 18:54:00.000000000,76.37,30.0
25-05-2023 01.31,25-05-2023 01.48,2023-05-25 02:02:33,16.81,39.0
02-06-2023 09.02,02-06-2023 09.29,2023-06-02 09:33:44,26.68,44.0
10-08-2023 09.58,10-08-2023 10.27,2023-08-10 10:37:22,28.65,38.0
05-06-2023 02.11,05-06-2023 02.37,05-06-2023 02:50:49.193022,26.66,33.0
12-07-2023 16.50,12-07-2023 17.13,2023-07-12 17:21:29,22.32,32.0
29-09-2023 22.37,29-09-2023 23.01,2023-09-29 23:11:06,100.56,42.0
08-09-2023 20.29,08-09-2023 20.50,2023-09-08 21:05:09,20.57,28.0
30-03-2023 6.51,30-03-2023 6.51,2023-03-30 06:54:59.800000000,3.33,24.0
05-05-2023 18.50,2023-05-05 19:08,2023-05-05 19:10:45,18.5,26.0
14-06-2023 09.26,14-06-2023 09.46,2023-06-14 09:53:11,20.29,31.0
30-03-2023 1.58,30-03-2023 1.59,2023-03-30 02:00:30.400000000,0.89,27.0
03-01-2024 03.09,03-01-2024 03.26,2024-01-03 03:31:45,17.61,27.0
16-09-2023 00.12,16-09-2023 00.29,2023-09-16 00:42:54,17.48,41.0
18-10-2023 05.31,18-10-2023 06.01,2023-10-18 06:15:29,29.76,36.0
30-03-2023 3.02,30-03-2023 3.07,2023-03-30 03:22:12.000000000,14.95,45.0
08-03-2024 11.50,08-03-2024 12.05,2024-03-08 12:09:29,14.93,23.0
06-02-2024 05.20,06-02-2024 05.39,2024-02-06 05:52:05,19.3,36.0
16-02-2024 12.27,16-02-2024 12.52,16-02-2024 13:06:53.823497,24.91,44.0
2023/11/20 09:15:18,2023-11-20 09:26,2023-11-20 09:31:00,11.15,6.0
05-05-2023 10.41,05-05-2023 10.53,2023-05-05 11:01:10,12.24,19.0
04-12-2023 16.00,04-12-2023 16.27,2023-12-04 16:38:25,26.59,46.0
23-07-2023 06.15,23-07-2023 06.39,2023-07-23 06:51:39,23.89,31.0
29-01-2024 05.16,2024-01-29 05:34,2024-01-29 05:46:48,17.63,21.0
21-03-2024 05.00,21-03-2024 05.23,2024-03-21 05:44:30,23.83,42.0
09-07-2023 11.38,09-07-2023 12.03,2023-07-09 12:13:28,25.55,33.0
28-02-2024 09.03,28-02-2024 09.24,2024-02-28 09:40:05,21.3,24.0
30-03-2023 8.42,30-03-2023 8.51,2023-03-30 09:04:55.400000000,13.14,47.0
12-08-2023 16.21,12-08-2023 16.41,2023-08-12 16:51:48,20.55,19.0
30-03-2023 21.09,30-03-2023 21.13,2023-03-30 21:26:19.200000000,12.47,44.0
2023/11/27 04:01:01,27-11-2023 04.29,2023-11-27 04:31:55,28.89,36.0
30-03-2023 20.49,30-03-2023 20.51,2023-03-30 21:04:48.199999999,12.87,22.0
18-09-2023 19.48,18-09-2023 20.04,18-09-2023 20:08:29.344619,15.5,22.0
03-05-2023 13.12,03-05-2023 13.29,2023-05-03 13:42:09,17.19,34.0
11-02-2024 23.25,11-02-2024 23.51,2024-02-11 23:53:20,25.55,42.0
09-10-2023 08.44,09-10-2023 09.08,2023-10-09 09:19:19,24.58,25.0
21-07-2023 22.11,21-07-2023 22.26,2023-07-21 22:28:35,,28.0
04-10-2023 05.35,04-10-2023 05.54,2023-10-04 06:14:41,19.01,26.0
01-07-2023 02.07,01-07-2023 02.22,2023-07-01 02:38:05,14.89,26.0
2023/09/18 08:09:07,18-09-2023 08.35,2023-09-18 08:47:50,26.59,46.0
09-05-2023 10.06,09-05-2023 10.43,2023-05-09 10:54:18,36.85,57.0
24-03-2024 20.20,24-03-2024 20.30,2024-03-24 20:41:33,10.78,9.0
17-07-2023 02.54,17-07-2023 03.27,2023-07-17 03:44:42,32.32,41.0
10-04-2023 23.34,10-04-2023 23.53,2023-04-11 00:01:59,18.44,38.0
31-07-2023 18.00,31-07-2023 18.24,2023-07-31 18:35:23,23.31,
2023/07/25 16:56:43,25-07-2023 17.23,2023-07-25 17:29:34,27.01,40.0
22-12-2023 17.34,22-12-2023 18.11,2023-12-22 18:20:26,36.61,39.0
02-02-2024 01.00,02-02-2024 01.17,2024-02-02 01:23:17,16.74,26.0
24-01-2024 05.59,24-01-2024 06.24,2024-01-24 06:36:06,24.42,35.0
19-05-2023 09.01,19-05-2023 09.23,2023-05-19 09:35:11,22.17,34.0
15-12-2023 08.18,15-12-2023 08.41,2023-12-15 08:52:38,23.32,53.0
25-12-2023 16.42,25-12-2023 16.53,2023-12-25 17:08:55,10.87,8.0
01-02-2024 05.11,01-02-2024 05.38,2024-02-01 05:54:50,27.46,37.0
25-04-2023 10.52,25-04-2023 11.04,2023-04-25 11:19:32,12.66,33.0
02-11-2023 17.01,02-11-2023 17.22,2023-11-02 17:32:58,20.9,35.0
16-06-2023 13.42,2023-06-16 14:08,2023-06-16 14:21:02,26.27,27.0
05-12-2023 10.22,05-12-2023 10.42,2023-12-05 10:55:01,20.1,19.0
08-09-2023 12.36,2023-09-08 13:00,08-09-2023 13:22:18.844863,23.81,36.0
28-05-2023 13.51,28-05-2023 14.12,2023-05-28 14:25:05,20.66,52.0
09-10-2023 17.18,09-10-2023 17.38,2023-10-09 17:52:44,20.8,17.0
05-03-2024 22.38,05-03-2024 23.00,2024-03-05 23:13:59,21.96,30.0
2024/03/03 04:19:43,03-03-2024 04.38,2024-03-03 04:50:06,18.62,20.0
26-09-2023 20.40,2023-09-26 21:01,2023-09-26 21:20:08,20.78,33.0
30-03-2023 8.42,30-03-2023 8.47,2023-03-30 09:00:23.000000000,12.6,47.0
01-07-2023 10.25,01-07-2023 10.48,01-07-2023 10:51:47.399249,23.72,37.0
18-05-2023 01.13,18-05-2023 01.36,2023-05-18 01:41:37,23.67,34.0
15-01-2024 18.30,15-01-2024 18.59,2024-01-15 19:09:37,28.79,32.0
11-12-2023 14.44,11-12-2023 14.58,2023-12-11 15:10:23,13.75,19.0
23-06-2023 09.28,23-06-2023 09.42,2023-06-23 09:47:50,13.83,169.0
07-07-2023 07.16,07-07-2023 07.44,2023-07-07 07:49:18,27.15,37.0
28-07-2023 16.53,28-07-2023 17.09,2023-07-28 17:26:49,16.05,28.0
03-01-2024 08.22,03-01-2024 08.23,2024-01-03 08:25:41,0.5,7.0
09-04-2023 19.31,09-04-2023 19.59,09-04-2023 20:15:17.804617,28.21,35.0
15-01-2024 23.01,15-01-2024 23.17,2024-01-15 23:31:10,15.65,19.0
02-03-2024 19.32,02-03-2024 20.02,2024-03-02 20:15:30,,57.0
08-06-2023 01.23,08-06-2023 01.34,2023-06-08 01:48:13,10.28,23.0
29-02-2024 04.37,2024-02-29 05:00,2024-02-29 05:19:19,23.2,18.0
2024/03/20 23:50:50,21-03-2024 00.10,21-03-2024 00:25:16.375096,20.09,29.0
10-05-2023 15.43,10-05-2023 16.03,2023-05-10 16:10:54,20.62,24.0
20-08-2023 20.20,20-08-2023 20.36,2023-08-20 20:43:05,16.03,24.0
31-07-2023 04.34,31-07-2023 04.51,2023-07-31 04:56:51,17.28,20.0
2023/09/18 14:39:30,18-09-2023 14.59,2023-09-18 15:15:26,20.22,28.0
24-08-2023 18.41,24-08-2023 19.11,2023-08-24 19:33:34,29.71,47.0
17-05-2023 20.08,17-05-2023 20.36,2023-05-17 20:45:50,28.19,43.0
13-03-2024 07.14,13-03-2024 07.37,2024-03-13 07:45:57,22.77,36.0
2024/01/09 05:48:26,09-01-2024 06.16,2024-01-09 06:21:05,28.03,58.0
17-12-2023 03.23,17-12-2023 03.43,2023-12-17 03:51:13,20.58,33.0
16-08-2023 05.19,16-08-2023 05.34,2023-08-16 05:45:37,15.22,16.0
08-04-2023 12.04,08-04-2023 12.26,2023-04-08 12:36:33,21.32,29.0
02-02-2024 17.33,02-02-2024 18.00,2024-02-02 18:06:48,90.86,23.0
30-03-2023 5.34,30-03-2023 5.36,2023-03-30 05:43:54.000000000,7.6,50.0
07-11-2023 22.30,07-11-2023 22.45,2023-11-07 22:55:47,14.35,19.0
02-05-2023 10.13,02-05-2023 10.45,2023-05-02 10:54:19,31.2,25.0
28-01-2024 05.15,28-01-2024 05.35,2024-01-28 05:58:12,19.34,36.0
23-02-2024 23.47,24-02-2024 00.09,2024-02-24 00:30:05,21.3,32.0
01-05-2023 06.53,01-05-2023 07.18,2023-05-01 07:26:15,24.98,39.0
28-08-2023 21.44,28-08-2023 22.11,2023-08-28 22:20:50,,16.0
25-11-2023 16.42,25-11-2023 17.05,2023-11-25 17:18:35,22.47,28.0
27-03-2024 19.03,27-03-2024 19.23,2024-03-27 19:35:50,19.62,29.0
28-08-2023 02.11,28-08-2023 02.37,2023-08-28 02:48:03,25.28,32.0
30-03-2023 10.31,30-03-2023 10.38,2023-03-30 10:47:40.400000000,9.29,32.0
30-03-2023 3.02,30-03-2023 3.08,2023-03-30 03:16:45.599999999,8.51,45.0
30-04-2023 12.40,30-04-2023 13.04,2023-04-30 13:07:05,23.59,25.0
26-05-2023 11.24,26-05-2023 11.48,2023-05-26 12:04:31,24.48,40.0
07-01-2024 11.36,07-01-2024 11.57,2024-01-07 12:03:47,20.93,13.0
30-03-2023 16.45,30-03-2023 16.45,2023-03-30 16:52:38.000000000,7.5,27.0
30-04-2023 16.32,2023-04-30 16:55,2023-04-30 17:11:29,23.39,39.0
27-02-2024 20.33,27-02-2024 20.51,2024-02-27 21:08:39,18.67,24.0
2023/11/11 08:39:04,11-11-2023 08.57,2023-11-11 09:09:53,18.22,31.0
23-11-2023 09.14,23-11-2023 09.38,2023-11-23 09:53:28,24.77,38.0
30-03-2023 16.45,30-03-2023 16.54,2023-03-30 17:11:31.400000000,17.39,27.0
21-05-2023 11.08,21-05-2023 11.36,2023-05-21 11:46:46,28.39,34.0
2023/09/17 21:42:26,17-09-2023 22.02,2023-09-17 22:11:40,,15.0
22-10-2023 00.14,22-10-2023 00.35,2023-10-22 00:43:37,20.56,36.0
07-06-2023 03.56,07-06-2023 04.11,2023-06-07 04:16:40,15.3,23.0
07-07-2023 13.55,07-07-2023 14.15,2023-07-07 14:24:23,19.92,10.0
2024/03/19 13:22:00,19-03-2024 13.31,2024-03-19 13:37:56,9.75,20.0
13-06-2023 13.39,13-06-2023 14.03,2023-06-13 14:12:45,23.81,38.0
2023/08/23 11:14:51,23-08-2023 11.37,2023-08-23 11:41:30,22.59,30.0
22-06-2023 21.28,22-06-2023 21.48,2023-06-22 21:57:58,19.44,16.0
2023/09/01 14:03:57,01-09-2023 14.30,2023-09-01 14:38:27,26.16,30.0
18-09-2023 23.49,19-09-2023 00.13,2023-09-19 00:24:24,24.23,24.0
25-03-2024 07.01,25-03-2024 07.11,2024-03-25 07:25:22,10.83,27.0
01-08-2023 23.37,02-08-2023 00.00,2023-08-02 00:05:17,23.14,20.0
31-03-2023 07.50,31-03-2023 08.04,2023-03-31 08:17:46,13.85,10.0
28-05-2023 02.08,28-05-2023 02.21,2023-05-28 02:37:28,12.81,11.0
17-12-2023 23.23,17-12-2023 23.33,2023-12-17 23:46:02,9.8,15.0
30-03-2023 1.58,30-03-2023 2.07,2023-03-30 02:11:52.600000000,4.26,27.0
16-01-2024 16.52,16-01-2024 17.10,2024-01-16 17:21:06,18.21,16.0
21-01-2024 18.52,21-01-2024 19.17,2024-01-21 19:29:43,25.45,30.0
2023/11/24 12:44:18,24-11-2023 13.07,2023-11-24 13:10:21,22.8,15.0
23-01-2024 08.17,23-01-2024 08.35,2024-01-23 08:44:25,17.97,14.0
05-07-2023 20.35,05-07-2023 20.47,2023-07-05 20:56:27,11.66,19.0
2023/11/24 11:08:37,24-11-2023 11.25,2023-11-24 11:36:56,16.82,31.0
18-04-2023 21.35,18-04-2023 21.48,2023-04-18 22:00:39,13.55,24.0
07-01-2024 12.39,07-01-2024 12.57,2024-01-07 13:02:14,18.09,22.0
03-11-2023 21.29,03-11-2023 21.37,2023-11-03 21:52:18,7.99,12.0
2024/01/03 08:51:54,03-01-2024 09.26,2024-01-03 09:31:53,34.96,49.0
31-01-2024 22.00,31-01-2024 22.25,2024-01-31 22:34:35,25.63,
12-12-2023 10.21,12-12-2023 10.32,2023-12-12 10:39:03,10.86,0.0
16-07-2023 13.29,16-07-2023 13.42,2023-07-16 13:57:48,13.12,18.0
24-01-2024 22.02,24-01-2024 22.31,2024-01-24 22:42:28,28.89,46.0
21-11-2023 19.26,21-11-2023 19.51,2023-11-21 20:01:31,24.99,31.0
05-02-2024 16.06,05-02-2024 16.32,2024-02-05 16:39:03,25.76,29.0
18-08-2023 16.23,18-08-2023 16.48,2023-08-18 16:55:30,24.82,219.0
05-03-2024 06.23,05-03-2024 06.42,2024-03-05 06:55:53,18.85,35.0
23-07-2023 18.18,23-07-2023 18.45,2023-07-23 18:57:35,27.13,44.0
30-03-2023 16.45,30-03-2023 16.45,2023-03-30 16:54:41.000000000,9.55,27.0
30-07-2023 01.09,30-07-2023 01.40,2023-07-30 01:54:43,31.76,35.0
2024/01/07 17:49:44,07-01-2024 17.57,2024-01-07 17:59:33,7.82,16.0
29-05-2023 10.13,29-05-2023 10.30,29-05-2023 10:39:04.923414,16.62,
21-06-2023 22.30,21-06-2023 23.01,2023-06-21 23:10:05,30.47,40.0
2023/07/17 07:53:45,17-07-2023 08.20,2023-07-17 08:25:06,26.58,27.0
13-09-2023 12.16,2023-09-13 12:51,2023-09-13 13:06:53,35.18,62.0
30-03-2023 3.02,30-03-2023 3.02,2023-03-30 03:14:18.600000000,12.06,45.0
30-03-2023 16.45,30-03-2023 16.50,2023-03-30 16:54:21.800000000,4.23,27.0
19-11-2023 10.52,19-11-2023 11.19,2023-11-19 11:26:04,27.52,46.0
20-03-2024 07.03,20-03-2024 07.33,2024-03-20 07:54:09,30.77,47.0
06-10-2023 23.07,06-10-2023 23.23,2023-10-06 23:27:26,16.18,7.0
09-02-2024 21.55,09-02-2024 22.16,2024-02-09 22:20:19,21.42,14.0
06-02-2024 14.34,06-02-2024 14.59,2024-02-06 15:14:28,25.73,26.0
15-02-2024 05.43,15-02-2024 06.00,2024-02-15 06:07:16,17.62,36.0
27-01-2024 08.42,27-01-2024 09.06,2024-01-27 09:17:03,23.63,32.0
02-07-2023 03.19,02-07-2023 03.30,02-07-2023 03:42:20.613846,11.46,8.0
05-05-2023 19.16,05-05-2023 19.40,2023-05-05 19:49:28,24.47,49.0
13-04-2023 14.05,13-04-2023 14.19,2023-04-13 14:31:24,13.85,0.0
28-03-2024 03.33,28-03-2024 03.46,2024-03-28 03:51:55,12.51,39.0
29-07-2023 18.03,29-07-2023 18.25,2023-07-29 18:51:04,22.07,33.0
22-07-2023 19.01,22-07-2023 18.45,2023-07-22 19:07:41,16.24,23.0
28-07-2023 01.42,28-07-2023 02.12,2023-07-28 02:24:52,29.35,39.0
27-06-2023 07.06,2023-06-27 07:27,2023-06-27 07:37:10,21.19,24.0
01-07-2023 17.02,01-07-2023 17.19,2023-07-01 17:29:13,16.98,24.0
04-07-2023 09.06,04-07-2023 09.42,2023-07-04 09:45:14,36.17,45.0
20-12-2023 01.30,20-12-2023 01.46,2023-12-20 02:03:12,16.53,200.0
12-06-2023 09.59,12-06-2023 10.19,2023-06-12 10:27:30,20.12,32.0
20-12-2023 08.46,20-12-2023 09.01,2023-12-20 09:17:19,,17.0
15-03-2024 23.16,15-03-2024 23.34,2024-03-15 23:50:40,17.82,34.0
05-12-2023 10.57,05-12-2023 11.24,2023-12-05 11:37:38,26.97,34.0
2023/04/17 23:21:09,17-04-2023 23.43,17-04-2023 23:50:38.050371,22.59,30.0
21-04-2023 03.57,21-04-2023 04.20,2023-04-21 04:35:59,23.02,32.0
2023/11/09 06:07:59,09-11-2023 06.26,2023-11-09 06:43:40,18.27,32.0
30-03-2023 13.55,30-03-2023 13.59,2023-03-30 14:12:23.199999999,12.62,25.0
21-11-2023 16.07,2023-11-21 16:38,2023-11-21 16:49:27,30.29,48.0
2024/02/22 09:58:43,22-02-2024 10.20,2024-02-22 10:37:48,22.2,10.0
15-01-2024 17.16,15-01-2024 17.37,2024-01-15 17:47:58,20.62,19.0
04-06-2023 23.55,05-06-2023 00.25,2023-06-05 00:36:29,30.08,32.0
25-02-2024 01.59,25-02-2024 02.15,2024-02-25 02:18:00,16.04,34.0
07-11-2023 17.45,07-11-2023 18.14,2023-11-07 18:32:57,29.15,28.0
06-09-2023 07.22,06-09-2023 07.49,2023-09-06 08:02:41,27.57,48.0
24-03-2024 02.42,24-03-2024 03.05,2024-03-24 03:16:07,22.93,33.0
16-08-2023 04.25,16-08-2023 04.46,2023-08-16 04:58:18,21.1,13.0
04-11-2023 22.33,04-11-2023 22.52,2023-11-04 23:01:40,18.9,22.0
16-05-2023 21.05,16-05-2023 21.20,2023-05-16 21:33:41,15.07,30.0
05-12-2023 05.57,05-12-2023 06.12,2023-12-05 06:18:15,15.65,13.0
25-07-2023 14.46,2023-07-25 14:59,2023-07-25 15:20:37,13.2,15.0
11-03-2024 21.44,11-03-2024 21.58,2024-03-11 22:05:49,13.99,31.0
24-03-2024 03.02,24-03-2024 03.24,2024-03-24 03:27:01,22.87,201.0
18-10-2023 16.12,18-10-2023 16.45,2023-10-18 16:55:44,33.2,55.0
27-09-2023 23.54,28-09-2023 00.24,2023-09-28 00:33:41,30.49,40.0
22-07-2023 17.51,22-07-2023 18.10,2023-07-22 18:24:49,19.24,13.0
15-09-2023 06.21,15-09-2023 06.41,2023-09-15 06:49:21,20.14,29.0
15-02-2024 10.16,15-02-2024 10.48,2024-02-15 11:01:37,32.24,38.0
28-12-2023 15.47,28-12-2023 16.06,2023-12-28 16:16:27,18.74,30.0
13-11-2023 18.38,2023-11-13 18:58,2023-11-13 19:12:45,20.53,32.0
08-10-2023 03.57,08-10-2023 04.33,2023-10-08 04:35:41,36.27,37.0
26-07-2023 09.57,26-07-2023 10.19,2023-07-26 10:25:05,21.82,56.0
15-02-2024 23.26,15-02-2024 23.49,15-02-2024 23:57:05.708021,22.37,28.0
29-05-2023 14.15,29-05-2023 14.41,2023-05-29 14:53:39,25.83,43.0
09-02-2024 07.39,09-02-2024 07.58,2024-02-09 08:12:44,19.34,19.0
2023/12/31 17:00:54,31-12-2023 17.20,2023-12-31 17:32:50,19.44,39.0
03-01-2024 03.50,03-01-2024 04.08,2024-01-03 04:11:43,17.27,25.0
14-03-2024 01.38,14-03-2024 02.10,2024-03-14 02:26:55,31.7,40.0
05-08-2023 06.31,05-08-2023 06.48,2023-08-05 06:57:34,17.34,27.0
14-12-2023 13.57,14-12-2023 14.27,2023-12-14 14:42:39,30.44,54.0
30-03-2023 23.54,30-03-2023 23.58,2023-03-31 00:17:23.200000000,18.42,2.0
14-07-2023 16.48,2023-07-14 17:08,2023-07-14 17:21:08,19.64,30.0
30-03-2023 21.09,30-03-2023 21.13,2023-03-30 21:15:24.000000000,,44.0
12-08-2023 21.10,12-08-2023 21.29,2023-08-12 21:33:04,18.33,13.0
2023/05/19 11:55:45,19-05-2023 12.14,2023-05-19 12:28:14,18.33,10.0
14-12-2023 00.04,14-12-2023 00.23,2023-12-14 00:29:09,19.26,46.0
09-03-2024 18.41,09-03-2024 19.08,2024-03-09 19:15:06,26.94,44.0
02-03-2024 12.43,2024-03-02 13:08,2024-03-02 13:28:41,25.23,20.0
07-02-2024 00.47,07-02-2024 01.15,2024-02-07 01:21:17,27.89,
30-03-2023 3.02,30-03-2023 3.03,2023-03-30 03:10:53.400000000,7.64,45.0
18-02-2024 03.30,18-02-2024 03.53,2024-02-18 04:11:53,22.78,35.0
26-11-2023 15.43,26-11-2023 16.10,2023-11-26 16:19:17,27.71,42.0
15-11-2023 20.23,15-11-2023 20.51,2023-11-15 21:05:40,27.79,50.0
19-04-2023 05.25,19-04-2023 05.38,2023-04-19 05:56:14,12.89,23.0
30-03-2023 4.45,30-03-2023 4.47,2023-03-30 04:59:08.400000000,12.09,3.0
02-10-2023 10.23,02-10-2023 10.48,2023-10-02 11:05:35,24.7,34.0
31-12-2023 19.30,31-12-2023 19.47,2023-12-31 19:58:39,17.24,37.0
10-07-2023 17.05,10-07-2023 17.28,2023-07-10 17:32:51,23.1,32.0
23-08-2023 15.02,23-08-2023 15.32,2023-08-23 15:38:26,29.7,49.0
05-01-2024 19.50,05-01-2024 20.11,2024-01-05 20:15:48,21.37,50.0
15-08-2023 12.16,15-08-2023 12.38,2023-08-15 12:40:54,22.59,36.0
30-03-2023 0.10,30-03-2023 0.15,2023-03-30 00:31:21.400000000,16.29,28.0
23-08-2023 18.53,23-08-2023 19.06,2023-08-23 19:15:45,13.14,29.0
05-11-2023 10.43,05-11-2023 11.10,05-11-2023 11:18:02.776223,26.85,28.0
27-12-2023 16.51,27-12-2023 17.27,2023-12-27 17:33:54,35.62,72.0
2023/11/07 19:18:23,07-11-2023 19.40,2023-11-07 19:57:33,21.82,29.0
23-09-2023 18.07,23-09-2023 18.32,2023-09-23 18:36:49,24.65,43.0
23-04-2023 15.37,23-04-2023 16.03,2023-04-23 16:09:13,25.32,35.0
07-06-2023 22.36,07-06-2023 23.01,2023-06-07 23:09:32,24.79,42.0
10-10-2023 10.58,10-10-2023 11.25,2023-10-10 11:37:48,26.73,32.0
,07-09-2023 20.59,2023-09-07 21:02:45,30.61,53.0
03-05-2023 19.27,03-05-2023 19.52,2023-05-03 20:01:29,104.21,51.0
2024/02/09 11:08:08,09-02-2024 11.35,2024-02-09 11:49:58,26.97,51.0
19-08-2023 12.28,19-08-2023 12.40,2023-08-19 12:42:24,11.72,5.0
05-05-2023 04.23,05-05-2023 04.51,2023-05-05 05:08:36,28.0,36.0
2023/09/12 14:15:52,12-09-2023 14.50,2023-09-12 14:57:57,34.84,46.0
29-02-2024 16.01,29-02-2024 16.19,2024-02-29 16:29:05,18.77,38.0
09-02-2024 09.20,09-02-2024 09.46,2024-02-09 09:55:36,26.14,63.0
22-11-2023 07.15,2023-11-22 07:42,2023-11-22 07:54:58,26.83,36.0
04-09-2023 13.03,04-09-2023 13.14,2023-09-04 13:16:57,10.16,6.0
30-08-2023 16.36,2023-08-30 17:01,2023-08-30 17:24:35,25.37,23.0
26-08-2023 07.18,26-08-2023 07.36,2023-08-26 07:44:26,17.23,28.0
15-01-2024 16.20,15-01-2024 16.53,2024-01-15 17:05:37,32.31,67.0
20-05-2023 06.30,20-05-2023 06.52,2023-05-20 07:00:13,22.15,35.0
01-11-2023 03.15,01-11-2023 03.36,2023-11-01 03:39:39,21.38,26.0
30-03-2023 21.09,30-03-2023 21.09,2023-03-30 21:19:54.600000000,10.06,44.0
02-06-2023 14.41,02-06-2023 15.10,2023-06-02 15:17:17,28.57,39.0
26-08-2023 04.06,26-08-2023 04.26,2023-08-26 04:41:05,19.76,21.0
30-03-2023 21.09,30-03-2023 21.13,2023-03-30 21:28:35.400000000,14.74,44.0
03-07-2023 14.22,03-07-2023 14.38,2023-07-03 14:41:21,16.19,45.0
26-09-2023 09.52,26-09-2023 10.13,2023-09-26 10:21:45,20.29,33.0
12-07-2023 13.26,12-07-2023 13.53,2023-07-12 13:57:31,26.99,50.0
2023/12/31 18:52:14,31-12-2023 19.16,2023-12-31 19:32:08,24.17,48.0
14-03-2024 23.20,14-03-2024 23.50,2024-03-15 00:02:18,29.99,46.0
08-03-2024 01.03,08-03-2024 01.26,2024-03-08 01:35:48,22.76,44.0
30-03-2023 5.34,30-03-2023 5.41,2023-03-30 05:50:16.800000000,8.98,50.0
29-10-2023 14.26,29-10-2023 14.58,2023-10-29 15:11:29,31.67,44.0
28-09-2023 18.52,28-09-2023 19.18,2023-09-28 19:28:20,25.88,24.0
24-04-2023 05.49,24-04-2023 06.21,2023-04-24 06:34:37,32.37,30.0
04-10-2023 07.05,04-10-2023 07.23,2023-10-04 07:34:18,18.24,39.0
28-03-2024 18.59,28-03-2024 19.16,2024-03-28 19:27:10,17.59,47.0
24-05-2023 09.56,24-05-2023 10.22,2023-05-24 10:36:35,25.74,30.0
05-02-2024 07.35,05-02-2024 07.48,2024-02-05 07:54:06,13.22,19.0
10-09-2023 09.32,10-09-2023 10.02,10-09-2023 10:20:40.632368,30.0,27.0
30-12-2023 07.35,30-12-2023 07.46,2023-12-30 07:56:32,58.69,22.0
30-09-2023 14.38,30-09-2023 15.03,2023-09-30 15:08:12,24.59,32.0
30-03-2023 5.34,30-03-2023 5.42,2023-03-30 05:56:09.599999999,13.86,50.0
04-12-2023 14.38,04-12-2023 14.58,2023-12-04 15:13:21,19.32,27.0
01-12-2023 12.11,01-12-2023 12.32,2023-12-01 12:47:19,21.08,33.0
11-10-2023 20.54,11-10-2023 21.12,2023-10-11 21:20:45,18.01,18.0
08-05-2023 04.00,08-05-2023 04.24,2023-05-08 04:43:41,24.15,33.0
24-11-2023 13.05,24-11-2023 13.25,2023-11-24 13:42:10,20.21,30.0
27-06-2023 16.29,27-06-2023 16.39,2023-06-27 16:43:35,10.07,20.0
30-03-2023 6.51,30-03-2023 7.01,2023-03-30 07:06:16.000000000,4.6,24.0
01-08-2023 07.44,01-08-2023 08.04,2023-08-01 08:16:20,19.76,30.0
29-04-2023 04.52,29-04-2023 05.20,2023-04-29 05:22:52,27.99,47.0
01-05-2023 21.45,01-05-2023 22.01,2023-05-01 22:15:15,15.76,27.0
18-08-2023 10.28,18-08-2023 10.37,2023-08-18 10:42:23,9.15,12.0
,30-03-2023 12.36,2023-03-30 12:46:44.800000000,10.63,40.0
28-08-2023 06.32,28-08-2023 07.10,2023-08-28 07:12:13,37.1,51.0
04-03-2024 13.04,2024-03-04 13:21,2024-03-04 13:34:20,17.2,9.0
2023/12/23 21:42:30,23-12-2023 22.03,2023-12-23 22:16:33,21.12,
16-02-2024 01.34,16-02-2024 01.53,2024-02-16 02:04:10,19.11,22.0
27-09-2023 10.40,27-09-2023 11.09,2023-09-27 11:15:36,29.15,205.0
11-05-2023 07.04,11-05-2023 07.24,2023-05-11 07:32:57,20.67,27.0
25-12-2023 00.33,2023-12-25 00:59,2023-12-25 01:12:58,26.02,43.0
15-09-2023 07.18,15-09-2023 07.50,2023-09-15 08:04:29,32.37,42.0
11-09-2023 10.53,11-09-2023 11.19,2023-09-11 11:31:10,25.17,215.0
30-03-2023 0.10,30-03-2023 0.16,2023-03-30 00:33:38.200000000,17.57,28.0
10-11-2023 10.57,10-11-2023 11.16,2023-11-10 11:27:44,19.37,24.0
27-12-2023 07.15,2023-12-27 07:33,2023-12-27 07:41:40,18.61,28.0
06-03-2024 00.50,06-03-2024 01.11,2024-03-06 01:20:01,21.21,42.0
07-09-2023 10.50,07-09-2023 11.10,2023-09-07 11:24:26,20.23,24.0
30-03-2023 8.42,30-03-2023 8.44,2023-03-30 08:55:47.000000000,11.0,47.0
02-02-2024 00.22,02-02-2024 00.41,2024-02-02 00:59:24,19.1,19.0
15-04-2023 18.48,15-04-2023 19.17,2023-04-15 19:30:55,,64.0
06-02-2024 09.29,06-02-2024 09.46,2024-02-06 09:49:03,17.22,23.0
08-07-2023 05.24,08-07-2023 05.33,2023-07-08 05:43:50,9.03,3.0
20-12-2023 16.04,20-12-2023 16.09,2023-12-20 16:24:14,4.73,11.0
29-08-2023 17.21,29-08-2023 17.42,2023-08-29 17:58:51,21.53,39.0
07-04-2023 20.24,07-04-2023 20.47,2023-04-07 20:49:13,22.28,41.0
03-04-2023 11.56,03-04-2023 12.18,2023-04-03 12:31:41,22.08,23.0
22-10-2023 12.29,2023-10-22 12:39,2023-10-22 12:49:19,9.85,16.0
05-11-2023 10.01,05-11-2023 10.17,2023-11-05 10:19:54,16.69,28.0
31-10-2023 11.22,31-10-2023 11.42,2023-10-31 11:56:57,20.4,20.0
28-05-2023 17.06,28-05-2023 17.32,2023-05-28 17:43:39,26.8,55.0
13-02-2024 15.34,13-02-2024 16.08,2024-02-13 16:28:20,33.97,59.0
30-03-2023 14.42,30-03-2023 15.06,2023-03-30 15:20:21,24.12,26.0
30-03-2023 5.34,30-03-2023 5.43,2023-03-30 05:50:57.000000000,7.65,50.0
19-01-2024 15.12,19-01-2024 15.44,2024-01-19 15:53:35,31.63,34.0
25-01-2024 06.39,25-01-2024 07.02,2024-01-25 07:06:33,22.1,32.0
2023/05/09 22:21:56,09-05-2023 22.44,2023-05-09 23:00:14,22.14,47.0
28-10-2023 10.28,28-10-2023 10.56,2023-10-28 11:08:55,27.26,40.0
2024/02/20 19:41:54,20-02-2024 20.00,2024-02-20 20:26:08,18.33,19.0
2023/04/03 17:59:18,03-04-2023 18.20,2023-04-03 18:29:07,21.57,44.0
13-01-2024 04.27,13-01-2024 04.45,2024-01-13 04:54:15,18.07,29.0
30-12-2023 10.13,30-12-2023 10.21,2023-12-30 10:25:21,7.67,
30-03-2023 3.02,30-03-2023 3.04,2023-03-30 03:11:01.200000000,6.77,45.0
2023/07/30 07:10:38,30-07-2023 07.46,2023-07-30 07:58:27,36.08,
2024/03/04 02:56:50,04-03-2024 03.24,2024-03-04 03:38:39,27.57,34.0
30-03-2023 9.49,30-03-2023 9.59,2023-03-30 10:13:34.600000000,14.51,10.0
02-11-2023 16.54,02-11-2023 17.14,2023-11-02 17:22:19,19.4,34.0
2023/10/11 01:19:18,11-10-2023 01.38,2023-10-11 01:46:34,19.27,30.0
14-08-2023 16.29,14-08-2023 16.54,2023-08-14 17:04:33,25.12,27.0
21-09-2023 10.17,21-09-2023 10.28,2023-09-21 10:32:20,11.19,11.0
19-10-2023 12.43,19-10-2023 13.07,2023-10-19 13:16:20,23.57,20.0
14-09-2023 08.21,14-09-2023 08.42,2023-09-14 08:56:43,21.28,37.0
27-09-2023 06.04,27-09-2023 06.31,2023-09-27 06:45:28,27.38,29.0
01-04-2023 16.14,01-04-2023 16.35,2023-04-01 16:41:57,20.85,19.0
06-10-2023 22.26,06-10-2023 22.52,2023-10-06 23:00:48,25.97,
27-01-2024 21.07,27-01-2024 21.28,2024-01-27 21:30:52,20.7,15.0
16-02-2024 15.10,16-02-2024 15.44,2024-02-16 15:59:32,34.07,43.0
2024/02/05 12:43:57,05-02-2024 13.00,2024-02-05 13:11:45,16.42,24.0
16-04-2023 18.58,16-04-2023 19.20,2023-04-16 19:42:39,21.63,29.0
24-07-2023 16.26,2023-07-24 16:44,2023-07-24 16:57:22,18.52,16.0
15-12-2023 22.54,15-12-2023 23.13,2023-12-15 23:29:38,18.95,27.0
19-09-2023 14.04,19-09-2023 14.27,19-09-2023 14:29:28.695457,22.44,36.0
09-01-2024 01.01,09-01-2024 01.16,2024-01-09 01:25:40,15.17,34.0
12-05-2023 18.18,12-05-2023 18.47,2023-05-12 18:55:51,28.79,
2024/01/03 05:33:23,2024-01-03 05:53,2024-01-03 06:14:27,19.83,26.0
30-03-2023 10.31,30-03-2023 10.38,2023-03-30 10:47:33.200000000,9.17,32.0
29-05-2023 12.09,29-05-2023 12.46,2023-05-29 12:59:29,36.94,45.0
2023/10/24 05:49:36,24-10-2023 06.11,2023-10-24 06:31:46,22.01,49.0
08-08-2023 16.24,08-08-2023 16.44,2023-08-08 17:07:14,19.79,203.0
2023/10/02 05:13:24,02-10-2023 05.31,2023-10-02 05:39:43,17.79,30.0
25-04-2023 05.34,25-04-2023 06.06,2023-04-25 06:23:25,31.87,28.0
21-08-2023 23.55,22-08-2023 00.14,2023-08-22 00:23:24,18.36,36.0
24-06-2023 09.40,24-06-2023 09.55,2023-06-24 10:02:25,15.32,18.0
30-03-2023 20.49,30-03-2023 20.50,2023-03-30 20:58:30.800000000,7.58,22.0
16-11-2023 02.33,16-11-2023 02.49,2023-11-16 03:02:17,16.03,32.0
30-09-2023 00.46,30-09-2023 00.54,2023-09-30 00:57:14,8.2,19.0
04-02-2024 13.58,04-02-2024 14.32,2024-02-04 14:47:48,34.49,51.0
20-06-2023 09.57,20-06-2023 10.10,2023-06-20 10:24:35,12.97,24.0
30-03-2023 5.34,30-03-2023 5.35,2023-03-30 05:42:39.600000000,7.36,50.0
2023/05/01 18:24:18,01-05-2023 18.43,2023-05-01 19:04:11,18.78,9.0
2024/03/26 00:06:39,2024-03-26 00:28,2024-03-26 00:40:18,22.32,24.0
05-01-2024 17.39,05-01-2024 17.59,2024-01-05 18:16:19,19.55,28.0
15-03-2024 02.23,15-03-2024 02.46,2024-03-15 02:50:11,23.16,31.0
16-06-2023 03.36,16-06-2023 03.50,2023-06-16 04:03:36,13.92,29.0
03-04-2023 09.44,03-04-2023 10.11,2023-04-03 10:31:28,27.32,26.0
06-07-2023 17.29,06-07-2023 17.58,2023-07-06 18:14:07,29.62,42.0
03-02-2024 15.15,03-02-2024 15.49,2024-02-03 16:06:32,34.34,40.0
31-07-2023 16.32,31-07-2023 16.52,2023-07-31 16:54:02,19.52,27.0
29-06-2023 03.16,29-06-2023 03.36,2023-06-29 03:46:17,20.24,11.0
04-12-2023 02.49,04-12-2023 03.19,2023-12-04 03:36:40,30.14,54.0
19-09-2023 02.31,19-09-2023 02.55,2023-09-19 03:03:39,23.99,47.0
04-05-2023 08.13,04-05-2023 08.38,2023-05-04 08:55:54,25.47,40.0
30-03-2023 8.42,30-03-2023 8.42,2023-03-30 08:46:29.000000000,3.7,
27-07-2023 07.47,27-07-2023 08.10,2023-07-27 08:16:39,22.86,51.0
26-04-2023 00.54,26-04-2023 01.18,26-04-2023 01:26:06.945609,24.25,31.0
17-05-2023 02.55,17-05-2023 03.10,2023-05-17 03:18:46,14.98,37.0
14-02-2024 00.17,14-02-2024 00.43,2024-02-14 00:50:11,25.48,22.0
,29-05-2023 13.25,2023-05-29 13:31:30,16.62,27.0
30-03-2023 8.42,30-03-2023 8.50,2023-03-30 09:03:23.599999999,12.61,47.0
25-05-2023 01.30,25-05-2023 01.53,2023-05-25 01:58:21,23.28,51.0
29-12-2023 14.34,29-12-2023 14.58,2023-12-29 15:08:41,24.46,27.0
03-03-2024 07.44,03-03-2024 08.08,2024-03-03 08:26:54,24.27,40.0
16-01-2024 12.20,16-01-2024 12.36,2024-01-16 12:38:24,15.81,28.0
12-09-2023 12.53,12-09-2023 13.31,2023-09-12 13:46:59,,49.0
31-01-2024 21.52,31-01-2024 22.18,2024-01-31 22:23:04,25.52,27.0
01-11-2023 03.38,2023-11-01 04:03,2023-11-01 04:12:18,25.22,41.0
2024/02/26 08:32:41,26-02-2024 08.50,2024-02-26 09:00:42,17.78,34.0
09-01-2024 16.55,2024-01-09 17:18,2024-01-09 17:24:44,22.46,38.0
,21-05-2023 00.33,2023-05-21 00:48:57,27.71,39.0
30-12-2023 23.47,2023-12-31 00:15,2023-12-31 00:17:32,28.1,33.0
31-01-2024 17.21,31-01-2024 17.49,2024-01-31 18:03:29,28.33,37.0
14-10-2023 18.24,14-10-2023 18.45,2023-10-14 18:55:46,20.68,46.0
12-06-2023 11.19,12-06-2023 11.36,2023-06-12 11:39:50,17.28,194.0
25-12-2023 23.00,25-12-2023 23.23,2023-12-25 23:34:57,135.38,31.0
17-04-2023 14.34,17-04-2023 14.53,2023-04-17 15:01:28,18.78,28.0
25-07-2023 01.38,2023-07-25 01:54,2023-07-25 02:03:33,16.32,26.0
22-11-2023 00.50,22-11-2023 01.10,2023-11-22 01:13:27,19.81,39.0
08-08-2023 14.43,08-08-2023 15.11,2023-08-08 15:13:35,28.57,47.0
17-09-2023 13.03,17-09-2023 13.21,2023-09-17 13:30:45,18.15,21.0
01-06-2023 10.27,01-06-2023 10.55,2023-06-01 11:11:00,28.12,33.0
18-06-2023 23.20,2023-06-18 23:48,2023-06-18 23:57:32,27.9,40.0
05-03-2024 17.04,05-03-2024 17.24,2024-03-05 17:30:27,19.4,23.0
17-03-2024 18.09,17-03-2024 18.34,2024-03-17 18:43:09,25.43,31.0
21-05-2023 07.27,21-05-2023 07.48,2023-05-21 07:59:01,20.31,22.0
06-04-2023 21.29,2023-04-06 21:47,2023-04-06 22:01:08,18.27,24.0
12-04-2023 02.08,12-04-2023 02.34,2023-04-12 02:42:56,25.28,53.0
02-03-2024 14.32,02-03-2024 14.58,2024-03-02 15:08:09,25.56,56.0
16-03-2024 21.01,16-03-2024 21.22,2024-03-16 21:31:57,21.38,21.0
29-07-2023 14.04,29-07-2023 14.29,2023-07-29 14:36:58,25.0,43.0
07-09-2023 01.16,07-09-2023 01.37,2023-09-07 01:47:18,21.0,38.0
2023/06/01 20:58:21,01-06-2023 21.35,2023-06-01 21:43:42,36.84,53.0
23-09-2023 11.59,23-09-2023 12.28,2023-09-23 12:38:17,28.93,22.0
13-06-2023 19.46,13-06-2023 20.01,2023-06-13 20:10:18,15.28,39.0
30-01-2024 07.19,30-01-2024 07.37,2024-01-30 07:41:49,17.69,31.0
06-04-2023 07.11,06-04-2023 07.32,06-04-2023 07:41:51.007882,21.35,51.0
21-07-2023 13.05,21-07-2023 13.27,2023-07-21 13:35:08,22.33,29.0
04-06-2023 09.59,04-06-2023 10.08,2023-06-04 10:19:57,9.58,29.0
02-03-2024 22.03,02-03-2024 22.23,02-03-2024 22:29:41.575613,20.49,30.0
11-04-2023 08.56,11-04-2023 09.16,2023-04-11 09:24:50,20.06,32.0
25-08-2023 23.37,26-08-2023 00.02,2023-08-26 00:14:32,25.8,121.0
2023/09/29 10:10:19,29-09-2023 10.32,2023-09-29 10:39:27,22.49,45.0
03-03-2024 11.53,03-03-2024 12.21,2024-03-03 12:34:15,27.73,39.0
25-08-2023 12.13,2023-08-25 12:38,2023-08-25 12:40:47,25.04,52.0
14-02-2024 23.10,14-02-2024 23.29,2024-02-14 23:42:18,19.09,35.0
24-01-2024 10.45,24-01-2024 11.01,2024-01-24 11:17:07,16.02,16.0
03-10-2023 03.45,03-10-2023 04.04,2023-10-03 04:12:12,19.16,37.0
2023/05/25 00:45:30,25-05-2023 01.12,2023-05-25 01:26:05,27.38,28.0
06-07-2023 18.54,06-07-2023 19.14,2023-07-06 19:16:50,20.58,18.0
24-11-2023 11.22,24-11-2023 11.36,2023-11-24 11:43:59,14.28,43.0
16-03-2024 06.48,16-03-2024 07.20,2024-03-16 07:33:35,31.53,44.0
09-12-2023 13.06,2023-12-09 13:20,09-12-2023 13:29:52.707136,13.47,15.0
31-07-2023 17.56,31-07-2023 18.11,2023-07-31 18:21:26,15.13,14.0
03-10-2023 16.45,03-10-2023 17.12,2023-10-03 17:26:26,26.84,37.0
2023/05/29 08:17:37,29-05-2023 08.45,2023-05-29 08:56:52,28.21,40.0
30-03-2023 8.42,30-03-2023 8.42,2023-03-30 08:52:03.800000000,9.28,47.0
20-09-2023 10.22,20-09-2023 10.48,2023-09-20 11:08:23,26.58,153.0
30-03-2023 21.09,30-03-2023 21.09,2023-03-30 21:20:08.400000000,10.29,44.0
23-05-2023 04.29,23-05-2023 04.47,2023-05-23 04:53:53,17.51,25.0
27-11-2023 14.24,27-11-2023 14.41,2023-11-27 14:57:27,16.64,25.0
11-06-2023 18.41,11-06-2023 19.03,2023-06-11 19:23:30,22.41,15.0
25-11-2023 21.20,25-11-2023 21.39,2023-11-25 21:48:39,19.43,29.0
22-09-2023 01.46,22-09-2023 02.03,2023-09-22 02:06:33,16.57,34.0
2023/07/01 22:44:53,01-07-2023 23.13,2023-07-01 23:24:05,28.59,31.0
06-11-2023 04.51,06-11-2023 05.14,2023-11-06 05:26:23,22.87,17.0
23-07-2023 10.44,2023-07-23 11:15,2023-07-23 11:17:36,31.27,50.0
23-07-2023 11.29,2023-07-23 11:59,2023-07-23 12:16:17,30.37,40.0
08-10-2023 13.27,08-10-2023 13.38,2023-10-08 13:53:20,10.96,32.0
30-03-2023 8.42,30-03-2023 8.45,2023-03-30 08:52:08.000000000,6.35,47.0
02-10-2023 01.26,02-10-2023 01.49,2023-10-02 01:55:56,22.63,25.0
25-11-2023 08.27,25-11-2023 08.46,2023-11-25 08:56:23,,17.0
01-11-2023 20.26,01-11-2023 20.56,2023-11-01 21:11:16,30.01,47.0
30-03-2023 15.45,30-03-2023 15.47,2023-03-30 15:56:31.600000000,8.71,25.0
13-06-2023 11.51,13-06-2023 12.12,2023-06-13 12:28:19,21.75,33.0
10-10-2023 02.56,10-10-2023 03.09,2023-10-10 03:23:59,12.41,1.0
21-06-2023 11.06,21-06-2023 11.23,2023-06-21 11:33:40,17.3,42.0
24-05-2023 17.43,24-05-2023 18.01,2023-05-24 18:12:23,17.79,32.0
30-03-2023 2.36,30-03-2023 2.41,2023-03-30 02:42:41.400000000,1.54,17.0
05-11-2023 13.53,05-11-2023 14.14,2023-11-05 14:21:01,20.84,26.0
12-08-2023 09.21,12-08-2023 09.47,2023-08-12 09:58:50,25.74,36.0
30-03-2023 20.49,30-03-2023 20.59,2023-03-30 21:19:03.800000000,19.13,22.0
30-03-2023 15.45,30-03-2023 15.53,2023-03-30 16:02:50.199999999,9.02,25.0
28-06-2023 11.47,28-06-2023 12.20,2023-06-28 12:25:04,33.85,48.0
22-07-2023 13.52,22-07-2023 14.25,2023-07-22 14:38:37,33.07,44.0
16-07-2023 08.48,16-07-2023 09.09,2023-07-16 09:24:58,20.97,19.0
30-03-2023 13.55,30-03-2023 13.57,2023-03-30 14:08:47.199999999,11.02,25.0
21-03-2024 17.12,21-03-2024 17.37,2024-03-21 17:46:05,25.3,32.0
05-06-2023 14.20,05-06-2023 14.37,2023-06-05 14:42:29,17.33,38.0
06-08-2023 15.45,06-08-2023 16.00,2023-08-06 16:08:41,15.43,24.0
17-11-2023 19.12,2023-11-17 19:29,17-11-2023 19:36:03.295428,16.66,28.0
11-06-2023 15.46,11-06-2023 16.02,2023-06-11 16:17:20,15.54,27.0
22-09-2023 06.42,22-09-2023 07.07,2023-09-22 07:18:00,25.25,43.0
19-12-2023 12.51,19-12-2023 13.14,2023-12-19 13:30:59,22.74,41.0
30-03-2023 5.34,30-03-2023 5.37,2023-03-30 05:43:01.200000000,5.72,50.0
04-07-2023 13.32,04-07-2023 13.55,2023-07-04 13:59:48,23.08,39.0
,03-05-2023 10.06,2023-05-03 10:15:58,29.74,30.0
31-01-2024 13.49,31-01-2024 14.08,2024-01-31 14:10:46,19.51,30.0
03-03-2024 21.51,03-03-2024 22.26,2024-03-03 22:43:14,34.88,41.0
21-05-2023 23.30,22-05-2023 00.00,2023-05-22 00:07:43,30.05,36.0
04-05-2023 07.43,04-05-2023 08.02,2023-05-04 08:06:39,19.58,29.0
19-10-2023 06.01,19-10-2023 06.20,2023-10-19 06:32:43,19.39,18.0
18-07-2023 09.53,18-07-2023 10.07,2023-07-18 10:27:09,14.1,19.0
25-05-2023 20.36,25-05-2023 21.06,2023-05-25 21:13:32,30.63,45.0
23-11-2023 04.39,23-11-2023 05.05,2023-11-23 05:13:31,26.41,34.0
30-03-2023 1.58,30-03-2023 2.08,2023-03-30 02:17:07.000000000,8.5,27.0
25-03-2024 16.09,25-03-2024 16.33,2024-03-25 16:42:08,23.97,31.0
24-12-2023 17.39,24-12-2023 18.03,2023-12-24 18:15:09,23.61,34.0
12-07-2023 01.50,12-07-2023 02.10,2023-07-12 02:22:14,20.52,41.0
19-07-2023 03.17,2023-07-19 03:45,2023-07-19 03:58:44,27.67,45.0
01-11-2023 18.07,01-11-2023 18.40,2023-11-01 18:51:13,32.92,37.0
11-09-2023 04.08,11-09-2023 04.25,2023-09-11 04:34:20,16.87,28.0
21-10-2023 03.22,21-10-2023 03.36,2023-10-21 03:46:49,14.28,23.0
,23-04-2023 10.01,2023-04-23 10:11:23,27.57,37.0
30-03-2023 8.42,30-03-2023 8.48,2023-03-30 08:59:35.000000000,10.8,47.0
14-03-2024 14.54,14-03-2024 15.15,14-03-2024 15:22:16.924855,20.65,25.0
2023/12/08 03:34:52,08-12-2023 04.00,2023-12-08 04:13:25,25.59,
05-09-2023 13.37,05-09-2023 13.55,2023-09-05 14:04:02,18.59,23.0
15-01-2024 10.34,15-01-2024 10.56,2024-01-15 11:04:36,22.33,34.0
25-10-2023 09.15,25-10-2023 09.41,2023-10-25 09:49:30,25.86,33.0
18-12-2023 16.02,18-12-2023 16.25,2023-12-18 16:39:34,23.34,35.0
08-03-2024 14.52,08-03-2024 15.16,2024-03-08 15:28:06,23.36,33.0
24-11-2023 02.57,24-11-2023 03.20,2023-11-24 03:22:03,22.2,40.0
25-10-2023 20.01,25-10-2023 20.32,2023-10-25 20:42:57,31.21,27.0
18-10-2023 08.51,18-10-2023 09.12,2023-10-18 09:28:45,20.72,30.0
10-01-2024 02.27,10-01-2024 02.53,2024-01-10 03:09:10,25.69,37.0
13-08-2023 16.28,13-08-2023 16.45,2023-08-13 16:59:15,17.44,33.0
24-10-2023 15.07,24-10-2023 15.21,2023-10-24 15:33:18,14.3,18.0
05-08-2023 11.04,2023-08-05 11:21,2023-08-05 11:37:27,17.09,40.0
30-03-2023 6.51,30-03-2023 6.54,2023-03-30 07:06:58.000000000,12.3,24.0
07-11-2023 20.00,07-11-2023 20.29,2023-11-07 20:48:34,28.18,29.0
25-06-2023 21.49,25-06-2023 22.02,2023-06-25 22:19:21,13.11,24.0
29-10-2023 05.25,29-10-2023 05.41,2023-10-29 05:51:50,16.29,28.0
17-09-2023 04.39,17-09-2023 05.10,2023-09-17 05:19:50,31.11,42.0
01-02-2024 16.29,01-02-2024 16.59,2024-02-01 17:10:44,29.57,50.0
25-05-2023 01.48,25-05-2023 02.04,25-05-2023 02:15:38.936130,15.52,25.0
30-03-2023 19.51,30-03-2023 19.59,2023-03-30 20:16:43.599999999,78.11,12.0
2023/12/19 04:10:31,19-12-2023 04.33,2023-12-19 04:37:58,22.63,29.0
01-03-2024 22.32,01-03-2024 22.52,2024-03-01 22:58:24,19.73,9.0
24-12-2023 18.27,24-12-2023 19.10,2023-12-24 19:23:14,42.49,57.0
20-03-2024 22.43,20-03-2024 23.10,2024-03-20 23:16:29,27.35,43.0
23-03-2024 13.10,23-03-2024 13.35,2024-03-23 13:44:50,25.11,32.0
15-03-2024 05.02,2024-03-15 05:19,2024-03-15 05:27:03,16.94,26.0
30-09-2023 19.37,30-09-2023 20.03,2023-09-30 20:15:54,26.17,
17-10-2023 13.18,17-10-2023 13.41,2023-10-17 13:57:21,23.04,27.0
30-03-2023 5.34,30-03-2023 5.41,2023-03-30 06:02:58.800000000,21.68,50.0
23-05-2023 19.18,23-05-2023 19.51,2023-05-23 20:02:35,33.01,45.0
23-01-2024 00.52,23-01-2024 01.24,2024-01-23 01:26:59,31.58,48.0
16-10-2023 04.07,16-10-2023 04.19,2023-10-16 04:34:02,12.07,15.0
21-10-2023 19.06,21-10-2023 19.29,2023-10-21 19:41:06,22.83,18.0
30-03-2023 18.31,30-03-2023 18.34,2023-03-30 18:49:48.000000000,15.4,30.0
07-12-2023 00.54,07-12-2023 01.19,2023-12-07 01:28:00,24.72,21.0
2024/01/12 14:15:00,12-01-2024 14.28,2024-01-12 14:36:20,13.93,24.0
08-01-2024 08.10,08-01-2024 08.22,2024-01-08 08:31:03,,11.0
